Sheet: 00.Info
B2: Informe de revisiÃ³n de la accesibilidad
B3: AnÃ¡lisis de accesibilidad en profundidad
B5: InformaciÃ³n General
B7: Instrucciones para rellenar el documento
B9: Objeto El documento sirve como soporte para la revisiÃ³n de accesibilidad en profundidad, es decir, permite anotar los resultados del anÃ¡lisis automÃ¡tico y manual realizado sobre un sitio web o aplicaciÃ³n para dispositivo mÃ³vil. El documento sigue la estructura de la WCAG-EM (Evaluation Methodology) para generar un informe estructurado a partir de los datos que usted proporcione. Para su aplicaciÃ³n, las personas encargadas deberÃ¡n conocer la aplicaciÃ³n de las Pautas de Accesibilidad para el Contenido Web (WCAG). El documento no sirve para realizar ninguna comprobaciÃ³n de accesibilidad.
B11: CÃ³mo utilizar el documento El orden recomendado para cumplimentar la informaciÃ³n es el siguiente: 1. Rellenar en primer lugar la informaciÃ³n de las pestaÃ±as "01.DefiniciÃ³n de Ã¡mbito" y "02. TecnologÃ­as"
B13: 2. En la pestaÃ±a "03. Muestra" deberÃ¡n indicarse las pÃ¡ginas que forman parte de la muestra. Para su selecciÃ³n deberÃ¡ tenerse en cuenta lo indicado en el apdo. 3.2 de la DecisiÃ³n de EjecuciÃ³n (UE) 2018/1524. De acuerdo con la DecisiÃ³n, por Â«pÃ¡ginaÂ» se entenderÃ¡ una pÃ¡gina web o una pantalla de una aplicaciÃ³n para dispositivos mÃ³viles. - Entre las pÃ¡ginas seleccionadas, en caso de existir, deberÃ¡n figurar de forma obligatoria las siguientes: PÃ¡gina de inicio, Inicio de sesiÃ³n, Mapa del sitio, Contacto, Ayuda, InformaciÃ³n legal y pÃ¡gina de la DeclaraciÃ³n de accesibilidad. - Por cada pÃ¡gina seleccionada en la muestra deberÃ¡ indicarse: Nombre corto, Tipo de pÃ¡gina, URL de la pÃ¡gina o Nombre de la pantalla, Direccionamiento alternativo (Ãºtil en los sitios web con URIs dinÃ¡micas asÃ­ como en las aplicaciones para dispositivos mÃ³viles) y Tipos de elementos (indicando los elementos mÃ¡s caracterÃ­sticos que incluye la pÃ¡gina, por ejemplo imÃ¡genes, listas, tablas, formularios, multimedia â¦) . - Cuando la muestra sea menor de 30 URLs, las URLs restantes se dejarÃ¡n vacÃ­as. - TambiÃ©n debe tenerse en cuenta que al menos un 10% de la muestra debe ser aleatorio e indicarse en al columna tipo.
B15: 3. En las pestaÃ±as "P1. Perceptible", "P2. Operable", "P3. Comprensible" y "P4. Robusto" deberÃ¡ cumplimentarse, para todos los criterios de Ã©xito, y dentro de estos, para cada una de las pÃ¡ginas de la muestra, el resultado de dicha comprobaciÃ³n indicÃ¡ndolo en la columna resultado. Para realizar la evaluaciÃ³n de la accesibilidad puede servir de ayuda el listado de herramientas automÃ¡ticas y manuales disponibles en: - Para sitios web: listado de herramientas disponibles en el Anexo de la GuÃ­a de validaciÃ³n de accesibilidad web - Para aplicaciones para dispositivos mÃ³viles: listado de herramientas disponibles en el Anexo IV de la GuÃ­a de accesibilidad de aplicaciones mÃ³viles
B17: 4. Los resultados agregados del proceso de validaciÃ³n serÃ¡n consolidados automÃ¡ticamente en la pestaÃ±a "RESULTADOS".

Sheet: 01.DefiniciÃ³n de Ã¡mbito
B2: Informe de revisiÃ³n de la accesibilidad
B3: AnÃ¡lisis de accesibilidad en profundidad
B5: DefiniciÃ³n de Ã¡mbito
B7: Nombre de la URA
B9: DIR3 de la URA
B11: Ãmbito de actuaciÃ³n de la URA | D11: (i) Entidad (Ministerio, CCAA, EELLâ¦) a la que representa
B13: DIR3 del Ã¡mbito de actuaciÃ³n de la URA
B17: Entidad responsable del Sitio web / AplicaciÃ³n mÃ³vil
B19: DIR3 de la Entidad responsable
B21: Persona responsable del Sitio web / AplicaciÃ³n mÃ³vil
B25: Sitio web o aplicaciÃ³n mÃ³vil
B27: TipologÃ­a del sitio web
B29: Nombre Sitio Web / App mÃ³vil
B31: URL del Sitio Web / URL descarga App MÃ³vil | D31: (i) Identifica la URL del sitio web o la URL de descarga de la aplicaciÃ³n mÃ³vil
B33: Alcance de la revisiÃ³n | D33: (i) Precisar si hay parte o partes del sitio web / app mÃ³vil que NO se va a analizar por quedar fuera del Ã¡mbito.
B35: Funcionalidad esencial del sitio web o app mÃ³vil
B39: Nivel de conformidad a analizar | C39: UNE-EN 301549 : 2019 - AA WCAG 2.1
B41: Ãmbito territorial
B44: Ãmbito temÃ¡tico
C45: EducaciÃ³n | D45: No
C46: Empleo | D46: No
C47: Hacienda | D47: No
C48: Medio Ambiente | D48: No
C49: Ocio y Cultura | D49: No
C50: ProtecciÃ³n social | D50: No
C51: Sanidad | D51: No
C52: Seguridad y Orden PÃºblico | D52: No
C53: Servicios Comunitarios | D53: No
C54: Transporte | D54: No
C55: Vivienda | D55: No
B57: Tipo de evaluaciÃ³n
B59: Nombre de empresa | D59: (i) Nombre de la empresa que ha realizado la evaluaciÃ³n
B61: Observaciones | D61: (i) Datos relacionados con la revisiÃ³n

Sheet: 02.TecnologÃ­as
B2: Informe de revisiÃ³n de la accesibilidad
B3: AnÃ¡lisis de accesibilidad en profundidad
B5: TecnologÃ­as aplicadas
B6: Indicar las tecnologÃ­as utilizadas en el desarrollo del sitio web o aplicaciÃ³n mÃ³vil.
B7: Para aÃ±adir otras tecnologÃ­as, seleccionar "Otras" y rellenar los campos "Nombre TecnologÃ­a" y "URL de la EspecificaciÃ³n o DescripciÃ³n". El campo "URL de la especificaciÃ³nâ debe identificar la especificaciÃ³n de la tecnologÃ­a utilizada.
B9: HTML5 | C9: No | E9: ECMAScript 3 | F9: No | H9: OOXML | I9: No
B10: XHTML 1.0 | C10: No | E10: ECMAScript 5 | F10: No | H10: ODF 1.2 | I10: No
B11: HTML 4.01 | C11: No | E11: DOM | F11: No | H11: SVG | I11: No
B12: CSS | C12: No | E12: Flash | F12: No | H12: OTRAS | I12: No | K12: Nombre TecnologÃ­a | L12: URL de la EspecificaciÃ³n o DescripciÃ³n
B13: WAI-ARIA | C13: No | E13: Silverlight | F13: No

Sheet: 03.Muestra
B2: Informe de revisiÃ³n de la accesibilidad
B3: AnÃ¡lisis de accesibilidad en profundidad
B5: SelecciÃ³n de la muestra
B7: ID | C7: Nombre corto | D7: Tipo | E7: URL pÃ¡gina o Nombre de pantalla | F7: Direccionamiento alternativo (migas) | G7: Tipos de elementos
B8: 1 | C8: Home | CTIC | F8: Ej. Home > Servicios > Listado de objetos | G8: Ej. ImÃ¡genes, tablas, listas, multimedia, formularios, plantilla X, plantilla Y
B9: 2 | C9: Trabaja con nosotros | CTIC
B10: 3
B11: 4
B12: 5
B13: 6
B14: 7
B15: 8
B16: 9
B17: 10
B18: 11
B19: 12
B20: 13
B21: 14
B22: 15
B23: 16
B24: 17
B25: 18
B26: 19
B27: 20
B28: 21
B29: 22
B30: 23
B31: 24
B32: 25
B33: 26
B34: 27
B35: 28
B36: 29
B37: 30
B40: PAGINAS ANALIZADAS | D40: of:=COUNTA([.E8:.E37]) -> 0
B42: PÃGINAS NO ALEATORIAS | D42: of:=[.D40]-[.D44] -> 0
B44: PAGINAS ALEATORIAS | D44: of:=COUNTIF([.D8:.D37];"Aleatoria") -> 0
B47: Â¿MUESTRA CORRECTA? | D47: of:=IF(AND([.D44]>=0.1*[.D42];[.D44]>0; COUNTIF([.D8:.D37];"DeclaraciÃ³n Accesibilidad"); COUNTIF([.D8:.D37];"PÃ¡gina inicio") ;   COUNTA([.C8:.C37])=COUNTA([.E8:.E37])  ;   COUNTA([.D8:.D37])=COUNTA([.E8:.E37])    );"SI";"NO") -> NO

Sheet: P1.Perceptible
B2: Informe de revisiÃ³n de la accesibilidad
B3: AnÃ¡lisis de accesibilidad en profundidad
B5: RevisiÃ³n de la muestra
B8: Principio 1: Perceptible
B9: La informaciÃ³n y los componentes de la interfaz de usuario deben ser presentados a los usuarios de modo que ellos puedan percibirlos.
B11: Criterios de VerificaciÃ³n | F11: Criterios | G11: Evaluados | H11: % | J11: Criterios | K11: Pendientes | L11: %
B12: A | C12: 9 | F12: Pasa | G12: of:=[.J20]+[.J53]+[.J86]+[.J119]+[.J152]+[.J185]+[.J218]+[.J251]+[.J284]+[.J317]+[.J350]+[.J383]+[.J416]+[.J449]+[.J482]+[.J515]+[.J548]+[.J581]+[.J614]+[.J648] -> 0 | H12: of:=IF(([.$G$15]+[.$K$15])=0;0;[.G12]/([.$G$15]+[.$K$15])) -> 0 | J12: No decide | K12: of:=[.G20]+[.G53]+[.G86]+[.G119]+[.G152]+[.G185]+[.G218]+[.G251]+[.G284]+[.G317]+[.G350]+[.G383]+[.G416]+[.G449]+[.G482]+[.G515]+[.G548]+[.G581]+[.G614]+[.G648] -> 0 | L12: of:=IF(([.$G$15]+[.$K$15])=0;0;[.K12]/([.$G$15]+[.$K$15])) -> 0
B13: AA | C13: 11 | F13: Falla | G13: of:=[.I20]+[.I53]+[.I86]+[.I119]+[.I152]+[.I185]+[.I218]+[.I251]+[.I284]+[.I317]+[.I350]+[.I383]+[.I416]+[.I449]+[.I482]+[.I515]+[.I548]+[.I581]+[.I614]+[.I648] -> 0 | H13: of:=IF(([.$G$15]+[.$K$15])=0;0;[.G13]/([.$G$15]+[.$K$15])) -> 0 | J13: No testeado | K13: of:=[.F20]+[.F53]+[.F86]+[.F119]+[.F152]+[.F185]+[.F218]+[.F251]+[.F284]+[.F317]+[.F350]+[.F383]+[.F416]+[.F449]+[.F482]+[.F515]+[.F548]+[.F581]+[.F614]+[.F648] -> 0 | L13: of:=IF(([.$G$15]+[.$K$15])=0;0;[.K13]/([.$G$15]+[.$K$15])) -> 0
B14: Total | C14: of:=[.C12]+[.C13] -> 20 | F14: No aplica | G14: of:=[.H20]+[.H53]+[.H86]+[.H119]+[.H152]+[.H185]+[.H218]+[.H251]+[.H284]+[.H317]+[.H350]+[.H383]+[.H416]+[.H449]+[.H482]+[.H515]+[.H548]+[.H581]+[.H614]+[.H648] -> 0 | H14: of:=IF(([.$G$15]+[.$K$15])=0;0;[.G14]/([.$G$15]+[.$K$15])) -> 0 | J14: En blanco | K14: of:=[.K20]+[.K53]+[.K86]+[.K119]+[.K152]+[.K185]+[.K218]+[.K251]+[.K284]+[.K317]+[.K350]+[.K383]+[.K416]+[.K449]+[.K482]+[.K515]+[.K548]+[.K581]+[.K614]+[.K648] -> 0 | L14: of:=IF(([.$G$15]+[.$K$15])=0;0;[.K14]/([.$G$15]+[.$K$15])) -> 0
F15: Total | G15: of:=SUM([.G12:.G14]) -> 0 | H15: of:=SUM([.H12:.H14]) -> 0 | J15: Total | K15: of:=SUM([.K12:.K14]) -> 0 | L15: of:=SUM([.L12:.L14]) -> 0
B18: A | C18: 1.1.1 Contenido no textual | D18: Resultado
B19: of:=IF( ISBLANK([$'03.Muestra'.$C$8]);"";[$'03.Muestra'.$C$8]) ->  | C19: of:=IF( ISBLANK([$'03.Muestra'.$E$8]);"";[$'03.Muestra'.$E$8]) ->  | D19: of:=IF(AND([.B19]<>"";[.C19]<>"");"N/T";"") ->  | E19: of:=IF([.D19]<>"";IF(AND([.B19]<>"";[.C19]<>"");"";"ERR");"") ->  | F19: of:=TRANSPOSE([$'DATA - Oculta'.$U$9:$'DATA - Oculta'.$U$13]) -> N/T | G19: N/D | H19: N/A | I19: Falla | J19: Pasa | K19: En blanco
B20: of:=IF( ISBLANK([$'03.Muestra'.$C$9]);"";[$'03.Muestra'.$C$9]) ->  | C20: of:=IF( ISBLANK([$'03.Muestra'.$E$9]);"";[$'03.Muestra'.$E$9]) ->  | D20: of:=IF(AND([.B20]<>"";[.C20]<>"");"N/T";"") ->  | E20: of:=IF([.D20]<>"";IF(AND([.B20]<>"";[.C20]<>"");"";"ERR");"") ->  | F20: of:=COUNTIF([.$D19]:INDIRECT("$D" &  SUM(ROW()-1;[$'03.Muestra'.$D$40])-1);[.F19]) -> 0 | G20: of:=COUNTIF([.$D19]:INDIRECT("$D" &  SUM(ROW()-1;[$'03.Muestra'.$D$40])-1);[.G19]) -> 0 | H20: of:=COUNTIF([.$D19]:INDIRECT("$D" &  SUM(ROW()-1;[$'03.Muestra'.$D$40])-1);[.H19]) -> 0 | I20: of:=COUNTIF([.$D19]:INDIRECT("$D" &  SUM(ROW()-1;[$'03.Muestra'.$D$40])-1);[.I19]) -> 0 | J20: of:=COUNTIF([.$D19]:INDIRECT("$D" &  SUM(ROW()-1;[$'03.Muestra'.$D$40])-1);[.J19]) -> 0 | K20: of:=IF([$'03.Muestra'.$D$40]=0;0;COUNTBLANK([.$D19]:INDIRECT("$D" &  SUM(ROW()-1;[$'03.Muestra'.$D$40])-1))) -> 0
B21: of:=IF( ISBLANK([$'03.Muestra'.$C$10]);"";[$'03.Muestra'.$C$10]) ->  | C21: of:=IF( ISBLANK([$'03.Muestra'.$E$10]);"";[$'03.Muestra'.$E$10]) ->  | D21: of:=IF(AND([.B21]<>"";[.C21]<>"");"N/T";"") ->  | E21: of:=IF([.D21]<>"";IF(AND([.B21]<>"";[.C21]<>"");"";"ERR");"") -> 
B22: of:=IF( ISBLANK([$'03.Muestra'.$C$11]);"";[$'03.Muestra'.$C$11]) ->  | C22: of:=IF( ISBLANK([$'03.Muestra'.$E$11]);"";[$'03.Muestra'.$E$11]) ->  | D22: of:=IF(AND([.B22]<>"";[.C22]<>"");"N/T";"") ->  | E22: of:=IF([.D22]<>"";IF(AND([.B22]<>"";[.C22]<>"");"";"ERR");"") ->  | K22: N/T | L22: No Testeado
B23: of:=IF( ISBLANK([$'03.Muestra'.$C$12]);"";[$'03.Muestra'.$C$12]) ->  | C23: of:=IF( ISBLANK([$'03.Muestra'.$E$12]);"";[$'03.Muestra'.$E$12]) ->  | D23: of:=IF(AND([.B23]<>"";[.C23]<>"");"N/T";"") ->  | E23: of:=IF([.D23]<>"";IF(AND([.B23]<>"";[.C23]<>"");"";"ERR");"") ->  | K23: N/A | L23: No Aplica
B24: of:=IF( ISBLANK([$'03.Muestra'.$C$13]);"";[$'03.Muestra'.$C$13]) ->  | C24: of:=IF( ISBLANK([$'03.Muestra'.$E$13]);"";[$'03.Muestra'.$E$13]) ->  | D24: of:=IF(AND([.B24]<>"";[.C24]<>"");"N/T";"") ->  | E24: of:=IF([.D24]<>"";IF(AND([.B24]<>"";[.C24]<>"");"";"ERR");"") ->  | K24: N/D | L24: No Decide
B25: of:=IF( ISBLANK([$'03.Muestra'.$C$14]);"";[$'03.Muestra'.$C$14]) ->  | C25: of:=IF( ISBLANK([$'03.Muestra'.$E$14]);"";[$'03.Muestra'.$E$14]) ->  | D25: of:=IF(AND([.B25]<>"";[.C25]<>"");"N/T";"") ->  | E25: of:=IF([.D25]<>"";IF(AND([.B25]<>"";[.C25]<>"");"";"ERR");"") -> 
B26: of:=IF( ISBLANK([$'03.Muestra'.$C$15]);"";[$'03.Muestra'.$C$15]) ->  | C26: of:=IF( ISBLANK([$'03.Muestra'.$E$15]);"";[$'03.Muestra'.$E$15]) ->  | D26: of:=IF(AND([.B26]<>"";[.C26]<>"");"N/T";"") ->  | E26: of:=IF([.D26]<>"";IF(AND([.B26]<>"";[.C26]<>"");"";"ERR");"") -> 
B27: of:=IF( ISBLANK([$'03.Muestra'.$C$16]);"";[$'03.Muestra'.$C$16]) ->  | C27: of:=IF( ISBLANK([$'03.Muestra'.$E$16]);"";[$'03.Muestra'.$E$16]) ->  | D27: of:=IF(AND([.B27]<>"";[.C27]<>"");"N/T";"") ->  | E27: of:=IF([.D27]<>"";IF(AND([.B27]<>"";[.C27]<>"");"";"ERR");"") -> 
B28: of:=IF( ISBLANK([$'03.Muestra'.$C$17]);"";[$'03.Muestra'.$C$17]) ->  | C28: of:=IF( ISBLANK([$'03.Muestra'.$E$17]);"";[$'03.Muestra'.$E$17]) ->  | D28: of:=IF(AND([.B28]<>"";[.C28]<>"");"N/T";"") ->  | E28: of:=IF([.D28]<>"";IF(AND([.B28]<>"";[.C28]<>"");"";"ERR");"") -> 
B29: of:=IF( ISBLANK([$'03.Muestra'.$C$18]);"";[$'03.Muestra'.$C$18]) ->  | C29: of:=IF( ISBLANK([$'03.Muestra'.$E$18]);"";[$'03.Muestra'.$E$18]) ->  | D29: of:=IF(AND([.B29]<>"";[.C29]<>"");"N/T";"") ->  | E29: of:=IF([.D29]<>"";IF(AND([.B29]<>"";[.C29]<>"");"";"ERR");"") -> 
B30: of:=IF( ISBLANK([$'03.Muestra'.$C$19]);"";[$'03.Muestra'.$C$19]) ->  | C30: of:=IF( ISBLANK([$'03.Muestra'.$E$19]);"";[$'03.Muestra'.$E$19]) ->  | D30: of:=IF(AND([.B30]<>"";[.C30]<>"");"N/T";"") ->  | E30: of:=IF([.D30]<>"";IF(AND([.B30]<>"";[.C30]<>"");"";"ERR");"") -> 
B31: of:=IF( ISBLANK([$'03.Muestra'.$C$20]);"";[$'03.Muestra'.$C$20]) ->  | C31: of:=IF( ISBLANK([$'03.Muestra'.$E$20]);"";[$'03.Muestra'.$E$20]) ->  | D31: of:=IF(AND([.B31]<>"";[.C31]<>"");"N/T";"") ->  | E31: of:=IF([.D31]<>"";IF(AND([.B31]<>"";[.C31]<>"");"";"ERR");"") -> 
B32: of:=IF( ISBLANK([$'03.Muestra'.$C$21]);"";[$'03.Muestra'.$C$21]) ->  | C32: of:=IF( ISBLANK([$'03.Muestra'.$E$21]);"";[$'03.Muestra'.$E$21]) ->  | D32: of:=IF(AND([.B32]<>"";[.C32]<>"");"N/T";"") ->  | E32: of:=IF([.D32]<>"";IF(AND([.B32]<>"";[.C32]<>"");"";"ERR");"") -> 
B33: of:=IF( ISBLANK([$'03.Muestra'.$C$22]);"";[$'03.Muestra'.$C$22]) ->  | C33: of:=IF( ISBLANK([$'03.Muestra'.$E$22]);"";[$'03.Muestra'.$E$22]) ->  | D33: of:=IF(AND([.B33]<>"";[.C33]<>"");"N/T";"") ->  | E33: of:=IF([.D33]<>"";IF(AND([.B33]<>"";[.C33]<>"");"";"ERR");"") -> 
B34: of:=IF( ISBLANK([$'03.Muestra'.$C$23]);"";[$'03.Muestra'.$C$23]) ->  | C34: of:=IF( ISBLANK([$'03.Muestra'.$E$23]);"";[$'03.Muestra'.$E$23]) ->  | D34: of:=IF(AND([.B34]<>"";[.C34]<>"");"N/T";"") ->  | E34: of:=IF([.D34]<>"";IF(AND([.B34]<>"";[.C34]<>"");"";"ERR");"") -> 
B35: of:=IF( ISBLANK([$'03.Muestra'.$C$24]);"";[$'03.Muestra'.$C$24]) ->  | C35: of:=IF( ISBLANK([$'03.Muestra'.$E$24]);"";[$'03.Muestra'.$E$24]) ->  | D35: of:=IF(AND([.B35]<>"";[.C35]<>"");"N/T";"") ->  | E35: of:=IF([.D35]<>"";IF(AND([.B35]<>"";[.C35]<>"");"";"ERR");"") -> 
B36: of:=IF( ISBLANK([$'03.Muestra'.$C$25]);"";[$'03.Muestra'.$C$25]) ->  | C36: of:=IF( ISBLANK([$'03.Muestra'.$E$25]);"";[$'03.Muestra'.$E$25]) ->  | D36: of:=IF(AND([.B36]<>"";[.C36]<>"");"N/T";"") ->  | E36: of:=IF([.D36]<>"";IF(AND([.B36]<>"";[.C36]<>"");"";"ERR");"") -> 
B37: of:=IF( ISBLANK([$'03.Muestra'.$C$26]);"";[$'03.Muestra'.$C$26]) ->  | C37: of:=IF( ISBLANK([$'03.Muestra'.$E$26]);"";[$'03.Muestra'.$E$26]) ->  | D37: of:=IF(AND([.B37]<>"";[.C37]<>"");"N/T";"") ->  | E37: of:=IF([.D37]<>"";IF(AND([.B37]<>"";[.C37]<>"");"";"ERR");"") -> 
B38: of:=IF( ISBLANK([$'03.Muestra'.$C$27]);"";[$'03.Muestra'.$C$27]) ->  | C38: of:=IF( ISBLANK([$'03.Muestra'.$E$27]);"";[$'03.Muestra'.$E$27]) ->  | D38: of:=IF(AND([.B38]<>"";[.C38]<>"");"N/T";"") ->  | E38: of:=IF([.D38]<>"";IF(AND([.B38]<>"";[.C38]<>"");"";"ERR");"") -> 
B39: of:=IF( ISBLANK([$'03.Muestra'.$C$28]);"";[$'03.Muestra'.$C$28]) ->  | C39: of:=IF( ISBLANK([$'03.Muestra'.$E$28]);"";[$'03.Muestra'.$E$28]) ->  | D39: of:=IF(AND([.B39]<>"";[.C39]<>"");"N/T";"") ->  | E39: of:=IF([.D39]<>"";IF(AND([.B39]<>"";[.C39]<>"");"";"ERR");"") -> 
B40: of:=IF( ISBLANK([$'03.Muestra'.$C$29]);"";[$'03.Muestra'.$C$29]) ->  | C40: of:=IF( ISBLANK([$'03.Muestra'.$E$29]);"";[$'03.Muestra'.$E$29]) ->  | D40: of:=IF(AND([.B40]<>"";[.C40]<>"");"N/T";"") ->  | E40: of:=IF([.D40]<>"";IF(AND([.B40]<>"";[.C40]<>"");"";"ERR");"") -> 
B41: of:=IF( ISBLANK([$'03.Muestra'.$C$30]);"";[$'03.Muestra'.$C$30]) ->  | C41: of:=IF( ISBLANK([$'03.Muestra'.$E$30]);"";[$'03.Muestra'.$E$30]) ->  | D41: of:=IF(AND([.B41]<>"";[.C41]<>"");"N/T";"") ->  | E41: of:=IF([.D41]<>"";IF(AND([.B41]<>"";[.C41]<>"");"";"ERR");"") -> 
B42: of:=IF( ISBLANK([$'03.Muestra'.$C$31]);"";[$'03.Muestra'.$C$31]) ->  | C42: of:=IF( ISBLANK([$'03.Muestra'.$E$31]);"";[$'03.Muestra'.$E$31]) ->  | D42: of:=IF(AND([.B42]<>"";[.C42]<>"");"N/T";"") ->  | E42: of:=IF([.D42]<>"";IF(AND([.B42]<>"";[.C42]<>"");"";"ERR");"") -> 
B43: of:=IF( ISBLANK([$'03.Muestra'.$C$32]);"";[$'03.Muestra'.$C$32]) ->  | C43: of:=IF( ISBLANK([$'03.Muestra'.$E$32]);"";[$'03.Muestra'.$E$32]) ->  | D43: of:=IF(AND([.B43]<>"";[.C43]<>"");"N/T";"") ->  | E43: of:=IF([.D43]<>"";IF(AND([.B43]<>"";[.C43]<>"");"";"ERR");"") -> 
B44: of:=IF( ISBLANK([$'03.Muestra'.$C$33]);"";[$'03.Muestra'.$C$33]) ->  | C44: of:=IF( ISBLANK([$'03.Muestra'.$E$33]);"";[$'03.Muestra'.$E$33]) ->  | D44: of:=IF(AND([.B44]<>"";[.C44]<>"");"N/T";"") ->  | E44: of:=IF([.D44]<>"";IF(AND([.B44]<>"";[.C44]<>"");"";"ERR");"") -> 
B45: of:=IF( ISBLANK([$'03.Muestra'.$C$34]);"";[$'03.Muestra'.$C$34]) ->  | C45: of:=IF( ISBLANK([$'03.Muestra'.$E$34]);"";[$'03.Muestra'.$E$34]) ->  | D45: of:=IF(AND([.B45]<>"";[.C45]<>"");"N/T";"") ->  | E45: of:=IF([.D45]<>"";IF(AND([.B45]<>"";[.C45]<>"");"";"ERR");"") -> 
B46: of:=IF( ISBLANK([$'03.Muestra'.$C$35]);"";[$'03.Muestra'.$C$35]) ->  | C46: of:=IF( ISBLANK([$'03.Muestra'.$E$35]);"";[$'03.Muestra'.$E$35]) ->  | D46: of:=IF(AND([.B46]<>"";[.C46]<>"");"N/T";"") ->  | E46: of:=IF([.D46]<>"";IF(AND([.B46]<>"";[.C46]<>"");"";"ERR");"") -> 
B47: of:=IF( ISBLANK([$'03.Muestra'.$C$36]);"";[$'03.Muestra'.$C$36]) ->  | C47: of:=IF( ISBLANK([$'03.Muestra'.$E$36]);"";[$'03.Muestra'.$E$36]) ->  | D47: of:=IF(AND([.B47]<>"";[.C47]<>"");"N/T";"") ->  | E47: of:=IF([.D47]<>"";IF(AND([.B47]<>"";[.C47]<>"");"";"ERR");"") -> 
B48: of:=IF( ISBLANK([$'03.Muestra'.$C$37]);"";[$'03.Muestra'.$C$37]) ->  | C48: of:=IF( ISBLANK([$'03.Muestra'.$E$37]);"";[$'03.Muestra'.$E$37]) ->  | D48: of:=IF(AND([.B48]<>"";[.C48]<>"");"N/T";"") ->  | E48: of:=IF([.D48]<>"";IF(AND([.B48]<>"";[.C48]<>"");"";"ERR");"") -> 
B51: A | C51: 1.2.1 SÃ³lo audio y sÃ³lo vÃ­deo (grabado) | D51: Resultado
B52: of:=IF( ISBLANK([$'03.Muestra'.$C$8]);"";[$'03.Muestra'.$C$8]) ->  | C52: of:=IF( ISBLANK([$'03.Muestra'.$E$8]);"";[$'03.Muestra'.$E$8]) ->  | D52: of:=IF(AND([.B52]<>"";[.C52]<>"");"N/T";"") ->  | E52: of:=IF([.D52]<>"";IF(AND([.B52]<>"";[.C52]<>"");"";"ERR");"") ->  | F52: of:=TRANSPOSE([$'DATA - Oculta'.$U$9:$'DATA - Oculta'.$U$13]) -> N/T | G52: N/D | H52: N/A | I52: Falla | J52: Pasa | K52: En blanco
B53: of:=IF( ISBLANK([$'03.Muestra'.$C$9]);"";[$'03.Muestra'.$C$9]) ->  | C53: of:=IF( ISBLANK([$'03.Muestra'.$E$9]);"";[$'03.Muestra'.$E$9]) ->  | D53: of:=IF(AND([.B53]<>"";[.C53]<>"");"N/T";"") ->  | E53: of:=IF([.D53]<>"";IF(AND([.B53]<>"";[.C53]<>"");"";"ERR");"") ->  | F53: of:=COUNTIF([.$D52]:INDIRECT("$D" &  SUM(ROW()-1;['03.Muestra'.$D$40])-1);[.F52]) -> 0 | G53: of:=COUNTIF([.$D52]:INDIRECT("$D" &  SUM(ROW()-1;['03.Muestra'.$D$40])-1);[.G52]) -> 0 | H53: of:=COUNTIF([.$D52]:INDIRECT("$D" &  SUM(ROW()-1;['03.Muestra'.$D$40])-1);[.H52]) -> 0 | I53: of:=COUNTIF([.$D52]:INDIRECT("$D" &  SUM(ROW()-1;['03.Muestra'.$D$40])-1);[.I52]) -> 0 | J53: of:=COUNTIF([.$D52]:INDIRECT("$D" &  SUM(ROW()-1;['03.Muestra'.$D$40])-1);[.J52]) -> 0 | K53: of:=IF(['03.Muestra'.$D$40]=0;0;COUNTBLANK([.$D52]:INDIRECT("$D" &  SUM(ROW()-1;['03.Muestra'.$D$40])-1))) -> 0
B54: of:=IF( ISBLANK([$'03.Muestra'.$C$10]);"";[$'03.Muestra'.$C$10]) ->  | C54: of:=IF( ISBLANK([$'03.Muestra'.$E$10]);"";[$'03.Muestra'.$E$10]) ->  | D54: of:=IF(AND([.B54]<>"";[.C54]<>"");"N/T";"") ->  | E54: of:=IF([.D54]<>"";IF(AND([.B54]<>"";[.C54]<>"");"";"ERR");"") -> 
B55: of:=IF( ISBLANK([$'03.Muestra'.$C$11]);"";[$'03.Muestra'.$C$11]) ->  | C55: of:=IF( ISBLANK([$'03.Muestra'.$E$11]);"";[$'03.Muestra'.$E$11]) ->  | D55: of:=IF(AND([.B55]<>"";[.C55]<>"");"N/T";"") ->  | E55: of:=IF([.D55]<>"";IF(AND([.B55]<>"";[.C55]<>"");"";"ERR");"") -> 
B56: of:=IF( ISBLANK([$'03.Muestra'.$C$12]);"";[$'03.Muestra'.$C$12]) ->  | C56: of:=IF( ISBLANK([$'03.Muestra'.$E$12]);"";[$'03.Muestra'.$E$12]) ->  | D56: of:=IF(AND([.B56]<>"";[.C56]<>"");"N/T";"") ->  | E56: of:=IF([.D56]<>"";IF(AND([.B56]<>"";[.C56]<>"");"";"ERR");"") -> 
B57: of:=IF( ISBLANK([$'03.Muestra'.$C$13]);"";[$'03.Muestra'.$C$13]) ->  | C57: of:=IF( ISBLANK([$'03.Muestra'.$E$13]);"";[$'03.Muestra'.$E$13]) ->  | D57: of:=IF(AND([.B57]<>"";[.C57]<>"");"N/T";"") ->  | E57: of:=IF([.D57]<>"";IF(AND([.B57]<>"";[.C57]<>"");"";"ERR");"") -> 
B58: of:=IF( ISBLANK([$'03.Muestra'.$C$14]);"";[$'03.Muestra'.$C$14]) ->  | C58: of:=IF( ISBLANK([$'03.Muestra'.$E$14]);"";[$'03.Muestra'.$E$14]) ->  | D58: of:=IF(AND([.B58]<>"";[.C58]<>"");"N/T";"") ->  | E58: of:=IF([.D58]<>"";IF(AND([.B58]<>"";[.C58]<>"");"";"ERR");"") -> 
B59: of:=IF( ISBLANK([$'03.Muestra'.$C$15]);"";[$'03.Muestra'.$C$15]) ->  | C59: of:=IF( ISBLANK([$'03.Muestra'.$E$15]);"";[$'03.Muestra'.$E$15]) ->  | D59: of:=IF(AND([.B59]<>"";[.C59]<>"");"N/T";"") ->  | E59: of:=IF([.D59]<>"";IF(AND([.B59]<>"";[.C59]<>"");"";"ERR");"") -> 
B60: of:=IF( ISBLANK([$'03.Muestra'.$C$16]);"";[$'03.Muestra'.$C$16]) ->  | C60: of:=IF( ISBLANK([$'03.Muestra'.$E$16]);"";[$'03.Muestra'.$E$16]) ->  | D60: of:=IF(AND([.B60]<>"";[.C60]<>"");"N/T";"") ->  | E60: of:=IF([.D60]<>"";IF(AND([.B60]<>"";[.C60]<>"");"";"ERR");"") -> 
B61: of:=IF( ISBLANK([$'03.Muestra'.$C$17]);"";[$'03.Muestra'.$C$17]) ->  | C61: of:=IF( ISBLANK([$'03.Muestra'.$E$17]);"";[$'03.Muestra'.$E$17]) ->  | D61: of:=IF(AND([.B61]<>"";[.C61]<>"");"N/T";"") ->  | E61: of:=IF([.D61]<>"";IF(AND([.B61]<>"";[.C61]<>"");"";"ERR");"") -> 
B62: of:=IF( ISBLANK([$'03.Muestra'.$C$18]);"";[$'03.Muestra'.$C$18]) ->  | C62: of:=IF( ISBLANK([$'03.Muestra'.$E$18]);"";[$'03.Muestra'.$E$18]) ->  | D62: of:=IF(AND([.B62]<>"";[.C62]<>"");"N/T";"") ->  | E62: of:=IF([.D62]<>"";IF(AND([.B62]<>"";[.C62]<>"");"";"ERR");"") -> 
B63: of:=IF( ISBLANK([$'03.Muestra'.$C$19]);"";[$'03.Muestra'.$C$19]) ->  | C63: of:=IF( ISBLANK([$'03.Muestra'.$E$19]);"";[$'03.Muestra'.$E$19]) ->  | D63: of:=IF(AND([.B63]<>"";[.C63]<>"");"N/T";"") ->  | E63: of:=IF([.D63]<>"";IF(AND([.B63]<>"";[.C63]<>"");"";"ERR");"") -> 
B64: of:=IF( ISBLANK([$'03.Muestra'.$C$20]);"";[$'03.Muestra'.$C$20]) ->  | C64: of:=IF( ISBLANK([$'03.Muestra'.$E$20]);"";[$'03.Muestra'.$E$20]) ->  | D64: of:=IF(AND([.B64]<>"";[.C64]<>"");"N/T";"") ->  | E64: of:=IF([.D64]<>"";IF(AND([.B64]<>"";[.C64]<>"");"";"ERR");"") -> 
B65: of:=IF( ISBLANK([$'03.Muestra'.$C$21]);"";[$'03.Muestra'.$C$21]) ->  | C65: of:=IF( ISBLANK([$'03.Muestra'.$E$21]);"";[$'03.Muestra'.$E$21]) ->  | D65: of:=IF(AND([.B65]<>"";[.C65]<>"");"N/T";"") ->  | E65: of:=IF([.D65]<>"";IF(AND([.B65]<>"";[.C65]<>"");"";"ERR");"") -> 
B66: of:=IF( ISBLANK([$'03.Muestra'.$C$22]);"";[$'03.Muestra'.$C$22]) ->  | C66: of:=IF( ISBLANK([$'03.Muestra'.$E$22]);"";[$'03.Muestra'.$E$22]) ->  | D66: of:=IF(AND([.B66]<>"";[.C66]<>"");"N/T";"") ->  | E66: of:=IF([.D66]<>"";IF(AND([.B66]<>"";[.C66]<>"");"";"ERR");"") -> 
B67: of:=IF( ISBLANK([$'03.Muestra'.$C$23]);"";[$'03.Muestra'.$C$23]) ->  | C67: of:=IF( ISBLANK([$'03.Muestra'.$E$23]);"";[$'03.Muestra'.$E$23]) ->  | D67: of:=IF(AND([.B67]<>"";[.C67]<>"");"N/T";"") ->  | E67: of:=IF([.D67]<>"";IF(AND([.B67]<>"";[.C67]<>"");"";"ERR");"") -> 
B68: of:=IF( ISBLANK([$'03.Muestra'.$C$24]);"";[$'03.Muestra'.$C$24]) ->  | C68: of:=IF( ISBLANK([$'03.Muestra'.$E$24]);"";[$'03.Muestra'.$E$24]) ->  | D68: of:=IF(AND([.B68]<>"";[.C68]<>"");"N/T";"") ->  | E68: of:=IF([.D68]<>"";IF(AND([.B68]<>"";[.C68]<>"");"";"ERR");"") -> 
B69: of:=IF( ISBLANK([$'03.Muestra'.$C$25]);"";[$'03.Muestra'.$C$25]) ->  | C69: of:=IF( ISBLANK([$'03.Muestra'.$E$25]);"";[$'03.Muestra'.$E$25]) ->  | D69: of:=IF(AND([.B69]<>"";[.C69]<>"");"N/T";"") ->  | E69: of:=IF([.D69]<>"";IF(AND([.B69]<>"";[.C69]<>"");"";"ERR");"") -> 
B70: of:=IF( ISBLANK([$'03.Muestra'.$C$26]);"";[$'03.Muestra'.$C$26]) ->  | C70: of:=IF( ISBLANK([$'03.Muestra'.$E$26]);"";[$'03.Muestra'.$E$26]) ->  | D70: of:=IF(AND([.B70]<>"";[.C70]<>"");"N/T";"") ->  | E70: of:=IF([.D70]<>"";IF(AND([.B70]<>"";[.C70]<>"");"";"ERR");"") -> 
B71: of:=IF( ISBLANK([$'03.Muestra'.$C$27]);"";[$'03.Muestra'.$C$27]) ->  | C71: of:=IF( ISBLANK([$'03.Muestra'.$E$27]);"";[$'03.Muestra'.$E$27]) ->  | D71: of:=IF(AND([.B71]<>"";[.C71]<>"");"N/T";"") ->  | E71: of:=IF([.D71]<>"";IF(AND([.B71]<>"";[.C71]<>"");"";"ERR");"") -> 
B72: of:=IF( ISBLANK([$'03.Muestra'.$C$28]);"";[$'03.Muestra'.$C$28]) ->  | C72: of:=IF( ISBLANK([$'03.Muestra'.$E$28]);"";[$'03.Muestra'.$E$28]) ->  | D72: of:=IF(AND([.B72]<>"";[.C72]<>"");"N/T";"") ->  | E72: of:=IF([.D72]<>"";IF(AND([.B72]<>"";[.C72]<>"");"";"ERR");"") -> 
B73: of:=IF( ISBLANK([$'03.Muestra'.$C$29]);"";[$'03.Muestra'.$C$29]) ->  | C73: of:=IF( ISBLANK([$'03.Muestra'.$E$29]);"";[$'03.Muestra'.$E$29]) ->  | D73: of:=IF(AND([.B73]<>"";[.C73]<>"");"N/T";"") ->  | E73: of:=IF([.D73]<>"";IF(AND([.B73]<>"";[.C73]<>"");"";"ERR");"") -> 
B74: of:=IF( ISBLANK([$'03.Muestra'.$C$30]);"";[$'03.Muestra'.$C$30]) ->  | C74: of:=IF( ISBLANK([$'03.Muestra'.$E$30]);"";[$'03.Muestra'.$E$30]) ->  | D74: of:=IF(AND([.B74]<>"";[.C74]<>"");"N/T";"") ->  | E74: of:=IF([.D74]<>"";IF(AND([.B74]<>"";[.C74]<>"");"";"ERR");"") -> 
B75: of:=IF( ISBLANK([$'03.Muestra'.$C$31]);"";[$'03.Muestra'.$C$31]) ->  | C75: of:=IF( ISBLANK([$'03.Muestra'.$E$31]);"";[$'03.Muestra'.$E$31]) ->  | D75: of:=IF(AND([.B75]<>"";[.C75]<>"");"N/T";"") ->  | E75: of:=IF([.D75]<>"";IF(AND([.B75]<>"";[.C75]<>"");"";"ERR");"") -> 
B76: of:=IF( ISBLANK([$'03.Muestra'.$C$32]);"";[$'03.Muestra'.$C$32]) ->  | C76: of:=IF( ISBLANK([$'03.Muestra'.$E$32]);"";[$'03.Muestra'.$E$32]) ->  | D76: of:=IF(AND([.B76]<>"";[.C76]<>"");"N/T";"") ->  | E76: of:=IF([.D76]<>"";IF(AND([.B76]<>"";[.C76]<>"");"";"ERR");"") -> 
B77: of:=IF( ISBLANK([$'03.Muestra'.$C$33]);"";[$'03.Muestra'.$C$33]) ->  | C77: of:=IF( ISBLANK([$'03.Muestra'.$E$33]);"";[$'03.Muestra'.$E$33]) ->  | D77: of:=IF(AND([.B77]<>"";[.C77]<>"");"N/T";"") ->  | E77: of:=IF([.D77]<>"";IF(AND([.B77]<>"";[.C77]<>"");"";"ERR");"") -> 
B78: of:=IF( ISBLANK([$'03.Muestra'.$C$34]);"";[$'03.Muestra'.$C$34]) ->  | C78: of:=IF( ISBLANK([$'03.Muestra'.$E$34]);"";[$'03.Muestra'.$E$34]) ->  | D78: of:=IF(AND([.B78]<>"";[.C78]<>"");"N/T";"") ->  | E78: of:=IF([.D78]<>"";IF(AND([.B78]<>"";[.C78]<>"");"";"ERR");"") -> 
B79: of:=IF( ISBLANK([$'03.Muestra'.$C$35]);"";[$'03.Muestra'.$C$35]) ->  | C79: of:=IF( ISBLANK([$'03.Muestra'.$E$35]);"";[$'03.Muestra'.$E$35]) ->  | D79: of:=IF(AND([.B79]<>"";[.C79]<>"");"N/T";"") ->  | E79: of:=IF([.D79]<>"";IF(AND([.B79]<>"";[.C79]<>"");"";"ERR");"") -> 
B80: of:=IF( ISBLANK([$'03.Muestra'.$C$36]);"";[$'03.Muestra'.$C$36]) ->  | C80: of:=IF( ISBLANK([$'03.Muestra'.$E$36]);"";[$'03.Muestra'.$E$36]) ->  | D80: of:=IF(AND([.B80]<>"";[.C80]<>"");"N/T";"") ->  | E80: of:=IF([.D80]<>"";IF(AND([.B80]<>"";[.C80]<>"");"";"ERR");"") -> 
B81: of:=IF( ISBLANK([$'03.Muestra'.$C$37]);"";[$'03.Muestra'.$C$37]) ->  | C81: of:=IF( ISBLANK([$'03.Muestra'.$E$37]);"";[$'03.Muestra'.$E$37]) ->  | D81: of:=IF(AND([.B81]<>"";[.C81]<>"");"N/T";"") ->  | E81: of:=IF([.D81]<>"";IF(AND([.B81]<>"";[.C81]<>"");"";"ERR");"") -> 
B84: A | C84: 1.2.2 SubtÃ­tulos (grabados) | D84: Resultado
B85: of:=IF( ISBLANK([$'03.Muestra'.$C$8]);"";[$'03.Muestra'.$C$8]) ->  | C85: of:=IF( ISBLANK([$'03.Muestra'.$E$8]);"";[$'03.Muestra'.$E$8]) ->  | D85: of:=IF(AND([.B85]<>"";[.C85]<>"");"N/T";"") ->  | E85: of:=IF([.D85]<>"";IF(AND([.B85]<>"";[.C85]<>"");"";"ERR");"") ->  | F85: of:=TRANSPOSE([$'DATA - Oculta'.$U$9:$'DATA - Oculta'.$U$13]) -> N/T | G85: N/D | H85: N/A | I85: Falla | J85: Pasa | K85: En blanco
B86: of:=IF( ISBLANK([$'03.Muestra'.$C$9]);"";[$'03.Muestra'.$C$9]) ->  | C86: of:=IF( ISBLANK([$'03.Muestra'.$E$9]);"";[$'03.Muestra'.$E$9]) ->  | D86: of:=IF(AND([.B86]<>"";[.C86]<>"");"N/T";"") ->  | E86: of:=IF([.D86]<>"";IF(AND([.B86]<>"";[.C86]<>"");"";"ERR");"") ->  | F86: of:=COUNTIF([.$D85]:INDIRECT("$D" &  SUM(ROW()-1;['03.Muestra'.$D$40])-1);[.F85]) -> 0 | G86: of:=COUNTIF([.$D85]:INDIRECT("$D" &  SUM(ROW()-1;['03.Muestra'.$D$40])-1);[.G85]) -> 0 | H86: of:=COUNTIF([.$D85]:INDIRECT("$D" &  SUM(ROW()-1;['03.Muestra'.$D$40])-1);[.H85]) -> 0 | I86: of:=COUNTIF([.$D85]:INDIRECT("$D" &  SUM(ROW()-1;['03.Muestra'.$D$40])-1);[.I85]) -> 0 | J86: of:=COUNTIF([.$D85]:INDIRECT("$D" &  SUM(ROW()-1;['03.Muestra'.$D$40])-1);[.J85]) -> 0 | K86: of:=IF(['03.Muestra'.$D$40]=0;0;COUNTBLANK([.$D85]:INDIRECT("$D" &  SUM(ROW()-1;['03.Muestra'.$D$40])-1))) -> 0
B87: of:=IF( ISBLANK([$'03.Muestra'.$C$10]);"";[$'03.Muestra'.$C$10]) ->  | C87: of:=IF( ISBLANK([$'03.Muestra'.$E$10]);"";[$'03.Muestra'.$E$10]) ->  | D87: of:=IF(AND([.B87]<>"";[.C87]<>"");"N/T";"") ->  | E87: of:=IF([.D87]<>"";IF(AND([.B87]<>"";[.C87]<>"");"";"ERR");"") -> 
B88: of:=IF( ISBLANK([$'03.Muestra'.$C$11]);"";[$'03.Muestra'.$C$11]) ->  | C88: of:=IF( ISBLANK([$'03.Muestra'.$E$11]);"";[$'03.Muestra'.$E$11]) ->  | D88: of:=IF(AND([.B88]<>"";[.C88]<>"");"N/T";"") ->  | E88: of:=IF([.D88]<>"";IF(AND([.B88]<>"";[.C88]<>"");"";"ERR");"") -> 
B89: of:=IF( ISBLANK([$'03.Muestra'.$C$12]);"";[$'03.Muestra'.$C$12]) ->  | C89: of:=IF( ISBLANK([$'03.Muestra'.$E$12]);"";[$'03.Muestra'.$E$12]) ->  | D89: of:=IF(AND([.B89]<>"";[.C89]<>"");"N/T";"") ->  | E89: of:=IF([.D89]<>"";IF(AND([.B89]<>"";[.C89]<>"");"";"ERR");"") -> 
B90: of:=IF( ISBLANK([$'03.Muestra'.$C$13]);"";[$'03.Muestra'.$C$13]) ->  | C90: of:=IF( ISBLANK([$'03.Muestra'.$E$13]);"";[$'03.Muestra'.$E$13]) ->  | D90: of:=IF(AND([.B90]<>"";[.C90]<>"");"N/T";"") ->  | E90: of:=IF([.D90]<>"";IF(AND([.B90]<>"";[.C90]<>"");"";"ERR");"") -> 
B91: of:=IF( ISBLANK([$'03.Muestra'.$C$14]);"";[$'03.Muestra'.$C$14]) ->  | C91: of:=IF( ISBLANK([$'03.Muestra'.$E$14]);"";[$'03.Muestra'.$E$14]) ->  | D91: of:=IF(AND([.B91]<>"";[.C91]<>"");"N/T";"") ->  | E91: of:=IF([.D91]<>"";IF(AND([.B91]<>"";[.C91]<>"");"";"ERR");"") -> 
B92: of:=IF( ISBLANK([$'03.Muestra'.$C$15]);"";[$'03.Muestra'.$C$15]) ->  | C92: of:=IF( ISBLANK([$'03.Muestra'.$E$15]);"";[$'03.Muestra'.$E$15]) ->  | D92: of:=IF(AND([.B92]<>"";[.C92]<>"");"N/T";"") ->  | E92: of:=IF([.D92]<>"";IF(AND([.B92]<>"";[.C92]<>"");"";"ERR");"") -> 
B93: of:=IF( ISBLANK([$'03.Muestra'.$C$16]);"";[$'03.Muestra'.$C$16]) ->  | C93: of:=IF( ISBLANK([$'03.Muestra'.$E$16]);"";[$'03.Muestra'.$E$16]) ->  | D93: of:=IF(AND([.B93]<>"";[.C93]<>"");"N/T";"") ->  | E93: of:=IF([.D93]<>"";IF(AND([.B93]<>"";[.C93]<>"");"";"ERR");"") -> 
B94: of:=IF( ISBLANK([$'03.Muestra'.$C$17]);"";[$'03.Muestra'.$C$17]) ->  | C94: of:=IF( ISBLANK([$'03.Muestra'.$E$17]);"";[$'03.Muestra'.$E$17]) ->  | D94: of:=IF(AND([.B94]<>"";[.C94]<>"");"N/T";"") ->  | E94: of:=IF([.D94]<>"";IF(AND([.B94]<>"";[.C94]<>"");"";"ERR");"") -> 
B95: of:=IF( ISBLANK([$'03.Muestra'.$C$18]);"";[$'03.Muestra'.$C$18]) ->  | C95: of:=IF( ISBLANK([$'03.Muestra'.$E$18]);"";[$'03.Muestra'.$E$18]) ->  | D95: of:=IF(AND([.B95]<>"";[.C95]<>"");"N/T";"") ->  | E95: of:=IF([.D95]<>"";IF(AND([.B95]<>"";[.C95]<>"");"";"ERR");"") -> 
B96: of:=IF( ISBLANK([$'03.Muestra'.$C$19]);"";[$'03.Muestra'.$C$19]) ->  | C96: of:=IF( ISBLANK([$'03.Muestra'.$E$19]);"";[$'03.Muestra'.$E$19]) ->  | D96: of:=IF(AND([.B96]<>"";[.C96]<>"");"N/T";"") ->  | E96: of:=IF([.D96]<>"";IF(AND([.B96]<>"";[.C96]<>"");"";"ERR");"") -> 
B97: of:=IF( ISBLANK([$'03.Muestra'.$C$20]);"";[$'03.Muestra'.$C$20]) ->  | C97: of:=IF( ISBLANK([$'03.Muestra'.$E$20]);"";[$'03.Muestra'.$E$20]) ->  | D97: of:=IF(AND([.B97]<>"";[.C97]<>"");"N/T";"") ->  | E97: of:=IF([.D97]<>"";IF(AND([.B97]<>"";[.C97]<>"");"";"ERR");"") -> 
B98: of:=IF( ISBLANK([$'03.Muestra'.$C$21]);"";[$'03.Muestra'.$C$21]) ->  | C98: of:=IF( ISBLANK([$'03.Muestra'.$E$21]);"";[$'03.Muestra'.$E$21]) ->  | D98: of:=IF(AND([.B98]<>"";[.C98]<>"");"N/T";"") ->  | E98: of:=IF([.D98]<>"";IF(AND([.B98]<>"";[.C98]<>"");"";"ERR");"") -> 
B99: of:=IF( ISBLANK([$'03.Muestra'.$C$22]);"";[$'03.Muestra'.$C$22]) ->  | C99: of:=IF( ISBLANK([$'03.Muestra'.$E$22]);"";[$'03.Muestra'.$E$22]) ->  | D99: of:=IF(AND([.B99]<>"";[.C99]<>"");"N/T";"") ->  | E99: of:=IF([.D99]<>"";IF(AND([.B99]<>"";[.C99]<>"");"";"ERR");"") -> 
B100: of:=IF( ISBLANK([$'03.Muestra'.$C$23]);"";[$'03.Muestra'.$C$23]) ->  | C100: of:=IF( ISBLANK([$'03.Muestra'.$E$23]);"";[$'03.Muestra'.$E$23]) ->  | D100: of:=IF(AND([.B100]<>"";[.C100]<>"");"N/T";"") ->  | E100: of:=IF([.D100]<>"";IF(AND([.B100]<>"";[.C100]<>"");"";"ERR");"") -> 
B101: of:=IF( ISBLANK([$'03.Muestra'.$C$24]);"";[$'03.Muestra'.$C$24]) ->  | C101: of:=IF( ISBLANK([$'03.Muestra'.$E$24]);"";[$'03.Muestra'.$E$24]) ->  | D101: of:=IF(AND([.B101]<>"";[.C101]<>"");"N/T";"") ->  | E101: of:=IF([.D101]<>"";IF(AND([.B101]<>"";[.C101]<>"");"";"ERR");"") -> 
B102: of:=IF( ISBLANK([$'03.Muestra'.$C$25]);"";[$'03.Muestra'.$C$25]) ->  | C102: of:=IF( ISBLANK([$'03.Muestra'.$E$25]);"";[$'03.Muestra'.$E$25]) ->  | D102: of:=IF(AND([.B102]<>"";[.C102]<>"");"N/T";"") ->  | E102: of:=IF([.D102]<>"";IF(AND([.B102]<>"";[.C102]<>"");"";"ERR");"") -> 
B103: of:=IF( ISBLANK([$'03.Muestra'.$C$26]);"";[$'03.Muestra'.$C$26]) ->  | C103: of:=IF( ISBLANK([$'03.Muestra'.$E$26]);"";[$'03.Muestra'.$E$26]) ->  | D103: of:=IF(AND([.B103]<>"";[.C103]<>"");"N/T";"") ->  | E103: of:=IF([.D103]<>"";IF(AND([.B103]<>"";[.C103]<>"");"";"ERR");"") -> 
B104: of:=IF( ISBLANK([$'03.Muestra'.$C$27]);"";[$'03.Muestra'.$C$27]) ->  | C104: of:=IF( ISBLANK([$'03.Muestra'.$E$27]);"";[$'03.Muestra'.$E$27]) ->  | D104: of:=IF(AND([.B104]<>"";[.C104]<>"");"N/T";"") ->  | E104: of:=IF([.D104]<>"";IF(AND([.B104]<>"";[.C104]<>"");"";"ERR");"") -> 
B105: of:=IF( ISBLANK([$'03.Muestra'.$C$28]);"";[$'03.Muestra'.$C$28]) ->  | C105: of:=IF( ISBLANK([$'03.Muestra'.$E$28]);"";[$'03.Muestra'.$E$28]) ->  | D105: of:=IF(AND([.B105]<>"";[.C105]<>"");"N/T";"") ->  | E105: of:=IF([.D105]<>"";IF(AND([.B105]<>"";[.C105]<>"");"";"ERR");"") -> 
B106: of:=IF( ISBLANK([$'03.Muestra'.$C$29]);"";[$'03.Muestra'.$C$29]) ->  | C106: of:=IF( ISBLANK([$'03.Muestra'.$E$29]);"";[$'03.Muestra'.$E$29]) ->  | D106: of:=IF(AND([.B106]<>"";[.C106]<>"");"N/T";"") ->  | E106: of:=IF([.D106]<>"";IF(AND([.B106]<>"";[.C106]<>"");"";"ERR");"") -> 
B107: of:=IF( ISBLANK([$'03.Muestra'.$C$30]);"";[$'03.Muestra'.$C$30]) ->  | C107: of:=IF( ISBLANK([$'03.Muestra'.$E$30]);"";[$'03.Muestra'.$E$30]) ->  | D107: of:=IF(AND([.B107]<>"";[.C107]<>"");"N/T";"") ->  | E107: of:=IF([.D107]<>"";IF(AND([.B107]<>"";[.C107]<>"");"";"ERR");"") -> 
B108: of:=IF( ISBLANK([$'03.Muestra'.$C$31]);"";[$'03.Muestra'.$C$31]) ->  | C108: of:=IF( ISBLANK([$'03.Muestra'.$E$31]);"";[$'03.Muestra'.$E$31]) ->  | D108: of:=IF(AND([.B108]<>"";[.C108]<>"");"N/T";"") ->  | E108: of:=IF([.D108]<>"";IF(AND([.B108]<>"";[.C108]<>"");"";"ERR");"") -> 
B109: of:=IF( ISBLANK([$'03.Muestra'.$C$32]);"";[$'03.Muestra'.$C$32]) ->  | C109: of:=IF( ISBLANK([$'03.Muestra'.$E$32]);"";[$'03.Muestra'.$E$32]) ->  | D109: of:=IF(AND([.B109]<>"";[.C109]<>"");"N/T";"") ->  | E109: of:=IF([.D109]<>"";IF(AND([.B109]<>"";[.C109]<>"");"";"ERR");"") -> 
B110: of:=IF( ISBLANK([$'03.Muestra'.$C$33]);"";[$'03.Muestra'.$C$33]) ->  | C110: of:=IF( ISBLANK([$'03.Muestra'.$E$33]);"";[$'03.Muestra'.$E$33]) ->  | D110: of:=IF(AND([.B110]<>"";[.C110]<>"");"N/T";"") ->  | E110: of:=IF([.D110]<>"";IF(AND([.B110]<>"";[.C110]<>"");"";"ERR");"") -> 
B111: of:=IF( ISBLANK([$'03.Muestra'.$C$34]);"";[$'03.Muestra'.$C$34]) ->  | C111: of:=IF( ISBLANK([$'03.Muestra'.$E$34]);"";[$'03.Muestra'.$E$34]) ->  | D111: of:=IF(AND([.B111]<>"";[.C111]<>"");"N/T";"") ->  | E111: of:=IF([.D111]<>"";IF(AND([.B111]<>"";[.C111]<>"");"";"ERR");"") -> 
B112: of:=IF( ISBLANK([$'03.Muestra'.$C$35]);"";[$'03.Muestra'.$C$35]) ->  | C112: of:=IF( ISBLANK([$'03.Muestra'.$E$35]);"";[$'03.Muestra'.$E$35]) ->  | D112: of:=IF(AND([.B112]<>"";[.C112]<>"");"N/T";"") ->  | E112: of:=IF([.D112]<>"";IF(AND([.B112]<>"";[.C112]<>"");"";"ERR");"") -> 
B113: of:=IF( ISBLANK([$'03.Muestra'.$C$36]);"";[$'03.Muestra'.$C$36]) ->  | C113: of:=IF( ISBLANK([$'03.Muestra'.$E$36]);"";[$'03.Muestra'.$E$36]) ->  | D113: of:=IF(AND([.B113]<>"";[.C113]<>"");"N/T";"") ->  | E113: of:=IF([.D113]<>"";IF(AND([.B113]<>"";[.C113]<>"");"";"ERR");"") -> 
B114: of:=IF( ISBLANK([$'03.Muestra'.$C$37]);"";[$'03.Muestra'.$C$37]) ->  | C114: of:=IF( ISBLANK([$'03.Muestra'.$E$37]);"";[$'03.Muestra'.$E$37]) ->  | D114: of:=IF(AND([.B114]<>"";[.C114]<>"");"N/T";"") ->  | E114: of:=IF([.D114]<>"";IF(AND([.B114]<>"";[.C114]<>"");"";"ERR");"") -> 
B117: A | C117: 1.2.3 AudiodescripciÃ³n o Medio Alternativo (grabado) | D117: Resultado
B118: of:=IF( ISBLANK([$'03.Muestra'.$C$8]);"";[$'03.Muestra'.$C$8]) ->  | C118: of:=IF( ISBLANK([$'03.Muestra'.$E$8]);"";[$'03.Muestra'.$E$8]) ->  | D118: of:=IF(AND([.B118]<>"";[.C118]<>"");"N/T";"") ->  | E118: of:=IF([.D118]<>"";IF(AND([.B118]<>"";[.C118]<>"");"";"ERR");"") ->  | F118: of:=TRANSPOSE([$'DATA - Oculta'.$U$9:$'DATA - Oculta'.$U$13]) -> N/T | G118: N/D | H118: N/A | I118: Falla | J118: Pasa | K118: En blanco
B119: of:=IF( ISBLANK([$'03.Muestra'.$C$9]);"";[$'03.Muestra'.$C$9]) ->  | C119: of:=IF( ISBLANK([$'03.Muestra'.$E$9]);"";[$'03.Muestra'.$E$9]) ->  | D119: of:=IF(AND([.B119]<>"";[.C119]<>"");"N/T";"") ->  | E119: of:=IF([.D119]<>"";IF(AND([.B119]<>"";[.C119]<>"");"";"ERR");"") ->  | F119: of:=COUNTIF([.$D118]:INDIRECT("$D" &  SUM(ROW()-1;['03.Muestra'.$D$40])-1);[.F118]) -> 0 | G119: of:=COUNTIF([.$D118]:INDIRECT("$D" &  SUM(ROW()-1;['03.Muestra'.$D$40])-1);[.G118]) -> 0 | H119: of:=COUNTIF([.$D118]:INDIRECT("$D" &  SUM(ROW()-1;['03.Muestra'.$D$40])-1);[.H118]) -> 0 | I119: of:=COUNTIF([.$D118]:INDIRECT("$D" &  SUM(ROW()-1;['03.Muestra'.$D$40])-1);[.I118]) -> 0 | J119: of:=COUNTIF([.$D118]:INDIRECT("$D" &  SUM(ROW()-1;['03.Muestra'.$D$40])-1);[.J118]) -> 0 | K119: of:=IF(['03.Muestra'.$D$40]=0;0;COUNTBLANK([.$D118]:INDIRECT("$D" &  SUM(ROW()-1;['03.Muestra'.$D$40])-1))) -> 0
B120: of:=IF( ISBLANK([$'03.Muestra'.$C$10]);"";[$'03.Muestra'.$C$10]) ->  | C120: of:=IF( ISBLANK([$'03.Muestra'.$E$10]);"";[$'03.Muestra'.$E$10]) ->  | D120: of:=IF(AND([.B120]<>"";[.C120]<>"");"N/T";"") ->  | E120: of:=IF([.D120]<>"";IF(AND([.B120]<>"";[.C120]<>"");"";"ERR");"") -> 
B121: of:=IF( ISBLANK([$'03.Muestra'.$C$11]);"";[$'03.Muestra'.$C$11]) ->  | C121: of:=IF( ISBLANK([$'03.Muestra'.$E$11]);"";[$'03.Muestra'.$E$11]) ->  | D121: of:=IF(AND([.B121]<>"";[.C121]<>"");"N/T";"") ->  | E121: of:=IF([.D121]<>"";IF(AND([.B121]<>"";[.C121]<>"");"";"ERR");"") -> 
B122: of:=IF( ISBLANK([$'03.Muestra'.$C$12]);"";[$'03.Muestra'.$C$12]) ->  | C122: of:=IF( ISBLANK([$'03.Muestra'.$E$12]);"";[$'03.Muestra'.$E$12]) ->  | D122: of:=IF(AND([.B122]<>"";[.C122]<>"");"N/T";"") ->  | E122: of:=IF([.D122]<>"";IF(AND([.B122]<>"";[.C122]<>"");"";"ERR");"") -> 
B123: of:=IF( ISBLANK([$'03.Muestra'.$C$13]);"";[$'03.Muestra'.$C$13]) ->  | C123: of:=IF( ISBLANK([$'03.Muestra'.$E$13]);"";[$'03.Muestra'.$E$13]) ->  | D123: of:=IF(AND([.B123]<>"";[.C123]<>"");"N/T";"") ->  | E123: of:=IF([.D123]<>"";IF(AND([.B123]<>"";[.C123]<>"");"";"ERR");"") -> 
B124: of:=IF( ISBLANK([$'03.Muestra'.$C$14]);"";[$'03.Muestra'.$C$14]) ->  | C124: of:=IF( ISBLANK([$'03.Muestra'.$E$14]);"";[$'03.Muestra'.$E$14]) ->  | D124: of:=IF(AND([.B124]<>"";[.C124]<>"");"N/T";"") ->  | E124: of:=IF([.D124]<>"";IF(AND([.B124]<>"";[.C124]<>"");"";"ERR");"") -> 
B125: of:=IF( ISBLANK([$'03.Muestra'.$C$15]);"";[$'03.Muestra'.$C$15]) ->  | C125: of:=IF( ISBLANK([$'03.Muestra'.$E$15]);"";[$'03.Muestra'.$E$15]) ->  | D125: of:=IF(AND([.B125]<>"";[.C125]<>"");"N/T";"") ->  | E125: of:=IF([.D125]<>"";IF(AND([.B125]<>"";[.C125]<>"");"";"ERR");"") -> 
B126: of:=IF( ISBLANK([$'03.Muestra'.$C$16]);"";[$'03.Muestra'.$C$16]) ->  | C126: of:=IF( ISBLANK([$'03.Muestra'.$E$16]);"";[$'03.Muestra'.$E$16]) ->  | D126: of:=IF(AND([.B126]<>"";[.C126]<>"");"N/T";"") ->  | E126: of:=IF([.D126]<>"";IF(AND([.B126]<>"";[.C126]<>"");"";"ERR");"") -> 
B127: of:=IF( ISBLANK([$'03.Muestra'.$C$17]);"";[$'03.Muestra'.$C$17]) ->  | C127: of:=IF( ISBLANK([$'03.Muestra'.$E$17]);"";[$'03.Muestra'.$E$17]) ->  | D127: of:=IF(AND([.B127]<>"";[.C127]<>"");"N/T";"") ->  | E127: of:=IF([.D127]<>"";IF(AND([.B127]<>"";[.C127]<>"");"";"ERR");"") -> 
B128: of:=IF( ISBLANK([$'03.Muestra'.$C$18]);"";[$'03.Muestra'.$C$18]) ->  | C128: of:=IF( ISBLANK([$'03.Muestra'.$E$18]);"";[$'03.Muestra'.$E$18]) ->  | D128: of:=IF(AND([.B128]<>"";[.C128]<>"");"N/T";"") ->  | E128: of:=IF([.D128]<>"";IF(AND([.B128]<>"";[.C128]<>"");"";"ERR");"") -> 
B129: of:=IF( ISBLANK([$'03.Muestra'.$C$19]);"";[$'03.Muestra'.$C$19]) ->  | C129: of:=IF( ISBLANK([$'03.Muestra'.$E$19]);"";[$'03.Muestra'.$E$19]) ->  | D129: of:=IF(AND([.B129]<>"";[.C129]<>"");"N/T";"") ->  | E129: of:=IF([.D129]<>"";IF(AND([.B129]<>"";[.C129]<>"");"";"ERR");"") -> 
B130: of:=IF( ISBLANK([$'03.Muestra'.$C$20]);"";[$'03.Muestra'.$C$20]) ->  | C130: of:=IF( ISBLANK([$'03.Muestra'.$E$20]);"";[$'03.Muestra'.$E$20]) ->  | D130: of:=IF(AND([.B130]<>"";[.C130]<>"");"N/T";"") ->  | E130: of:=IF([.D130]<>"";IF(AND([.B130]<>"";[.C130]<>"");"";"ERR");"") -> 
B131: of:=IF( ISBLANK([$'03.Muestra'.$C$21]);"";[$'03.Muestra'.$C$21]) ->  | C131: of:=IF( ISBLANK([$'03.Muestra'.$E$21]);"";[$'03.Muestra'.$E$21]) ->  | D131: of:=IF(AND([.B131]<>"";[.C131]<>"");"N/T";"") ->  | E131: of:=IF([.D131]<>"";IF(AND([.B131]<>"";[.C131]<>"");"";"ERR");"") -> 
B132: of:=IF( ISBLANK([$'03.Muestra'.$C$22]);"";[$'03.Muestra'.$C$22]) ->  | C132: of:=IF( ISBLANK([$'03.Muestra'.$E$22]);"";[$'03.Muestra'.$E$22]) ->  | D132: of:=IF(AND([.B132]<>"";[.C132]<>"");"N/T";"") ->  | E132: of:=IF([.D132]<>"";IF(AND([.B132]<>"";[.C132]<>"");"";"ERR");"") -> 
B133: of:=IF( ISBLANK([$'03.Muestra'.$C$23]);"";[$'03.Muestra'.$C$23]) ->  | C133: of:=IF( ISBLANK([$'03.Muestra'.$E$23]);"";[$'03.Muestra'.$E$23]) ->  | D133: of:=IF(AND([.B133]<>"";[.C133]<>"");"N/T";"") ->  | E133: of:=IF([.D133]<>"";IF(AND([.B133]<>"";[.C133]<>"");"";"ERR");"") -> 
B134: of:=IF( ISBLANK([$'03.Muestra'.$C$24]);"";[$'03.Muestra'.$C$24]) ->  | C134: of:=IF( ISBLANK([$'03.Muestra'.$E$24]);"";[$'03.Muestra'.$E$24]) ->  | D134: of:=IF(AND([.B134]<>"";[.C134]<>"");"N/T";"") ->  | E134: of:=IF([.D134]<>"";IF(AND([.B134]<>"";[.C134]<>"");"";"ERR");"") -> 
B135: of:=IF( ISBLANK([$'03.Muestra'.$C$25]);"";[$'03.Muestra'.$C$25]) ->  | C135: of:=IF( ISBLANK([$'03.Muestra'.$E$25]);"";[$'03.Muestra'.$E$25]) ->  | D135: of:=IF(AND([.B135]<>"";[.C135]<>"");"N/T";"") ->  | E135: of:=IF([.D135]<>"";IF(AND([.B135]<>"";[.C135]<>"");"";"ERR");"") -> 
B136: of:=IF( ISBLANK([$'03.Muestra'.$C$26]);"";[$'03.Muestra'.$C$26]) ->  | C136: of:=IF( ISBLANK([$'03.Muestra'.$E$26]);"";[$'03.Muestra'.$E$26]) ->  | D136: of:=IF(AND([.B136]<>"";[.C136]<>"");"N/T";"") ->  | E136: of:=IF([.D136]<>"";IF(AND([.B136]<>"";[.C136]<>"");"";"ERR");"") -> 
B137: of:=IF( ISBLANK([$'03.Muestra'.$C$27]);"";[$'03.Muestra'.$C$27]) ->  | C137: of:=IF( ISBLANK([$'03.Muestra'.$E$27]);"";[$'03.Muestra'.$E$27]) ->  | D137: of:=IF(AND([.B137]<>"";[.C137]<>"");"N/T";"") ->  | E137: of:=IF([.D137]<>"";IF(AND([.B137]<>"";[.C137]<>"");"";"ERR");"") -> 
B138: of:=IF( ISBLANK([$'03.Muestra'.$C$28]);"";[$'03.Muestra'.$C$28]) ->  | C138: of:=IF( ISBLANK([$'03.Muestra'.$E$28]);"";[$'03.Muestra'.$E$28]) ->  | D138: of:=IF(AND([.B138]<>"";[.C138]<>"");"N/T";"") ->  | E138: of:=IF([.D138]<>"";IF(AND([.B138]<>"";[.C138]<>"");"";"ERR");"") -> 
B139: of:=IF( ISBLANK([$'03.Muestra'.$C$29]);"";[$'03.Muestra'.$C$29]) ->  | C139: of:=IF( ISBLANK([$'03.Muestra'.$E$29]);"";[$'03.Muestra'.$E$29]) ->  | D139: of:=IF(AND([.B139]<>"";[.C139]<>"");"N/T";"") ->  | E139: of:=IF([.D139]<>"";IF(AND([.B139]<>"";[.C139]<>"");"";"ERR");"") -> 
B140: of:=IF( ISBLANK([$'03.Muestra'.$C$30]);"";[$'03.Muestra'.$C$30]) ->  | C140: of:=IF( ISBLANK([$'03.Muestra'.$E$30]);"";[$'03.Muestra'.$E$30]) ->  | D140: of:=IF(AND([.B140]<>"";[.C140]<>"");"N/T";"") ->  | E140: of:=IF([.D140]<>"";IF(AND([.B140]<>"";[.C140]<>"");"";"ERR");"") -> 
B141: of:=IF( ISBLANK([$'03.Muestra'.$C$31]);"";[$'03.Muestra'.$C$31]) ->  | C141: of:=IF( ISBLANK([$'03.Muestra'.$E$31]);"";[$'03.Muestra'.$E$31]) ->  | D141: of:=IF(AND([.B141]<>"";[.C141]<>"");"N/T";"") ->  | E141: of:=IF([.D141]<>"";IF(AND([.B141]<>"";[.C141]<>"");"";"ERR");"") -> 
B142: of:=IF( ISBLANK([$'03.Muestra'.$C$32]);"";[$'03.Muestra'.$C$32]) ->  | C142: of:=IF( ISBLANK([$'03.Muestra'.$E$32]);"";[$'03.Muestra'.$E$32]) ->  | D142: of:=IF(AND([.B142]<>"";[.C142]<>"");"N/T";"") ->  | E142: of:=IF([.D142]<>"";IF(AND([.B142]<>"";[.C142]<>"");"";"ERR");"") -> 
B143: of:=IF( ISBLANK([$'03.Muestra'.$C$33]);"";[$'03.Muestra'.$C$33]) ->  | C143: of:=IF( ISBLANK([$'03.Muestra'.$E$33]);"";[$'03.Muestra'.$E$33]) ->  | D143: of:=IF(AND([.B143]<>"";[.C143]<>"");"N/T";"") ->  | E143: of:=IF([.D143]<>"";IF(AND([.B143]<>"";[.C143]<>"");"";"ERR");"") -> 
B144: of:=IF( ISBLANK([$'03.Muestra'.$C$34]);"";[$'03.Muestra'.$C$34]) ->  | C144: of:=IF( ISBLANK([$'03.Muestra'.$E$34]);"";[$'03.Muestra'.$E$34]) ->  | D144: of:=IF(AND([.B144]<>"";[.C144]<>"");"N/T";"") ->  | E144: of:=IF([.D144]<>"";IF(AND([.B144]<>"";[.C144]<>"");"";"ERR");"") -> 
B145: of:=IF( ISBLANK([$'03.Muestra'.$C$35]);"";[$'03.Muestra'.$C$35]) ->  | C145: of:=IF( ISBLANK([$'03.Muestra'.$E$35]);"";[$'03.Muestra'.$E$35]) ->  | D145: of:=IF(AND([.B145]<>"";[.C145]<>"");"N/T";"") ->  | E145: of:=IF([.D145]<>"";IF(AND([.B145]<>"";[.C145]<>"");"";"ERR");"") -> 
B146: of:=IF( ISBLANK([$'03.Muestra'.$C$36]);"";[$'03.Muestra'.$C$36]) ->  | C146: of:=IF( ISBLANK([$'03.Muestra'.$E$36]);"";[$'03.Muestra'.$E$36]) ->  | D146: of:=IF(AND([.B146]<>"";[.C146]<>"");"N/T";"") ->  | E146: of:=IF([.D146]<>"";IF(AND([.B146]<>"";[.C146]<>"");"";"ERR");"") -> 
B147: of:=IF( ISBLANK([$'03.Muestra'.$C$37]);"";[$'03.Muestra'.$C$37]) ->  | C147: of:=IF( ISBLANK([$'03.Muestra'.$E$37]);"";[$'03.Muestra'.$E$37]) ->  | D147: of:=IF(AND([.B147]<>"";[.C147]<>"");"N/T";"") ->  | E147: of:=IF([.D147]<>"";IF(AND([.B147]<>"";[.C147]<>"");"";"ERR");"") -> 
B150: AA | C150: 1.2.4 SubtÃ­tulos (en directo) | D150: Resultado
B151: of:=IF( ISBLANK([$'03.Muestra'.$C$8]);"";[$'03.Muestra'.$C$8]) ->  | C151: of:=IF( ISBLANK([$'03.Muestra'.$E$8]);"";[$'03.Muestra'.$E$8]) ->  | D151: of:=IF(AND([.B151]<>"";[.C151]<>"");"N/T";"") ->  | E151: of:=IF([.D151]<>"";IF(AND([.B151]<>"";[.C151]<>"");"";"ERR");"") ->  | F151: of:=TRANSPOSE([$'DATA - Oculta'.$U$9:$'DATA - Oculta'.$U$13]) -> N/T | G151: N/D | H151: N/A | I151: Falla | J151: Pasa | K151: En blanco
B152: of:=IF( ISBLANK([$'03.Muestra'.$C$9]);"";[$'03.Muestra'.$C$9]) ->  | C152: of:=IF( ISBLANK([$'03.Muestra'.$E$9]);"";[$'03.Muestra'.$E$9]) ->  | D152: of:=IF(AND([.B152]<>"";[.C152]<>"");"N/T";"") ->  | E152: of:=IF([.D152]<>"";IF(AND([.B152]<>"";[.C152]<>"");"";"ERR");"") ->  | F152: of:=COUNTIF([.$D151]:INDIRECT("$D" &  SUM(ROW()-1;['03.Muestra'.$D$40])-1);[.F151]) -> 0 | G152: of:=COUNTIF([.$D151]:INDIRECT("$D" &  SUM(ROW()-1;['03.Muestra'.$D$40])-1);[.G151]) -> 0 | H152: of:=COUNTIF([.$D151]:INDIRECT("$D" &  SUM(ROW()-1;['03.Muestra'.$D$40])-1);[.H151]) -> 0 | I152: of:=COUNTIF([.$D151]:INDIRECT("$D" &  SUM(ROW()-1;['03.Muestra'.$D$40])-1);[.I151]) -> 0 | J152: of:=COUNTIF([.$D151]:INDIRECT("$D" &  SUM(ROW()-1;['03.Muestra'.$D$40])-1);[.J151]) -> 0 | K152: of:=IF(['03.Muestra'.$D$40]=0;0;COUNTBLANK([.$D151]:INDIRECT("$D" &  SUM(ROW()-1;['03.Muestra'.$D$40])-1))) -> 0
B153: of:=IF( ISBLANK([$'03.Muestra'.$C$10]);"";[$'03.Muestra'.$C$10]) ->  | C153: of:=IF( ISBLANK([$'03.Muestra'.$E$10]);"";[$'03.Muestra'.$E$10]) ->  | D153: of:=IF(AND([.B153]<>"";[.C153]<>"");"N/T";"") ->  | E153: of:=IF([.D153]<>"";IF(AND([.B153]<>"";[.C153]<>"");"";"ERR");"") -> 
B154: of:=IF( ISBLANK([$'03.Muestra'.$C$11]);"";[$'03.Muestra'.$C$11]) ->  | C154: of:=IF( ISBLANK([$'03.Muestra'.$E$11]);"";[$'03.Muestra'.$E$11]) ->  | D154: of:=IF(AND([.B154]<>"";[.C154]<>"");"N/T";"") ->  | E154: of:=IF([.D154]<>"";IF(AND([.B154]<>"";[.C154]<>"");"";"ERR");"") -> 
B155: of:=IF( ISBLANK([$'03.Muestra'.$C$12]);"";[$'03.Muestra'.$C$12]) ->  | C155: of:=IF( ISBLANK([$'03.Muestra'.$E$12]);"";[$'03.Muestra'.$E$12]) ->  | D155: of:=IF(AND([.B155]<>"";[.C155]<>"");"N/T";"") ->  | E155: of:=IF([.D155]<>"";IF(AND([.B155]<>"";[.C155]<>"");"";"ERR");"") -> 
B156: of:=IF( ISBLANK([$'03.Muestra'.$C$13]);"";[$'03.Muestra'.$C$13]) ->  | C156: of:=IF( ISBLANK([$'03.Muestra'.$E$13]);"";[$'03.Muestra'.$E$13]) ->  | D156: of:=IF(AND([.B156]<>"";[.C156]<>"");"N/T";"") ->  | E156: of:=IF([.D156]<>"";IF(AND([.B156]<>"";[.C156]<>"");"";"ERR");"") -> 
B157: of:=IF( ISBLANK([$'03.Muestra'.$C$14]);"";[$'03.Muestra'.$C$14]) ->  | C157: of:=IF( ISBLANK([$'03.Muestra'.$E$14]);"";[$'03.Muestra'.$E$14]) ->  | D157: of:=IF(AND([.B157]<>"";[.C157]<>"");"N/T";"") ->  | E157: of:=IF([.D157]<>"";IF(AND([.B157]<>"";[.C157]<>"");"";"ERR");"") -> 
B158: of:=IF( ISBLANK([$'03.Muestra'.$C$15]);"";[$'03.Muestra'.$C$15]) ->  | C158: of:=IF( ISBLANK([$'03.Muestra'.$E$15]);"";[$'03.Muestra'.$E$15]) ->  | D158: of:=IF(AND([.B158]<>"";[.C158]<>"");"N/T";"") ->  | E158: of:=IF([.D158]<>"";IF(AND([.B158]<>"";[.C158]<>"");"";"ERR");"") -> 
B159: of:=IF( ISBLANK([$'03.Muestra'.$C$16]);"";[$'03.Muestra'.$C$16]) ->  | C159: of:=IF( ISBLANK([$'03.Muestra'.$E$16]);"";[$'03.Muestra'.$E$16]) ->  | D159: of:=IF(AND([.B159]<>"";[.C159]<>"");"N/T";"") ->  | E159: of:=IF([.D159]<>"";IF(AND([.B159]<>"";[.C159]<>"");"";"ERR");"") -> 
B160: of:=IF( ISBLANK([$'03.Muestra'.$C$17]);"";[$'03.Muestra'.$C$17]) ->  | C160: of:=IF( ISBLANK([$'03.Muestra'.$E$17]);"";[$'03.Muestra'.$E$17]) ->  | D160: of:=IF(AND([.B160]<>"";[.C160]<>"");"N/T";"") ->  | E160: of:=IF([.D160]<>"";IF(AND([.B160]<>"";[.C160]<>"");"";"ERR");"") -> 
B161: of:=IF( ISBLANK([$'03.Muestra'.$C$18]);"";[$'03.Muestra'.$C$18]) ->  | C161: of:=IF( ISBLANK([$'03.Muestra'.$E$18]);"";[$'03.Muestra'.$E$18]) ->  | D161: of:=IF(AND([.B161]<>"";[.C161]<>"");"N/T";"") ->  | E161: of:=IF([.D161]<>"";IF(AND([.B161]<>"";[.C161]<>"");"";"ERR");"") -> 
B162: of:=IF( ISBLANK([$'03.Muestra'.$C$19]);"";[$'03.Muestra'.$C$19]) ->  | C162: of:=IF( ISBLANK([$'03.Muestra'.$E$19]);"";[$'03.Muestra'.$E$19]) ->  | D162: of:=IF(AND([.B162]<>"";[.C162]<>"");"N/T";"") ->  | E162: of:=IF([.D162]<>"";IF(AND([.B162]<>"";[.C162]<>"");"";"ERR");"") -> 
B163: of:=IF( ISBLANK([$'03.Muestra'.$C$20]);"";[$'03.Muestra'.$C$20]) ->  | C163: of:=IF( ISBLANK([$'03.Muestra'.$E$20]);"";[$'03.Muestra'.$E$20]) ->  | D163: of:=IF(AND([.B163]<>"";[.C163]<>"");"N/T";"") ->  | E163: of:=IF([.D163]<>"";IF(AND([.B163]<>"";[.C163]<>"");"";"ERR");"") -> 
B164: of:=IF( ISBLANK([$'03.Muestra'.$C$21]);"";[$'03.Muestra'.$C$21]) ->  | C164: of:=IF( ISBLANK([$'03.Muestra'.$E$21]);"";[$'03.Muestra'.$E$21]) ->  | D164: of:=IF(AND([.B164]<>"";[.C164]<>"");"N/T";"") ->  | E164: of:=IF([.D164]<>"";IF(AND([.B164]<>"";[.C164]<>"");"";"ERR");"") -> 
B165: of:=IF( ISBLANK([$'03.Muestra'.$C$22]);"";[$'03.Muestra'.$C$22]) ->  | C165: of:=IF( ISBLANK([$'03.Muestra'.$E$22]);"";[$'03.Muestra'.$E$22]) ->  | D165: of:=IF(AND([.B165]<>"";[.C165]<>"");"N/T";"") ->  | E165: of:=IF([.D165]<>"";IF(AND([.B165]<>"";[.C165]<>"");"";"ERR");"") -> 
B166: of:=IF( ISBLANK([$'03.Muestra'.$C$23]);"";[$'03.Muestra'.$C$23]) ->  | C166: of:=IF( ISBLANK([$'03.Muestra'.$E$23]);"";[$'03.Muestra'.$E$23]) ->  | D166: of:=IF(AND([.B166]<>"";[.C166]<>"");"N/T";"") ->  | E166: of:=IF([.D166]<>"";IF(AND([.B166]<>"";[.C166]<>"");"";"ERR");"") -> 
B167: of:=IF( ISBLANK([$'03.Muestra'.$C$24]);"";[$'03.Muestra'.$C$24]) ->  | C167: of:=IF( ISBLANK([$'03.Muestra'.$E$24]);"";[$'03.Muestra'.$E$24]) ->  | D167: of:=IF(AND([.B167]<>"";[.C167]<>"");"N/T";"") ->  | E167: of:=IF([.D167]<>"";IF(AND([.B167]<>"";[.C167]<>"");"";"ERR");"") -> 
B168: of:=IF( ISBLANK([$'03.Muestra'.$C$25]);"";[$'03.Muestra'.$C$25]) ->  | C168: of:=IF( ISBLANK([$'03.Muestra'.$E$25]);"";[$'03.Muestra'.$E$25]) ->  | D168: of:=IF(AND([.B168]<>"";[.C168]<>"");"N/T";"") ->  | E168: of:=IF([.D168]<>"";IF(AND([.B168]<>"";[.C168]<>"");"";"ERR");"") -> 
B169: of:=IF( ISBLANK([$'03.Muestra'.$C$26]);"";[$'03.Muestra'.$C$26]) ->  | C169: of:=IF( ISBLANK([$'03.Muestra'.$E$26]);"";[$'03.Muestra'.$E$26]) ->  | D169: of:=IF(AND([.B169]<>"";[.C169]<>"");"N/T";"") ->  | E169: of:=IF([.D169]<>"";IF(AND([.B169]<>"";[.C169]<>"");"";"ERR");"") -> 
B170: of:=IF( ISBLANK([$'03.Muestra'.$C$27]);"";[$'03.Muestra'.$C$27]) ->  | C170: of:=IF( ISBLANK([$'03.Muestra'.$E$27]);"";[$'03.Muestra'.$E$27]) ->  | D170: of:=IF(AND([.B170]<>"";[.C170]<>"");"N/T";"") ->  | E170: of:=IF([.D170]<>"";IF(AND([.B170]<>"";[.C170]<>"");"";"ERR");"") -> 
B171: of:=IF( ISBLANK([$'03.Muestra'.$C$28]);"";[$'03.Muestra'.$C$28]) ->  | C171: of:=IF( ISBLANK([$'03.Muestra'.$E$28]);"";[$'03.Muestra'.$E$28]) ->  | D171: of:=IF(AND([.B171]<>"";[.C171]<>"");"N/T";"") ->  | E171: of:=IF([.D171]<>"";IF(AND([.B171]<>"";[.C171]<>"");"";"ERR");"") -> 
B172: of:=IF( ISBLANK([$'03.Muestra'.$C$29]);"";[$'03.Muestra'.$C$29]) ->  | C172: of:=IF( ISBLANK([$'03.Muestra'.$E$29]);"";[$'03.Muestra'.$E$29]) ->  | D172: of:=IF(AND([.B172]<>"";[.C172]<>"");"N/T";"") ->  | E172: of:=IF([.D172]<>"";IF(AND([.B172]<>"";[.C172]<>"");"";"ERR");"") -> 
B173: of:=IF( ISBLANK([$'03.Muestra'.$C$30]);"";[$'03.Muestra'.$C$30]) ->  | C173: of:=IF( ISBLANK([$'03.Muestra'.$E$30]);"";[$'03.Muestra'.$E$30]) ->  | D173: of:=IF(AND([.B173]<>"";[.C173]<>"");"N/T";"") ->  | E173: of:=IF([.D173]<>"";IF(AND([.B173]<>"";[.C173]<>"");"";"ERR");"") -> 
B174: of:=IF( ISBLANK([$'03.Muestra'.$C$31]);"";[$'03.Muestra'.$C$31]) ->  | C174: of:=IF( ISBLANK([$'03.Muestra'.$E$31]);"";[$'03.Muestra'.$E$31]) ->  | D174: of:=IF(AND([.B174]<>"";[.C174]<>"");"N/T";"") ->  | E174: of:=IF([.D174]<>"";IF(AND([.B174]<>"";[.C174]<>"");"";"ERR");"") -> 
B175: of:=IF( ISBLANK([$'03.Muestra'.$C$32]);"";[$'03.Muestra'.$C$32]) ->  | C175: of:=IF( ISBLANK([$'03.Muestra'.$E$32]);"";[$'03.Muestra'.$E$32]) ->  | D175: of:=IF(AND([.B175]<>"";[.C175]<>"");"N/T";"") ->  | E175: of:=IF([.D175]<>"";IF(AND([.B175]<>"";[.C175]<>"");"";"ERR");"") -> 
B176: of:=IF( ISBLANK([$'03.Muestra'.$C$33]);"";[$'03.Muestra'.$C$33]) ->  | C176: of:=IF( ISBLANK([$'03.Muestra'.$E$33]);"";[$'03.Muestra'.$E$33]) ->  | D176: of:=IF(AND([.B176]<>"";[.C176]<>"");"N/T";"") ->  | E176: of:=IF([.D176]<>"";IF(AND([.B176]<>"";[.C176]<>"");"";"ERR");"") -> 
B177: of:=IF( ISBLANK([$'03.Muestra'.$C$34]);"";[$'03.Muestra'.$C$34]) ->  | C177: of:=IF( ISBLANK([$'03.Muestra'.$E$34]);"";[$'03.Muestra'.$E$34]) ->  | D177: of:=IF(AND([.B177]<>"";[.C177]<>"");"N/T";"") ->  | E177: of:=IF([.D177]<>"";IF(AND([.B177]<>"";[.C177]<>"");"";"ERR");"") -> 
B178: of:=IF( ISBLANK([$'03.Muestra'.$C$35]);"";[$'03.Muestra'.$C$35]) ->  | C178: of:=IF( ISBLANK([$'03.Muestra'.$E$35]);"";[$'03.Muestra'.$E$35]) ->  | D178: of:=IF(AND([.B178]<>"";[.C178]<>"");"N/T";"") ->  | E178: of:=IF([.D178]<>"";IF(AND([.B178]<>"";[.C178]<>"");"";"ERR");"") -> 
B179: of:=IF( ISBLANK([$'03.Muestra'.$C$36]);"";[$'03.Muestra'.$C$36]) ->  | C179: of:=IF( ISBLANK([$'03.Muestra'.$E$36]);"";[$'03.Muestra'.$E$36]) ->  | D179: of:=IF(AND([.B179]<>"";[.C179]<>"");"N/T";"") ->  | E179: of:=IF([.D179]<>"";IF(AND([.B179]<>"";[.C179]<>"");"";"ERR");"") -> 
B180: of:=IF( ISBLANK([$'03.Muestra'.$C$37]);"";[$'03.Muestra'.$C$37]) ->  | C180: of:=IF( ISBLANK([$'03.Muestra'.$E$37]);"";[$'03.Muestra'.$E$37]) ->  | D180: of:=IF(AND([.B180]<>"";[.C180]<>"");"N/T";"") ->  | E180: of:=IF([.D180]<>"";IF(AND([.B180]<>"";[.C180]<>"");"";"ERR");"") -> 
B183: AA | C183: 1.2.5 AudiodescripciÃ³n (grabado) | D183: Resultado
B184: of:=IF( ISBLANK([$'03.Muestra'.$C$8]);"";[$'03.Muestra'.$C$8]) ->  | C184: of:=IF( ISBLANK([$'03.Muestra'.$E$8]);"";[$'03.Muestra'.$E$8]) ->  | D184: of:=IF(AND([.B184]<>"";[.C184]<>"");"N/T";"") ->  | E184: of:=IF([.D184]<>"";IF(AND([.B184]<>"";[.C184]<>"");"";"ERR");"") ->  | F184: of:=TRANSPOSE([$'DATA - Oculta'.$U$9:$'DATA - Oculta'.$U$13]) -> N/T | G184: N/D | H184: N/A | I184: Falla | J184: Pasa | K184: En blanco
B185: of:=IF( ISBLANK([$'03.Muestra'.$C$9]);"";[$'03.Muestra'.$C$9]) ->  | C185: of:=IF( ISBLANK([$'03.Muestra'.$E$9]);"";[$'03.Muestra'.$E$9]) ->  | D185: of:=IF(AND([.B185]<>"";[.C185]<>"");"N/T";"") ->  | E185: of:=IF([.D185]<>"";IF(AND([.B185]<>"";[.C185]<>"");"";"ERR");"") ->  | F185: of:=COUNTIF([.$D184]:INDIRECT("$D" &  SUM(ROW()-1;['03.Muestra'.$D$40])-1);[.F184]) -> 0 | G185: of:=COUNTIF([.$D184]:INDIRECT("$D" &  SUM(ROW()-1;['03.Muestra'.$D$40])-1);[.G184]) -> 0 | H185: of:=COUNTIF([.$D184]:INDIRECT("$D" &  SUM(ROW()-1;['03.Muestra'.$D$40])-1);[.H184]) -> 0 | I185: of:=COUNTIF([.$D184]:INDIRECT("$D" &  SUM(ROW()-1;['03.Muestra'.$D$40])-1);[.I184]) -> 0 | J185: of:=COUNTIF([.$D184]:INDIRECT("$D" &  SUM(ROW()-1;['03.Muestra'.$D$40])-1);[.J184]) -> 0 | K185: of:=IF(['03.Muestra'.$D$40]=0;0;COUNTBLANK([.$D184]:INDIRECT("$D" &  SUM(ROW()-1;['03.Muestra'.$D$40])-1))) -> 0
B186: of:=IF( ISBLANK([$'03.Muestra'.$C$10]);"";[$'03.Muestra'.$C$10]) ->  | C186: of:=IF( ISBLANK([$'03.Muestra'.$E$10]);"";[$'03.Muestra'.$E$10]) ->  | D186: of:=IF(AND([.B186]<>"";[.C186]<>"");"N/T";"") ->  | E186: of:=IF([.D186]<>"";IF(AND([.B186]<>"";[.C186]<>"");"";"ERR");"") -> 
B187: of:=IF( ISBLANK([$'03.Muestra'.$C$11]);"";[$'03.Muestra'.$C$11]) ->  | C187: of:=IF( ISBLANK([$'03.Muestra'.$E$11]);"";[$'03.Muestra'.$E$11]) ->  | D187: of:=IF(AND([.B187]<>"";[.C187]<>"");"N/T";"") ->  | E187: of:=IF([.D187]<>"";IF(AND([.B187]<>"";[.C187]<>"");"";"ERR");"") -> 
B188: of:=IF( ISBLANK([$'03.Muestra'.$C$12]);"";[$'03.Muestra'.$C$12]) ->  | C188: of:=IF( ISBLANK([$'03.Muestra'.$E$12]);"";[$'03.Muestra'.$E$12]) ->  | D188: of:=IF(AND([.B188]<>"";[.C188]<>"");"N/T";"") ->  | E188: of:=IF([.D188]<>"";IF(AND([.B188]<>"";[.C188]<>"");"";"ERR");"") -> 
B189: of:=IF( ISBLANK([$'03.Muestra'.$C$13]);"";[$'03.Muestra'.$C$13]) ->  | C189: of:=IF( ISBLANK([$'03.Muestra'.$E$13]);"";[$'03.Muestra'.$E$13]) ->  | D189: of:=IF(AND([.B189]<>"";[.C189]<>"");"N/T";"") ->  | E189: of:=IF([.D189]<>"";IF(AND([.B189]<>"";[.C189]<>"");"";"ERR");"") -> 
B190: of:=IF( ISBLANK([$'03.Muestra'.$C$14]);"";[$'03.Muestra'.$C$14]) ->  | C190: of:=IF( ISBLANK([$'03.Muestra'.$E$14]);"";[$'03.Muestra'.$E$14]) ->  | D190: of:=IF(AND([.B190]<>"";[.C190]<>"");"N/T";"") ->  | E190: of:=IF([.D190]<>"";IF(AND([.B190]<>"";[.C190]<>"");"";"ERR");"") -> 
B191: of:=IF( ISBLANK([$'03.Muestra'.$C$15]);"";[$'03.Muestra'.$C$15]) ->  | C191: of:=IF( ISBLANK([$'03.Muestra'.$E$15]);"";[$'03.Muestra'.$E$15]) ->  | D191: of:=IF(AND([.B191]<>"";[.C191]<>"");"N/T";"") ->  | E191: of:=IF([.D191]<>"";IF(AND([.B191]<>"";[.C191]<>"");"";"ERR");"") -> 
B192: of:=IF( ISBLANK([$'03.Muestra'.$C$16]);"";[$'03.Muestra'.$C$16]) ->  | C192: of:=IF( ISBLANK([$'03.Muestra'.$E$16]);"";[$'03.Muestra'.$E$16]) ->  | D192: of:=IF(AND([.B192]<>"";[.C192]<>"");"N/T";"") ->  | E192: of:=IF([.D192]<>"";IF(AND([.B192]<>"";[.C192]<>"");"";"ERR");"") -> 
B193: of:=IF( ISBLANK([$'03.Muestra'.$C$17]);"";[$'03.Muestra'.$C$17]) ->  | C193: of:=IF( ISBLANK([$'03.Muestra'.$E$17]);"";[$'03.Muestra'.$E$17]) ->  | D193: of:=IF(AND([.B193]<>"";[.C193]<>"");"N/T";"") ->  | E193: of:=IF([.D193]<>"";IF(AND([.B193]<>"";[.C193]<>"");"";"ERR");"") -> 
B194: of:=IF( ISBLANK([$'03.Muestra'.$C$18]);"";[$'03.Muestra'.$C$18]) ->  | C194: of:=IF( ISBLANK([$'03.Muestra'.$E$18]);"";[$'03.Muestra'.$E$18]) ->  | D194: of:=IF(AND([.B194]<>"";[.C194]<>"");"N/T";"") ->  | E194: of:=IF([.D194]<>"";IF(AND([.B194]<>"";[.C194]<>"");"";"ERR");"") -> 
B195: of:=IF( ISBLANK([$'03.Muestra'.$C$19]);"";[$'03.Muestra'.$C$19]) ->  | C195: of:=IF( ISBLANK([$'03.Muestra'.$E$19]);"";[$'03.Muestra'.$E$19]) ->  | D195: of:=IF(AND([.B195]<>"";[.C195]<>"");"N/T";"") ->  | E195: of:=IF([.D195]<>"";IF(AND([.B195]<>"";[.C195]<>"");"";"ERR");"") -> 
B196: of:=IF( ISBLANK([$'03.Muestra'.$C$20]);"";[$'03.Muestra'.$C$20]) ->  | C196: of:=IF( ISBLANK([$'03.Muestra'.$E$20]);"";[$'03.Muestra'.$E$20]) ->  | D196: of:=IF(AND([.B196]<>"";[.C196]<>"");"N/T";"") ->  | E196: of:=IF([.D196]<>"";IF(AND([.B196]<>"";[.C196]<>"");"";"ERR");"") -> 
B197: of:=IF( ISBLANK([$'03.Muestra'.$C$21]);"";[$'03.Muestra'.$C$21]) ->  | C197: of:=IF( ISBLANK([$'03.Muestra'.$E$21]);"";[$'03.Muestra'.$E$21]) ->  | D197: of:=IF(AND([.B197]<>"";[.C197]<>"");"N/T";"") ->  | E197: of:=IF([.D197]<>"";IF(AND([.B197]<>"";[.C197]<>"");"";"ERR");"") -> 
B198: of:=IF( ISBLANK([$'03.Muestra'.$C$22]);"";[$'03.Muestra'.$C$22]) ->  | C198: of:=IF( ISBLANK([$'03.Muestra'.$E$22]);"";[$'03.Muestra'.$E$22]) ->  | D198: of:=IF(AND([.B198]<>"";[.C198]<>"");"N/T";"") ->  | E198: of:=IF([.D198]<>"";IF(AND([.B198]<>"";[.C198]<>"");"";"ERR");"") -> 
B199: of:=IF( ISBLANK([$'03.Muestra'.$C$23]);"";[$'03.Muestra'.$C$23]) ->  | C199: of:=IF( ISBLANK([$'03.Muestra'.$E$23]);"";[$'03.Muestra'.$E$23]) ->  | D199: of:=IF(AND([.B199]<>"";[.C199]<>"");"N/T";"") ->  | E199: of:=IF([.D199]<>"";IF(AND([.B199]<>"";[.C199]<>"");"";"ERR");"") -> 
B200: of:=IF( ISBLANK([$'03.Muestra'.$C$24]);"";[$'03.Muestra'.$C$24]) ->  | C200: of:=IF( ISBLANK([$'03.Muestra'.$E$24]);"";[$'03.Muestra'.$E$24]) ->  | D200: of:=IF(AND([.B200]<>"";[.C200]<>"");"N/T";"") ->  | E200: of:=IF([.D200]<>"";IF(AND([.B200]<>"";[.C200]<>"");"";"ERR");"") -> 
B201: of:=IF( ISBLANK([$'03.Muestra'.$C$25]);"";[$'03.Muestra'.$C$25]) ->  | C201: of:=IF( ISBLANK([$'03.Muestra'.$E$25]);"";[$'03.Muestra'.$E$25]) ->  | D201: of:=IF(AND([.B201]<>"";[.C201]<>"");"N/T";"") ->  | E201: of:=IF([.D201]<>"";IF(AND([.B201]<>"";[.C201]<>"");"";"ERR");"") -> 
B202: of:=IF( ISBLANK([$'03.Muestra'.$C$26]);"";[$'03.Muestra'.$C$26]) ->  | C202: of:=IF( ISBLANK([$'03.Muestra'.$E$26]);"";[$'03.Muestra'.$E$26]) ->  | D202: of:=IF(AND([.B202]<>"";[.C202]<>"");"N/T";"") ->  | E202: of:=IF([.D202]<>"";IF(AND([.B202]<>"";[.C202]<>"");"";"ERR");"") -> 
B203: of:=IF( ISBLANK([$'03.Muestra'.$C$27]);"";[$'03.Muestra'.$C$27]) ->  | C203: of:=IF( ISBLANK([$'03.Muestra'.$E$27]);"";[$'03.Muestra'.$E$27]) ->  | D203: of:=IF(AND([.B203]<>"";[.C203]<>"");"N/T";"") ->  | E203: of:=IF([.D203]<>"";IF(AND([.B203]<>"";[.C203]<>"");"";"ERR");"") -> 
B204: of:=IF( ISBLANK([$'03.Muestra'.$C$28]);"";[$'03.Muestra'.$C$28]) ->  | C204: of:=IF( ISBLANK([$'03.Muestra'.$E$28]);"";[$'03.Muestra'.$E$28]) ->  | D204: of:=IF(AND([.B204]<>"";[.C204]<>"");"N/T";"") ->  | E204: of:=IF([.D204]<>"";IF(AND([.B204]<>"";[.C204]<>"");"";"ERR");"") -> 
B205: of:=IF( ISBLANK([$'03.Muestra'.$C$29]);"";[$'03.Muestra'.$C$29]) ->  | C205: of:=IF( ISBLANK([$'03.Muestra'.$E$29]);"";[$'03.Muestra'.$E$29]) ->  | D205: of:=IF(AND([.B205]<>"";[.C205]<>"");"N/T";"") ->  | E205: of:=IF([.D205]<>"";IF(AND([.B205]<>"";[.C205]<>"");"";"ERR");"") -> 
B206: of:=IF( ISBLANK([$'03.Muestra'.$C$30]);"";[$'03.Muestra'.$C$30]) ->  | C206: of:=IF( ISBLANK([$'03.Muestra'.$E$30]);"";[$'03.Muestra'.$E$30]) ->  | D206: of:=IF(AND([.B206]<>"";[.C206]<>"");"N/T";"") ->  | E206: of:=IF([.D206]<>"";IF(AND([.B206]<>"";[.C206]<>"");"";"ERR");"") -> 
B207: of:=IF( ISBLANK([$'03.Muestra'.$C$31]);"";[$'03.Muestra'.$C$31]) ->  | C207: of:=IF( ISBLANK([$'03.Muestra'.$E$31]);"";[$'03.Muestra'.$E$31]) ->  | D207: of:=IF(AND([.B207]<>"";[.C207]<>"");"N/T";"") ->  | E207: of:=IF([.D207]<>"";IF(AND([.B207]<>"";[.C207]<>"");"";"ERR");"") -> 
B208: of:=IF( ISBLANK([$'03.Muestra'.$C$32]);"";[$'03.Muestra'.$C$32]) ->  | C208: of:=IF( ISBLANK([$'03.Muestra'.$E$32]);"";[$'03.Muestra'.$E$32]) ->  | D208: of:=IF(AND([.B208]<>"";[.C208]<>"");"N/T";"") ->  | E208: of:=IF([.D208]<>"";IF(AND([.B208]<>"";[.C208]<>"");"";"ERR");"") -> 
B209: of:=IF( ISBLANK([$'03.Muestra'.$C$33]);"";[$'03.Muestra'.$C$33]) ->  | C209: of:=IF( ISBLANK([$'03.Muestra'.$E$33]);"";[$'03.Muestra'.$E$33]) ->  | D209: of:=IF(AND([.B209]<>"";[.C209]<>"");"N/T";"") ->  | E209: of:=IF([.D209]<>"";IF(AND([.B209]<>"";[.C209]<>"");"";"ERR");"") -> 
B210: of:=IF( ISBLANK([$'03.Muestra'.$C$34]);"";[$'03.Muestra'.$C$34]) ->  | C210: of:=IF( ISBLANK([$'03.Muestra'.$E$34]);"";[$'03.Muestra'.$E$34]) ->  | D210: of:=IF(AND([.B210]<>"";[.C210]<>"");"N/T";"") ->  | E210: of:=IF([.D210]<>"";IF(AND([.B210]<>"";[.C210]<>"");"";"ERR");"") -> 
B211: of:=IF( ISBLANK([$'03.Muestra'.$C$35]);"";[$'03.Muestra'.$C$35]) ->  | C211: of:=IF( ISBLANK([$'03.Muestra'.$E$35]);"";[$'03.Muestra'.$E$35]) ->  | D211: of:=IF(AND([.B211]<>"";[.C211]<>"");"N/T";"") ->  | E211: of:=IF([.D211]<>"";IF(AND([.B211]<>"";[.C211]<>"");"";"ERR");"") -> 
B212: of:=IF( ISBLANK([$'03.Muestra'.$C$36]);"";[$'03.Muestra'.$C$36]) ->  | C212: of:=IF( ISBLANK([$'03.Muestra'.$E$36]);"";[$'03.Muestra'.$E$36]) ->  | D212: of:=IF(AND([.B212]<>"";[.C212]<>"");"N/T";"") ->  | E212: of:=IF([.D212]<>"";IF(AND([.B212]<>"";[.C212]<>"");"";"ERR");"") -> 
B213: of:=IF( ISBLANK([$'03.Muestra'.$C$37]);"";[$'03.Muestra'.$C$37]) ->  | C213: of:=IF( ISBLANK([$'03.Muestra'.$E$37]);"";[$'03.Muestra'.$E$37]) ->  | D213: of:=IF(AND([.B213]<>"";[.C213]<>"");"N/T";"") ->  | E213: of:=IF([.D213]<>"";IF(AND([.B213]<>"";[.C213]<>"");"";"ERR");"") -> 
B216: A | C216: 1.3.1 InformaciÃ³n y relaciones | D216: Resultado
B217: of:=IF( ISBLANK([$'03.Muestra'.$C$8]);"";[$'03.Muestra'.$C$8]) ->  | C217: of:=IF( ISBLANK([$'03.Muestra'.$E$8]);"";[$'03.Muestra'.$E$8]) ->  | D217: of:=IF(AND([.B217]<>"";[.C217]<>"");"N/T";"") ->  | E217: of:=IF([.D217]<>"";IF(AND([.B217]<>"";[.C217]<>"");"";"ERR");"") ->  | F217: of:=TRANSPOSE([$'DATA - Oculta'.$U$9:$'DATA - Oculta'.$U$13]) -> N/T | G217: N/D | H217: N/A | I217: Falla | J217: Pasa | K217: En blanco
B218: of:=IF( ISBLANK([$'03.Muestra'.$C$9]);"";[$'03.Muestra'.$C$9]) ->  | C218: of:=IF( ISBLANK([$'03.Muestra'.$E$9]);"";[$'03.Muestra'.$E$9]) ->  | D218: of:=IF(AND([.B218]<>"";[.C218]<>"");"N/T";"") ->  | E218: of:=IF([.D218]<>"";IF(AND([.B218]<>"";[.C218]<>"");"";"ERR");"") ->  | F218: of:=COUNTIF([.$D217]:INDIRECT("$D" &  SUM(ROW()-1;['03.Muestra'.$D$40])-1);[.F217]) -> 0 | G218: of:=COUNTIF([.$D217]:INDIRECT("$D" &  SUM(ROW()-1;['03.Muestra'.$D$40])-1);[.G217]) -> 0 | H218: of:=COUNTIF([.$D217]:INDIRECT("$D" &  SUM(ROW()-1;['03.Muestra'.$D$40])-1);[.H217]) -> 0 | I218: of:=COUNTIF([.$D217]:INDIRECT("$D" &  SUM(ROW()-1;['03.Muestra'.$D$40])-1);[.I217]) -> 0 | J218: of:=COUNTIF([.$D217]:INDIRECT("$D" &  SUM(ROW()-1;['03.Muestra'.$D$40])-1);[.J217]) -> 0 | K218: of:=IF(['03.Muestra'.$D$40]=0;0;COUNTBLANK([.$D217]:INDIRECT("$D" &  SUM(ROW()-1;['03.Muestra'.$D$40])-1))) -> 0
B219: of:=IF( ISBLANK([$'03.Muestra'.$C$10]);"";[$'03.Muestra'.$C$10]) ->  | C219: of:=IF( ISBLANK([$'03.Muestra'.$E$10]);"";[$'03.Muestra'.$E$10]) ->  | D219: of:=IF(AND([.B219]<>"";[.C219]<>"");"N/T";"") ->  | E219: of:=IF([.D219]<>"";IF(AND([.B219]<>"";[.C219]<>"");"";"ERR");"") -> 
B220: of:=IF( ISBLANK([$'03.Muestra'.$C$11]);"";[$'03.Muestra'.$C$11]) ->  | C220: of:=IF( ISBLANK([$'03.Muestra'.$E$11]);"";[$'03.Muestra'.$E$11]) ->  | D220: of:=IF(AND([.B220]<>"";[.C220]<>"");"N/T";"") ->  | E220: of:=IF([.D220]<>"";IF(AND([.B220]<>"";[.C220]<>"");"";"ERR");"") -> 
B221: of:=IF( ISBLANK([$'03.Muestra'.$C$12]);"";[$'03.Muestra'.$C$12]) ->  | C221: of:=IF( ISBLANK([$'03.Muestra'.$E$12]);"";[$'03.Muestra'.$E$12]) ->  | D221: of:=IF(AND([.B221]<>"";[.C221]<>"");"N/T";"") ->  | E221: of:=IF([.D221]<>"";IF(AND([.B221]<>"";[.C221]<>"");"";"ERR");"") -> 
B222: of:=IF( ISBLANK([$'03.Muestra'.$C$13]);"";[$'03.Muestra'.$C$13]) ->  | C222: of:=IF( ISBLANK([$'03.Muestra'.$E$13]);"";[$'03.Muestra'.$E$13]) ->  | D222: of:=IF(AND([.B222]<>"";[.C222]<>"");"N/T";"") ->  | E222: of:=IF([.D222]<>"";IF(AND([.B222]<>"";[.C222]<>"");"";"ERR");"") -> 
B223: of:=IF( ISBLANK([$'03.Muestra'.$C$14]);"";[$'03.Muestra'.$C$14]) ->  | C223: of:=IF( ISBLANK([$'03.Muestra'.$E$14]);"";[$'03.Muestra'.$E$14]) ->  | D223: of:=IF(AND([.B223]<>"";[.C223]<>"");"N/T";"") ->  | E223: of:=IF([.D223]<>"";IF(AND([.B223]<>"";[.C223]<>"");"";"ERR");"") -> 
B224: of:=IF( ISBLANK([$'03.Muestra'.$C$15]);"";[$'03.Muestra'.$C$15]) ->  | C224: of:=IF( ISBLANK([$'03.Muestra'.$E$15]);"";[$'03.Muestra'.$E$15]) ->  | D224: of:=IF(AND([.B224]<>"";[.C224]<>"");"N/T";"") ->  | E224: of:=IF([.D224]<>"";IF(AND([.B224]<>"";[.C224]<>"");"";"ERR");"") -> 
B225: of:=IF( ISBLANK([$'03.Muestra'.$C$16]);"";[$'03.Muestra'.$C$16]) ->  | C225: of:=IF( ISBLANK([$'03.Muestra'.$E$16]);"";[$'03.Muestra'.$E$16]) ->  | D225: of:=IF(AND([.B225]<>"";[.C225]<>"");"N/T";"") ->  | E225: of:=IF([.D225]<>"";IF(AND([.B225]<>"";[.C225]<>"");"";"ERR");"") -> 
B226: of:=IF( ISBLANK([$'03.Muestra'.$C$17]);"";[$'03.Muestra'.$C$17]) ->  | C226: of:=IF( ISBLANK([$'03.Muestra'.$E$17]);"";[$'03.Muestra'.$E$17]) ->  | D226: of:=IF(AND([.B226]<>"";[.C226]<>"");"N/T";"") ->  | E226: of:=IF([.D226]<>"";IF(AND([.B226]<>"";[.C226]<>"");"";"ERR");"") -> 
B227: of:=IF( ISBLANK([$'03.Muestra'.$C$18]);"";[$'03.Muestra'.$C$18]) ->  | C227: of:=IF( ISBLANK([$'03.Muestra'.$E$18]);"";[$'03.Muestra'.$E$18]) ->  | D227: of:=IF(AND([.B227]<>"";[.C227]<>"");"N/T";"") ->  | E227: of:=IF([.D227]<>"";IF(AND([.B227]<>"";[.C227]<>"");"";"ERR");"") -> 
B228: of:=IF( ISBLANK([$'03.Muestra'.$C$19]);"";[$'03.Muestra'.$C$19]) ->  | C228: of:=IF( ISBLANK([$'03.Muestra'.$E$19]);"";[$'03.Muestra'.$E$19]) ->  | D228: of:=IF(AND([.B228]<>"";[.C228]<>"");"N/T";"") ->  | E228: of:=IF([.D228]<>"";IF(AND([.B228]<>"";[.C228]<>"");"";"ERR");"") -> 
B229: of:=IF( ISBLANK([$'03.Muestra'.$C$20]);"";[$'03.Muestra'.$C$20]) ->  | C229: of:=IF( ISBLANK([$'03.Muestra'.$E$20]);"";[$'03.Muestra'.$E$20]) ->  | D229: of:=IF(AND([.B229]<>"";[.C229]<>"");"N/T";"") ->  | E229: of:=IF([.D229]<>"";IF(AND([.B229]<>"";[.C229]<>"");"";"ERR");"") -> 
B230: of:=IF( ISBLANK([$'03.Muestra'.$C$21]);"";[$'03.Muestra'.$C$21]) ->  | C230: of:=IF( ISBLANK([$'03.Muestra'.$E$21]);"";[$'03.Muestra'.$E$21]) ->  | D230: of:=IF(AND([.B230]<>"";[.C230]<>"");"N/T";"") ->  | E230: of:=IF([.D230]<>"";IF(AND([.B230]<>"";[.C230]<>"");"";"ERR");"") -> 
B231: of:=IF( ISBLANK([$'03.Muestra'.$C$22]);"";[$'03.Muestra'.$C$22]) ->  | C231: of:=IF( ISBLANK([$'03.Muestra'.$E$22]);"";[$'03.Muestra'.$E$22]) ->  | D231: of:=IF(AND([.B231]<>"";[.C231]<>"");"N/T";"") ->  | E231: of:=IF([.D231]<>"";IF(AND([.B231]<>"";[.C231]<>"");"";"ERR");"") -> 
B232: of:=IF( ISBLANK([$'03.Muestra'.$C$23]);"";[$'03.Muestra'.$C$23]) ->  | C232: of:=IF( ISBLANK([$'03.Muestra'.$E$23]);"";[$'03.Muestra'.$E$23]) ->  | D232: of:=IF(AND([.B232]<>"";[.C232]<>"");"N/T";"") ->  | E232: of:=IF([.D232]<>"";IF(AND([.B232]<>"";[.C232]<>"");"";"ERR");"") -> 
B233: of:=IF( ISBLANK([$'03.Muestra'.$C$24]);"";[$'03.Muestra'.$C$24]) ->  | C233: of:=IF( ISBLANK([$'03.Muestra'.$E$24]);"";[$'03.Muestra'.$E$24]) ->  | D233: of:=IF(AND([.B233]<>"";[.C233]<>"");"N/T";"") ->  | E233: of:=IF([.D233]<>"";IF(AND([.B233]<>"";[.C233]<>"");"";"ERR");"") -> 
B234: of:=IF( ISBLANK([$'03.Muestra'.$C$25]);"";[$'03.Muestra'.$C$25]) ->  | C234: of:=IF( ISBLANK([$'03.Muestra'.$E$25]);"";[$'03.Muestra'.$E$25]) ->  | D234: of:=IF(AND([.B234]<>"";[.C234]<>"");"N/T";"") ->  | E234: of:=IF([.D234]<>"";IF(AND([.B234]<>"";[.C234]<>"");"";"ERR");"") -> 
B235: of:=IF( ISBLANK([$'03.Muestra'.$C$26]);"";[$'03.Muestra'.$C$26]) ->  | C235: of:=IF( ISBLANK([$'03.Muestra'.$E$26]);"";[$'03.Muestra'.$E$26]) ->  | D235: of:=IF(AND([.B235]<>"";[.C235]<>"");"N/T";"") ->  | E235: of:=IF([.D235]<>"";IF(AND([.B235]<>"";[.C235]<>"");"";"ERR");"") -> 
B236: of:=IF( ISBLANK([$'03.Muestra'.$C$27]);"";[$'03.Muestra'.$C$27]) ->  | C236: of:=IF( ISBLANK([$'03.Muestra'.$E$27]);"";[$'03.Muestra'.$E$27]) ->  | D236: of:=IF(AND([.B236]<>"";[.C236]<>"");"N/T";"") ->  | E236: of:=IF([.D236]<>"";IF(AND([.B236]<>"";[.C236]<>"");"";"ERR");"") -> 
B237: of:=IF( ISBLANK([$'03.Muestra'.$C$28]);"";[$'03.Muestra'.$C$28]) ->  | C237: of:=IF( ISBLANK([$'03.Muestra'.$E$28]);"";[$'03.Muestra'.$E$28]) ->  | D237: of:=IF(AND([.B237]<>"";[.C237]<>"");"N/T";"") ->  | E237: of:=IF([.D237]<>"";IF(AND([.B237]<>"";[.C237]<>"");"";"ERR");"") -> 
B238: of:=IF( ISBLANK([$'03.Muestra'.$C$29]);"";[$'03.Muestra'.$C$29]) ->  | C238: of:=IF( ISBLANK([$'03.Muestra'.$E$29]);"";[$'03.Muestra'.$E$29]) ->  | D238: of:=IF(AND([.B238]<>"";[.C238]<>"");"N/T";"") ->  | E238: of:=IF([.D238]<>"";IF(AND([.B238]<>"";[.C238]<>"");"";"ERR");"") -> 
B239: of:=IF( ISBLANK([$'03.Muestra'.$C$30]);"";[$'03.Muestra'.$C$30]) ->  | C239: of:=IF( ISBLANK([$'03.Muestra'.$E$30]);"";[$'03.Muestra'.$E$30]) ->  | D239: of:=IF(AND([.B239]<>"";[.C239]<>"");"N/T";"") ->  | E239: of:=IF([.D239]<>"";IF(AND([.B239]<>"";[.C239]<>"");"";"ERR");"") -> 
B240: of:=IF( ISBLANK([$'03.Muestra'.$C$31]);"";[$'03.Muestra'.$C$31]) ->  | C240: of:=IF( ISBLANK([$'03.Muestra'.$E$31]);"";[$'03.Muestra'.$E$31]) ->  | D240: of:=IF(AND([.B240]<>"";[.C240]<>"");"N/T";"") ->  | E240: of:=IF([.D240]<>"";IF(AND([.B240]<>"";[.C240]<>"");"";"ERR");"") -> 
B241: of:=IF( ISBLANK([$'03.Muestra'.$C$32]);"";[$'03.Muestra'.$C$32]) ->  | C241: of:=IF( ISBLANK([$'03.Muestra'.$E$32]);"";[$'03.Muestra'.$E$32]) ->  | D241: of:=IF(AND([.B241]<>"";[.C241]<>"");"N/T";"") ->  | E241: of:=IF([.D241]<>"";IF(AND([.B241]<>"";[.C241]<>"");"";"ERR");"") -> 
B242: of:=IF( ISBLANK([$'03.Muestra'.$C$33]);"";[$'03.Muestra'.$C$33]) ->  | C242: of:=IF( ISBLANK([$'03.Muestra'.$E$33]);"";[$'03.Muestra'.$E$33]) ->  | D242: of:=IF(AND([.B242]<>"";[.C242]<>"");"N/T";"") ->  | E242: of:=IF([.D242]<>"";IF(AND([.B242]<>"";[.C242]<>"");"";"ERR");"") -> 
B243: of:=IF( ISBLANK([$'03.Muestra'.$C$34]);"";[$'03.Muestra'.$C$34]) ->  | C243: of:=IF( ISBLANK([$'03.Muestra'.$E$34]);"";[$'03.Muestra'.$E$34]) ->  | D243: of:=IF(AND([.B243]<>"";[.C243]<>"");"N/T";"") ->  | E243: of:=IF([.D243]<>"";IF(AND([.B243]<>"";[.C243]<>"");"";"ERR");"") -> 
B244: of:=IF( ISBLANK([$'03.Muestra'.$C$35]);"";[$'03.Muestra'.$C$35]) ->  | C244: of:=IF( ISBLANK([$'03.Muestra'.$E$35]);"";[$'03.Muestra'.$E$35]) ->  | D244: of:=IF(AND([.B244]<>"";[.C244]<>"");"N/T";"") ->  | E244: of:=IF([.D244]<>"";IF(AND([.B244]<>"";[.C244]<>"");"";"ERR");"") -> 
B245: of:=IF( ISBLANK([$'03.Muestra'.$C$36]);"";[$'03.Muestra'.$C$36]) ->  | C245: of:=IF( ISBLANK([$'03.Muestra'.$E$36]);"";[$'03.Muestra'.$E$36]) ->  | D245: of:=IF(AND([.B245]<>"";[.C245]<>"");"N/T";"") ->  | E245: of:=IF([.D245]<>"";IF(AND([.B245]<>"";[.C245]<>"");"";"ERR");"") -> 
B246: of:=IF( ISBLANK([$'03.Muestra'.$C$37]);"";[$'03.Muestra'.$C$37]) ->  | C246: of:=IF( ISBLANK([$'03.Muestra'.$E$37]);"";[$'03.Muestra'.$E$37]) ->  | D246: of:=IF(AND([.B246]<>"";[.C246]<>"");"N/T";"") ->  | E246: of:=IF([.D246]<>"";IF(AND([.B246]<>"";[.C246]<>"");"";"ERR");"") -> 
B249: A | C249: 1.3.2 Secuencia significativa | D249: Resultado
B250: of:=IF( ISBLANK([$'03.Muestra'.$C$8]);"";[$'03.Muestra'.$C$8]) ->  | C250: of:=IF( ISBLANK([$'03.Muestra'.$E$8]);"";[$'03.Muestra'.$E$8]) ->  | D250: of:=IF(AND([.B250]<>"";[.C250]<>"");"N/T";"") ->  | E250: of:=IF([.D250]<>"";IF(AND([.B250]<>"";[.C250]<>"");"";"ERR");"") ->  | F250: of:=TRANSPOSE([$'DATA - Oculta'.$U$9:$'DATA - Oculta'.$U$13]) -> N/T | G250: N/D | H250: N/A | I250: Falla | J250: Pasa | K250: En blanco
B251: of:=IF( ISBLANK([$'03.Muestra'.$C$9]);"";[$'03.Muestra'.$C$9]) ->  | C251: of:=IF( ISBLANK([$'03.Muestra'.$E$9]);"";[$'03.Muestra'.$E$9]) ->  | D251: of:=IF(AND([.B251]<>"";[.C251]<>"");"N/T";"") ->  | E251: of:=IF([.D251]<>"";IF(AND([.B251]<>"";[.C251]<>"");"";"ERR");"") ->  | F251: of:=COUNTIF([.$D250]:INDIRECT("$D" &  SUM(ROW()-1;['03.Muestra'.$D$40])-1);[.F250]) -> 0 | G251: of:=COUNTIF([.$D250]:INDIRECT("$D" &  SUM(ROW()-1;['03.Muestra'.$D$40])-1);[.G250]) -> 0 | H251: of:=COUNTIF([.$D250]:INDIRECT("$D" &  SUM(ROW()-1;['03.Muestra'.$D$40])-1);[.H250]) -> 0 | I251: of:=COUNTIF([.$D250]:INDIRECT("$D" &  SUM(ROW()-1;['03.Muestra'.$D$40])-1);[.I250]) -> 0 | J251: of:=COUNTIF([.$D250]:INDIRECT("$D" &  SUM(ROW()-1;['03.Muestra'.$D$40])-1);[.J250]) -> 0 | K251: of:=IF(['03.Muestra'.$D$40]=0;0;COUNTBLANK([.$D250]:INDIRECT("$D" &  SUM(ROW()-1;['03.Muestra'.$D$40])-1))) -> 0
B252: of:=IF( ISBLANK([$'03.Muestra'.$C$10]);"";[$'03.Muestra'.$C$10]) ->  | C252: of:=IF( ISBLANK([$'03.Muestra'.$E$10]);"";[$'03.Muestra'.$E$10]) ->  | D252: of:=IF(AND([.B252]<>"";[.C252]<>"");"N/T";"") ->  | E252: of:=IF([.D252]<>"";IF(AND([.B252]<>"";[.C252]<>"");"";"ERR");"") -> 
B253: of:=IF( ISBLANK([$'03.Muestra'.$C$11]);"";[$'03.Muestra'.$C$11]) ->  | C253: of:=IF( ISBLANK([$'03.Muestra'.$E$11]);"";[$'03.Muestra'.$E$11]) ->  | D253: of:=IF(AND([.B253]<>"";[.C253]<>"");"N/T";"") ->  | E253: of:=IF([.D253]<>"";IF(AND([.B253]<>"";[.C253]<>"");"";"ERR");"") -> 
B254: of:=IF( ISBLANK([$'03.Muestra'.$C$12]);"";[$'03.Muestra'.$C$12]) ->  | C254: of:=IF( ISBLANK([$'03.Muestra'.$E$12]);"";[$'03.Muestra'.$E$12]) ->  | D254: of:=IF(AND([.B254]<>"";[.C254]<>"");"N/T";"") ->  | E254: of:=IF([.D254]<>"";IF(AND([.B254]<>"";[.C254]<>"");"";"ERR");"") -> 
B255: of:=IF( ISBLANK([$'03.Muestra'.$C$13]);"";[$'03.Muestra'.$C$13]) ->  | C255: of:=IF( ISBLANK([$'03.Muestra'.$E$13]);"";[$'03.Muestra'.$E$13]) ->  | D255: of:=IF(AND([.B255]<>"";[.C255]<>"");"N/T";"") ->  | E255: of:=IF([.D255]<>"";IF(AND([.B255]<>"";[.C255]<>"");"";"ERR");"") -> 
B256: of:=IF( ISBLANK([$'03.Muestra'.$C$14]);"";[$'03.Muestra'.$C$14]) ->  | C256: of:=IF( ISBLANK([$'03.Muestra'.$E$14]);"";[$'03.Muestra'.$E$14]) ->  | D256: of:=IF(AND([.B256]<>"";[.C256]<>"");"N/T";"") ->  | E256: of:=IF([.D256]<>"";IF(AND([.B256]<>"";[.C256]<>"");"";"ERR");"") -> 
B257: of:=IF( ISBLANK([$'03.Muestra'.$C$15]);"";[$'03.Muestra'.$C$15]) ->  | C257: of:=IF( ISBLANK([$'03.Muestra'.$E$15]);"";[$'03.Muestra'.$E$15]) ->  | D257: of:=IF(AND([.B257]<>"";[.C257]<>"");"N/T";"") ->  | E257: of:=IF([.D257]<>"";IF(AND([.B257]<>"";[.C257]<>"");"";"ERR");"") -> 
B258: of:=IF( ISBLANK([$'03.Muestra'.$C$16]);"";[$'03.Muestra'.$C$16]) ->  | C258: of:=IF( ISBLANK([$'03.Muestra'.$E$16]);"";[$'03.Muestra'.$E$16]) ->  | D258: of:=IF(AND([.B258]<>"";[.C258]<>"");"N/T";"") ->  | E258: of:=IF([.D258]<>"";IF(AND([.B258]<>"";[.C258]<>"");"";"ERR");"") -> 
B259: of:=IF( ISBLANK([$'03.Muestra'.$C$17]);"";[$'03.Muestra'.$C$17]) ->  | C259: of:=IF( ISBLANK([$'03.Muestra'.$E$17]);"";[$'03.Muestra'.$E$17]) ->  | D259: of:=IF(AND([.B259]<>"";[.C259]<>"");"N/T";"") ->  | E259: of:=IF([.D259]<>"";IF(AND([.B259]<>"";[.C259]<>"");"";"ERR");"") -> 
B260: of:=IF( ISBLANK([$'03.Muestra'.$C$18]);"";[$'03.Muestra'.$C$18]) ->  | C260: of:=IF( ISBLANK([$'03.Muestra'.$E$18]);"";[$'03.Muestra'.$E$18]) ->  | D260: of:=IF(AND([.B260]<>"";[.C260]<>"");"N/T";"") ->  | E260: of:=IF([.D260]<>"";IF(AND([.B260]<>"";[.C260]<>"");"";"ERR");"") -> 
B261: of:=IF( ISBLANK([$'03.Muestra'.$C$19]);"";[$'03.Muestra'.$C$19]) ->  | C261: of:=IF( ISBLANK([$'03.Muestra'.$E$19]);"";[$'03.Muestra'.$E$19]) ->  | D261: of:=IF(AND([.B261]<>"";[.C261]<>"");"N/T";"") ->  | E261: of:=IF([.D261]<>"";IF(AND([.B261]<>"";[.C261]<>"");"";"ERR");"") -> 
B262: of:=IF( ISBLANK([$'03.Muestra'.$C$20]);"";[$'03.Muestra'.$C$20]) ->  | C262: of:=IF( ISBLANK([$'03.Muestra'.$E$20]);"";[$'03.Muestra'.$E$20]) ->  | D262: of:=IF(AND([.B262]<>"";[.C262]<>"");"N/T";"") ->  | E262: of:=IF([.D262]<>"";IF(AND([.B262]<>"";[.C262]<>"");"";"ERR");"") -> 
B263: of:=IF( ISBLANK([$'03.Muestra'.$C$21]);"";[$'03.Muestra'.$C$21]) ->  | C263: of:=IF( ISBLANK([$'03.Muestra'.$E$21]);"";[$'03.Muestra'.$E$21]) ->  | D263: of:=IF(AND([.B263]<>"";[.C263]<>"");"N/T";"") ->  | E263: of:=IF([.D263]<>"";IF(AND([.B263]<>"";[.C263]<>"");"";"ERR");"") -> 
B264: of:=IF( ISBLANK([$'03.Muestra'.$C$22]);"";[$'03.Muestra'.$C$22]) ->  | C264: of:=IF( ISBLANK([$'03.Muestra'.$E$22]);"";[$'03.Muestra'.$E$22]) ->  | D264: of:=IF(AND([.B264]<>"";[.C264]<>"");"N/T";"") ->  | E264: of:=IF([.D264]<>"";IF(AND([.B264]<>"";[.C264]<>"");"";"ERR");"") -> 
B265: of:=IF( ISBLANK([$'03.Muestra'.$C$23]);"";[$'03.Muestra'.$C$23]) ->  | C265: of:=IF( ISBLANK([$'03.Muestra'.$E$23]);"";[$'03.Muestra'.$E$23]) ->  | D265: of:=IF(AND([.B265]<>"";[.C265]<>"");"N/T";"") ->  | E265: of:=IF([.D265]<>"";IF(AND([.B265]<>"";[.C265]<>"");"";"ERR");"") -> 
B266: of:=IF( ISBLANK([$'03.Muestra'.$C$24]);"";[$'03.Muestra'.$C$24]) ->  | C266: of:=IF( ISBLANK([$'03.Muestra'.$E$24]);"";[$'03.Muestra'.$E$24]) ->  | D266: of:=IF(AND([.B266]<>"";[.C266]<>"");"N/T";"") ->  | E266: of:=IF([.D266]<>"";IF(AND([.B266]<>"";[.C266]<>"");"";"ERR");"") -> 
B267: of:=IF( ISBLANK([$'03.Muestra'.$C$25]);"";[$'03.Muestra'.$C$25]) ->  | C267: of:=IF( ISBLANK([$'03.Muestra'.$E$25]);"";[$'03.Muestra'.$E$25]) ->  | D267: of:=IF(AND([.B267]<>"";[.C267]<>"");"N/T";"") ->  | E267: of:=IF([.D267]<>"";IF(AND([.B267]<>"";[.C267]<>"");"";"ERR");"") -> 
B268: of:=IF( ISBLANK([$'03.Muestra'.$C$26]);"";[$'03.Muestra'.$C$26]) ->  | C268: of:=IF( ISBLANK([$'03.Muestra'.$E$26]);"";[$'03.Muestra'.$E$26]) ->  | D268: of:=IF(AND([.B268]<>"";[.C268]<>"");"N/T";"") ->  | E268: of:=IF([.D268]<>"";IF(AND([.B268]<>"";[.C268]<>"");"";"ERR");"") -> 
B269: of:=IF( ISBLANK([$'03.Muestra'.$C$27]);"";[$'03.Muestra'.$C$27]) ->  | C269: of:=IF( ISBLANK([$'03.Muestra'.$E$27]);"";[$'03.Muestra'.$E$27]) ->  | D269: of:=IF(AND([.B269]<>"";[.C269]<>"");"N/T";"") ->  | E269: of:=IF([.D269]<>"";IF(AND([.B269]<>"";[.C269]<>"");"";"ERR");"") -> 
B270: of:=IF( ISBLANK([$'03.Muestra'.$C$28]);"";[$'03.Muestra'.$C$28]) ->  | C270: of:=IF( ISBLANK([$'03.Muestra'.$E$28]);"";[$'03.Muestra'.$E$28]) ->  | D270: of:=IF(AND([.B270]<>"";[.C270]<>"");"N/T";"") ->  | E270: of:=IF([.D270]<>"";IF(AND([.B270]<>"";[.C270]<>"");"";"ERR");"") -> 
B271: of:=IF( ISBLANK([$'03.Muestra'.$C$29]);"";[$'03.Muestra'.$C$29]) ->  | C271: of:=IF( ISBLANK([$'03.Muestra'.$E$29]);"";[$'03.Muestra'.$E$29]) ->  | D271: of:=IF(AND([.B271]<>"";[.C271]<>"");"N/T";"") ->  | E271: of:=IF([.D271]<>"";IF(AND([.B271]<>"";[.C271]<>"");"";"ERR");"") -> 
B272: of:=IF( ISBLANK([$'03.Muestra'.$C$30]);"";[$'03.Muestra'.$C$30]) ->  | C272: of:=IF( ISBLANK([$'03.Muestra'.$E$30]);"";[$'03.Muestra'.$E$30]) ->  | D272: of:=IF(AND([.B272]<>"";[.C272]<>"");"N/T";"") ->  | E272: of:=IF([.D272]<>"";IF(AND([.B272]<>"";[.C272]<>"");"";"ERR");"") -> 
B273: of:=IF( ISBLANK([$'03.Muestra'.$C$31]);"";[$'03.Muestra'.$C$31]) ->  | C273: of:=IF( ISBLANK([$'03.Muestra'.$E$31]);"";[$'03.Muestra'.$E$31]) ->  | D273: of:=IF(AND([.B273]<>"";[.C273]<>"");"N/T";"") ->  | E273: of:=IF([.D273]<>"";IF(AND([.B273]<>"";[.C273]<>"");"";"ERR");"") -> 
B274: of:=IF( ISBLANK([$'03.Muestra'.$C$32]);"";[$'03.Muestra'.$C$32]) ->  | C274: of:=IF( ISBLANK([$'03.Muestra'.$E$32]);"";[$'03.Muestra'.$E$32]) ->  | D274: of:=IF(AND([.B274]<>"";[.C274]<>"");"N/T";"") ->  | E274: of:=IF([.D274]<>"";IF(AND([.B274]<>"";[.C274]<>"");"";"ERR");"") -> 
B275: of:=IF( ISBLANK([$'03.Muestra'.$C$33]);"";[$'03.Muestra'.$C$33]) ->  | C275: of:=IF( ISBLANK([$'03.Muestra'.$E$33]);"";[$'03.Muestra'.$E$33]) ->  | D275: of:=IF(AND([.B275]<>"";[.C275]<>"");"N/T";"") ->  | E275: of:=IF([.D275]<>"";IF(AND([.B275]<>"";[.C275]<>"");"";"ERR");"") -> 
B276: of:=IF( ISBLANK([$'03.Muestra'.$C$34]);"";[$'03.Muestra'.$C$34]) ->  | C276: of:=IF( ISBLANK([$'03.Muestra'.$E$34]);"";[$'03.Muestra'.$E$34]) ->  | D276: of:=IF(AND([.B276]<>"";[.C276]<>"");"N/T";"") ->  | E276: of:=IF([.D276]<>"";IF(AND([.B276]<>"";[.C276]<>"");"";"ERR");"") -> 
B277: of:=IF( ISBLANK([$'03.Muestra'.$C$35]);"";[$'03.Muestra'.$C$35]) ->  | C277: of:=IF( ISBLANK([$'03.Muestra'.$E$35]);"";[$'03.Muestra'.$E$35]) ->  | D277: of:=IF(AND([.B277]<>"";[.C277]<>"");"N/T";"") ->  | E277: of:=IF([.D277]<>"";IF(AND([.B277]<>"";[.C277]<>"");"";"ERR");"") -> 
B278: of:=IF( ISBLANK([$'03.Muestra'.$C$36]);"";[$'03.Muestra'.$C$36]) ->  | C278: of:=IF( ISBLANK([$'03.Muestra'.$E$36]);"";[$'03.Muestra'.$E$36]) ->  | D278: of:=IF(AND([.B278]<>"";[.C278]<>"");"N/T";"") ->  | E278: of:=IF([.D278]<>"";IF(AND([.B278]<>"";[.C278]<>"");"";"ERR");"") -> 
B279: of:=IF( ISBLANK([$'03.Muestra'.$C$37]);"";[$'03.Muestra'.$C$37]) ->  | C279: of:=IF( ISBLANK([$'03.Muestra'.$E$37]);"";[$'03.Muestra'.$E$37]) ->  | D279: of:=IF(AND([.B279]<>"";[.C279]<>"");"N/T";"") ->  | E279: of:=IF([.D279]<>"";IF(AND([.B279]<>"";[.C279]<>"");"";"ERR");"") -> 
B282: A | C282: 1.3.3 CaracterÃ­sticas sensoriales | D282: Resultado
B283: of:=IF( ISBLANK([$'03.Muestra'.$C$8]);"";[$'03.Muestra'.$C$8]) ->  | C283: of:=IF( ISBLANK([$'03.Muestra'.$E$8]);"";[$'03.Muestra'.$E$8]) ->  | D283: of:=IF(AND([.B283]<>"";[.C283]<>"");"N/T";"") ->  | E283: of:=IF([.D283]<>"";IF(AND([.B283]<>"";[.C283]<>"");"";"ERR");"") ->  | F283: of:=TRANSPOSE([$'DATA - Oculta'.$U$9:$'DATA - Oculta'.$U$13]) -> N/T | G283: N/D | H283: N/A | I283: Falla | J283: Pasa | K283: En blanco
B284: of:=IF( ISBLANK([$'03.Muestra'.$C$9]);"";[$'03.Muestra'.$C$9]) ->  | C284: of:=IF( ISBLANK([$'03.Muestra'.$E$9]);"";[$'03.Muestra'.$E$9]) ->  | D284: of:=IF(AND([.B284]<>"";[.C284]<>"");"N/T";"") ->  | E284: of:=IF([.D284]<>"";IF(AND([.B284]<>"";[.C284]<>"");"";"ERR");"") ->  | F284: of:=COUNTIF([.$D283]:INDIRECT("$D" &  SUM(ROW()-1;['03.Muestra'.$D$40])-1);[.F283]) -> 0 | G284: of:=COUNTIF([.$D283]:INDIRECT("$D" &  SUM(ROW()-1;['03.Muestra'.$D$40])-1);[.G283]) -> 0 | H284: of:=COUNTIF([.$D283]:INDIRECT("$D" &  SUM(ROW()-1;['03.Muestra'.$D$40])-1);[.H283]) -> 0 | I284: of:=COUNTIF([.$D283]:INDIRECT("$D" &  SUM(ROW()-1;['03.Muestra'.$D$40])-1);[.I283]) -> 0 | J284: of:=COUNTIF([.$D283]:INDIRECT("$D" &  SUM(ROW()-1;['03.Muestra'.$D$40])-1);[.J283]) -> 0 | K284: of:=IF(['03.Muestra'.$D$40]=0;0;COUNTBLANK([.$D283]:INDIRECT("$D" &  SUM(ROW()-1;['03.Muestra'.$D$40])-1))) -> 0
B285: of:=IF( ISBLANK([$'03.Muestra'.$C$10]);"";[$'03.Muestra'.$C$10]) ->  | C285: of:=IF( ISBLANK([$'03.Muestra'.$E$10]);"";[$'03.Muestra'.$E$10]) ->  | D285: of:=IF(AND([.B285]<>"";[.C285]<>"");"N/T";"") ->  | E285: of:=IF([.D285]<>"";IF(AND([.B285]<>"";[.C285]<>"");"";"ERR");"") -> 
B286: of:=IF( ISBLANK([$'03.Muestra'.$C$11]);"";[$'03.Muestra'.$C$11]) ->  | C286: of:=IF( ISBLANK([$'03.Muestra'.$E$11]);"";[$'03.Muestra'.$E$11]) ->  | D286: of:=IF(AND([.B286]<>"";[.C286]<>"");"N/T";"") ->  | E286: of:=IF([.D286]<>"";IF(AND([.B286]<>"";[.C286]<>"");"";"ERR");"") -> 
B287: of:=IF( ISBLANK([$'03.Muestra'.$C$12]);"";[$'03.Muestra'.$C$12]) ->  | C287: of:=IF( ISBLANK([$'03.Muestra'.$E$12]);"";[$'03.Muestra'.$E$12]) ->  | D287: of:=IF(AND([.B287]<>"";[.C287]<>"");"N/T";"") ->  | E287: of:=IF([.D287]<>"";IF(AND([.B287]<>"";[.C287]<>"");"";"ERR");"") -> 
B288: of:=IF( ISBLANK([$'03.Muestra'.$C$13]);"";[$'03.Muestra'.$C$13]) ->  | C288: of:=IF( ISBLANK([$'03.Muestra'.$E$13]);"";[$'03.Muestra'.$E$13]) ->  | D288: of:=IF(AND([.B288]<>"";[.C288]<>"");"N/T";"") ->  | E288: of:=IF([.D288]<>"";IF(AND([.B288]<>"";[.C288]<>"");"";"ERR");"") -> 
B289: of:=IF( ISBLANK([$'03.Muestra'.$C$14]);"";[$'03.Muestra'.$C$14]) ->  | C289: of:=IF( ISBLANK([$'03.Muestra'.$E$14]);"";[$'03.Muestra'.$E$14]) ->  | D289: of:=IF(AND([.B289]<>"";[.C289]<>"");"N/T";"") ->  | E289: of:=IF([.D289]<>"";IF(AND([.B289]<>"";[.C289]<>"");"";"ERR");"") -> 
B290: of:=IF( ISBLANK([$'03.Muestra'.$C$15]);"";[$'03.Muestra'.$C$15]) ->  | C290: of:=IF( ISBLANK([$'03.Muestra'.$E$15]);"";[$'03.Muestra'.$E$15]) ->  | D290: of:=IF(AND([.B290]<>"";[.C290]<>"");"N/T";"") ->  | E290: of:=IF([.D290]<>"";IF(AND([.B290]<>"";[.C290]<>"");"";"ERR");"") -> 
B291: of:=IF( ISBLANK([$'03.Muestra'.$C$16]);"";[$'03.Muestra'.$C$16]) ->  | C291: of:=IF( ISBLANK([$'03.Muestra'.$E$16]);"";[$'03.Muestra'.$E$16]) ->  | D291: of:=IF(AND([.B291]<>"";[.C291]<>"");"N/T";"") ->  | E291: of:=IF([.D291]<>"";IF(AND([.B291]<>"";[.C291]<>"");"";"ERR");"") -> 
B292: of:=IF( ISBLANK([$'03.Muestra'.$C$17]);"";[$'03.Muestra'.$C$17]) ->  | C292: of:=IF( ISBLANK([$'03.Muestra'.$E$17]);"";[$'03.Muestra'.$E$17]) ->  | D292: of:=IF(AND([.B292]<>"";[.C292]<>"");"N/T";"") ->  | E292: of:=IF([.D292]<>"";IF(AND([.B292]<>"";[.C292]<>"");"";"ERR");"") -> 
B293: of:=IF( ISBLANK([$'03.Muestra'.$C$18]);"";[$'03.Muestra'.$C$18]) ->  | C293: of:=IF( ISBLANK([$'03.Muestra'.$E$18]);"";[$'03.Muestra'.$E$18]) ->  | D293: of:=IF(AND([.B293]<>"";[.C293]<>"");"N/T";"") ->  | E293: of:=IF([.D293]<>"";IF(AND([.B293]<>"";[.C293]<>"");"";"ERR");"") -> 
B294: of:=IF( ISBLANK([$'03.Muestra'.$C$19]);"";[$'03.Muestra'.$C$19]) ->  | C294: of:=IF( ISBLANK([$'03.Muestra'.$E$19]);"";[$'03.Muestra'.$E$19]) ->  | D294: of:=IF(AND([.B294]<>"";[.C294]<>"");"N/T";"") ->  | E294: of:=IF([.D294]<>"";IF(AND([.B294]<>"";[.C294]<>"");"";"ERR");"") -> 
B295: of:=IF( ISBLANK([$'03.Muestra'.$C$20]);"";[$'03.Muestra'.$C$20]) ->  | C295: of:=IF( ISBLANK([$'03.Muestra'.$E$20]);"";[$'03.Muestra'.$E$20]) ->  | D295: of:=IF(AND([.B295]<>"";[.C295]<>"");"N/T";"") ->  | E295: of:=IF([.D295]<>"";IF(AND([.B295]<>"";[.C295]<>"");"";"ERR");"") -> 
B296: of:=IF( ISBLANK([$'03.Muestra'.$C$21]);"";[$'03.Muestra'.$C$21]) ->  | C296: of:=IF( ISBLANK([$'03.Muestra'.$E$21]);"";[$'03.Muestra'.$E$21]) ->  | D296: of:=IF(AND([.B296]<>"";[.C296]<>"");"N/T";"") ->  | E296: of:=IF([.D296]<>"";IF(AND([.B296]<>"";[.C296]<>"");"";"ERR");"") -> 
B297: of:=IF( ISBLANK([$'03.Muestra'.$C$22]);"";[$'03.Muestra'.$C$22]) ->  | C297: of:=IF( ISBLANK([$'03.Muestra'.$E$22]);"";[$'03.Muestra'.$E$22]) ->  | D297: of:=IF(AND([.B297]<>"";[.C297]<>"");"N/T";"") ->  | E297: of:=IF([.D297]<>"";IF(AND([.B297]<>"";[.C297]<>"");"";"ERR");"") -> 
B298: of:=IF( ISBLANK([$'03.Muestra'.$C$23]);"";[$'03.Muestra'.$C$23]) ->  | C298: of:=IF( ISBLANK([$'03.Muestra'.$E$23]);"";[$'03.Muestra'.$E$23]) ->  | D298: of:=IF(AND([.B298]<>"";[.C298]<>"");"N/T";"") ->  | E298: of:=IF([.D298]<>"";IF(AND([.B298]<>"";[.C298]<>"");"";"ERR");"") -> 
B299: of:=IF( ISBLANK([$'03.Muestra'.$C$24]);"";[$'03.Muestra'.$C$24]) ->  | C299: of:=IF( ISBLANK([$'03.Muestra'.$E$24]);"";[$'03.Muestra'.$E$24]) ->  | D299: of:=IF(AND([.B299]<>"";[.C299]<>"");"N/T";"") ->  | E299: of:=IF([.D299]<>"";IF(AND([.B299]<>"";[.C299]<>"");"";"ERR");"") -> 
B300: of:=IF( ISBLANK([$'03.Muestra'.$C$25]);"";[$'03.Muestra'.$C$25]) ->  | C300: of:=IF( ISBLANK([$'03.Muestra'.$E$25]);"";[$'03.Muestra'.$E$25]) ->  | D300: of:=IF(AND([.B300]<>"";[.C300]<>"");"N/T";"") ->  | E300: of:=IF([.D300]<>"";IF(AND([.B300]<>"";[.C300]<>"");"";"ERR");"") -> 
B301: of:=IF( ISBLANK([$'03.Muestra'.$C$26]);"";[$'03.Muestra'.$C$26]) ->  | C301: of:=IF( ISBLANK([$'03.Muestra'.$E$26]);"";[$'03.Muestra'.$E$26]) ->  | D301: of:=IF(AND([.B301]<>"";[.C301]<>"");"N/T";"") ->  | E301: of:=IF([.D301]<>"";IF(AND([.B301]<>"";[.C301]<>"");"";"ERR");"") -> 
B302: of:=IF( ISBLANK([$'03.Muestra'.$C$27]);"";[$'03.Muestra'.$C$27]) ->  | C302: of:=IF( ISBLANK([$'03.Muestra'.$E$27]);"";[$'03.Muestra'.$E$27]) ->  | D302: of:=IF(AND([.B302]<>"";[.C302]<>"");"N/T";"") ->  | E302: of:=IF([.D302]<>"";IF(AND([.B302]<>"";[.C302]<>"");"";"ERR");"") -> 
B303: of:=IF( ISBLANK([$'03.Muestra'.$C$28]);"";[$'03.Muestra'.$C$28]) ->  | C303: of:=IF( ISBLANK([$'03.Muestra'.$E$28]);"";[$'03.Muestra'.$E$28]) ->  | D303: of:=IF(AND([.B303]<>"";[.C303]<>"");"N/T";"") ->  | E303: of:=IF([.D303]<>"";IF(AND([.B303]<>"";[.C303]<>"");"";"ERR");"") -> 
B304: of:=IF( ISBLANK([$'03.Muestra'.$C$29]);"";[$'03.Muestra'.$C$29]) ->  | C304: of:=IF( ISBLANK([$'03.Muestra'.$E$29]);"";[$'03.Muestra'.$E$29]) ->  | D304: of:=IF(AND([.B304]<>"";[.C304]<>"");"N/T";"") ->  | E304: of:=IF([.D304]<>"";IF(AND([.B304]<>"";[.C304]<>"");"";"ERR");"") -> 
B305: of:=IF( ISBLANK([$'03.Muestra'.$C$30]);"";[$'03.Muestra'.$C$30]) ->  | C305: of:=IF( ISBLANK([$'03.Muestra'.$E$30]);"";[$'03.Muestra'.$E$30]) ->  | D305: of:=IF(AND([.B305]<>"";[.C305]<>"");"N/T";"") ->  | E305: of:=IF([.D305]<>"";IF(AND([.B305]<>"";[.C305]<>"");"";"ERR");"") -> 
B306: of:=IF( ISBLANK([$'03.Muestra'.$C$31]);"";[$'03.Muestra'.$C$31]) ->  | C306: of:=IF( ISBLANK([$'03.Muestra'.$E$31]);"";[$'03.Muestra'.$E$31]) ->  | D306: of:=IF(AND([.B306]<>"";[.C306]<>"");"N/T";"") ->  | E306: of:=IF([.D306]<>"";IF(AND([.B306]<>"";[.C306]<>"");"";"ERR");"") -> 
B307: of:=IF( ISBLANK([$'03.Muestra'.$C$32]);"";[$'03.Muestra'.$C$32]) ->  | C307: of:=IF( ISBLANK([$'03.Muestra'.$E$32]);"";[$'03.Muestra'.$E$32]) ->  | D307: of:=IF(AND([.B307]<>"";[.C307]<>"");"N/T";"") ->  | E307: of:=IF([.D307]<>"";IF(AND([.B307]<>"";[.C307]<>"");"";"ERR");"") -> 
B308: of:=IF( ISBLANK([$'03.Muestra'.$C$33]);"";[$'03.Muestra'.$C$33]) ->  | C308: of:=IF( ISBLANK([$'03.Muestra'.$E$33]);"";[$'03.Muestra'.$E$33]) ->  | D308: of:=IF(AND([.B308]<>"";[.C308]<>"");"N/T";"") ->  | E308: of:=IF([.D308]<>"";IF(AND([.B308]<>"";[.C308]<>"");"";"ERR");"") -> 
B309: of:=IF( ISBLANK([$'03.Muestra'.$C$34]);"";[$'03.Muestra'.$C$34]) ->  | C309: of:=IF( ISBLANK([$'03.Muestra'.$E$34]);"";[$'03.Muestra'.$E$34]) ->  | D309: of:=IF(AND([.B309]<>"";[.C309]<>"");"N/T";"") ->  | E309: of:=IF([.D309]<>"";IF(AND([.B309]<>"";[.C309]<>"");"";"ERR");"") -> 
B310: of:=IF( ISBLANK([$'03.Muestra'.$C$35]);"";[$'03.Muestra'.$C$35]) ->  | C310: of:=IF( ISBLANK([$'03.Muestra'.$E$35]);"";[$'03.Muestra'.$E$35]) ->  | D310: of:=IF(AND([.B310]<>"";[.C310]<>"");"N/T";"") ->  | E310: of:=IF([.D310]<>"";IF(AND([.B310]<>"";[.C310]<>"");"";"ERR");"") -> 
B311: of:=IF( ISBLANK([$'03.Muestra'.$C$36]);"";[$'03.Muestra'.$C$36]) ->  | C311: of:=IF( ISBLANK([$'03.Muestra'.$E$36]);"";[$'03.Muestra'.$E$36]) ->  | D311: of:=IF(AND([.B311]<>"";[.C311]<>"");"N/T";"") ->  | E311: of:=IF([.D311]<>"";IF(AND([.B311]<>"";[.C311]<>"");"";"ERR");"") -> 
B312: of:=IF( ISBLANK([$'03.Muestra'.$C$37]);"";[$'03.Muestra'.$C$37]) ->  | C312: of:=IF( ISBLANK([$'03.Muestra'.$E$37]);"";[$'03.Muestra'.$E$37]) ->  | D312: of:=IF(AND([.B312]<>"";[.C312]<>"");"N/T";"") ->  | E312: of:=IF([.D312]<>"";IF(AND([.B312]<>"";[.C312]<>"");"";"ERR");"") -> 
B315: AA | C315: 1.3.4 OrientaciÃ³n | D315: Resultado
B316: of:=IF( ISBLANK([$'03.Muestra'.$C$8]);"";[$'03.Muestra'.$C$8]) ->  | C316: of:=IF( ISBLANK([$'03.Muestra'.$E$8]);"";[$'03.Muestra'.$E$8]) ->  | D316: of:=IF(AND([.B316]<>"";[.C316]<>"");"N/T";"") ->  | E316: of:=IF([.D316]<>"";IF(AND([.B316]<>"";[.C316]<>"");"";"ERR");"") ->  | F316: of:=TRANSPOSE([$'DATA - Oculta'.$U$9:$'DATA - Oculta'.$U$13]) -> N/T | G316: N/D | H316: N/A | I316: Falla | J316: Pasa | K316: En blanco
B317: of:=IF( ISBLANK([$'03.Muestra'.$C$9]);"";[$'03.Muestra'.$C$9]) ->  | C317: of:=IF( ISBLANK([$'03.Muestra'.$E$9]);"";[$'03.Muestra'.$E$9]) ->  | D317: of:=IF(AND([.B317]<>"";[.C317]<>"");"N/T";"") ->  | E317: of:=IF([.D317]<>"";IF(AND([.B317]<>"";[.C317]<>"");"";"ERR");"") ->  | F317: of:=COUNTIF([.$D316]:INDIRECT("$D" &  SUM(ROW()-1;['03.Muestra'.$D$40])-1);[.F316]) -> 0 | G317: of:=COUNTIF([.$D316]:INDIRECT("$D" &  SUM(ROW()-1;['03.Muestra'.$D$40])-1);[.G316]) -> 0 | H317: of:=COUNTIF([.$D316]:INDIRECT("$D" &  SUM(ROW()-1;['03.Muestra'.$D$40])-1);[.H316]) -> 0 | I317: of:=COUNTIF([.$D316]:INDIRECT("$D" &  SUM(ROW()-1;['03.Muestra'.$D$40])-1);[.I316]) -> 0 | J317: of:=COUNTIF([.$D316]:INDIRECT("$D" &  SUM(ROW()-1;['03.Muestra'.$D$40])-1);[.J316]) -> 0 | K317: of:=IF(['03.Muestra'.$D$40]=0;0;COUNTBLANK([.$D316]:INDIRECT("$D" &  SUM(ROW()-1;['03.Muestra'.$D$40])-1))) -> 0
B318: of:=IF( ISBLANK([$'03.Muestra'.$C$10]);"";[$'03.Muestra'.$C$10]) ->  | C318: of:=IF( ISBLANK([$'03.Muestra'.$E$10]);"";[$'03.Muestra'.$E$10]) ->  | D318: of:=IF(AND([.B318]<>"";[.C318]<>"");"N/T";"") ->  | E318: of:=IF([.D318]<>"";IF(AND([.B318]<>"";[.C318]<>"");"";"ERR");"") -> 
B319: of:=IF( ISBLANK([$'03.Muestra'.$C$11]);"";[$'03.Muestra'.$C$11]) ->  | C319: of:=IF( ISBLANK([$'03.Muestra'.$E$11]);"";[$'03.Muestra'.$E$11]) ->  | D319: of:=IF(AND([.B319]<>"";[.C319]<>"");"N/T";"") ->  | E319: of:=IF([.D319]<>"";IF(AND([.B319]<>"";[.C319]<>"");"";"ERR");"") -> 
B320: of:=IF( ISBLANK([$'03.Muestra'.$C$12]);"";[$'03.Muestra'.$C$12]) ->  | C320: of:=IF( ISBLANK([$'03.Muestra'.$E$12]);"";[$'03.Muestra'.$E$12]) ->  | D320: of:=IF(AND([.B320]<>"";[.C320]<>"");"N/T";"") ->  | E320: of:=IF([.D320]<>"";IF(AND([.B320]<>"";[.C320]<>"");"";"ERR");"") -> 
B321: of:=IF( ISBLANK([$'03.Muestra'.$C$13]);"";[$'03.Muestra'.$C$13]) ->  | C321: of:=IF( ISBLANK([$'03.Muestra'.$E$13]);"";[$'03.Muestra'.$E$13]) ->  | D321: of:=IF(AND([.B321]<>"";[.C321]<>"");"N/T";"") ->  | E321: of:=IF([.D321]<>"";IF(AND([.B321]<>"";[.C321]<>"");"";"ERR");"") -> 
B322: of:=IF( ISBLANK([$'03.Muestra'.$C$14]);"";[$'03.Muestra'.$C$14]) ->  | C322: of:=IF( ISBLANK([$'03.Muestra'.$E$14]);"";[$'03.Muestra'.$E$14]) ->  | D322: of:=IF(AND([.B322]<>"";[.C322]<>"");"N/T";"") ->  | E322: of:=IF([.D322]<>"";IF(AND([.B322]<>"";[.C322]<>"");"";"ERR");"") -> 
B323: of:=IF( ISBLANK([$'03.Muestra'.$C$15]);"";[$'03.Muestra'.$C$15]) ->  | C323: of:=IF( ISBLANK([$'03.Muestra'.$E$15]);"";[$'03.Muestra'.$E$15]) ->  | D323: of:=IF(AND([.B323]<>"";[.C323]<>"");"N/T";"") ->  | E323: of:=IF([.D323]<>"";IF(AND([.B323]<>"";[.C323]<>"");"";"ERR");"") -> 
B324: of:=IF( ISBLANK([$'03.Muestra'.$C$16]);"";[$'03.Muestra'.$C$16]) ->  | C324: of:=IF( ISBLANK([$'03.Muestra'.$E$16]);"";[$'03.Muestra'.$E$16]) ->  | D324: of:=IF(AND([.B324]<>"";[.C324]<>"");"N/T";"") ->  | E324: of:=IF([.D324]<>"";IF(AND([.B324]<>"";[.C324]<>"");"";"ERR");"") -> 
B325: of:=IF( ISBLANK([$'03.Muestra'.$C$17]);"";[$'03.Muestra'.$C$17]) ->  | C325: of:=IF( ISBLANK([$'03.Muestra'.$E$17]);"";[$'03.Muestra'.$E$17]) ->  | D325: of:=IF(AND([.B325]<>"";[.C325]<>"");"N/T";"") ->  | E325: of:=IF([.D325]<>"";IF(AND([.B325]<>"";[.C325]<>"");"";"ERR");"") -> 
B326: of:=IF( ISBLANK([$'03.Muestra'.$C$18]);"";[$'03.Muestra'.$C$18]) ->  | C326: of:=IF( ISBLANK([$'03.Muestra'.$E$18]);"";[$'03.Muestra'.$E$18]) ->  | D326: of:=IF(AND([.B326]<>"";[.C326]<>"");"N/T";"") ->  | E326: of:=IF([.D326]<>"";IF(AND([.B326]<>"";[.C326]<>"");"";"ERR");"") -> 
B327: of:=IF( ISBLANK([$'03.Muestra'.$C$19]);"";[$'03.Muestra'.$C$19]) ->  | C327: of:=IF( ISBLANK([$'03.Muestra'.$E$19]);"";[$'03.Muestra'.$E$19]) ->  | D327: of:=IF(AND([.B327]<>"";[.C327]<>"");"N/T";"") ->  | E327: of:=IF([.D327]<>"";IF(AND([.B327]<>"";[.C327]<>"");"";"ERR");"") -> 
B328: of:=IF( ISBLANK([$'03.Muestra'.$C$20]);"";[$'03.Muestra'.$C$20]) ->  | C328: of:=IF( ISBLANK([$'03.Muestra'.$E$20]);"";[$'03.Muestra'.$E$20]) ->  | D328: of:=IF(AND([.B328]<>"";[.C328]<>"");"N/T";"") ->  | E328: of:=IF([.D328]<>"";IF(AND([.B328]<>"";[.C328]<>"");"";"ERR");"") -> 
B329: of:=IF( ISBLANK([$'03.Muestra'.$C$21]);"";[$'03.Muestra'.$C$21]) ->  | C329: of:=IF( ISBLANK([$'03.Muestra'.$E$21]);"";[$'03.Muestra'.$E$21]) ->  | D329: of:=IF(AND([.B329]<>"";[.C329]<>"");"N/T";"") ->  | E329: of:=IF([.D329]<>"";IF(AND([.B329]<>"";[.C329]<>"");"";"ERR");"") -> 
B330: of:=IF( ISBLANK([$'03.Muestra'.$C$22]);"";[$'03.Muestra'.$C$22]) ->  | C330: of:=IF( ISBLANK([$'03.Muestra'.$E$22]);"";[$'03.Muestra'.$E$22]) ->  | D330: of:=IF(AND([.B330]<>"";[.C330]<>"");"N/T";"") ->  | E330: of:=IF([.D330]<>"";IF(AND([.B330]<>"";[.C330]<>"");"";"ERR");"") -> 
B331: of:=IF( ISBLANK([$'03.Muestra'.$C$23]);"";[$'03.Muestra'.$C$23]) ->  | C331: of:=IF( ISBLANK([$'03.Muestra'.$E$23]);"";[$'03.Muestra'.$E$23]) ->  | D331: of:=IF(AND([.B331]<>"";[.C331]<>"");"N/T";"") ->  | E331: of:=IF([.D331]<>"";IF(AND([.B331]<>"";[.C331]<>"");"";"ERR");"") -> 
B332: of:=IF( ISBLANK([$'03.Muestra'.$C$24]);"";[$'03.Muestra'.$C$24]) ->  | C332: of:=IF( ISBLANK([$'03.Muestra'.$E$24]);"";[$'03.Muestra'.$E$24]) ->  | D332: of:=IF(AND([.B332]<>"";[.C332]<>"");"N/T";"") ->  | E332: of:=IF([.D332]<>"";IF(AND([.B332]<>"";[.C332]<>"");"";"ERR");"") -> 
B333: of:=IF( ISBLANK([$'03.Muestra'.$C$25]);"";[$'03.Muestra'.$C$25]) ->  | C333: of:=IF( ISBLANK([$'03.Muestra'.$E$25]);"";[$'03.Muestra'.$E$25]) ->  | D333: of:=IF(AND([.B333]<>"";[.C333]<>"");"N/T";"") ->  | E333: of:=IF([.D333]<>"";IF(AND([.B333]<>"";[.C333]<>"");"";"ERR");"") -> 
B334: of:=IF( ISBLANK([$'03.Muestra'.$C$26]);"";[$'03.Muestra'.$C$26]) ->  | C334: of:=IF( ISBLANK([$'03.Muestra'.$E$26]);"";[$'03.Muestra'.$E$26]) ->  | D334: of:=IF(AND([.B334]<>"";[.C334]<>"");"N/T";"") ->  | E334: of:=IF([.D334]<>"";IF(AND([.B334]<>"";[.C334]<>"");"";"ERR");"") -> 
B335: of:=IF( ISBLANK([$'03.Muestra'.$C$27]);"";[$'03.Muestra'.$C$27]) ->  | C335: of:=IF( ISBLANK([$'03.Muestra'.$E$27]);"";[$'03.Muestra'.$E$27]) ->  | D335: of:=IF(AND([.B335]<>"";[.C335]<>"");"N/T";"") ->  | E335: of:=IF([.D335]<>"";IF(AND([.B335]<>"";[.C335]<>"");"";"ERR");"") -> 
B336: of:=IF( ISBLANK([$'03.Muestra'.$C$28]);"";[$'03.Muestra'.$C$28]) ->  | C336: of:=IF( ISBLANK([$'03.Muestra'.$E$28]);"";[$'03.Muestra'.$E$28]) ->  | D336: of:=IF(AND([.B336]<>"";[.C336]<>"");"N/T";"") ->  | E336: of:=IF([.D336]<>"";IF(AND([.B336]<>"";[.C336]<>"");"";"ERR");"") -> 
B337: of:=IF( ISBLANK([$'03.Muestra'.$C$29]);"";[$'03.Muestra'.$C$29]) ->  | C337: of:=IF( ISBLANK([$'03.Muestra'.$E$29]);"";[$'03.Muestra'.$E$29]) ->  | D337: of:=IF(AND([.B337]<>"";[.C337]<>"");"N/T";"") ->  | E337: of:=IF([.D337]<>"";IF(AND([.B337]<>"";[.C337]<>"");"";"ERR");"") -> 
B338: of:=IF( ISBLANK([$'03.Muestra'.$C$30]);"";[$'03.Muestra'.$C$30]) ->  | C338: of:=IF( ISBLANK([$'03.Muestra'.$E$30]);"";[$'03.Muestra'.$E$30]) ->  | D338: of:=IF(AND([.B338]<>"";[.C338]<>"");"N/T";"") ->  | E338: of:=IF([.D338]<>"";IF(AND([.B338]<>"";[.C338]<>"");"";"ERR");"") -> 
B339: of:=IF( ISBLANK([$'03.Muestra'.$C$31]);"";[$'03.Muestra'.$C$31]) ->  | C339: of:=IF( ISBLANK([$'03.Muestra'.$E$31]);"";[$'03.Muestra'.$E$31]) ->  | D339: of:=IF(AND([.B339]<>"";[.C339]<>"");"N/T";"") ->  | E339: of:=IF([.D339]<>"";IF(AND([.B339]<>"";[.C339]<>"");"";"ERR");"") -> 
B340: of:=IF( ISBLANK([$'03.Muestra'.$C$32]);"";[$'03.Muestra'.$C$32]) ->  | C340: of:=IF( ISBLANK([$'03.Muestra'.$E$32]);"";[$'03.Muestra'.$E$32]) ->  | D340: of:=IF(AND([.B340]<>"";[.C340]<>"");"N/T";"") ->  | E340: of:=IF([.D340]<>"";IF(AND([.B340]<>"";[.C340]<>"");"";"ERR");"") -> 
B341: of:=IF( ISBLANK([$'03.Muestra'.$C$33]);"";[$'03.Muestra'.$C$33]) ->  | C341: of:=IF( ISBLANK([$'03.Muestra'.$E$33]);"";[$'03.Muestra'.$E$33]) ->  | D341: of:=IF(AND([.B341]<>"";[.C341]<>"");"N/T";"") ->  | E341: of:=IF([.D341]<>"";IF(AND([.B341]<>"";[.C341]<>"");"";"ERR");"") -> 
B342: of:=IF( ISBLANK([$'03.Muestra'.$C$34]);"";[$'03.Muestra'.$C$34]) ->  | C342: of:=IF( ISBLANK([$'03.Muestra'.$E$34]);"";[$'03.Muestra'.$E$34]) ->  | D342: of:=IF(AND([.B342]<>"";[.C342]<>"");"N/T";"") ->  | E342: of:=IF([.D342]<>"";IF(AND([.B342]<>"";[.C342]<>"");"";"ERR");"") -> 
B343: of:=IF( ISBLANK([$'03.Muestra'.$C$35]);"";[$'03.Muestra'.$C$35]) ->  | C343: of:=IF( ISBLANK([$'03.Muestra'.$E$35]);"";[$'03.Muestra'.$E$35]) ->  | D343: of:=IF(AND([.B343]<>"";[.C343]<>"");"N/T";"") ->  | E343: of:=IF([.D343]<>"";IF(AND([.B343]<>"";[.C343]<>"");"";"ERR");"") -> 
B344: of:=IF( ISBLANK([$'03.Muestra'.$C$36]);"";[$'03.Muestra'.$C$36]) ->  | C344: of:=IF( ISBLANK([$'03.Muestra'.$E$36]);"";[$'03.Muestra'.$E$36]) ->  | D344: of:=IF(AND([.B344]<>"";[.C344]<>"");"N/T";"") ->  | E344: of:=IF([.D344]<>"";IF(AND([.B344]<>"";[.C344]<>"");"";"ERR");"") -> 
B345: of:=IF( ISBLANK([$'03.Muestra'.$C$37]);"";[$'03.Muestra'.$C$37]) ->  | C345: of:=IF( ISBLANK([$'03.Muestra'.$E$37]);"";[$'03.Muestra'.$E$37]) ->  | D345: of:=IF(AND([.B345]<>"";[.C345]<>"");"N/T";"") ->  | E345: of:=IF([.D345]<>"";IF(AND([.B345]<>"";[.C345]<>"");"";"ERR");"") -> 
B348: AA | C348: 1.3.5 Identificar el propÃ³sito de campo | D348: Resultado
B349: of:=IF( ISBLANK([$'03.Muestra'.$C$8]);"";[$'03.Muestra'.$C$8]) ->  | C349: of:=IF( ISBLANK([$'03.Muestra'.$E$8]);"";[$'03.Muestra'.$E$8]) ->  | D349: of:=IF(AND([.B349]<>"";[.C349]<>"");"N/T";"") ->  | E349: of:=IF([.D349]<>"";IF(AND([.B349]<>"";[.C349]<>"");"";"ERR");"") ->  | F349: of:=TRANSPOSE([$'DATA - Oculta'.$U$9:$'DATA - Oculta'.$U$13]) -> N/T | G349: N/D | H349: N/A | I349: Falla | J349: Pasa | K349: En blanco
B350: of:=IF( ISBLANK([$'03.Muestra'.$C$9]);"";[$'03.Muestra'.$C$9]) ->  | C350: of:=IF( ISBLANK([$'03.Muestra'.$E$9]);"";[$'03.Muestra'.$E$9]) ->  | D350: of:=IF(AND([.B350]<>"";[.C350]<>"");"N/T";"") ->  | E350: of:=IF([.D350]<>"";IF(AND([.B350]<>"";[.C350]<>"");"";"ERR");"") ->  | F350: of:=COUNTIF([.$D349]:INDIRECT("$D" &  SUM(ROW()-1;['03.Muestra'.$D$40])-1);[.F349]) -> 0 | G350: of:=COUNTIF([.$D349]:INDIRECT("$D" &  SUM(ROW()-1;['03.Muestra'.$D$40])-1);[.G349]) -> 0 | H350: of:=COUNTIF([.$D349]:INDIRECT("$D" &  SUM(ROW()-1;['03.Muestra'.$D$40])-1);[.H349]) -> 0 | I350: of:=COUNTIF([.$D349]:INDIRECT("$D" &  SUM(ROW()-1;['03.Muestra'.$D$40])-1);[.I349]) -> 0 | J350: of:=COUNTIF([.$D349]:INDIRECT("$D" &  SUM(ROW()-1;['03.Muestra'.$D$40])-1);[.J349]) -> 0 | K350: of:=IF(['03.Muestra'.$D$40]=0;0;COUNTBLANK([.$D349]:INDIRECT("$D" &  SUM(ROW()-1;['03.Muestra'.$D$40])-1))) -> 0
B351: of:=IF( ISBLANK([$'03.Muestra'.$C$10]);"";[$'03.Muestra'.$C$10]) ->  | C351: of:=IF( ISBLANK([$'03.Muestra'.$E$10]);"";[$'03.Muestra'.$E$10]) ->  | D351: of:=IF(AND([.B351]<>"";[.C351]<>"");"N/T";"") ->  | E351: of:=IF([.D351]<>"";IF(AND([.B351]<>"";[.C351]<>"");"";"ERR");"") -> 
B352: of:=IF( ISBLANK([$'03.Muestra'.$C$11]);"";[$'03.Muestra'.$C$11]) ->  | C352: of:=IF( ISBLANK([$'03.Muestra'.$E$11]);"";[$'03.Muestra'.$E$11]) ->  | D352: of:=IF(AND([.B352]<>"";[.C352]<>"");"N/T";"") ->  | E352: of:=IF([.D352]<>"";IF(AND([.B352]<>"";[.C352]<>"");"";"ERR");"") -> 
B353: of:=IF( ISBLANK([$'03.Muestra'.$C$12]);"";[$'03.Muestra'.$C$12]) ->  | C353: of:=IF( ISBLANK([$'03.Muestra'.$E$12]);"";[$'03.Muestra'.$E$12]) ->  | D353: of:=IF(AND([.B353]<>"";[.C353]<>"");"N/T";"") ->  | E353: of:=IF([.D353]<>"";IF(AND([.B353]<>"";[.C353]<>"");"";"ERR");"") -> 
B354: of:=IF( ISBLANK([$'03.Muestra'.$C$13]);"";[$'03.Muestra'.$C$13]) ->  | C354: of:=IF( ISBLANK([$'03.Muestra'.$E$13]);"";[$'03.Muestra'.$E$13]) ->  | D354: of:=IF(AND([.B354]<>"";[.C354]<>"");"N/T";"") ->  | E354: of:=IF([.D354]<>"";IF(AND([.B354]<>"";[.C354]<>"");"";"ERR");"") -> 
B355: of:=IF( ISBLANK([$'03.Muestra'.$C$14]);"";[$'03.Muestra'.$C$14]) ->  | C355: of:=IF( ISBLANK([$'03.Muestra'.$E$14]);"";[$'03.Muestra'.$E$14]) ->  | D355: of:=IF(AND([.B355]<>"";[.C355]<>"");"N/T";"") ->  | E355: of:=IF([.D355]<>"";IF(AND([.B355]<>"";[.C355]<>"");"";"ERR");"") -> 
B356: of:=IF( ISBLANK([$'03.Muestra'.$C$15]);"";[$'03.Muestra'.$C$15]) ->  | C356: of:=IF( ISBLANK([$'03.Muestra'.$E$15]);"";[$'03.Muestra'.$E$15]) ->  | D356: of:=IF(AND([.B356]<>"";[.C356]<>"");"N/T";"") ->  | E356: of:=IF([.D356]<>"";IF(AND([.B356]<>"";[.C356]<>"");"";"ERR");"") -> 
B357: of:=IF( ISBLANK([$'03.Muestra'.$C$16]);"";[$'03.Muestra'.$C$16]) ->  | C357: of:=IF( ISBLANK([$'03.Muestra'.$E$16]);"";[$'03.Muestra'.$E$16]) ->  | D357: of:=IF(AND([.B357]<>"";[.C357]<>"");"N/T";"") ->  | E357: of:=IF([.D357]<>"";IF(AND([.B357]<>"";[.C357]<>"");"";"ERR");"") -> 
B358: of:=IF( ISBLANK([$'03.Muestra'.$C$17]);"";[$'03.Muestra'.$C$17]) ->  | C358: of:=IF( ISBLANK([$'03.Muestra'.$E$17]);"";[$'03.Muestra'.$E$17]) ->  | D358: of:=IF(AND([.B358]<>"";[.C358]<>"");"N/T";"") ->  | E358: of:=IF([.D358]<>"";IF(AND([.B358]<>"";[.C358]<>"");"";"ERR");"") -> 
B359: of:=IF( ISBLANK([$'03.Muestra'.$C$18]);"";[$'03.Muestra'.$C$18]) ->  | C359: of:=IF( ISBLANK([$'03.Muestra'.$E$18]);"";[$'03.Muestra'.$E$18]) ->  | D359: of:=IF(AND([.B359]<>"";[.C359]<>"");"N/T";"") ->  | E359: of:=IF([.D359]<>"";IF(AND([.B359]<>"";[.C359]<>"");"";"ERR");"") -> 
B360: of:=IF( ISBLANK([$'03.Muestra'.$C$19]);"";[$'03.Muestra'.$C$19]) ->  | C360: of:=IF( ISBLANK([$'03.Muestra'.$E$19]);"";[$'03.Muestra'.$E$19]) ->  | D360: of:=IF(AND([.B360]<>"";[.C360]<>"");"N/T";"") ->  | E360: of:=IF([.D360]<>"";IF(AND([.B360]<>"";[.C360]<>"");"";"ERR");"") -> 
B361: of:=IF( ISBLANK([$'03.Muestra'.$C$20]);"";[$'03.Muestra'.$C$20]) ->  | C361: of:=IF( ISBLANK([$'03.Muestra'.$E$20]);"";[$'03.Muestra'.$E$20]) ->  | D361: of:=IF(AND([.B361]<>"";[.C361]<>"");"N/T";"") ->  | E361: of:=IF([.D361]<>"";IF(AND([.B361]<>"";[.C361]<>"");"";"ERR");"") -> 
B362: of:=IF( ISBLANK([$'03.Muestra'.$C$21]);"";[$'03.Muestra'.$C$21]) ->  | C362: of:=IF( ISBLANK([$'03.Muestra'.$E$21]);"";[$'03.Muestra'.$E$21]) ->  | D362: of:=IF(AND([.B362]<>"";[.C362]<>"");"N/T";"") ->  | E362: of:=IF([.D362]<>"";IF(AND([.B362]<>"";[.C362]<>"");"";"ERR");"") -> 
B363: of:=IF( ISBLANK([$'03.Muestra'.$C$22]);"";[$'03.Muestra'.$C$22]) ->  | C363: of:=IF( ISBLANK([$'03.Muestra'.$E$22]);"";[$'03.Muestra'.$E$22]) ->  | D363: of:=IF(AND([.B363]<>"";[.C363]<>"");"N/T";"") ->  | E363: of:=IF([.D363]<>"";IF(AND([.B363]<>"";[.C363]<>"");"";"ERR");"") -> 
B364: of:=IF( ISBLANK([$'03.Muestra'.$C$23]);"";[$'03.Muestra'.$C$23]) ->  | C364: of:=IF( ISBLANK([$'03.Muestra'.$E$23]);"";[$'03.Muestra'.$E$23]) ->  | D364: of:=IF(AND([.B364]<>"";[.C364]<>"");"N/T";"") ->  | E364: of:=IF([.D364]<>"";IF(AND([.B364]<>"";[.C364]<>"");"";"ERR");"") -> 
B365: of:=IF( ISBLANK([$'03.Muestra'.$C$24]);"";[$'03.Muestra'.$C$24]) ->  | C365: of:=IF( ISBLANK([$'03.Muestra'.$E$24]);"";[$'03.Muestra'.$E$24]) ->  | D365: of:=IF(AND([.B365]<>"";[.C365]<>"");"N/T";"") ->  | E365: of:=IF([.D365]<>"";IF(AND([.B365]<>"";[.C365]<>"");"";"ERR");"") -> 
B366: of:=IF( ISBLANK([$'03.Muestra'.$C$25]);"";[$'03.Muestra'.$C$25]) ->  | C366: of:=IF( ISBLANK([$'03.Muestra'.$E$25]);"";[$'03.Muestra'.$E$25]) ->  | D366: of:=IF(AND([.B366]<>"";[.C366]<>"");"N/T";"") ->  | E366: of:=IF([.D366]<>"";IF(AND([.B366]<>"";[.C366]<>"");"";"ERR");"") -> 
B367: of:=IF( ISBLANK([$'03.Muestra'.$C$26]);"";[$'03.Muestra'.$C$26]) ->  | C367: of:=IF( ISBLANK([$'03.Muestra'.$E$26]);"";[$'03.Muestra'.$E$26]) ->  | D367: of:=IF(AND([.B367]<>"";[.C367]<>"");"N/T";"") ->  | E367: of:=IF([.D367]<>"";IF(AND([.B367]<>"";[.C367]<>"");"";"ERR");"") -> 
B368: of:=IF( ISBLANK([$'03.Muestra'.$C$27]);"";[$'03.Muestra'.$C$27]) ->  | C368: of:=IF( ISBLANK([$'03.Muestra'.$E$27]);"";[$'03.Muestra'.$E$27]) ->  | D368: of:=IF(AND([.B368]<>"";[.C368]<>"");"N/T";"") ->  | E368: of:=IF([.D368]<>"";IF(AND([.B368]<>"";[.C368]<>"");"";"ERR");"") -> 
B369: of:=IF( ISBLANK([$'03.Muestra'.$C$28]);"";[$'03.Muestra'.$C$28]) ->  | C369: of:=IF( ISBLANK([$'03.Muestra'.$E$28]);"";[$'03.Muestra'.$E$28]) ->  | D369: of:=IF(AND([.B369]<>"";[.C369]<>"");"N/T";"") ->  | E369: of:=IF([.D369]<>"";IF(AND([.B369]<>"";[.C369]<>"");"";"ERR");"") -> 
B370: of:=IF( ISBLANK([$'03.Muestra'.$C$29]);"";[$'03.Muestra'.$C$29]) ->  | C370: of:=IF( ISBLANK([$'03.Muestra'.$E$29]);"";[$'03.Muestra'.$E$29]) ->  | D370: of:=IF(AND([.B370]<>"";[.C370]<>"");"N/T";"") ->  | E370: of:=IF([.D370]<>"";IF(AND([.B370]<>"";[.C370]<>"");"";"ERR");"") -> 
B371: of:=IF( ISBLANK([$'03.Muestra'.$C$30]);"";[$'03.Muestra'.$C$30]) ->  | C371: of:=IF( ISBLANK([$'03.Muestra'.$E$30]);"";[$'03.Muestra'.$E$30]) ->  | D371: of:=IF(AND([.B371]<>"";[.C371]<>"");"N/T";"") ->  | E371: of:=IF([.D371]<>"";IF(AND([.B371]<>"";[.C371]<>"");"";"ERR");"") -> 
B372: of:=IF( ISBLANK([$'03.Muestra'.$C$31]);"";[$'03.Muestra'.$C$31]) ->  | C372: of:=IF( ISBLANK([$'03.Muestra'.$E$31]);"";[$'03.Muestra'.$E$31]) ->  | D372: of:=IF(AND([.B372]<>"";[.C372]<>"");"N/T";"") ->  | E372: of:=IF([.D372]<>"";IF(AND([.B372]<>"";[.C372]<>"");"";"ERR");"") -> 
B373: of:=IF( ISBLANK([$'03.Muestra'.$C$32]);"";[$'03.Muestra'.$C$32]) ->  | C373: of:=IF( ISBLANK([$'03.Muestra'.$E$32]);"";[$'03.Muestra'.$E$32]) ->  | D373: of:=IF(AND([.B373]<>"";[.C373]<>"");"N/T";"") ->  | E373: of:=IF([.D373]<>"";IF(AND([.B373]<>"";[.C373]<>"");"";"ERR");"") -> 
B374: of:=IF( ISBLANK([$'03.Muestra'.$C$33]);"";[$'03.Muestra'.$C$33]) ->  | C374: of:=IF( ISBLANK([$'03.Muestra'.$E$33]);"";[$'03.Muestra'.$E$33]) ->  | D374: of:=IF(AND([.B374]<>"";[.C374]<>"");"N/T";"") ->  | E374: of:=IF([.D374]<>"";IF(AND([.B374]<>"";[.C374]<>"");"";"ERR");"") -> 
B375: of:=IF( ISBLANK([$'03.Muestra'.$C$34]);"";[$'03.Muestra'.$C$34]) ->  | C375: of:=IF( ISBLANK([$'03.Muestra'.$E$34]);"";[$'03.Muestra'.$E$34]) ->  | D375: of:=IF(AND([.B375]<>"";[.C375]<>"");"N/T";"") ->  | E375: of:=IF([.D375]<>"";IF(AND([.B375]<>"";[.C375]<>"");"";"ERR");"") -> 
B376: of:=IF( ISBLANK([$'03.Muestra'.$C$35]);"";[$'03.Muestra'.$C$35]) ->  | C376: of:=IF( ISBLANK([$'03.Muestra'.$E$35]);"";[$'03.Muestra'.$E$35]) ->  | D376: of:=IF(AND([.B376]<>"";[.C376]<>"");"N/T";"") ->  | E376: of:=IF([.D376]<>"";IF(AND([.B376]<>"";[.C376]<>"");"";"ERR");"") -> 
B377: of:=IF( ISBLANK([$'03.Muestra'.$C$36]);"";[$'03.Muestra'.$C$36]) ->  | C377: of:=IF( ISBLANK([$'03.Muestra'.$E$36]);"";[$'03.Muestra'.$E$36]) ->  | D377: of:=IF(AND([.B377]<>"";[.C377]<>"");"N/T";"") ->  | E377: of:=IF([.D377]<>"";IF(AND([.B377]<>"";[.C377]<>"");"";"ERR");"") -> 
B378: of:=IF( ISBLANK([$'03.Muestra'.$C$37]);"";[$'03.Muestra'.$C$37]) ->  | C378: of:=IF( ISBLANK([$'03.Muestra'.$E$37]);"";[$'03.Muestra'.$E$37]) ->  | D378: of:=IF(AND([.B378]<>"";[.C378]<>"");"N/T";"") ->  | E378: of:=IF([.D378]<>"";IF(AND([.B378]<>"";[.C378]<>"");"";"ERR");"") -> 
B381: A | C381: 1.4.1 Uso del Color | D381: Resultado
B382: of:=IF( ISBLANK([$'03.Muestra'.$C$8]);"";[$'03.Muestra'.$C$8]) ->  | C382: of:=IF( ISBLANK([$'03.Muestra'.$E$8]);"";[$'03.Muestra'.$E$8]) ->  | D382: of:=IF(AND([.B382]<>"";[.C382]<>"");"N/T";"") ->  | E382: of:=IF([.D382]<>"";IF(AND([.B382]<>"";[.C382]<>"");"";"ERR");"") ->  | F382: of:=TRANSPOSE([$'DATA - Oculta'.$U$9:$'DATA - Oculta'.$U$13]) -> N/T | G382: N/D | H382: N/A | I382: Falla | J382: Pasa | K382: En blanco
B383: of:=IF( ISBLANK([$'03.Muestra'.$C$9]);"";[$'03.Muestra'.$C$9]) ->  | C383: of:=IF( ISBLANK([$'03.Muestra'.$E$9]);"";[$'03.Muestra'.$E$9]) ->  | D383: of:=IF(AND([.B383]<>"";[.C383]<>"");"N/T";"") ->  | E383: of:=IF([.D383]<>"";IF(AND([.B383]<>"";[.C383]<>"");"";"ERR");"") ->  | F383: of:=COUNTIF([.$D382]:INDIRECT("$D" &  SUM(ROW()-1;['03.Muestra'.$D$40])-1);[.F382]) -> 0 | G383: of:=COUNTIF([.$D382]:INDIRECT("$D" &  SUM(ROW()-1;['03.Muestra'.$D$40])-1);[.G382]) -> 0 | H383: of:=COUNTIF([.$D382]:INDIRECT("$D" &  SUM(ROW()-1;['03.Muestra'.$D$40])-1);[.H382]) -> 0 | I383: of:=COUNTIF([.$D382]:INDIRECT("$D" &  SUM(ROW()-1;['03.Muestra'.$D$40])-1);[.I382]) -> 0 | J383: of:=COUNTIF([.$D382]:INDIRECT("$D" &  SUM(ROW()-1;['03.Muestra'.$D$40])-1);[.J382]) -> 0 | K383: of:=IF(['03.Muestra'.$D$40]=0;0;COUNTBLANK([.$D382]:INDIRECT("$D" &  SUM(ROW()-1;['03.Muestra'.$D$40])-1))) -> 0
B384: of:=IF( ISBLANK([$'03.Muestra'.$C$10]);"";[$'03.Muestra'.$C$10]) ->  | C384: of:=IF( ISBLANK([$'03.Muestra'.$E$10]);"";[$'03.Muestra'.$E$10]) ->  | D384: of:=IF(AND([.B384]<>"";[.C384]<>"");"N/T";"") ->  | E384: of:=IF([.D384]<>"";IF(AND([.B384]<>"";[.C384]<>"");"";"ERR");"") -> 
B385: of:=IF( ISBLANK([$'03.Muestra'.$C$11]);"";[$'03.Muestra'.$C$11]) ->  | C385: of:=IF( ISBLANK([$'03.Muestra'.$E$11]);"";[$'03.Muestra'.$E$11]) ->  | D385: of:=IF(AND([.B385]<>"";[.C385]<>"");"N/T";"") ->  | E385: of:=IF([.D385]<>"";IF(AND([.B385]<>"";[.C385]<>"");"";"ERR");"") -> 
B386: of:=IF( ISBLANK([$'03.Muestra'.$C$12]);"";[$'03.Muestra'.$C$12]) ->  | C386: of:=IF( ISBLANK([$'03.Muestra'.$E$12]);"";[$'03.Muestra'.$E$12]) ->  | D386: of:=IF(AND([.B386]<>"";[.C386]<>"");"N/T";"") ->  | E386: of:=IF([.D386]<>"";IF(AND([.B386]<>"";[.C386]<>"");"";"ERR");"") -> 
B387: of:=IF( ISBLANK([$'03.Muestra'.$C$13]);"";[$'03.Muestra'.$C$13]) ->  | C387: of:=IF( ISBLANK([$'03.Muestra'.$E$13]);"";[$'03.Muestra'.$E$13]) ->  | D387: of:=IF(AND([.B387]<>"";[.C387]<>"");"N/T";"") ->  | E387: of:=IF([.D387]<>"";IF(AND([.B387]<>"";[.C387]<>"");"";"ERR");"") -> 
B388: of:=IF( ISBLANK([$'03.Muestra'.$C$14]);"";[$'03.Muestra'.$C$14]) ->  | C388: of:=IF( ISBLANK([$'03.Muestra'.$E$14]);"";[$'03.Muestra'.$E$14]) ->  | D388: of:=IF(AND([.B388]<>"";[.C388]<>"");"N/T";"") ->  | E388: of:=IF([.D388]<>"";IF(AND([.B388]<>"";[.C388]<>"");"";"ERR");"") -> 
B389: of:=IF( ISBLANK([$'03.Muestra'.$C$15]);"";[$'03.Muestra'.$C$15]) ->  | C389: of:=IF( ISBLANK([$'03.Muestra'.$E$15]);"";[$'03.Muestra'.$E$15]) ->  | D389: of:=IF(AND([.B389]<>"";[.C389]<>"");"N/T";"") ->  | E389: of:=IF([.D389]<>"";IF(AND([.B389]<>"";[.C389]<>"");"";"ERR");"") -> 
B390: of:=IF( ISBLANK([$'03.Muestra'.$C$16]);"";[$'03.Muestra'.$C$16]) ->  | C390: of:=IF( ISBLANK([$'03.Muestra'.$E$16]);"";[$'03.Muestra'.$E$16]) ->  | D390: of:=IF(AND([.B390]<>"";[.C390]<>"");"N/T";"") ->  | E390: of:=IF([.D390]<>"";IF(AND([.B390]<>"";[.C390]<>"");"";"ERR");"") -> 
B391: of:=IF( ISBLANK([$'03.Muestra'.$C$17]);"";[$'03.Muestra'.$C$17]) ->  | C391: of:=IF( ISBLANK([$'03.Muestra'.$E$17]);"";[$'03.Muestra'.$E$17]) ->  | D391: of:=IF(AND([.B391]<>"";[.C391]<>"");"N/T";"") ->  | E391: of:=IF([.D391]<>"";IF(AND([.B391]<>"";[.C391]<>"");"";"ERR");"") -> 
B392: of:=IF( ISBLANK([$'03.Muestra'.$C$18]);"";[$'03.Muestra'.$C$18]) ->  | C392: of:=IF( ISBLANK([$'03.Muestra'.$E$18]);"";[$'03.Muestra'.$E$18]) ->  | D392: of:=IF(AND([.B392]<>"";[.C392]<>"");"N/T";"") ->  | E392: of:=IF([.D392]<>"";IF(AND([.B392]<>"";[.C392]<>"");"";"ERR");"") -> 
B393: of:=IF( ISBLANK([$'03.Muestra'.$C$19]);"";[$'03.Muestra'.$C$19]) ->  | C393: of:=IF( ISBLANK([$'03.Muestra'.$E$19]);"";[$'03.Muestra'.$E$19]) ->  | D393: of:=IF(AND([.B393]<>"";[.C393]<>"");"N/T";"") ->  | E393: of:=IF([.D393]<>"";IF(AND([.B393]<>"";[.C393]<>"");"";"ERR");"") -> 
B394: of:=IF( ISBLANK([$'03.Muestra'.$C$20]);"";[$'03.Muestra'.$C$20]) ->  | C394: of:=IF( ISBLANK([$'03.Muestra'.$E$20]);"";[$'03.Muestra'.$E$20]) ->  | D394: of:=IF(AND([.B394]<>"";[.C394]<>"");"N/T";"") ->  | E394: of:=IF([.D394]<>"";IF(AND([.B394]<>"";[.C394]<>"");"";"ERR");"") -> 
B395: of:=IF( ISBLANK([$'03.Muestra'.$C$21]);"";[$'03.Muestra'.$C$21]) ->  | C395: of:=IF( ISBLANK([$'03.Muestra'.$E$21]);"";[$'03.Muestra'.$E$21]) ->  | D395: of:=IF(AND([.B395]<>"";[.C395]<>"");"N/T";"") ->  | E395: of:=IF([.D395]<>"";IF(AND([.B395]<>"";[.C395]<>"");"";"ERR");"") -> 
B396: of:=IF( ISBLANK([$'03.Muestra'.$C$22]);"";[$'03.Muestra'.$C$22]) ->  | C396: of:=IF( ISBLANK([$'03.Muestra'.$E$22]);"";[$'03.Muestra'.$E$22]) ->  | D396: of:=IF(AND([.B396]<>"";[.C396]<>"");"N/T";"") ->  | E396: of:=IF([.D396]<>"";IF(AND([.B396]<>"";[.C396]<>"");"";"ERR");"") -> 
B397: of:=IF( ISBLANK([$'03.Muestra'.$C$23]);"";[$'03.Muestra'.$C$23]) ->  | C397: of:=IF( ISBLANK([$'03.Muestra'.$E$23]);"";[$'03.Muestra'.$E$23]) ->  | D397: of:=IF(AND([.B397]<>"";[.C397]<>"");"N/T";"") ->  | E397: of:=IF([.D397]<>"";IF(AND([.B397]<>"";[.C397]<>"");"";"ERR");"") -> 
B398: of:=IF( ISBLANK([$'03.Muestra'.$C$24]);"";[$'03.Muestra'.$C$24]) ->  | C398: of:=IF( ISBLANK([$'03.Muestra'.$E$24]);"";[$'03.Muestra'.$E$24]) ->  | D398: of:=IF(AND([.B398]<>"";[.C398]<>"");"N/T";"") ->  | E398: of:=IF([.D398]<>"";IF(AND([.B398]<>"";[.C398]<>"");"";"ERR");"") -> 
B399: of:=IF( ISBLANK([$'03.Muestra'.$C$25]);"";[$'03.Muestra'.$C$25]) ->  | C399: of:=IF( ISBLANK([$'03.Muestra'.$E$25]);"";[$'03.Muestra'.$E$25]) ->  | D399: of:=IF(AND([.B399]<>"";[.C399]<>"");"N/T";"") ->  | E399: of:=IF([.D399]<>"";IF(AND([.B399]<>"";[.C399]<>"");"";"ERR");"") -> 
B400: of:=IF( ISBLANK([$'03.Muestra'.$C$26]);"";[$'03.Muestra'.$C$26]) ->  | C400: of:=IF( ISBLANK([$'03.Muestra'.$E$26]);"";[$'03.Muestra'.$E$26]) ->  | D400: of:=IF(AND([.B400]<>"";[.C400]<>"");"N/T";"") ->  | E400: of:=IF([.D400]<>"";IF(AND([.B400]<>"";[.C400]<>"");"";"ERR");"") -> 
B401: of:=IF( ISBLANK([$'03.Muestra'.$C$27]);"";[$'03.Muestra'.$C$27]) ->  | C401: of:=IF( ISBLANK([$'03.Muestra'.$E$27]);"";[$'03.Muestra'.$E$27]) ->  | D401: of:=IF(AND([.B401]<>"";[.C401]<>"");"N/T";"") ->  | E401: of:=IF([.D401]<>"";IF(AND([.B401]<>"";[.C401]<>"");"";"ERR");"") -> 
B402: of:=IF( ISBLANK([$'03.Muestra'.$C$28]);"";[$'03.Muestra'.$C$28]) ->  | C402: of:=IF( ISBLANK([$'03.Muestra'.$E$28]);"";[$'03.Muestra'.$E$28]) ->  | D402: of:=IF(AND([.B402]<>"";[.C402]<>"");"N/T";"") ->  | E402: of:=IF([.D402]<>"";IF(AND([.B402]<>"";[.C402]<>"");"";"ERR");"") -> 
B403: of:=IF( ISBLANK([$'03.Muestra'.$C$29]);"";[$'03.Muestra'.$C$29]) ->  | C403: of:=IF( ISBLANK([$'03.Muestra'.$E$29]);"";[$'03.Muestra'.$E$29]) ->  | D403: of:=IF(AND([.B403]<>"";[.C403]<>"");"N/T";"") ->  | E403: of:=IF([.D403]<>"";IF(AND([.B403]<>"";[.C403]<>"");"";"ERR");"") -> 
B404: of:=IF( ISBLANK([$'03.Muestra'.$C$30]);"";[$'03.Muestra'.$C$30]) ->  | C404: of:=IF( ISBLANK([$'03.Muestra'.$E$30]);"";[$'03.Muestra'.$E$30]) ->  | D404: of:=IF(AND([.B404]<>"";[.C404]<>"");"N/T";"") ->  | E404: of:=IF([.D404]<>"";IF(AND([.B404]<>"";[.C404]<>"");"";"ERR");"") -> 
B405: of:=IF( ISBLANK([$'03.Muestra'.$C$31]);"";[$'03.Muestra'.$C$31]) ->  | C405: of:=IF( ISBLANK([$'03.Muestra'.$E$31]);"";[$'03.Muestra'.$E$31]) ->  | D405: of:=IF(AND([.B405]<>"";[.C405]<>"");"N/T";"") ->  | E405: of:=IF([.D405]<>"";IF(AND([.B405]<>"";[.C405]<>"");"";"ERR");"") -> 
B406: of:=IF( ISBLANK([$'03.Muestra'.$C$32]);"";[$'03.Muestra'.$C$32]) ->  | C406: of:=IF( ISBLANK([$'03.Muestra'.$E$32]);"";[$'03.Muestra'.$E$32]) ->  | D406: of:=IF(AND([.B406]<>"";[.C406]<>"");"N/T";"") ->  | E406: of:=IF([.D406]<>"";IF(AND([.B406]<>"";[.C406]<>"");"";"ERR");"") -> 
B407: of:=IF( ISBLANK([$'03.Muestra'.$C$33]);"";[$'03.Muestra'.$C$33]) ->  | C407: of:=IF( ISBLANK([$'03.Muestra'.$E$33]);"";[$'03.Muestra'.$E$33]) ->  | D407: of:=IF(AND([.B407]<>"";[.C407]<>"");"N/T";"") ->  | E407: of:=IF([.D407]<>"";IF(AND([.B407]<>"";[.C407]<>"");"";"ERR");"") -> 
B408: of:=IF( ISBLANK([$'03.Muestra'.$C$34]);"";[$'03.Muestra'.$C$34]) ->  | C408: of:=IF( ISBLANK([$'03.Muestra'.$E$34]);"";[$'03.Muestra'.$E$34]) ->  | D408: of:=IF(AND([.B408]<>"";[.C408]<>"");"N/T";"") ->  | E408: of:=IF([.D408]<>"";IF(AND([.B408]<>"";[.C408]<>"");"";"ERR");"") -> 
B409: of:=IF( ISBLANK([$'03.Muestra'.$C$35]);"";[$'03.Muestra'.$C$35]) ->  | C409: of:=IF( ISBLANK([$'03.Muestra'.$E$35]);"";[$'03.Muestra'.$E$35]) ->  | D409: of:=IF(AND([.B409]<>"";[.C409]<>"");"N/T";"") ->  | E409: of:=IF([.D409]<>"";IF(AND([.B409]<>"";[.C409]<>"");"";"ERR");"") -> 
B410: of:=IF( ISBLANK([$'03.Muestra'.$C$36]);"";[$'03.Muestra'.$C$36]) ->  | C410: of:=IF( ISBLANK([$'03.Muestra'.$E$36]);"";[$'03.Muestra'.$E$36]) ->  | D410: of:=IF(AND([.B410]<>"";[.C410]<>"");"N/T";"") ->  | E410: of:=IF([.D410]<>"";IF(AND([.B410]<>"";[.C410]<>"");"";"ERR");"") -> 
B411: of:=IF( ISBLANK([$'03.Muestra'.$C$37]);"";[$'03.Muestra'.$C$37]) ->  | C411: of:=IF( ISBLANK([$'03.Muestra'.$E$37]);"";[$'03.Muestra'.$E$37]) ->  | D411: of:=IF(AND([.B411]<>"";[.C411]<>"");"N/T";"") ->  | E411: of:=IF([.D411]<>"";IF(AND([.B411]<>"";[.C411]<>"");"";"ERR");"") -> 
B414: A | C414: 1.4.2 Control del audio | D414: Resultado
B415: of:=IF( ISBLANK([$'03.Muestra'.$C$8]);"";[$'03.Muestra'.$C$8]) ->  | C415: of:=IF( ISBLANK([$'03.Muestra'.$E$8]);"";[$'03.Muestra'.$E$8]) ->  | D415: of:=IF(AND([.B415]<>"";[.C415]<>"");"N/T";"") ->  | E415: of:=IF([.D415]<>"";IF(AND([.B415]<>"";[.C415]<>"");"";"ERR");"") ->  | F415: of:=TRANSPOSE([$'DATA - Oculta'.$U$9:$'DATA - Oculta'.$U$13]) -> N/T | G415: N/D | H415: N/A | I415: Falla | J415: Pasa | K415: En blanco
B416: of:=IF( ISBLANK([$'03.Muestra'.$C$9]);"";[$'03.Muestra'.$C$9]) ->  | C416: of:=IF( ISBLANK([$'03.Muestra'.$E$9]);"";[$'03.Muestra'.$E$9]) ->  | D416: of:=IF(AND([.B416]<>"";[.C416]<>"");"N/T";"") ->  | E416: of:=IF([.D416]<>"";IF(AND([.B416]<>"";[.C416]<>"");"";"ERR");"") ->  | F416: of:=COUNTIF([.$D415]:INDIRECT("$D" &  SUM(ROW()-1;['03.Muestra'.$D$40])-1);[.F415]) -> 0 | G416: of:=COUNTIF([.$D415]:INDIRECT("$D" &  SUM(ROW()-1;['03.Muestra'.$D$40])-1);[.G415]) -> 0 | H416: of:=COUNTIF([.$D415]:INDIRECT("$D" &  SUM(ROW()-1;['03.Muestra'.$D$40])-1);[.H415]) -> 0 | I416: of:=COUNTIF([.$D415]:INDIRECT("$D" &  SUM(ROW()-1;['03.Muestra'.$D$40])-1);[.I415]) -> 0 | J416: of:=COUNTIF([.$D415]:INDIRECT("$D" &  SUM(ROW()-1;['03.Muestra'.$D$40])-1);[.J415]) -> 0 | K416: of:=IF(['03.Muestra'.$D$40]=0;0;COUNTBLANK([.$D415]:INDIRECT("$D" &  SUM(ROW()-1;['03.Muestra'.$D$40])-1))) -> 0
B417: of:=IF( ISBLANK([$'03.Muestra'.$C$10]);"";[$'03.Muestra'.$C$10]) ->  | C417: of:=IF( ISBLANK([$'03.Muestra'.$E$10]);"";[$'03.Muestra'.$E$10]) ->  | D417: of:=IF(AND([.B417]<>"";[.C417]<>"");"N/T";"") ->  | E417: of:=IF([.D417]<>"";IF(AND([.B417]<>"";[.C417]<>"");"";"ERR");"") -> 
B418: of:=IF( ISBLANK([$'03.Muestra'.$C$11]);"";[$'03.Muestra'.$C$11]) ->  | C418: of:=IF( ISBLANK([$'03.Muestra'.$E$11]);"";[$'03.Muestra'.$E$11]) ->  | D418: of:=IF(AND([.B418]<>"";[.C418]<>"");"N/T";"") ->  | E418: of:=IF([.D418]<>"";IF(AND([.B418]<>"";[.C418]<>"");"";"ERR");"") -> 
B419: of:=IF( ISBLANK([$'03.Muestra'.$C$12]);"";[$'03.Muestra'.$C$12]) ->  | C419: of:=IF( ISBLANK([$'03.Muestra'.$E$12]);"";[$'03.Muestra'.$E$12]) ->  | D419: of:=IF(AND([.B419]<>"";[.C419]<>"");"N/T";"") ->  | E419: of:=IF([.D419]<>"";IF(AND([.B419]<>"";[.C419]<>"");"";"ERR");"") -> 
B420: of:=IF( ISBLANK([$'03.Muestra'.$C$13]);"";[$'03.Muestra'.$C$13]) ->  | C420: of:=IF( ISBLANK([$'03.Muestra'.$E$13]);"";[$'03.Muestra'.$E$13]) ->  | D420: of:=IF(AND([.B420]<>"";[.C420]<>"");"N/T";"") ->  | E420: of:=IF([.D420]<>"";IF(AND([.B420]<>"";[.C420]<>"");"";"ERR");"") -> 
B421: of:=IF( ISBLANK([$'03.Muestra'.$C$14]);"";[$'03.Muestra'.$C$14]) ->  | C421: of:=IF( ISBLANK([$'03.Muestra'.$E$14]);"";[$'03.Muestra'.$E$14]) ->  | D421: of:=IF(AND([.B421]<>"";[.C421]<>"");"N/T";"") ->  | E421: of:=IF([.D421]<>"";IF(AND([.B421]<>"";[.C421]<>"");"";"ERR");"") -> 
B422: of:=IF( ISBLANK([$'03.Muestra'.$C$15]);"";[$'03.Muestra'.$C$15]) ->  | C422: of:=IF( ISBLANK([$'03.Muestra'.$E$15]);"";[$'03.Muestra'.$E$15]) ->  | D422: of:=IF(AND([.B422]<>"";[.C422]<>"");"N/T";"") ->  | E422: of:=IF([.D422]<>"";IF(AND([.B422]<>"";[.C422]<>"");"";"ERR");"") -> 
B423: of:=IF( ISBLANK([$'03.Muestra'.$C$16]);"";[$'03.Muestra'.$C$16]) ->  | C423: of:=IF( ISBLANK([$'03.Muestra'.$E$16]);"";[$'03.Muestra'.$E$16]) ->  | D423: of:=IF(AND([.B423]<>"";[.C423]<>"");"N/T";"") ->  | E423: of:=IF([.D423]<>"";IF(AND([.B423]<>"";[.C423]<>"");"";"ERR");"") -> 
B424: of:=IF( ISBLANK([$'03.Muestra'.$C$17]);"";[$'03.Muestra'.$C$17]) ->  | C424: of:=IF( ISBLANK([$'03.Muestra'.$E$17]);"";[$'03.Muestra'.$E$17]) ->  | D424: of:=IF(AND([.B424]<>"";[.C424]<>"");"N/T";"") ->  | E424: of:=IF([.D424]<>"";IF(AND([.B424]<>"";[.C424]<>"");"";"ERR");"") -> 
B425: of:=IF( ISBLANK([$'03.Muestra'.$C$18]);"";[$'03.Muestra'.$C$18]) ->  | C425: of:=IF( ISBLANK([$'03.Muestra'.$E$18]);"";[$'03.Muestra'.$E$18]) ->  | D425: of:=IF(AND([.B425]<>"";[.C425]<>"");"N/T";"") ->  | E425: of:=IF([.D425]<>"";IF(AND([.B425]<>"";[.C425]<>"");"";"ERR");"") -> 
B426: of:=IF( ISBLANK([$'03.Muestra'.$C$19]);"";[$'03.Muestra'.$C$19]) ->  | C426: of:=IF( ISBLANK([$'03.Muestra'.$E$19]);"";[$'03.Muestra'.$E$19]) ->  | D426: of:=IF(AND([.B426]<>"";[.C426]<>"");"N/T";"") ->  | E426: of:=IF([.D426]<>"";IF(AND([.B426]<>"";[.C426]<>"");"";"ERR");"") -> 
B427: of:=IF( ISBLANK([$'03.Muestra'.$C$20]);"";[$'03.Muestra'.$C$20]) ->  | C427: of:=IF( ISBLANK([$'03.Muestra'.$E$20]);"";[$'03.Muestra'.$E$20]) ->  | D427: of:=IF(AND([.B427]<>"";[.C427]<>"");"N/T";"") ->  | E427: of:=IF([.D427]<>"";IF(AND([.B427]<>"";[.C427]<>"");"";"ERR");"") -> 
B428: of:=IF( ISBLANK([$'03.Muestra'.$C$21]);"";[$'03.Muestra'.$C$21]) ->  | C428: of:=IF( ISBLANK([$'03.Muestra'.$E$21]);"";[$'03.Muestra'.$E$21]) ->  | D428: of:=IF(AND([.B428]<>"";[.C428]<>"");"N/T";"") ->  | E428: of:=IF([.D428]<>"";IF(AND([.B428]<>"";[.C428]<>"");"";"ERR");"") -> 
B429: of:=IF( ISBLANK([$'03.Muestra'.$C$22]);"";[$'03.Muestra'.$C$22]) ->  | C429: of:=IF( ISBLANK([$'03.Muestra'.$E$22]);"";[$'03.Muestra'.$E$22]) ->  | D429: of:=IF(AND([.B429]<>"";[.C429]<>"");"N/T";"") ->  | E429: of:=IF([.D429]<>"";IF(AND([.B429]<>"";[.C429]<>"");"";"ERR");"") -> 
B430: of:=IF( ISBLANK([$'03.Muestra'.$C$23]);"";[$'03.Muestra'.$C$23]) ->  | C430: of:=IF( ISBLANK([$'03.Muestra'.$E$23]);"";[$'03.Muestra'.$E$23]) ->  | D430: of:=IF(AND([.B430]<>"";[.C430]<>"");"N/T";"") ->  | E430: of:=IF([.D430]<>"";IF(AND([.B430]<>"";[.C430]<>"");"";"ERR");"") -> 
B431: of:=IF( ISBLANK([$'03.Muestra'.$C$24]);"";[$'03.Muestra'.$C$24]) ->  | C431: of:=IF( ISBLANK([$'03.Muestra'.$E$24]);"";[$'03.Muestra'.$E$24]) ->  | D431: of:=IF(AND([.B431]<>"";[.C431]<>"");"N/T";"") ->  | E431: of:=IF([.D431]<>"";IF(AND([.B431]<>"";[.C431]<>"");"";"ERR");"") -> 
B432: of:=IF( ISBLANK([$'03.Muestra'.$C$25]);"";[$'03.Muestra'.$C$25]) ->  | C432: of:=IF( ISBLANK([$'03.Muestra'.$E$25]);"";[$'03.Muestra'.$E$25]) ->  | D432: of:=IF(AND([.B432]<>"";[.C432]<>"");"N/T";"") ->  | E432: of:=IF([.D432]<>"";IF(AND([.B432]<>"";[.C432]<>"");"";"ERR");"") -> 
B433: of:=IF( ISBLANK([$'03.Muestra'.$C$26]);"";[$'03.Muestra'.$C$26]) ->  | C433: of:=IF( ISBLANK([$'03.Muestra'.$E$26]);"";[$'03.Muestra'.$E$26]) ->  | D433: of:=IF(AND([.B433]<>"";[.C433]<>"");"N/T";"") ->  | E433: of:=IF([.D433]<>"";IF(AND([.B433]<>"";[.C433]<>"");"";"ERR");"") -> 
B434: of:=IF( ISBLANK([$'03.Muestra'.$C$27]);"";[$'03.Muestra'.$C$27]) ->  | C434: of:=IF( ISBLANK([$'03.Muestra'.$E$27]);"";[$'03.Muestra'.$E$27]) ->  | D434: of:=IF(AND([.B434]<>"";[.C434]<>"");"N/T";"") ->  | E434: of:=IF([.D434]<>"";IF(AND([.B434]<>"";[.C434]<>"");"";"ERR");"") -> 
B435: of:=IF( ISBLANK([$'03.Muestra'.$C$28]);"";[$'03.Muestra'.$C$28]) ->  | C435: of:=IF( ISBLANK([$'03.Muestra'.$E$28]);"";[$'03.Muestra'.$E$28]) ->  | D435: of:=IF(AND([.B435]<>"";[.C435]<>"");"N/T";"") ->  | E435: of:=IF([.D435]<>"";IF(AND([.B435]<>"";[.C435]<>"");"";"ERR");"") -> 
B436: of:=IF( ISBLANK([$'03.Muestra'.$C$29]);"";[$'03.Muestra'.$C$29]) ->  | C436: of:=IF( ISBLANK([$'03.Muestra'.$E$29]);"";[$'03.Muestra'.$E$29]) ->  | D436: of:=IF(AND([.B436]<>"";[.C436]<>"");"N/T";"") ->  | E436: of:=IF([.D436]<>"";IF(AND([.B436]<>"";[.C436]<>"");"";"ERR");"") -> 
B437: of:=IF( ISBLANK([$'03.Muestra'.$C$30]);"";[$'03.Muestra'.$C$30]) ->  | C437: of:=IF( ISBLANK([$'03.Muestra'.$E$30]);"";[$'03.Muestra'.$E$30]) ->  | D437: of:=IF(AND([.B437]<>"";[.C437]<>"");"N/T";"") ->  | E437: of:=IF([.D437]<>"";IF(AND([.B437]<>"";[.C437]<>"");"";"ERR");"") -> 
B438: of:=IF( ISBLANK([$'03.Muestra'.$C$31]);"";[$'03.Muestra'.$C$31]) ->  | C438: of:=IF( ISBLANK([$'03.Muestra'.$E$31]);"";[$'03.Muestra'.$E$31]) ->  | D438: of:=IF(AND([.B438]<>"";[.C438]<>"");"N/T";"") ->  | E438: of:=IF([.D438]<>"";IF(AND([.B438]<>"";[.C438]<>"");"";"ERR");"") -> 
B439: of:=IF( ISBLANK([$'03.Muestra'.$C$32]);"";[$'03.Muestra'.$C$32]) ->  | C439: of:=IF( ISBLANK([$'03.Muestra'.$E$32]);"";[$'03.Muestra'.$E$32]) ->  | D439: of:=IF(AND([.B439]<>"";[.C439]<>"");"N/T";"") ->  | E439: of:=IF([.D439]<>"";IF(AND([.B439]<>"";[.C439]<>"");"";"ERR");"") -> 
B440: of:=IF( ISBLANK([$'03.Muestra'.$C$33]);"";[$'03.Muestra'.$C$33]) ->  | C440: of:=IF( ISBLANK([$'03.Muestra'.$E$33]);"";[$'03.Muestra'.$E$33]) ->  | D440: of:=IF(AND([.B440]<>"";[.C440]<>"");"N/T";"") ->  | E440: of:=IF([.D440]<>"";IF(AND([.B440]<>"";[.C440]<>"");"";"ERR");"") -> 
B441: of:=IF( ISBLANK([$'03.Muestra'.$C$34]);"";[$'03.Muestra'.$C$34]) ->  | C441: of:=IF( ISBLANK([$'03.Muestra'.$E$34]);"";[$'03.Muestra'.$E$34]) ->  | D441: of:=IF(AND([.B441]<>"";[.C441]<>"");"N/T";"") ->  | E441: of:=IF([.D441]<>"";IF(AND([.B441]<>"";[.C441]<>"");"";"ERR");"") -> 
B442: of:=IF( ISBLANK([$'03.Muestra'.$C$35]);"";[$'03.Muestra'.$C$35]) ->  | C442: of:=IF( ISBLANK([$'03.Muestra'.$E$35]);"";[$'03.Muestra'.$E$35]) ->  | D442: of:=IF(AND([.B442]<>"";[.C442]<>"");"N/T";"") ->  | E442: of:=IF([.D442]<>"";IF(AND([.B442]<>"";[.C442]<>"");"";"ERR");"") -> 
B443: of:=IF( ISBLANK([$'03.Muestra'.$C$36]);"";[$'03.Muestra'.$C$36]) ->  | C443: of:=IF( ISBLANK([$'03.Muestra'.$E$36]);"";[$'03.Muestra'.$E$36]) ->  | D443: of:=IF(AND([.B443]<>"";[.C443]<>"");"N/T";"") ->  | E443: of:=IF([.D443]<>"";IF(AND([.B443]<>"";[.C443]<>"");"";"ERR");"") -> 
B444: of:=IF( ISBLANK([$'03.Muestra'.$C$37]);"";[$'03.Muestra'.$C$37]) ->  | C444: of:=IF( ISBLANK([$'03.Muestra'.$E$37]);"";[$'03.Muestra'.$E$37]) ->  | D444: of:=IF(AND([.B444]<>"";[.C444]<>"");"N/T";"") ->  | E444: of:=IF([.D444]<>"";IF(AND([.B444]<>"";[.C444]<>"");"";"ERR");"") -> 
B447: AA | C447: 1.4.3 Contraste (mÃ­nimo) | D447: Resultado
B448: of:=IF( ISBLANK([$'03.Muestra'.$C$8]);"";[$'03.Muestra'.$C$8]) ->  | C448: of:=IF( ISBLANK([$'03.Muestra'.$E$8]);"";[$'03.Muestra'.$E$8]) ->  | D448: of:=IF(AND([.B448]<>"";[.C448]<>"");"N/T";"") ->  | E448: of:=IF([.D448]<>"";IF(AND([.B448]<>"";[.C448]<>"");"";"ERR");"") ->  | F448: of:=TRANSPOSE([$'DATA - Oculta'.$U$9:$'DATA - Oculta'.$U$13]) -> N/T | G448: N/D | H448: N/A | I448: Falla | J448: Pasa | K448: En blanco
B449: of:=IF( ISBLANK([$'03.Muestra'.$C$9]);"";[$'03.Muestra'.$C$9]) ->  | C449: of:=IF( ISBLANK([$'03.Muestra'.$E$9]);"";[$'03.Muestra'.$E$9]) ->  | D449: of:=IF(AND([.B449]<>"";[.C449]<>"");"N/T";"") ->  | E449: of:=IF([.D449]<>"";IF(AND([.B449]<>"";[.C449]<>"");"";"ERR");"") ->  | F449: of:=COUNTIF([.$D448]:INDIRECT("$D" &  SUM(ROW()-1;['03.Muestra'.$D$40])-1);[.F448]) -> 0 | G449: of:=COUNTIF([.$D448]:INDIRECT("$D" &  SUM(ROW()-1;['03.Muestra'.$D$40])-1);[.G448]) -> 0 | H449: of:=COUNTIF([.$D448]:INDIRECT("$D" &  SUM(ROW()-1;['03.Muestra'.$D$40])-1);[.H448]) -> 0 | I449: of:=COUNTIF([.$D448]:INDIRECT("$D" &  SUM(ROW()-1;['03.Muestra'.$D$40])-1);[.I448]) -> 0 | J449: of:=COUNTIF([.$D448]:INDIRECT("$D" &  SUM(ROW()-1;['03.Muestra'.$D$40])-1);[.J448]) -> 0 | K449: of:=IF(['03.Muestra'.$D$40]=0;0;COUNTBLANK([.$D448]:INDIRECT("$D" &  SUM(ROW()-1;['03.Muestra'.$D$40])-1))) -> 0
B450: of:=IF( ISBLANK([$'03.Muestra'.$C$10]);"";[$'03.Muestra'.$C$10]) ->  | C450: of:=IF( ISBLANK([$'03.Muestra'.$E$10]);"";[$'03.Muestra'.$E$10]) ->  | D450: of:=IF(AND([.B450]<>"";[.C450]<>"");"N/T";"") ->  | E450: of:=IF([.D450]<>"";IF(AND([.B450]<>"";[.C450]<>"");"";"ERR");"") -> 
B451: of:=IF( ISBLANK([$'03.Muestra'.$C$11]);"";[$'03.Muestra'.$C$11]) ->  | C451: of:=IF( ISBLANK([$'03.Muestra'.$E$11]);"";[$'03.Muestra'.$E$11]) ->  | D451: of:=IF(AND([.B451]<>"";[.C451]<>"");"N/T";"") ->  | E451: of:=IF([.D451]<>"";IF(AND([.B451]<>"";[.C451]<>"");"";"ERR");"") -> 
B452: of:=IF( ISBLANK([$'03.Muestra'.$C$12]);"";[$'03.Muestra'.$C$12]) ->  | C452: of:=IF( ISBLANK([$'03.Muestra'.$E$12]);"";[$'03.Muestra'.$E$12]) ->  | D452: of:=IF(AND([.B452]<>"";[.C452]<>"");"N/T";"") ->  | E452: of:=IF([.D452]<>"";IF(AND([.B452]<>"";[.C452]<>"");"";"ERR");"") -> 
B453: of:=IF( ISBLANK([$'03.Muestra'.$C$13]);"";[$'03.Muestra'.$C$13]) ->  | C453: of:=IF( ISBLANK([$'03.Muestra'.$E$13]);"";[$'03.Muestra'.$E$13]) ->  | D453: of:=IF(AND([.B453]<>"";[.C453]<>"");"N/T";"") ->  | E453: of:=IF([.D453]<>"";IF(AND([.B453]<>"";[.C453]<>"");"";"ERR");"") -> 
B454: of:=IF( ISBLANK([$'03.Muestra'.$C$14]);"";[$'03.Muestra'.$C$14]) ->  | C454: of:=IF( ISBLANK([$'03.Muestra'.$E$14]);"";[$'03.Muestra'.$E$14]) ->  | D454: of:=IF(AND([.B454]<>"";[.C454]<>"");"N/T";"") ->  | E454: of:=IF([.D454]<>"";IF(AND([.B454]<>"";[.C454]<>"");"";"ERR");"") -> 
B455: of:=IF( ISBLANK([$'03.Muestra'.$C$15]);"";[$'03.Muestra'.$C$15]) ->  | C455: of:=IF( ISBLANK([$'03.Muestra'.$E$15]);"";[$'03.Muestra'.$E$15]) ->  | D455: of:=IF(AND([.B455]<>"";[.C455]<>"");"N/T";"") ->  | E455: of:=IF([.D455]<>"";IF(AND([.B455]<>"";[.C455]<>"");"";"ERR");"") -> 
B456: of:=IF( ISBLANK([$'03.Muestra'.$C$16]);"";[$'03.Muestra'.$C$16]) ->  | C456: of:=IF( ISBLANK([$'03.Muestra'.$E$16]);"";[$'03.Muestra'.$E$16]) ->  | D456: of:=IF(AND([.B456]<>"";[.C456]<>"");"N/T";"") ->  | E456: of:=IF([.D456]<>"";IF(AND([.B456]<>"";[.C456]<>"");"";"ERR");"") -> 
B457: of:=IF( ISBLANK([$'03.Muestra'.$C$17]);"";[$'03.Muestra'.$C$17]) ->  | C457: of:=IF( ISBLANK([$'03.Muestra'.$E$17]);"";[$'03.Muestra'.$E$17]) ->  | D457: of:=IF(AND([.B457]<>"";[.C457]<>"");"N/T";"") ->  | E457: of:=IF([.D457]<>"";IF(AND([.B457]<>"";[.C457]<>"");"";"ERR");"") -> 
B458: of:=IF( ISBLANK([$'03.Muestra'.$C$18]);"";[$'03.Muestra'.$C$18]) ->  | C458: of:=IF( ISBLANK([$'03.Muestra'.$E$18]);"";[$'03.Muestra'.$E$18]) ->  | D458: of:=IF(AND([.B458]<>"";[.C458]<>"");"N/T";"") ->  | E458: of:=IF([.D458]<>"";IF(AND([.B458]<>"";[.C458]<>"");"";"ERR");"") -> 
B459: of:=IF( ISBLANK([$'03.Muestra'.$C$19]);"";[$'03.Muestra'.$C$19]) ->  | C459: of:=IF( ISBLANK([$'03.Muestra'.$E$19]);"";[$'03.Muestra'.$E$19]) ->  | D459: of:=IF(AND([.B459]<>"";[.C459]<>"");"N/T";"") ->  | E459: of:=IF([.D459]<>"";IF(AND([.B459]<>"";[.C459]<>"");"";"ERR");"") -> 
B460: of:=IF( ISBLANK([$'03.Muestra'.$C$20]);"";[$'03.Muestra'.$C$20]) ->  | C460: of:=IF( ISBLANK([$'03.Muestra'.$E$20]);"";[$'03.Muestra'.$E$20]) ->  | D460: of:=IF(AND([.B460]<>"";[.C460]<>"");"N/T";"") ->  | E460: of:=IF([.D460]<>"";IF(AND([.B460]<>"";[.C460]<>"");"";"ERR");"") -> 
B461: of:=IF( ISBLANK([$'03.Muestra'.$C$21]);"";[$'03.Muestra'.$C$21]) ->  | C461: of:=IF( ISBLANK([$'03.Muestra'.$E$21]);"";[$'03.Muestra'.$E$21]) ->  | D461: of:=IF(AND([.B461]<>"";[.C461]<>"");"N/T";"") ->  | E461: of:=IF([.D461]<>"";IF(AND([.B461]<>"";[.C461]<>"");"";"ERR");"") -> 
B462: of:=IF( ISBLANK([$'03.Muestra'.$C$22]);"";[$'03.Muestra'.$C$22]) ->  | C462: of:=IF( ISBLANK([$'03.Muestra'.$E$22]);"";[$'03.Muestra'.$E$22]) ->  | D462: of:=IF(AND([.B462]<>"";[.C462]<>"");"N/T";"") ->  | E462: of:=IF([.D462]<>"";IF(AND([.B462]<>"";[.C462]<>"");"";"ERR");"") -> 
B463: of:=IF( ISBLANK([$'03.Muestra'.$C$23]);"";[$'03.Muestra'.$C$23]) ->  | C463: of:=IF( ISBLANK([$'03.Muestra'.$E$23]);"";[$'03.Muestra'.$E$23]) ->  | D463: of:=IF(AND([.B463]<>"";[.C463]<>"");"N/T";"") ->  | E463: of:=IF([.D463]<>"";IF(AND([.B463]<>"";[.C463]<>"");"";"ERR");"") -> 
B464: of:=IF( ISBLANK([$'03.Muestra'.$C$24]);"";[$'03.Muestra'.$C$24]) ->  | C464: of:=IF( ISBLANK([$'03.Muestra'.$E$24]);"";[$'03.Muestra'.$E$24]) ->  | D464: of:=IF(AND([.B464]<>"";[.C464]<>"");"N/T";"") ->  | E464: of:=IF([.D464]<>"";IF(AND([.B464]<>"";[.C464]<>"");"";"ERR");"") -> 
B465: of:=IF( ISBLANK([$'03.Muestra'.$C$25]);"";[$'03.Muestra'.$C$25]) ->  | C465: of:=IF( ISBLANK([$'03.Muestra'.$E$25]);"";[$'03.Muestra'.$E$25]) ->  | D465: of:=IF(AND([.B465]<>"";[.C465]<>"");"N/T";"") ->  | E465: of:=IF([.D465]<>"";IF(AND([.B465]<>"";[.C465]<>"");"";"ERR");"") -> 
B466: of:=IF( ISBLANK([$'03.Muestra'.$C$26]);"";[$'03.Muestra'.$C$26]) ->  | C466: of:=IF( ISBLANK([$'03.Muestra'.$E$26]);"";[$'03.Muestra'.$E$26]) ->  | D466: of:=IF(AND([.B466]<>"";[.C466]<>"");"N/T";"") ->  | E466: of:=IF([.D466]<>"";IF(AND([.B466]<>"";[.C466]<>"");"";"ERR");"") -> 
B467: of:=IF( ISBLANK([$'03.Muestra'.$C$27]);"";[$'03.Muestra'.$C$27]) ->  | C467: of:=IF( ISBLANK([$'03.Muestra'.$E$27]);"";[$'03.Muestra'.$E$27]) ->  | D467: of:=IF(AND([.B467]<>"";[.C467]<>"");"N/T";"") ->  | E467: of:=IF([.D467]<>"";IF(AND([.B467]<>"";[.C467]<>"");"";"ERR");"") -> 
B468: of:=IF( ISBLANK([$'03.Muestra'.$C$28]);"";[$'03.Muestra'.$C$28]) ->  | C468: of:=IF( ISBLANK([$'03.Muestra'.$E$28]);"";[$'03.Muestra'.$E$28]) ->  | D468: of:=IF(AND([.B468]<>"";[.C468]<>"");"N/T";"") ->  | E468: of:=IF([.D468]<>"";IF(AND([.B468]<>"";[.C468]<>"");"";"ERR");"") -> 
B469: of:=IF( ISBLANK([$'03.Muestra'.$C$29]);"";[$'03.Muestra'.$C$29]) ->  | C469: of:=IF( ISBLANK([$'03.Muestra'.$E$29]);"";[$'03.Muestra'.$E$29]) ->  | D469: of:=IF(AND([.B469]<>"";[.C469]<>"");"N/T";"") ->  | E469: of:=IF([.D469]<>"";IF(AND([.B469]<>"";[.C469]<>"");"";"ERR");"") -> 
B470: of:=IF( ISBLANK([$'03.Muestra'.$C$30]);"";[$'03.Muestra'.$C$30]) ->  | C470: of:=IF( ISBLANK([$'03.Muestra'.$E$30]);"";[$'03.Muestra'.$E$30]) ->  | D470: of:=IF(AND([.B470]<>"";[.C470]<>"");"N/T";"") ->  | E470: of:=IF([.D470]<>"";IF(AND([.B470]<>"";[.C470]<>"");"";"ERR");"") -> 
B471: of:=IF( ISBLANK([$'03.Muestra'.$C$31]);"";[$'03.Muestra'.$C$31]) ->  | C471: of:=IF( ISBLANK([$'03.Muestra'.$E$31]);"";[$'03.Muestra'.$E$31]) ->  | D471: of:=IF(AND([.B471]<>"";[.C471]<>"");"N/T";"") ->  | E471: of:=IF([.D471]<>"";IF(AND([.B471]<>"";[.C471]<>"");"";"ERR");"") -> 
B472: of:=IF( ISBLANK([$'03.Muestra'.$C$32]);"";[$'03.Muestra'.$C$32]) ->  | C472: of:=IF( ISBLANK([$'03.Muestra'.$E$32]);"";[$'03.Muestra'.$E$32]) ->  | D472: of:=IF(AND([.B472]<>"";[.C472]<>"");"N/T";"") ->  | E472: of:=IF([.D472]<>"";IF(AND([.B472]<>"";[.C472]<>"");"";"ERR");"") -> 
B473: of:=IF( ISBLANK([$'03.Muestra'.$C$33]);"";[$'03.Muestra'.$C$33]) ->  | C473: of:=IF( ISBLANK([$'03.Muestra'.$E$33]);"";[$'03.Muestra'.$E$33]) ->  | D473: of:=IF(AND([.B473]<>"";[.C473]<>"");"N/T";"") ->  | E473: of:=IF([.D473]<>"";IF(AND([.B473]<>"";[.C473]<>"");"";"ERR");"") -> 
B474: of:=IF( ISBLANK([$'03.Muestra'.$C$34]);"";[$'03.Muestra'.$C$34]) ->  | C474: of:=IF( ISBLANK([$'03.Muestra'.$E$34]);"";[$'03.Muestra'.$E$34]) ->  | D474: of:=IF(AND([.B474]<>"";[.C474]<>"");"N/T";"") ->  | E474: of:=IF([.D474]<>"";IF(AND([.B474]<>"";[.C474]<>"");"";"ERR");"") -> 
B475: of:=IF( ISBLANK([$'03.Muestra'.$C$35]);"";[$'03.Muestra'.$C$35]) ->  | C475: of:=IF( ISBLANK([$'03.Muestra'.$E$35]);"";[$'03.Muestra'.$E$35]) ->  | D475: of:=IF(AND([.B475]<>"";[.C475]<>"");"N/T";"") ->  | E475: of:=IF([.D475]<>"";IF(AND([.B475]<>"";[.C475]<>"");"";"ERR");"") -> 
B476: of:=IF( ISBLANK([$'03.Muestra'.$C$36]);"";[$'03.Muestra'.$C$36]) ->  | C476: of:=IF( ISBLANK([$'03.Muestra'.$E$36]);"";[$'03.Muestra'.$E$36]) ->  | D476: of:=IF(AND([.B476]<>"";[.C476]<>"");"N/T";"") ->  | E476: of:=IF([.D476]<>"";IF(AND([.B476]<>"";[.C476]<>"");"";"ERR");"") -> 
B477: of:=IF( ISBLANK([$'03.Muestra'.$C$37]);"";[$'03.Muestra'.$C$37]) ->  | C477: of:=IF( ISBLANK([$'03.Muestra'.$E$37]);"";[$'03.Muestra'.$E$37]) ->  | D477: of:=IF(AND([.B477]<>"";[.C477]<>"");"N/T";"") ->  | E477: of:=IF([.D477]<>"";IF(AND([.B477]<>"";[.C477]<>"");"";"ERR");"") -> 
B480: AA | C480: 1.4.4 RedimensiÃ³n del texto | D480: Resultado
B481: of:=IF( ISBLANK([$'03.Muestra'.$C$8]);"";[$'03.Muestra'.$C$8]) ->  | C481: of:=IF( ISBLANK([$'03.Muestra'.$E$8]);"";[$'03.Muestra'.$E$8]) ->  | D481: of:=IF(AND([.B481]<>"";[.C481]<>"");"N/T";"") ->  | E481: of:=IF([.D481]<>"";IF(AND([.B481]<>"";[.C481]<>"");"";"ERR");"") ->  | F481: of:=TRANSPOSE([$'DATA - Oculta'.$U$9:$'DATA - Oculta'.$U$13]) -> N/T | G481: N/D | H481: N/A | I481: Falla | J481: Pasa | K481: En blanco
B482: of:=IF( ISBLANK([$'03.Muestra'.$C$9]);"";[$'03.Muestra'.$C$9]) ->  | C482: of:=IF( ISBLANK([$'03.Muestra'.$E$9]);"";[$'03.Muestra'.$E$9]) ->  | D482: of:=IF(AND([.B482]<>"";[.C482]<>"");"N/T";"") ->  | E482: of:=IF([.D482]<>"";IF(AND([.B482]<>"";[.C482]<>"");"";"ERR");"") ->  | F482: of:=COUNTIF([.$D481]:INDIRECT("$D" &  SUM(ROW()-1;['03.Muestra'.$D$40])-1);[.F481]) -> 0 | G482: of:=COUNTIF([.$D481]:INDIRECT("$D" &  SUM(ROW()-1;['03.Muestra'.$D$40])-1);[.G481]) -> 0 | H482: of:=COUNTIF([.$D481]:INDIRECT("$D" &  SUM(ROW()-1;['03.Muestra'.$D$40])-1);[.H481]) -> 0 | I482: of:=COUNTIF([.$D481]:INDIRECT("$D" &  SUM(ROW()-1;['03.Muestra'.$D$40])-1);[.I481]) -> 0 | J482: of:=COUNTIF([.$D481]:INDIRECT("$D" &  SUM(ROW()-1;['03.Muestra'.$D$40])-1);[.J481]) -> 0 | K482: of:=IF(['03.Muestra'.$D$40]=0;0;COUNTBLANK([.$D481]:INDIRECT("$D" &  SUM(ROW()-1;['03.Muestra'.$D$40])-1))) -> 0
B483: of:=IF( ISBLANK([$'03.Muestra'.$C$10]);"";[$'03.Muestra'.$C$10]) ->  | C483: of:=IF( ISBLANK([$'03.Muestra'.$E$10]);"";[$'03.Muestra'.$E$10]) ->  | D483: of:=IF(AND([.B483]<>"";[.C483]<>"");"N/T";"") ->  | E483: of:=IF([.D483]<>"";IF(AND([.B483]<>"";[.C483]<>"");"";"ERR");"") -> 
B484: of:=IF( ISBLANK([$'03.Muestra'.$C$11]);"";[$'03.Muestra'.$C$11]) ->  | C484: of:=IF( ISBLANK([$'03.Muestra'.$E$11]);"";[$'03.Muestra'.$E$11]) ->  | D484: of:=IF(AND([.B484]<>"";[.C484]<>"");"N/T";"") ->  | E484: of:=IF([.D484]<>"";IF(AND([.B484]<>"";[.C484]<>"");"";"ERR");"") -> 
B485: of:=IF( ISBLANK([$'03.Muestra'.$C$12]);"";[$'03.Muestra'.$C$12]) ->  | C485: of:=IF( ISBLANK([$'03.Muestra'.$E$12]);"";[$'03.Muestra'.$E$12]) ->  | D485: of:=IF(AND([.B485]<>"";[.C485]<>"");"N/T";"") ->  | E485: of:=IF([.D485]<>"";IF(AND([.B485]<>"";[.C485]<>"");"";"ERR");"") -> 
B486: of:=IF( ISBLANK([$'03.Muestra'.$C$13]);"";[$'03.Muestra'.$C$13]) ->  | C486: of:=IF( ISBLANK([$'03.Muestra'.$E$13]);"";[$'03.Muestra'.$E$13]) ->  | D486: of:=IF(AND([.B486]<>"";[.C486]<>"");"N/T";"") ->  | E486: of:=IF([.D486]<>"";IF(AND([.B486]<>"";[.C486]<>"");"";"ERR");"") -> 
B487: of:=IF( ISBLANK([$'03.Muestra'.$C$14]);"";[$'03.Muestra'.$C$14]) ->  | C487: of:=IF( ISBLANK([$'03.Muestra'.$E$14]);"";[$'03.Muestra'.$E$14]) ->  | D487: of:=IF(AND([.B487]<>"";[.C487]<>"");"N/T";"") ->  | E487: of:=IF([.D487]<>"";IF(AND([.B487]<>"";[.C487]<>"");"";"ERR");"") -> 
B488: of:=IF( ISBLANK([$'03.Muestra'.$C$15]);"";[$'03.Muestra'.$C$15]) ->  | C488: of:=IF( ISBLANK([$'03.Muestra'.$E$15]);"";[$'03.Muestra'.$E$15]) ->  | D488: of:=IF(AND([.B488]<>"";[.C488]<>"");"N/T";"") ->  | E488: of:=IF([.D488]<>"";IF(AND([.B488]<>"";[.C488]<>"");"";"ERR");"") -> 
B489: of:=IF( ISBLANK([$'03.Muestra'.$C$16]);"";[$'03.Muestra'.$C$16]) ->  | C489: of:=IF( ISBLANK([$'03.Muestra'.$E$16]);"";[$'03.Muestra'.$E$16]) ->  | D489: of:=IF(AND([.B489]<>"";[.C489]<>"");"N/T";"") ->  | E489: of:=IF([.D489]<>"";IF(AND([.B489]<>"";[.C489]<>"");"";"ERR");"") -> 
B490: of:=IF( ISBLANK([$'03.Muestra'.$C$17]);"";[$'03.Muestra'.$C$17]) ->  | C490: of:=IF( ISBLANK([$'03.Muestra'.$E$17]);"";[$'03.Muestra'.$E$17]) ->  | D490: of:=IF(AND([.B490]<>"";[.C490]<>"");"N/T";"") ->  | E490: of:=IF([.D490]<>"";IF(AND([.B490]<>"";[.C490]<>"");"";"ERR");"") -> 
B491: of:=IF( ISBLANK([$'03.Muestra'.$C$18]);"";[$'03.Muestra'.$C$18]) ->  | C491: of:=IF( ISBLANK([$'03.Muestra'.$E$18]);"";[$'03.Muestra'.$E$18]) ->  | D491: of:=IF(AND([.B491]<>"";[.C491]<>"");"N/T";"") ->  | E491: of:=IF([.D491]<>"";IF(AND([.B491]<>"";[.C491]<>"");"";"ERR");"") -> 
B492: of:=IF( ISBLANK([$'03.Muestra'.$C$19]);"";[$'03.Muestra'.$C$19]) ->  | C492: of:=IF( ISBLANK([$'03.Muestra'.$E$19]);"";[$'03.Muestra'.$E$19]) ->  | D492: of:=IF(AND([.B492]<>"";[.C492]<>"");"N/T";"") ->  | E492: of:=IF([.D492]<>"";IF(AND([.B492]<>"";[.C492]<>"");"";"ERR");"") -> 
B493: of:=IF( ISBLANK([$'03.Muestra'.$C$20]);"";[$'03.Muestra'.$C$20]) ->  | C493: of:=IF( ISBLANK([$'03.Muestra'.$E$20]);"";[$'03.Muestra'.$E$20]) ->  | D493: of:=IF(AND([.B493]<>"";[.C493]<>"");"N/T";"") ->  | E493: of:=IF([.D493]<>"";IF(AND([.B493]<>"";[.C493]<>"");"";"ERR");"") -> 
B494: of:=IF( ISBLANK([$'03.Muestra'.$C$21]);"";[$'03.Muestra'.$C$21]) ->  | C494: of:=IF( ISBLANK([$'03.Muestra'.$E$21]);"";[$'03.Muestra'.$E$21]) ->  | D494: of:=IF(AND([.B494]<>"";[.C494]<>"");"N/T";"") ->  | E494: of:=IF([.D494]<>"";IF(AND([.B494]<>"";[.C494]<>"");"";"ERR");"") -> 
B495: of:=IF( ISBLANK([$'03.Muestra'.$C$22]);"";[$'03.Muestra'.$C$22]) ->  | C495: of:=IF( ISBLANK([$'03.Muestra'.$E$22]);"";[$'03.Muestra'.$E$22]) ->  | D495: of:=IF(AND([.B495]<>"";[.C495]<>"");"N/T";"") ->  | E495: of:=IF([.D495]<>"";IF(AND([.B495]<>"";[.C495]<>"");"";"ERR");"") -> 
B496: of:=IF( ISBLANK([$'03.Muestra'.$C$23]);"";[$'03.Muestra'.$C$23]) ->  | C496: of:=IF( ISBLANK([$'03.Muestra'.$E$23]);"";[$'03.Muestra'.$E$23]) ->  | D496: of:=IF(AND([.B496]<>"";[.C496]<>"");"N/T";"") ->  | E496: of:=IF([.D496]<>"";IF(AND([.B496]<>"";[.C496]<>"");"";"ERR");"") -> 
B497: of:=IF( ISBLANK([$'03.Muestra'.$C$24]);"";[$'03.Muestra'.$C$24]) ->  | C497: of:=IF( ISBLANK([$'03.Muestra'.$E$24]);"";[$'03.Muestra'.$E$24]) ->  | D497: of:=IF(AND([.B497]<>"";[.C497]<>"");"N/T";"") ->  | E497: of:=IF([.D497]<>"";IF(AND([.B497]<>"";[.C497]<>"");"";"ERR");"") -> 
B498: of:=IF( ISBLANK([$'03.Muestra'.$C$25]);"";[$'03.Muestra'.$C$25]) ->  | C498: of:=IF( ISBLANK([$'03.Muestra'.$E$25]);"";[$'03.Muestra'.$E$25]) ->  | D498: of:=IF(AND([.B498]<>"";[.C498]<>"");"N/T";"") ->  | E498: of:=IF([.D498]<>"";IF(AND([.B498]<>"";[.C498]<>"");"";"ERR");"") -> 
B499: of:=IF( ISBLANK([$'03.Muestra'.$C$26]);"";[$'03.Muestra'.$C$26]) ->  | C499: of:=IF( ISBLANK([$'03.Muestra'.$E$26]);"";[$'03.Muestra'.$E$26]) ->  | D499: of:=IF(AND([.B499]<>"";[.C499]<>"");"N/T";"") ->  | E499: of:=IF([.D499]<>"";IF(AND([.B499]<>"";[.C499]<>"");"";"ERR");"") -> 
B500: of:=IF( ISBLANK([$'03.Muestra'.$C$27]);"";[$'03.Muestra'.$C$27]) ->  | C500: of:=IF( ISBLANK([$'03.Muestra'.$E$27]);"";[$'03.Muestra'.$E$27]) ->  | D500: of:=IF(AND([.B500]<>"";[.C500]<>"");"N/T";"") ->  | E500: of:=IF([.D500]<>"";IF(AND([.B500]<>"";[.C500]<>"");"";"ERR");"") -> 
B501: of:=IF( ISBLANK([$'03.Muestra'.$C$28]);"";[$'03.Muestra'.$C$28]) ->  | C501: of:=IF( ISBLANK([$'03.Muestra'.$E$28]);"";[$'03.Muestra'.$E$28]) ->  | D501: of:=IF(AND([.B501]<>"";[.C501]<>"");"N/T";"") ->  | E501: of:=IF([.D501]<>"";IF(AND([.B501]<>"";[.C501]<>"");"";"ERR");"") -> 
B502: of:=IF( ISBLANK([$'03.Muestra'.$C$29]);"";[$'03.Muestra'.$C$29]) ->  | C502: of:=IF( ISBLANK([$'03.Muestra'.$E$29]);"";[$'03.Muestra'.$E$29]) ->  | D502: of:=IF(AND([.B502]<>"";[.C502]<>"");"N/T";"") ->  | E502: of:=IF([.D502]<>"";IF(AND([.B502]<>"";[.C502]<>"");"";"ERR");"") -> 
B503: of:=IF( ISBLANK([$'03.Muestra'.$C$30]);"";[$'03.Muestra'.$C$30]) ->  | C503: of:=IF( ISBLANK([$'03.Muestra'.$E$30]);"";[$'03.Muestra'.$E$30]) ->  | D503: of:=IF(AND([.B503]<>"";[.C503]<>"");"N/T";"") ->  | E503: of:=IF([.D503]<>"";IF(AND([.B503]<>"";[.C503]<>"");"";"ERR");"") -> 
B504: of:=IF( ISBLANK([$'03.Muestra'.$C$31]);"";[$'03.Muestra'.$C$31]) ->  | C504: of:=IF( ISBLANK([$'03.Muestra'.$E$31]);"";[$'03.Muestra'.$E$31]) ->  | D504: of:=IF(AND([.B504]<>"";[.C504]<>"");"N/T";"") ->  | E504: of:=IF([.D504]<>"";IF(AND([.B504]<>"";[.C504]<>"");"";"ERR");"") -> 
B505: of:=IF( ISBLANK([$'03.Muestra'.$C$32]);"";[$'03.Muestra'.$C$32]) ->  | C505: of:=IF( ISBLANK([$'03.Muestra'.$E$32]);"";[$'03.Muestra'.$E$32]) ->  | D505: of:=IF(AND([.B505]<>"";[.C505]<>"");"N/T";"") ->  | E505: of:=IF([.D505]<>"";IF(AND([.B505]<>"";[.C505]<>"");"";"ERR");"") -> 
B506: of:=IF( ISBLANK([$'03.Muestra'.$C$33]);"";[$'03.Muestra'.$C$33]) ->  | C506: of:=IF( ISBLANK([$'03.Muestra'.$E$33]);"";[$'03.Muestra'.$E$33]) ->  | D506: of:=IF(AND([.B506]<>"";[.C506]<>"");"N/T";"") ->  | E506: of:=IF([.D506]<>"";IF(AND([.B506]<>"";[.C506]<>"");"";"ERR");"") -> 
B507: of:=IF( ISBLANK([$'03.Muestra'.$C$34]);"";[$'03.Muestra'.$C$34]) ->  | C507: of:=IF( ISBLANK([$'03.Muestra'.$E$34]);"";[$'03.Muestra'.$E$34]) ->  | D507: of:=IF(AND([.B507]<>"";[.C507]<>"");"N/T";"") ->  | E507: of:=IF([.D507]<>"";IF(AND([.B507]<>"";[.C507]<>"");"";"ERR");"") -> 
B508: of:=IF( ISBLANK([$'03.Muestra'.$C$35]);"";[$'03.Muestra'.$C$35]) ->  | C508: of:=IF( ISBLANK([$'03.Muestra'.$E$35]);"";[$'03.Muestra'.$E$35]) ->  | D508: of:=IF(AND([.B508]<>"";[.C508]<>"");"N/T";"") ->  | E508: of:=IF([.D508]<>"";IF(AND([.B508]<>"";[.C508]<>"");"";"ERR");"") -> 
B509: of:=IF( ISBLANK([$'03.Muestra'.$C$36]);"";[$'03.Muestra'.$C$36]) ->  | C509: of:=IF( ISBLANK([$'03.Muestra'.$E$36]);"";[$'03.Muestra'.$E$36]) ->  | D509: of:=IF(AND([.B509]<>"";[.C509]<>"");"N/T";"") ->  | E509: of:=IF([.D509]<>"";IF(AND([.B509]<>"";[.C509]<>"");"";"ERR");"") -> 
B510: of:=IF( ISBLANK([$'03.Muestra'.$C$37]);"";[$'03.Muestra'.$C$37]) ->  | C510: of:=IF( ISBLANK([$'03.Muestra'.$E$37]);"";[$'03.Muestra'.$E$37]) ->  | D510: of:=IF(AND([.B510]<>"";[.C510]<>"");"N/T";"") ->  | E510: of:=IF([.D510]<>"";IF(AND([.B510]<>"";[.C510]<>"");"";"ERR");"") -> 
B513: AA | C513: 1.4.5 ImÃ¡genes de texto | D513: Resultado
B514: of:=IF( ISBLANK([$'03.Muestra'.$C$8]);"";[$'03.Muestra'.$C$8]) ->  | C514: of:=IF( ISBLANK([$'03.Muestra'.$E$8]);"";[$'03.Muestra'.$E$8]) ->  | D514: of:=IF(AND([.B514]<>"";[.C514]<>"");"N/T";"") ->  | E514: of:=IF([.D514]<>"";IF(AND([.B514]<>"";[.C514]<>"");"";"ERR");"") ->  | F514: of:=TRANSPOSE([$'DATA - Oculta'.$U$9:$'DATA - Oculta'.$U$13]) -> N/T | G514: N/D | H514: N/A | I514: Falla | J514: Pasa | K514: En blanco
B515: of:=IF( ISBLANK([$'03.Muestra'.$C$9]);"";[$'03.Muestra'.$C$9]) ->  | C515: of:=IF( ISBLANK([$'03.Muestra'.$E$9]);"";[$'03.Muestra'.$E$9]) ->  | D515: of:=IF(AND([.B515]<>"";[.C515]<>"");"N/T";"") ->  | E515: of:=IF([.D515]<>"";IF(AND([.B515]<>"";[.C515]<>"");"";"ERR");"") ->  | F515: of:=COUNTIF([.$D514]:INDIRECT("$D" &  SUM(ROW()-1;['03.Muestra'.$D$40])-1);[.F514]) -> 0 | G515: of:=COUNTIF([.$D514]:INDIRECT("$D" &  SUM(ROW()-1;['03.Muestra'.$D$40])-1);[.G514]) -> 0 | H515: of:=COUNTIF([.$D514]:INDIRECT("$D" &  SUM(ROW()-1;['03.Muestra'.$D$40])-1);[.H514]) -> 0 | I515: of:=COUNTIF([.$D514]:INDIRECT("$D" &  SUM(ROW()-1;['03.Muestra'.$D$40])-1);[.I514]) -> 0 | J515: of:=COUNTIF([.$D514]:INDIRECT("$D" &  SUM(ROW()-1;['03.Muestra'.$D$40])-1);[.J514]) -> 0 | K515: of:=IF(['03.Muestra'.$D$40]=0;0;COUNTBLANK([.$D514]:INDIRECT("$D" &  SUM(ROW()-1;['03.Muestra'.$D$40])-1))) -> 0
B516: of:=IF( ISBLANK([$'03.Muestra'.$C$10]);"";[$'03.Muestra'.$C$10]) ->  | C516: of:=IF( ISBLANK([$'03.Muestra'.$E$10]);"";[$'03.Muestra'.$E$10]) ->  | D516: of:=IF(AND([.B516]<>"";[.C516]<>"");"N/T";"") ->  | E516: of:=IF([.D516]<>"";IF(AND([.B516]<>"";[.C516]<>"");"";"ERR");"") -> 
B517: of:=IF( ISBLANK([$'03.Muestra'.$C$11]);"";[$'03.Muestra'.$C$11]) ->  | C517: of:=IF( ISBLANK([$'03.Muestra'.$E$11]);"";[$'03.Muestra'.$E$11]) ->  | D517: of:=IF(AND([.B517]<>"";[.C517]<>"");"N/T";"") ->  | E517: of:=IF([.D517]<>"";IF(AND([.B517]<>"";[.C517]<>"");"";"ERR");"") -> 
B518: of:=IF( ISBLANK([$'03.Muestra'.$C$12]);"";[$'03.Muestra'.$C$12]) ->  | C518: of:=IF( ISBLANK([$'03.Muestra'.$E$12]);"";[$'03.Muestra'.$E$12]) ->  | D518: of:=IF(AND([.B518]<>"";[.C518]<>"");"N/T";"") ->  | E518: of:=IF([.D518]<>"";IF(AND([.B518]<>"";[.C518]<>"");"";"ERR");"") -> 
B519: of:=IF( ISBLANK([$'03.Muestra'.$C$13]);"";[$'03.Muestra'.$C$13]) ->  | C519: of:=IF( ISBLANK([$'03.Muestra'.$E$13]);"";[$'03.Muestra'.$E$13]) ->  | D519: of:=IF(AND([.B519]<>"";[.C519]<>"");"N/T";"") ->  | E519: of:=IF([.D519]<>"";IF(AND([.B519]<>"";[.C519]<>"");"";"ERR");"") -> 
B520: of:=IF( ISBLANK([$'03.Muestra'.$C$14]);"";[$'03.Muestra'.$C$14]) ->  | C520: of:=IF( ISBLANK([$'03.Muestra'.$E$14]);"";[$'03.Muestra'.$E$14]) ->  | D520: of:=IF(AND([.B520]<>"";[.C520]<>"");"N/T";"") ->  | E520: of:=IF([.D520]<>"";IF(AND([.B520]<>"";[.C520]<>"");"";"ERR");"") -> 
B521: of:=IF( ISBLANK([$'03.Muestra'.$C$15]);"";[$'03.Muestra'.$C$15]) ->  | C521: of:=IF( ISBLANK([$'03.Muestra'.$E$15]);"";[$'03.Muestra'.$E$15]) ->  | D521: of:=IF(AND([.B521]<>"";[.C521]<>"");"N/T";"") ->  | E521: of:=IF([.D521]<>"";IF(AND([.B521]<>"";[.C521]<>"");"";"ERR");"") -> 
B522: of:=IF( ISBLANK([$'03.Muestra'.$C$16]);"";[$'03.Muestra'.$C$16]) ->  | C522: of:=IF( ISBLANK([$'03.Muestra'.$E$16]);"";[$'03.Muestra'.$E$16]) ->  | D522: of:=IF(AND([.B522]<>"";[.C522]<>"");"N/T";"") ->  | E522: of:=IF([.D522]<>"";IF(AND([.B522]<>"";[.C522]<>"");"";"ERR");"") -> 
B523: of:=IF( ISBLANK([$'03.Muestra'.$C$17]);"";[$'03.Muestra'.$C$17]) ->  | C523: of:=IF( ISBLANK([$'03.Muestra'.$E$17]);"";[$'03.Muestra'.$E$17]) ->  | D523: of:=IF(AND([.B523]<>"";[.C523]<>"");"N/T";"") ->  | E523: of:=IF([.D523]<>"";IF(AND([.B523]<>"";[.C523]<>"");"";"ERR");"") -> 
B524: of:=IF( ISBLANK([$'03.Muestra'.$C$18]);"";[$'03.Muestra'.$C$18]) ->  | C524: of:=IF( ISBLANK([$'03.Muestra'.$E$18]);"";[$'03.Muestra'.$E$18]) ->  | D524: of:=IF(AND([.B524]<>"";[.C524]<>"");"N/T";"") ->  | E524: of:=IF([.D524]<>"";IF(AND([.B524]<>"";[.C524]<>"");"";"ERR");"") -> 
B525: of:=IF( ISBLANK([$'03.Muestra'.$C$19]);"";[$'03.Muestra'.$C$19]) ->  | C525: of:=IF( ISBLANK([$'03.Muestra'.$E$19]);"";[$'03.Muestra'.$E$19]) ->  | D525: of:=IF(AND([.B525]<>"";[.C525]<>"");"N/T";"") ->  | E525: of:=IF([.D525]<>"";IF(AND([.B525]<>"";[.C525]<>"");"";"ERR");"") -> 
B526: of:=IF( ISBLANK([$'03.Muestra'.$C$20]);"";[$'03.Muestra'.$C$20]) ->  | C526: of:=IF( ISBLANK([$'03.Muestra'.$E$20]);"";[$'03.Muestra'.$E$20]) ->  | D526: of:=IF(AND([.B526]<>"";[.C526]<>"");"N/T";"") ->  | E526: of:=IF([.D526]<>"";IF(AND([.B526]<>"";[.C526]<>"");"";"ERR");"") -> 
B527: of:=IF( ISBLANK([$'03.Muestra'.$C$21]);"";[$'03.Muestra'.$C$21]) ->  | C527: of:=IF( ISBLANK([$'03.Muestra'.$E$21]);"";[$'03.Muestra'.$E$21]) ->  | D527: of:=IF(AND([.B527]<>"";[.C527]<>"");"N/T";"") ->  | E527: of:=IF([.D527]<>"";IF(AND([.B527]<>"";[.C527]<>"");"";"ERR");"") -> 
B528: of:=IF( ISBLANK([$'03.Muestra'.$C$22]);"";[$'03.Muestra'.$C$22]) ->  | C528: of:=IF( ISBLANK([$'03.Muestra'.$E$22]);"";[$'03.Muestra'.$E$22]) ->  | D528: of:=IF(AND([.B528]<>"";[.C528]<>"");"N/T";"") ->  | E528: of:=IF([.D528]<>"";IF(AND([.B528]<>"";[.C528]<>"");"";"ERR");"") -> 
B529: of:=IF( ISBLANK([$'03.Muestra'.$C$23]);"";[$'03.Muestra'.$C$23]) ->  | C529: of:=IF( ISBLANK([$'03.Muestra'.$E$23]);"";[$'03.Muestra'.$E$23]) ->  | D529: of:=IF(AND([.B529]<>"";[.C529]<>"");"N/T";"") ->  | E529: of:=IF([.D529]<>"";IF(AND([.B529]<>"";[.C529]<>"");"";"ERR");"") -> 
B530: of:=IF( ISBLANK([$'03.Muestra'.$C$24]);"";[$'03.Muestra'.$C$24]) ->  | C530: of:=IF( ISBLANK([$'03.Muestra'.$E$24]);"";[$'03.Muestra'.$E$24]) ->  | D530: of:=IF(AND([.B530]<>"";[.C530]<>"");"N/T";"") ->  | E530: of:=IF([.D530]<>"";IF(AND([.B530]<>"";[.C530]<>"");"";"ERR");"") -> 
B531: of:=IF( ISBLANK([$'03.Muestra'.$C$25]);"";[$'03.Muestra'.$C$25]) ->  | C531: of:=IF( ISBLANK([$'03.Muestra'.$E$25]);"";[$'03.Muestra'.$E$25]) ->  | D531: of:=IF(AND([.B531]<>"";[.C531]<>"");"N/T";"") ->  | E531: of:=IF([.D531]<>"";IF(AND([.B531]<>"";[.C531]<>"");"";"ERR");"") -> 
B532: of:=IF( ISBLANK([$'03.Muestra'.$C$26]);"";[$'03.Muestra'.$C$26]) ->  | C532: of:=IF( ISBLANK([$'03.Muestra'.$E$26]);"";[$'03.Muestra'.$E$26]) ->  | D532: of:=IF(AND([.B532]<>"";[.C532]<>"");"N/T";"") ->  | E532: of:=IF([.D532]<>"";IF(AND([.B532]<>"";[.C532]<>"");"";"ERR");"") -> 
B533: of:=IF( ISBLANK([$'03.Muestra'.$C$27]);"";[$'03.Muestra'.$C$27]) ->  | C533: of:=IF( ISBLANK([$'03.Muestra'.$E$27]);"";[$'03.Muestra'.$E$27]) ->  | D533: of:=IF(AND([.B533]<>"";[.C533]<>"");"N/T";"") ->  | E533: of:=IF([.D533]<>"";IF(AND([.B533]<>"";[.C533]<>"");"";"ERR");"") -> 
B534: of:=IF( ISBLANK([$'03.Muestra'.$C$28]);"";[$'03.Muestra'.$C$28]) ->  | C534: of:=IF( ISBLANK([$'03.Muestra'.$E$28]);"";[$'03.Muestra'.$E$28]) ->  | D534: of:=IF(AND([.B534]<>"";[.C534]<>"");"N/T";"") ->  | E534: of:=IF([.D534]<>"";IF(AND([.B534]<>"";[.C534]<>"");"";"ERR");"") -> 
B535: of:=IF( ISBLANK([$'03.Muestra'.$C$29]);"";[$'03.Muestra'.$C$29]) ->  | C535: of:=IF( ISBLANK([$'03.Muestra'.$E$29]);"";[$'03.Muestra'.$E$29]) ->  | D535: of:=IF(AND([.B535]<>"";[.C535]<>"");"N/T";"") ->  | E535: of:=IF([.D535]<>"";IF(AND([.B535]<>"";[.C535]<>"");"";"ERR");"") -> 
B536: of:=IF( ISBLANK([$'03.Muestra'.$C$30]);"";[$'03.Muestra'.$C$30]) ->  | C536: of:=IF( ISBLANK([$'03.Muestra'.$E$30]);"";[$'03.Muestra'.$E$30]) ->  | D536: of:=IF(AND([.B536]<>"";[.C536]<>"");"N/T";"") ->  | E536: of:=IF([.D536]<>"";IF(AND([.B536]<>"";[.C536]<>"");"";"ERR");"") -> 
B537: of:=IF( ISBLANK([$'03.Muestra'.$C$31]);"";[$'03.Muestra'.$C$31]) ->  | C537: of:=IF( ISBLANK([$'03.Muestra'.$E$31]);"";[$'03.Muestra'.$E$31]) ->  | D537: of:=IF(AND([.B537]<>"";[.C537]<>"");"N/T";"") ->  | E537: of:=IF([.D537]<>"";IF(AND([.B537]<>"";[.C537]<>"");"";"ERR");"") -> 
B538: of:=IF( ISBLANK([$'03.Muestra'.$C$32]);"";[$'03.Muestra'.$C$32]) ->  | C538: of:=IF( ISBLANK([$'03.Muestra'.$E$32]);"";[$'03.Muestra'.$E$32]) ->  | D538: of:=IF(AND([.B538]<>"";[.C538]<>"");"N/T";"") ->  | E538: of:=IF([.D538]<>"";IF(AND([.B538]<>"";[.C538]<>"");"";"ERR");"") -> 
B539: of:=IF( ISBLANK([$'03.Muestra'.$C$33]);"";[$'03.Muestra'.$C$33]) ->  | C539: of:=IF( ISBLANK([$'03.Muestra'.$E$33]);"";[$'03.Muestra'.$E$33]) ->  | D539: of:=IF(AND([.B539]<>"";[.C539]<>"");"N/T";"") ->  | E539: of:=IF([.D539]<>"";IF(AND([.B539]<>"";[.C539]<>"");"";"ERR");"") -> 
B540: of:=IF( ISBLANK([$'03.Muestra'.$C$34]);"";[$'03.Muestra'.$C$34]) ->  | C540: of:=IF( ISBLANK([$'03.Muestra'.$E$34]);"";[$'03.Muestra'.$E$34]) ->  | D540: of:=IF(AND([.B540]<>"";[.C540]<>"");"N/T";"") ->  | E540: of:=IF([.D540]<>"";IF(AND([.B540]<>"";[.C540]<>"");"";"ERR");"") -> 
B541: of:=IF( ISBLANK([$'03.Muestra'.$C$35]);"";[$'03.Muestra'.$C$35]) ->  | C541: of:=IF( ISBLANK([$'03.Muestra'.$E$35]);"";[$'03.Muestra'.$E$35]) ->  | D541: of:=IF(AND([.B541]<>"";[.C541]<>"");"N/T";"") ->  | E541: of:=IF([.D541]<>"";IF(AND([.B541]<>"";[.C541]<>"");"";"ERR");"") -> 
B542: of:=IF( ISBLANK([$'03.Muestra'.$C$36]);"";[$'03.Muestra'.$C$36]) ->  | C542: of:=IF( ISBLANK([$'03.Muestra'.$E$36]);"";[$'03.Muestra'.$E$36]) ->  | D542: of:=IF(AND([.B542]<>"";[.C542]<>"");"N/T";"") ->  | E542: of:=IF([.D542]<>"";IF(AND([.B542]<>"";[.C542]<>"");"";"ERR");"") -> 
B543: of:=IF( ISBLANK([$'03.Muestra'.$C$37]);"";[$'03.Muestra'.$C$37]) ->  | C543: of:=IF( ISBLANK([$'03.Muestra'.$E$37]);"";[$'03.Muestra'.$E$37]) ->  | D543: of:=IF(AND([.B543]<>"";[.C543]<>"");"N/T";"") ->  | E543: of:=IF([.D543]<>"";IF(AND([.B543]<>"";[.C543]<>"");"";"ERR");"") -> 
B546: AA | C546: 1.4.10 Reflow | D546: Resultado
B547: of:=IF( ISBLANK([$'03.Muestra'.$C$8]);"";[$'03.Muestra'.$C$8]) ->  | C547: of:=IF( ISBLANK([$'03.Muestra'.$E$8]);"";[$'03.Muestra'.$E$8]) ->  | D547: of:=IF(AND([.B547]<>"";[.C547]<>"");"N/T";"") ->  | E547: of:=IF([.D547]<>"";IF(AND([.B547]<>"";[.C547]<>"");"";"ERR");"") ->  | F547: of:=TRANSPOSE([$'DATA - Oculta'.$U$9:$'DATA - Oculta'.$U$13]) -> N/T | G547: N/D | H547: N/A | I547: Falla | J547: Pasa | K547: En blanco
B548: of:=IF( ISBLANK([$'03.Muestra'.$C$9]);"";[$'03.Muestra'.$C$9]) ->  | C548: of:=IF( ISBLANK([$'03.Muestra'.$E$9]);"";[$'03.Muestra'.$E$9]) ->  | D548: of:=IF(AND([.B548]<>"";[.C548]<>"");"N/T";"") ->  | E548: of:=IF([.D548]<>"";IF(AND([.B548]<>"";[.C548]<>"");"";"ERR");"") ->  | F548: of:=COUNTIF([.$D547]:INDIRECT("$D" &  SUM(ROW()-1;['03.Muestra'.$D$40])-1);[.F547]) -> 0 | G548: of:=COUNTIF([.$D547]:INDIRECT("$D" &  SUM(ROW()-1;['03.Muestra'.$D$40])-1);[.G547]) -> 0 | H548: of:=COUNTIF([.$D547]:INDIRECT("$D" &  SUM(ROW()-1;['03.Muestra'.$D$40])-1);[.H547]) -> 0 | I548: of:=COUNTIF([.$D547]:INDIRECT("$D" &  SUM(ROW()-1;['03.Muestra'.$D$40])-1);[.I547]) -> 0 | J548: of:=COUNTIF([.$D547]:INDIRECT("$D" &  SUM(ROW()-1;['03.Muestra'.$D$40])-1);[.J547]) -> 0 | K548: of:=IF(['03.Muestra'.$D$40]=0;0;COUNTBLANK([.$D547]:INDIRECT("$D" &  SUM(ROW()-1;['03.Muestra'.$D$40])-1))) -> 0
B549: of:=IF( ISBLANK([$'03.Muestra'.$C$10]);"";[$'03.Muestra'.$C$10]) ->  | C549: of:=IF( ISBLANK([$'03.Muestra'.$E$10]);"";[$'03.Muestra'.$E$10]) ->  | D549: of:=IF(AND([.B549]<>"";[.C549]<>"");"N/T";"") ->  | E549: of:=IF([.D549]<>"";IF(AND([.B549]<>"";[.C549]<>"");"";"ERR");"") -> 
B550: of:=IF( ISBLANK([$'03.Muestra'.$C$11]);"";[$'03.Muestra'.$C$11]) ->  | C550: of:=IF( ISBLANK([$'03.Muestra'.$E$11]);"";[$'03.Muestra'.$E$11]) ->  | D550: of:=IF(AND([.B550]<>"";[.C550]<>"");"N/T";"") ->  | E550: of:=IF([.D550]<>"";IF(AND([.B550]<>"";[.C550]<>"");"";"ERR");"") -> 
B551: of:=IF( ISBLANK([$'03.Muestra'.$C$12]);"";[$'03.Muestra'.$C$12]) ->  | C551: of:=IF( ISBLANK([$'03.Muestra'.$E$12]);"";[$'03.Muestra'.$E$12]) ->  | D551: of:=IF(AND([.B551]<>"";[.C551]<>"");"N/T";"") ->  | E551: of:=IF([.D551]<>"";IF(AND([.B551]<>"";[.C551]<>"");"";"ERR");"") -> 
B552: of:=IF( ISBLANK([$'03.Muestra'.$C$13]);"";[$'03.Muestra'.$C$13]) ->  | C552: of:=IF( ISBLANK([$'03.Muestra'.$E$13]);"";[$'03.Muestra'.$E$13]) ->  | D552: of:=IF(AND([.B552]<>"";[.C552]<>"");"N/T";"") ->  | E552: of:=IF([.D552]<>"";IF(AND([.B552]<>"";[.C552]<>"");"";"ERR");"") -> 
B553: of:=IF( ISBLANK([$'03.Muestra'.$C$14]);"";[$'03.Muestra'.$C$14]) ->  | C553: of:=IF( ISBLANK([$'03.Muestra'.$E$14]);"";[$'03.Muestra'.$E$14]) ->  | D553: of:=IF(AND([.B553]<>"";[.C553]<>"");"N/T";"") ->  | E553: of:=IF([.D553]<>"";IF(AND([.B553]<>"";[.C553]<>"");"";"ERR");"") -> 
B554: of:=IF( ISBLANK([$'03.Muestra'.$C$15]);"";[$'03.Muestra'.$C$15]) ->  | C554: of:=IF( ISBLANK([$'03.Muestra'.$E$15]);"";[$'03.Muestra'.$E$15]) ->  | D554: of:=IF(AND([.B554]<>"";[.C554]<>"");"N/T";"") ->  | E554: of:=IF([.D554]<>"";IF(AND([.B554]<>"";[.C554]<>"");"";"ERR");"") -> 
B555: of:=IF( ISBLANK([$'03.Muestra'.$C$16]);"";[$'03.Muestra'.$C$16]) ->  | C555: of:=IF( ISBLANK([$'03.Muestra'.$E$16]);"";[$'03.Muestra'.$E$16]) ->  | D555: of:=IF(AND([.B555]<>"";[.C555]<>"");"N/T";"") ->  | E555: of:=IF([.D555]<>"";IF(AND([.B555]<>"";[.C555]<>"");"";"ERR");"") -> 
B556: of:=IF( ISBLANK([$'03.Muestra'.$C$17]);"";[$'03.Muestra'.$C$17]) ->  | C556: of:=IF( ISBLANK([$'03.Muestra'.$E$17]);"";[$'03.Muestra'.$E$17]) ->  | D556: of:=IF(AND([.B556]<>"";[.C556]<>"");"N/T";"") ->  | E556: of:=IF([.D556]<>"";IF(AND([.B556]<>"";[.C556]<>"");"";"ERR");"") -> 
B557: of:=IF( ISBLANK([$'03.Muestra'.$C$18]);"";[$'03.Muestra'.$C$18]) ->  | C557: of:=IF( ISBLANK([$'03.Muestra'.$E$18]);"";[$'03.Muestra'.$E$18]) ->  | D557: of:=IF(AND([.B557]<>"";[.C557]<>"");"N/T";"") ->  | E557: of:=IF([.D557]<>"";IF(AND([.B557]<>"";[.C557]<>"");"";"ERR");"") -> 
B558: of:=IF( ISBLANK([$'03.Muestra'.$C$19]);"";[$'03.Muestra'.$C$19]) ->  | C558: of:=IF( ISBLANK([$'03.Muestra'.$E$19]);"";[$'03.Muestra'.$E$19]) ->  | D558: of:=IF(AND([.B558]<>"";[.C558]<>"");"N/T";"") ->  | E558: of:=IF([.D558]<>"";IF(AND([.B558]<>"";[.C558]<>"");"";"ERR");"") -> 
B559: of:=IF( ISBLANK([$'03.Muestra'.$C$20]);"";[$'03.Muestra'.$C$20]) ->  | C559: of:=IF( ISBLANK([$'03.Muestra'.$E$20]);"";[$'03.Muestra'.$E$20]) ->  | D559: of:=IF(AND([.B559]<>"";[.C559]<>"");"N/T";"") ->  | E559: of:=IF([.D559]<>"";IF(AND([.B559]<>"";[.C559]<>"");"";"ERR");"") -> 
B560: of:=IF( ISBLANK([$'03.Muestra'.$C$21]);"";[$'03.Muestra'.$C$21]) ->  | C560: of:=IF( ISBLANK([$'03.Muestra'.$E$21]);"";[$'03.Muestra'.$E$21]) ->  | D560: of:=IF(AND([.B560]<>"";[.C560]<>"");"N/T";"") ->  | E560: of:=IF([.D560]<>"";IF(AND([.B560]<>"";[.C560]<>"");"";"ERR");"") -> 
B561: of:=IF( ISBLANK([$'03.Muestra'.$C$22]);"";[$'03.Muestra'.$C$22]) ->  | C561: of:=IF( ISBLANK([$'03.Muestra'.$E$22]);"";[$'03.Muestra'.$E$22]) ->  | D561: of:=IF(AND([.B561]<>"";[.C561]<>"");"N/T";"") ->  | E561: of:=IF([.D561]<>"";IF(AND([.B561]<>"";[.C561]<>"");"";"ERR");"") -> 
B562: of:=IF( ISBLANK([$'03.Muestra'.$C$23]);"";[$'03.Muestra'.$C$23]) ->  | C562: of:=IF( ISBLANK([$'03.Muestra'.$E$23]);"";[$'03.Muestra'.$E$23]) ->  | D562: of:=IF(AND([.B562]<>"";[.C562]<>"");"N/T";"") ->  | E562: of:=IF([.D562]<>"";IF(AND([.B562]<>"";[.C562]<>"");"";"ERR");"") -> 
B563: of:=IF( ISBLANK([$'03.Muestra'.$C$24]);"";[$'03.Muestra'.$C$24]) ->  | C563: of:=IF( ISBLANK([$'03.Muestra'.$E$24]);"";[$'03.Muestra'.$E$24]) ->  | D563: of:=IF(AND([.B563]<>"";[.C563]<>"");"N/T";"") ->  | E563: of:=IF([.D563]<>"";IF(AND([.B563]<>"";[.C563]<>"");"";"ERR");"") -> 
B564: of:=IF( ISBLANK([$'03.Muestra'.$C$25]);"";[$'03.Muestra'.$C$25]) ->  | C564: of:=IF( ISBLANK([$'03.Muestra'.$E$25]);"";[$'03.Muestra'.$E$25]) ->  | D564: of:=IF(AND([.B564]<>"";[.C564]<>"");"N/T";"") ->  | E564: of:=IF([.D564]<>"";IF(AND([.B564]<>"";[.C564]<>"");"";"ERR");"") -> 
B565: of:=IF( ISBLANK([$'03.Muestra'.$C$26]);"";[$'03.Muestra'.$C$26]) ->  | C565: of:=IF( ISBLANK([$'03.Muestra'.$E$26]);"";[$'03.Muestra'.$E$26]) ->  | D565: of:=IF(AND([.B565]<>"";[.C565]<>"");"N/T";"") ->  | E565: of:=IF([.D565]<>"";IF(AND([.B565]<>"";[.C565]<>"");"";"ERR");"") -> 
B566: of:=IF( ISBLANK([$'03.Muestra'.$C$27]);"";[$'03.Muestra'.$C$27]) ->  | C566: of:=IF( ISBLANK([$'03.Muestra'.$E$27]);"";[$'03.Muestra'.$E$27]) ->  | D566: of:=IF(AND([.B566]<>"";[.C566]<>"");"N/T";"") ->  | E566: of:=IF([.D566]<>"";IF(AND([.B566]<>"";[.C566]<>"");"";"ERR");"") -> 
B567: of:=IF( ISBLANK([$'03.Muestra'.$C$28]);"";[$'03.Muestra'.$C$28]) ->  | C567: of:=IF( ISBLANK([$'03.Muestra'.$E$28]);"";[$'03.Muestra'.$E$28]) ->  | D567: of:=IF(AND([.B567]<>"";[.C567]<>"");"N/T";"") ->  | E567: of:=IF([.D567]<>"";IF(AND([.B567]<>"";[.C567]<>"");"";"ERR");"") -> 
B568: of:=IF( ISBLANK([$'03.Muestra'.$C$29]);"";[$'03.Muestra'.$C$29]) ->  | C568: of:=IF( ISBLANK([$'03.Muestra'.$E$29]);"";[$'03.Muestra'.$E$29]) ->  | D568: of:=IF(AND([.B568]<>"";[.C568]<>"");"N/T";"") ->  | E568: of:=IF([.D568]<>"";IF(AND([.B568]<>"";[.C568]<>"");"";"ERR");"") -> 
B569: of:=IF( ISBLANK([$'03.Muestra'.$C$30]);"";[$'03.Muestra'.$C$30]) ->  | C569: of:=IF( ISBLANK([$'03.Muestra'.$E$30]);"";[$'03.Muestra'.$E$30]) ->  | D569: of:=IF(AND([.B569]<>"";[.C569]<>"");"N/T";"") ->  | E569: of:=IF([.D569]<>"";IF(AND([.B569]<>"";[.C569]<>"");"";"ERR");"") -> 
B570: of:=IF( ISBLANK([$'03.Muestra'.$C$31]);"";[$'03.Muestra'.$C$31]) ->  | C570: of:=IF( ISBLANK([$'03.Muestra'.$E$31]);"";[$'03.Muestra'.$E$31]) ->  | D570: of:=IF(AND([.B570]<>"";[.C570]<>"");"N/T";"") ->  | E570: of:=IF([.D570]<>"";IF(AND([.B570]<>"";[.C570]<>"");"";"ERR");"") -> 
B571: of:=IF( ISBLANK([$'03.Muestra'.$C$32]);"";[$'03.Muestra'.$C$32]) ->  | C571: of:=IF( ISBLANK([$'03.Muestra'.$E$32]);"";[$'03.Muestra'.$E$32]) ->  | D571: of:=IF(AND([.B571]<>"";[.C571]<>"");"N/T";"") ->  | E571: of:=IF([.D571]<>"";IF(AND([.B571]<>"";[.C571]<>"");"";"ERR");"") -> 
B572: of:=IF( ISBLANK([$'03.Muestra'.$C$33]);"";[$'03.Muestra'.$C$33]) ->  | C572: of:=IF( ISBLANK([$'03.Muestra'.$E$33]);"";[$'03.Muestra'.$E$33]) ->  | D572: of:=IF(AND([.B572]<>"";[.C572]<>"");"N/T";"") ->  | E572: of:=IF([.D572]<>"";IF(AND([.B572]<>"";[.C572]<>"");"";"ERR");"") -> 
B573: of:=IF( ISBLANK([$'03.Muestra'.$C$34]);"";[$'03.Muestra'.$C$34]) ->  | C573: of:=IF( ISBLANK([$'03.Muestra'.$E$34]);"";[$'03.Muestra'.$E$34]) ->  | D573: of:=IF(AND([.B573]<>"";[.C573]<>"");"N/T";"") ->  | E573: of:=IF([.D573]<>"";IF(AND([.B573]<>"";[.C573]<>"");"";"ERR");"") -> 
B574: of:=IF( ISBLANK([$'03.Muestra'.$C$35]);"";[$'03.Muestra'.$C$35]) ->  | C574: of:=IF( ISBLANK([$'03.Muestra'.$E$35]);"";[$'03.Muestra'.$E$35]) ->  | D574: of:=IF(AND([.B574]<>"";[.C574]<>"");"N/T";"") ->  | E574: of:=IF([.D574]<>"";IF(AND([.B574]<>"";[.C574]<>"");"";"ERR");"") -> 
B575: of:=IF( ISBLANK([$'03.Muestra'.$C$36]);"";[$'03.Muestra'.$C$36]) ->  | C575: of:=IF( ISBLANK([$'03.Muestra'.$E$36]);"";[$'03.Muestra'.$E$36]) ->  | D575: of:=IF(AND([.B575]<>"";[.C575]<>"");"N/T";"") ->  | E575: of:=IF([.D575]<>"";IF(AND([.B575]<>"";[.C575]<>"");"";"ERR");"") -> 
B576: of:=IF( ISBLANK([$'03.Muestra'.$C$37]);"";[$'03.Muestra'.$C$37]) ->  | C576: of:=IF( ISBLANK([$'03.Muestra'.$E$37]);"";[$'03.Muestra'.$E$37]) ->  | D576: of:=IF(AND([.B576]<>"";[.C576]<>"");"N/T";"") ->  | E576: of:=IF([.D576]<>"";IF(AND([.B576]<>"";[.C576]<>"");"";"ERR");"") -> 
B579: AA | C579: 1.4.11 Contraste en elementos no textuales | D579: Resultado
B580: of:=IF( ISBLANK([$'03.Muestra'.$C$8]);"";[$'03.Muestra'.$C$8]) ->  | C580: of:=IF( ISBLANK([$'03.Muestra'.$E$8]);"";[$'03.Muestra'.$E$8]) ->  | D580: of:=IF(AND([.B580]<>"";[.C580]<>"");"N/T";"") ->  | E580: of:=IF([.D580]<>"";IF(AND([.B580]<>"";[.C580]<>"");"";"ERR");"") ->  | F580: of:=TRANSPOSE([$'DATA - Oculta'.$U$9:$'DATA - Oculta'.$U$13]) -> N/T | G580: N/D | H580: N/A | I580: Falla | J580: Pasa | K580: En blanco
B581: of:=IF( ISBLANK([$'03.Muestra'.$C$9]);"";[$'03.Muestra'.$C$9]) ->  | C581: of:=IF( ISBLANK([$'03.Muestra'.$E$9]);"";[$'03.Muestra'.$E$9]) ->  | D581: of:=IF(AND([.B581]<>"";[.C581]<>"");"N/T";"") ->  | E581: of:=IF([.D581]<>"";IF(AND([.B581]<>"";[.C581]<>"");"";"ERR");"") ->  | F581: of:=COUNTIF([.$D580]:INDIRECT("$D" &  SUM(ROW()-1;['03.Muestra'.$D$40])-1);[.F580]) -> 0 | G581: of:=COUNTIF([.$D580]:INDIRECT("$D" &  SUM(ROW()-1;['03.Muestra'.$D$40])-1);[.G580]) -> 0 | H581: of:=COUNTIF([.$D580]:INDIRECT("$D" &  SUM(ROW()-1;['03.Muestra'.$D$40])-1);[.H580]) -> 0 | I581: of:=COUNTIF([.$D580]:INDIRECT("$D" &  SUM(ROW()-1;['03.Muestra'.$D$40])-1);[.I580]) -> 0 | J581: of:=COUNTIF([.$D580]:INDIRECT("$D" &  SUM(ROW()-1;['03.Muestra'.$D$40])-1);[.J580]) -> 0 | K581: of:=IF(['03.Muestra'.$D$40]=0;0;COUNTBLANK([.$D580]:INDIRECT("$D" &  SUM(ROW()-1;['03.Muestra'.$D$40])-1))) -> 0
B582: of:=IF( ISBLANK([$'03.Muestra'.$C$10]);"";[$'03.Muestra'.$C$10]) ->  | C582: of:=IF( ISBLANK([$'03.Muestra'.$E$10]);"";[$'03.Muestra'.$E$10]) ->  | D582: of:=IF(AND([.B582]<>"";[.C582]<>"");"N/T";"") ->  | E582: of:=IF([.D582]<>"";IF(AND([.B582]<>"";[.C582]<>"");"";"ERR");"") -> 
B583: of:=IF( ISBLANK([$'03.Muestra'.$C$11]);"";[$'03.Muestra'.$C$11]) ->  | C583: of:=IF( ISBLANK([$'03.Muestra'.$E$11]);"";[$'03.Muestra'.$E$11]) ->  | D583: of:=IF(AND([.B583]<>"";[.C583]<>"");"N/T";"") ->  | E583: of:=IF([.D583]<>"";IF(AND([.B583]<>"";[.C583]<>"");"";"ERR");"") -> 
B584: of:=IF( ISBLANK([$'03.Muestra'.$C$12]);"";[$'03.Muestra'.$C$12]) ->  | C584: of:=IF( ISBLANK([$'03.Muestra'.$E$12]);"";[$'03.Muestra'.$E$12]) ->  | D584: of:=IF(AND([.B584]<>"";[.C584]<>"");"N/T";"") ->  | E584: of:=IF([.D584]<>"";IF(AND([.B584]<>"";[.C584]<>"");"";"ERR");"") -> 
B585: of:=IF( ISBLANK([$'03.Muestra'.$C$13]);"";[$'03.Muestra'.$C$13]) ->  | C585: of:=IF( ISBLANK([$'03.Muestra'.$E$13]);"";[$'03.Muestra'.$E$13]) ->  | D585: of:=IF(AND([.B585]<>"";[.C585]<>"");"N/T";"") ->  | E585: of:=IF([.D585]<>"";IF(AND([.B585]<>"";[.C585]<>"");"";"ERR");"") -> 
B586: of:=IF( ISBLANK([$'03.Muestra'.$C$14]);"";[$'03.Muestra'.$C$14]) ->  | C586: of:=IF( ISBLANK([$'03.Muestra'.$E$14]);"";[$'03.Muestra'.$E$14]) ->  | D586: of:=IF(AND([.B586]<>"";[.C586]<>"");"N/T";"") ->  | E586: of:=IF([.D586]<>"";IF(AND([.B586]<>"";[.C586]<>"");"";"ERR");"") -> 
B587: of:=IF( ISBLANK([$'03.Muestra'.$C$15]);"";[$'03.Muestra'.$C$15]) ->  | C587: of:=IF( ISBLANK([$'03.Muestra'.$E$15]);"";[$'03.Muestra'.$E$15]) ->  | D587: of:=IF(AND([.B587]<>"";[.C587]<>"");"N/T";"") ->  | E587: of:=IF([.D587]<>"";IF(AND([.B587]<>"";[.C587]<>"");"";"ERR");"") -> 
B588: of:=IF( ISBLANK([$'03.Muestra'.$C$16]);"";[$'03.Muestra'.$C$16]) ->  | C588: of:=IF( ISBLANK([$'03.Muestra'.$E$16]);"";[$'03.Muestra'.$E$16]) ->  | D588: of:=IF(AND([.B588]<>"";[.C588]<>"");"N/T";"") ->  | E588: of:=IF([.D588]<>"";IF(AND([.B588]<>"";[.C588]<>"");"";"ERR");"") -> 
B589: of:=IF( ISBLANK([$'03.Muestra'.$C$17]);"";[$'03.Muestra'.$C$17]) ->  | C589: of:=IF( ISBLANK([$'03.Muestra'.$E$17]);"";[$'03.Muestra'.$E$17]) ->  | D589: of:=IF(AND([.B589]<>"";[.C589]<>"");"N/T";"") ->  | E589: of:=IF([.D589]<>"";IF(AND([.B589]<>"";[.C589]<>"");"";"ERR");"") -> 
B590: of:=IF( ISBLANK([$'03.Muestra'.$C$18]);"";[$'03.Muestra'.$C$18]) ->  | C590: of:=IF( ISBLANK([$'03.Muestra'.$E$18]);"";[$'03.Muestra'.$E$18]) ->  | D590: of:=IF(AND([.B590]<>"";[.C590]<>"");"N/T";"") ->  | E590: of:=IF([.D590]<>"";IF(AND([.B590]<>"";[.C590]<>"");"";"ERR");"") -> 
B591: of:=IF( ISBLANK([$'03.Muestra'.$C$19]);"";[$'03.Muestra'.$C$19]) ->  | C591: of:=IF( ISBLANK([$'03.Muestra'.$E$19]);"";[$'03.Muestra'.$E$19]) ->  | D591: of:=IF(AND([.B591]<>"";[.C591]<>"");"N/T";"") ->  | E591: of:=IF([.D591]<>"";IF(AND([.B591]<>"";[.C591]<>"");"";"ERR");"") -> 
B592: of:=IF( ISBLANK([$'03.Muestra'.$C$20]);"";[$'03.Muestra'.$C$20]) ->  | C592: of:=IF( ISBLANK([$'03.Muestra'.$E$20]);"";[$'03.Muestra'.$E$20]) ->  | D592: of:=IF(AND([.B592]<>"";[.C592]<>"");"N/T";"") ->  | E592: of:=IF([.D592]<>"";IF(AND([.B592]<>"";[.C592]<>"");"";"ERR");"") -> 
B593: of:=IF( ISBLANK([$'03.Muestra'.$C$21]);"";[$'03.Muestra'.$C$21]) ->  | C593: of:=IF( ISBLANK([$'03.Muestra'.$E$21]);"";[$'03.Muestra'.$E$21]) ->  | D593: of:=IF(AND([.B593]<>"";[.C593]<>"");"N/T";"") ->  | E593: of:=IF([.D593]<>"";IF(AND([.B593]<>"";[.C593]<>"");"";"ERR");"") -> 
B594: of:=IF( ISBLANK([$'03.Muestra'.$C$22]);"";[$'03.Muestra'.$C$22]) ->  | C594: of:=IF( ISBLANK([$'03.Muestra'.$E$22]);"";[$'03.Muestra'.$E$22]) ->  | D594: of:=IF(AND([.B594]<>"";[.C594]<>"");"N/T";"") ->  | E594: of:=IF([.D594]<>"";IF(AND([.B594]<>"";[.C594]<>"");"";"ERR");"") -> 
B595: of:=IF( ISBLANK([$'03.Muestra'.$C$23]);"";[$'03.Muestra'.$C$23]) ->  | C595: of:=IF( ISBLANK([$'03.Muestra'.$E$23]);"";[$'03.Muestra'.$E$23]) ->  | D595: of:=IF(AND([.B595]<>"";[.C595]<>"");"N/T";"") ->  | E595: of:=IF([.D595]<>"";IF(AND([.B595]<>"";[.C595]<>"");"";"ERR");"") -> 
B596: of:=IF( ISBLANK([$'03.Muestra'.$C$24]);"";[$'03.Muestra'.$C$24]) ->  | C596: of:=IF( ISBLANK([$'03.Muestra'.$E$24]);"";[$'03.Muestra'.$E$24]) ->  | D596: of:=IF(AND([.B596]<>"";[.C596]<>"");"N/T";"") ->  | E596: of:=IF([.D596]<>"";IF(AND([.B596]<>"";[.C596]<>"");"";"ERR");"") -> 
B597: of:=IF( ISBLANK([$'03.Muestra'.$C$25]);"";[$'03.Muestra'.$C$25]) ->  | C597: of:=IF( ISBLANK([$'03.Muestra'.$E$25]);"";[$'03.Muestra'.$E$25]) ->  | D597: of:=IF(AND([.B597]<>"";[.C597]<>"");"N/T";"") ->  | E597: of:=IF([.D597]<>"";IF(AND([.B597]<>"";[.C597]<>"");"";"ERR");"") -> 
B598: of:=IF( ISBLANK([$'03.Muestra'.$C$26]);"";[$'03.Muestra'.$C$26]) ->  | C598: of:=IF( ISBLANK([$'03.Muestra'.$E$26]);"";[$'03.Muestra'.$E$26]) ->  | D598: of:=IF(AND([.B598]<>"";[.C598]<>"");"N/T";"") ->  | E598: of:=IF([.D598]<>"";IF(AND([.B598]<>"";[.C598]<>"");"";"ERR");"") -> 
B599: of:=IF( ISBLANK([$'03.Muestra'.$C$27]);"";[$'03.Muestra'.$C$27]) ->  | C599: of:=IF( ISBLANK([$'03.Muestra'.$E$27]);"";[$'03.Muestra'.$E$27]) ->  | D599: of:=IF(AND([.B599]<>"";[.C599]<>"");"N/T";"") ->  | E599: of:=IF([.D599]<>"";IF(AND([.B599]<>"";[.C599]<>"");"";"ERR");"") -> 
B600: of:=IF( ISBLANK([$'03.Muestra'.$C$28]);"";[$'03.Muestra'.$C$28]) ->  | C600: of:=IF( ISBLANK([$'03.Muestra'.$E$28]);"";[$'03.Muestra'.$E$28]) ->  | D600: of:=IF(AND([.B600]<>"";[.C600]<>"");"N/T";"") ->  | E600: of:=IF([.D600]<>"";IF(AND([.B600]<>"";[.C600]<>"");"";"ERR");"") -> 
B601: of:=IF( ISBLANK([$'03.Muestra'.$C$29]);"";[$'03.Muestra'.$C$29]) ->  | C601: of:=IF( ISBLANK([$'03.Muestra'.$E$29]);"";[$'03.Muestra'.$E$29]) ->  | D601: of:=IF(AND([.B601]<>"";[.C601]<>"");"N/T";"") ->  | E601: of:=IF([.D601]<>"";IF(AND([.B601]<>"";[.C601]<>"");"";"ERR");"") -> 
B602: of:=IF( ISBLANK([$'03.Muestra'.$C$30]);"";[$'03.Muestra'.$C$30]) ->  | C602: of:=IF( ISBLANK([$'03.Muestra'.$E$30]);"";[$'03.Muestra'.$E$30]) ->  | D602: of:=IF(AND([.B602]<>"";[.C602]<>"");"N/T";"") ->  | E602: of:=IF([.D602]<>"";IF(AND([.B602]<>"";[.C602]<>"");"";"ERR");"") -> 
B603: of:=IF( ISBLANK([$'03.Muestra'.$C$31]);"";[$'03.Muestra'.$C$31]) ->  | C603: of:=IF( ISBLANK([$'03.Muestra'.$E$31]);"";[$'03.Muestra'.$E$31]) ->  | D603: of:=IF(AND([.B603]<>"";[.C603]<>"");"N/T";"") ->  | E603: of:=IF([.D603]<>"";IF(AND([.B603]<>"";[.C603]<>"");"";"ERR");"") -> 
B604: of:=IF( ISBLANK([$'03.Muestra'.$C$32]);"";[$'03.Muestra'.$C$32]) ->  | C604: of:=IF( ISBLANK([$'03.Muestra'.$E$32]);"";[$'03.Muestra'.$E$32]) ->  | D604: of:=IF(AND([.B604]<>"";[.C604]<>"");"N/T";"") ->  | E604: of:=IF([.D604]<>"";IF(AND([.B604]<>"";[.C604]<>"");"";"ERR");"") -> 
B605: of:=IF( ISBLANK([$'03.Muestra'.$C$33]);"";[$'03.Muestra'.$C$33]) ->  | C605: of:=IF( ISBLANK([$'03.Muestra'.$E$33]);"";[$'03.Muestra'.$E$33]) ->  | D605: of:=IF(AND([.B605]<>"";[.C605]<>"");"N/T";"") ->  | E605: of:=IF([.D605]<>"";IF(AND([.B605]<>"";[.C605]<>"");"";"ERR");"") -> 
B606: of:=IF( ISBLANK([$'03.Muestra'.$C$34]);"";[$'03.Muestra'.$C$34]) ->  | C606: of:=IF( ISBLANK([$'03.Muestra'.$E$34]);"";[$'03.Muestra'.$E$34]) ->  | D606: of:=IF(AND([.B606]<>"";[.C606]<>"");"N/T";"") ->  | E606: of:=IF([.D606]<>"";IF(AND([.B606]<>"";[.C606]<>"");"";"ERR");"") -> 
B607: of:=IF( ISBLANK([$'03.Muestra'.$C$35]);"";[$'03.Muestra'.$C$35]) ->  | C607: of:=IF( ISBLANK([$'03.Muestra'.$E$35]);"";[$'03.Muestra'.$E$35]) ->  | D607: of:=IF(AND([.B607]<>"";[.C607]<>"");"N/T";"") ->  | E607: of:=IF([.D607]<>"";IF(AND([.B607]<>"";[.C607]<>"");"";"ERR");"") -> 
B608: of:=IF( ISBLANK([$'03.Muestra'.$C$36]);"";[$'03.Muestra'.$C$36]) ->  | C608: of:=IF( ISBLANK([$'03.Muestra'.$E$36]);"";[$'03.Muestra'.$E$36]) ->  | D608: of:=IF(AND([.B608]<>"";[.C608]<>"");"N/T";"") ->  | E608: of:=IF([.D608]<>"";IF(AND([.B608]<>"";[.C608]<>"");"";"ERR");"") -> 
B609: of:=IF( ISBLANK([$'03.Muestra'.$C$37]);"";[$'03.Muestra'.$C$37]) ->  | C609: of:=IF( ISBLANK([$'03.Muestra'.$E$37]);"";[$'03.Muestra'.$E$37]) ->  | D609: of:=IF(AND([.B609]<>"";[.C609]<>"");"N/T";"") ->  | E609: of:=IF([.D609]<>"";IF(AND([.B609]<>"";[.C609]<>"");"";"ERR");"") -> 
B612: AA | C612: 1.4.12 Espaciado en el texto | D612: Resultado
B613: of:=IF( ISBLANK([$'03.Muestra'.$C$8]);"";[$'03.Muestra'.$C$8]) ->  | C613: of:=IF( ISBLANK([$'03.Muestra'.$E$8]);"";[$'03.Muestra'.$E$8]) ->  | D613: of:=IF(AND([.B613]<>"";[.C613]<>"");"N/T";"") ->  | E613: of:=IF([.D613]<>"";IF(AND([.B613]<>"";[.C613]<>"");"";"ERR");"") ->  | F613: of:=TRANSPOSE([$'DATA - Oculta'.$U$9:$'DATA - Oculta'.$U$13]) -> N/T | G613: N/D | H613: N/A | I613: Falla | J613: Pasa | K613: En blanco
B614: of:=IF( ISBLANK([$'03.Muestra'.$C$9]);"";[$'03.Muestra'.$C$9]) ->  | C614: of:=IF( ISBLANK([$'03.Muestra'.$E$9]);"";[$'03.Muestra'.$E$9]) ->  | D614: of:=IF(AND([.B614]<>"";[.C614]<>"");"N/T";"") ->  | E614: of:=IF([.D614]<>"";IF(AND([.B614]<>"";[.C614]<>"");"";"ERR");"") ->  | F614: of:=COUNTIF([.$D613]:INDIRECT("$D" &  SUM(ROW()-1;['03.Muestra'.$D$40])-1);[.F613]) -> 0 | G614: of:=COUNTIF([.$D613]:INDIRECT("$D" &  SUM(ROW()-1;['03.Muestra'.$D$40])-1);[.G613]) -> 0 | H614: of:=COUNTIF([.$D613]:INDIRECT("$D" &  SUM(ROW()-1;['03.Muestra'.$D$40])-1);[.H613]) -> 0 | I614: of:=COUNTIF([.$D613]:INDIRECT("$D" &  SUM(ROW()-1;['03.Muestra'.$D$40])-1);[.I613]) -> 0 | J614: of:=COUNTIF([.$D613]:INDIRECT("$D" &  SUM(ROW()-1;['03.Muestra'.$D$40])-1);[.J613]) -> 0 | K614: of:=IF(['03.Muestra'.$D$40]=0;0;COUNTBLANK([.$D613]:INDIRECT("$D" &  SUM(ROW()-1;['03.Muestra'.$D$40])-1))) -> 0
B615: of:=IF( ISBLANK([$'03.Muestra'.$C$10]);"";[$'03.Muestra'.$C$10]) ->  | C615: of:=IF( ISBLANK([$'03.Muestra'.$E$10]);"";[$'03.Muestra'.$E$10]) ->  | D615: of:=IF(AND([.B615]<>"";[.C615]<>"");"N/T";"") ->  | E615: of:=IF([.D615]<>"";IF(AND([.B615]<>"";[.C615]<>"");"";"ERR");"") -> 
B616: of:=IF( ISBLANK([$'03.Muestra'.$C$11]);"";[$'03.Muestra'.$C$11]) ->  | C616: of:=IF( ISBLANK([$'03.Muestra'.$E$11]);"";[$'03.Muestra'.$E$11]) ->  | D616: of:=IF(AND([.B616]<>"";[.C616]<>"");"N/T";"") ->  | E616: of:=IF([.D616]<>"";IF(AND([.B616]<>"";[.C616]<>"");"";"ERR");"") -> 
B617: of:=IF( ISBLANK([$'03.Muestra'.$C$12]);"";[$'03.Muestra'.$C$12]) ->  | C617: of:=IF( ISBLANK([$'03.Muestra'.$E$12]);"";[$'03.Muestra'.$E$12]) ->  | D617: of:=IF(AND([.B617]<>"";[.C617]<>"");"N/T";"") ->  | E617: of:=IF([.D617]<>"";IF(AND([.B617]<>"";[.C617]<>"");"";"ERR");"") -> 
B618: of:=IF( ISBLANK([$'03.Muestra'.$C$13]);"";[$'03.Muestra'.$C$13]) ->  | C618: of:=IF( ISBLANK([$'03.Muestra'.$E$13]);"";[$'03.Muestra'.$E$13]) ->  | D618: of:=IF(AND([.B618]<>"";[.C618]<>"");"N/T";"") ->  | E618: of:=IF([.D618]<>"";IF(AND([.B618]<>"";[.C618]<>"");"";"ERR");"") -> 
B619: of:=IF( ISBLANK([$'03.Muestra'.$C$14]);"";[$'03.Muestra'.$C$14]) ->  | C619: of:=IF( ISBLANK([$'03.Muestra'.$E$14]);"";[$'03.Muestra'.$E$14]) ->  | D619: of:=IF(AND([.B619]<>"";[.C619]<>"");"N/T";"") ->  | E619: of:=IF([.D619]<>"";IF(AND([.B619]<>"";[.C619]<>"");"";"ERR");"") -> 
B620: of:=IF( ISBLANK([$'03.Muestra'.$C$15]);"";[$'03.Muestra'.$C$15]) ->  | C620: of:=IF( ISBLANK([$'03.Muestra'.$E$15]);"";[$'03.Muestra'.$E$15]) ->  | D620: of:=IF(AND([.B620]<>"";[.C620]<>"");"N/T";"") ->  | E620: of:=IF([.D620]<>"";IF(AND([.B620]<>"";[.C620]<>"");"";"ERR");"") -> 
B621: of:=IF( ISBLANK([$'03.Muestra'.$C$16]);"";[$'03.Muestra'.$C$16]) ->  | C621: of:=IF( ISBLANK([$'03.Muestra'.$E$16]);"";[$'03.Muestra'.$E$16]) ->  | D621: of:=IF(AND([.B621]<>"";[.C621]<>"");"N/T";"") ->  | E621: of:=IF([.D621]<>"";IF(AND([.B621]<>"";[.C621]<>"");"";"ERR");"") -> 
B622: of:=IF( ISBLANK([$'03.Muestra'.$C$17]);"";[$'03.Muestra'.$C$17]) ->  | C622: of:=IF( ISBLANK([$'03.Muestra'.$E$17]);"";[$'03.Muestra'.$E$17]) ->  | D622: of:=IF(AND([.B622]<>"";[.C622]<>"");"N/T";"") ->  | E622: of:=IF([.D622]<>"";IF(AND([.B622]<>"";[.C622]<>"");"";"ERR");"") -> 
B623: of:=IF( ISBLANK([$'03.Muestra'.$C$18]);"";[$'03.Muestra'.$C$18]) ->  | C623: of:=IF( ISBLANK([$'03.Muestra'.$E$18]);"";[$'03.Muestra'.$E$18]) ->  | D623: of:=IF(AND([.B623]<>"";[.C623]<>"");"N/T";"") ->  | E623: of:=IF([.D623]<>"";IF(AND([.B623]<>"";[.C623]<>"");"";"ERR");"") -> 
B624: of:=IF( ISBLANK([$'03.Muestra'.$C$19]);"";[$'03.Muestra'.$C$19]) ->  | C624: of:=IF( ISBLANK([$'03.Muestra'.$E$19]);"";[$'03.Muestra'.$E$19]) ->  | D624: of:=IF(AND([.B624]<>"";[.C624]<>"");"N/T";"") ->  | E624: of:=IF([.D624]<>"";IF(AND([.B624]<>"";[.C624]<>"");"";"ERR");"") -> 
B625: of:=IF( ISBLANK([$'03.Muestra'.$C$20]);"";[$'03.Muestra'.$C$20]) ->  | C625: of:=IF( ISBLANK([$'03.Muestra'.$E$20]);"";[$'03.Muestra'.$E$20]) ->  | D625: of:=IF(AND([.B625]<>"";[.C625]<>"");"N/T";"") ->  | E625: of:=IF([.D625]<>"";IF(AND([.B625]<>"";[.C625]<>"");"";"ERR");"") -> 
B626: of:=IF( ISBLANK([$'03.Muestra'.$C$21]);"";[$'03.Muestra'.$C$21]) ->  | C626: of:=IF( ISBLANK([$'03.Muestra'.$E$21]);"";[$'03.Muestra'.$E$21]) ->  | D626: of:=IF(AND([.B626]<>"";[.C626]<>"");"N/T";"") ->  | E626: of:=IF([.D626]<>"";IF(AND([.B626]<>"";[.C626]<>"");"";"ERR");"") -> 
B627: of:=IF( ISBLANK([$'03.Muestra'.$C$22]);"";[$'03.Muestra'.$C$22]) ->  | C627: of:=IF( ISBLANK([$'03.Muestra'.$E$22]);"";[$'03.Muestra'.$E$22]) ->  | D627: of:=IF(AND([.B627]<>"";[.C627]<>"");"N/T";"") ->  | E627: of:=IF([.D627]<>"";IF(AND([.B627]<>"";[.C627]<>"");"";"ERR");"") -> 
B628: of:=IF( ISBLANK([$'03.Muestra'.$C$23]);"";[$'03.Muestra'.$C$23]) ->  | C628: of:=IF( ISBLANK([$'03.Muestra'.$E$23]);"";[$'03.Muestra'.$E$23]) ->  | D628: of:=IF(AND([.B628]<>"";[.C628]<>"");"N/T";"") ->  | E628: of:=IF([.D628]<>"";IF(AND([.B628]<>"";[.C628]<>"");"";"ERR");"") -> 
B629: of:=IF( ISBLANK([$'03.Muestra'.$C$24]);"";[$'03.Muestra'.$C$24]) ->  | C629: of:=IF( ISBLANK([$'03.Muestra'.$E$24]);"";[$'03.Muestra'.$E$24]) ->  | D629: of:=IF(AND([.B629]<>"";[.C629]<>"");"N/T";"") ->  | E629: of:=IF([.D629]<>"";IF(AND([.B629]<>"";[.C629]<>"");"";"ERR");"") -> 
B630: of:=IF( ISBLANK([$'03.Muestra'.$C$25]);"";[$'03.Muestra'.$C$25]) ->  | C630: of:=IF( ISBLANK([$'03.Muestra'.$E$25]);"";[$'03.Muestra'.$E$25]) ->  | D630: of:=IF(AND([.B630]<>"";[.C630]<>"");"N/T";"") ->  | E630: of:=IF([.D630]<>"";IF(AND([.B630]<>"";[.C630]<>"");"";"ERR");"") -> 
B631: of:=IF( ISBLANK([$'03.Muestra'.$C$26]);"";[$'03.Muestra'.$C$26]) ->  | C631: of:=IF( ISBLANK([$'03.Muestra'.$E$26]);"";[$'03.Muestra'.$E$26]) ->  | D631: of:=IF(AND([.B631]<>"";[.C631]<>"");"N/T";"") ->  | E631: of:=IF([.D631]<>"";IF(AND([.B631]<>"";[.C631]<>"");"";"ERR");"") -> 
B632: of:=IF( ISBLANK([$'03.Muestra'.$C$27]);"";[$'03.Muestra'.$C$27]) ->  | C632: of:=IF( ISBLANK([$'03.Muestra'.$E$27]);"";[$'03.Muestra'.$E$27]) ->  | D632: of:=IF(AND([.B632]<>"";[.C632]<>"");"N/T";"") ->  | E632: of:=IF([.D632]<>"";IF(AND([.B632]<>"";[.C632]<>"");"";"ERR");"") -> 
B633: of:=IF( ISBLANK([$'03.Muestra'.$C$28]);"";[$'03.Muestra'.$C$28]) ->  | C633: of:=IF( ISBLANK([$'03.Muestra'.$E$28]);"";[$'03.Muestra'.$E$28]) ->  | D633: of:=IF(AND([.B633]<>"";[.C633]<>"");"N/T";"") ->  | E633: of:=IF([.D633]<>"";IF(AND([.B633]<>"";[.C633]<>"");"";"ERR");"") -> 
B634: of:=IF( ISBLANK([$'03.Muestra'.$C$29]);"";[$'03.Muestra'.$C$29]) ->  | C634: of:=IF( ISBLANK([$'03.Muestra'.$E$29]);"";[$'03.Muestra'.$E$29]) ->  | D634: of:=IF(AND([.B634]<>"";[.C634]<>"");"N/T";"") ->  | E634: of:=IF([.D634]<>"";IF(AND([.B634]<>"";[.C634]<>"");"";"ERR");"") -> 
B635: of:=IF( ISBLANK([$'03.Muestra'.$C$30]);"";[$'03.Muestra'.$C$30]) ->  | C635: of:=IF( ISBLANK([$'03.Muestra'.$E$30]);"";[$'03.Muestra'.$E$30]) ->  | D635: of:=IF(AND([.B635]<>"";[.C635]<>"");"N/T";"") ->  | E635: of:=IF([.D635]<>"";IF(AND([.B635]<>"";[.C635]<>"");"";"ERR");"") -> 
B636: of:=IF( ISBLANK([$'03.Muestra'.$C$31]);"";[$'03.Muestra'.$C$31]) ->  | C636: of:=IF( ISBLANK([$'03.Muestra'.$E$31]);"";[$'03.Muestra'.$E$31]) ->  | D636: of:=IF(AND([.B636]<>"";[.C636]<>"");"N/T";"") ->  | E636: of:=IF([.D636]<>"";IF(AND([.B636]<>"";[.C636]<>"");"";"ERR");"") -> 
B637: of:=IF( ISBLANK([$'03.Muestra'.$C$32]);"";[$'03.Muestra'.$C$32]) ->  | C637: of:=IF( ISBLANK([$'03.Muestra'.$E$32]);"";[$'03.Muestra'.$E$32]) ->  | D637: of:=IF(AND([.B637]<>"";[.C637]<>"");"N/T";"") ->  | E637: of:=IF([.D637]<>"";IF(AND([.B637]<>"";[.C637]<>"");"";"ERR");"") -> 
B638: of:=IF( ISBLANK([$'03.Muestra'.$C$33]);"";[$'03.Muestra'.$C$33]) ->  | C638: of:=IF( ISBLANK([$'03.Muestra'.$E$33]);"";[$'03.Muestra'.$E$33]) ->  | D638: of:=IF(AND([.B638]<>"";[.C638]<>"");"N/T";"") ->  | E638: of:=IF([.D638]<>"";IF(AND([.B638]<>"";[.C638]<>"");"";"ERR");"") -> 
B639: of:=IF( ISBLANK([$'03.Muestra'.$C$34]);"";[$'03.Muestra'.$C$34]) ->  | C639: of:=IF( ISBLANK([$'03.Muestra'.$E$34]);"";[$'03.Muestra'.$E$34]) ->  | D639: of:=IF(AND([.B639]<>"";[.C639]<>"");"N/T";"") ->  | E639: of:=IF([.D639]<>"";IF(AND([.B639]<>"";[.C639]<>"");"";"ERR");"") -> 
B640: of:=IF( ISBLANK([$'03.Muestra'.$C$35]);"";[$'03.Muestra'.$C$35]) ->  | C640: of:=IF( ISBLANK([$'03.Muestra'.$E$35]);"";[$'03.Muestra'.$E$35]) ->  | D640: of:=IF(AND([.B640]<>"";[.C640]<>"");"N/T";"") ->  | E640: of:=IF([.D640]<>"";IF(AND([.B640]<>"";[.C640]<>"");"";"ERR");"") -> 
B641: of:=IF( ISBLANK([$'03.Muestra'.$C$36]);"";[$'03.Muestra'.$C$36]) ->  | C641: of:=IF( ISBLANK([$'03.Muestra'.$E$36]);"";[$'03.Muestra'.$E$36]) ->  | D641: of:=IF(AND([.B641]<>"";[.C641]<>"");"N/T";"") ->  | E641: of:=IF([.D641]<>"";IF(AND([.B641]<>"";[.C641]<>"");"";"ERR");"") -> 
B642: of:=IF( ISBLANK([$'03.Muestra'.$C$37]);"";[$'03.Muestra'.$C$37]) ->  | C642: of:=IF( ISBLANK([$'03.Muestra'.$E$37]);"";[$'03.Muestra'.$E$37]) ->  | E642: of:=IF([.D642]<>"";IF(AND([.B642]<>"";[.C642]<>"");"";"ERR");"") -> 
B646: AA | C646: 1.4.13 Contenido en over o focus | D646: Resultado
B647: of:=IF( ISBLANK([$'03.Muestra'.$C$8]);"";[$'03.Muestra'.$C$8]) ->  | C647: of:=IF( ISBLANK([$'03.Muestra'.$E$8]);"";[$'03.Muestra'.$E$8]) ->  | D647: of:=IF(AND([.B647]<>"";[.C647]<>"");"N/T";"") ->  | E647: of:=IF([.D647]<>"";IF(AND([.B647]<>"";[.C647]<>"");"";"ERR");"") ->  | F647: of:=TRANSPOSE([$'DATA - Oculta'.$U$9:$'DATA - Oculta'.$U$13]) -> N/T | G647: N/D | H647: N/A | I647: Falla | J647: Pasa | K647: En blanco
B648: of:=IF( ISBLANK([$'03.Muestra'.$C$9]);"";[$'03.Muestra'.$C$9]) ->  | C648: of:=IF( ISBLANK([$'03.Muestra'.$E$9]);"";[$'03.Muestra'.$E$9]) ->  | D648: of:=IF(AND([.B648]<>"";[.C648]<>"");"N/T";"") ->  | E648: of:=IF([.D648]<>"";IF(AND([.B648]<>"";[.C648]<>"");"";"ERR");"") ->  | F648: of:=COUNTIF([.$D647]:INDIRECT("$D" &  SUM(ROW()-1;['03.Muestra'.$D$40])-1);[.F647]) -> 0 | G648: of:=COUNTIF([.$D647]:INDIRECT("$D" &  SUM(ROW()-1;['03.Muestra'.$D$40])-1);[.G647]) -> 0 | H648: of:=COUNTIF([.$D647]:INDIRECT("$D" &  SUM(ROW()-1;['03.Muestra'.$D$40])-1);[.H647]) -> 0 | I648: of:=COUNTIF([.$D647]:INDIRECT("$D" &  SUM(ROW()-1;['03.Muestra'.$D$40])-1);[.I647]) -> 0 | J648: of:=COUNTIF([.$D647]:INDIRECT("$D" &  SUM(ROW()-1;['03.Muestra'.$D$40])-1);[.J647]) -> 0 | K648: of:=IF(['03.Muestra'.$D$40]=0;0;COUNTBLANK([.$D647]:INDIRECT("$D" &  SUM(ROW()-1;['03.Muestra'.$D$40])-1))) -> 0
B649: of:=IF( ISBLANK([$'03.Muestra'.$C$10]);"";[$'03.Muestra'.$C$10]) ->  | C649: of:=IF( ISBLANK([$'03.Muestra'.$E$10]);"";[$'03.Muestra'.$E$10]) ->  | D649: of:=IF(AND([.B649]<>"";[.C649]<>"");"N/T";"") ->  | E649: of:=IF([.D649]<>"";IF(AND([.B649]<>"";[.C649]<>"");"";"ERR");"") -> 
B650: of:=IF( ISBLANK([$'03.Muestra'.$C$11]);"";[$'03.Muestra'.$C$11]) ->  | C650: of:=IF( ISBLANK([$'03.Muestra'.$E$11]);"";[$'03.Muestra'.$E$11]) ->  | D650: of:=IF(AND([.B650]<>"";[.C650]<>"");"N/T";"") ->  | E650: of:=IF([.D650]<>"";IF(AND([.B650]<>"";[.C650]<>"");"";"ERR");"") -> 
B651: of:=IF( ISBLANK([$'03.Muestra'.$C$12]);"";[$'03.Muestra'.$C$12]) ->  | C651: of:=IF( ISBLANK([$'03.Muestra'.$E$12]);"";[$'03.Muestra'.$E$12]) ->  | D651: of:=IF(AND([.B651]<>"";[.C651]<>"");"N/T";"") ->  | E651: of:=IF([.D651]<>"";IF(AND([.B651]<>"";[.C651]<>"");"";"ERR");"") -> 
B652: of:=IF( ISBLANK([$'03.Muestra'.$C$13]);"";[$'03.Muestra'.$C$13]) ->  | C652: of:=IF( ISBLANK([$'03.Muestra'.$E$13]);"";[$'03.Muestra'.$E$13]) ->  | D652: of:=IF(AND([.B652]<>"";[.C652]<>"");"N/T";"") ->  | E652: of:=IF([.D652]<>"";IF(AND([.B652]<>"";[.C652]<>"");"";"ERR");"") -> 
B653: of:=IF( ISBLANK([$'03.Muestra'.$C$14]);"";[$'03.Muestra'.$C$14]) ->  | C653: of:=IF( ISBLANK([$'03.Muestra'.$E$14]);"";[$'03.Muestra'.$E$14]) ->  | D653: of:=IF(AND([.B653]<>"";[.C653]<>"");"N/T";"") ->  | E653: of:=IF([.D653]<>"";IF(AND([.B653]<>"";[.C653]<>"");"";"ERR");"") -> 
B654: of:=IF( ISBLANK([$'03.Muestra'.$C$15]);"";[$'03.Muestra'.$C$15]) ->  | C654: of:=IF( ISBLANK([$'03.Muestra'.$E$15]);"";[$'03.Muestra'.$E$15]) ->  | D654: of:=IF(AND([.B654]<>"";[.C654]<>"");"N/T";"") ->  | E654: of:=IF([.D654]<>"";IF(AND([.B654]<>"";[.C654]<>"");"";"ERR");"") -> 
B655: of:=IF( ISBLANK([$'03.Muestra'.$C$16]);"";[$'03.Muestra'.$C$16]) ->  | C655: of:=IF( ISBLANK([$'03.Muestra'.$E$16]);"";[$'03.Muestra'.$E$16]) ->  | D655: of:=IF(AND([.B655]<>"";[.C655]<>"");"N/T";"") ->  | E655: of:=IF([.D655]<>"";IF(AND([.B655]<>"";[.C655]<>"");"";"ERR");"") -> 
B656: of:=IF( ISBLANK([$'03.Muestra'.$C$17]);"";[$'03.Muestra'.$C$17]) ->  | C656: of:=IF( ISBLANK([$'03.Muestra'.$E$17]);"";[$'03.Muestra'.$E$17]) ->  | D656: of:=IF(AND([.B656]<>"";[.C656]<>"");"N/T";"") ->  | E656: of:=IF([.D656]<>"";IF(AND([.B656]<>"";[.C656]<>"");"";"ERR");"") -> 
B657: of:=IF( ISBLANK([$'03.Muestra'.$C$18]);"";[$'03.Muestra'.$C$18]) ->  | C657: of:=IF( ISBLANK([$'03.Muestra'.$E$18]);"";[$'03.Muestra'.$E$18]) ->  | D657: of:=IF(AND([.B657]<>"";[.C657]<>"");"N/T";"") ->  | E657: of:=IF([.D657]<>"";IF(AND([.B657]<>"";[.C657]<>"");"";"ERR");"") -> 
B658: of:=IF( ISBLANK([$'03.Muestra'.$C$19]);"";[$'03.Muestra'.$C$19]) ->  | C658: of:=IF( ISBLANK([$'03.Muestra'.$E$19]);"";[$'03.Muestra'.$E$19]) ->  | D658: of:=IF(AND([.B658]<>"";[.C658]<>"");"N/T";"") ->  | E658: of:=IF([.D658]<>"";IF(AND([.B658]<>"";[.C658]<>"");"";"ERR");"") -> 
B659: of:=IF( ISBLANK([$'03.Muestra'.$C$20]);"";[$'03.Muestra'.$C$20]) ->  | C659: of:=IF( ISBLANK([$'03.Muestra'.$E$20]);"";[$'03.Muestra'.$E$20]) ->  | D659: of:=IF(AND([.B659]<>"";[.C659]<>"");"N/T";"") ->  | E659: of:=IF([.D659]<>"";IF(AND([.B659]<>"";[.C659]<>"");"";"ERR");"") -> 
B660: of:=IF( ISBLANK([$'03.Muestra'.$C$21]);"";[$'03.Muestra'.$C$21]) ->  | C660: of:=IF( ISBLANK([$'03.Muestra'.$E$21]);"";[$'03.Muestra'.$E$21]) ->  | D660: of:=IF(AND([.B660]<>"";[.C660]<>"");"N/T";"") ->  | E660: of:=IF([.D660]<>"";IF(AND([.B660]<>"";[.C660]<>"");"";"ERR");"") -> 
B661: of:=IF( ISBLANK([$'03.Muestra'.$C$22]);"";[$'03.Muestra'.$C$22]) ->  | C661: of:=IF( ISBLANK([$'03.Muestra'.$E$22]);"";[$'03.Muestra'.$E$22]) ->  | D661: of:=IF(AND([.B661]<>"";[.C661]<>"");"N/T";"") ->  | E661: of:=IF([.D661]<>"";IF(AND([.B661]<>"";[.C661]<>"");"";"ERR");"") -> 
B662: of:=IF( ISBLANK([$'03.Muestra'.$C$23]);"";[$'03.Muestra'.$C$23]) ->  | C662: of:=IF( ISBLANK([$'03.Muestra'.$E$23]);"";[$'03.Muestra'.$E$23]) ->  | D662: of:=IF(AND([.B662]<>"";[.C662]<>"");"N/T";"") ->  | E662: of:=IF([.D662]<>"";IF(AND([.B662]<>"";[.C662]<>"");"";"ERR");"") -> 
B663: of:=IF( ISBLANK([$'03.Muestra'.$C$24]);"";[$'03.Muestra'.$C$24]) ->  | C663: of:=IF( ISBLANK([$'03.Muestra'.$E$24]);"";[$'03.Muestra'.$E$24]) ->  | D663: of:=IF(AND([.B663]<>"";[.C663]<>"");"N/T";"") ->  | E663: of:=IF([.D663]<>"";IF(AND([.B663]<>"";[.C663]<>"");"";"ERR");"") -> 
B664: of:=IF( ISBLANK([$'03.Muestra'.$C$25]);"";[$'03.Muestra'.$C$25]) ->  | C664: of:=IF( ISBLANK([$'03.Muestra'.$E$25]);"";[$'03.Muestra'.$E$25]) ->  | D664: of:=IF(AND([.B664]<>"";[.C664]<>"");"N/T";"") ->  | E664: of:=IF([.D664]<>"";IF(AND([.B664]<>"";[.C664]<>"");"";"ERR");"") -> 
B665: of:=IF( ISBLANK([$'03.Muestra'.$C$26]);"";[$'03.Muestra'.$C$26]) ->  | C665: of:=IF( ISBLANK([$'03.Muestra'.$E$26]);"";[$'03.Muestra'.$E$26]) ->  | D665: of:=IF(AND([.B665]<>"";[.C665]<>"");"N/T";"") ->  | E665: of:=IF([.D665]<>"";IF(AND([.B665]<>"";[.C665]<>"");"";"ERR");"") -> 
B666: of:=IF( ISBLANK([$'03.Muestra'.$C$27]);"";[$'03.Muestra'.$C$27]) ->  | C666: of:=IF( ISBLANK([$'03.Muestra'.$E$27]);"";[$'03.Muestra'.$E$27]) ->  | D666: of:=IF(AND([.B666]<>"";[.C666]<>"");"N/T";"") ->  | E666: of:=IF([.D666]<>"";IF(AND([.B666]<>"";[.C666]<>"");"";"ERR");"") -> 
B667: of:=IF( ISBLANK([$'03.Muestra'.$C$28]);"";[$'03.Muestra'.$C$28]) ->  | C667: of:=IF( ISBLANK([$'03.Muestra'.$E$28]);"";[$'03.Muestra'.$E$28]) ->  | D667: of:=IF(AND([.B667]<>"";[.C667]<>"");"N/T";"") ->  | E667: of:=IF([.D667]<>"";IF(AND([.B667]<>"";[.C667]<>"");"";"ERR");"") -> 
B668: of:=IF( ISBLANK([$'03.Muestra'.$C$29]);"";[$'03.Muestra'.$C$29]) ->  | C668: of:=IF( ISBLANK([$'03.Muestra'.$E$29]);"";[$'03.Muestra'.$E$29]) ->  | D668: of:=IF(AND([.B668]<>"";[.C668]<>"");"N/T";"") ->  | E668: of:=IF([.D668]<>"";IF(AND([.B668]<>"";[.C668]<>"");"";"ERR");"") -> 
B669: of:=IF( ISBLANK([$'03.Muestra'.$C$30]);"";[$'03.Muestra'.$C$30]) ->  | C669: of:=IF( ISBLANK([$'03.Muestra'.$E$30]);"";[$'03.Muestra'.$E$30]) ->  | D669: of:=IF(AND([.B669]<>"";[.C669]<>"");"N/T";"") ->  | E669: of:=IF([.D669]<>"";IF(AND([.B669]<>"";[.C669]<>"");"";"ERR");"") -> 
B670: of:=IF( ISBLANK([$'03.Muestra'.$C$31]);"";[$'03.Muestra'.$C$31]) ->  | C670: of:=IF( ISBLANK([$'03.Muestra'.$E$31]);"";[$'03.Muestra'.$E$31]) ->  | D670: of:=IF(AND([.B670]<>"";[.C670]<>"");"N/T";"") ->  | E670: of:=IF([.D670]<>"";IF(AND([.B670]<>"";[.C670]<>"");"";"ERR");"") -> 
B671: of:=IF( ISBLANK([$'03.Muestra'.$C$32]);"";[$'03.Muestra'.$C$32]) ->  | C671: of:=IF( ISBLANK([$'03.Muestra'.$E$32]);"";[$'03.Muestra'.$E$32]) ->  | D671: of:=IF(AND([.B671]<>"";[.C671]<>"");"N/T";"") ->  | E671: of:=IF([.D671]<>"";IF(AND([.B671]<>"";[.C671]<>"");"";"ERR");"") -> 
B672: of:=IF( ISBLANK([$'03.Muestra'.$C$33]);"";[$'03.Muestra'.$C$33]) ->  | C672: of:=IF( ISBLANK([$'03.Muestra'.$E$33]);"";[$'03.Muestra'.$E$33]) ->  | D672: of:=IF(AND([.B672]<>"";[.C672]<>"");"N/T";"") ->  | E672: of:=IF([.D672]<>"";IF(AND([.B672]<>"";[.C672]<>"");"";"ERR");"") -> 
B673: of:=IF( ISBLANK([$'03.Muestra'.$C$34]);"";[$'03.Muestra'.$C$34]) ->  | C673: of:=IF( ISBLANK([$'03.Muestra'.$E$34]);"";[$'03.Muestra'.$E$34]) ->  | D673: of:=IF(AND([.B673]<>"";[.C673]<>"");"N/T";"") ->  | E673: of:=IF([.D673]<>"";IF(AND([.B673]<>"";[.C673]<>"");"";"ERR");"") -> 
B674: of:=IF( ISBLANK([$'03.Muestra'.$C$35]);"";[$'03.Muestra'.$C$35]) ->  | C674: of:=IF( ISBLANK([$'03.Muestra'.$E$35]);"";[$'03.Muestra'.$E$35]) ->  | D674: of:=IF(AND([.B674]<>"";[.C674]<>"");"N/T";"") ->  | E674: of:=IF([.D674]<>"";IF(AND([.B674]<>"";[.C674]<>"");"";"ERR");"") -> 
B675: of:=IF( ISBLANK([$'03.Muestra'.$C$36]);"";[$'03.Muestra'.$C$36]) ->  | C675: of:=IF( ISBLANK([$'03.Muestra'.$E$36]);"";[$'03.Muestra'.$E$36]) ->  | D675: of:=IF(AND([.B675]<>"";[.C675]<>"");"N/T";"") ->  | E675: of:=IF([.D675]<>"";IF(AND([.B675]<>"";[.C675]<>"");"";"ERR");"") -> 
B676: of:=IF( ISBLANK([$'03.Muestra'.$C$37]);"";[$'03.Muestra'.$C$37]) ->  | C676: of:=IF( ISBLANK([$'03.Muestra'.$E$37]);"";[$'03.Muestra'.$E$37]) ->  | D676: of:=IF(AND([.B676]<>"";[.C676]<>"");"N/T";"") ->  | E676: of:=IF([.D676]<>"";IF(AND([.B676]<>"";[.C676]<>"");"";"ERR");"") -> 

Sheet: P2.Operable
B2: Informe de revisiÃ³n de la accesibilidad
B3: AnÃ¡lisis de accesibilidad en profundidad
B5: RevisiÃ³n de la muestra
B8: Principio 2: Operable
B9: Los componentes de la interfaz de usuario y la navegaciÃ³n deben ser operables.
B11: Criterios de VerificaciÃ³n | F11: Criterios | G11: Evaluados | H11: % | J11: Criterios | K11: Pendientes | L11: %
B12: A | C12: 14 | F12: Pasa | G12: of:=[.J20]+[.J53]+[.J86]+[.J119]+[.J152]+[.J185]+[.J218]+[.J251]+[.J284]+[.J317]+[.J350]+[.J383]+[.J416]+[.J449]+[.J482]+[.J515]+[.J548] -> 0 | H12: of:=IF(([.$G$15]+[.$K$15])=0;0;[.G12]/([.$G$15]+[.$K$15])) -> 0 | J12: No decide | K12: of:=[.G20]+[.G53]+[.G86]+[.G119]+[.G152]+[.G185]+[.G218]+[.G251]+[.G284]+[.G317]+[.G350]+[.G383]+[.G416]+[.G449]+[.G482]+[.G515]+[.G548] -> 0 | L12: of:=IF(([.$G$15]+[.$K$15])=0;0;[.K12]/([.$G$15]+[.$K$15])) -> 0
B13: AA | C13: 3 | F13: Falla | G13: of:=[.I20]+[.I53]+[.I86]+[.I119]+[.I152]+[.I185]+[.I218]+[.I251]+[.I284]+[.I317]+[.I350]+[.I383]+[.I416]+[.I449]+[.I482]+[.I515]+[.I548] -> 0 | H13: of:=IF(([.$G$15]+[.$K$15])=0;0;[.G13]/([.$G$15]+[.$K$15])) -> 0 | J13: No testeado | K13: of:=[.F20]+[.F53]+[.F86]+[.F119]+[.F152]+[.F185]+[.F218]+[.F251]+[.F284]+[.F317]+[.F350]+[.F383]+[.F416]+[.F449]+[.F482]+[.F515]+[.F548] -> 0 | L13: of:=IF(([.$G$15]+[.$K$15])=0;0;[.K13]/([.$G$15]+[.$K$15])) -> 0
B14: Total | C14: of:=SUM([.C12:.C13]) -> 17 | F14: No aplica | G14: of:=[.H20]+[.H53]+[.H86]+[.H119]+[.H152]+[.H185]+[.H218]+[.H251]+[.H284]+[.H317]+[.H350]+[.H383]+[.H416]+[.H449]+[.H482]+[.H515]+[.H548] -> 0 | H14: of:=IF(([.$G$15]+[.$K$15])=0;0;[.G14]/([.$G$15]+[.$K$15])) -> 0 | J14: En blanco | K14: of:=[.K20]+[.K53]+[.K86]+[.K119]+[.K152]+[.K185]+[.K218]+[.K251]+[.K284]+[.K317]+[.K350]+[.K383]+[.K416]+[.K449]+[.K482]+[.K515]+[.K548] -> 0 | L14: of:=IF(([.$G$15]+[.$K$15])=0;0;[.K14]/([.$G$15]+[.$K$15])) -> 0
F15: Total | G15: of:=SUM([.G12:.G14]) -> 0 | H15: of:=SUM([.H12:.H14]) -> 0 | J15: Total | K15: of:=SUM([.K12:.K14]) -> 0 | L15: of:=SUM([.L12:.L14]) -> 0
B18: A | C18: 2.1.1 Teclado | D18: Resultado
B19: of:=IF( ISBLANK([$'03.Muestra'.$C$8]);"";[$'03.Muestra'.$C$8]) ->  | C19: of:=IF( ISBLANK([$'03.Muestra'.$E$8]);"";[$'03.Muestra'.$E$8]) ->  | D19: of:=IF(AND([.B19]<>"";[.C19]<>"");"N/T";"") ->  | E19: of:=IF([.D19]<>"";IF(AND([.B19]<>"";[.C19]<>"");"";"ERR");"") ->  | F19: of:=TRANSPOSE([$'DATA - Oculta'.$U$9:$'DATA - Oculta'.$U$13]) -> N/T | G19: N/D | H19: N/A | I19: Falla | J19: Pasa | K19: En blanco
B20: of:=IF( ISBLANK([$'03.Muestra'.$C$9]);"";[$'03.Muestra'.$C$9]) ->  | C20: of:=IF( ISBLANK([$'03.Muestra'.$E$9]);"";[$'03.Muestra'.$E$9]) ->  | D20: of:=IF(AND([.B20]<>"";[.C20]<>"");"N/T";"") ->  | E20: of:=IF([.D20]<>"";IF(AND([.B20]<>"";[.C20]<>"");"";"ERR");"") ->  | F20: of:=COUNTIF([.$D19]:INDIRECT("$D" &  SUM(ROW()-1;[$'03.Muestra'.$D$40])-1);[.F19]) -> 0 | G20: of:=COUNTIF([.$D19]:INDIRECT("$D" &  SUM(ROW()-1;[$'03.Muestra'.$D$40])-1);[.G19]) -> 0 | H20: of:=COUNTIF([.$D19]:INDIRECT("$D" &  SUM(ROW()-1;[$'03.Muestra'.$D$40])-1);[.H19]) -> 0 | I20: of:=COUNTIF([.$D19]:INDIRECT("$D" &  SUM(ROW()-1;[$'03.Muestra'.$D$40])-1);[.I19]) -> 0 | J20: of:=COUNTIF([.$D19]:INDIRECT("$D" &  SUM(ROW()-1;[$'03.Muestra'.$D$40])-1);[.J19]) -> 0 | K20: of:=IF([$'03.Muestra'.$D$40]=0;0;COUNTBLANK([.$D19]:INDIRECT("$D" &  SUM(ROW()-1;[$'03.Muestra'.$D$40])-1))) -> 0
B21: of:=IF( ISBLANK([$'03.Muestra'.$C$10]);"";[$'03.Muestra'.$C$10]) ->  | C21: of:=IF( ISBLANK([$'03.Muestra'.$E$10]);"";[$'03.Muestra'.$E$10]) ->  | D21: of:=IF(AND([.B21]<>"";[.C21]<>"");"N/T";"") ->  | E21: of:=IF([.D21]<>"";IF(AND([.B21]<>"";[.C21]<>"");"";"ERR");"") -> 
B22: of:=IF( ISBLANK([$'03.Muestra'.$C$11]);"";[$'03.Muestra'.$C$11]) ->  | C22: of:=IF( ISBLANK([$'03.Muestra'.$E$11]);"";[$'03.Muestra'.$E$11]) ->  | D22: of:=IF(AND([.B22]<>"";[.C22]<>"");"N/T";"") ->  | E22: of:=IF([.D22]<>"";IF(AND([.B22]<>"";[.C22]<>"");"";"ERR");"") ->  | K22: N/T | L22: No Testeado
B23: of:=IF( ISBLANK([$'03.Muestra'.$C$12]);"";[$'03.Muestra'.$C$12]) ->  | C23: of:=IF( ISBLANK([$'03.Muestra'.$E$12]);"";[$'03.Muestra'.$E$12]) ->  | D23: of:=IF(AND([.B23]<>"";[.C23]<>"");"N/T";"") ->  | E23: of:=IF([.D23]<>"";IF(AND([.B23]<>"";[.C23]<>"");"";"ERR");"") ->  | K23: N/A | L23: No Aplica
B24: of:=IF( ISBLANK([$'03.Muestra'.$C$13]);"";[$'03.Muestra'.$C$13]) ->  | C24: of:=IF( ISBLANK([$'03.Muestra'.$E$13]);"";[$'03.Muestra'.$E$13]) ->  | D24: of:=IF(AND([.B24]<>"";[.C24]<>"");"N/T";"") ->  | E24: of:=IF([.D24]<>"";IF(AND([.B24]<>"";[.C24]<>"");"";"ERR");"") ->  | K24: N/D | L24: No Decide
B25: of:=IF( ISBLANK([$'03.Muestra'.$C$14]);"";[$'03.Muestra'.$C$14]) ->  | C25: of:=IF( ISBLANK([$'03.Muestra'.$E$14]);"";[$'03.Muestra'.$E$14]) ->  | D25: of:=IF(AND([.B25]<>"";[.C25]<>"");"N/T";"") ->  | E25: of:=IF([.D25]<>"";IF(AND([.B25]<>"";[.C25]<>"");"";"ERR");"") -> 
B26: of:=IF( ISBLANK([$'03.Muestra'.$C$15]);"";[$'03.Muestra'.$C$15]) ->  | C26: of:=IF( ISBLANK([$'03.Muestra'.$E$15]);"";[$'03.Muestra'.$E$15]) ->  | D26: of:=IF(AND([.B26]<>"";[.C26]<>"");"N/T";"") ->  | E26: of:=IF([.D26]<>"";IF(AND([.B26]<>"";[.C26]<>"");"";"ERR");"") -> 
B27: of:=IF( ISBLANK([$'03.Muestra'.$C$16]);"";[$'03.Muestra'.$C$16]) ->  | C27: of:=IF( ISBLANK([$'03.Muestra'.$E$16]);"";[$'03.Muestra'.$E$16]) ->  | D27: of:=IF(AND([.B27]<>"";[.C27]<>"");"N/T";"") ->  | E27: of:=IF([.D27]<>"";IF(AND([.B27]<>"";[.C27]<>"");"";"ERR");"") -> 
B28: of:=IF( ISBLANK([$'03.Muestra'.$C$17]);"";[$'03.Muestra'.$C$17]) ->  | C28: of:=IF( ISBLANK([$'03.Muestra'.$E$17]);"";[$'03.Muestra'.$E$17]) ->  | D28: of:=IF(AND([.B28]<>"";[.C28]<>"");"N/T";"") ->  | E28: of:=IF([.D28]<>"";IF(AND([.B28]<>"";[.C28]<>"");"";"ERR");"") -> 
B29: of:=IF( ISBLANK([$'03.Muestra'.$C$18]);"";[$'03.Muestra'.$C$18]) ->  | C29: of:=IF( ISBLANK([$'03.Muestra'.$E$18]);"";[$'03.Muestra'.$E$18]) ->  | D29: of:=IF(AND([.B29]<>"";[.C29]<>"");"N/T";"") ->  | E29: of:=IF([.D29]<>"";IF(AND([.B29]<>"";[.C29]<>"");"";"ERR");"") -> 
B30: of:=IF( ISBLANK([$'03.Muestra'.$C$19]);"";[$'03.Muestra'.$C$19]) ->  | C30: of:=IF( ISBLANK([$'03.Muestra'.$E$19]);"";[$'03.Muestra'.$E$19]) ->  | D30: of:=IF(AND([.B30]<>"";[.C30]<>"");"N/T";"") ->  | E30: of:=IF([.D30]<>"";IF(AND([.B30]<>"";[.C30]<>"");"";"ERR");"") -> 
B31: of:=IF( ISBLANK([$'03.Muestra'.$C$20]);"";[$'03.Muestra'.$C$20]) ->  | C31: of:=IF( ISBLANK([$'03.Muestra'.$E$20]);"";[$'03.Muestra'.$E$20]) ->  | D31: of:=IF(AND([.B31]<>"";[.C31]<>"");"N/T";"") ->  | E31: of:=IF([.D31]<>"";IF(AND([.B31]<>"";[.C31]<>"");"";"ERR");"") -> 
B32: of:=IF( ISBLANK([$'03.Muestra'.$C$21]);"";[$'03.Muestra'.$C$21]) ->  | C32: of:=IF( ISBLANK([$'03.Muestra'.$E$21]);"";[$'03.Muestra'.$E$21]) ->  | D32: of:=IF(AND([.B32]<>"";[.C32]<>"");"N/T";"") ->  | E32: of:=IF([.D32]<>"";IF(AND([.B32]<>"";[.C32]<>"");"";"ERR");"") -> 
B33: of:=IF( ISBLANK([$'03.Muestra'.$C$22]);"";[$'03.Muestra'.$C$22]) ->  | C33: of:=IF( ISBLANK([$'03.Muestra'.$E$22]);"";[$'03.Muestra'.$E$22]) ->  | D33: of:=IF(AND([.B33]<>"";[.C33]<>"");"N/T";"") ->  | E33: of:=IF([.D33]<>"";IF(AND([.B33]<>"";[.C33]<>"");"";"ERR");"") -> 
B34: of:=IF( ISBLANK([$'03.Muestra'.$C$23]);"";[$'03.Muestra'.$C$23]) ->  | C34: of:=IF( ISBLANK([$'03.Muestra'.$E$23]);"";[$'03.Muestra'.$E$23]) ->  | D34: of:=IF(AND([.B34]<>"";[.C34]<>"");"N/T";"") ->  | E34: of:=IF([.D34]<>"";IF(AND([.B34]<>"";[.C34]<>"");"";"ERR");"") -> 
B35: of:=IF( ISBLANK([$'03.Muestra'.$C$24]);"";[$'03.Muestra'.$C$24]) ->  | C35: of:=IF( ISBLANK([$'03.Muestra'.$E$24]);"";[$'03.Muestra'.$E$24]) ->  | D35: of:=IF(AND([.B35]<>"";[.C35]<>"");"N/T";"") ->  | E35: of:=IF([.D35]<>"";IF(AND([.B35]<>"";[.C35]<>"");"";"ERR");"") -> 
B36: of:=IF( ISBLANK([$'03.Muestra'.$C$25]);"";[$'03.Muestra'.$C$25]) ->  | C36: of:=IF( ISBLANK([$'03.Muestra'.$E$25]);"";[$'03.Muestra'.$E$25]) ->  | D36: of:=IF(AND([.B36]<>"";[.C36]<>"");"N/T";"") ->  | E36: of:=IF([.D36]<>"";IF(AND([.B36]<>"";[.C36]<>"");"";"ERR");"") -> 
B37: of:=IF( ISBLANK([$'03.Muestra'.$C$26]);"";[$'03.Muestra'.$C$26]) ->  | C37: of:=IF( ISBLANK([$'03.Muestra'.$E$26]);"";[$'03.Muestra'.$E$26]) ->  | D37: of:=IF(AND([.B37]<>"";[.C37]<>"");"N/T";"") ->  | E37: of:=IF([.D37]<>"";IF(AND([.B37]<>"";[.C37]<>"");"";"ERR");"") -> 
B38: of:=IF( ISBLANK([$'03.Muestra'.$C$27]);"";[$'03.Muestra'.$C$27]) ->  | C38: of:=IF( ISBLANK([$'03.Muestra'.$E$27]);"";[$'03.Muestra'.$E$27]) ->  | D38: of:=IF(AND([.B38]<>"";[.C38]<>"");"N/T";"") ->  | E38: of:=IF([.D38]<>"";IF(AND([.B38]<>"";[.C38]<>"");"";"ERR");"") -> 
B39: of:=IF( ISBLANK([$'03.Muestra'.$C$28]);"";[$'03.Muestra'.$C$28]) ->  | C39: of:=IF( ISBLANK([$'03.Muestra'.$E$28]);"";[$'03.Muestra'.$E$28]) ->  | D39: of:=IF(AND([.B39]<>"";[.C39]<>"");"N/T";"") ->  | E39: of:=IF([.D39]<>"";IF(AND([.B39]<>"";[.C39]<>"");"";"ERR");"") -> 
B40: of:=IF( ISBLANK([$'03.Muestra'.$C$29]);"";[$'03.Muestra'.$C$29]) ->  | C40: of:=IF( ISBLANK([$'03.Muestra'.$E$29]);"";[$'03.Muestra'.$E$29]) ->  | D40: of:=IF(AND([.B40]<>"";[.C40]<>"");"N/T";"") ->  | E40: of:=IF([.D40]<>"";IF(AND([.B40]<>"";[.C40]<>"");"";"ERR");"") -> 
B41: of:=IF( ISBLANK([$'03.Muestra'.$C$30]);"";[$'03.Muestra'.$C$30]) ->  | C41: of:=IF( ISBLANK([$'03.Muestra'.$E$30]);"";[$'03.Muestra'.$E$30]) ->  | D41: of:=IF(AND([.B41]<>"";[.C41]<>"");"N/T";"") ->  | E41: of:=IF([.D41]<>"";IF(AND([.B41]<>"";[.C41]<>"");"";"ERR");"") -> 
B42: of:=IF( ISBLANK([$'03.Muestra'.$C$31]);"";[$'03.Muestra'.$C$31]) ->  | C42: of:=IF( ISBLANK([$'03.Muestra'.$E$31]);"";[$'03.Muestra'.$E$31]) ->  | D42: of:=IF(AND([.B42]<>"";[.C42]<>"");"N/T";"") ->  | E42: of:=IF([.D42]<>"";IF(AND([.B42]<>"";[.C42]<>"");"";"ERR");"") -> 
B43: of:=IF( ISBLANK([$'03.Muestra'.$C$32]);"";[$'03.Muestra'.$C$32]) ->  | C43: of:=IF( ISBLANK([$'03.Muestra'.$E$32]);"";[$'03.Muestra'.$E$32]) ->  | D43: of:=IF(AND([.B43]<>"";[.C43]<>"");"N/T";"") ->  | E43: of:=IF([.D43]<>"";IF(AND([.B43]<>"";[.C43]<>"");"";"ERR");"") -> 
B44: of:=IF( ISBLANK([$'03.Muestra'.$C$33]);"";[$'03.Muestra'.$C$33]) ->  | C44: of:=IF( ISBLANK([$'03.Muestra'.$E$33]);"";[$'03.Muestra'.$E$33]) ->  | D44: of:=IF(AND([.B44]<>"";[.C44]<>"");"N/T";"") ->  | E44: of:=IF([.D44]<>"";IF(AND([.B44]<>"";[.C44]<>"");"";"ERR");"") -> 
B45: of:=IF( ISBLANK([$'03.Muestra'.$C$34]);"";[$'03.Muestra'.$C$34]) ->  | C45: of:=IF( ISBLANK([$'03.Muestra'.$E$34]);"";[$'03.Muestra'.$E$34]) ->  | D45: of:=IF(AND([.B45]<>"";[.C45]<>"");"N/T";"") ->  | E45: of:=IF([.D45]<>"";IF(AND([.B45]<>"";[.C45]<>"");"";"ERR");"") -> 
B46: of:=IF( ISBLANK([$'03.Muestra'.$C$35]);"";[$'03.Muestra'.$C$35]) ->  | C46: of:=IF( ISBLANK([$'03.Muestra'.$E$35]);"";[$'03.Muestra'.$E$35]) ->  | D46: of:=IF(AND([.B46]<>"";[.C46]<>"");"N/T";"") ->  | E46: of:=IF([.D46]<>"";IF(AND([.B46]<>"";[.C46]<>"");"";"ERR");"") -> 
B47: of:=IF( ISBLANK([$'03.Muestra'.$C$36]);"";[$'03.Muestra'.$C$36]) ->  | C47: of:=IF( ISBLANK([$'03.Muestra'.$E$36]);"";[$'03.Muestra'.$E$36]) ->  | D47: of:=IF(AND([.B47]<>"";[.C47]<>"");"N/T";"") ->  | E47: of:=IF([.D47]<>"";IF(AND([.B47]<>"";[.C47]<>"");"";"ERR");"") -> 
B48: of:=IF( ISBLANK([$'03.Muestra'.$C$37]);"";[$'03.Muestra'.$C$37]) ->  | C48: of:=IF( ISBLANK([$'03.Muestra'.$E$37]);"";[$'03.Muestra'.$E$37]) ->  | D48: of:=IF(AND([.B48]<>"";[.C48]<>"");"N/T";"") ->  | E48: of:=IF([.D48]<>"";IF(AND([.B48]<>"";[.C48]<>"");"";"ERR");"") -> 
B51: A | C51: 2.1.2 Sin trampas para el foco del teclado | D51: Resultado
B52: of:=IF( ISBLANK([$'03.Muestra'.$C$8]);"";[$'03.Muestra'.$C$8]) ->  | C52: of:=IF( ISBLANK([$'03.Muestra'.$E$8]);"";[$'03.Muestra'.$E$8]) ->  | D52: of:=IF(AND([.B52]<>"";[.C52]<>"");"N/T";"") ->  | E52: of:=IF([.D52]<>"";IF(AND([.B52]<>"";[.C52]<>"");"";"ERR");"") ->  | F52: of:=TRANSPOSE([$'DATA - Oculta'.$U$9:$'DATA - Oculta'.$U$13]) -> N/T | G52: N/D | H52: N/A | I52: Falla | J52: Pasa | K52: En blanco
B53: of:=IF( ISBLANK([$'03.Muestra'.$C$9]);"";[$'03.Muestra'.$C$9]) ->  | C53: of:=IF( ISBLANK([$'03.Muestra'.$E$9]);"";[$'03.Muestra'.$E$9]) ->  | D53: of:=IF(AND([.B53]<>"";[.C53]<>"");"N/T";"") ->  | E53: of:=IF([.D53]<>"";IF(AND([.B53]<>"";[.C53]<>"");"";"ERR");"") ->  | F53: of:=COUNTIF([.$D52]:INDIRECT("$D" &  SUM(ROW()-1;[$'03.Muestra'.$D$40])-1);[.F52]) -> 0 | G53: of:=COUNTIF([.$D52]:INDIRECT("$D" &  SUM(ROW()-1;[$'03.Muestra'.$D$40])-1);[.G52]) -> 0 | H53: of:=COUNTIF([.$D52]:INDIRECT("$D" &  SUM(ROW()-1;[$'03.Muestra'.$D$40])-1);[.H52]) -> 0 | I53: of:=COUNTIF([.$D52]:INDIRECT("$D" &  SUM(ROW()-1;[$'03.Muestra'.$D$40])-1);[.I52]) -> 0 | J53: of:=COUNTIF([.$D52]:INDIRECT("$D" &  SUM(ROW()-1;[$'03.Muestra'.$D$40])-1);[.J52]) -> 0 | K53: of:=IF([$'03.Muestra'.$D$40]=0;0;COUNTBLANK([.$D52]:INDIRECT("$D" &  SUM(ROW()-1;[$'03.Muestra'.$D$40])-1))) -> 0
B54: of:=IF( ISBLANK([$'03.Muestra'.$C$10]);"";[$'03.Muestra'.$C$10]) ->  | C54: of:=IF( ISBLANK([$'03.Muestra'.$E$10]);"";[$'03.Muestra'.$E$10]) ->  | D54: of:=IF(AND([.B54]<>"";[.C54]<>"");"N/T";"") ->  | E54: of:=IF([.D54]<>"";IF(AND([.B54]<>"";[.C54]<>"");"";"ERR");"") -> 
B55: of:=IF( ISBLANK([$'03.Muestra'.$C$11]);"";[$'03.Muestra'.$C$11]) ->  | C55: of:=IF( ISBLANK([$'03.Muestra'.$E$11]);"";[$'03.Muestra'.$E$11]) ->  | D55: of:=IF(AND([.B55]<>"";[.C55]<>"");"N/T";"") ->  | E55: of:=IF([.D55]<>"";IF(AND([.B55]<>"";[.C55]<>"");"";"ERR");"") -> 
B56: of:=IF( ISBLANK([$'03.Muestra'.$C$12]);"";[$'03.Muestra'.$C$12]) ->  | C56: of:=IF( ISBLANK([$'03.Muestra'.$E$12]);"";[$'03.Muestra'.$E$12]) ->  | D56: of:=IF(AND([.B56]<>"";[.C56]<>"");"N/T";"") ->  | E56: of:=IF([.D56]<>"";IF(AND([.B56]<>"";[.C56]<>"");"";"ERR");"") -> 
B57: of:=IF( ISBLANK([$'03.Muestra'.$C$13]);"";[$'03.Muestra'.$C$13]) ->  | C57: of:=IF( ISBLANK([$'03.Muestra'.$E$13]);"";[$'03.Muestra'.$E$13]) ->  | D57: of:=IF(AND([.B57]<>"";[.C57]<>"");"N/T";"") ->  | E57: of:=IF([.D57]<>"";IF(AND([.B57]<>"";[.C57]<>"");"";"ERR");"") -> 
B58: of:=IF( ISBLANK([$'03.Muestra'.$C$14]);"";[$'03.Muestra'.$C$14]) ->  | C58: of:=IF( ISBLANK([$'03.Muestra'.$E$14]);"";[$'03.Muestra'.$E$14]) ->  | D58: of:=IF(AND([.B58]<>"";[.C58]<>"");"N/T";"") ->  | E58: of:=IF([.D58]<>"";IF(AND([.B58]<>"";[.C58]<>"");"";"ERR");"") -> 
B59: of:=IF( ISBLANK([$'03.Muestra'.$C$15]);"";[$'03.Muestra'.$C$15]) ->  | C59: of:=IF( ISBLANK([$'03.Muestra'.$E$15]);"";[$'03.Muestra'.$E$15]) ->  | D59: of:=IF(AND([.B59]<>"";[.C59]<>"");"N/T";"") ->  | E59: of:=IF([.D59]<>"";IF(AND([.B59]<>"";[.C59]<>"");"";"ERR");"") -> 
B60: of:=IF( ISBLANK([$'03.Muestra'.$C$16]);"";[$'03.Muestra'.$C$16]) ->  | C60: of:=IF( ISBLANK([$'03.Muestra'.$E$16]);"";[$'03.Muestra'.$E$16]) ->  | D60: of:=IF(AND([.B60]<>"";[.C60]<>"");"N/T";"") ->  | E60: of:=IF([.D60]<>"";IF(AND([.B60]<>"";[.C60]<>"");"";"ERR");"") -> 
B61: of:=IF( ISBLANK([$'03.Muestra'.$C$17]);"";[$'03.Muestra'.$C$17]) ->  | C61: of:=IF( ISBLANK([$'03.Muestra'.$E$17]);"";[$'03.Muestra'.$E$17]) ->  | D61: of:=IF(AND([.B61]<>"";[.C61]<>"");"N/T";"") ->  | E61: of:=IF([.D61]<>"";IF(AND([.B61]<>"";[.C61]<>"");"";"ERR");"") -> 
B62: of:=IF( ISBLANK([$'03.Muestra'.$C$18]);"";[$'03.Muestra'.$C$18]) ->  | C62: of:=IF( ISBLANK([$'03.Muestra'.$E$18]);"";[$'03.Muestra'.$E$18]) ->  | D62: of:=IF(AND([.B62]<>"";[.C62]<>"");"N/T";"") ->  | E62: of:=IF([.D62]<>"";IF(AND([.B62]<>"";[.C62]<>"");"";"ERR");"") -> 
B63: of:=IF( ISBLANK([$'03.Muestra'.$C$19]);"";[$'03.Muestra'.$C$19]) ->  | C63: of:=IF( ISBLANK([$'03.Muestra'.$E$19]);"";[$'03.Muestra'.$E$19]) ->  | D63: of:=IF(AND([.B63]<>"";[.C63]<>"");"N/T";"") ->  | E63: of:=IF([.D63]<>"";IF(AND([.B63]<>"";[.C63]<>"");"";"ERR");"") -> 
B64: of:=IF( ISBLANK([$'03.Muestra'.$C$20]);"";[$'03.Muestra'.$C$20]) ->  | C64: of:=IF( ISBLANK([$'03.Muestra'.$E$20]);"";[$'03.Muestra'.$E$20]) ->  | D64: of:=IF(AND([.B64]<>"";[.C64]<>"");"N/T";"") ->  | E64: of:=IF([.D64]<>"";IF(AND([.B64]<>"";[.C64]<>"");"";"ERR");"") -> 
B65: of:=IF( ISBLANK([$'03.Muestra'.$C$21]);"";[$'03.Muestra'.$C$21]) ->  | C65: of:=IF( ISBLANK([$'03.Muestra'.$E$21]);"";[$'03.Muestra'.$E$21]) ->  | D65: of:=IF(AND([.B65]<>"";[.C65]<>"");"N/T";"") ->  | E65: of:=IF([.D65]<>"";IF(AND([.B65]<>"";[.C65]<>"");"";"ERR");"") -> 
B66: of:=IF( ISBLANK([$'03.Muestra'.$C$22]);"";[$'03.Muestra'.$C$22]) ->  | C66: of:=IF( ISBLANK([$'03.Muestra'.$E$22]);"";[$'03.Muestra'.$E$22]) ->  | D66: of:=IF(AND([.B66]<>"";[.C66]<>"");"N/T";"") ->  | E66: of:=IF([.D66]<>"";IF(AND([.B66]<>"";[.C66]<>"");"";"ERR");"") -> 
B67: of:=IF( ISBLANK([$'03.Muestra'.$C$23]);"";[$'03.Muestra'.$C$23]) ->  | C67: of:=IF( ISBLANK([$'03.Muestra'.$E$23]);"";[$'03.Muestra'.$E$23]) ->  | D67: of:=IF(AND([.B67]<>"";[.C67]<>"");"N/T";"") ->  | E67: of:=IF([.D67]<>"";IF(AND([.B67]<>"";[.C67]<>"");"";"ERR");"") -> 
B68: of:=IF( ISBLANK([$'03.Muestra'.$C$24]);"";[$'03.Muestra'.$C$24]) ->  | C68: of:=IF( ISBLANK([$'03.Muestra'.$E$24]);"";[$'03.Muestra'.$E$24]) ->  | D68: of:=IF(AND([.B68]<>"";[.C68]<>"");"N/T";"") ->  | E68: of:=IF([.D68]<>"";IF(AND([.B68]<>"";[.C68]<>"");"";"ERR");"") -> 
B69: of:=IF( ISBLANK([$'03.Muestra'.$C$25]);"";[$'03.Muestra'.$C$25]) ->  | C69: of:=IF( ISBLANK([$'03.Muestra'.$E$25]);"";[$'03.Muestra'.$E$25]) ->  | D69: of:=IF(AND([.B69]<>"";[.C69]<>"");"N/T";"") ->  | E69: of:=IF([.D69]<>"";IF(AND([.B69]<>"";[.C69]<>"");"";"ERR");"") -> 
B70: of:=IF( ISBLANK([$'03.Muestra'.$C$26]);"";[$'03.Muestra'.$C$26]) ->  | C70: of:=IF( ISBLANK([$'03.Muestra'.$E$26]);"";[$'03.Muestra'.$E$26]) ->  | D70: of:=IF(AND([.B70]<>"";[.C70]<>"");"N/T";"") ->  | E70: of:=IF([.D70]<>"";IF(AND([.B70]<>"";[.C70]<>"");"";"ERR");"") -> 
B71: of:=IF( ISBLANK([$'03.Muestra'.$C$27]);"";[$'03.Muestra'.$C$27]) ->  | C71: of:=IF( ISBLANK([$'03.Muestra'.$E$27]);"";[$'03.Muestra'.$E$27]) ->  | D71: of:=IF(AND([.B71]<>"";[.C71]<>"");"N/T";"") ->  | E71: of:=IF([.D71]<>"";IF(AND([.B71]<>"";[.C71]<>"");"";"ERR");"") -> 
B72: of:=IF( ISBLANK([$'03.Muestra'.$C$28]);"";[$'03.Muestra'.$C$28]) ->  | C72: of:=IF( ISBLANK([$'03.Muestra'.$E$28]);"";[$'03.Muestra'.$E$28]) ->  | D72: of:=IF(AND([.B72]<>"";[.C72]<>"");"N/T";"") ->  | E72: of:=IF([.D72]<>"";IF(AND([.B72]<>"";[.C72]<>"");"";"ERR");"") -> 
B73: of:=IF( ISBLANK([$'03.Muestra'.$C$29]);"";[$'03.Muestra'.$C$29]) ->  | C73: of:=IF( ISBLANK([$'03.Muestra'.$E$29]);"";[$'03.Muestra'.$E$29]) ->  | D73: of:=IF(AND([.B73]<>"";[.C73]<>"");"N/T";"") ->  | E73: of:=IF([.D73]<>"";IF(AND([.B73]<>"";[.C73]<>"");"";"ERR");"") -> 
B74: of:=IF( ISBLANK([$'03.Muestra'.$C$30]);"";[$'03.Muestra'.$C$30]) ->  | C74: of:=IF( ISBLANK([$'03.Muestra'.$E$30]);"";[$'03.Muestra'.$E$30]) ->  | D74: of:=IF(AND([.B74]<>"";[.C74]<>"");"N/T";"") ->  | E74: of:=IF([.D74]<>"";IF(AND([.B74]<>"";[.C74]<>"");"";"ERR");"") -> 
B75: of:=IF( ISBLANK([$'03.Muestra'.$C$31]);"";[$'03.Muestra'.$C$31]) ->  | C75: of:=IF( ISBLANK([$'03.Muestra'.$E$31]);"";[$'03.Muestra'.$E$31]) ->  | D75: of:=IF(AND([.B75]<>"";[.C75]<>"");"N/T";"") ->  | E75: of:=IF([.D75]<>"";IF(AND([.B75]<>"";[.C75]<>"");"";"ERR");"") -> 
B76: of:=IF( ISBLANK([$'03.Muestra'.$C$32]);"";[$'03.Muestra'.$C$32]) ->  | C76: of:=IF( ISBLANK([$'03.Muestra'.$E$32]);"";[$'03.Muestra'.$E$32]) ->  | D76: of:=IF(AND([.B76]<>"";[.C76]<>"");"N/T";"") ->  | E76: of:=IF([.D76]<>"";IF(AND([.B76]<>"";[.C76]<>"");"";"ERR");"") -> 
B77: of:=IF( ISBLANK([$'03.Muestra'.$C$33]);"";[$'03.Muestra'.$C$33]) ->  | C77: of:=IF( ISBLANK([$'03.Muestra'.$E$33]);"";[$'03.Muestra'.$E$33]) ->  | D77: of:=IF(AND([.B77]<>"";[.C77]<>"");"N/T";"") ->  | E77: of:=IF([.D77]<>"";IF(AND([.B77]<>"";[.C77]<>"");"";"ERR");"") -> 
B78: of:=IF( ISBLANK([$'03.Muestra'.$C$34]);"";[$'03.Muestra'.$C$34]) ->  | C78: of:=IF( ISBLANK([$'03.Muestra'.$E$34]);"";[$'03.Muestra'.$E$34]) ->  | D78: of:=IF(AND([.B78]<>"";[.C78]<>"");"N/T";"") ->  | E78: of:=IF([.D78]<>"";IF(AND([.B78]<>"";[.C78]<>"");"";"ERR");"") -> 
B79: of:=IF( ISBLANK([$'03.Muestra'.$C$35]);"";[$'03.Muestra'.$C$35]) ->  | C79: of:=IF( ISBLANK([$'03.Muestra'.$E$35]);"";[$'03.Muestra'.$E$35]) ->  | D79: of:=IF(AND([.B79]<>"";[.C79]<>"");"N/T";"") ->  | E79: of:=IF([.D79]<>"";IF(AND([.B79]<>"";[.C79]<>"");"";"ERR");"") -> 
B80: of:=IF( ISBLANK([$'03.Muestra'.$C$36]);"";[$'03.Muestra'.$C$36]) ->  | C80: of:=IF( ISBLANK([$'03.Muestra'.$E$36]);"";[$'03.Muestra'.$E$36]) ->  | D80: of:=IF(AND([.B80]<>"";[.C80]<>"");"N/T";"") ->  | E80: of:=IF([.D80]<>"";IF(AND([.B80]<>"";[.C80]<>"");"";"ERR");"") -> 
B81: of:=IF( ISBLANK([$'03.Muestra'.$C$37]);"";[$'03.Muestra'.$C$37]) ->  | C81: of:=IF( ISBLANK([$'03.Muestra'.$E$37]);"";[$'03.Muestra'.$E$37]) ->  | D81: of:=IF(AND([.B81]<>"";[.C81]<>"");"N/T";"") ->  | E81: of:=IF([.D81]<>"";IF(AND([.B81]<>"";[.C81]<>"");"";"ERR");"") -> 
B84: A | C84: 2.1.4 Atajos con teclas de caracteres | D84: Resultado
B85: of:=IF( ISBLANK([$'03.Muestra'.$C$8]);"";[$'03.Muestra'.$C$8]) ->  | C85: of:=IF( ISBLANK([$'03.Muestra'.$E$8]);"";[$'03.Muestra'.$E$8]) ->  | D85: of:=IF(AND([.B85]<>"";[.C85]<>"");"N/T";"") ->  | E85: of:=IF([.D85]<>"";IF(AND([.B85]<>"";[.C85]<>"");"";"ERR");"") ->  | F85: of:=TRANSPOSE([$'DATA - Oculta'.$U$9:$'DATA - Oculta'.$U$13]) -> N/T | G85: N/D | H85: N/A | I85: Falla | J85: Pasa | K85: En blanco
B86: of:=IF( ISBLANK([$'03.Muestra'.$C$9]);"";[$'03.Muestra'.$C$9]) ->  | C86: of:=IF( ISBLANK([$'03.Muestra'.$E$9]);"";[$'03.Muestra'.$E$9]) ->  | D86: of:=IF(AND([.B86]<>"";[.C86]<>"");"N/T";"") ->  | E86: of:=IF([.D86]<>"";IF(AND([.B86]<>"";[.C86]<>"");"";"ERR");"") ->  | F86: of:=COUNTIF([.$D85]:INDIRECT("$D" &  SUM(ROW()-1;[$'03.Muestra'.$D$40])-1);[.F85]) -> 0 | G86: of:=COUNTIF([.$D85]:INDIRECT("$D" &  SUM(ROW()-1;[$'03.Muestra'.$D$40])-1);[.G85]) -> 0 | H86: of:=COUNTIF([.$D85]:INDIRECT("$D" &  SUM(ROW()-1;[$'03.Muestra'.$D$40])-1);[.H85]) -> 0 | I86: of:=COUNTIF([.$D85]:INDIRECT("$D" &  SUM(ROW()-1;[$'03.Muestra'.$D$40])-1);[.I85]) -> 0 | J86: of:=COUNTIF([.$D85]:INDIRECT("$D" &  SUM(ROW()-1;[$'03.Muestra'.$D$40])-1);[.J85]) -> 0 | K86: of:=IF([$'03.Muestra'.$D$40]=0;0;COUNTBLANK([.$D85]:INDIRECT("$D" &  SUM(ROW()-1;[$'03.Muestra'.$D$40])-1))) -> 0
B87: of:=IF( ISBLANK([$'03.Muestra'.$C$10]);"";[$'03.Muestra'.$C$10]) ->  | C87: of:=IF( ISBLANK([$'03.Muestra'.$E$10]);"";[$'03.Muestra'.$E$10]) ->  | D87: of:=IF(AND([.B87]<>"";[.C87]<>"");"N/T";"") ->  | E87: of:=IF([.D87]<>"";IF(AND([.B87]<>"";[.C87]<>"");"";"ERR");"") -> 
B88: of:=IF( ISBLANK([$'03.Muestra'.$C$11]);"";[$'03.Muestra'.$C$11]) ->  | C88: of:=IF( ISBLANK([$'03.Muestra'.$E$11]);"";[$'03.Muestra'.$E$11]) ->  | D88: of:=IF(AND([.B88]<>"";[.C88]<>"");"N/T";"") ->  | E88: of:=IF([.D88]<>"";IF(AND([.B88]<>"";[.C88]<>"");"";"ERR");"") -> 
B89: of:=IF( ISBLANK([$'03.Muestra'.$C$12]);"";[$'03.Muestra'.$C$12]) ->  | C89: of:=IF( ISBLANK([$'03.Muestra'.$E$12]);"";[$'03.Muestra'.$E$12]) ->  | D89: of:=IF(AND([.B89]<>"";[.C89]<>"");"N/T";"") ->  | E89: of:=IF([.D89]<>"";IF(AND([.B89]<>"";[.C89]<>"");"";"ERR");"") -> 
B90: of:=IF( ISBLANK([$'03.Muestra'.$C$13]);"";[$'03.Muestra'.$C$13]) ->  | C90: of:=IF( ISBLANK([$'03.Muestra'.$E$13]);"";[$'03.Muestra'.$E$13]) ->  | D90: of:=IF(AND([.B90]<>"";[.C90]<>"");"N/T";"") ->  | E90: of:=IF([.D90]<>"";IF(AND([.B90]<>"";[.C90]<>"");"";"ERR");"") -> 
B91: of:=IF( ISBLANK([$'03.Muestra'.$C$14]);"";[$'03.Muestra'.$C$14]) ->  | C91: of:=IF( ISBLANK([$'03.Muestra'.$E$14]);"";[$'03.Muestra'.$E$14]) ->  | D91: of:=IF(AND([.B91]<>"";[.C91]<>"");"N/T";"") ->  | E91: of:=IF([.D91]<>"";IF(AND([.B91]<>"";[.C91]<>"");"";"ERR");"") -> 
B92: of:=IF( ISBLANK([$'03.Muestra'.$C$15]);"";[$'03.Muestra'.$C$15]) ->  | C92: of:=IF( ISBLANK([$'03.Muestra'.$E$15]);"";[$'03.Muestra'.$E$15]) ->  | D92: of:=IF(AND([.B92]<>"";[.C92]<>"");"N/T";"") ->  | E92: of:=IF([.D92]<>"";IF(AND([.B92]<>"";[.C92]<>"");"";"ERR");"") -> 
B93: of:=IF( ISBLANK([$'03.Muestra'.$C$16]);"";[$'03.Muestra'.$C$16]) ->  | C93: of:=IF( ISBLANK([$'03.Muestra'.$E$16]);"";[$'03.Muestra'.$E$16]) ->  | D93: of:=IF(AND([.B93]<>"";[.C93]<>"");"N/T";"") ->  | E93: of:=IF([.D93]<>"";IF(AND([.B93]<>"";[.C93]<>"");"";"ERR");"") -> 
B94: of:=IF( ISBLANK([$'03.Muestra'.$C$17]);"";[$'03.Muestra'.$C$17]) ->  | C94: of:=IF( ISBLANK([$'03.Muestra'.$E$17]);"";[$'03.Muestra'.$E$17]) ->  | D94: of:=IF(AND([.B94]<>"";[.C94]<>"");"N/T";"") ->  | E94: of:=IF([.D94]<>"";IF(AND([.B94]<>"";[.C94]<>"");"";"ERR");"") -> 
B95: of:=IF( ISBLANK([$'03.Muestra'.$C$18]);"";[$'03.Muestra'.$C$18]) ->  | C95: of:=IF( ISBLANK([$'03.Muestra'.$E$18]);"";[$'03.Muestra'.$E$18]) ->  | D95: of:=IF(AND([.B95]<>"";[.C95]<>"");"N/T";"") ->  | E95: of:=IF([.D95]<>"";IF(AND([.B95]<>"";[.C95]<>"");"";"ERR");"") -> 
B96: of:=IF( ISBLANK([$'03.Muestra'.$C$19]);"";[$'03.Muestra'.$C$19]) ->  | C96: of:=IF( ISBLANK([$'03.Muestra'.$E$19]);"";[$'03.Muestra'.$E$19]) ->  | D96: of:=IF(AND([.B96]<>"";[.C96]<>"");"N/T";"") ->  | E96: of:=IF([.D96]<>"";IF(AND([.B96]<>"";[.C96]<>"");"";"ERR");"") -> 
B97: of:=IF( ISBLANK([$'03.Muestra'.$C$20]);"";[$'03.Muestra'.$C$20]) ->  | C97: of:=IF( ISBLANK([$'03.Muestra'.$E$20]);"";[$'03.Muestra'.$E$20]) ->  | D97: of:=IF(AND([.B97]<>"";[.C97]<>"");"N/T";"") ->  | E97: of:=IF([.D97]<>"";IF(AND([.B97]<>"";[.C97]<>"");"";"ERR");"") -> 
B98: of:=IF( ISBLANK([$'03.Muestra'.$C$21]);"";[$'03.Muestra'.$C$21]) ->  | C98: of:=IF( ISBLANK([$'03.Muestra'.$E$21]);"";[$'03.Muestra'.$E$21]) ->  | D98: of:=IF(AND([.B98]<>"";[.C98]<>"");"N/T";"") ->  | E98: of:=IF([.D98]<>"";IF(AND([.B98]<>"";[.C98]<>"");"";"ERR");"") -> 
B99: of:=IF( ISBLANK([$'03.Muestra'.$C$22]);"";[$'03.Muestra'.$C$22]) ->  | C99: of:=IF( ISBLANK([$'03.Muestra'.$E$22]);"";[$'03.Muestra'.$E$22]) ->  | D99: of:=IF(AND([.B99]<>"";[.C99]<>"");"N/T";"") ->  | E99: of:=IF([.D99]<>"";IF(AND([.B99]<>"";[.C99]<>"");"";"ERR");"") -> 
B100: of:=IF( ISBLANK([$'03.Muestra'.$C$23]);"";[$'03.Muestra'.$C$23]) ->  | C100: of:=IF( ISBLANK([$'03.Muestra'.$E$23]);"";[$'03.Muestra'.$E$23]) ->  | D100: of:=IF(AND([.B100]<>"";[.C100]<>"");"N/T";"") ->  | E100: of:=IF([.D100]<>"";IF(AND([.B100]<>"";[.C100]<>"");"";"ERR");"") -> 
B101: of:=IF( ISBLANK([$'03.Muestra'.$C$24]);"";[$'03.Muestra'.$C$24]) ->  | C101: of:=IF( ISBLANK([$'03.Muestra'.$E$24]);"";[$'03.Muestra'.$E$24]) ->  | D101: of:=IF(AND([.B101]<>"";[.C101]<>"");"N/T";"") ->  | E101: of:=IF([.D101]<>"";IF(AND([.B101]<>"";[.C101]<>"");"";"ERR");"") -> 
B102: of:=IF( ISBLANK([$'03.Muestra'.$C$25]);"";[$'03.Muestra'.$C$25]) ->  | C102: of:=IF( ISBLANK([$'03.Muestra'.$E$25]);"";[$'03.Muestra'.$E$25]) ->  | D102: of:=IF(AND([.B102]<>"";[.C102]<>"");"N/T";"") ->  | E102: of:=IF([.D102]<>"";IF(AND([.B102]<>"";[.C102]<>"");"";"ERR");"") -> 
B103: of:=IF( ISBLANK([$'03.Muestra'.$C$26]);"";[$'03.Muestra'.$C$26]) ->  | C103: of:=IF( ISBLANK([$'03.Muestra'.$E$26]);"";[$'03.Muestra'.$E$26]) ->  | D103: of:=IF(AND([.B103]<>"";[.C103]<>"");"N/T";"") ->  | E103: of:=IF([.D103]<>"";IF(AND([.B103]<>"";[.C103]<>"");"";"ERR");"") -> 
B104: of:=IF( ISBLANK([$'03.Muestra'.$C$27]);"";[$'03.Muestra'.$C$27]) ->  | C104: of:=IF( ISBLANK([$'03.Muestra'.$E$27]);"";[$'03.Muestra'.$E$27]) ->  | D104: of:=IF(AND([.B104]<>"";[.C104]<>"");"N/T";"") ->  | E104: of:=IF([.D104]<>"";IF(AND([.B104]<>"";[.C104]<>"");"";"ERR");"") -> 
B105: of:=IF( ISBLANK([$'03.Muestra'.$C$28]);"";[$'03.Muestra'.$C$28]) ->  | C105: of:=IF( ISBLANK([$'03.Muestra'.$E$28]);"";[$'03.Muestra'.$E$28]) ->  | D105: of:=IF(AND([.B105]<>"";[.C105]<>"");"N/T";"") ->  | E105: of:=IF([.D105]<>"";IF(AND([.B105]<>"";[.C105]<>"");"";"ERR");"") -> 
B106: of:=IF( ISBLANK([$'03.Muestra'.$C$29]);"";[$'03.Muestra'.$C$29]) ->  | C106: of:=IF( ISBLANK([$'03.Muestra'.$E$29]);"";[$'03.Muestra'.$E$29]) ->  | D106: of:=IF(AND([.B106]<>"";[.C106]<>"");"N/T";"") ->  | E106: of:=IF([.D106]<>"";IF(AND([.B106]<>"";[.C106]<>"");"";"ERR");"") -> 
B107: of:=IF( ISBLANK([$'03.Muestra'.$C$30]);"";[$'03.Muestra'.$C$30]) ->  | C107: of:=IF( ISBLANK([$'03.Muestra'.$E$30]);"";[$'03.Muestra'.$E$30]) ->  | D107: of:=IF(AND([.B107]<>"";[.C107]<>"");"N/T";"") ->  | E107: of:=IF([.D107]<>"";IF(AND([.B107]<>"";[.C107]<>"");"";"ERR");"") -> 
B108: of:=IF( ISBLANK([$'03.Muestra'.$C$31]);"";[$'03.Muestra'.$C$31]) ->  | C108: of:=IF( ISBLANK([$'03.Muestra'.$E$31]);"";[$'03.Muestra'.$E$31]) ->  | D108: of:=IF(AND([.B108]<>"";[.C108]<>"");"N/T";"") ->  | E108: of:=IF([.D108]<>"";IF(AND([.B108]<>"";[.C108]<>"");"";"ERR");"") -> 
B109: of:=IF( ISBLANK([$'03.Muestra'.$C$32]);"";[$'03.Muestra'.$C$32]) ->  | C109: of:=IF( ISBLANK([$'03.Muestra'.$E$32]);"";[$'03.Muestra'.$E$32]) ->  | D109: of:=IF(AND([.B109]<>"";[.C109]<>"");"N/T";"") ->  | E109: of:=IF([.D109]<>"";IF(AND([.B109]<>"";[.C109]<>"");"";"ERR");"") -> 
B110: of:=IF( ISBLANK([$'03.Muestra'.$C$33]);"";[$'03.Muestra'.$C$33]) ->  | C110: of:=IF( ISBLANK([$'03.Muestra'.$E$33]);"";[$'03.Muestra'.$E$33]) ->  | D110: of:=IF(AND([.B110]<>"";[.C110]<>"");"N/T";"") ->  | E110: of:=IF([.D110]<>"";IF(AND([.B110]<>"";[.C110]<>"");"";"ERR");"") -> 
B111: of:=IF( ISBLANK([$'03.Muestra'.$C$34]);"";[$'03.Muestra'.$C$34]) ->  | C111: of:=IF( ISBLANK([$'03.Muestra'.$E$34]);"";[$'03.Muestra'.$E$34]) ->  | D111: of:=IF(AND([.B111]<>"";[.C111]<>"");"N/T";"") ->  | E111: of:=IF([.D111]<>"";IF(AND([.B111]<>"";[.C111]<>"");"";"ERR");"") -> 
B112: of:=IF( ISBLANK([$'03.Muestra'.$C$35]);"";[$'03.Muestra'.$C$35]) ->  | C112: of:=IF( ISBLANK([$'03.Muestra'.$E$35]);"";[$'03.Muestra'.$E$35]) ->  | D112: of:=IF(AND([.B112]<>"";[.C112]<>"");"N/T";"") ->  | E112: of:=IF([.D112]<>"";IF(AND([.B112]<>"";[.C112]<>"");"";"ERR");"") -> 
B113: of:=IF( ISBLANK([$'03.Muestra'.$C$36]);"";[$'03.Muestra'.$C$36]) ->  | C113: of:=IF( ISBLANK([$'03.Muestra'.$E$36]);"";[$'03.Muestra'.$E$36]) ->  | D113: of:=IF(AND([.B113]<>"";[.C113]<>"");"N/T";"") ->  | E113: of:=IF([.D113]<>"";IF(AND([.B113]<>"";[.C113]<>"");"";"ERR");"") -> 
B114: of:=IF( ISBLANK([$'03.Muestra'.$C$37]);"";[$'03.Muestra'.$C$37]) ->  | C114: of:=IF( ISBLANK([$'03.Muestra'.$E$37]);"";[$'03.Muestra'.$E$37]) ->  | D114: of:=IF(AND([.B114]<>"";[.C114]<>"");"N/T";"") ->  | E114: of:=IF([.D114]<>"";IF(AND([.B114]<>"";[.C114]<>"");"";"ERR");"") -> 
B117: A | C117: 2.2.1 Tiempo ajustable | D117: Resultado
B118: of:=IF( ISBLANK([$'03.Muestra'.$C$8]);"";[$'03.Muestra'.$C$8]) ->  | C118: of:=IF( ISBLANK([$'03.Muestra'.$E$8]);"";[$'03.Muestra'.$E$8]) ->  | D118: of:=IF(AND([.B118]<>"";[.C118]<>"");"N/T";"") ->  | E118: of:=IF([.D118]<>"";IF(AND([.B118]<>"";[.C118]<>"");"";"ERR");"") ->  | F118: of:=TRANSPOSE([$'DATA - Oculta'.$U$9:$'DATA - Oculta'.$U$13]) -> N/T | G118: N/D | H118: N/A | I118: Falla | J118: Pasa | K118: En blanco
B119: of:=IF( ISBLANK([$'03.Muestra'.$C$9]);"";[$'03.Muestra'.$C$9]) ->  | C119: of:=IF( ISBLANK([$'03.Muestra'.$E$9]);"";[$'03.Muestra'.$E$9]) ->  | D119: of:=IF(AND([.B119]<>"";[.C119]<>"");"N/T";"") ->  | E119: of:=IF([.D119]<>"";IF(AND([.B119]<>"";[.C119]<>"");"";"ERR");"") ->  | F119: of:=COUNTIF([.$D118]:INDIRECT("$D" &  SUM(ROW()-1;[$'03.Muestra'.$D$40])-1);[.F118]) -> 0 | G119: of:=COUNTIF([.$D118]:INDIRECT("$D" &  SUM(ROW()-1;[$'03.Muestra'.$D$40])-1);[.G118]) -> 0 | H119: of:=COUNTIF([.$D118]:INDIRECT("$D" &  SUM(ROW()-1;[$'03.Muestra'.$D$40])-1);[.H118]) -> 0 | I119: of:=COUNTIF([.$D118]:INDIRECT("$D" &  SUM(ROW()-1;[$'03.Muestra'.$D$40])-1);[.I118]) -> 0 | J119: of:=COUNTIF([.$D118]:INDIRECT("$D" &  SUM(ROW()-1;[$'03.Muestra'.$D$40])-1);[.J118]) -> 0 | K119: of:=IF([$'03.Muestra'.$D$40]=0;0;COUNTBLANK([.$D118]:INDIRECT("$D" &  SUM(ROW()-1;[$'03.Muestra'.$D$40])-1))) -> 0
B120: of:=IF( ISBLANK([$'03.Muestra'.$C$10]);"";[$'03.Muestra'.$C$10]) ->  | C120: of:=IF( ISBLANK([$'03.Muestra'.$E$10]);"";[$'03.Muestra'.$E$10]) ->  | D120: of:=IF(AND([.B120]<>"";[.C120]<>"");"N/T";"") ->  | E120: of:=IF([.D120]<>"";IF(AND([.B120]<>"";[.C120]<>"");"";"ERR");"") -> 
B121: of:=IF( ISBLANK([$'03.Muestra'.$C$11]);"";[$'03.Muestra'.$C$11]) ->  | C121: of:=IF( ISBLANK([$'03.Muestra'.$E$11]);"";[$'03.Muestra'.$E$11]) ->  | D121: of:=IF(AND([.B121]<>"";[.C121]<>"");"N/T";"") ->  | E121: of:=IF([.D121]<>"";IF(AND([.B121]<>"";[.C121]<>"");"";"ERR");"") -> 
B122: of:=IF( ISBLANK([$'03.Muestra'.$C$12]);"";[$'03.Muestra'.$C$12]) ->  | C122: of:=IF( ISBLANK([$'03.Muestra'.$E$12]);"";[$'03.Muestra'.$E$12]) ->  | D122: of:=IF(AND([.B122]<>"";[.C122]<>"");"N/T";"") ->  | E122: of:=IF([.D122]<>"";IF(AND([.B122]<>"";[.C122]<>"");"";"ERR");"") -> 
B123: of:=IF( ISBLANK([$'03.Muestra'.$C$13]);"";[$'03.Muestra'.$C$13]) ->  | C123: of:=IF( ISBLANK([$'03.Muestra'.$E$13]);"";[$'03.Muestra'.$E$13]) ->  | D123: of:=IF(AND([.B123]<>"";[.C123]<>"");"N/T";"") ->  | E123: of:=IF([.D123]<>"";IF(AND([.B123]<>"";[.C123]<>"");"";"ERR");"") -> 
B124: of:=IF( ISBLANK([$'03.Muestra'.$C$14]);"";[$'03.Muestra'.$C$14]) ->  | C124: of:=IF( ISBLANK([$'03.Muestra'.$E$14]);"";[$'03.Muestra'.$E$14]) ->  | D124: of:=IF(AND([.B124]<>"";[.C124]<>"");"N/T";"") ->  | E124: of:=IF([.D124]<>"";IF(AND([.B124]<>"";[.C124]<>"");"";"ERR");"") -> 
B125: of:=IF( ISBLANK([$'03.Muestra'.$C$15]);"";[$'03.Muestra'.$C$15]) ->  | C125: of:=IF( ISBLANK([$'03.Muestra'.$E$15]);"";[$'03.Muestra'.$E$15]) ->  | D125: of:=IF(AND([.B125]<>"";[.C125]<>"");"N/T";"") ->  | E125: of:=IF([.D125]<>"";IF(AND([.B125]<>"";[.C125]<>"");"";"ERR");"") -> 
B126: of:=IF( ISBLANK([$'03.Muestra'.$C$16]);"";[$'03.Muestra'.$C$16]) ->  | C126: of:=IF( ISBLANK([$'03.Muestra'.$E$16]);"";[$'03.Muestra'.$E$16]) ->  | D126: of:=IF(AND([.B126]<>"";[.C126]<>"");"N/T";"") ->  | E126: of:=IF([.D126]<>"";IF(AND([.B126]<>"";[.C126]<>"");"";"ERR");"") -> 
B127: of:=IF( ISBLANK([$'03.Muestra'.$C$17]);"";[$'03.Muestra'.$C$17]) ->  | C127: of:=IF( ISBLANK([$'03.Muestra'.$E$17]);"";[$'03.Muestra'.$E$17]) ->  | D127: of:=IF(AND([.B127]<>"";[.C127]<>"");"N/T";"") ->  | E127: of:=IF([.D127]<>"";IF(AND([.B127]<>"";[.C127]<>"");"";"ERR");"") -> 
B128: of:=IF( ISBLANK([$'03.Muestra'.$C$18]);"";[$'03.Muestra'.$C$18]) ->  | C128: of:=IF( ISBLANK([$'03.Muestra'.$E$18]);"";[$'03.Muestra'.$E$18]) ->  | D128: of:=IF(AND([.B128]<>"";[.C128]<>"");"N/T";"") ->  | E128: of:=IF([.D128]<>"";IF(AND([.B128]<>"";[.C128]<>"");"";"ERR");"") -> 
B129: of:=IF( ISBLANK([$'03.Muestra'.$C$19]);"";[$'03.Muestra'.$C$19]) ->  | C129: of:=IF( ISBLANK([$'03.Muestra'.$E$19]);"";[$'03.Muestra'.$E$19]) ->  | D129: of:=IF(AND([.B129]<>"";[.C129]<>"");"N/T";"") ->  | E129: of:=IF([.D129]<>"";IF(AND([.B129]<>"";[.C129]<>"");"";"ERR");"") -> 
B130: of:=IF( ISBLANK([$'03.Muestra'.$C$20]);"";[$'03.Muestra'.$C$20]) ->  | C130: of:=IF( ISBLANK([$'03.Muestra'.$E$20]);"";[$'03.Muestra'.$E$20]) ->  | D130: of:=IF(AND([.B130]<>"";[.C130]<>"");"N/T";"") ->  | E130: of:=IF([.D130]<>"";IF(AND([.B130]<>"";[.C130]<>"");"";"ERR");"") -> 
B131: of:=IF( ISBLANK([$'03.Muestra'.$C$21]);"";[$'03.Muestra'.$C$21]) ->  | C131: of:=IF( ISBLANK([$'03.Muestra'.$E$21]);"";[$'03.Muestra'.$E$21]) ->  | D131: of:=IF(AND([.B131]<>"";[.C131]<>"");"N/T";"") ->  | E131: of:=IF([.D131]<>"";IF(AND([.B131]<>"";[.C131]<>"");"";"ERR");"") -> 
B132: of:=IF( ISBLANK([$'03.Muestra'.$C$22]);"";[$'03.Muestra'.$C$22]) ->  | C132: of:=IF( ISBLANK([$'03.Muestra'.$E$22]);"";[$'03.Muestra'.$E$22]) ->  | D132: of:=IF(AND([.B132]<>"";[.C132]<>"");"N/T";"") ->  | E132: of:=IF([.D132]<>"";IF(AND([.B132]<>"";[.C132]<>"");"";"ERR");"") -> 
B133: of:=IF( ISBLANK([$'03.Muestra'.$C$23]);"";[$'03.Muestra'.$C$23]) ->  | C133: of:=IF( ISBLANK([$'03.Muestra'.$E$23]);"";[$'03.Muestra'.$E$23]) ->  | D133: of:=IF(AND([.B133]<>"";[.C133]<>"");"N/T";"") ->  | E133: of:=IF([.D133]<>"";IF(AND([.B133]<>"";[.C133]<>"");"";"ERR");"") -> 
B134: of:=IF( ISBLANK([$'03.Muestra'.$C$24]);"";[$'03.Muestra'.$C$24]) ->  | C134: of:=IF( ISBLANK([$'03.Muestra'.$E$24]);"";[$'03.Muestra'.$E$24]) ->  | D134: of:=IF(AND([.B134]<>"";[.C134]<>"");"N/T";"") ->  | E134: of:=IF([.D134]<>"";IF(AND([.B134]<>"";[.C134]<>"");"";"ERR");"") -> 
B135: of:=IF( ISBLANK([$'03.Muestra'.$C$25]);"";[$'03.Muestra'.$C$25]) ->  | C135: of:=IF( ISBLANK([$'03.Muestra'.$E$25]);"";[$'03.Muestra'.$E$25]) ->  | D135: of:=IF(AND([.B135]<>"";[.C135]<>"");"N/T";"") ->  | E135: of:=IF([.D135]<>"";IF(AND([.B135]<>"";[.C135]<>"");"";"ERR");"") -> 
B136: of:=IF( ISBLANK([$'03.Muestra'.$C$26]);"";[$'03.Muestra'.$C$26]) ->  | C136: of:=IF( ISBLANK([$'03.Muestra'.$E$26]);"";[$'03.Muestra'.$E$26]) ->  | D136: of:=IF(AND([.B136]<>"";[.C136]<>"");"N/T";"") ->  | E136: of:=IF([.D136]<>"";IF(AND([.B136]<>"";[.C136]<>"");"";"ERR");"") -> 
B137: of:=IF( ISBLANK([$'03.Muestra'.$C$27]);"";[$'03.Muestra'.$C$27]) ->  | C137: of:=IF( ISBLANK([$'03.Muestra'.$E$27]);"";[$'03.Muestra'.$E$27]) ->  | D137: of:=IF(AND([.B137]<>"";[.C137]<>"");"N/T";"") ->  | E137: of:=IF([.D137]<>"";IF(AND([.B137]<>"";[.C137]<>"");"";"ERR");"") -> 
B138: of:=IF( ISBLANK([$'03.Muestra'.$C$28]);"";[$'03.Muestra'.$C$28]) ->  | C138: of:=IF( ISBLANK([$'03.Muestra'.$E$28]);"";[$'03.Muestra'.$E$28]) ->  | D138: of:=IF(AND([.B138]<>"";[.C138]<>"");"N/T";"") ->  | E138: of:=IF([.D138]<>"";IF(AND([.B138]<>"";[.C138]<>"");"";"ERR");"") -> 
B139: of:=IF( ISBLANK([$'03.Muestra'.$C$29]);"";[$'03.Muestra'.$C$29]) ->  | C139: of:=IF( ISBLANK([$'03.Muestra'.$E$29]);"";[$'03.Muestra'.$E$29]) ->  | D139: of:=IF(AND([.B139]<>"";[.C139]<>"");"N/T";"") ->  | E139: of:=IF([.D139]<>"";IF(AND([.B139]<>"";[.C139]<>"");"";"ERR");"") -> 
B140: of:=IF( ISBLANK([$'03.Muestra'.$C$30]);"";[$'03.Muestra'.$C$30]) ->  | C140: of:=IF( ISBLANK([$'03.Muestra'.$E$30]);"";[$'03.Muestra'.$E$30]) ->  | D140: of:=IF(AND([.B140]<>"";[.C140]<>"");"N/T";"") ->  | E140: of:=IF([.D140]<>"";IF(AND([.B140]<>"";[.C140]<>"");"";"ERR");"") -> 
B141: of:=IF( ISBLANK([$'03.Muestra'.$C$31]);"";[$'03.Muestra'.$C$31]) ->  | C141: of:=IF( ISBLANK([$'03.Muestra'.$E$31]);"";[$'03.Muestra'.$E$31]) ->  | D141: of:=IF(AND([.B141]<>"";[.C141]<>"");"N/T";"") ->  | E141: of:=IF([.D141]<>"";IF(AND([.B141]<>"";[.C141]<>"");"";"ERR");"") -> 
B142: of:=IF( ISBLANK([$'03.Muestra'.$C$32]);"";[$'03.Muestra'.$C$32]) ->  | C142: of:=IF( ISBLANK([$'03.Muestra'.$E$32]);"";[$'03.Muestra'.$E$32]) ->  | D142: of:=IF(AND([.B142]<>"";[.C142]<>"");"N/T";"") ->  | E142: of:=IF([.D142]<>"";IF(AND([.B142]<>"";[.C142]<>"");"";"ERR");"") -> 
B143: of:=IF( ISBLANK([$'03.Muestra'.$C$33]);"";[$'03.Muestra'.$C$33]) ->  | C143: of:=IF( ISBLANK([$'03.Muestra'.$E$33]);"";[$'03.Muestra'.$E$33]) ->  | D143: of:=IF(AND([.B143]<>"";[.C143]<>"");"N/T";"") ->  | E143: of:=IF([.D143]<>"";IF(AND([.B143]<>"";[.C143]<>"");"";"ERR");"") -> 
B144: of:=IF( ISBLANK([$'03.Muestra'.$C$34]);"";[$'03.Muestra'.$C$34]) ->  | C144: of:=IF( ISBLANK([$'03.Muestra'.$E$34]);"";[$'03.Muestra'.$E$34]) ->  | D144: of:=IF(AND([.B144]<>"";[.C144]<>"");"N/T";"") ->  | E144: of:=IF([.D144]<>"";IF(AND([.B144]<>"";[.C144]<>"");"";"ERR");"") -> 
B145: of:=IF( ISBLANK([$'03.Muestra'.$C$35]);"";[$'03.Muestra'.$C$35]) ->  | C145: of:=IF( ISBLANK([$'03.Muestra'.$E$35]);"";[$'03.Muestra'.$E$35]) ->  | D145: of:=IF(AND([.B145]<>"";[.C145]<>"");"N/T";"") ->  | E145: of:=IF([.D145]<>"";IF(AND([.B145]<>"";[.C145]<>"");"";"ERR");"") -> 
B146: of:=IF( ISBLANK([$'03.Muestra'.$C$36]);"";[$'03.Muestra'.$C$36]) ->  | C146: of:=IF( ISBLANK([$'03.Muestra'.$E$36]);"";[$'03.Muestra'.$E$36]) ->  | D146: of:=IF(AND([.B146]<>"";[.C146]<>"");"N/T";"") ->  | E146: of:=IF([.D146]<>"";IF(AND([.B146]<>"";[.C146]<>"");"";"ERR");"") -> 
B147: of:=IF( ISBLANK([$'03.Muestra'.$C$37]);"";[$'03.Muestra'.$C$37]) ->  | C147: of:=IF( ISBLANK([$'03.Muestra'.$E$37]);"";[$'03.Muestra'.$E$37]) ->  | D147: of:=IF(AND([.B147]<>"";[.C147]<>"");"N/T";"") ->  | E147: of:=IF([.D147]<>"";IF(AND([.B147]<>"";[.C147]<>"");"";"ERR");"") -> 
B150: A | C150: 2.2.2 Poner en pausa, detener, ocultar | D150: Resultado
B151: of:=IF( ISBLANK([$'03.Muestra'.$C$8]);"";[$'03.Muestra'.$C$8]) ->  | C151: of:=IF( ISBLANK([$'03.Muestra'.$E$8]);"";[$'03.Muestra'.$E$8]) ->  | D151: of:=IF(AND([.B151]<>"";[.C151]<>"");"N/T";"") ->  | E151: of:=IF([.D151]<>"";IF(AND([.B151]<>"";[.C151]<>"");"";"ERR");"") ->  | F151: of:=TRANSPOSE([$'DATA - Oculta'.$U$9:$'DATA - Oculta'.$U$13]) -> N/T | G151: N/D | H151: N/A | I151: Falla | J151: Pasa | K151: En blanco
B152: of:=IF( ISBLANK([$'03.Muestra'.$C$9]);"";[$'03.Muestra'.$C$9]) ->  | C152: of:=IF( ISBLANK([$'03.Muestra'.$E$9]);"";[$'03.Muestra'.$E$9]) ->  | D152: of:=IF(AND([.B152]<>"";[.C152]<>"");"N/T";"") ->  | E152: of:=IF([.D152]<>"";IF(AND([.B152]<>"";[.C152]<>"");"";"ERR");"") ->  | F152: of:=COUNTIF([.$D151]:INDIRECT("$D" &  SUM(ROW()-1;[$'03.Muestra'.$D$40])-1);[.F151]) -> 0 | G152: of:=COUNTIF([.$D151]:INDIRECT("$D" &  SUM(ROW()-1;[$'03.Muestra'.$D$40])-1);[.G151]) -> 0 | H152: of:=COUNTIF([.$D151]:INDIRECT("$D" &  SUM(ROW()-1;[$'03.Muestra'.$D$40])-1);[.H151]) -> 0 | I152: of:=COUNTIF([.$D151]:INDIRECT("$D" &  SUM(ROW()-1;[$'03.Muestra'.$D$40])-1);[.I151]) -> 0 | J152: of:=COUNTIF([.$D151]:INDIRECT("$D" &  SUM(ROW()-1;[$'03.Muestra'.$D$40])-1);[.J151]) -> 0 | K152: of:=IF([$'03.Muestra'.$D$40]=0;0;COUNTBLANK([.$D151]:INDIRECT("$D" &  SUM(ROW()-1;[$'03.Muestra'.$D$40])-1))) -> 0
B153: of:=IF( ISBLANK([$'03.Muestra'.$C$10]);"";[$'03.Muestra'.$C$10]) ->  | C153: of:=IF( ISBLANK([$'03.Muestra'.$E$10]);"";[$'03.Muestra'.$E$10]) ->  | D153: of:=IF(AND([.B153]<>"";[.C153]<>"");"N/T";"") ->  | E153: of:=IF([.D153]<>"";IF(AND([.B153]<>"";[.C153]<>"");"";"ERR");"") -> 
B154: of:=IF( ISBLANK([$'03.Muestra'.$C$11]);"";[$'03.Muestra'.$C$11]) ->  | C154: of:=IF( ISBLANK([$'03.Muestra'.$E$11]);"";[$'03.Muestra'.$E$11]) ->  | D154: of:=IF(AND([.B154]<>"";[.C154]<>"");"N/T";"") ->  | E154: of:=IF([.D154]<>"";IF(AND([.B154]<>"";[.C154]<>"");"";"ERR");"") -> 
B155: of:=IF( ISBLANK([$'03.Muestra'.$C$12]);"";[$'03.Muestra'.$C$12]) ->  | C155: of:=IF( ISBLANK([$'03.Muestra'.$E$12]);"";[$'03.Muestra'.$E$12]) ->  | D155: of:=IF(AND([.B155]<>"";[.C155]<>"");"N/T";"") ->  | E155: of:=IF([.D155]<>"";IF(AND([.B155]<>"";[.C155]<>"");"";"ERR");"") -> 
B156: of:=IF( ISBLANK([$'03.Muestra'.$C$13]);"";[$'03.Muestra'.$C$13]) ->  | C156: of:=IF( ISBLANK([$'03.Muestra'.$E$13]);"";[$'03.Muestra'.$E$13]) ->  | D156: of:=IF(AND([.B156]<>"";[.C156]<>"");"N/T";"") ->  | E156: of:=IF([.D156]<>"";IF(AND([.B156]<>"";[.C156]<>"");"";"ERR");"") -> 
B157: of:=IF( ISBLANK([$'03.Muestra'.$C$14]);"";[$'03.Muestra'.$C$14]) ->  | C157: of:=IF( ISBLANK([$'03.Muestra'.$E$14]);"";[$'03.Muestra'.$E$14]) ->  | D157: of:=IF(AND([.B157]<>"";[.C157]<>"");"N/T";"") ->  | E157: of:=IF([.D157]<>"";IF(AND([.B157]<>"";[.C157]<>"");"";"ERR");"") -> 
B158: of:=IF( ISBLANK([$'03.Muestra'.$C$15]);"";[$'03.Muestra'.$C$15]) ->  | C158: of:=IF( ISBLANK([$'03.Muestra'.$E$15]);"";[$'03.Muestra'.$E$15]) ->  | D158: of:=IF(AND([.B158]<>"";[.C158]<>"");"N/T";"") ->  | E158: of:=IF([.D158]<>"";IF(AND([.B158]<>"";[.C158]<>"");"";"ERR");"") -> 
B159: of:=IF( ISBLANK([$'03.Muestra'.$C$16]);"";[$'03.Muestra'.$C$16]) ->  | C159: of:=IF( ISBLANK([$'03.Muestra'.$E$16]);"";[$'03.Muestra'.$E$16]) ->  | D159: of:=IF(AND([.B159]<>"";[.C159]<>"");"N/T";"") ->  | E159: of:=IF([.D159]<>"";IF(AND([.B159]<>"";[.C159]<>"");"";"ERR");"") -> 
B160: of:=IF( ISBLANK([$'03.Muestra'.$C$17]);"";[$'03.Muestra'.$C$17]) ->  | C160: of:=IF( ISBLANK([$'03.Muestra'.$E$17]);"";[$'03.Muestra'.$E$17]) ->  | D160: of:=IF(AND([.B160]<>"";[.C160]<>"");"N/T";"") ->  | E160: of:=IF([.D160]<>"";IF(AND([.B160]<>"";[.C160]<>"");"";"ERR");"") -> 
B161: of:=IF( ISBLANK([$'03.Muestra'.$C$18]);"";[$'03.Muestra'.$C$18]) ->  | C161: of:=IF( ISBLANK([$'03.Muestra'.$E$18]);"";[$'03.Muestra'.$E$18]) ->  | D161: of:=IF(AND([.B161]<>"";[.C161]<>"");"N/T";"") ->  | E161: of:=IF([.D161]<>"";IF(AND([.B161]<>"";[.C161]<>"");"";"ERR");"") -> 
B162: of:=IF( ISBLANK([$'03.Muestra'.$C$19]);"";[$'03.Muestra'.$C$19]) ->  | C162: of:=IF( ISBLANK([$'03.Muestra'.$E$19]);"";[$'03.Muestra'.$E$19]) ->  | D162: of:=IF(AND([.B162]<>"";[.C162]<>"");"N/T";"") ->  | E162: of:=IF([.D162]<>"";IF(AND([.B162]<>"";[.C162]<>"");"";"ERR");"") -> 
B163: of:=IF( ISBLANK([$'03.Muestra'.$C$20]);"";[$'03.Muestra'.$C$20]) ->  | C163: of:=IF( ISBLANK([$'03.Muestra'.$E$20]);"";[$'03.Muestra'.$E$20]) ->  | D163: of:=IF(AND([.B163]<>"";[.C163]<>"");"N/T";"") ->  | E163: of:=IF([.D163]<>"";IF(AND([.B163]<>"";[.C163]<>"");"";"ERR");"") -> 
B164: of:=IF( ISBLANK([$'03.Muestra'.$C$21]);"";[$'03.Muestra'.$C$21]) ->  | C164: of:=IF( ISBLANK([$'03.Muestra'.$E$21]);"";[$'03.Muestra'.$E$21]) ->  | D164: of:=IF(AND([.B164]<>"";[.C164]<>"");"N/T";"") ->  | E164: of:=IF([.D164]<>"";IF(AND([.B164]<>"";[.C164]<>"");"";"ERR");"") -> 
B165: of:=IF( ISBLANK([$'03.Muestra'.$C$22]);"";[$'03.Muestra'.$C$22]) ->  | C165: of:=IF( ISBLANK([$'03.Muestra'.$E$22]);"";[$'03.Muestra'.$E$22]) ->  | D165: of:=IF(AND([.B165]<>"";[.C165]<>"");"N/T";"") ->  | E165: of:=IF([.D165]<>"";IF(AND([.B165]<>"";[.C165]<>"");"";"ERR");"") -> 
B166: of:=IF( ISBLANK([$'03.Muestra'.$C$23]);"";[$'03.Muestra'.$C$23]) ->  | C166: of:=IF( ISBLANK([$'03.Muestra'.$E$23]);"";[$'03.Muestra'.$E$23]) ->  | D166: of:=IF(AND([.B166]<>"";[.C166]<>"");"N/T";"") ->  | E166: of:=IF([.D166]<>"";IF(AND([.B166]<>"";[.C166]<>"");"";"ERR");"") -> 
B167: of:=IF( ISBLANK([$'03.Muestra'.$C$24]);"";[$'03.Muestra'.$C$24]) ->  | C167: of:=IF( ISBLANK([$'03.Muestra'.$E$24]);"";[$'03.Muestra'.$E$24]) ->  | D167: of:=IF(AND([.B167]<>"";[.C167]<>"");"N/T";"") ->  | E167: of:=IF([.D167]<>"";IF(AND([.B167]<>"";[.C167]<>"");"";"ERR");"") -> 
B168: of:=IF( ISBLANK([$'03.Muestra'.$C$25]);"";[$'03.Muestra'.$C$25]) ->  | C168: of:=IF( ISBLANK([$'03.Muestra'.$E$25]);"";[$'03.Muestra'.$E$25]) ->  | D168: of:=IF(AND([.B168]<>"";[.C168]<>"");"N/T";"") ->  | E168: of:=IF([.D168]<>"";IF(AND([.B168]<>"";[.C168]<>"");"";"ERR");"") -> 
B169: of:=IF( ISBLANK([$'03.Muestra'.$C$26]);"";[$'03.Muestra'.$C$26]) ->  | C169: of:=IF( ISBLANK([$'03.Muestra'.$E$26]);"";[$'03.Muestra'.$E$26]) ->  | D169: of:=IF(AND([.B169]<>"";[.C169]<>"");"N/T";"") ->  | E169: of:=IF([.D169]<>"";IF(AND([.B169]<>"";[.C169]<>"");"";"ERR");"") -> 
B170: of:=IF( ISBLANK([$'03.Muestra'.$C$27]);"";[$'03.Muestra'.$C$27]) ->  | C170: of:=IF( ISBLANK([$'03.Muestra'.$E$27]);"";[$'03.Muestra'.$E$27]) ->  | D170: of:=IF(AND([.B170]<>"";[.C170]<>"");"N/T";"") ->  | E170: of:=IF([.D170]<>"";IF(AND([.B170]<>"";[.C170]<>"");"";"ERR");"") -> 
B171: of:=IF( ISBLANK([$'03.Muestra'.$C$28]);"";[$'03.Muestra'.$C$28]) ->  | C171: of:=IF( ISBLANK([$'03.Muestra'.$E$28]);"";[$'03.Muestra'.$E$28]) ->  | D171: of:=IF(AND([.B171]<>"";[.C171]<>"");"N/T";"") ->  | E171: of:=IF([.D171]<>"";IF(AND([.B171]<>"";[.C171]<>"");"";"ERR");"") -> 
B172: of:=IF( ISBLANK([$'03.Muestra'.$C$29]);"";[$'03.Muestra'.$C$29]) ->  | C172: of:=IF( ISBLANK([$'03.Muestra'.$E$29]);"";[$'03.Muestra'.$E$29]) ->  | D172: of:=IF(AND([.B172]<>"";[.C172]<>"");"N/T";"") ->  | E172: of:=IF([.D172]<>"";IF(AND([.B172]<>"";[.C172]<>"");"";"ERR");"") -> 
B173: of:=IF( ISBLANK([$'03.Muestra'.$C$30]);"";[$'03.Muestra'.$C$30]) ->  | C173: of:=IF( ISBLANK([$'03.Muestra'.$E$30]);"";[$'03.Muestra'.$E$30]) ->  | D173: of:=IF(AND([.B173]<>"";[.C173]<>"");"N/T";"") ->  | E173: of:=IF([.D173]<>"";IF(AND([.B173]<>"";[.C173]<>"");"";"ERR");"") -> 
B174: of:=IF( ISBLANK([$'03.Muestra'.$C$31]);"";[$'03.Muestra'.$C$31]) ->  | C174: of:=IF( ISBLANK([$'03.Muestra'.$E$31]);"";[$'03.Muestra'.$E$31]) ->  | D174: of:=IF(AND([.B174]<>"";[.C174]<>"");"N/T";"") ->  | E174: of:=IF([.D174]<>"";IF(AND([.B174]<>"";[.C174]<>"");"";"ERR");"") -> 
B175: of:=IF( ISBLANK([$'03.Muestra'.$C$32]);"";[$'03.Muestra'.$C$32]) ->  | C175: of:=IF( ISBLANK([$'03.Muestra'.$E$32]);"";[$'03.Muestra'.$E$32]) ->  | D175: of:=IF(AND([.B175]<>"";[.C175]<>"");"N/T";"") ->  | E175: of:=IF([.D175]<>"";IF(AND([.B175]<>"";[.C175]<>"");"";"ERR");"") -> 
B176: of:=IF( ISBLANK([$'03.Muestra'.$C$33]);"";[$'03.Muestra'.$C$33]) ->  | C176: of:=IF( ISBLANK([$'03.Muestra'.$E$33]);"";[$'03.Muestra'.$E$33]) ->  | D176: of:=IF(AND([.B176]<>"";[.C176]<>"");"N/T";"") ->  | E176: of:=IF([.D176]<>"";IF(AND([.B176]<>"";[.C176]<>"");"";"ERR");"") -> 
B177: of:=IF( ISBLANK([$'03.Muestra'.$C$34]);"";[$'03.Muestra'.$C$34]) ->  | C177: of:=IF( ISBLANK([$'03.Muestra'.$E$34]);"";[$'03.Muestra'.$E$34]) ->  | D177: of:=IF(AND([.B177]<>"";[.C177]<>"");"N/T";"") ->  | E177: of:=IF([.D177]<>"";IF(AND([.B177]<>"";[.C177]<>"");"";"ERR");"") -> 
B178: of:=IF( ISBLANK([$'03.Muestra'.$C$35]);"";[$'03.Muestra'.$C$35]) ->  | C178: of:=IF( ISBLANK([$'03.Muestra'.$E$35]);"";[$'03.Muestra'.$E$35]) ->  | D178: of:=IF(AND([.B178]<>"";[.C178]<>"");"N/T";"") ->  | E178: of:=IF([.D178]<>"";IF(AND([.B178]<>"";[.C178]<>"");"";"ERR");"") -> 
B179: of:=IF( ISBLANK([$'03.Muestra'.$C$36]);"";[$'03.Muestra'.$C$36]) ->  | C179: of:=IF( ISBLANK([$'03.Muestra'.$E$36]);"";[$'03.Muestra'.$E$36]) ->  | D179: of:=IF(AND([.B179]<>"";[.C179]<>"");"N/T";"") ->  | E179: of:=IF([.D179]<>"";IF(AND([.B179]<>"";[.C179]<>"");"";"ERR");"") -> 
B180: of:=IF( ISBLANK([$'03.Muestra'.$C$37]);"";[$'03.Muestra'.$C$37]) ->  | C180: of:=IF( ISBLANK([$'03.Muestra'.$E$37]);"";[$'03.Muestra'.$E$37]) ->  | D180: of:=IF(AND([.B180]<>"";[.C180]<>"");"N/T";"") ->  | E180: of:=IF([.D180]<>"";IF(AND([.B180]<>"";[.C180]<>"");"";"ERR");"") -> 
B183: A | C183: 2.3.1 Umbral de tres destellos o menos | D183: Resultado
B184: of:=IF( ISBLANK([$'03.Muestra'.$C$8]);"";[$'03.Muestra'.$C$8]) ->  | C184: of:=IF( ISBLANK([$'03.Muestra'.$E$8]);"";[$'03.Muestra'.$E$8]) ->  | D184: of:=IF(AND([.B184]<>"";[.C184]<>"");"N/T";"") ->  | E184: of:=IF([.D184]<>"";IF(AND([.B184]<>"";[.C184]<>"");"";"ERR");"") ->  | F184: of:=TRANSPOSE([$'DATA - Oculta'.$U$9:$'DATA - Oculta'.$U$13]) -> N/T | G184: N/D | H184: N/A | I184: Falla | J184: Pasa | K184: En blanco
B185: of:=IF( ISBLANK([$'03.Muestra'.$C$9]);"";[$'03.Muestra'.$C$9]) ->  | C185: of:=IF( ISBLANK([$'03.Muestra'.$E$9]);"";[$'03.Muestra'.$E$9]) ->  | D185: of:=IF(AND([.B185]<>"";[.C185]<>"");"N/T";"") ->  | E185: of:=IF([.D185]<>"";IF(AND([.B185]<>"";[.C185]<>"");"";"ERR");"") ->  | F185: of:=COUNTIF([.$D184]:INDIRECT("$D" &  SUM(ROW()-1;[$'03.Muestra'.$D$40])-1);[.F184]) -> 0 | G185: of:=COUNTIF([.$D184]:INDIRECT("$D" &  SUM(ROW()-1;[$'03.Muestra'.$D$40])-1);[.G184]) -> 0 | H185: of:=COUNTIF([.$D184]:INDIRECT("$D" &  SUM(ROW()-1;[$'03.Muestra'.$D$40])-1);[.H184]) -> 0 | I185: of:=COUNTIF([.$D184]:INDIRECT("$D" &  SUM(ROW()-1;[$'03.Muestra'.$D$40])-1);[.I184]) -> 0 | J185: of:=COUNTIF([.$D184]:INDIRECT("$D" &  SUM(ROW()-1;[$'03.Muestra'.$D$40])-1);[.J184]) -> 0 | K185: of:=IF([$'03.Muestra'.$D$40]=0;0;COUNTBLANK([.$D184]:INDIRECT("$D" &  SUM(ROW()-1;[$'03.Muestra'.$D$40])-1))) -> 0
B186: of:=IF( ISBLANK([$'03.Muestra'.$C$10]);"";[$'03.Muestra'.$C$10]) ->  | C186: of:=IF( ISBLANK([$'03.Muestra'.$E$10]);"";[$'03.Muestra'.$E$10]) ->  | D186: of:=IF(AND([.B186]<>"";[.C186]<>"");"N/T";"") ->  | E186: of:=IF([.D186]<>"";IF(AND([.B186]<>"";[.C186]<>"");"";"ERR");"") -> 
B187: of:=IF( ISBLANK([$'03.Muestra'.$C$11]);"";[$'03.Muestra'.$C$11]) ->  | C187: of:=IF( ISBLANK([$'03.Muestra'.$E$11]);"";[$'03.Muestra'.$E$11]) ->  | D187: of:=IF(AND([.B187]<>"";[.C187]<>"");"N/T";"") ->  | E187: of:=IF([.D187]<>"";IF(AND([.B187]<>"";[.C187]<>"");"";"ERR");"") -> 
B188: of:=IF( ISBLANK([$'03.Muestra'.$C$12]);"";[$'03.Muestra'.$C$12]) ->  | C188: of:=IF( ISBLANK([$'03.Muestra'.$E$12]);"";[$'03.Muestra'.$E$12]) ->  | D188: of:=IF(AND([.B188]<>"";[.C188]<>"");"N/T";"") ->  | E188: of:=IF([.D188]<>"";IF(AND([.B188]<>"";[.C188]<>"");"";"ERR");"") -> 
B189: of:=IF( ISBLANK([$'03.Muestra'.$C$13]);"";[$'03.Muestra'.$C$13]) ->  | C189: of:=IF( ISBLANK([$'03.Muestra'.$E$13]);"";[$'03.Muestra'.$E$13]) ->  | D189: of:=IF(AND([.B189]<>"";[.C189]<>"");"N/T";"") ->  | E189: of:=IF([.D189]<>"";IF(AND([.B189]<>"";[.C189]<>"");"";"ERR");"") -> 
B190: of:=IF( ISBLANK([$'03.Muestra'.$C$14]);"";[$'03.Muestra'.$C$14]) ->  | C190: of:=IF( ISBLANK([$'03.Muestra'.$E$14]);"";[$'03.Muestra'.$E$14]) ->  | D190: of:=IF(AND([.B190]<>"";[.C190]<>"");"N/T";"") ->  | E190: of:=IF([.D190]<>"";IF(AND([.B190]<>"";[.C190]<>"");"";"ERR");"") -> 
B191: of:=IF( ISBLANK([$'03.Muestra'.$C$15]);"";[$'03.Muestra'.$C$15]) ->  | C191: of:=IF( ISBLANK([$'03.Muestra'.$E$15]);"";[$'03.Muestra'.$E$15]) ->  | D191: of:=IF(AND([.B191]<>"";[.C191]<>"");"N/T";"") ->  | E191: of:=IF([.D191]<>"";IF(AND([.B191]<>"";[.C191]<>"");"";"ERR");"") -> 
B192: of:=IF( ISBLANK([$'03.Muestra'.$C$16]);"";[$'03.Muestra'.$C$16]) ->  | C192: of:=IF( ISBLANK([$'03.Muestra'.$E$16]);"";[$'03.Muestra'.$E$16]) ->  | D192: of:=IF(AND([.B192]<>"";[.C192]<>"");"N/T";"") ->  | E192: of:=IF([.D192]<>"";IF(AND([.B192]<>"";[.C192]<>"");"";"ERR");"") -> 
B193: of:=IF( ISBLANK([$'03.Muestra'.$C$17]);"";[$'03.Muestra'.$C$17]) ->  | C193: of:=IF( ISBLANK([$'03.Muestra'.$E$17]);"";[$'03.Muestra'.$E$17]) ->  | D193: of:=IF(AND([.B193]<>"";[.C193]<>"");"N/T";"") ->  | E193: of:=IF([.D193]<>"";IF(AND([.B193]<>"";[.C193]<>"");"";"ERR");"") -> 
B194: of:=IF( ISBLANK([$'03.Muestra'.$C$18]);"";[$'03.Muestra'.$C$18]) ->  | C194: of:=IF( ISBLANK([$'03.Muestra'.$E$18]);"";[$'03.Muestra'.$E$18]) ->  | D194: of:=IF(AND([.B194]<>"";[.C194]<>"");"N/T";"") ->  | E194: of:=IF([.D194]<>"";IF(AND([.B194]<>"";[.C194]<>"");"";"ERR");"") -> 
B195: of:=IF( ISBLANK([$'03.Muestra'.$C$19]);"";[$'03.Muestra'.$C$19]) ->  | C195: of:=IF( ISBLANK([$'03.Muestra'.$E$19]);"";[$'03.Muestra'.$E$19]) ->  | D195: of:=IF(AND([.B195]<>"";[.C195]<>"");"N/T";"") ->  | E195: of:=IF([.D195]<>"";IF(AND([.B195]<>"";[.C195]<>"");"";"ERR");"") -> 
B196: of:=IF( ISBLANK([$'03.Muestra'.$C$20]);"";[$'03.Muestra'.$C$20]) ->  | C196: of:=IF( ISBLANK([$'03.Muestra'.$E$20]);"";[$'03.Muestra'.$E$20]) ->  | D196: of:=IF(AND([.B196]<>"";[.C196]<>"");"N/T";"") ->  | E196: of:=IF([.D196]<>"";IF(AND([.B196]<>"";[.C196]<>"");"";"ERR");"") -> 
B197: of:=IF( ISBLANK([$'03.Muestra'.$C$21]);"";[$'03.Muestra'.$C$21]) ->  | C197: of:=IF( ISBLANK([$'03.Muestra'.$E$21]);"";[$'03.Muestra'.$E$21]) ->  | D197: of:=IF(AND([.B197]<>"";[.C197]<>"");"N/T";"") ->  | E197: of:=IF([.D197]<>"";IF(AND([.B197]<>"";[.C197]<>"");"";"ERR");"") -> 
B198: of:=IF( ISBLANK([$'03.Muestra'.$C$22]);"";[$'03.Muestra'.$C$22]) ->  | C198: of:=IF( ISBLANK([$'03.Muestra'.$E$22]);"";[$'03.Muestra'.$E$22]) ->  | D198: of:=IF(AND([.B198]<>"";[.C198]<>"");"N/T";"") ->  | E198: of:=IF([.D198]<>"";IF(AND([.B198]<>"";[.C198]<>"");"";"ERR");"") -> 
B199: of:=IF( ISBLANK([$'03.Muestra'.$C$23]);"";[$'03.Muestra'.$C$23]) ->  | C199: of:=IF( ISBLANK([$'03.Muestra'.$E$23]);"";[$'03.Muestra'.$E$23]) ->  | D199: of:=IF(AND([.B199]<>"";[.C199]<>"");"N/T";"") ->  | E199: of:=IF([.D199]<>"";IF(AND([.B199]<>"";[.C199]<>"");"";"ERR");"") -> 
B200: of:=IF( ISBLANK([$'03.Muestra'.$C$24]);"";[$'03.Muestra'.$C$24]) ->  | C200: of:=IF( ISBLANK([$'03.Muestra'.$E$24]);"";[$'03.Muestra'.$E$24]) ->  | D200: of:=IF(AND([.B200]<>"";[.C200]<>"");"N/T";"") ->  | E200: of:=IF([.D200]<>"";IF(AND([.B200]<>"";[.C200]<>"");"";"ERR");"") -> 
B201: of:=IF( ISBLANK([$'03.Muestra'.$C$25]);"";[$'03.Muestra'.$C$25]) ->  | C201: of:=IF( ISBLANK([$'03.Muestra'.$E$25]);"";[$'03.Muestra'.$E$25]) ->  | D201: of:=IF(AND([.B201]<>"";[.C201]<>"");"N/T";"") ->  | E201: of:=IF([.D201]<>"";IF(AND([.B201]<>"";[.C201]<>"");"";"ERR");"") -> 
B202: of:=IF( ISBLANK([$'03.Muestra'.$C$26]);"";[$'03.Muestra'.$C$26]) ->  | C202: of:=IF( ISBLANK([$'03.Muestra'.$E$26]);"";[$'03.Muestra'.$E$26]) ->  | D202: of:=IF(AND([.B202]<>"";[.C202]<>"");"N/T";"") ->  | E202: of:=IF([.D202]<>"";IF(AND([.B202]<>"";[.C202]<>"");"";"ERR");"") -> 
B203: of:=IF( ISBLANK([$'03.Muestra'.$C$27]);"";[$'03.Muestra'.$C$27]) ->  | C203: of:=IF( ISBLANK([$'03.Muestra'.$E$27]);"";[$'03.Muestra'.$E$27]) ->  | D203: of:=IF(AND([.B203]<>"";[.C203]<>"");"N/T";"") ->  | E203: of:=IF([.D203]<>"";IF(AND([.B203]<>"";[.C203]<>"");"";"ERR");"") -> 
B204: of:=IF( ISBLANK([$'03.Muestra'.$C$28]);"";[$'03.Muestra'.$C$28]) ->  | C204: of:=IF( ISBLANK([$'03.Muestra'.$E$28]);"";[$'03.Muestra'.$E$28]) ->  | D204: of:=IF(AND([.B204]<>"";[.C204]<>"");"N/T";"") ->  | E204: of:=IF([.D204]<>"";IF(AND([.B204]<>"";[.C204]<>"");"";"ERR");"") -> 
B205: of:=IF( ISBLANK([$'03.Muestra'.$C$29]);"";[$'03.Muestra'.$C$29]) ->  | C205: of:=IF( ISBLANK([$'03.Muestra'.$E$29]);"";[$'03.Muestra'.$E$29]) ->  | D205: of:=IF(AND([.B205]<>"";[.C205]<>"");"N/T";"") ->  | E205: of:=IF([.D205]<>"";IF(AND([.B205]<>"";[.C205]<>"");"";"ERR");"") -> 
B206: of:=IF( ISBLANK([$'03.Muestra'.$C$30]);"";[$'03.Muestra'.$C$30]) ->  | C206: of:=IF( ISBLANK([$'03.Muestra'.$E$30]);"";[$'03.Muestra'.$E$30]) ->  | D206: of:=IF(AND([.B206]<>"";[.C206]<>"");"N/T";"") ->  | E206: of:=IF([.D206]<>"";IF(AND([.B206]<>"";[.C206]<>"");"";"ERR");"") -> 
B207: of:=IF( ISBLANK([$'03.Muestra'.$C$31]);"";[$'03.Muestra'.$C$31]) ->  | C207: of:=IF( ISBLANK([$'03.Muestra'.$E$31]);"";[$'03.Muestra'.$E$31]) ->  | D207: of:=IF(AND([.B207]<>"";[.C207]<>"");"N/T";"") ->  | E207: of:=IF([.D207]<>"";IF(AND([.B207]<>"";[.C207]<>"");"";"ERR");"") -> 
B208: of:=IF( ISBLANK([$'03.Muestra'.$C$32]);"";[$'03.Muestra'.$C$32]) ->  | C208: of:=IF( ISBLANK([$'03.Muestra'.$E$32]);"";[$'03.Muestra'.$E$32]) ->  | D208: of:=IF(AND([.B208]<>"";[.C208]<>"");"N/T";"") ->  | E208: of:=IF([.D208]<>"";IF(AND([.B208]<>"";[.C208]<>"");"";"ERR");"") -> 
B209: of:=IF( ISBLANK([$'03.Muestra'.$C$33]);"";[$'03.Muestra'.$C$33]) ->  | C209: of:=IF( ISBLANK([$'03.Muestra'.$E$33]);"";[$'03.Muestra'.$E$33]) ->  | D209: of:=IF(AND([.B209]<>"";[.C209]<>"");"N/T";"") ->  | E209: of:=IF([.D209]<>"";IF(AND([.B209]<>"";[.C209]<>"");"";"ERR");"") -> 
B210: of:=IF( ISBLANK([$'03.Muestra'.$C$34]);"";[$'03.Muestra'.$C$34]) ->  | C210: of:=IF( ISBLANK([$'03.Muestra'.$E$34]);"";[$'03.Muestra'.$E$34]) ->  | D210: of:=IF(AND([.B210]<>"";[.C210]<>"");"N/T";"") ->  | E210: of:=IF([.D210]<>"";IF(AND([.B210]<>"";[.C210]<>"");"";"ERR");"") -> 
B211: of:=IF( ISBLANK([$'03.Muestra'.$C$35]);"";[$'03.Muestra'.$C$35]) ->  | C211: of:=IF( ISBLANK([$'03.Muestra'.$E$35]);"";[$'03.Muestra'.$E$35]) ->  | D211: of:=IF(AND([.B211]<>"";[.C211]<>"");"N/T";"") ->  | E211: of:=IF([.D211]<>"";IF(AND([.B211]<>"";[.C211]<>"");"";"ERR");"") -> 
B212: of:=IF( ISBLANK([$'03.Muestra'.$C$36]);"";[$'03.Muestra'.$C$36]) ->  | C212: of:=IF( ISBLANK([$'03.Muestra'.$E$36]);"";[$'03.Muestra'.$E$36]) ->  | D212: of:=IF(AND([.B212]<>"";[.C212]<>"");"N/T";"") ->  | E212: of:=IF([.D212]<>"";IF(AND([.B212]<>"";[.C212]<>"");"";"ERR");"") -> 
B213: of:=IF( ISBLANK([$'03.Muestra'.$C$37]);"";[$'03.Muestra'.$C$37]) ->  | C213: of:=IF( ISBLANK([$'03.Muestra'.$E$37]);"";[$'03.Muestra'.$E$37]) ->  | D213: of:=IF(AND([.B213]<>"";[.C213]<>"");"N/T";"") ->  | E213: of:=IF([.D213]<>"";IF(AND([.B213]<>"";[.C213]<>"");"";"ERR");"") -> 
B216: A | C216: 2.4.1 Evitar bloques | D216: Resultado
B217: of:=IF( ISBLANK([$'03.Muestra'.$C$8]);"";[$'03.Muestra'.$C$8]) ->  | C217: of:=IF( ISBLANK([$'03.Muestra'.$E$8]);"";[$'03.Muestra'.$E$8]) ->  | D217: of:=IF(AND([.B217]<>"";[.C217]<>"");"N/T";"") ->  | E217: of:=IF([.D217]<>"";IF(AND([.B217]<>"";[.C217]<>"");"";"ERR");"") ->  | F217: of:=TRANSPOSE([$'DATA - Oculta'.$U$9:$'DATA - Oculta'.$U$13]) -> N/T | G217: N/D | H217: N/A | I217: Falla | J217: Pasa | K217: En blanco
B218: of:=IF( ISBLANK([$'03.Muestra'.$C$9]);"";[$'03.Muestra'.$C$9]) ->  | C218: of:=IF( ISBLANK([$'03.Muestra'.$E$9]);"";[$'03.Muestra'.$E$9]) ->  | D218: of:=IF(AND([.B218]<>"";[.C218]<>"");"N/T";"") ->  | E218: of:=IF([.D218]<>"";IF(AND([.B218]<>"";[.C218]<>"");"";"ERR");"") ->  | F218: of:=COUNTIF([.$D217]:INDIRECT("$D" &  SUM(ROW()-1;[$'03.Muestra'.$D$40])-1);[.F217]) -> 0 | G218: of:=COUNTIF([.$D217]:INDIRECT("$D" &  SUM(ROW()-1;[$'03.Muestra'.$D$40])-1);[.G217]) -> 0 | H218: of:=COUNTIF([.$D217]:INDIRECT("$D" &  SUM(ROW()-1;[$'03.Muestra'.$D$40])-1);[.H217]) -> 0 | I218: of:=COUNTIF([.$D217]:INDIRECT("$D" &  SUM(ROW()-1;[$'03.Muestra'.$D$40])-1);[.I217]) -> 0 | J218: of:=COUNTIF([.$D217]:INDIRECT("$D" &  SUM(ROW()-1;[$'03.Muestra'.$D$40])-1);[.J217]) -> 0 | K218: of:=IF([$'03.Muestra'.$D$40]=0;0;COUNTBLANK([.$D217]:INDIRECT("$D" &  SUM(ROW()-1;[$'03.Muestra'.$D$40])-1))) -> 0
B219: of:=IF( ISBLANK([$'03.Muestra'.$C$10]);"";[$'03.Muestra'.$C$10]) ->  | C219: of:=IF( ISBLANK([$'03.Muestra'.$E$10]);"";[$'03.Muestra'.$E$10]) ->  | D219: of:=IF(AND([.B219]<>"";[.C219]<>"");"N/T";"") ->  | E219: of:=IF([.D219]<>"";IF(AND([.B219]<>"";[.C219]<>"");"";"ERR");"") -> 
B220: of:=IF( ISBLANK([$'03.Muestra'.$C$11]);"";[$'03.Muestra'.$C$11]) ->  | C220: of:=IF( ISBLANK([$'03.Muestra'.$E$11]);"";[$'03.Muestra'.$E$11]) ->  | D220: of:=IF(AND([.B220]<>"";[.C220]<>"");"N/T";"") ->  | E220: of:=IF([.D220]<>"";IF(AND([.B220]<>"";[.C220]<>"");"";"ERR");"") -> 
B221: of:=IF( ISBLANK([$'03.Muestra'.$C$12]);"";[$'03.Muestra'.$C$12]) ->  | C221: of:=IF( ISBLANK([$'03.Muestra'.$E$12]);"";[$'03.Muestra'.$E$12]) ->  | D221: of:=IF(AND([.B221]<>"";[.C221]<>"");"N/T";"") ->  | E221: of:=IF([.D221]<>"";IF(AND([.B221]<>"";[.C221]<>"");"";"ERR");"") -> 
B222: of:=IF( ISBLANK([$'03.Muestra'.$C$13]);"";[$'03.Muestra'.$C$13]) ->  | C222: of:=IF( ISBLANK([$'03.Muestra'.$E$13]);"";[$'03.Muestra'.$E$13]) ->  | D222: of:=IF(AND([.B222]<>"";[.C222]<>"");"N/T";"") ->  | E222: of:=IF([.D222]<>"";IF(AND([.B222]<>"";[.C222]<>"");"";"ERR");"") -> 
B223: of:=IF( ISBLANK([$'03.Muestra'.$C$14]);"";[$'03.Muestra'.$C$14]) ->  | C223: of:=IF( ISBLANK([$'03.Muestra'.$E$14]);"";[$'03.Muestra'.$E$14]) ->  | D223: of:=IF(AND([.B223]<>"";[.C223]<>"");"N/T";"") ->  | E223: of:=IF([.D223]<>"";IF(AND([.B223]<>"";[.C223]<>"");"";"ERR");"") -> 
B224: of:=IF( ISBLANK([$'03.Muestra'.$C$15]);"";[$'03.Muestra'.$C$15]) ->  | C224: of:=IF( ISBLANK([$'03.Muestra'.$E$15]);"";[$'03.Muestra'.$E$15]) ->  | D224: of:=IF(AND([.B224]<>"";[.C224]<>"");"N/T";"") ->  | E224: of:=IF([.D224]<>"";IF(AND([.B224]<>"";[.C224]<>"");"";"ERR");"") -> 
B225: of:=IF( ISBLANK([$'03.Muestra'.$C$16]);"";[$'03.Muestra'.$C$16]) ->  | C225: of:=IF( ISBLANK([$'03.Muestra'.$E$16]);"";[$'03.Muestra'.$E$16]) ->  | D225: of:=IF(AND([.B225]<>"";[.C225]<>"");"N/T";"") ->  | E225: of:=IF([.D225]<>"";IF(AND([.B225]<>"";[.C225]<>"");"";"ERR");"") -> 
B226: of:=IF( ISBLANK([$'03.Muestra'.$C$17]);"";[$'03.Muestra'.$C$17]) ->  | C226: of:=IF( ISBLANK([$'03.Muestra'.$E$17]);"";[$'03.Muestra'.$E$17]) ->  | D226: of:=IF(AND([.B226]<>"";[.C226]<>"");"N/T";"") ->  | E226: of:=IF([.D226]<>"";IF(AND([.B226]<>"";[.C226]<>"");"";"ERR");"") -> 
B227: of:=IF( ISBLANK([$'03.Muestra'.$C$18]);"";[$'03.Muestra'.$C$18]) ->  | C227: of:=IF( ISBLANK([$'03.Muestra'.$E$18]);"";[$'03.Muestra'.$E$18]) ->  | D227: of:=IF(AND([.B227]<>"";[.C227]<>"");"N/T";"") ->  | E227: of:=IF([.D227]<>"";IF(AND([.B227]<>"";[.C227]<>"");"";"ERR");"") -> 
B228: of:=IF( ISBLANK([$'03.Muestra'.$C$19]);"";[$'03.Muestra'.$C$19]) ->  | C228: of:=IF( ISBLANK([$'03.Muestra'.$E$19]);"";[$'03.Muestra'.$E$19]) ->  | D228: of:=IF(AND([.B228]<>"";[.C228]<>"");"N/T";"") ->  | E228: of:=IF([.D228]<>"";IF(AND([.B228]<>"";[.C228]<>"");"";"ERR");"") -> 
B229: of:=IF( ISBLANK([$'03.Muestra'.$C$20]);"";[$'03.Muestra'.$C$20]) ->  | C229: of:=IF( ISBLANK([$'03.Muestra'.$E$20]);"";[$'03.Muestra'.$E$20]) ->  | D229: of:=IF(AND([.B229]<>"";[.C229]<>"");"N/T";"") ->  | E229: of:=IF([.D229]<>"";IF(AND([.B229]<>"";[.C229]<>"");"";"ERR");"") -> 
B230: of:=IF( ISBLANK([$'03.Muestra'.$C$21]);"";[$'03.Muestra'.$C$21]) ->  | C230: of:=IF( ISBLANK([$'03.Muestra'.$E$21]);"";[$'03.Muestra'.$E$21]) ->  | D230: of:=IF(AND([.B230]<>"";[.C230]<>"");"N/T";"") ->  | E230: of:=IF([.D230]<>"";IF(AND([.B230]<>"";[.C230]<>"");"";"ERR");"") -> 
B231: of:=IF( ISBLANK([$'03.Muestra'.$C$22]);"";[$'03.Muestra'.$C$22]) ->  | C231: of:=IF( ISBLANK([$'03.Muestra'.$E$22]);"";[$'03.Muestra'.$E$22]) ->  | D231: of:=IF(AND([.B231]<>"";[.C231]<>"");"N/T";"") ->  | E231: of:=IF([.D231]<>"";IF(AND([.B231]<>"";[.C231]<>"");"";"ERR");"") -> 
B232: of:=IF( ISBLANK([$'03.Muestra'.$C$23]);"";[$'03.Muestra'.$C$23]) ->  | C232: of:=IF( ISBLANK([$'03.Muestra'.$E$23]);"";[$'03.Muestra'.$E$23]) ->  | D232: of:=IF(AND([.B232]<>"";[.C232]<>"");"N/T";"") ->  | E232: of:=IF([.D232]<>"";IF(AND([.B232]<>"";[.C232]<>"");"";"ERR");"") -> 
B233: of:=IF( ISBLANK([$'03.Muestra'.$C$24]);"";[$'03.Muestra'.$C$24]) ->  | C233: of:=IF( ISBLANK([$'03.Muestra'.$E$24]);"";[$'03.Muestra'.$E$24]) ->  | D233: of:=IF(AND([.B233]<>"";[.C233]<>"");"N/T";"") ->  | E233: of:=IF([.D233]<>"";IF(AND([.B233]<>"";[.C233]<>"");"";"ERR");"") -> 
B234: of:=IF( ISBLANK([$'03.Muestra'.$C$25]);"";[$'03.Muestra'.$C$25]) ->  | C234: of:=IF( ISBLANK([$'03.Muestra'.$E$25]);"";[$'03.Muestra'.$E$25]) ->  | D234: of:=IF(AND([.B234]<>"";[.C234]<>"");"N/T";"") ->  | E234: of:=IF([.D234]<>"";IF(AND([.B234]<>"";[.C234]<>"");"";"ERR");"") -> 
B235: of:=IF( ISBLANK([$'03.Muestra'.$C$26]);"";[$'03.Muestra'.$C$26]) ->  | C235: of:=IF( ISBLANK([$'03.Muestra'.$E$26]);"";[$'03.Muestra'.$E$26]) ->  | D235: of:=IF(AND([.B235]<>"";[.C235]<>"");"N/T";"") ->  | E235: of:=IF([.D235]<>"";IF(AND([.B235]<>"";[.C235]<>"");"";"ERR");"") -> 
B236: of:=IF( ISBLANK([$'03.Muestra'.$C$27]);"";[$'03.Muestra'.$C$27]) ->  | C236: of:=IF( ISBLANK([$'03.Muestra'.$E$27]);"";[$'03.Muestra'.$E$27]) ->  | D236: of:=IF(AND([.B236]<>"";[.C236]<>"");"N/T";"") ->  | E236: of:=IF([.D236]<>"";IF(AND([.B236]<>"";[.C236]<>"");"";"ERR");"") -> 
B237: of:=IF( ISBLANK([$'03.Muestra'.$C$28]);"";[$'03.Muestra'.$C$28]) ->  | C237: of:=IF( ISBLANK([$'03.Muestra'.$E$28]);"";[$'03.Muestra'.$E$28]) ->  | D237: of:=IF(AND([.B237]<>"";[.C237]<>"");"N/T";"") ->  | E237: of:=IF([.D237]<>"";IF(AND([.B237]<>"";[.C237]<>"");"";"ERR");"") -> 
B238: of:=IF( ISBLANK([$'03.Muestra'.$C$29]);"";[$'03.Muestra'.$C$29]) ->  | C238: of:=IF( ISBLANK([$'03.Muestra'.$E$29]);"";[$'03.Muestra'.$E$29]) ->  | D238: of:=IF(AND([.B238]<>"";[.C238]<>"");"N/T";"") ->  | E238: of:=IF([.D238]<>"";IF(AND([.B238]<>"";[.C238]<>"");"";"ERR");"") -> 
B239: of:=IF( ISBLANK([$'03.Muestra'.$C$30]);"";[$'03.Muestra'.$C$30]) ->  | C239: of:=IF( ISBLANK([$'03.Muestra'.$E$30]);"";[$'03.Muestra'.$E$30]) ->  | D239: of:=IF(AND([.B239]<>"";[.C239]<>"");"N/T";"") ->  | E239: of:=IF([.D239]<>"";IF(AND([.B239]<>"";[.C239]<>"");"";"ERR");"") -> 
B240: of:=IF( ISBLANK([$'03.Muestra'.$C$31]);"";[$'03.Muestra'.$C$31]) ->  | C240: of:=IF( ISBLANK([$'03.Muestra'.$E$31]);"";[$'03.Muestra'.$E$31]) ->  | D240: of:=IF(AND([.B240]<>"";[.C240]<>"");"N/T";"") ->  | E240: of:=IF([.D240]<>"";IF(AND([.B240]<>"";[.C240]<>"");"";"ERR");"") -> 
B241: of:=IF( ISBLANK([$'03.Muestra'.$C$32]);"";[$'03.Muestra'.$C$32]) ->  | C241: of:=IF( ISBLANK([$'03.Muestra'.$E$32]);"";[$'03.Muestra'.$E$32]) ->  | D241: of:=IF(AND([.B241]<>"";[.C241]<>"");"N/T";"") ->  | E241: of:=IF([.D241]<>"";IF(AND([.B241]<>"";[.C241]<>"");"";"ERR");"") -> 
B242: of:=IF( ISBLANK([$'03.Muestra'.$C$33]);"";[$'03.Muestra'.$C$33]) ->  | C242: of:=IF( ISBLANK([$'03.Muestra'.$E$33]);"";[$'03.Muestra'.$E$33]) ->  | D242: of:=IF(AND([.B242]<>"";[.C242]<>"");"N/T";"") ->  | E242: of:=IF([.D242]<>"";IF(AND([.B242]<>"";[.C242]<>"");"";"ERR");"") -> 
B243: of:=IF( ISBLANK([$'03.Muestra'.$C$34]);"";[$'03.Muestra'.$C$34]) ->  | C243: of:=IF( ISBLANK([$'03.Muestra'.$E$34]);"";[$'03.Muestra'.$E$34]) ->  | D243: of:=IF(AND([.B243]<>"";[.C243]<>"");"N/T";"") ->  | E243: of:=IF([.D243]<>"";IF(AND([.B243]<>"";[.C243]<>"");"";"ERR");"") -> 
B244: of:=IF( ISBLANK([$'03.Muestra'.$C$35]);"";[$'03.Muestra'.$C$35]) ->  | C244: of:=IF( ISBLANK([$'03.Muestra'.$E$35]);"";[$'03.Muestra'.$E$35]) ->  | D244: of:=IF(AND([.B244]<>"";[.C244]<>"");"N/T";"") ->  | E244: of:=IF([.D244]<>"";IF(AND([.B244]<>"";[.C244]<>"");"";"ERR");"") -> 
B245: of:=IF( ISBLANK([$'03.Muestra'.$C$36]);"";[$'03.Muestra'.$C$36]) ->  | C245: of:=IF( ISBLANK([$'03.Muestra'.$E$36]);"";[$'03.Muestra'.$E$36]) ->  | D245: of:=IF(AND([.B245]<>"";[.C245]<>"");"N/T";"") ->  | E245: of:=IF([.D245]<>"";IF(AND([.B245]<>"";[.C245]<>"");"";"ERR");"") -> 
B246: of:=IF( ISBLANK([$'03.Muestra'.$C$37]);"";[$'03.Muestra'.$C$37]) ->  | C246: of:=IF( ISBLANK([$'03.Muestra'.$E$37]);"";[$'03.Muestra'.$E$37]) ->  | D246: of:=IF(AND([.B246]<>"";[.C246]<>"");"N/T";"") ->  | E246: of:=IF([.D246]<>"";IF(AND([.B246]<>"";[.C246]<>"");"";"ERR");"") -> 
B249: A | C249: 2.4.2 Titulado de pÃ¡ginas | D249: Resultado
B250: of:=IF( ISBLANK([$'03.Muestra'.$C$8]);"";[$'03.Muestra'.$C$8]) ->  | C250: of:=IF( ISBLANK([$'03.Muestra'.$E$8]);"";[$'03.Muestra'.$E$8]) ->  | D250: of:=IF(AND([.B250]<>"";[.C250]<>"");"N/T";"") ->  | E250: of:=IF([.D250]<>"";IF(AND([.B250]<>"";[.C250]<>"");"";"ERR");"") ->  | F250: of:=TRANSPOSE([$'DATA - Oculta'.$U$9:$'DATA - Oculta'.$U$13]) -> N/T | G250: N/D | H250: N/A | I250: Falla | J250: Pasa | K250: En blanco
B251: of:=IF( ISBLANK([$'03.Muestra'.$C$9]);"";[$'03.Muestra'.$C$9]) ->  | C251: of:=IF( ISBLANK([$'03.Muestra'.$E$9]);"";[$'03.Muestra'.$E$9]) ->  | D251: of:=IF(AND([.B251]<>"";[.C251]<>"");"N/T";"") ->  | E251: of:=IF([.D251]<>"";IF(AND([.B251]<>"";[.C251]<>"");"";"ERR");"") ->  | F251: of:=COUNTIF([.$D250]:INDIRECT("$D" &  SUM(ROW()-1;[$'03.Muestra'.$D$40])-1);[.F250]) -> 0 | G251: of:=COUNTIF([.$D250]:INDIRECT("$D" &  SUM(ROW()-1;[$'03.Muestra'.$D$40])-1);[.G250]) -> 0 | H251: of:=COUNTIF([.$D250]:INDIRECT("$D" &  SUM(ROW()-1;[$'03.Muestra'.$D$40])-1);[.H250]) -> 0 | I251: of:=COUNTIF([.$D250]:INDIRECT("$D" &  SUM(ROW()-1;[$'03.Muestra'.$D$40])-1);[.I250]) -> 0 | J251: of:=COUNTIF([.$D250]:INDIRECT("$D" &  SUM(ROW()-1;[$'03.Muestra'.$D$40])-1);[.J250]) -> 0 | K251: of:=IF([$'03.Muestra'.$D$40]=0;0;COUNTBLANK([.$D250]:INDIRECT("$D" &  SUM(ROW()-1;[$'03.Muestra'.$D$40])-1))) -> 0
B252: of:=IF( ISBLANK([$'03.Muestra'.$C$10]);"";[$'03.Muestra'.$C$10]) ->  | C252: of:=IF( ISBLANK([$'03.Muestra'.$E$10]);"";[$'03.Muestra'.$E$10]) ->  | D252: of:=IF(AND([.B252]<>"";[.C252]<>"");"N/T";"") ->  | E252: of:=IF([.D252]<>"";IF(AND([.B252]<>"";[.C252]<>"");"";"ERR");"") -> 
B253: of:=IF( ISBLANK([$'03.Muestra'.$C$11]);"";[$'03.Muestra'.$C$11]) ->  | C253: of:=IF( ISBLANK([$'03.Muestra'.$E$11]);"";[$'03.Muestra'.$E$11]) ->  | D253: of:=IF(AND([.B253]<>"";[.C253]<>"");"N/T";"") ->  | E253: of:=IF([.D253]<>"";IF(AND([.B253]<>"";[.C253]<>"");"";"ERR");"") -> 
B254: of:=IF( ISBLANK([$'03.Muestra'.$C$12]);"";[$'03.Muestra'.$C$12]) ->  | C254: of:=IF( ISBLANK([$'03.Muestra'.$E$12]);"";[$'03.Muestra'.$E$12]) ->  | D254: of:=IF(AND([.B254]<>"";[.C254]<>"");"N/T";"") ->  | E254: of:=IF([.D254]<>"";IF(AND([.B254]<>"";[.C254]<>"");"";"ERR");"") -> 
B255: of:=IF( ISBLANK([$'03.Muestra'.$C$13]);"";[$'03.Muestra'.$C$13]) ->  | C255: of:=IF( ISBLANK([$'03.Muestra'.$E$13]);"";[$'03.Muestra'.$E$13]) ->  | D255: of:=IF(AND([.B255]<>"";[.C255]<>"");"N/T";"") ->  | E255: of:=IF([.D255]<>"";IF(AND([.B255]<>"";[.C255]<>"");"";"ERR");"") -> 
B256: of:=IF( ISBLANK([$'03.Muestra'.$C$14]);"";[$'03.Muestra'.$C$14]) ->  | C256: of:=IF( ISBLANK([$'03.Muestra'.$E$14]);"";[$'03.Muestra'.$E$14]) ->  | D256: of:=IF(AND([.B256]<>"";[.C256]<>"");"N/T";"") ->  | E256: of:=IF([.D256]<>"";IF(AND([.B256]<>"";[.C256]<>"");"";"ERR");"") -> 
B257: of:=IF( ISBLANK([$'03.Muestra'.$C$15]);"";[$'03.Muestra'.$C$15]) ->  | C257: of:=IF( ISBLANK([$'03.Muestra'.$E$15]);"";[$'03.Muestra'.$E$15]) ->  | D257: of:=IF(AND([.B257]<>"";[.C257]<>"");"N/T";"") ->  | E257: of:=IF([.D257]<>"";IF(AND([.B257]<>"";[.C257]<>"");"";"ERR");"") -> 
B258: of:=IF( ISBLANK([$'03.Muestra'.$C$16]);"";[$'03.Muestra'.$C$16]) ->  | C258: of:=IF( ISBLANK([$'03.Muestra'.$E$16]);"";[$'03.Muestra'.$E$16]) ->  | D258: of:=IF(AND([.B258]<>"";[.C258]<>"");"N/T";"") ->  | E258: of:=IF([.D258]<>"";IF(AND([.B258]<>"";[.C258]<>"");"";"ERR");"") -> 
B259: of:=IF( ISBLANK([$'03.Muestra'.$C$17]);"";[$'03.Muestra'.$C$17]) ->  | C259: of:=IF( ISBLANK([$'03.Muestra'.$E$17]);"";[$'03.Muestra'.$E$17]) ->  | D259: of:=IF(AND([.B259]<>"";[.C259]<>"");"N/T";"") ->  | E259: of:=IF([.D259]<>"";IF(AND([.B259]<>"";[.C259]<>"");"";"ERR");"") -> 
B260: of:=IF( ISBLANK([$'03.Muestra'.$C$18]);"";[$'03.Muestra'.$C$18]) ->  | C260: of:=IF( ISBLANK([$'03.Muestra'.$E$18]);"";[$'03.Muestra'.$E$18]) ->  | D260: of:=IF(AND([.B260]<>"";[.C260]<>"");"N/T";"") ->  | E260: of:=IF([.D260]<>"";IF(AND([.B260]<>"";[.C260]<>"");"";"ERR");"") -> 
B261: of:=IF( ISBLANK([$'03.Muestra'.$C$19]);"";[$'03.Muestra'.$C$19]) ->  | C261: of:=IF( ISBLANK([$'03.Muestra'.$E$19]);"";[$'03.Muestra'.$E$19]) ->  | D261: of:=IF(AND([.B261]<>"";[.C261]<>"");"N/T";"") ->  | E261: of:=IF([.D261]<>"";IF(AND([.B261]<>"";[.C261]<>"");"";"ERR");"") -> 
B262: of:=IF( ISBLANK([$'03.Muestra'.$C$20]);"";[$'03.Muestra'.$C$20]) ->  | C262: of:=IF( ISBLANK([$'03.Muestra'.$E$20]);"";[$'03.Muestra'.$E$20]) ->  | D262: of:=IF(AND([.B262]<>"";[.C262]<>"");"N/T";"") ->  | E262: of:=IF([.D262]<>"";IF(AND([.B262]<>"";[.C262]<>"");"";"ERR");"") -> 
B263: of:=IF( ISBLANK([$'03.Muestra'.$C$21]);"";[$'03.Muestra'.$C$21]) ->  | C263: of:=IF( ISBLANK([$'03.Muestra'.$E$21]);"";[$'03.Muestra'.$E$21]) ->  | D263: of:=IF(AND([.B263]<>"";[.C263]<>"");"N/T";"") ->  | E263: of:=IF([.D263]<>"";IF(AND([.B263]<>"";[.C263]<>"");"";"ERR");"") -> 
B264: of:=IF( ISBLANK([$'03.Muestra'.$C$22]);"";[$'03.Muestra'.$C$22]) ->  | C264: of:=IF( ISBLANK([$'03.Muestra'.$E$22]);"";[$'03.Muestra'.$E$22]) ->  | D264: of:=IF(AND([.B264]<>"";[.C264]<>"");"N/T";"") ->  | E264: of:=IF([.D264]<>"";IF(AND([.B264]<>"";[.C264]<>"");"";"ERR");"") -> 
B265: of:=IF( ISBLANK([$'03.Muestra'.$C$23]);"";[$'03.Muestra'.$C$23]) ->  | C265: of:=IF( ISBLANK([$'03.Muestra'.$E$23]);"";[$'03.Muestra'.$E$23]) ->  | D265: of:=IF(AND([.B265]<>"";[.C265]<>"");"N/T";"") ->  | E265: of:=IF([.D265]<>"";IF(AND([.B265]<>"";[.C265]<>"");"";"ERR");"") -> 
B266: of:=IF( ISBLANK([$'03.Muestra'.$C$24]);"";[$'03.Muestra'.$C$24]) ->  | C266: of:=IF( ISBLANK([$'03.Muestra'.$E$24]);"";[$'03.Muestra'.$E$24]) ->  | D266: of:=IF(AND([.B266]<>"";[.C266]<>"");"N/T";"") ->  | E266: of:=IF([.D266]<>"";IF(AND([.B266]<>"";[.C266]<>"");"";"ERR");"") -> 
B267: of:=IF( ISBLANK([$'03.Muestra'.$C$25]);"";[$'03.Muestra'.$C$25]) ->  | C267: of:=IF( ISBLANK([$'03.Muestra'.$E$25]);"";[$'03.Muestra'.$E$25]) ->  | D267: of:=IF(AND([.B267]<>"";[.C267]<>"");"N/T";"") ->  | E267: of:=IF([.D267]<>"";IF(AND([.B267]<>"";[.C267]<>"");"";"ERR");"") -> 
B268: of:=IF( ISBLANK([$'03.Muestra'.$C$26]);"";[$'03.Muestra'.$C$26]) ->  | C268: of:=IF( ISBLANK([$'03.Muestra'.$E$26]);"";[$'03.Muestra'.$E$26]) ->  | D268: of:=IF(AND([.B268]<>"";[.C268]<>"");"N/T";"") ->  | E268: of:=IF([.D268]<>"";IF(AND([.B268]<>"";[.C268]<>"");"";"ERR");"") -> 
B269: of:=IF( ISBLANK([$'03.Muestra'.$C$27]);"";[$'03.Muestra'.$C$27]) ->  | C269: of:=IF( ISBLANK([$'03.Muestra'.$E$27]);"";[$'03.Muestra'.$E$27]) ->  | D269: of:=IF(AND([.B269]<>"";[.C269]<>"");"N/T";"") ->  | E269: of:=IF([.D269]<>"";IF(AND([.B269]<>"";[.C269]<>"");"";"ERR");"") -> 
B270: of:=IF( ISBLANK([$'03.Muestra'.$C$28]);"";[$'03.Muestra'.$C$28]) ->  | C270: of:=IF( ISBLANK([$'03.Muestra'.$E$28]);"";[$'03.Muestra'.$E$28]) ->  | D270: of:=IF(AND([.B270]<>"";[.C270]<>"");"N/T";"") ->  | E270: of:=IF([.D270]<>"";IF(AND([.B270]<>"";[.C270]<>"");"";"ERR");"") -> 
B271: of:=IF( ISBLANK([$'03.Muestra'.$C$29]);"";[$'03.Muestra'.$C$29]) ->  | C271: of:=IF( ISBLANK([$'03.Muestra'.$E$29]);"";[$'03.Muestra'.$E$29]) ->  | D271: of:=IF(AND([.B271]<>"";[.C271]<>"");"N/T";"") ->  | E271: of:=IF([.D271]<>"";IF(AND([.B271]<>"";[.C271]<>"");"";"ERR");"") -> 
B272: of:=IF( ISBLANK([$'03.Muestra'.$C$30]);"";[$'03.Muestra'.$C$30]) ->  | C272: of:=IF( ISBLANK([$'03.Muestra'.$E$30]);"";[$'03.Muestra'.$E$30]) ->  | D272: of:=IF(AND([.B272]<>"";[.C272]<>"");"N/T";"") ->  | E272: of:=IF([.D272]<>"";IF(AND([.B272]<>"";[.C272]<>"");"";"ERR");"") -> 
B273: of:=IF( ISBLANK([$'03.Muestra'.$C$31]);"";[$'03.Muestra'.$C$31]) ->  | C273: of:=IF( ISBLANK([$'03.Muestra'.$E$31]);"";[$'03.Muestra'.$E$31]) ->  | D273: of:=IF(AND([.B273]<>"";[.C273]<>"");"N/T";"") ->  | E273: of:=IF([.D273]<>"";IF(AND([.B273]<>"";[.C273]<>"");"";"ERR");"") -> 
B274: of:=IF( ISBLANK([$'03.Muestra'.$C$32]);"";[$'03.Muestra'.$C$32]) ->  | C274: of:=IF( ISBLANK([$'03.Muestra'.$E$32]);"";[$'03.Muestra'.$E$32]) ->  | D274: of:=IF(AND([.B274]<>"";[.C274]<>"");"N/T";"") ->  | E274: of:=IF([.D274]<>"";IF(AND([.B274]<>"";[.C274]<>"");"";"ERR");"") -> 
B275: of:=IF( ISBLANK([$'03.Muestra'.$C$33]);"";[$'03.Muestra'.$C$33]) ->  | C275: of:=IF( ISBLANK([$'03.Muestra'.$E$33]);"";[$'03.Muestra'.$E$33]) ->  | D275: of:=IF(AND([.B275]<>"";[.C275]<>"");"N/T";"") ->  | E275: of:=IF([.D275]<>"";IF(AND([.B275]<>"";[.C275]<>"");"";"ERR");"") -> 
B276: of:=IF( ISBLANK([$'03.Muestra'.$C$34]);"";[$'03.Muestra'.$C$34]) ->  | C276: of:=IF( ISBLANK([$'03.Muestra'.$E$34]);"";[$'03.Muestra'.$E$34]) ->  | D276: of:=IF(AND([.B276]<>"";[.C276]<>"");"N/T";"") ->  | E276: of:=IF([.D276]<>"";IF(AND([.B276]<>"";[.C276]<>"");"";"ERR");"") -> 
B277: of:=IF( ISBLANK([$'03.Muestra'.$C$35]);"";[$'03.Muestra'.$C$35]) ->  | C277: of:=IF( ISBLANK([$'03.Muestra'.$E$35]);"";[$'03.Muestra'.$E$35]) ->  | D277: of:=IF(AND([.B277]<>"";[.C277]<>"");"N/T";"") ->  | E277: of:=IF([.D277]<>"";IF(AND([.B277]<>"";[.C277]<>"");"";"ERR");"") -> 
B278: of:=IF( ISBLANK([$'03.Muestra'.$C$36]);"";[$'03.Muestra'.$C$36]) ->  | C278: of:=IF( ISBLANK([$'03.Muestra'.$E$36]);"";[$'03.Muestra'.$E$36]) ->  | D278: of:=IF(AND([.B278]<>"";[.C278]<>"");"N/T";"") ->  | E278: of:=IF([.D278]<>"";IF(AND([.B278]<>"";[.C278]<>"");"";"ERR");"") -> 
B279: of:=IF( ISBLANK([$'03.Muestra'.$C$37]);"";[$'03.Muestra'.$C$37]) ->  | C279: of:=IF( ISBLANK([$'03.Muestra'.$E$37]);"";[$'03.Muestra'.$E$37]) ->  | D279: of:=IF(AND([.B279]<>"";[.C279]<>"");"N/T";"") ->  | E279: of:=IF([.D279]<>"";IF(AND([.B279]<>"";[.C279]<>"");"";"ERR");"") -> 
B282: A | C282: 2.4.3 Orden del foco | D282: Resultado
B283: of:=IF( ISBLANK([$'03.Muestra'.$C$8]);"";[$'03.Muestra'.$C$8]) ->  | C283: of:=IF( ISBLANK([$'03.Muestra'.$E$8]);"";[$'03.Muestra'.$E$8]) ->  | D283: of:=IF(AND([.B283]<>"";[.C283]<>"");"N/T";"") ->  | E283: of:=IF([.D283]<>"";IF(AND([.B283]<>"";[.C283]<>"");"";"ERR");"") ->  | F283: of:=TRANSPOSE([$'DATA - Oculta'.$U$9:$'DATA - Oculta'.$U$13]) -> N/T | G283: N/D | H283: N/A | I283: Falla | J283: Pasa | K283: En blanco
B284: of:=IF( ISBLANK([$'03.Muestra'.$C$9]);"";[$'03.Muestra'.$C$9]) ->  | C284: of:=IF( ISBLANK([$'03.Muestra'.$E$9]);"";[$'03.Muestra'.$E$9]) ->  | D284: of:=IF(AND([.B284]<>"";[.C284]<>"");"N/T";"") ->  | E284: of:=IF([.D284]<>"";IF(AND([.B284]<>"";[.C284]<>"");"";"ERR");"") ->  | F284: of:=COUNTIF([.$D283]:INDIRECT("$D" &  SUM(ROW()-1;[$'03.Muestra'.$D$40])-1);[.F283]) -> 0 | G284: of:=COUNTIF([.$D283]:INDIRECT("$D" &  SUM(ROW()-1;[$'03.Muestra'.$D$40])-1);[.G283]) -> 0 | H284: of:=COUNTIF([.$D283]:INDIRECT("$D" &  SUM(ROW()-1;[$'03.Muestra'.$D$40])-1);[.H283]) -> 0 | I284: of:=COUNTIF([.$D283]:INDIRECT("$D" &  SUM(ROW()-1;[$'03.Muestra'.$D$40])-1);[.I283]) -> 0 | J284: of:=COUNTIF([.$D283]:INDIRECT("$D" &  SUM(ROW()-1;[$'03.Muestra'.$D$40])-1);[.J283]) -> 0 | K284: of:=IF([$'03.Muestra'.$D$40]=0;0;COUNTBLANK([.$D283]:INDIRECT("$D" &  SUM(ROW()-1;[$'03.Muestra'.$D$40])-1))) -> 0
B285: of:=IF( ISBLANK([$'03.Muestra'.$C$10]);"";[$'03.Muestra'.$C$10]) ->  | C285: of:=IF( ISBLANK([$'03.Muestra'.$E$10]);"";[$'03.Muestra'.$E$10]) ->  | D285: of:=IF(AND([.B285]<>"";[.C285]<>"");"N/T";"") ->  | E285: of:=IF([.D285]<>"";IF(AND([.B285]<>"";[.C285]<>"");"";"ERR");"") -> 
B286: of:=IF( ISBLANK([$'03.Muestra'.$C$11]);"";[$'03.Muestra'.$C$11]) ->  | C286: of:=IF( ISBLANK([$'03.Muestra'.$E$11]);"";[$'03.Muestra'.$E$11]) ->  | D286: of:=IF(AND([.B286]<>"";[.C286]<>"");"N/T";"") ->  | E286: of:=IF([.D286]<>"";IF(AND([.B286]<>"";[.C286]<>"");"";"ERR");"") -> 
B287: of:=IF( ISBLANK([$'03.Muestra'.$C$12]);"";[$'03.Muestra'.$C$12]) ->  | C287: of:=IF( ISBLANK([$'03.Muestra'.$E$12]);"";[$'03.Muestra'.$E$12]) ->  | D287: of:=IF(AND([.B287]<>"";[.C287]<>"");"N/T";"") ->  | E287: of:=IF([.D287]<>"";IF(AND([.B287]<>"";[.C287]<>"");"";"ERR");"") -> 
B288: of:=IF( ISBLANK([$'03.Muestra'.$C$13]);"";[$'03.Muestra'.$C$13]) ->  | C288: of:=IF( ISBLANK([$'03.Muestra'.$E$13]);"";[$'03.Muestra'.$E$13]) ->  | D288: of:=IF(AND([.B288]<>"";[.C288]<>"");"N/T";"") ->  | E288: of:=IF([.D288]<>"";IF(AND([.B288]<>"";[.C288]<>"");"";"ERR");"") -> 
B289: of:=IF( ISBLANK([$'03.Muestra'.$C$14]);"";[$'03.Muestra'.$C$14]) ->  | C289: of:=IF( ISBLANK([$'03.Muestra'.$E$14]);"";[$'03.Muestra'.$E$14]) ->  | D289: of:=IF(AND([.B289]<>"";[.C289]<>"");"N/T";"") ->  | E289: of:=IF([.D289]<>"";IF(AND([.B289]<>"";[.C289]<>"");"";"ERR");"") -> 
B290: of:=IF( ISBLANK([$'03.Muestra'.$C$15]);"";[$'03.Muestra'.$C$15]) ->  | C290: of:=IF( ISBLANK([$'03.Muestra'.$E$15]);"";[$'03.Muestra'.$E$15]) ->  | D290: of:=IF(AND([.B290]<>"";[.C290]<>"");"N/T";"") ->  | E290: of:=IF([.D290]<>"";IF(AND([.B290]<>"";[.C290]<>"");"";"ERR");"") -> 
B291: of:=IF( ISBLANK([$'03.Muestra'.$C$16]);"";[$'03.Muestra'.$C$16]) ->  | C291: of:=IF( ISBLANK([$'03.Muestra'.$E$16]);"";[$'03.Muestra'.$E$16]) ->  | D291: of:=IF(AND([.B291]<>"";[.C291]<>"");"N/T";"") ->  | E291: of:=IF([.D291]<>"";IF(AND([.B291]<>"";[.C291]<>"");"";"ERR");"") -> 
B292: of:=IF( ISBLANK([$'03.Muestra'.$C$17]);"";[$'03.Muestra'.$C$17]) ->  | C292: of:=IF( ISBLANK([$'03.Muestra'.$E$17]);"";[$'03.Muestra'.$E$17]) ->  | D292: of:=IF(AND([.B292]<>"";[.C292]<>"");"N/T";"") ->  | E292: of:=IF([.D292]<>"";IF(AND([.B292]<>"";[.C292]<>"");"";"ERR");"") -> 
B293: of:=IF( ISBLANK([$'03.Muestra'.$C$18]);"";[$'03.Muestra'.$C$18]) ->  | C293: of:=IF( ISBLANK([$'03.Muestra'.$E$18]);"";[$'03.Muestra'.$E$18]) ->  | D293: of:=IF(AND([.B293]<>"";[.C293]<>"");"N/T";"") ->  | E293: of:=IF([.D293]<>"";IF(AND([.B293]<>"";[.C293]<>"");"";"ERR");"") -> 
B294: of:=IF( ISBLANK([$'03.Muestra'.$C$19]);"";[$'03.Muestra'.$C$19]) ->  | C294: of:=IF( ISBLANK([$'03.Muestra'.$E$19]);"";[$'03.Muestra'.$E$19]) ->  | D294: of:=IF(AND([.B294]<>"";[.C294]<>"");"N/T";"") ->  | E294: of:=IF([.D294]<>"";IF(AND([.B294]<>"";[.C294]<>"");"";"ERR");"") -> 
B295: of:=IF( ISBLANK([$'03.Muestra'.$C$20]);"";[$'03.Muestra'.$C$20]) ->  | C295: of:=IF( ISBLANK([$'03.Muestra'.$E$20]);"";[$'03.Muestra'.$E$20]) ->  | D295: of:=IF(AND([.B295]<>"";[.C295]<>"");"N/T";"") ->  | E295: of:=IF([.D295]<>"";IF(AND([.B295]<>"";[.C295]<>"");"";"ERR");"") -> 
B296: of:=IF( ISBLANK([$'03.Muestra'.$C$21]);"";[$'03.Muestra'.$C$21]) ->  | C296: of:=IF( ISBLANK([$'03.Muestra'.$E$21]);"";[$'03.Muestra'.$E$21]) ->  | D296: of:=IF(AND([.B296]<>"";[.C296]<>"");"N/T";"") ->  | E296: of:=IF([.D296]<>"";IF(AND([.B296]<>"";[.C296]<>"");"";"ERR");"") -> 
B297: of:=IF( ISBLANK([$'03.Muestra'.$C$22]);"";[$'03.Muestra'.$C$22]) ->  | C297: of:=IF( ISBLANK([$'03.Muestra'.$E$22]);"";[$'03.Muestra'.$E$22]) ->  | D297: of:=IF(AND([.B297]<>"";[.C297]<>"");"N/T";"") ->  | E297: of:=IF([.D297]<>"";IF(AND([.B297]<>"";[.C297]<>"");"";"ERR");"") -> 
B298: of:=IF( ISBLANK([$'03.Muestra'.$C$23]);"";[$'03.Muestra'.$C$23]) ->  | C298: of:=IF( ISBLANK([$'03.Muestra'.$E$23]);"";[$'03.Muestra'.$E$23]) ->  | D298: of:=IF(AND([.B298]<>"";[.C298]<>"");"N/T";"") ->  | E298: of:=IF([.D298]<>"";IF(AND([.B298]<>"";[.C298]<>"");"";"ERR");"") -> 
B299: of:=IF( ISBLANK([$'03.Muestra'.$C$24]);"";[$'03.Muestra'.$C$24]) ->  | C299: of:=IF( ISBLANK([$'03.Muestra'.$E$24]);"";[$'03.Muestra'.$E$24]) ->  | D299: of:=IF(AND([.B299]<>"";[.C299]<>"");"N/T";"") ->  | E299: of:=IF([.D299]<>"";IF(AND([.B299]<>"";[.C299]<>"");"";"ERR");"") -> 
B300: of:=IF( ISBLANK([$'03.Muestra'.$C$25]);"";[$'03.Muestra'.$C$25]) ->  | C300: of:=IF( ISBLANK([$'03.Muestra'.$E$25]);"";[$'03.Muestra'.$E$25]) ->  | D300: of:=IF(AND([.B300]<>"";[.C300]<>"");"N/T";"") ->  | E300: of:=IF([.D300]<>"";IF(AND([.B300]<>"";[.C300]<>"");"";"ERR");"") -> 
B301: of:=IF( ISBLANK([$'03.Muestra'.$C$26]);"";[$'03.Muestra'.$C$26]) ->  | C301: of:=IF( ISBLANK([$'03.Muestra'.$E$26]);"";[$'03.Muestra'.$E$26]) ->  | D301: of:=IF(AND([.B301]<>"";[.C301]<>"");"N/T";"") ->  | E301: of:=IF([.D301]<>"";IF(AND([.B301]<>"";[.C301]<>"");"";"ERR");"") -> 
B302: of:=IF( ISBLANK([$'03.Muestra'.$C$27]);"";[$'03.Muestra'.$C$27]) ->  | C302: of:=IF( ISBLANK([$'03.Muestra'.$E$27]);"";[$'03.Muestra'.$E$27]) ->  | D302: of:=IF(AND([.B302]<>"";[.C302]<>"");"N/T";"") ->  | E302: of:=IF([.D302]<>"";IF(AND([.B302]<>"";[.C302]<>"");"";"ERR");"") -> 
B303: of:=IF( ISBLANK([$'03.Muestra'.$C$28]);"";[$'03.Muestra'.$C$28]) ->  | C303: of:=IF( ISBLANK([$'03.Muestra'.$E$28]);"";[$'03.Muestra'.$E$28]) ->  | D303: of:=IF(AND([.B303]<>"";[.C303]<>"");"N/T";"") ->  | E303: of:=IF([.D303]<>"";IF(AND([.B303]<>"";[.C303]<>"");"";"ERR");"") -> 
B304: of:=IF( ISBLANK([$'03.Muestra'.$C$29]);"";[$'03.Muestra'.$C$29]) ->  | C304: of:=IF( ISBLANK([$'03.Muestra'.$E$29]);"";[$'03.Muestra'.$E$29]) ->  | D304: of:=IF(AND([.B304]<>"";[.C304]<>"");"N/T";"") ->  | E304: of:=IF([.D304]<>"";IF(AND([.B304]<>"";[.C304]<>"");"";"ERR");"") -> 
B305: of:=IF( ISBLANK([$'03.Muestra'.$C$30]);"";[$'03.Muestra'.$C$30]) ->  | C305: of:=IF( ISBLANK([$'03.Muestra'.$E$30]);"";[$'03.Muestra'.$E$30]) ->  | D305: of:=IF(AND([.B305]<>"";[.C305]<>"");"N/T";"") ->  | E305: of:=IF([.D305]<>"";IF(AND([.B305]<>"";[.C305]<>"");"";"ERR");"") -> 
B306: of:=IF( ISBLANK([$'03.Muestra'.$C$31]);"";[$'03.Muestra'.$C$31]) ->  | C306: of:=IF( ISBLANK([$'03.Muestra'.$E$31]);"";[$'03.Muestra'.$E$31]) ->  | D306: of:=IF(AND([.B306]<>"";[.C306]<>"");"N/T";"") ->  | E306: of:=IF([.D306]<>"";IF(AND([.B306]<>"";[.C306]<>"");"";"ERR");"") -> 
B307: of:=IF( ISBLANK([$'03.Muestra'.$C$32]);"";[$'03.Muestra'.$C$32]) ->  | C307: of:=IF( ISBLANK([$'03.Muestra'.$E$32]);"";[$'03.Muestra'.$E$32]) ->  | D307: of:=IF(AND([.B307]<>"";[.C307]<>"");"N/T";"") ->  | E307: of:=IF([.D307]<>"";IF(AND([.B307]<>"";[.C307]<>"");"";"ERR");"") -> 
B308: of:=IF( ISBLANK([$'03.Muestra'.$C$33]);"";[$'03.Muestra'.$C$33]) ->  | C308: of:=IF( ISBLANK([$'03.Muestra'.$E$33]);"";[$'03.Muestra'.$E$33]) ->  | D308: of:=IF(AND([.B308]<>"";[.C308]<>"");"N/T";"") ->  | E308: of:=IF([.D308]<>"";IF(AND([.B308]<>"";[.C308]<>"");"";"ERR");"") -> 
B309: of:=IF( ISBLANK([$'03.Muestra'.$C$34]);"";[$'03.Muestra'.$C$34]) ->  | C309: of:=IF( ISBLANK([$'03.Muestra'.$E$34]);"";[$'03.Muestra'.$E$34]) ->  | D309: of:=IF(AND([.B309]<>"";[.C309]<>"");"N/T";"") ->  | E309: of:=IF([.D309]<>"";IF(AND([.B309]<>"";[.C309]<>"");"";"ERR");"") -> 
B310: of:=IF( ISBLANK([$'03.Muestra'.$C$35]);"";[$'03.Muestra'.$C$35]) ->  | C310: of:=IF( ISBLANK([$'03.Muestra'.$E$35]);"";[$'03.Muestra'.$E$35]) ->  | D310: of:=IF(AND([.B310]<>"";[.C310]<>"");"N/T";"") ->  | E310: of:=IF([.D310]<>"";IF(AND([.B310]<>"";[.C310]<>"");"";"ERR");"") -> 
B311: of:=IF( ISBLANK([$'03.Muestra'.$C$36]);"";[$'03.Muestra'.$C$36]) ->  | C311: of:=IF( ISBLANK([$'03.Muestra'.$E$36]);"";[$'03.Muestra'.$E$36]) ->  | D311: of:=IF(AND([.B311]<>"";[.C311]<>"");"N/T";"") ->  | E311: of:=IF([.D311]<>"";IF(AND([.B311]<>"";[.C311]<>"");"";"ERR");"") -> 
B312: of:=IF( ISBLANK([$'03.Muestra'.$C$37]);"";[$'03.Muestra'.$C$37]) ->  | C312: of:=IF( ISBLANK([$'03.Muestra'.$E$37]);"";[$'03.Muestra'.$E$37]) ->  | D312: of:=IF(AND([.B312]<>"";[.C312]<>"");"N/T";"") ->  | E312: of:=IF([.D312]<>"";IF(AND([.B312]<>"";[.C312]<>"");"";"ERR");"") -> 
B315: A | C315: 2.4.4 PropÃ³sito de los enlaces (en contexto) | D315: Resultado
B316: of:=IF( ISBLANK([$'03.Muestra'.$C$8]);"";[$'03.Muestra'.$C$8]) ->  | C316: of:=IF( ISBLANK([$'03.Muestra'.$E$8]);"";[$'03.Muestra'.$E$8]) ->  | D316: of:=IF(AND([.B316]<>"";[.C316]<>"");"N/T";"") ->  | E316: of:=IF([.D316]<>"";IF(AND([.B316]<>"";[.C316]<>"");"";"ERR");"") ->  | F316: of:=TRANSPOSE([$'DATA - Oculta'.$U$9:$'DATA - Oculta'.$U$13]) -> N/T | G316: N/D | H316: N/A | I316: Falla | J316: Pasa | K316: En blanco
B317: of:=IF( ISBLANK([$'03.Muestra'.$C$9]);"";[$'03.Muestra'.$C$9]) ->  | C317: of:=IF( ISBLANK([$'03.Muestra'.$E$9]);"";[$'03.Muestra'.$E$9]) ->  | D317: of:=IF(AND([.B317]<>"";[.C317]<>"");"N/T";"") ->  | E317: of:=IF([.D317]<>"";IF(AND([.B317]<>"";[.C317]<>"");"";"ERR");"") ->  | F317: of:=COUNTIF([.$D316]:INDIRECT("$D" &  SUM(ROW()-1;[$'03.Muestra'.$D$40])-1);[.F316]) -> 0 | G317: of:=COUNTIF([.$D316]:INDIRECT("$D" &  SUM(ROW()-1;[$'03.Muestra'.$D$40])-1);[.G316]) -> 0 | H317: of:=COUNTIF([.$D316]:INDIRECT("$D" &  SUM(ROW()-1;[$'03.Muestra'.$D$40])-1);[.H316]) -> 0 | I317: of:=COUNTIF([.$D316]:INDIRECT("$D" &  SUM(ROW()-1;[$'03.Muestra'.$D$40])-1);[.I316]) -> 0 | J317: of:=COUNTIF([.$D316]:INDIRECT("$D" &  SUM(ROW()-1;[$'03.Muestra'.$D$40])-1);[.J316]) -> 0 | K317: of:=IF([$'03.Muestra'.$D$40]=0;0;COUNTBLANK([.$D316]:INDIRECT("$D" &  SUM(ROW()-1;[$'03.Muestra'.$D$40])-1))) -> 0
B318: of:=IF( ISBLANK([$'03.Muestra'.$C$10]);"";[$'03.Muestra'.$C$10]) ->  | C318: of:=IF( ISBLANK([$'03.Muestra'.$E$10]);"";[$'03.Muestra'.$E$10]) ->  | D318: of:=IF(AND([.B318]<>"";[.C318]<>"");"N/T";"") ->  | E318: of:=IF([.D318]<>"";IF(AND([.B318]<>"";[.C318]<>"");"";"ERR");"") -> 
B319: of:=IF( ISBLANK([$'03.Muestra'.$C$11]);"";[$'03.Muestra'.$C$11]) ->  | C319: of:=IF( ISBLANK([$'03.Muestra'.$E$11]);"";[$'03.Muestra'.$E$11]) ->  | D319: of:=IF(AND([.B319]<>"";[.C319]<>"");"N/T";"") ->  | E319: of:=IF([.D319]<>"";IF(AND([.B319]<>"";[.C319]<>"");"";"ERR");"") -> 
B320: of:=IF( ISBLANK([$'03.Muestra'.$C$12]);"";[$'03.Muestra'.$C$12]) ->  | C320: of:=IF( ISBLANK([$'03.Muestra'.$E$12]);"";[$'03.Muestra'.$E$12]) ->  | D320: of:=IF(AND([.B320]<>"";[.C320]<>"");"N/T";"") ->  | E320: of:=IF([.D320]<>"";IF(AND([.B320]<>"";[.C320]<>"");"";"ERR");"") -> 
B321: of:=IF( ISBLANK([$'03.Muestra'.$C$13]);"";[$'03.Muestra'.$C$13]) ->  | C321: of:=IF( ISBLANK([$'03.Muestra'.$E$13]);"";[$'03.Muestra'.$E$13]) ->  | D321: of:=IF(AND([.B321]<>"";[.C321]<>"");"N/T";"") ->  | E321: of:=IF([.D321]<>"";IF(AND([.B321]<>"";[.C321]<>"");"";"ERR");"") -> 
B322: of:=IF( ISBLANK([$'03.Muestra'.$C$14]);"";[$'03.Muestra'.$C$14]) ->  | C322: of:=IF( ISBLANK([$'03.Muestra'.$E$14]);"";[$'03.Muestra'.$E$14]) ->  | D322: of:=IF(AND([.B322]<>"";[.C322]<>"");"N/T";"") ->  | E322: of:=IF([.D322]<>"";IF(AND([.B322]<>"";[.C322]<>"");"";"ERR");"") -> 
B323: of:=IF( ISBLANK([$'03.Muestra'.$C$15]);"";[$'03.Muestra'.$C$15]) ->  | C323: of:=IF( ISBLANK([$'03.Muestra'.$E$15]);"";[$'03.Muestra'.$E$15]) ->  | D323: of:=IF(AND([.B323]<>"";[.C323]<>"");"N/T";"") ->  | E323: of:=IF([.D323]<>"";IF(AND([.B323]<>"";[.C323]<>"");"";"ERR");"") -> 
B324: of:=IF( ISBLANK([$'03.Muestra'.$C$16]);"";[$'03.Muestra'.$C$16]) ->  | C324: of:=IF( ISBLANK([$'03.Muestra'.$E$16]);"";[$'03.Muestra'.$E$16]) ->  | D324: of:=IF(AND([.B324]<>"";[.C324]<>"");"N/T";"") ->  | E324: of:=IF([.D324]<>"";IF(AND([.B324]<>"";[.C324]<>"");"";"ERR");"") -> 
B325: of:=IF( ISBLANK([$'03.Muestra'.$C$17]);"";[$'03.Muestra'.$C$17]) ->  | C325: of:=IF( ISBLANK([$'03.Muestra'.$E$17]);"";[$'03.Muestra'.$E$17]) ->  | D325: of:=IF(AND([.B325]<>"";[.C325]<>"");"N/T";"") ->  | E325: of:=IF([.D325]<>"";IF(AND([.B325]<>"";[.C325]<>"");"";"ERR");"") -> 
B326: of:=IF( ISBLANK([$'03.Muestra'.$C$18]);"";[$'03.Muestra'.$C$18]) ->  | C326: of:=IF( ISBLANK([$'03.Muestra'.$E$18]);"";[$'03.Muestra'.$E$18]) ->  | D326: of:=IF(AND([.B326]<>"";[.C326]<>"");"N/T";"") ->  | E326: of:=IF([.D326]<>"";IF(AND([.B326]<>"";[.C326]<>"");"";"ERR");"") -> 
B327: of:=IF( ISBLANK([$'03.Muestra'.$C$19]);"";[$'03.Muestra'.$C$19]) ->  | C327: of:=IF( ISBLANK([$'03.Muestra'.$E$19]);"";[$'03.Muestra'.$E$19]) ->  | D327: of:=IF(AND([.B327]<>"";[.C327]<>"");"N/T";"") ->  | E327: of:=IF([.D327]<>"";IF(AND([.B327]<>"";[.C327]<>"");"";"ERR");"") -> 
B328: of:=IF( ISBLANK([$'03.Muestra'.$C$20]);"";[$'03.Muestra'.$C$20]) ->  | C328: of:=IF( ISBLANK([$'03.Muestra'.$E$20]);"";[$'03.Muestra'.$E$20]) ->  | D328: of:=IF(AND([.B328]<>"";[.C328]<>"");"N/T";"") ->  | E328: of:=IF([.D328]<>"";IF(AND([.B328]<>"";[.C328]<>"");"";"ERR");"") -> 
B329: of:=IF( ISBLANK([$'03.Muestra'.$C$21]);"";[$'03.Muestra'.$C$21]) ->  | C329: of:=IF( ISBLANK([$'03.Muestra'.$E$21]);"";[$'03.Muestra'.$E$21]) ->  | D329: of:=IF(AND([.B329]<>"";[.C329]<>"");"N/T";"") ->  | E329: of:=IF([.D329]<>"";IF(AND([.B329]<>"";[.C329]<>"");"";"ERR");"") -> 
B330: of:=IF( ISBLANK([$'03.Muestra'.$C$22]);"";[$'03.Muestra'.$C$22]) ->  | C330: of:=IF( ISBLANK([$'03.Muestra'.$E$22]);"";[$'03.Muestra'.$E$22]) ->  | D330: of:=IF(AND([.B330]<>"";[.C330]<>"");"N/T";"") ->  | E330: of:=IF([.D330]<>"";IF(AND([.B330]<>"";[.C330]<>"");"";"ERR");"") -> 
B331: of:=IF( ISBLANK([$'03.Muestra'.$C$23]);"";[$'03.Muestra'.$C$23]) ->  | C331: of:=IF( ISBLANK([$'03.Muestra'.$E$23]);"";[$'03.Muestra'.$E$23]) ->  | D331: of:=IF(AND([.B331]<>"";[.C331]<>"");"N/T";"") ->  | E331: of:=IF([.D331]<>"";IF(AND([.B331]<>"";[.C331]<>"");"";"ERR");"") -> 
B332: of:=IF( ISBLANK([$'03.Muestra'.$C$24]);"";[$'03.Muestra'.$C$24]) ->  | C332: of:=IF( ISBLANK([$'03.Muestra'.$E$24]);"";[$'03.Muestra'.$E$24]) ->  | D332: of:=IF(AND([.B332]<>"";[.C332]<>"");"N/T";"") ->  | E332: of:=IF([.D332]<>"";IF(AND([.B332]<>"";[.C332]<>"");"";"ERR");"") -> 
B333: of:=IF( ISBLANK([$'03.Muestra'.$C$25]);"";[$'03.Muestra'.$C$25]) ->  | C333: of:=IF( ISBLANK([$'03.Muestra'.$E$25]);"";[$'03.Muestra'.$E$25]) ->  | D333: of:=IF(AND([.B333]<>"";[.C333]<>"");"N/T";"") ->  | E333: of:=IF([.D333]<>"";IF(AND([.B333]<>"";[.C333]<>"");"";"ERR");"") -> 
B334: of:=IF( ISBLANK([$'03.Muestra'.$C$26]);"";[$'03.Muestra'.$C$26]) ->  | C334: of:=IF( ISBLANK([$'03.Muestra'.$E$26]);"";[$'03.Muestra'.$E$26]) ->  | D334: of:=IF(AND([.B334]<>"";[.C334]<>"");"N/T";"") ->  | E334: of:=IF([.D334]<>"";IF(AND([.B334]<>"";[.C334]<>"");"";"ERR");"") -> 
B335: of:=IF( ISBLANK([$'03.Muestra'.$C$27]);"";[$'03.Muestra'.$C$27]) ->  | C335: of:=IF( ISBLANK([$'03.Muestra'.$E$27]);"";[$'03.Muestra'.$E$27]) ->  | D335: of:=IF(AND([.B335]<>"";[.C335]<>"");"N/T";"") ->  | E335: of:=IF([.D335]<>"";IF(AND([.B335]<>"";[.C335]<>"");"";"ERR");"") -> 
B336: of:=IF( ISBLANK([$'03.Muestra'.$C$28]);"";[$'03.Muestra'.$C$28]) ->  | C336: of:=IF( ISBLANK([$'03.Muestra'.$E$28]);"";[$'03.Muestra'.$E$28]) ->  | D336: of:=IF(AND([.B336]<>"";[.C336]<>"");"N/T";"") ->  | E336: of:=IF([.D336]<>"";IF(AND([.B336]<>"";[.C336]<>"");"";"ERR");"") -> 
B337: of:=IF( ISBLANK([$'03.Muestra'.$C$29]);"";[$'03.Muestra'.$C$29]) ->  | C337: of:=IF( ISBLANK([$'03.Muestra'.$E$29]);"";[$'03.Muestra'.$E$29]) ->  | D337: of:=IF(AND([.B337]<>"";[.C337]<>"");"N/T";"") ->  | E337: of:=IF([.D337]<>"";IF(AND([.B337]<>"";[.C337]<>"");"";"ERR");"") -> 
B338: of:=IF( ISBLANK([$'03.Muestra'.$C$30]);"";[$'03.Muestra'.$C$30]) ->  | C338: of:=IF( ISBLANK([$'03.Muestra'.$E$30]);"";[$'03.Muestra'.$E$30]) ->  | D338: of:=IF(AND([.B338]<>"";[.C338]<>"");"N/T";"") ->  | E338: of:=IF([.D338]<>"";IF(AND([.B338]<>"";[.C338]<>"");"";"ERR");"") -> 
B339: of:=IF( ISBLANK([$'03.Muestra'.$C$31]);"";[$'03.Muestra'.$C$31]) ->  | C339: of:=IF( ISBLANK([$'03.Muestra'.$E$31]);"";[$'03.Muestra'.$E$31]) ->  | D339: of:=IF(AND([.B339]<>"";[.C339]<>"");"N/T";"") ->  | E339: of:=IF([.D339]<>"";IF(AND([.B339]<>"";[.C339]<>"");"";"ERR");"") -> 
B340: of:=IF( ISBLANK([$'03.Muestra'.$C$32]);"";[$'03.Muestra'.$C$32]) ->  | C340: of:=IF( ISBLANK([$'03.Muestra'.$E$32]);"";[$'03.Muestra'.$E$32]) ->  | D340: of:=IF(AND([.B340]<>"";[.C340]<>"");"N/T";"") ->  | E340: of:=IF([.D340]<>"";IF(AND([.B340]<>"";[.C340]<>"");"";"ERR");"") -> 
B341: of:=IF( ISBLANK([$'03.Muestra'.$C$33]);"";[$'03.Muestra'.$C$33]) ->  | C341: of:=IF( ISBLANK([$'03.Muestra'.$E$33]);"";[$'03.Muestra'.$E$33]) ->  | D341: of:=IF(AND([.B341]<>"";[.C341]<>"");"N/T";"") ->  | E341: of:=IF([.D341]<>"";IF(AND([.B341]<>"";[.C341]<>"");"";"ERR");"") -> 
B342: of:=IF( ISBLANK([$'03.Muestra'.$C$34]);"";[$'03.Muestra'.$C$34]) ->  | C342: of:=IF( ISBLANK([$'03.Muestra'.$E$34]);"";[$'03.Muestra'.$E$34]) ->  | D342: of:=IF(AND([.B342]<>"";[.C342]<>"");"N/T";"") ->  | E342: of:=IF([.D342]<>"";IF(AND([.B342]<>"";[.C342]<>"");"";"ERR");"") -> 
B343: of:=IF( ISBLANK([$'03.Muestra'.$C$35]);"";[$'03.Muestra'.$C$35]) ->  | C343: of:=IF( ISBLANK([$'03.Muestra'.$E$35]);"";[$'03.Muestra'.$E$35]) ->  | D343: of:=IF(AND([.B343]<>"";[.C343]<>"");"N/T";"") ->  | E343: of:=IF([.D343]<>"";IF(AND([.B343]<>"";[.C343]<>"");"";"ERR");"") -> 
B344: of:=IF( ISBLANK([$'03.Muestra'.$C$36]);"";[$'03.Muestra'.$C$36]) ->  | C344: of:=IF( ISBLANK([$'03.Muestra'.$E$36]);"";[$'03.Muestra'.$E$36]) ->  | D344: of:=IF(AND([.B344]<>"";[.C344]<>"");"N/T";"") ->  | E344: of:=IF([.D344]<>"";IF(AND([.B344]<>"";[.C344]<>"");"";"ERR");"") -> 
B345: of:=IF( ISBLANK([$'03.Muestra'.$C$37]);"";[$'03.Muestra'.$C$37]) ->  | C345: of:=IF( ISBLANK([$'03.Muestra'.$E$37]);"";[$'03.Muestra'.$E$37]) ->  | D345: of:=IF(AND([.B345]<>"";[.C345]<>"");"N/T";"") ->  | E345: of:=IF([.D345]<>"";IF(AND([.B345]<>"";[.C345]<>"");"";"ERR");"") -> 
B348: AA | C348: 2.4.5 MÃºltiples vÃ­as | D348: Resultado
B349: of:=IF( ISBLANK([$'03.Muestra'.$C$8]);"";[$'03.Muestra'.$C$8]) ->  | C349: of:=IF( ISBLANK([$'03.Muestra'.$E$8]);"";[$'03.Muestra'.$E$8]) ->  | D349: of:=IF(AND([.B349]<>"";[.C349]<>"");"N/T";"") ->  | E349: of:=IF([.D349]<>"";IF(AND([.B349]<>"";[.C349]<>"");"";"ERR");"") ->  | F349: of:=TRANSPOSE([$'DATA - Oculta'.$U$9:$'DATA - Oculta'.$U$13]) -> N/T | G349: N/D | H349: N/A | I349: Falla | J349: Pasa | K349: En blanco
B350: of:=IF( ISBLANK([$'03.Muestra'.$C$9]);"";[$'03.Muestra'.$C$9]) ->  | C350: of:=IF( ISBLANK([$'03.Muestra'.$E$9]);"";[$'03.Muestra'.$E$9]) ->  | D350: of:=IF(AND([.B350]<>"";[.C350]<>"");"N/T";"") ->  | E350: of:=IF([.D350]<>"";IF(AND([.B350]<>"";[.C350]<>"");"";"ERR");"") ->  | F350: of:=COUNTIF([.$D349]:INDIRECT("$D" &  SUM(ROW()-1;[$'03.Muestra'.$D$40])-1);[.F349]) -> 0 | G350: of:=COUNTIF([.$D349]:INDIRECT("$D" &  SUM(ROW()-1;[$'03.Muestra'.$D$40])-1);[.G349]) -> 0 | H350: of:=COUNTIF([.$D349]:INDIRECT("$D" &  SUM(ROW()-1;[$'03.Muestra'.$D$40])-1);[.H349]) -> 0 | I350: of:=COUNTIF([.$D349]:INDIRECT("$D" &  SUM(ROW()-1;[$'03.Muestra'.$D$40])-1);[.I349]) -> 0 | J350: of:=COUNTIF([.$D349]:INDIRECT("$D" &  SUM(ROW()-1;[$'03.Muestra'.$D$40])-1);[.J349]) -> 0 | K350: of:=IF([$'03.Muestra'.$D$40]=0;0;COUNTBLANK([.$D349]:INDIRECT("$D" &  SUM(ROW()-1;[$'03.Muestra'.$D$40])-1))) -> 0
B351: of:=IF( ISBLANK([$'03.Muestra'.$C$10]);"";[$'03.Muestra'.$C$10]) ->  | C351: of:=IF( ISBLANK([$'03.Muestra'.$E$10]);"";[$'03.Muestra'.$E$10]) ->  | D351: of:=IF(AND([.B351]<>"";[.C351]<>"");"N/T";"") ->  | E351: of:=IF([.D351]<>"";IF(AND([.B351]<>"";[.C351]<>"");"";"ERR");"") -> 
B352: of:=IF( ISBLANK([$'03.Muestra'.$C$11]);"";[$'03.Muestra'.$C$11]) ->  | C352: of:=IF( ISBLANK([$'03.Muestra'.$E$11]);"";[$'03.Muestra'.$E$11]) ->  | D352: of:=IF(AND([.B352]<>"";[.C352]<>"");"N/T";"") ->  | E352: of:=IF([.D352]<>"";IF(AND([.B352]<>"";[.C352]<>"");"";"ERR");"") -> 
B353: of:=IF( ISBLANK([$'03.Muestra'.$C$12]);"";[$'03.Muestra'.$C$12]) ->  | C353: of:=IF( ISBLANK([$'03.Muestra'.$E$12]);"";[$'03.Muestra'.$E$12]) ->  | D353: of:=IF(AND([.B353]<>"";[.C353]<>"");"N/T";"") ->  | E353: of:=IF([.D353]<>"";IF(AND([.B353]<>"";[.C353]<>"");"";"ERR");"") -> 
B354: of:=IF( ISBLANK([$'03.Muestra'.$C$13]);"";[$'03.Muestra'.$C$13]) ->  | C354: of:=IF( ISBLANK([$'03.Muestra'.$E$13]);"";[$'03.Muestra'.$E$13]) ->  | D354: of:=IF(AND([.B354]<>"";[.C354]<>"");"N/T";"") ->  | E354: of:=IF([.D354]<>"";IF(AND([.B354]<>"";[.C354]<>"");"";"ERR");"") -> 
B355: of:=IF( ISBLANK([$'03.Muestra'.$C$14]);"";[$'03.Muestra'.$C$14]) ->  | C355: of:=IF( ISBLANK([$'03.Muestra'.$E$14]);"";[$'03.Muestra'.$E$14]) ->  | D355: of:=IF(AND([.B355]<>"";[.C355]<>"");"N/T";"") ->  | E355: of:=IF([.D355]<>"";IF(AND([.B355]<>"";[.C355]<>"");"";"ERR");"") -> 
B356: of:=IF( ISBLANK([$'03.Muestra'.$C$15]);"";[$'03.Muestra'.$C$15]) ->  | C356: of:=IF( ISBLANK([$'03.Muestra'.$E$15]);"";[$'03.Muestra'.$E$15]) ->  | D356: of:=IF(AND([.B356]<>"";[.C356]<>"");"N/T";"") ->  | E356: of:=IF([.D356]<>"";IF(AND([.B356]<>"";[.C356]<>"");"";"ERR");"") -> 
B357: of:=IF( ISBLANK([$'03.Muestra'.$C$16]);"";[$'03.Muestra'.$C$16]) ->  | C357: of:=IF( ISBLANK([$'03.Muestra'.$E$16]);"";[$'03.Muestra'.$E$16]) ->  | D357: of:=IF(AND([.B357]<>"";[.C357]<>"");"N/T";"") ->  | E357: of:=IF([.D357]<>"";IF(AND([.B357]<>"";[.C357]<>"");"";"ERR");"") -> 
B358: of:=IF( ISBLANK([$'03.Muestra'.$C$17]);"";[$'03.Muestra'.$C$17]) ->  | C358: of:=IF( ISBLANK([$'03.Muestra'.$E$17]);"";[$'03.Muestra'.$E$17]) ->  | D358: of:=IF(AND([.B358]<>"";[.C358]<>"");"N/T";"") ->  | E358: of:=IF([.D358]<>"";IF(AND([.B358]<>"";[.C358]<>"");"";"ERR");"") -> 
B359: of:=IF( ISBLANK([$'03.Muestra'.$C$18]);"";[$'03.Muestra'.$C$18]) ->  | C359: of:=IF( ISBLANK([$'03.Muestra'.$E$18]);"";[$'03.Muestra'.$E$18]) ->  | D359: of:=IF(AND([.B359]<>"";[.C359]<>"");"N/T";"") ->  | E359: of:=IF([.D359]<>"";IF(AND([.B359]<>"";[.C359]<>"");"";"ERR");"") -> 
B360: of:=IF( ISBLANK([$'03.Muestra'.$C$19]);"";[$'03.Muestra'.$C$19]) ->  | C360: of:=IF( ISBLANK([$'03.Muestra'.$E$19]);"";[$'03.Muestra'.$E$19]) ->  | D360: of:=IF(AND([.B360]<>"";[.C360]<>"");"N/T";"") ->  | E360: of:=IF([.D360]<>"";IF(AND([.B360]<>"";[.C360]<>"");"";"ERR");"") -> 
B361: of:=IF( ISBLANK([$'03.Muestra'.$C$20]);"";[$'03.Muestra'.$C$20]) ->  | C361: of:=IF( ISBLANK([$'03.Muestra'.$E$20]);"";[$'03.Muestra'.$E$20]) ->  | D361: of:=IF(AND([.B361]<>"";[.C361]<>"");"N/T";"") ->  | E361: of:=IF([.D361]<>"";IF(AND([.B361]<>"";[.C361]<>"");"";"ERR");"") -> 
B362: of:=IF( ISBLANK([$'03.Muestra'.$C$21]);"";[$'03.Muestra'.$C$21]) ->  | C362: of:=IF( ISBLANK([$'03.Muestra'.$E$21]);"";[$'03.Muestra'.$E$21]) ->  | D362: of:=IF(AND([.B362]<>"";[.C362]<>"");"N/T";"") ->  | E362: of:=IF([.D362]<>"";IF(AND([.B362]<>"";[.C362]<>"");"";"ERR");"") -> 
B363: of:=IF( ISBLANK([$'03.Muestra'.$C$22]);"";[$'03.Muestra'.$C$22]) ->  | C363: of:=IF( ISBLANK([$'03.Muestra'.$E$22]);"";[$'03.Muestra'.$E$22]) ->  | D363: of:=IF(AND([.B363]<>"";[.C363]<>"");"N/T";"") ->  | E363: of:=IF([.D363]<>"";IF(AND([.B363]<>"";[.C363]<>"");"";"ERR");"") -> 
B364: of:=IF( ISBLANK([$'03.Muestra'.$C$23]);"";[$'03.Muestra'.$C$23]) ->  | C364: of:=IF( ISBLANK([$'03.Muestra'.$E$23]);"";[$'03.Muestra'.$E$23]) ->  | D364: of:=IF(AND([.B364]<>"";[.C364]<>"");"N/T";"") ->  | E364: of:=IF([.D364]<>"";IF(AND([.B364]<>"";[.C364]<>"");"";"ERR");"") -> 
B365: of:=IF( ISBLANK([$'03.Muestra'.$C$24]);"";[$'03.Muestra'.$C$24]) ->  | C365: of:=IF( ISBLANK([$'03.Muestra'.$E$24]);"";[$'03.Muestra'.$E$24]) ->  | D365: of:=IF(AND([.B365]<>"";[.C365]<>"");"N/T";"") ->  | E365: of:=IF([.D365]<>"";IF(AND([.B365]<>"";[.C365]<>"");"";"ERR");"") -> 
B366: of:=IF( ISBLANK([$'03.Muestra'.$C$25]);"";[$'03.Muestra'.$C$25]) ->  | C366: of:=IF( ISBLANK([$'03.Muestra'.$E$25]);"";[$'03.Muestra'.$E$25]) ->  | D366: of:=IF(AND([.B366]<>"";[.C366]<>"");"N/T";"") ->  | E366: of:=IF([.D366]<>"";IF(AND([.B366]<>"";[.C366]<>"");"";"ERR");"") -> 
B367: of:=IF( ISBLANK([$'03.Muestra'.$C$26]);"";[$'03.Muestra'.$C$26]) ->  | C367: of:=IF( ISBLANK([$'03.Muestra'.$E$26]);"";[$'03.Muestra'.$E$26]) ->  | D367: of:=IF(AND([.B367]<>"";[.C367]<>"");"N/T";"") ->  | E367: of:=IF([.D367]<>"";IF(AND([.B367]<>"";[.C367]<>"");"";"ERR");"") -> 
B368: of:=IF( ISBLANK([$'03.Muestra'.$C$27]);"";[$'03.Muestra'.$C$27]) ->  | C368: of:=IF( ISBLANK([$'03.Muestra'.$E$27]);"";[$'03.Muestra'.$E$27]) ->  | D368: of:=IF(AND([.B368]<>"";[.C368]<>"");"N/T";"") ->  | E368: of:=IF([.D368]<>"";IF(AND([.B368]<>"";[.C368]<>"");"";"ERR");"") -> 
B369: of:=IF( ISBLANK([$'03.Muestra'.$C$28]);"";[$'03.Muestra'.$C$28]) ->  | C369: of:=IF( ISBLANK([$'03.Muestra'.$E$28]);"";[$'03.Muestra'.$E$28]) ->  | D369: of:=IF(AND([.B369]<>"";[.C369]<>"");"N/T";"") ->  | E369: of:=IF([.D369]<>"";IF(AND([.B369]<>"";[.C369]<>"");"";"ERR");"") -> 
B370: of:=IF( ISBLANK([$'03.Muestra'.$C$29]);"";[$'03.Muestra'.$C$29]) ->  | C370: of:=IF( ISBLANK([$'03.Muestra'.$E$29]);"";[$'03.Muestra'.$E$29]) ->  | D370: of:=IF(AND([.B370]<>"";[.C370]<>"");"N/T";"") ->  | E370: of:=IF([.D370]<>"";IF(AND([.B370]<>"";[.C370]<>"");"";"ERR");"") -> 
B371: of:=IF( ISBLANK([$'03.Muestra'.$C$30]);"";[$'03.Muestra'.$C$30]) ->  | C371: of:=IF( ISBLANK([$'03.Muestra'.$E$30]);"";[$'03.Muestra'.$E$30]) ->  | D371: of:=IF(AND([.B371]<>"";[.C371]<>"");"N/T";"") ->  | E371: of:=IF([.D371]<>"";IF(AND([.B371]<>"";[.C371]<>"");"";"ERR");"") -> 
B372: of:=IF( ISBLANK([$'03.Muestra'.$C$31]);"";[$'03.Muestra'.$C$31]) ->  | C372: of:=IF( ISBLANK([$'03.Muestra'.$E$31]);"";[$'03.Muestra'.$E$31]) ->  | D372: of:=IF(AND([.B372]<>"";[.C372]<>"");"N/T";"") ->  | E372: of:=IF([.D372]<>"";IF(AND([.B372]<>"";[.C372]<>"");"";"ERR");"") -> 
B373: of:=IF( ISBLANK([$'03.Muestra'.$C$32]);"";[$'03.Muestra'.$C$32]) ->  | C373: of:=IF( ISBLANK([$'03.Muestra'.$E$32]);"";[$'03.Muestra'.$E$32]) ->  | D373: of:=IF(AND([.B373]<>"";[.C373]<>"");"N/T";"") ->  | E373: of:=IF([.D373]<>"";IF(AND([.B373]<>"";[.C373]<>"");"";"ERR");"") -> 
B374: of:=IF( ISBLANK([$'03.Muestra'.$C$33]);"";[$'03.Muestra'.$C$33]) ->  | C374: of:=IF( ISBLANK([$'03.Muestra'.$E$33]);"";[$'03.Muestra'.$E$33]) ->  | D374: of:=IF(AND([.B374]<>"";[.C374]<>"");"N/T";"") ->  | E374: of:=IF([.D374]<>"";IF(AND([.B374]<>"";[.C374]<>"");"";"ERR");"") -> 
B375: of:=IF( ISBLANK([$'03.Muestra'.$C$34]);"";[$'03.Muestra'.$C$34]) ->  | C375: of:=IF( ISBLANK([$'03.Muestra'.$E$34]);"";[$'03.Muestra'.$E$34]) ->  | D375: of:=IF(AND([.B375]<>"";[.C375]<>"");"N/T";"") ->  | E375: of:=IF([.D375]<>"";IF(AND([.B375]<>"";[.C375]<>"");"";"ERR");"") -> 
B376: of:=IF( ISBLANK([$'03.Muestra'.$C$35]);"";[$'03.Muestra'.$C$35]) ->  | C376: of:=IF( ISBLANK([$'03.Muestra'.$E$35]);"";[$'03.Muestra'.$E$35]) ->  | D376: of:=IF(AND([.B376]<>"";[.C376]<>"");"N/T";"") ->  | E376: of:=IF([.D376]<>"";IF(AND([.B376]<>"";[.C376]<>"");"";"ERR");"") -> 
B377: of:=IF( ISBLANK([$'03.Muestra'.$C$36]);"";[$'03.Muestra'.$C$36]) ->  | C377: of:=IF( ISBLANK([$'03.Muestra'.$E$36]);"";[$'03.Muestra'.$E$36]) ->  | D377: of:=IF(AND([.B377]<>"";[.C377]<>"");"N/T";"") ->  | E377: of:=IF([.D377]<>"";IF(AND([.B377]<>"";[.C377]<>"");"";"ERR");"") -> 
B378: of:=IF( ISBLANK([$'03.Muestra'.$C$37]);"";[$'03.Muestra'.$C$37]) ->  | C378: of:=IF( ISBLANK([$'03.Muestra'.$E$37]);"";[$'03.Muestra'.$E$37]) ->  | D378: of:=IF(AND([.B378]<>"";[.C378]<>"");"N/T";"") ->  | E378: of:=IF([.D378]<>"";IF(AND([.B378]<>"";[.C378]<>"");"";"ERR");"") -> 
B381: AA | C381: 2.4.6 Encabezados y etiquetas | D381: Resultado
B382: of:=IF( ISBLANK([$'03.Muestra'.$C$8]);"";[$'03.Muestra'.$C$8]) ->  | C382: of:=IF( ISBLANK([$'03.Muestra'.$E$8]);"";[$'03.Muestra'.$E$8]) ->  | D382: of:=IF(AND([.B382]<>"";[.C382]<>"");"N/T";"") ->  | E382: of:=IF([.D382]<>"";IF(AND([.B382]<>"";[.C382]<>"");"";"ERR");"") ->  | F382: of:=TRANSPOSE([$'DATA - Oculta'.$U$9:$'DATA - Oculta'.$U$13]) -> N/T | G382: N/D | H382: N/A | I382: Falla | J382: Pasa | K382: En blanco
B383: of:=IF( ISBLANK([$'03.Muestra'.$C$9]);"";[$'03.Muestra'.$C$9]) ->  | C383: of:=IF( ISBLANK([$'03.Muestra'.$E$9]);"";[$'03.Muestra'.$E$9]) ->  | D383: of:=IF(AND([.B383]<>"";[.C383]<>"");"N/T";"") ->  | E383: of:=IF([.D383]<>"";IF(AND([.B383]<>"";[.C383]<>"");"";"ERR");"") ->  | F383: of:=COUNTIF([.$D382]:INDIRECT("$D" &  SUM(ROW()-1;[$'03.Muestra'.$D$40])-1);[.F382]) -> 0 | G383: of:=COUNTIF([.$D382]:INDIRECT("$D" &  SUM(ROW()-1;[$'03.Muestra'.$D$40])-1);[.G382]) -> 0 | H383: of:=COUNTIF([.$D382]:INDIRECT("$D" &  SUM(ROW()-1;[$'03.Muestra'.$D$40])-1);[.H382]) -> 0 | I383: of:=COUNTIF([.$D382]:INDIRECT("$D" &  SUM(ROW()-1;[$'03.Muestra'.$D$40])-1);[.I382]) -> 0 | J383: of:=COUNTIF([.$D382]:INDIRECT("$D" &  SUM(ROW()-1;[$'03.Muestra'.$D$40])-1);[.J382]) -> 0 | K383: of:=IF([$'03.Muestra'.$D$40]=0;0;COUNTBLANK([.$D382]:INDIRECT("$D" &  SUM(ROW()-1;[$'03.Muestra'.$D$40])-1))) -> 0
B384: of:=IF( ISBLANK([$'03.Muestra'.$C$10]);"";[$'03.Muestra'.$C$10]) ->  | C384: of:=IF( ISBLANK([$'03.Muestra'.$E$10]);"";[$'03.Muestra'.$E$10]) ->  | D384: of:=IF(AND([.B384]<>"";[.C384]<>"");"N/T";"") ->  | E384: of:=IF([.D384]<>"";IF(AND([.B384]<>"";[.C384]<>"");"";"ERR");"") -> 
B385: of:=IF( ISBLANK([$'03.Muestra'.$C$11]);"";[$'03.Muestra'.$C$11]) ->  | C385: of:=IF( ISBLANK([$'03.Muestra'.$E$11]);"";[$'03.Muestra'.$E$11]) ->  | D385: of:=IF(AND([.B385]<>"";[.C385]<>"");"N/T";"") ->  | E385: of:=IF([.D385]<>"";IF(AND([.B385]<>"";[.C385]<>"");"";"ERR");"") -> 
B386: of:=IF( ISBLANK([$'03.Muestra'.$C$12]);"";[$'03.Muestra'.$C$12]) ->  | C386: of:=IF( ISBLANK([$'03.Muestra'.$E$12]);"";[$'03.Muestra'.$E$12]) ->  | D386: of:=IF(AND([.B386]<>"";[.C386]<>"");"N/T";"") ->  | E386: of:=IF([.D386]<>"";IF(AND([.B386]<>"";[.C386]<>"");"";"ERR");"") -> 
B387: of:=IF( ISBLANK([$'03.Muestra'.$C$13]);"";[$'03.Muestra'.$C$13]) ->  | C387: of:=IF( ISBLANK([$'03.Muestra'.$E$13]);"";[$'03.Muestra'.$E$13]) ->  | D387: of:=IF(AND([.B387]<>"";[.C387]<>"");"N/T";"") ->  | E387: of:=IF([.D387]<>"";IF(AND([.B387]<>"";[.C387]<>"");"";"ERR");"") -> 
B388: of:=IF( ISBLANK([$'03.Muestra'.$C$14]);"";[$'03.Muestra'.$C$14]) ->  | C388: of:=IF( ISBLANK([$'03.Muestra'.$E$14]);"";[$'03.Muestra'.$E$14]) ->  | D388: of:=IF(AND([.B388]<>"";[.C388]<>"");"N/T";"") ->  | E388: of:=IF([.D388]<>"";IF(AND([.B388]<>"";[.C388]<>"");"";"ERR");"") -> 
B389: of:=IF( ISBLANK([$'03.Muestra'.$C$15]);"";[$'03.Muestra'.$C$15]) ->  | C389: of:=IF( ISBLANK([$'03.Muestra'.$E$15]);"";[$'03.Muestra'.$E$15]) ->  | D389: of:=IF(AND([.B389]<>"";[.C389]<>"");"N/T";"") ->  | E389: of:=IF([.D389]<>"";IF(AND([.B389]<>"";[.C389]<>"");"";"ERR");"") -> 
B390: of:=IF( ISBLANK([$'03.Muestra'.$C$16]);"";[$'03.Muestra'.$C$16]) ->  | C390: of:=IF( ISBLANK([$'03.Muestra'.$E$16]);"";[$'03.Muestra'.$E$16]) ->  | D390: of:=IF(AND([.B390]<>"";[.C390]<>"");"N/T";"") ->  | E390: of:=IF([.D390]<>"";IF(AND([.B390]<>"";[.C390]<>"");"";"ERR");"") -> 
B391: of:=IF( ISBLANK([$'03.Muestra'.$C$17]);"";[$'03.Muestra'.$C$17]) ->  | C391: of:=IF( ISBLANK([$'03.Muestra'.$E$17]);"";[$'03.Muestra'.$E$17]) ->  | D391: of:=IF(AND([.B391]<>"";[.C391]<>"");"N/T";"") ->  | E391: of:=IF([.D391]<>"";IF(AND([.B391]<>"";[.C391]<>"");"";"ERR");"") -> 
B392: of:=IF( ISBLANK([$'03.Muestra'.$C$18]);"";[$'03.Muestra'.$C$18]) ->  | C392: of:=IF( ISBLANK([$'03.Muestra'.$E$18]);"";[$'03.Muestra'.$E$18]) ->  | D392: of:=IF(AND([.B392]<>"";[.C392]<>"");"N/T";"") ->  | E392: of:=IF([.D392]<>"";IF(AND([.B392]<>"";[.C392]<>"");"";"ERR");"") -> 
B393: of:=IF( ISBLANK([$'03.Muestra'.$C$19]);"";[$'03.Muestra'.$C$19]) ->  | C393: of:=IF( ISBLANK([$'03.Muestra'.$E$19]);"";[$'03.Muestra'.$E$19]) ->  | D393: of:=IF(AND([.B393]<>"";[.C393]<>"");"N/T";"") ->  | E393: of:=IF([.D393]<>"";IF(AND([.B393]<>"";[.C393]<>"");"";"ERR");"") -> 
B394: of:=IF( ISBLANK([$'03.Muestra'.$C$20]);"";[$'03.Muestra'.$C$20]) ->  | C394: of:=IF( ISBLANK([$'03.Muestra'.$E$20]);"";[$'03.Muestra'.$E$20]) ->  | D394: of:=IF(AND([.B394]<>"";[.C394]<>"");"N/T";"") ->  | E394: of:=IF([.D394]<>"";IF(AND([.B394]<>"";[.C394]<>"");"";"ERR");"") -> 
B395: of:=IF( ISBLANK([$'03.Muestra'.$C$21]);"";[$'03.Muestra'.$C$21]) ->  | C395: of:=IF( ISBLANK([$'03.Muestra'.$E$21]);"";[$'03.Muestra'.$E$21]) ->  | D395: of:=IF(AND([.B395]<>"";[.C395]<>"");"N/T";"") ->  | E395: of:=IF([.D395]<>"";IF(AND([.B395]<>"";[.C395]<>"");"";"ERR");"") -> 
B396: of:=IF( ISBLANK([$'03.Muestra'.$C$22]);"";[$'03.Muestra'.$C$22]) ->  | C396: of:=IF( ISBLANK([$'03.Muestra'.$E$22]);"";[$'03.Muestra'.$E$22]) ->  | D396: of:=IF(AND([.B396]<>"";[.C396]<>"");"N/T";"") ->  | E396: of:=IF([.D396]<>"";IF(AND([.B396]<>"";[.C396]<>"");"";"ERR");"") -> 
B397: of:=IF( ISBLANK([$'03.Muestra'.$C$23]);"";[$'03.Muestra'.$C$23]) ->  | C397: of:=IF( ISBLANK([$'03.Muestra'.$E$23]);"";[$'03.Muestra'.$E$23]) ->  | D397: of:=IF(AND([.B397]<>"";[.C397]<>"");"N/T";"") ->  | E397: of:=IF([.D397]<>"";IF(AND([.B397]<>"";[.C397]<>"");"";"ERR");"") -> 
B398: of:=IF( ISBLANK([$'03.Muestra'.$C$24]);"";[$'03.Muestra'.$C$24]) ->  | C398: of:=IF( ISBLANK([$'03.Muestra'.$E$24]);"";[$'03.Muestra'.$E$24]) ->  | D398: of:=IF(AND([.B398]<>"";[.C398]<>"");"N/T";"") ->  | E398: of:=IF([.D398]<>"";IF(AND([.B398]<>"";[.C398]<>"");"";"ERR");"") -> 
B399: of:=IF( ISBLANK([$'03.Muestra'.$C$25]);"";[$'03.Muestra'.$C$25]) ->  | C399: of:=IF( ISBLANK([$'03.Muestra'.$E$25]);"";[$'03.Muestra'.$E$25]) ->  | D399: of:=IF(AND([.B399]<>"";[.C399]<>"");"N/T";"") ->  | E399: of:=IF([.D399]<>"";IF(AND([.B399]<>"";[.C399]<>"");"";"ERR");"") -> 
B400: of:=IF( ISBLANK([$'03.Muestra'.$C$26]);"";[$'03.Muestra'.$C$26]) ->  | C400: of:=IF( ISBLANK([$'03.Muestra'.$E$26]);"";[$'03.Muestra'.$E$26]) ->  | D400: of:=IF(AND([.B400]<>"";[.C400]<>"");"N/T";"") ->  | E400: of:=IF([.D400]<>"";IF(AND([.B400]<>"";[.C400]<>"");"";"ERR");"") -> 
B401: of:=IF( ISBLANK([$'03.Muestra'.$C$27]);"";[$'03.Muestra'.$C$27]) ->  | C401: of:=IF( ISBLANK([$'03.Muestra'.$E$27]);"";[$'03.Muestra'.$E$27]) ->  | D401: of:=IF(AND([.B401]<>"";[.C401]<>"");"N/T";"") ->  | E401: of:=IF([.D401]<>"";IF(AND([.B401]<>"";[.C401]<>"");"";"ERR");"") -> 
B402: of:=IF( ISBLANK([$'03.Muestra'.$C$28]);"";[$'03.Muestra'.$C$28]) ->  | C402: of:=IF( ISBLANK([$'03.Muestra'.$E$28]);"";[$'03.Muestra'.$E$28]) ->  | D402: of:=IF(AND([.B402]<>"";[.C402]<>"");"N/T";"") ->  | E402: of:=IF([.D402]<>"";IF(AND([.B402]<>"";[.C402]<>"");"";"ERR");"") -> 
B403: of:=IF( ISBLANK([$'03.Muestra'.$C$29]);"";[$'03.Muestra'.$C$29]) ->  | C403: of:=IF( ISBLANK([$'03.Muestra'.$E$29]);"";[$'03.Muestra'.$E$29]) ->  | D403: of:=IF(AND([.B403]<>"";[.C403]<>"");"N/T";"") ->  | E403: of:=IF([.D403]<>"";IF(AND([.B403]<>"";[.C403]<>"");"";"ERR");"") -> 
B404: of:=IF( ISBLANK([$'03.Muestra'.$C$30]);"";[$'03.Muestra'.$C$30]) ->  | C404: of:=IF( ISBLANK([$'03.Muestra'.$E$30]);"";[$'03.Muestra'.$E$30]) ->  | D404: of:=IF(AND([.B404]<>"";[.C404]<>"");"N/T";"") ->  | E404: of:=IF([.D404]<>"";IF(AND([.B404]<>"";[.C404]<>"");"";"ERR");"") -> 
B405: of:=IF( ISBLANK([$'03.Muestra'.$C$31]);"";[$'03.Muestra'.$C$31]) ->  | C405: of:=IF( ISBLANK([$'03.Muestra'.$E$31]);"";[$'03.Muestra'.$E$31]) ->  | D405: of:=IF(AND([.B405]<>"";[.C405]<>"");"N/T";"") ->  | E405: of:=IF([.D405]<>"";IF(AND([.B405]<>"";[.C405]<>"");"";"ERR");"") -> 
B406: of:=IF( ISBLANK([$'03.Muestra'.$C$32]);"";[$'03.Muestra'.$C$32]) ->  | C406: of:=IF( ISBLANK([$'03.Muestra'.$E$32]);"";[$'03.Muestra'.$E$32]) ->  | D406: of:=IF(AND([.B406]<>"";[.C406]<>"");"N/T";"") ->  | E406: of:=IF([.D406]<>"";IF(AND([.B406]<>"";[.C406]<>"");"";"ERR");"") -> 
B407: of:=IF( ISBLANK([$'03.Muestra'.$C$33]);"";[$'03.Muestra'.$C$33]) ->  | C407: of:=IF( ISBLANK([$'03.Muestra'.$E$33]);"";[$'03.Muestra'.$E$33]) ->  | D407: of:=IF(AND([.B407]<>"";[.C407]<>"");"N/T";"") ->  | E407: of:=IF([.D407]<>"";IF(AND([.B407]<>"";[.C407]<>"");"";"ERR");"") -> 
B408: of:=IF( ISBLANK([$'03.Muestra'.$C$34]);"";[$'03.Muestra'.$C$34]) ->  | C408: of:=IF( ISBLANK([$'03.Muestra'.$E$34]);"";[$'03.Muestra'.$E$34]) ->  | D408: of:=IF(AND([.B408]<>"";[.C408]<>"");"N/T";"") ->  | E408: of:=IF([.D408]<>"";IF(AND([.B408]<>"";[.C408]<>"");"";"ERR");"") -> 
B409: of:=IF( ISBLANK([$'03.Muestra'.$C$35]);"";[$'03.Muestra'.$C$35]) ->  | C409: of:=IF( ISBLANK([$'03.Muestra'.$E$35]);"";[$'03.Muestra'.$E$35]) ->  | D409: of:=IF(AND([.B409]<>"";[.C409]<>"");"N/T";"") ->  | E409: of:=IF([.D409]<>"";IF(AND([.B409]<>"";[.C409]<>"");"";"ERR");"") -> 
B410: of:=IF( ISBLANK([$'03.Muestra'.$C$36]);"";[$'03.Muestra'.$C$36]) ->  | C410: of:=IF( ISBLANK([$'03.Muestra'.$E$36]);"";[$'03.Muestra'.$E$36]) ->  | D410: of:=IF(AND([.B410]<>"";[.C410]<>"");"N/T";"") ->  | E410: of:=IF([.D410]<>"";IF(AND([.B410]<>"";[.C410]<>"");"";"ERR");"") -> 
B411: of:=IF( ISBLANK([$'03.Muestra'.$C$37]);"";[$'03.Muestra'.$C$37]) ->  | C411: of:=IF( ISBLANK([$'03.Muestra'.$E$37]);"";[$'03.Muestra'.$E$37]) ->  | D411: of:=IF(AND([.B411]<>"";[.C411]<>"");"N/T";"") ->  | E411: of:=IF([.D411]<>"";IF(AND([.B411]<>"";[.C411]<>"");"";"ERR");"") -> 
B414: AA | C414: 2.4.7 Foco visible | D414: Resultado
B415: of:=IF( ISBLANK([$'03.Muestra'.$C$8]);"";[$'03.Muestra'.$C$8]) ->  | C415: of:=IF( ISBLANK([$'03.Muestra'.$E$8]);"";[$'03.Muestra'.$E$8]) ->  | D415: of:=IF(AND([.B415]<>"";[.C415]<>"");"N/T";"") ->  | E415: of:=IF([.D415]<>"";IF(AND([.B415]<>"";[.C415]<>"");"";"ERR");"") ->  | F415: of:=TRANSPOSE([$'DATA - Oculta'.$U$9:$'DATA - Oculta'.$U$13]) -> N/T | G415: N/D | H415: N/A | I415: Falla | J415: Pasa | K415: En blanco
B416: of:=IF( ISBLANK([$'03.Muestra'.$C$9]);"";[$'03.Muestra'.$C$9]) ->  | C416: of:=IF( ISBLANK([$'03.Muestra'.$E$9]);"";[$'03.Muestra'.$E$9]) ->  | D416: of:=IF(AND([.B416]<>"";[.C416]<>"");"N/T";"") ->  | E416: of:=IF([.D416]<>"";IF(AND([.B416]<>"";[.C416]<>"");"";"ERR");"") ->  | F416: of:=COUNTIF([.$D415]:INDIRECT("$D" &  SUM(ROW()-1;[$'03.Muestra'.$D$40])-1);[.F415]) -> 0 | G416: of:=COUNTIF([.$D415]:INDIRECT("$D" &  SUM(ROW()-1;[$'03.Muestra'.$D$40])-1);[.G415]) -> 0 | H416: of:=COUNTIF([.$D415]:INDIRECT("$D" &  SUM(ROW()-1;[$'03.Muestra'.$D$40])-1);[.H415]) -> 0 | I416: of:=COUNTIF([.$D415]:INDIRECT("$D" &  SUM(ROW()-1;[$'03.Muestra'.$D$40])-1);[.I415]) -> 0 | J416: of:=COUNTIF([.$D415]:INDIRECT("$D" &  SUM(ROW()-1;[$'03.Muestra'.$D$40])-1);[.J415]) -> 0 | K416: of:=IF([$'03.Muestra'.$D$40]=0;0;COUNTBLANK([.$D415]:INDIRECT("$D" &  SUM(ROW()-1;[$'03.Muestra'.$D$40])-1))) -> 0
B417: of:=IF( ISBLANK([$'03.Muestra'.$C$10]);"";[$'03.Muestra'.$C$10]) ->  | C417: of:=IF( ISBLANK([$'03.Muestra'.$E$10]);"";[$'03.Muestra'.$E$10]) ->  | D417: of:=IF(AND([.B417]<>"";[.C417]<>"");"N/T";"") ->  | E417: of:=IF([.D417]<>"";IF(AND([.B417]<>"";[.C417]<>"");"";"ERR");"") -> 
B418: of:=IF( ISBLANK([$'03.Muestra'.$C$11]);"";[$'03.Muestra'.$C$11]) ->  | C418: of:=IF( ISBLANK([$'03.Muestra'.$E$11]);"";[$'03.Muestra'.$E$11]) ->  | D418: of:=IF(AND([.B418]<>"";[.C418]<>"");"N/T";"") ->  | E418: of:=IF([.D418]<>"";IF(AND([.B418]<>"";[.C418]<>"");"";"ERR");"") -> 
B419: of:=IF( ISBLANK([$'03.Muestra'.$C$12]);"";[$'03.Muestra'.$C$12]) ->  | C419: of:=IF( ISBLANK([$'03.Muestra'.$E$12]);"";[$'03.Muestra'.$E$12]) ->  | D419: of:=IF(AND([.B419]<>"";[.C419]<>"");"N/T";"") ->  | E419: of:=IF([.D419]<>"";IF(AND([.B419]<>"";[.C419]<>"");"";"ERR");"") -> 
B420: of:=IF( ISBLANK([$'03.Muestra'.$C$13]);"";[$'03.Muestra'.$C$13]) ->  | C420: of:=IF( ISBLANK([$'03.Muestra'.$E$13]);"";[$'03.Muestra'.$E$13]) ->  | D420: of:=IF(AND([.B420]<>"";[.C420]<>"");"N/T";"") ->  | E420: of:=IF([.D420]<>"";IF(AND([.B420]<>"";[.C420]<>"");"";"ERR");"") -> 
B421: of:=IF( ISBLANK([$'03.Muestra'.$C$14]);"";[$'03.Muestra'.$C$14]) ->  | C421: of:=IF( ISBLANK([$'03.Muestra'.$E$14]);"";[$'03.Muestra'.$E$14]) ->  | D421: of:=IF(AND([.B421]<>"";[.C421]<>"");"N/T";"") ->  | E421: of:=IF([.D421]<>"";IF(AND([.B421]<>"";[.C421]<>"");"";"ERR");"") -> 
B422: of:=IF( ISBLANK([$'03.Muestra'.$C$15]);"";[$'03.Muestra'.$C$15]) ->  | C422: of:=IF( ISBLANK([$'03.Muestra'.$E$15]);"";[$'03.Muestra'.$E$15]) ->  | D422: of:=IF(AND([.B422]<>"";[.C422]<>"");"N/T";"") ->  | E422: of:=IF([.D422]<>"";IF(AND([.B422]<>"";[.C422]<>"");"";"ERR");"") -> 
B423: of:=IF( ISBLANK([$'03.Muestra'.$C$16]);"";[$'03.Muestra'.$C$16]) ->  | C423: of:=IF( ISBLANK([$'03.Muestra'.$E$16]);"";[$'03.Muestra'.$E$16]) ->  | D423: of:=IF(AND([.B423]<>"";[.C423]<>"");"N/T";"") ->  | E423: of:=IF([.D423]<>"";IF(AND([.B423]<>"";[.C423]<>"");"";"ERR");"") -> 
B424: of:=IF( ISBLANK([$'03.Muestra'.$C$17]);"";[$'03.Muestra'.$C$17]) ->  | C424: of:=IF( ISBLANK([$'03.Muestra'.$E$17]);"";[$'03.Muestra'.$E$17]) ->  | D424: of:=IF(AND([.B424]<>"";[.C424]<>"");"N/T";"") ->  | E424: of:=IF([.D424]<>"";IF(AND([.B424]<>"";[.C424]<>"");"";"ERR");"") -> 
B425: of:=IF( ISBLANK([$'03.Muestra'.$C$18]);"";[$'03.Muestra'.$C$18]) ->  | C425: of:=IF( ISBLANK([$'03.Muestra'.$E$18]);"";[$'03.Muestra'.$E$18]) ->  | D425: of:=IF(AND([.B425]<>"";[.C425]<>"");"N/T";"") ->  | E425: of:=IF([.D425]<>"";IF(AND([.B425]<>"";[.C425]<>"");"";"ERR");"") -> 
B426: of:=IF( ISBLANK([$'03.Muestra'.$C$19]);"";[$'03.Muestra'.$C$19]) ->  | C426: of:=IF( ISBLANK([$'03.Muestra'.$E$19]);"";[$'03.Muestra'.$E$19]) ->  | D426: of:=IF(AND([.B426]<>"";[.C426]<>"");"N/T";"") ->  | E426: of:=IF([.D426]<>"";IF(AND([.B426]<>"";[.C426]<>"");"";"ERR");"") -> 
B427: of:=IF( ISBLANK([$'03.Muestra'.$C$20]);"";[$'03.Muestra'.$C$20]) ->  | C427: of:=IF( ISBLANK([$'03.Muestra'.$E$20]);"";[$'03.Muestra'.$E$20]) ->  | D427: of:=IF(AND([.B427]<>"";[.C427]<>"");"N/T";"") ->  | E427: of:=IF([.D427]<>"";IF(AND([.B427]<>"";[.C427]<>"");"";"ERR");"") -> 
B428: of:=IF( ISBLANK([$'03.Muestra'.$C$21]);"";[$'03.Muestra'.$C$21]) ->  | C428: of:=IF( ISBLANK([$'03.Muestra'.$E$21]);"";[$'03.Muestra'.$E$21]) ->  | D428: of:=IF(AND([.B428]<>"";[.C428]<>"");"N/T";"") ->  | E428: of:=IF([.D428]<>"";IF(AND([.B428]<>"";[.C428]<>"");"";"ERR");"") -> 
B429: of:=IF( ISBLANK([$'03.Muestra'.$C$22]);"";[$'03.Muestra'.$C$22]) ->  | C429: of:=IF( ISBLANK([$'03.Muestra'.$E$22]);"";[$'03.Muestra'.$E$22]) ->  | D429: of:=IF(AND([.B429]<>"";[.C429]<>"");"N/T";"") ->  | E429: of:=IF([.D429]<>"";IF(AND([.B429]<>"";[.C429]<>"");"";"ERR");"") -> 
B430: of:=IF( ISBLANK([$'03.Muestra'.$C$23]);"";[$'03.Muestra'.$C$23]) ->  | C430: of:=IF( ISBLANK([$'03.Muestra'.$E$23]);"";[$'03.Muestra'.$E$23]) ->  | D430: of:=IF(AND([.B430]<>"";[.C430]<>"");"N/T";"") ->  | E430: of:=IF([.D430]<>"";IF(AND([.B430]<>"";[.C430]<>"");"";"ERR");"") -> 
B431: of:=IF( ISBLANK([$'03.Muestra'.$C$24]);"";[$'03.Muestra'.$C$24]) ->  | C431: of:=IF( ISBLANK([$'03.Muestra'.$E$24]);"";[$'03.Muestra'.$E$24]) ->  | D431: of:=IF(AND([.B431]<>"";[.C431]<>"");"N/T";"") ->  | E431: of:=IF([.D431]<>"";IF(AND([.B431]<>"";[.C431]<>"");"";"ERR");"") -> 
B432: of:=IF( ISBLANK([$'03.Muestra'.$C$25]);"";[$'03.Muestra'.$C$25]) ->  | C432: of:=IF( ISBLANK([$'03.Muestra'.$E$25]);"";[$'03.Muestra'.$E$25]) ->  | D432: of:=IF(AND([.B432]<>"";[.C432]<>"");"N/T";"") ->  | E432: of:=IF([.D432]<>"";IF(AND([.B432]<>"";[.C432]<>"");"";"ERR");"") -> 
B433: of:=IF( ISBLANK([$'03.Muestra'.$C$26]);"";[$'03.Muestra'.$C$26]) ->  | C433: of:=IF( ISBLANK([$'03.Muestra'.$E$26]);"";[$'03.Muestra'.$E$26]) ->  | D433: of:=IF(AND([.B433]<>"";[.C433]<>"");"N/T";"") ->  | E433: of:=IF([.D433]<>"";IF(AND([.B433]<>"";[.C433]<>"");"";"ERR");"") -> 
B434: of:=IF( ISBLANK([$'03.Muestra'.$C$27]);"";[$'03.Muestra'.$C$27]) ->  | C434: of:=IF( ISBLANK([$'03.Muestra'.$E$27]);"";[$'03.Muestra'.$E$27]) ->  | D434: of:=IF(AND([.B434]<>"";[.C434]<>"");"N/T";"") ->  | E434: of:=IF([.D434]<>"";IF(AND([.B434]<>"";[.C434]<>"");"";"ERR");"") -> 
B435: of:=IF( ISBLANK([$'03.Muestra'.$C$28]);"";[$'03.Muestra'.$C$28]) ->  | C435: of:=IF( ISBLANK([$'03.Muestra'.$E$28]);"";[$'03.Muestra'.$E$28]) ->  | D435: of:=IF(AND([.B435]<>"";[.C435]<>"");"N/T";"") ->  | E435: of:=IF([.D435]<>"";IF(AND([.B435]<>"";[.C435]<>"");"";"ERR");"") -> 
B436: of:=IF( ISBLANK([$'03.Muestra'.$C$29]);"";[$'03.Muestra'.$C$29]) ->  | C436: of:=IF( ISBLANK([$'03.Muestra'.$E$29]);"";[$'03.Muestra'.$E$29]) ->  | D436: of:=IF(AND([.B436]<>"";[.C436]<>"");"N/T";"") ->  | E436: of:=IF([.D436]<>"";IF(AND([.B436]<>"";[.C436]<>"");"";"ERR");"") -> 
B437: of:=IF( ISBLANK([$'03.Muestra'.$C$30]);"";[$'03.Muestra'.$C$30]) ->  | C437: of:=IF( ISBLANK([$'03.Muestra'.$E$30]);"";[$'03.Muestra'.$E$30]) ->  | D437: of:=IF(AND([.B437]<>"";[.C437]<>"");"N/T";"") ->  | E437: of:=IF([.D437]<>"";IF(AND([.B437]<>"";[.C437]<>"");"";"ERR");"") -> 
B438: of:=IF( ISBLANK([$'03.Muestra'.$C$31]);"";[$'03.Muestra'.$C$31]) ->  | C438: of:=IF( ISBLANK([$'03.Muestra'.$E$31]);"";[$'03.Muestra'.$E$31]) ->  | D438: of:=IF(AND([.B438]<>"";[.C438]<>"");"N/T";"") ->  | E438: of:=IF([.D438]<>"";IF(AND([.B438]<>"";[.C438]<>"");"";"ERR");"") -> 
B439: of:=IF( ISBLANK([$'03.Muestra'.$C$32]);"";[$'03.Muestra'.$C$32]) ->  | C439: of:=IF( ISBLANK([$'03.Muestra'.$E$32]);"";[$'03.Muestra'.$E$32]) ->  | D439: of:=IF(AND([.B439]<>"";[.C439]<>"");"N/T";"") ->  | E439: of:=IF([.D439]<>"";IF(AND([.B439]<>"";[.C439]<>"");"";"ERR");"") -> 
B440: of:=IF( ISBLANK([$'03.Muestra'.$C$33]);"";[$'03.Muestra'.$C$33]) ->  | C440: of:=IF( ISBLANK([$'03.Muestra'.$E$33]);"";[$'03.Muestra'.$E$33]) ->  | D440: of:=IF(AND([.B440]<>"";[.C440]<>"");"N/T";"") ->  | E440: of:=IF([.D440]<>"";IF(AND([.B440]<>"";[.C440]<>"");"";"ERR");"") -> 
B441: of:=IF( ISBLANK([$'03.Muestra'.$C$34]);"";[$'03.Muestra'.$C$34]) ->  | C441: of:=IF( ISBLANK([$'03.Muestra'.$E$34]);"";[$'03.Muestra'.$E$34]) ->  | D441: of:=IF(AND([.B441]<>"";[.C441]<>"");"N/T";"") ->  | E441: of:=IF([.D441]<>"";IF(AND([.B441]<>"";[.C441]<>"");"";"ERR");"") -> 
B442: of:=IF( ISBLANK([$'03.Muestra'.$C$35]);"";[$'03.Muestra'.$C$35]) ->  | C442: of:=IF( ISBLANK([$'03.Muestra'.$E$35]);"";[$'03.Muestra'.$E$35]) ->  | D442: of:=IF(AND([.B442]<>"";[.C442]<>"");"N/T";"") ->  | E442: of:=IF([.D442]<>"";IF(AND([.B442]<>"";[.C442]<>"");"";"ERR");"") -> 
B443: of:=IF( ISBLANK([$'03.Muestra'.$C$36]);"";[$'03.Muestra'.$C$36]) ->  | C443: of:=IF( ISBLANK([$'03.Muestra'.$E$36]);"";[$'03.Muestra'.$E$36]) ->  | D443: of:=IF(AND([.B443]<>"";[.C443]<>"");"N/T";"") ->  | E443: of:=IF([.D443]<>"";IF(AND([.B443]<>"";[.C443]<>"");"";"ERR");"") -> 
B444: of:=IF( ISBLANK([$'03.Muestra'.$C$37]);"";[$'03.Muestra'.$C$37]) ->  | C444: of:=IF( ISBLANK([$'03.Muestra'.$E$37]);"";[$'03.Muestra'.$E$37]) ->  | D444: of:=IF(AND([.B444]<>"";[.C444]<>"");"N/T";"") ->  | E444: of:=IF([.D444]<>"";IF(AND([.B444]<>"";[.C444]<>"");"";"ERR");"") -> 
B447: A | C447: 2.5.1 Gestos del puntero | D447: Resultado
B448: of:=IF( ISBLANK([$'03.Muestra'.$C$8]);"";[$'03.Muestra'.$C$8]) ->  | C448: of:=IF( ISBLANK([$'03.Muestra'.$E$8]);"";[$'03.Muestra'.$E$8]) ->  | D448: of:=IF(AND([.B448]<>"";[.C448]<>"");"N/T";"") ->  | E448: of:=IF([.D448]<>"";IF(AND([.B448]<>"";[.C448]<>"");"";"ERR");"") ->  | F448: of:=TRANSPOSE([$'DATA - Oculta'.$U$9:$'DATA - Oculta'.$U$13]) -> N/T | G448: N/D | H448: N/A | I448: Falla | J448: Pasa | K448: En blanco
B449: of:=IF( ISBLANK([$'03.Muestra'.$C$9]);"";[$'03.Muestra'.$C$9]) ->  | C449: of:=IF( ISBLANK([$'03.Muestra'.$E$9]);"";[$'03.Muestra'.$E$9]) ->  | D449: of:=IF(AND([.B449]<>"";[.C449]<>"");"N/T";"") ->  | E449: of:=IF([.D449]<>"";IF(AND([.B449]<>"";[.C449]<>"");"";"ERR");"") ->  | F449: of:=COUNTIF([.$D448]:INDIRECT("$D" &  SUM(ROW()-1;[$'03.Muestra'.$D$40])-1);[.F448]) -> 0 | G449: of:=COUNTIF([.$D448]:INDIRECT("$D" &  SUM(ROW()-1;[$'03.Muestra'.$D$40])-1);[.G448]) -> 0 | H449: of:=COUNTIF([.$D448]:INDIRECT("$D" &  SUM(ROW()-1;[$'03.Muestra'.$D$40])-1);[.H448]) -> 0 | I449: of:=COUNTIF([.$D448]:INDIRECT("$D" &  SUM(ROW()-1;[$'03.Muestra'.$D$40])-1);[.I448]) -> 0 | J449: of:=COUNTIF([.$D448]:INDIRECT("$D" &  SUM(ROW()-1;[$'03.Muestra'.$D$40])-1);[.J448]) -> 0 | K449: of:=IF([$'03.Muestra'.$D$40]=0;0;COUNTBLANK([.$D448]:INDIRECT("$D" &  SUM(ROW()-1;[$'03.Muestra'.$D$40])-1))) -> 0
B450: of:=IF( ISBLANK([$'03.Muestra'.$C$10]);"";[$'03.Muestra'.$C$10]) ->  | C450: of:=IF( ISBLANK([$'03.Muestra'.$E$10]);"";[$'03.Muestra'.$E$10]) ->  | D450: of:=IF(AND([.B450]<>"";[.C450]<>"");"N/T";"") ->  | E450: of:=IF([.D450]<>"";IF(AND([.B450]<>"";[.C450]<>"");"";"ERR");"") -> 
B451: of:=IF( ISBLANK([$'03.Muestra'.$C$11]);"";[$'03.Muestra'.$C$11]) ->  | C451: of:=IF( ISBLANK([$'03.Muestra'.$E$11]);"";[$'03.Muestra'.$E$11]) ->  | D451: of:=IF(AND([.B451]<>"";[.C451]<>"");"N/T";"") ->  | E451: of:=IF([.D451]<>"";IF(AND([.B451]<>"";[.C451]<>"");"";"ERR");"") -> 
B452: of:=IF( ISBLANK([$'03.Muestra'.$C$12]);"";[$'03.Muestra'.$C$12]) ->  | C452: of:=IF( ISBLANK([$'03.Muestra'.$E$12]);"";[$'03.Muestra'.$E$12]) ->  | D452: of:=IF(AND([.B452]<>"";[.C452]<>"");"N/T";"") ->  | E452: of:=IF([.D452]<>"";IF(AND([.B452]<>"";[.C452]<>"");"";"ERR");"") -> 
B453: of:=IF( ISBLANK([$'03.Muestra'.$C$13]);"";[$'03.Muestra'.$C$13]) ->  | C453: of:=IF( ISBLANK([$'03.Muestra'.$E$13]);"";[$'03.Muestra'.$E$13]) ->  | D453: of:=IF(AND([.B453]<>"";[.C453]<>"");"N/T";"") ->  | E453: of:=IF([.D453]<>"";IF(AND([.B453]<>"";[.C453]<>"");"";"ERR");"") -> 
B454: of:=IF( ISBLANK([$'03.Muestra'.$C$14]);"";[$'03.Muestra'.$C$14]) ->  | C454: of:=IF( ISBLANK([$'03.Muestra'.$E$14]);"";[$'03.Muestra'.$E$14]) ->  | D454: of:=IF(AND([.B454]<>"";[.C454]<>"");"N/T";"") ->  | E454: of:=IF([.D454]<>"";IF(AND([.B454]<>"";[.C454]<>"");"";"ERR");"") -> 
B455: of:=IF( ISBLANK([$'03.Muestra'.$C$15]);"";[$'03.Muestra'.$C$15]) ->  | C455: of:=IF( ISBLANK([$'03.Muestra'.$E$15]);"";[$'03.Muestra'.$E$15]) ->  | D455: of:=IF(AND([.B455]<>"";[.C455]<>"");"N/T";"") ->  | E455: of:=IF([.D455]<>"";IF(AND([.B455]<>"";[.C455]<>"");"";"ERR");"") -> 
B456: of:=IF( ISBLANK([$'03.Muestra'.$C$16]);"";[$'03.Muestra'.$C$16]) ->  | C456: of:=IF( ISBLANK([$'03.Muestra'.$E$16]);"";[$'03.Muestra'.$E$16]) ->  | D456: of:=IF(AND([.B456]<>"";[.C456]<>"");"N/T";"") ->  | E456: of:=IF([.D456]<>"";IF(AND([.B456]<>"";[.C456]<>"");"";"ERR");"") -> 
B457: of:=IF( ISBLANK([$'03.Muestra'.$C$17]);"";[$'03.Muestra'.$C$17]) ->  | C457: of:=IF( ISBLANK([$'03.Muestra'.$E$17]);"";[$'03.Muestra'.$E$17]) ->  | D457: of:=IF(AND([.B457]<>"";[.C457]<>"");"N/T";"") ->  | E457: of:=IF([.D457]<>"";IF(AND([.B457]<>"";[.C457]<>"");"";"ERR");"") -> 
B458: of:=IF( ISBLANK([$'03.Muestra'.$C$18]);"";[$'03.Muestra'.$C$18]) ->  | C458: of:=IF( ISBLANK([$'03.Muestra'.$E$18]);"";[$'03.Muestra'.$E$18]) ->  | D458: of:=IF(AND([.B458]<>"";[.C458]<>"");"N/T";"") ->  | E458: of:=IF([.D458]<>"";IF(AND([.B458]<>"";[.C458]<>"");"";"ERR");"") -> 
B459: of:=IF( ISBLANK([$'03.Muestra'.$C$19]);"";[$'03.Muestra'.$C$19]) ->  | C459: of:=IF( ISBLANK([$'03.Muestra'.$E$19]);"";[$'03.Muestra'.$E$19]) ->  | D459: of:=IF(AND([.B459]<>"";[.C459]<>"");"N/T";"") ->  | E459: of:=IF([.D459]<>"";IF(AND([.B459]<>"";[.C459]<>"");"";"ERR");"") -> 
B460: of:=IF( ISBLANK([$'03.Muestra'.$C$20]);"";[$'03.Muestra'.$C$20]) ->  | C460: of:=IF( ISBLANK([$'03.Muestra'.$E$20]);"";[$'03.Muestra'.$E$20]) ->  | D460: of:=IF(AND([.B460]<>"";[.C460]<>"");"N/T";"") ->  | E460: of:=IF([.D460]<>"";IF(AND([.B460]<>"";[.C460]<>"");"";"ERR");"") -> 
B461: of:=IF( ISBLANK([$'03.Muestra'.$C$21]);"";[$'03.Muestra'.$C$21]) ->  | C461: of:=IF( ISBLANK([$'03.Muestra'.$E$21]);"";[$'03.Muestra'.$E$21]) ->  | D461: of:=IF(AND([.B461]<>"";[.C461]<>"");"N/T";"") ->  | E461: of:=IF([.D461]<>"";IF(AND([.B461]<>"";[.C461]<>"");"";"ERR");"") -> 
B462: of:=IF( ISBLANK([$'03.Muestra'.$C$22]);"";[$'03.Muestra'.$C$22]) ->  | C462: of:=IF( ISBLANK([$'03.Muestra'.$E$22]);"";[$'03.Muestra'.$E$22]) ->  | D462: of:=IF(AND([.B462]<>"";[.C462]<>"");"N/T";"") ->  | E462: of:=IF([.D462]<>"";IF(AND([.B462]<>"";[.C462]<>"");"";"ERR");"") -> 
B463: of:=IF( ISBLANK([$'03.Muestra'.$C$23]);"";[$'03.Muestra'.$C$23]) ->  | C463: of:=IF( ISBLANK([$'03.Muestra'.$E$23]);"";[$'03.Muestra'.$E$23]) ->  | D463: of:=IF(AND([.B463]<>"";[.C463]<>"");"N/T";"") ->  | E463: of:=IF([.D463]<>"";IF(AND([.B463]<>"";[.C463]<>"");"";"ERR");"") -> 
B464: of:=IF( ISBLANK([$'03.Muestra'.$C$24]);"";[$'03.Muestra'.$C$24]) ->  | C464: of:=IF( ISBLANK([$'03.Muestra'.$E$24]);"";[$'03.Muestra'.$E$24]) ->  | D464: of:=IF(AND([.B464]<>"";[.C464]<>"");"N/T";"") ->  | E464: of:=IF([.D464]<>"";IF(AND([.B464]<>"";[.C464]<>"");"";"ERR");"") -> 
B465: of:=IF( ISBLANK([$'03.Muestra'.$C$25]);"";[$'03.Muestra'.$C$25]) ->  | C465: of:=IF( ISBLANK([$'03.Muestra'.$E$25]);"";[$'03.Muestra'.$E$25]) ->  | D465: of:=IF(AND([.B465]<>"";[.C465]<>"");"N/T";"") ->  | E465: of:=IF([.D465]<>"";IF(AND([.B465]<>"";[.C465]<>"");"";"ERR");"") -> 
B466: of:=IF( ISBLANK([$'03.Muestra'.$C$26]);"";[$'03.Muestra'.$C$26]) ->  | C466: of:=IF( ISBLANK([$'03.Muestra'.$E$26]);"";[$'03.Muestra'.$E$26]) ->  | D466: of:=IF(AND([.B466]<>"";[.C466]<>"");"N/T";"") ->  | E466: of:=IF([.D466]<>"";IF(AND([.B466]<>"";[.C466]<>"");"";"ERR");"") -> 
B467: of:=IF( ISBLANK([$'03.Muestra'.$C$27]);"";[$'03.Muestra'.$C$27]) ->  | C467: of:=IF( ISBLANK([$'03.Muestra'.$E$27]);"";[$'03.Muestra'.$E$27]) ->  | D467: of:=IF(AND([.B467]<>"";[.C467]<>"");"N/T";"") ->  | E467: of:=IF([.D467]<>"";IF(AND([.B467]<>"";[.C467]<>"");"";"ERR");"") -> 
B468: of:=IF( ISBLANK([$'03.Muestra'.$C$28]);"";[$'03.Muestra'.$C$28]) ->  | C468: of:=IF( ISBLANK([$'03.Muestra'.$E$28]);"";[$'03.Muestra'.$E$28]) ->  | D468: of:=IF(AND([.B468]<>"";[.C468]<>"");"N/T";"") ->  | E468: of:=IF([.D468]<>"";IF(AND([.B468]<>"";[.C468]<>"");"";"ERR");"") -> 
B469: of:=IF( ISBLANK([$'03.Muestra'.$C$29]);"";[$'03.Muestra'.$C$29]) ->  | C469: of:=IF( ISBLANK([$'03.Muestra'.$E$29]);"";[$'03.Muestra'.$E$29]) ->  | D469: of:=IF(AND([.B469]<>"";[.C469]<>"");"N/T";"") ->  | E469: of:=IF([.D469]<>"";IF(AND([.B469]<>"";[.C469]<>"");"";"ERR");"") -> 
B470: of:=IF( ISBLANK([$'03.Muestra'.$C$30]);"";[$'03.Muestra'.$C$30]) ->  | C470: of:=IF( ISBLANK([$'03.Muestra'.$E$30]);"";[$'03.Muestra'.$E$30]) ->  | D470: of:=IF(AND([.B470]<>"";[.C470]<>"");"N/T";"") ->  | E470: of:=IF([.D470]<>"";IF(AND([.B470]<>"";[.C470]<>"");"";"ERR");"") -> 
B471: of:=IF( ISBLANK([$'03.Muestra'.$C$31]);"";[$'03.Muestra'.$C$31]) ->  | C471: of:=IF( ISBLANK([$'03.Muestra'.$E$31]);"";[$'03.Muestra'.$E$31]) ->  | D471: of:=IF(AND([.B471]<>"";[.C471]<>"");"N/T";"") ->  | E471: of:=IF([.D471]<>"";IF(AND([.B471]<>"";[.C471]<>"");"";"ERR");"") -> 
B472: of:=IF( ISBLANK([$'03.Muestra'.$C$32]);"";[$'03.Muestra'.$C$32]) ->  | C472: of:=IF( ISBLANK([$'03.Muestra'.$E$32]);"";[$'03.Muestra'.$E$32]) ->  | D472: of:=IF(AND([.B472]<>"";[.C472]<>"");"N/T";"") ->  | E472: of:=IF([.D472]<>"";IF(AND([.B472]<>"";[.C472]<>"");"";"ERR");"") -> 
B473: of:=IF( ISBLANK([$'03.Muestra'.$C$33]);"";[$'03.Muestra'.$C$33]) ->  | C473: of:=IF( ISBLANK([$'03.Muestra'.$E$33]);"";[$'03.Muestra'.$E$33]) ->  | D473: of:=IF(AND([.B473]<>"";[.C473]<>"");"N/T";"") ->  | E473: of:=IF([.D473]<>"";IF(AND([.B473]<>"";[.C473]<>"");"";"ERR");"") -> 
B474: of:=IF( ISBLANK([$'03.Muestra'.$C$34]);"";[$'03.Muestra'.$C$34]) ->  | C474: of:=IF( ISBLANK([$'03.Muestra'.$E$34]);"";[$'03.Muestra'.$E$34]) ->  | D474: of:=IF(AND([.B474]<>"";[.C474]<>"");"N/T";"") ->  | E474: of:=IF([.D474]<>"";IF(AND([.B474]<>"";[.C474]<>"");"";"ERR");"") -> 
B475: of:=IF( ISBLANK([$'03.Muestra'.$C$35]);"";[$'03.Muestra'.$C$35]) ->  | C475: of:=IF( ISBLANK([$'03.Muestra'.$E$35]);"";[$'03.Muestra'.$E$35]) ->  | D475: of:=IF(AND([.B475]<>"";[.C475]<>"");"N/T";"") ->  | E475: of:=IF([.D475]<>"";IF(AND([.B475]<>"";[.C475]<>"");"";"ERR");"") -> 
B476: of:=IF( ISBLANK([$'03.Muestra'.$C$36]);"";[$'03.Muestra'.$C$36]) ->  | C476: of:=IF( ISBLANK([$'03.Muestra'.$E$36]);"";[$'03.Muestra'.$E$36]) ->  | D476: of:=IF(AND([.B476]<>"";[.C476]<>"");"N/T";"") ->  | E476: of:=IF([.D476]<>"";IF(AND([.B476]<>"";[.C476]<>"");"";"ERR");"") -> 
B477: of:=IF( ISBLANK([$'03.Muestra'.$C$37]);"";[$'03.Muestra'.$C$37]) ->  | C477: of:=IF( ISBLANK([$'03.Muestra'.$E$37]);"";[$'03.Muestra'.$E$37]) ->  | D477: of:=IF(AND([.B477]<>"";[.C477]<>"");"N/T";"") ->  | E477: of:=IF([.D477]<>"";IF(AND([.B477]<>"";[.C477]<>"");"";"ERR");"") -> 
B480: A | C480: 2.5.2 CancelaciÃ³n del puntero | D480: Resultado
B481: of:=IF( ISBLANK([$'03.Muestra'.$C$8]);"";[$'03.Muestra'.$C$8]) ->  | C481: of:=IF( ISBLANK([$'03.Muestra'.$E$8]);"";[$'03.Muestra'.$E$8]) ->  | D481: of:=IF(AND([.B481]<>"";[.C481]<>"");"N/T";"") ->  | E481: of:=IF([.D481]<>"";IF(AND([.B481]<>"";[.C481]<>"");"";"ERR");"") ->  | F481: of:=TRANSPOSE([$'DATA - Oculta'.$U$9:$'DATA - Oculta'.$U$13]) -> N/T | G481: N/D | H481: N/A | I481: Falla | J481: Pasa | K481: En blanco
B482: of:=IF( ISBLANK([$'03.Muestra'.$C$9]);"";[$'03.Muestra'.$C$9]) ->  | C482: of:=IF( ISBLANK([$'03.Muestra'.$E$9]);"";[$'03.Muestra'.$E$9]) ->  | D482: of:=IF(AND([.B482]<>"";[.C482]<>"");"N/T";"") ->  | E482: of:=IF([.D482]<>"";IF(AND([.B482]<>"";[.C482]<>"");"";"ERR");"") ->  | F482: of:=COUNTIF([.$D481]:INDIRECT("$D" &  SUM(ROW()-1;[$'03.Muestra'.$D$40])-1);[.F481]) -> 0 | G482: of:=COUNTIF([.$D481]:INDIRECT("$D" &  SUM(ROW()-1;[$'03.Muestra'.$D$40])-1);[.G481]) -> 0 | H482: of:=COUNTIF([.$D481]:INDIRECT("$D" &  SUM(ROW()-1;[$'03.Muestra'.$D$40])-1);[.H481]) -> 0 | I482: of:=COUNTIF([.$D481]:INDIRECT("$D" &  SUM(ROW()-1;[$'03.Muestra'.$D$40])-1);[.I481]) -> 0 | J482: of:=COUNTIF([.$D481]:INDIRECT("$D" &  SUM(ROW()-1;[$'03.Muestra'.$D$40])-1);[.J481]) -> 0 | K482: of:=IF([$'03.Muestra'.$D$40]=0;0;COUNTBLANK([.$D481]:INDIRECT("$D" &  SUM(ROW()-1;[$'03.Muestra'.$D$40])-1))) -> 0
B483: of:=IF( ISBLANK([$'03.Muestra'.$C$10]);"";[$'03.Muestra'.$C$10]) ->  | C483: of:=IF( ISBLANK([$'03.Muestra'.$E$10]);"";[$'03.Muestra'.$E$10]) ->  | D483: of:=IF(AND([.B483]<>"";[.C483]<>"");"N/T";"") ->  | E483: of:=IF([.D483]<>"";IF(AND([.B483]<>"";[.C483]<>"");"";"ERR");"") -> 
B484: of:=IF( ISBLANK([$'03.Muestra'.$C$11]);"";[$'03.Muestra'.$C$11]) ->  | C484: of:=IF( ISBLANK([$'03.Muestra'.$E$11]);"";[$'03.Muestra'.$E$11]) ->  | D484: of:=IF(AND([.B484]<>"";[.C484]<>"");"N/T";"") ->  | E484: of:=IF([.D484]<>"";IF(AND([.B484]<>"";[.C484]<>"");"";"ERR");"") -> 
B485: of:=IF( ISBLANK([$'03.Muestra'.$C$12]);"";[$'03.Muestra'.$C$12]) ->  | C485: of:=IF( ISBLANK([$'03.Muestra'.$E$12]);"";[$'03.Muestra'.$E$12]) ->  | D485: of:=IF(AND([.B485]<>"";[.C485]<>"");"N/T";"") ->  | E485: of:=IF([.D485]<>"";IF(AND([.B485]<>"";[.C485]<>"");"";"ERR");"") -> 
B486: of:=IF( ISBLANK([$'03.Muestra'.$C$13]);"";[$'03.Muestra'.$C$13]) ->  | C486: of:=IF( ISBLANK([$'03.Muestra'.$E$13]);"";[$'03.Muestra'.$E$13]) ->  | D486: of:=IF(AND([.B486]<>"";[.C486]<>"");"N/T";"") ->  | E486: of:=IF([.D486]<>"";IF(AND([.B486]<>"";[.C486]<>"");"";"ERR");"") -> 
B487: of:=IF( ISBLANK([$'03.Muestra'.$C$14]);"";[$'03.Muestra'.$C$14]) ->  | C487: of:=IF( ISBLANK([$'03.Muestra'.$E$14]);"";[$'03.Muestra'.$E$14]) ->  | D487: of:=IF(AND([.B487]<>"";[.C487]<>"");"N/T";"") ->  | E487: of:=IF([.D487]<>"";IF(AND([.B487]<>"";[.C487]<>"");"";"ERR");"") -> 
B488: of:=IF( ISBLANK([$'03.Muestra'.$C$15]);"";[$'03.Muestra'.$C$15]) ->  | C488: of:=IF( ISBLANK([$'03.Muestra'.$E$15]);"";[$'03.Muestra'.$E$15]) ->  | D488: of:=IF(AND([.B488]<>"";[.C488]<>"");"N/T";"") ->  | E488: of:=IF([.D488]<>"";IF(AND([.B488]<>"";[.C488]<>"");"";"ERR");"") -> 
B489: of:=IF( ISBLANK([$'03.Muestra'.$C$16]);"";[$'03.Muestra'.$C$16]) ->  | C489: of:=IF( ISBLANK([$'03.Muestra'.$E$16]);"";[$'03.Muestra'.$E$16]) ->  | D489: of:=IF(AND([.B489]<>"";[.C489]<>"");"N/T";"") ->  | E489: of:=IF([.D489]<>"";IF(AND([.B489]<>"";[.C489]<>"");"";"ERR");"") -> 
B490: of:=IF( ISBLANK([$'03.Muestra'.$C$17]);"";[$'03.Muestra'.$C$17]) ->  | C490: of:=IF( ISBLANK([$'03.Muestra'.$E$17]);"";[$'03.Muestra'.$E$17]) ->  | D490: of:=IF(AND([.B490]<>"";[.C490]<>"");"N/T";"") ->  | E490: of:=IF([.D490]<>"";IF(AND([.B490]<>"";[.C490]<>"");"";"ERR");"") -> 
B491: of:=IF( ISBLANK([$'03.Muestra'.$C$18]);"";[$'03.Muestra'.$C$18]) ->  | C491: of:=IF( ISBLANK([$'03.Muestra'.$E$18]);"";[$'03.Muestra'.$E$18]) ->  | D491: of:=IF(AND([.B491]<>"";[.C491]<>"");"N/T";"") ->  | E491: of:=IF([.D491]<>"";IF(AND([.B491]<>"";[.C491]<>"");"";"ERR");"") -> 
B492: of:=IF( ISBLANK([$'03.Muestra'.$C$19]);"";[$'03.Muestra'.$C$19]) ->  | C492: of:=IF( ISBLANK([$'03.Muestra'.$E$19]);"";[$'03.Muestra'.$E$19]) ->  | D492: of:=IF(AND([.B492]<>"";[.C492]<>"");"N/T";"") ->  | E492: of:=IF([.D492]<>"";IF(AND([.B492]<>"";[.C492]<>"");"";"ERR");"") -> 
B493: of:=IF( ISBLANK([$'03.Muestra'.$C$20]);"";[$'03.Muestra'.$C$20]) ->  | C493: of:=IF( ISBLANK([$'03.Muestra'.$E$20]);"";[$'03.Muestra'.$E$20]) ->  | D493: of:=IF(AND([.B493]<>"";[.C493]<>"");"N/T";"") ->  | E493: of:=IF([.D493]<>"";IF(AND([.B493]<>"";[.C493]<>"");"";"ERR");"") -> 
B494: of:=IF( ISBLANK([$'03.Muestra'.$C$21]);"";[$'03.Muestra'.$C$21]) ->  | C494: of:=IF( ISBLANK([$'03.Muestra'.$E$21]);"";[$'03.Muestra'.$E$21]) ->  | D494: of:=IF(AND([.B494]<>"";[.C494]<>"");"N/T";"") ->  | E494: of:=IF([.D494]<>"";IF(AND([.B494]<>"";[.C494]<>"");"";"ERR");"") -> 
B495: of:=IF( ISBLANK([$'03.Muestra'.$C$22]);"";[$'03.Muestra'.$C$22]) ->  | C495: of:=IF( ISBLANK([$'03.Muestra'.$E$22]);"";[$'03.Muestra'.$E$22]) ->  | D495: of:=IF(AND([.B495]<>"";[.C495]<>"");"N/T";"") ->  | E495: of:=IF([.D495]<>"";IF(AND([.B495]<>"";[.C495]<>"");"";"ERR");"") -> 
B496: of:=IF( ISBLANK([$'03.Muestra'.$C$23]);"";[$'03.Muestra'.$C$23]) ->  | C496: of:=IF( ISBLANK([$'03.Muestra'.$E$23]);"";[$'03.Muestra'.$E$23]) ->  | D496: of:=IF(AND([.B496]<>"";[.C496]<>"");"N/T";"") ->  | E496: of:=IF([.D496]<>"";IF(AND([.B496]<>"";[.C496]<>"");"";"ERR");"") -> 
B497: of:=IF( ISBLANK([$'03.Muestra'.$C$24]);"";[$'03.Muestra'.$C$24]) ->  | C497: of:=IF( ISBLANK([$'03.Muestra'.$E$24]);"";[$'03.Muestra'.$E$24]) ->  | D497: of:=IF(AND([.B497]<>"";[.C497]<>"");"N/T";"") ->  | E497: of:=IF([.D497]<>"";IF(AND([.B497]<>"";[.C497]<>"");"";"ERR");"") -> 
B498: of:=IF( ISBLANK([$'03.Muestra'.$C$25]);"";[$'03.Muestra'.$C$25]) ->  | C498: of:=IF( ISBLANK([$'03.Muestra'.$E$25]);"";[$'03.Muestra'.$E$25]) ->  | D498: of:=IF(AND([.B498]<>"";[.C498]<>"");"N/T";"") ->  | E498: of:=IF([.D498]<>"";IF(AND([.B498]<>"";[.C498]<>"");"";"ERR");"") -> 
B499: of:=IF( ISBLANK([$'03.Muestra'.$C$26]);"";[$'03.Muestra'.$C$26]) ->  | C499: of:=IF( ISBLANK([$'03.Muestra'.$E$26]);"";[$'03.Muestra'.$E$26]) ->  | D499: of:=IF(AND([.B499]<>"";[.C499]<>"");"N/T";"") ->  | E499: of:=IF([.D499]<>"";IF(AND([.B499]<>"";[.C499]<>"");"";"ERR");"") -> 
B500: of:=IF( ISBLANK([$'03.Muestra'.$C$27]);"";[$'03.Muestra'.$C$27]) ->  | C500: of:=IF( ISBLANK([$'03.Muestra'.$E$27]);"";[$'03.Muestra'.$E$27]) ->  | D500: of:=IF(AND([.B500]<>"";[.C500]<>"");"N/T";"") ->  | E500: of:=IF([.D500]<>"";IF(AND([.B500]<>"";[.C500]<>"");"";"ERR");"") -> 
B501: of:=IF( ISBLANK([$'03.Muestra'.$C$28]);"";[$'03.Muestra'.$C$28]) ->  | C501: of:=IF( ISBLANK([$'03.Muestra'.$E$28]);"";[$'03.Muestra'.$E$28]) ->  | D501: of:=IF(AND([.B501]<>"";[.C501]<>"");"N/T";"") ->  | E501: of:=IF([.D501]<>"";IF(AND([.B501]<>"";[.C501]<>"");"";"ERR");"") -> 
B502: of:=IF( ISBLANK([$'03.Muestra'.$C$29]);"";[$'03.Muestra'.$C$29]) ->  | C502: of:=IF( ISBLANK([$'03.Muestra'.$E$29]);"";[$'03.Muestra'.$E$29]) ->  | D502: of:=IF(AND([.B502]<>"";[.C502]<>"");"N/T";"") ->  | E502: of:=IF([.D502]<>"";IF(AND([.B502]<>"";[.C502]<>"");"";"ERR");"") -> 
B503: of:=IF( ISBLANK([$'03.Muestra'.$C$30]);"";[$'03.Muestra'.$C$30]) ->  | C503: of:=IF( ISBLANK([$'03.Muestra'.$E$30]);"";[$'03.Muestra'.$E$30]) ->  | D503: of:=IF(AND([.B503]<>"";[.C503]<>"");"N/T";"") ->  | E503: of:=IF([.D503]<>"";IF(AND([.B503]<>"";[.C503]<>"");"";"ERR");"") -> 
B504: of:=IF( ISBLANK([$'03.Muestra'.$C$31]);"";[$'03.Muestra'.$C$31]) ->  | C504: of:=IF( ISBLANK([$'03.Muestra'.$E$31]);"";[$'03.Muestra'.$E$31]) ->  | D504: of:=IF(AND([.B504]<>"";[.C504]<>"");"N/T";"") ->  | E504: of:=IF([.D504]<>"";IF(AND([.B504]<>"";[.C504]<>"");"";"ERR");"") -> 
B505: of:=IF( ISBLANK([$'03.Muestra'.$C$32]);"";[$'03.Muestra'.$C$32]) ->  | C505: of:=IF( ISBLANK([$'03.Muestra'.$E$32]);"";[$'03.Muestra'.$E$32]) ->  | D505: of:=IF(AND([.B505]<>"";[.C505]<>"");"N/T";"") ->  | E505: of:=IF([.D505]<>"";IF(AND([.B505]<>"";[.C505]<>"");"";"ERR");"") -> 
B506: of:=IF( ISBLANK([$'03.Muestra'.$C$33]);"";[$'03.Muestra'.$C$33]) ->  | C506: of:=IF( ISBLANK([$'03.Muestra'.$E$33]);"";[$'03.Muestra'.$E$33]) ->  | D506: of:=IF(AND([.B506]<>"";[.C506]<>"");"N/T";"") ->  | E506: of:=IF([.D506]<>"";IF(AND([.B506]<>"";[.C506]<>"");"";"ERR");"") -> 
B507: of:=IF( ISBLANK([$'03.Muestra'.$C$34]);"";[$'03.Muestra'.$C$34]) ->  | C507: of:=IF( ISBLANK([$'03.Muestra'.$E$34]);"";[$'03.Muestra'.$E$34]) ->  | D507: of:=IF(AND([.B507]<>"";[.C507]<>"");"N/T";"") ->  | E507: of:=IF([.D507]<>"";IF(AND([.B507]<>"";[.C507]<>"");"";"ERR");"") -> 
B508: of:=IF( ISBLANK([$'03.Muestra'.$C$35]);"";[$'03.Muestra'.$C$35]) ->  | C508: of:=IF( ISBLANK([$'03.Muestra'.$E$35]);"";[$'03.Muestra'.$E$35]) ->  | D508: of:=IF(AND([.B508]<>"";[.C508]<>"");"N/T";"") ->  | E508: of:=IF([.D508]<>"";IF(AND([.B508]<>"";[.C508]<>"");"";"ERR");"") -> 
B509: of:=IF( ISBLANK([$'03.Muestra'.$C$36]);"";[$'03.Muestra'.$C$36]) ->  | C509: of:=IF( ISBLANK([$'03.Muestra'.$E$36]);"";[$'03.Muestra'.$E$36]) ->  | D509: of:=IF(AND([.B509]<>"";[.C509]<>"");"N/T";"") ->  | E509: of:=IF([.D509]<>"";IF(AND([.B509]<>"";[.C509]<>"");"";"ERR");"") -> 
B510: of:=IF( ISBLANK([$'03.Muestra'.$C$37]);"";[$'03.Muestra'.$C$37]) ->  | C510: of:=IF( ISBLANK([$'03.Muestra'.$E$37]);"";[$'03.Muestra'.$E$37]) ->  | D510: of:=IF(AND([.B510]<>"";[.C510]<>"");"N/T";"") ->  | E510: of:=IF([.D510]<>"";IF(AND([.B510]<>"";[.C510]<>"");"";"ERR");"") -> 
B513: A | C513: 2.5.3 Etiqueta en el nombre | D513: Resultado
B514: of:=IF( ISBLANK([$'03.Muestra'.$C$8]);"";[$'03.Muestra'.$C$8]) ->  | C514: of:=IF( ISBLANK([$'03.Muestra'.$E$8]);"";[$'03.Muestra'.$E$8]) ->  | D514: of:=IF(AND([.B514]<>"";[.C514]<>"");"N/T";"") ->  | E514: of:=IF([.D514]<>"";IF(AND([.B514]<>"";[.C514]<>"");"";"ERR");"") ->  | F514: of:=TRANSPOSE([$'DATA - Oculta'.$U$9:$'DATA - Oculta'.$U$13]) -> N/T | G514: N/D | H514: N/A | I514: Falla | J514: Pasa | K514: En blanco
B515: of:=IF( ISBLANK([$'03.Muestra'.$C$9]);"";[$'03.Muestra'.$C$9]) ->  | C515: of:=IF( ISBLANK([$'03.Muestra'.$E$9]);"";[$'03.Muestra'.$E$9]) ->  | D515: of:=IF(AND([.B515]<>"";[.C515]<>"");"N/T";"") ->  | E515: of:=IF([.D515]<>"";IF(AND([.B515]<>"";[.C515]<>"");"";"ERR");"") ->  | F515: of:=COUNTIF([.$D514]:INDIRECT("$D" &  SUM(ROW()-1;[$'03.Muestra'.$D$40])-1);[.F514]) -> 0 | G515: of:=COUNTIF([.$D514]:INDIRECT("$D" &  SUM(ROW()-1;[$'03.Muestra'.$D$40])-1);[.G514]) -> 0 | H515: of:=COUNTIF([.$D514]:INDIRECT("$D" &  SUM(ROW()-1;[$'03.Muestra'.$D$40])-1);[.H514]) -> 0 | I515: of:=COUNTIF([.$D514]:INDIRECT("$D" &  SUM(ROW()-1;[$'03.Muestra'.$D$40])-1);[.I514]) -> 0 | J515: of:=COUNTIF([.$D514]:INDIRECT("$D" &  SUM(ROW()-1;[$'03.Muestra'.$D$40])-1);[.J514]) -> 0 | K515: of:=IF([$'03.Muestra'.$D$40]=0;0;COUNTBLANK([.$D514]:INDIRECT("$D" &  SUM(ROW()-1;[$'03.Muestra'.$D$40])-1))) -> 0
B516: of:=IF( ISBLANK([$'03.Muestra'.$C$10]);"";[$'03.Muestra'.$C$10]) ->  | C516: of:=IF( ISBLANK([$'03.Muestra'.$E$10]);"";[$'03.Muestra'.$E$10]) ->  | D516: of:=IF(AND([.B516]<>"";[.C516]<>"");"N/T";"") ->  | E516: of:=IF([.D516]<>"";IF(AND([.B516]<>"";[.C516]<>"");"";"ERR");"") -> 
B517: of:=IF( ISBLANK([$'03.Muestra'.$C$11]);"";[$'03.Muestra'.$C$11]) ->  | C517: of:=IF( ISBLANK([$'03.Muestra'.$E$11]);"";[$'03.Muestra'.$E$11]) ->  | D517: of:=IF(AND([.B517]<>"";[.C517]<>"");"N/T";"") ->  | E517: of:=IF([.D517]<>"";IF(AND([.B517]<>"";[.C517]<>"");"";"ERR");"") -> 
B518: of:=IF( ISBLANK([$'03.Muestra'.$C$12]);"";[$'03.Muestra'.$C$12]) ->  | C518: of:=IF( ISBLANK([$'03.Muestra'.$E$12]);"";[$'03.Muestra'.$E$12]) ->  | D518: of:=IF(AND([.B518]<>"";[.C518]<>"");"N/T";"") ->  | E518: of:=IF([.D518]<>"";IF(AND([.B518]<>"";[.C518]<>"");"";"ERR");"") -> 
B519: of:=IF( ISBLANK([$'03.Muestra'.$C$13]);"";[$'03.Muestra'.$C$13]) ->  | C519: of:=IF( ISBLANK([$'03.Muestra'.$E$13]);"";[$'03.Muestra'.$E$13]) ->  | D519: of:=IF(AND([.B519]<>"";[.C519]<>"");"N/T";"") ->  | E519: of:=IF([.D519]<>"";IF(AND([.B519]<>"";[.C519]<>"");"";"ERR");"") -> 
B520: of:=IF( ISBLANK([$'03.Muestra'.$C$14]);"";[$'03.Muestra'.$C$14]) ->  | C520: of:=IF( ISBLANK([$'03.Muestra'.$E$14]);"";[$'03.Muestra'.$E$14]) ->  | D520: of:=IF(AND([.B520]<>"";[.C520]<>"");"N/T";"") ->  | E520: of:=IF([.D520]<>"";IF(AND([.B520]<>"";[.C520]<>"");"";"ERR");"") -> 
B521: of:=IF( ISBLANK([$'03.Muestra'.$C$15]);"";[$'03.Muestra'.$C$15]) ->  | C521: of:=IF( ISBLANK([$'03.Muestra'.$E$15]);"";[$'03.Muestra'.$E$15]) ->  | D521: of:=IF(AND([.B521]<>"";[.C521]<>"");"N/T";"") ->  | E521: of:=IF([.D521]<>"";IF(AND([.B521]<>"";[.C521]<>"");"";"ERR");"") -> 
B522: of:=IF( ISBLANK([$'03.Muestra'.$C$16]);"";[$'03.Muestra'.$C$16]) ->  | C522: of:=IF( ISBLANK([$'03.Muestra'.$E$16]);"";[$'03.Muestra'.$E$16]) ->  | D522: of:=IF(AND([.B522]<>"";[.C522]<>"");"N/T";"") ->  | E522: of:=IF([.D522]<>"";IF(AND([.B522]<>"";[.C522]<>"");"";"ERR");"") -> 
B523: of:=IF( ISBLANK([$'03.Muestra'.$C$17]);"";[$'03.Muestra'.$C$17]) ->  | C523: of:=IF( ISBLANK([$'03.Muestra'.$E$17]);"";[$'03.Muestra'.$E$17]) ->  | D523: of:=IF(AND([.B523]<>"";[.C523]<>"");"N/T";"") ->  | E523: of:=IF([.D523]<>"";IF(AND([.B523]<>"";[.C523]<>"");"";"ERR");"") -> 
B524: of:=IF( ISBLANK([$'03.Muestra'.$C$18]);"";[$'03.Muestra'.$C$18]) ->  | C524: of:=IF( ISBLANK([$'03.Muestra'.$E$18]);"";[$'03.Muestra'.$E$18]) ->  | D524: of:=IF(AND([.B524]<>"";[.C524]<>"");"N/T";"") ->  | E524: of:=IF([.D524]<>"";IF(AND([.B524]<>"";[.C524]<>"");"";"ERR");"") -> 
B525: of:=IF( ISBLANK([$'03.Muestra'.$C$19]);"";[$'03.Muestra'.$C$19]) ->  | C525: of:=IF( ISBLANK([$'03.Muestra'.$E$19]);"";[$'03.Muestra'.$E$19]) ->  | D525: of:=IF(AND([.B525]<>"";[.C525]<>"");"N/T";"") ->  | E525: of:=IF([.D525]<>"";IF(AND([.B525]<>"";[.C525]<>"");"";"ERR");"") -> 
B526: of:=IF( ISBLANK([$'03.Muestra'.$C$20]);"";[$'03.Muestra'.$C$20]) ->  | C526: of:=IF( ISBLANK([$'03.Muestra'.$E$20]);"";[$'03.Muestra'.$E$20]) ->  | D526: of:=IF(AND([.B526]<>"";[.C526]<>"");"N/T";"") ->  | E526: of:=IF([.D526]<>"";IF(AND([.B526]<>"";[.C526]<>"");"";"ERR");"") -> 
B527: of:=IF( ISBLANK([$'03.Muestra'.$C$21]);"";[$'03.Muestra'.$C$21]) ->  | C527: of:=IF( ISBLANK([$'03.Muestra'.$E$21]);"";[$'03.Muestra'.$E$21]) ->  | D527: of:=IF(AND([.B527]<>"";[.C527]<>"");"N/T";"") ->  | E527: of:=IF([.D527]<>"";IF(AND([.B527]<>"";[.C527]<>"");"";"ERR");"") -> 
B528: of:=IF( ISBLANK([$'03.Muestra'.$C$22]);"";[$'03.Muestra'.$C$22]) ->  | C528: of:=IF( ISBLANK([$'03.Muestra'.$E$22]);"";[$'03.Muestra'.$E$22]) ->  | D528: of:=IF(AND([.B528]<>"";[.C528]<>"");"N/T";"") ->  | E528: of:=IF([.D528]<>"";IF(AND([.B528]<>"";[.C528]<>"");"";"ERR");"") -> 
B529: of:=IF( ISBLANK([$'03.Muestra'.$C$23]);"";[$'03.Muestra'.$C$23]) ->  | C529: of:=IF( ISBLANK([$'03.Muestra'.$E$23]);"";[$'03.Muestra'.$E$23]) ->  | D529: of:=IF(AND([.B529]<>"";[.C529]<>"");"N/T";"") ->  | E529: of:=IF([.D529]<>"";IF(AND([.B529]<>"";[.C529]<>"");"";"ERR");"") -> 
B530: of:=IF( ISBLANK([$'03.Muestra'.$C$24]);"";[$'03.Muestra'.$C$24]) ->  | C530: of:=IF( ISBLANK([$'03.Muestra'.$E$24]);"";[$'03.Muestra'.$E$24]) ->  | D530: of:=IF(AND([.B530]<>"";[.C530]<>"");"N/T";"") ->  | E530: of:=IF([.D530]<>"";IF(AND([.B530]<>"";[.C530]<>"");"";"ERR");"") -> 
B531: of:=IF( ISBLANK([$'03.Muestra'.$C$25]);"";[$'03.Muestra'.$C$25]) ->  | C531: of:=IF( ISBLANK([$'03.Muestra'.$E$25]);"";[$'03.Muestra'.$E$25]) ->  | D531: of:=IF(AND([.B531]<>"";[.C531]<>"");"N/T";"") ->  | E531: of:=IF([.D531]<>"";IF(AND([.B531]<>"";[.C531]<>"");"";"ERR");"") -> 
B532: of:=IF( ISBLANK([$'03.Muestra'.$C$26]);"";[$'03.Muestra'.$C$26]) ->  | C532: of:=IF( ISBLANK([$'03.Muestra'.$E$26]);"";[$'03.Muestra'.$E$26]) ->  | D532: of:=IF(AND([.B532]<>"";[.C532]<>"");"N/T";"") ->  | E532: of:=IF([.D532]<>"";IF(AND([.B532]<>"";[.C532]<>"");"";"ERR");"") -> 
B533: of:=IF( ISBLANK([$'03.Muestra'.$C$27]);"";[$'03.Muestra'.$C$27]) ->  | C533: of:=IF( ISBLANK([$'03.Muestra'.$E$27]);"";[$'03.Muestra'.$E$27]) ->  | D533: of:=IF(AND([.B533]<>"";[.C533]<>"");"N/T";"") ->  | E533: of:=IF([.D533]<>"";IF(AND([.B533]<>"";[.C533]<>"");"";"ERR");"") -> 
B534: of:=IF( ISBLANK([$'03.Muestra'.$C$28]);"";[$'03.Muestra'.$C$28]) ->  | C534: of:=IF( ISBLANK([$'03.Muestra'.$E$28]);"";[$'03.Muestra'.$E$28]) ->  | D534: of:=IF(AND([.B534]<>"";[.C534]<>"");"N/T";"") ->  | E534: of:=IF([.D534]<>"";IF(AND([.B534]<>"";[.C534]<>"");"";"ERR");"") -> 
B535: of:=IF( ISBLANK([$'03.Muestra'.$C$29]);"";[$'03.Muestra'.$C$29]) ->  | C535: of:=IF( ISBLANK([$'03.Muestra'.$E$29]);"";[$'03.Muestra'.$E$29]) ->  | D535: of:=IF(AND([.B535]<>"";[.C535]<>"");"N/T";"") ->  | E535: of:=IF([.D535]<>"";IF(AND([.B535]<>"";[.C535]<>"");"";"ERR");"") -> 
B536: of:=IF( ISBLANK([$'03.Muestra'.$C$30]);"";[$'03.Muestra'.$C$30]) ->  | C536: of:=IF( ISBLANK([$'03.Muestra'.$E$30]);"";[$'03.Muestra'.$E$30]) ->  | D536: of:=IF(AND([.B536]<>"";[.C536]<>"");"N/T";"") ->  | E536: of:=IF([.D536]<>"";IF(AND([.B536]<>"";[.C536]<>"");"";"ERR");"") -> 
B537: of:=IF( ISBLANK([$'03.Muestra'.$C$31]);"";[$'03.Muestra'.$C$31]) ->  | C537: of:=IF( ISBLANK([$'03.Muestra'.$E$31]);"";[$'03.Muestra'.$E$31]) ->  | D537: of:=IF(AND([.B537]<>"";[.C537]<>"");"N/T";"") ->  | E537: of:=IF([.D537]<>"";IF(AND([.B537]<>"";[.C537]<>"");"";"ERR");"") -> 
B538: of:=IF( ISBLANK([$'03.Muestra'.$C$32]);"";[$'03.Muestra'.$C$32]) ->  | C538: of:=IF( ISBLANK([$'03.Muestra'.$E$32]);"";[$'03.Muestra'.$E$32]) ->  | D538: of:=IF(AND([.B538]<>"";[.C538]<>"");"N/T";"") ->  | E538: of:=IF([.D538]<>"";IF(AND([.B538]<>"";[.C538]<>"");"";"ERR");"") -> 
B539: of:=IF( ISBLANK([$'03.Muestra'.$C$33]);"";[$'03.Muestra'.$C$33]) ->  | C539: of:=IF( ISBLANK([$'03.Muestra'.$E$33]);"";[$'03.Muestra'.$E$33]) ->  | D539: of:=IF(AND([.B539]<>"";[.C539]<>"");"N/T";"") ->  | E539: of:=IF([.D539]<>"";IF(AND([.B539]<>"";[.C539]<>"");"";"ERR");"") -> 
B540: of:=IF( ISBLANK([$'03.Muestra'.$C$34]);"";[$'03.Muestra'.$C$34]) ->  | C540: of:=IF( ISBLANK([$'03.Muestra'.$E$34]);"";[$'03.Muestra'.$E$34]) ->  | D540: of:=IF(AND([.B540]<>"";[.C540]<>"");"N/T";"") ->  | E540: of:=IF([.D540]<>"";IF(AND([.B540]<>"";[.C540]<>"");"";"ERR");"") -> 
B541: of:=IF( ISBLANK([$'03.Muestra'.$C$35]);"";[$'03.Muestra'.$C$35]) ->  | C541: of:=IF( ISBLANK([$'03.Muestra'.$E$35]);"";[$'03.Muestra'.$E$35]) ->  | D541: of:=IF(AND([.B541]<>"";[.C541]<>"");"N/T";"") ->  | E541: of:=IF([.D541]<>"";IF(AND([.B541]<>"";[.C541]<>"");"";"ERR");"") -> 
B542: of:=IF( ISBLANK([$'03.Muestra'.$C$36]);"";[$'03.Muestra'.$C$36]) ->  | C542: of:=IF( ISBLANK([$'03.Muestra'.$E$36]);"";[$'03.Muestra'.$E$36]) ->  | D542: of:=IF(AND([.B542]<>"";[.C542]<>"");"N/T";"") ->  | E542: of:=IF([.D542]<>"";IF(AND([.B542]<>"";[.C542]<>"");"";"ERR");"") -> 
B543: of:=IF( ISBLANK([$'03.Muestra'.$C$37]);"";[$'03.Muestra'.$C$37]) ->  | C543: of:=IF( ISBLANK([$'03.Muestra'.$E$37]);"";[$'03.Muestra'.$E$37]) ->  | D543: of:=IF(AND([.B543]<>"";[.C543]<>"");"N/T";"") ->  | E543: of:=IF([.D543]<>"";IF(AND([.B543]<>"";[.C543]<>"");"";"ERR");"") -> 
B546: A | C546: 2.5.4. ActivaciÃ³n mediante movimiento | D546: Resultado
B547: of:=IF( ISBLANK([$'03.Muestra'.$C$8]);"";[$'03.Muestra'.$C$8]) ->  | C547: of:=IF( ISBLANK([$'03.Muestra'.$E$8]);"";[$'03.Muestra'.$E$8]) ->  | D547: of:=IF(AND([.B547]<>"";[.C547]<>"");"N/T";"") ->  | E547: of:=IF([.D547]<>"";IF(AND([.B547]<>"";[.C547]<>"");"";"ERR");"") ->  | F547: of:=TRANSPOSE([$'DATA - Oculta'.$U$9:$'DATA - Oculta'.$U$13]) -> N/T | G547: N/D | H547: N/A | I547: Falla | J547: Pasa | K547: En blanco
B548: of:=IF( ISBLANK([$'03.Muestra'.$C$9]);"";[$'03.Muestra'.$C$9]) ->  | C548: of:=IF( ISBLANK([$'03.Muestra'.$E$9]);"";[$'03.Muestra'.$E$9]) ->  | D548: of:=IF(AND([.B548]<>"";[.C548]<>"");"N/T";"") ->  | E548: of:=IF([.D548]<>"";IF(AND([.B548]<>"";[.C548]<>"");"";"ERR");"") ->  | F548: of:=COUNTIF([.$D547]:INDIRECT("$D" &  SUM(ROW()-1;[$'03.Muestra'.$D$40])-1);[.F547]) -> 0 | G548: of:=COUNTIF([.$D547]:INDIRECT("$D" &  SUM(ROW()-1;[$'03.Muestra'.$D$40])-1);[.G547]) -> 0 | H548: of:=COUNTIF([.$D547]:INDIRECT("$D" &  SUM(ROW()-1;[$'03.Muestra'.$D$40])-1);[.H547]) -> 0 | I548: of:=COUNTIF([.$D547]:INDIRECT("$D" &  SUM(ROW()-1;[$'03.Muestra'.$D$40])-1);[.I547]) -> 0 | J548: of:=COUNTIF([.$D547]:INDIRECT("$D" &  SUM(ROW()-1;[$'03.Muestra'.$D$40])-1);[.J547]) -> 0 | K548: of:=IF([$'03.Muestra'.$D$40]=0;0;COUNTBLANK([.$D547]:INDIRECT("$D" &  SUM(ROW()-1;[$'03.Muestra'.$D$40])-1))) -> 0
B549: of:=IF( ISBLANK([$'03.Muestra'.$C$10]);"";[$'03.Muestra'.$C$10]) ->  | C549: of:=IF( ISBLANK([$'03.Muestra'.$E$10]);"";[$'03.Muestra'.$E$10]) ->  | D549: of:=IF(AND([.B549]<>"";[.C549]<>"");"N/T";"") ->  | E549: of:=IF([.D549]<>"";IF(AND([.B549]<>"";[.C549]<>"");"";"ERR");"") -> 
B550: of:=IF( ISBLANK([$'03.Muestra'.$C$11]);"";[$'03.Muestra'.$C$11]) ->  | C550: of:=IF( ISBLANK([$'03.Muestra'.$E$11]);"";[$'03.Muestra'.$E$11]) ->  | D550: of:=IF(AND([.B550]<>"";[.C550]<>"");"N/T";"") ->  | E550: of:=IF([.D550]<>"";IF(AND([.B550]<>"";[.C550]<>"");"";"ERR");"") -> 
B551: of:=IF( ISBLANK([$'03.Muestra'.$C$12]);"";[$'03.Muestra'.$C$12]) ->  | C551: of:=IF( ISBLANK([$'03.Muestra'.$E$12]);"";[$'03.Muestra'.$E$12]) ->  | D551: of:=IF(AND([.B551]<>"";[.C551]<>"");"N/T";"") ->  | E551: of:=IF([.D551]<>"";IF(AND([.B551]<>"";[.C551]<>"");"";"ERR");"") -> 
B552: of:=IF( ISBLANK([$'03.Muestra'.$C$13]);"";[$'03.Muestra'.$C$13]) ->  | C552: of:=IF( ISBLANK([$'03.Muestra'.$E$13]);"";[$'03.Muestra'.$E$13]) ->  | D552: of:=IF(AND([.B552]<>"";[.C552]<>"");"N/T";"") ->  | E552: of:=IF([.D552]<>"";IF(AND([.B552]<>"";[.C552]<>"");"";"ERR");"") -> 
B553: of:=IF( ISBLANK([$'03.Muestra'.$C$14]);"";[$'03.Muestra'.$C$14]) ->  | C553: of:=IF( ISBLANK([$'03.Muestra'.$E$14]);"";[$'03.Muestra'.$E$14]) ->  | D553: of:=IF(AND([.B553]<>"";[.C553]<>"");"N/T";"") ->  | E553: of:=IF([.D553]<>"";IF(AND([.B553]<>"";[.C553]<>"");"";"ERR");"") -> 
B554: of:=IF( ISBLANK([$'03.Muestra'.$C$15]);"";[$'03.Muestra'.$C$15]) ->  | C554: of:=IF( ISBLANK([$'03.Muestra'.$E$15]);"";[$'03.Muestra'.$E$15]) ->  | D554: of:=IF(AND([.B554]<>"";[.C554]<>"");"N/T";"") ->  | E554: of:=IF([.D554]<>"";IF(AND([.B554]<>"";[.C554]<>"");"";"ERR");"") -> 
B555: of:=IF( ISBLANK([$'03.Muestra'.$C$16]);"";[$'03.Muestra'.$C$16]) ->  | C555: of:=IF( ISBLANK([$'03.Muestra'.$E$16]);"";[$'03.Muestra'.$E$16]) ->  | D555: of:=IF(AND([.B555]<>"";[.C555]<>"");"N/T";"") ->  | E555: of:=IF([.D555]<>"";IF(AND([.B555]<>"";[.C555]<>"");"";"ERR");"") -> 
B556: of:=IF( ISBLANK([$'03.Muestra'.$C$17]);"";[$'03.Muestra'.$C$17]) ->  | C556: of:=IF( ISBLANK([$'03.Muestra'.$E$17]);"";[$'03.Muestra'.$E$17]) ->  | D556: of:=IF(AND([.B556]<>"";[.C556]<>"");"N/T";"") ->  | E556: of:=IF([.D556]<>"";IF(AND([.B556]<>"";[.C556]<>"");"";"ERR");"") -> 
B557: of:=IF( ISBLANK([$'03.Muestra'.$C$18]);"";[$'03.Muestra'.$C$18]) ->  | C557: of:=IF( ISBLANK([$'03.Muestra'.$E$18]);"";[$'03.Muestra'.$E$18]) ->  | D557: of:=IF(AND([.B557]<>"";[.C557]<>"");"N/T";"") ->  | E557: of:=IF([.D557]<>"";IF(AND([.B557]<>"";[.C557]<>"");"";"ERR");"") -> 
B558: of:=IF( ISBLANK([$'03.Muestra'.$C$19]);"";[$'03.Muestra'.$C$19]) ->  | C558: of:=IF( ISBLANK([$'03.Muestra'.$E$19]);"";[$'03.Muestra'.$E$19]) ->  | D558: of:=IF(AND([.B558]<>"";[.C558]<>"");"N/T";"") ->  | E558: of:=IF([.D558]<>"";IF(AND([.B558]<>"";[.C558]<>"");"";"ERR");"") -> 
B559: of:=IF( ISBLANK([$'03.Muestra'.$C$20]);"";[$'03.Muestra'.$C$20]) ->  | C559: of:=IF( ISBLANK([$'03.Muestra'.$E$20]);"";[$'03.Muestra'.$E$20]) ->  | D559: of:=IF(AND([.B559]<>"";[.C559]<>"");"N/T";"") ->  | E559: of:=IF([.D559]<>"";IF(AND([.B559]<>"";[.C559]<>"");"";"ERR");"") -> 
B560: of:=IF( ISBLANK([$'03.Muestra'.$C$21]);"";[$'03.Muestra'.$C$21]) ->  | C560: of:=IF( ISBLANK([$'03.Muestra'.$E$21]);"";[$'03.Muestra'.$E$21]) ->  | D560: of:=IF(AND([.B560]<>"";[.C560]<>"");"N/T";"") ->  | E560: of:=IF([.D560]<>"";IF(AND([.B560]<>"";[.C560]<>"");"";"ERR");"") -> 
B561: of:=IF( ISBLANK([$'03.Muestra'.$C$22]);"";[$'03.Muestra'.$C$22]) ->  | C561: of:=IF( ISBLANK([$'03.Muestra'.$E$22]);"";[$'03.Muestra'.$E$22]) ->  | D561: of:=IF(AND([.B561]<>"";[.C561]<>"");"N/T";"") ->  | E561: of:=IF([.D561]<>"";IF(AND([.B561]<>"";[.C561]<>"");"";"ERR");"") -> 
B562: of:=IF( ISBLANK([$'03.Muestra'.$C$23]);"";[$'03.Muestra'.$C$23]) ->  | C562: of:=IF( ISBLANK([$'03.Muestra'.$E$23]);"";[$'03.Muestra'.$E$23]) ->  | D562: of:=IF(AND([.B562]<>"";[.C562]<>"");"N/T";"") ->  | E562: of:=IF([.D562]<>"";IF(AND([.B562]<>"";[.C562]<>"");"";"ERR");"") -> 
B563: of:=IF( ISBLANK([$'03.Muestra'.$C$24]);"";[$'03.Muestra'.$C$24]) ->  | C563: of:=IF( ISBLANK([$'03.Muestra'.$E$24]);"";[$'03.Muestra'.$E$24]) ->  | D563: of:=IF(AND([.B563]<>"";[.C563]<>"");"N/T";"") ->  | E563: of:=IF([.D563]<>"";IF(AND([.B563]<>"";[.C563]<>"");"";"ERR");"") -> 
B564: of:=IF( ISBLANK([$'03.Muestra'.$C$25]);"";[$'03.Muestra'.$C$25]) ->  | C564: of:=IF( ISBLANK([$'03.Muestra'.$E$25]);"";[$'03.Muestra'.$E$25]) ->  | D564: of:=IF(AND([.B564]<>"";[.C564]<>"");"N/T";"") ->  | E564: of:=IF([.D564]<>"";IF(AND([.B564]<>"";[.C564]<>"");"";"ERR");"") -> 
B565: of:=IF( ISBLANK([$'03.Muestra'.$C$26]);"";[$'03.Muestra'.$C$26]) ->  | C565: of:=IF( ISBLANK([$'03.Muestra'.$E$26]);"";[$'03.Muestra'.$E$26]) ->  | D565: of:=IF(AND([.B565]<>"";[.C565]<>"");"N/T";"") ->  | E565: of:=IF([.D565]<>"";IF(AND([.B565]<>"";[.C565]<>"");"";"ERR");"") -> 
B566: of:=IF( ISBLANK([$'03.Muestra'.$C$27]);"";[$'03.Muestra'.$C$27]) ->  | C566: of:=IF( ISBLANK([$'03.Muestra'.$E$27]);"";[$'03.Muestra'.$E$27]) ->  | D566: of:=IF(AND([.B566]<>"";[.C566]<>"");"N/T";"") ->  | E566: of:=IF([.D566]<>"";IF(AND([.B566]<>"";[.C566]<>"");"";"ERR");"") -> 
B567: of:=IF( ISBLANK([$'03.Muestra'.$C$28]);"";[$'03.Muestra'.$C$28]) ->  | C567: of:=IF( ISBLANK([$'03.Muestra'.$E$28]);"";[$'03.Muestra'.$E$28]) ->  | D567: of:=IF(AND([.B567]<>"";[.C567]<>"");"N/T";"") ->  | E567: of:=IF([.D567]<>"";IF(AND([.B567]<>"";[.C567]<>"");"";"ERR");"") -> 
B568: of:=IF( ISBLANK([$'03.Muestra'.$C$29]);"";[$'03.Muestra'.$C$29]) ->  | C568: of:=IF( ISBLANK([$'03.Muestra'.$E$29]);"";[$'03.Muestra'.$E$29]) ->  | D568: of:=IF(AND([.B568]<>"";[.C568]<>"");"N/T";"") ->  | E568: of:=IF([.D568]<>"";IF(AND([.B568]<>"";[.C568]<>"");"";"ERR");"") -> 
B569: of:=IF( ISBLANK([$'03.Muestra'.$C$30]);"";[$'03.Muestra'.$C$30]) ->  | C569: of:=IF( ISBLANK([$'03.Muestra'.$E$30]);"";[$'03.Muestra'.$E$30]) ->  | D569: of:=IF(AND([.B569]<>"";[.C569]<>"");"N/T";"") ->  | E569: of:=IF([.D569]<>"";IF(AND([.B569]<>"";[.C569]<>"");"";"ERR");"") -> 
B570: of:=IF( ISBLANK([$'03.Muestra'.$C$31]);"";[$'03.Muestra'.$C$31]) ->  | C570: of:=IF( ISBLANK([$'03.Muestra'.$E$31]);"";[$'03.Muestra'.$E$31]) ->  | D570: of:=IF(AND([.B570]<>"";[.C570]<>"");"N/T";"") ->  | E570: of:=IF([.D570]<>"";IF(AND([.B570]<>"";[.C570]<>"");"";"ERR");"") -> 
B571: of:=IF( ISBLANK([$'03.Muestra'.$C$32]);"";[$'03.Muestra'.$C$32]) ->  | C571: of:=IF( ISBLANK([$'03.Muestra'.$E$32]);"";[$'03.Muestra'.$E$32]) ->  | D571: of:=IF(AND([.B571]<>"";[.C571]<>"");"N/T";"") ->  | E571: of:=IF([.D571]<>"";IF(AND([.B571]<>"";[.C571]<>"");"";"ERR");"") -> 
B572: of:=IF( ISBLANK([$'03.Muestra'.$C$33]);"";[$'03.Muestra'.$C$33]) ->  | C572: of:=IF( ISBLANK([$'03.Muestra'.$E$33]);"";[$'03.Muestra'.$E$33]) ->  | D572: of:=IF(AND([.B572]<>"";[.C572]<>"");"N/T";"") ->  | E572: of:=IF([.D572]<>"";IF(AND([.B572]<>"";[.C572]<>"");"";"ERR");"") -> 
B573: of:=IF( ISBLANK([$'03.Muestra'.$C$34]);"";[$'03.Muestra'.$C$34]) ->  | C573: of:=IF( ISBLANK([$'03.Muestra'.$E$34]);"";[$'03.Muestra'.$E$34]) ->  | D573: of:=IF(AND([.B573]<>"";[.C573]<>"");"N/T";"") ->  | E573: of:=IF([.D573]<>"";IF(AND([.B573]<>"";[.C573]<>"");"";"ERR");"") -> 
B574: of:=IF( ISBLANK([$'03.Muestra'.$C$35]);"";[$'03.Muestra'.$C$35]) ->  | C574: of:=IF( ISBLANK([$'03.Muestra'.$E$35]);"";[$'03.Muestra'.$E$35]) ->  | D574: of:=IF(AND([.B574]<>"";[.C574]<>"");"N/T";"") ->  | E574: of:=IF([.D574]<>"";IF(AND([.B574]<>"";[.C574]<>"");"";"ERR");"") -> 
B575: of:=IF( ISBLANK([$'03.Muestra'.$C$36]);"";[$'03.Muestra'.$C$36]) ->  | C575: of:=IF( ISBLANK([$'03.Muestra'.$E$36]);"";[$'03.Muestra'.$E$36]) ->  | D575: of:=IF(AND([.B575]<>"";[.C575]<>"");"N/T";"") ->  | E575: of:=IF([.D575]<>"";IF(AND([.B575]<>"";[.C575]<>"");"";"ERR");"") -> 
B576: of:=IF( ISBLANK([$'03.Muestra'.$C$37]);"";[$'03.Muestra'.$C$37]) ->  | C576: of:=IF( ISBLANK([$'03.Muestra'.$E$37]);"";[$'03.Muestra'.$E$37]) ->  | D576: of:=IF(AND([.B576]<>"";[.C576]<>"");"N/T";"") ->  | E576: of:=IF([.D576]<>"";IF(AND([.B576]<>"";[.C576]<>"");"";"ERR");"") -> 

Sheet: P3.Comprensible
B2: Informe de revisiÃ³n de la accesibilidad
B3: AnÃ¡lisis de accesibilidad en profundidad
B5: RevisiÃ³n de la muestra
B8: Principio 3: Comprensible
B9: La informaciÃ³n y el manejo de la interfaz de usuario deben ser comprensibles.
B11: Criterios de VerificaciÃ³n | F11: Criterios | G11: Evaluados | H11: % | J11: Criterios | K11: Pendientes | L11: %
B12: A | C12: 5 | F12: Pasa | G12: of:=[.J20]+[.J53]+[.J86]+[.J119]+[.J152]+[.J185]+[.J218]+[.J251]+[.J284]+[.J317] -> 0 | H12: of:=IF(([.$G$15]+[.$K$15])=0;0;[.G12]/([.$G$15]+[.$K$15])) -> 0 | J12: No decide | K12: of:=[.G20]+[.G53]+[.G86]+[.G119]+[.G152]+[.G185]+[.G218]+[.G251]+[.G284]+[.G317] -> 0 | L12: of:=IF(([.$G$15]+[.$K$15])=0;0;[.K12]/([.$G$15]+[.$K$15])) -> 0
B13: AA | C13: 5 | F13: Falla | G13: of:=[.I20]+[.I53]+[.I86]+[.I119]+[.I152]+[.I185]+[.I218]+[.I251]+[.I284]+[.I317] -> 0 | H13: of:=IF(([.$G$15]+[.$K$15])=0;0;[.G13]/([.$G$15]+[.$K$15])) -> 0 | J13: No testeado | K13: of:=[.F20]+[.F53]+[.F86]+[.F119]+[.F152]+[.F185]+[.F218]+[.F251]+[.F284]+[.F317] -> 0 | L13: of:=IF(([.$G$15]+[.$K$15])=0;0;[.K13]/([.$G$15]+[.$K$15])) -> 0
B14: Total | C14: of:=SUM([.C12:.C13]) -> 10 | F14: No aplica | G14: of:=[.H20]+[.H53]+[.H86]+[.H119]+[.H152]+[.H185]+[.H218]+[.H251]+[.H284]+[.H317] -> 0 | H14: of:=IF(([.$G$15]+[.$K$15])=0;0;[.G14]/([.$G$15]+[.$K$15])) -> 0 | J14: En blanco | K14: of:=[.K20]+[.K53]+[.K86]+[.K119]+[.K152]+[.K185]+[.K218]+[.K251]+[.K284]+[.K317] -> 0 | L14: of:=IF(([.$G$15]+[.$K$15])=0;0;[.K14]/([.$G$15]+[.$K$15])) -> 0
F15: Total | G15: of:=SUM([.G12:.G14]) -> 0 | H15: of:=SUM([.H12:.H14]) -> 0 | J15: Total | K15: of:=SUM([.K12:.K14]) -> 0 | L15: of:=SUM([.L12:.L14]) -> 0
B18: A | C18: 3.1.1 Idioma de la pÃ¡gina | D18: Resultado
B19: of:=IF( ISBLANK([$'03.Muestra'.$C$8]);"";[$'03.Muestra'.$C$8]) ->  | C19: of:=IF( ISBLANK([$'03.Muestra'.$E$8]);"";[$'03.Muestra'.$E$8]) ->  | D19: of:=IF(AND([.B19]<>"";[.C19]<>"");"N/T";"") ->  | E19: of:=IF([.D19]<>"";IF(AND([.B19]<>"";[.C19]<>"");"";"ERR");"") ->  | F19: of:=TRANSPOSE([$'DATA - Oculta'.$U$9:$'DATA - Oculta'.$U$13]) -> N/T | G19: N/D | H19: N/A | I19: Falla | J19: Pasa | K19: En blanco
B20: of:=IF( ISBLANK([$'03.Muestra'.$C$9]);"";[$'03.Muestra'.$C$9]) ->  | C20: of:=IF( ISBLANK([$'03.Muestra'.$E$9]);"";[$'03.Muestra'.$E$9]) ->  | D20: of:=IF(AND([.B20]<>"";[.C20]<>"");"N/T";"") ->  | E20: of:=IF([.D20]<>"";IF(AND([.B20]<>"";[.C20]<>"");"";"ERR");"") ->  | F20: of:=COUNTIF([.$D19]:INDIRECT("$D" &  SUM(ROW()-1;[$'03.Muestra'.$D$40])-1);[.F19]) -> 0 | G20: of:=COUNTIF([.$D19]:INDIRECT("$D" &  SUM(ROW()-1;[$'03.Muestra'.$D$40])-1);[.G19]) -> 0 | H20: of:=COUNTIF([.$D19]:INDIRECT("$D" &  SUM(ROW()-1;[$'03.Muestra'.$D$40])-1);[.H19]) -> 0 | I20: of:=COUNTIF([.$D19]:INDIRECT("$D" &  SUM(ROW()-1;[$'03.Muestra'.$D$40])-1);[.I19]) -> 0 | J20: of:=COUNTIF([.$D19]:INDIRECT("$D" &  SUM(ROW()-1;[$'03.Muestra'.$D$40])-1);[.J19]) -> 0 | K20: of:=IF([$'03.Muestra'.$D$40]=0;0;COUNTBLANK([.$D19]:INDIRECT("$D" &  SUM(ROW()-1;[$'03.Muestra'.$D$40])-1))) -> 0
B21: of:=IF( ISBLANK([$'03.Muestra'.$C$10]);"";[$'03.Muestra'.$C$10]) ->  | C21: of:=IF( ISBLANK([$'03.Muestra'.$E$10]);"";[$'03.Muestra'.$E$10]) ->  | D21: of:=IF(AND([.B21]<>"";[.C21]<>"");"N/T";"") ->  | E21: of:=IF([.D21]<>"";IF(AND([.B21]<>"";[.C21]<>"");"";"ERR");"") -> 
B22: of:=IF( ISBLANK([$'03.Muestra'.$C$11]);"";[$'03.Muestra'.$C$11]) ->  | C22: of:=IF( ISBLANK([$'03.Muestra'.$E$11]);"";[$'03.Muestra'.$E$11]) ->  | D22: of:=IF(AND([.B22]<>"";[.C22]<>"");"N/T";"") ->  | E22: of:=IF([.D22]<>"";IF(AND([.B22]<>"";[.C22]<>"");"";"ERR");"") ->  | K22: N/T | L22: No Testeado
B23: of:=IF( ISBLANK([$'03.Muestra'.$C$12]);"";[$'03.Muestra'.$C$12]) ->  | C23: of:=IF( ISBLANK([$'03.Muestra'.$E$12]);"";[$'03.Muestra'.$E$12]) ->  | D23: of:=IF(AND([.B23]<>"";[.C23]<>"");"N/T";"") ->  | E23: of:=IF([.D23]<>"";IF(AND([.B23]<>"";[.C23]<>"");"";"ERR");"") ->  | K23: N/A | L23: No Aplica
B24: of:=IF( ISBLANK([$'03.Muestra'.$C$13]);"";[$'03.Muestra'.$C$13]) ->  | C24: of:=IF( ISBLANK([$'03.Muestra'.$E$13]);"";[$'03.Muestra'.$E$13]) ->  | D24: of:=IF(AND([.B24]<>"";[.C24]<>"");"N/T";"") ->  | E24: of:=IF([.D24]<>"";IF(AND([.B24]<>"";[.C24]<>"");"";"ERR");"") ->  | K24: N/D | L24: No Decide
B25: of:=IF( ISBLANK([$'03.Muestra'.$C$14]);"";[$'03.Muestra'.$C$14]) ->  | C25: of:=IF( ISBLANK([$'03.Muestra'.$E$14]);"";[$'03.Muestra'.$E$14]) ->  | D25: of:=IF(AND([.B25]<>"";[.C25]<>"");"N/T";"") ->  | E25: of:=IF([.D25]<>"";IF(AND([.B25]<>"";[.C25]<>"");"";"ERR");"") -> 
B26: of:=IF( ISBLANK([$'03.Muestra'.$C$15]);"";[$'03.Muestra'.$C$15]) ->  | C26: of:=IF( ISBLANK([$'03.Muestra'.$E$15]);"";[$'03.Muestra'.$E$15]) ->  | D26: of:=IF(AND([.B26]<>"";[.C26]<>"");"N/T";"") ->  | E26: of:=IF([.D26]<>"";IF(AND([.B26]<>"";[.C26]<>"");"";"ERR");"") -> 
B27: of:=IF( ISBLANK([$'03.Muestra'.$C$16]);"";[$'03.Muestra'.$C$16]) ->  | C27: of:=IF( ISBLANK([$'03.Muestra'.$E$16]);"";[$'03.Muestra'.$E$16]) ->  | D27: of:=IF(AND([.B27]<>"";[.C27]<>"");"N/T";"") ->  | E27: of:=IF([.D27]<>"";IF(AND([.B27]<>"";[.C27]<>"");"";"ERR");"") -> 
B28: of:=IF( ISBLANK([$'03.Muestra'.$C$17]);"";[$'03.Muestra'.$C$17]) ->  | C28: of:=IF( ISBLANK([$'03.Muestra'.$E$17]);"";[$'03.Muestra'.$E$17]) ->  | D28: of:=IF(AND([.B28]<>"";[.C28]<>"");"N/T";"") ->  | E28: of:=IF([.D28]<>"";IF(AND([.B28]<>"";[.C28]<>"");"";"ERR");"") -> 
B29: of:=IF( ISBLANK([$'03.Muestra'.$C$18]);"";[$'03.Muestra'.$C$18]) ->  | C29: of:=IF( ISBLANK([$'03.Muestra'.$E$18]);"";[$'03.Muestra'.$E$18]) ->  | D29: of:=IF(AND([.B29]<>"";[.C29]<>"");"N/T";"") ->  | E29: of:=IF([.D29]<>"";IF(AND([.B29]<>"";[.C29]<>"");"";"ERR");"") -> 
B30: of:=IF( ISBLANK([$'03.Muestra'.$C$19]);"";[$'03.Muestra'.$C$19]) ->  | C30: of:=IF( ISBLANK([$'03.Muestra'.$E$19]);"";[$'03.Muestra'.$E$19]) ->  | D30: of:=IF(AND([.B30]<>"";[.C30]<>"");"N/T";"") ->  | E30: of:=IF([.D30]<>"";IF(AND([.B30]<>"";[.C30]<>"");"";"ERR");"") -> 
B31: of:=IF( ISBLANK([$'03.Muestra'.$C$20]);"";[$'03.Muestra'.$C$20]) ->  | C31: of:=IF( ISBLANK([$'03.Muestra'.$E$20]);"";[$'03.Muestra'.$E$20]) ->  | D31: of:=IF(AND([.B31]<>"";[.C31]<>"");"N/T";"") ->  | E31: of:=IF([.D31]<>"";IF(AND([.B31]<>"";[.C31]<>"");"";"ERR");"") -> 
B32: of:=IF( ISBLANK([$'03.Muestra'.$C$21]);"";[$'03.Muestra'.$C$21]) ->  | C32: of:=IF( ISBLANK([$'03.Muestra'.$E$21]);"";[$'03.Muestra'.$E$21]) ->  | D32: of:=IF(AND([.B32]<>"";[.C32]<>"");"N/T";"") ->  | E32: of:=IF([.D32]<>"";IF(AND([.B32]<>"";[.C32]<>"");"";"ERR");"") -> 
B33: of:=IF( ISBLANK([$'03.Muestra'.$C$22]);"";[$'03.Muestra'.$C$22]) ->  | C33: of:=IF( ISBLANK([$'03.Muestra'.$E$22]);"";[$'03.Muestra'.$E$22]) ->  | D33: of:=IF(AND([.B33]<>"";[.C33]<>"");"N/T";"") ->  | E33: of:=IF([.D33]<>"";IF(AND([.B33]<>"";[.C33]<>"");"";"ERR");"") -> 
B34: of:=IF( ISBLANK([$'03.Muestra'.$C$23]);"";[$'03.Muestra'.$C$23]) ->  | C34: of:=IF( ISBLANK([$'03.Muestra'.$E$23]);"";[$'03.Muestra'.$E$23]) ->  | D34: of:=IF(AND([.B34]<>"";[.C34]<>"");"N/T";"") ->  | E34: of:=IF([.D34]<>"";IF(AND([.B34]<>"";[.C34]<>"");"";"ERR");"") -> 
B35: of:=IF( ISBLANK([$'03.Muestra'.$C$24]);"";[$'03.Muestra'.$C$24]) ->  | C35: of:=IF( ISBLANK([$'03.Muestra'.$E$24]);"";[$'03.Muestra'.$E$24]) ->  | D35: of:=IF(AND([.B35]<>"";[.C35]<>"");"N/T";"") ->  | E35: of:=IF([.D35]<>"";IF(AND([.B35]<>"";[.C35]<>"");"";"ERR");"") -> 
B36: of:=IF( ISBLANK([$'03.Muestra'.$C$25]);"";[$'03.Muestra'.$C$25]) ->  | C36: of:=IF( ISBLANK([$'03.Muestra'.$E$25]);"";[$'03.Muestra'.$E$25]) ->  | D36: of:=IF(AND([.B36]<>"";[.C36]<>"");"N/T";"") ->  | E36: of:=IF([.D36]<>"";IF(AND([.B36]<>"";[.C36]<>"");"";"ERR");"") -> 
B37: of:=IF( ISBLANK([$'03.Muestra'.$C$26]);"";[$'03.Muestra'.$C$26]) ->  | C37: of:=IF( ISBLANK([$'03.Muestra'.$E$26]);"";[$'03.Muestra'.$E$26]) ->  | D37: of:=IF(AND([.B37]<>"";[.C37]<>"");"N/T";"") ->  | E37: of:=IF([.D37]<>"";IF(AND([.B37]<>"";[.C37]<>"");"";"ERR");"") -> 
B38: of:=IF( ISBLANK([$'03.Muestra'.$C$27]);"";[$'03.Muestra'.$C$27]) ->  | C38: of:=IF( ISBLANK([$'03.Muestra'.$E$27]);"";[$'03.Muestra'.$E$27]) ->  | D38: of:=IF(AND([.B38]<>"";[.C38]<>"");"N/T";"") ->  | E38: of:=IF([.D38]<>"";IF(AND([.B38]<>"";[.C38]<>"");"";"ERR");"") -> 
B39: of:=IF( ISBLANK([$'03.Muestra'.$C$28]);"";[$'03.Muestra'.$C$28]) ->  | C39: of:=IF( ISBLANK([$'03.Muestra'.$E$28]);"";[$'03.Muestra'.$E$28]) ->  | D39: of:=IF(AND([.B39]<>"";[.C39]<>"");"N/T";"") ->  | E39: of:=IF([.D39]<>"";IF(AND([.B39]<>"";[.C39]<>"");"";"ERR");"") -> 
B40: of:=IF( ISBLANK([$'03.Muestra'.$C$29]);"";[$'03.Muestra'.$C$29]) ->  | C40: of:=IF( ISBLANK([$'03.Muestra'.$E$29]);"";[$'03.Muestra'.$E$29]) ->  | D40: of:=IF(AND([.B40]<>"";[.C40]<>"");"N/T";"") ->  | E40: of:=IF([.D40]<>"";IF(AND([.B40]<>"";[.C40]<>"");"";"ERR");"") -> 
B41: of:=IF( ISBLANK([$'03.Muestra'.$C$30]);"";[$'03.Muestra'.$C$30]) ->  | C41: of:=IF( ISBLANK([$'03.Muestra'.$E$30]);"";[$'03.Muestra'.$E$30]) ->  | D41: of:=IF(AND([.B41]<>"";[.C41]<>"");"N/T";"") ->  | E41: of:=IF([.D41]<>"";IF(AND([.B41]<>"";[.C41]<>"");"";"ERR");"") -> 
B42: of:=IF( ISBLANK([$'03.Muestra'.$C$31]);"";[$'03.Muestra'.$C$31]) ->  | C42: of:=IF( ISBLANK([$'03.Muestra'.$E$31]);"";[$'03.Muestra'.$E$31]) ->  | D42: of:=IF(AND([.B42]<>"";[.C42]<>"");"N/T";"") ->  | E42: of:=IF([.D42]<>"";IF(AND([.B42]<>"";[.C42]<>"");"";"ERR");"") -> 
B43: of:=IF( ISBLANK([$'03.Muestra'.$C$32]);"";[$'03.Muestra'.$C$32]) ->  | C43: of:=IF( ISBLANK([$'03.Muestra'.$E$32]);"";[$'03.Muestra'.$E$32]) ->  | D43: of:=IF(AND([.B43]<>"";[.C43]<>"");"N/T";"") ->  | E43: of:=IF([.D43]<>"";IF(AND([.B43]<>"";[.C43]<>"");"";"ERR");"") -> 
B44: of:=IF( ISBLANK([$'03.Muestra'.$C$33]);"";[$'03.Muestra'.$C$33]) ->  | C44: of:=IF( ISBLANK([$'03.Muestra'.$E$33]);"";[$'03.Muestra'.$E$33]) ->  | D44: of:=IF(AND([.B44]<>"";[.C44]<>"");"N/T";"") ->  | E44: of:=IF([.D44]<>"";IF(AND([.B44]<>"";[.C44]<>"");"";"ERR");"") -> 
B45: of:=IF( ISBLANK([$'03.Muestra'.$C$34]);"";[$'03.Muestra'.$C$34]) ->  | C45: of:=IF( ISBLANK([$'03.Muestra'.$E$34]);"";[$'03.Muestra'.$E$34]) ->  | D45: of:=IF(AND([.B45]<>"";[.C45]<>"");"N/T";"") ->  | E45: of:=IF([.D45]<>"";IF(AND([.B45]<>"";[.C45]<>"");"";"ERR");"") -> 
B46: of:=IF( ISBLANK([$'03.Muestra'.$C$35]);"";[$'03.Muestra'.$C$35]) ->  | C46: of:=IF( ISBLANK([$'03.Muestra'.$E$35]);"";[$'03.Muestra'.$E$35]) ->  | D46: of:=IF(AND([.B46]<>"";[.C46]<>"");"N/T";"") ->  | E46: of:=IF([.D46]<>"";IF(AND([.B46]<>"";[.C46]<>"");"";"ERR");"") -> 
B47: of:=IF( ISBLANK([$'03.Muestra'.$C$36]);"";[$'03.Muestra'.$C$36]) ->  | C47: of:=IF( ISBLANK([$'03.Muestra'.$E$36]);"";[$'03.Muestra'.$E$36]) ->  | D47: of:=IF(AND([.B47]<>"";[.C47]<>"");"N/T";"") ->  | E47: of:=IF([.D47]<>"";IF(AND([.B47]<>"";[.C47]<>"");"";"ERR");"") -> 
B48: of:=IF( ISBLANK([$'03.Muestra'.$C$37]);"";[$'03.Muestra'.$C$37]) ->  | C48: of:=IF( ISBLANK([$'03.Muestra'.$E$37]);"";[$'03.Muestra'.$E$37]) ->  | D48: of:=IF(AND([.B48]<>"";[.C48]<>"");"N/T";"") ->  | E48: of:=IF([.D48]<>"";IF(AND([.B48]<>"";[.C48]<>"");"";"ERR");"") -> 
B51: AA | C51: 3.1.2 Idioma de las partes | D51: Resultado
B52: of:=IF( ISBLANK([$'03.Muestra'.$C$8]);"";[$'03.Muestra'.$C$8]) ->  | C52: of:=IF( ISBLANK([$'03.Muestra'.$E$8]);"";[$'03.Muestra'.$E$8]) ->  | D52: of:=IF(AND([.B52]<>"";[.C52]<>"");"N/T";"") ->  | E52: of:=IF([.D52]<>"";IF(AND([.B52]<>"";[.C52]<>"");"";"ERR");"") ->  | F52: of:=TRANSPOSE([$'DATA - Oculta'.$U$9:$'DATA - Oculta'.$U$13]) -> N/T | G52: N/D | H52: N/A | I52: Falla | J52: Pasa | K52: En blanco
B53: of:=IF( ISBLANK([$'03.Muestra'.$C$9]);"";[$'03.Muestra'.$C$9]) ->  | C53: of:=IF( ISBLANK([$'03.Muestra'.$E$9]);"";[$'03.Muestra'.$E$9]) ->  | D53: of:=IF(AND([.B53]<>"";[.C53]<>"");"N/T";"") ->  | E53: of:=IF([.D53]<>"";IF(AND([.B53]<>"";[.C53]<>"");"";"ERR");"") ->  | F53: of:=COUNTIF([.$D52]:INDIRECT("$D" &  SUM(ROW()-1;[$'03.Muestra'.$D$40])-1);[.F52]) -> 0 | G53: of:=COUNTIF([.$D52]:INDIRECT("$D" &  SUM(ROW()-1;[$'03.Muestra'.$D$40])-1);[.G52]) -> 0 | H53: of:=COUNTIF([.$D52]:INDIRECT("$D" &  SUM(ROW()-1;[$'03.Muestra'.$D$40])-1);[.H52]) -> 0 | I53: of:=COUNTIF([.$D52]:INDIRECT("$D" &  SUM(ROW()-1;[$'03.Muestra'.$D$40])-1);[.I52]) -> 0 | J53: of:=COUNTIF([.$D52]:INDIRECT("$D" &  SUM(ROW()-1;[$'03.Muestra'.$D$40])-1);[.J52]) -> 0 | K53: of:=IF([$'03.Muestra'.$D$40]=0;0;COUNTBLANK([.$D52]:INDIRECT("$D" &  SUM(ROW()-1;[$'03.Muestra'.$D$40])-1))) -> 0
B54: of:=IF( ISBLANK([$'03.Muestra'.$C$10]);"";[$'03.Muestra'.$C$10]) ->  | C54: of:=IF( ISBLANK([$'03.Muestra'.$E$10]);"";[$'03.Muestra'.$E$10]) ->  | D54: of:=IF(AND([.B54]<>"";[.C54]<>"");"N/T";"") ->  | E54: of:=IF([.D54]<>"";IF(AND([.B54]<>"";[.C54]<>"");"";"ERR");"") -> 
B55: of:=IF( ISBLANK([$'03.Muestra'.$C$11]);"";[$'03.Muestra'.$C$11]) ->  | C55: of:=IF( ISBLANK([$'03.Muestra'.$E$11]);"";[$'03.Muestra'.$E$11]) ->  | D55: of:=IF(AND([.B55]<>"";[.C55]<>"");"N/T";"") ->  | E55: of:=IF([.D55]<>"";IF(AND([.B55]<>"";[.C55]<>"");"";"ERR");"") -> 
B56: of:=IF( ISBLANK([$'03.Muestra'.$C$12]);"";[$'03.Muestra'.$C$12]) ->  | C56: of:=IF( ISBLANK([$'03.Muestra'.$E$12]);"";[$'03.Muestra'.$E$12]) ->  | D56: of:=IF(AND([.B56]<>"";[.C56]<>"");"N/T";"") ->  | E56: of:=IF([.D56]<>"";IF(AND([.B56]<>"";[.C56]<>"");"";"ERR");"") -> 
B57: of:=IF( ISBLANK([$'03.Muestra'.$C$13]);"";[$'03.Muestra'.$C$13]) ->  | C57: of:=IF( ISBLANK([$'03.Muestra'.$E$13]);"";[$'03.Muestra'.$E$13]) ->  | D57: of:=IF(AND([.B57]<>"";[.C57]<>"");"N/T";"") ->  | E57: of:=IF([.D57]<>"";IF(AND([.B57]<>"";[.C57]<>"");"";"ERR");"") -> 
B58: of:=IF( ISBLANK([$'03.Muestra'.$C$14]);"";[$'03.Muestra'.$C$14]) ->  | C58: of:=IF( ISBLANK([$'03.Muestra'.$E$14]);"";[$'03.Muestra'.$E$14]) ->  | D58: of:=IF(AND([.B58]<>"";[.C58]<>"");"N/T";"") ->  | E58: of:=IF([.D58]<>"";IF(AND([.B58]<>"";[.C58]<>"");"";"ERR");"") -> 
B59: of:=IF( ISBLANK([$'03.Muestra'.$C$15]);"";[$'03.Muestra'.$C$15]) ->  | C59: of:=IF( ISBLANK([$'03.Muestra'.$E$15]);"";[$'03.Muestra'.$E$15]) ->  | D59: of:=IF(AND([.B59]<>"";[.C59]<>"");"N/T";"") ->  | E59: of:=IF([.D59]<>"";IF(AND([.B59]<>"";[.C59]<>"");"";"ERR");"") -> 
B60: of:=IF( ISBLANK([$'03.Muestra'.$C$16]);"";[$'03.Muestra'.$C$16]) ->  | C60: of:=IF( ISBLANK([$'03.Muestra'.$E$16]);"";[$'03.Muestra'.$E$16]) ->  | D60: of:=IF(AND([.B60]<>"";[.C60]<>"");"N/T";"") ->  | E60: of:=IF([.D60]<>"";IF(AND([.B60]<>"";[.C60]<>"");"";"ERR");"") -> 
B61: of:=IF( ISBLANK([$'03.Muestra'.$C$17]);"";[$'03.Muestra'.$C$17]) ->  | C61: of:=IF( ISBLANK([$'03.Muestra'.$E$17]);"";[$'03.Muestra'.$E$17]) ->  | D61: of:=IF(AND([.B61]<>"";[.C61]<>"");"N/T";"") ->  | E61: of:=IF([.D61]<>"";IF(AND([.B61]<>"";[.C61]<>"");"";"ERR");"") -> 
B62: of:=IF( ISBLANK([$'03.Muestra'.$C$18]);"";[$'03.Muestra'.$C$18]) ->  | C62: of:=IF( ISBLANK([$'03.Muestra'.$E$18]);"";[$'03.Muestra'.$E$18]) ->  | D62: of:=IF(AND([.B62]<>"";[.C62]<>"");"N/T";"") ->  | E62: of:=IF([.D62]<>"";IF(AND([.B62]<>"";[.C62]<>"");"";"ERR");"") -> 
B63: of:=IF( ISBLANK([$'03.Muestra'.$C$19]);"";[$'03.Muestra'.$C$19]) ->  | C63: of:=IF( ISBLANK([$'03.Muestra'.$E$19]);"";[$'03.Muestra'.$E$19]) ->  | D63: of:=IF(AND([.B63]<>"";[.C63]<>"");"N/T";"") ->  | E63: of:=IF([.D63]<>"";IF(AND([.B63]<>"";[.C63]<>"");"";"ERR");"") -> 
B64: of:=IF( ISBLANK([$'03.Muestra'.$C$20]);"";[$'03.Muestra'.$C$20]) ->  | C64: of:=IF( ISBLANK([$'03.Muestra'.$E$20]);"";[$'03.Muestra'.$E$20]) ->  | D64: of:=IF(AND([.B64]<>"";[.C64]<>"");"N/T";"") ->  | E64: of:=IF([.D64]<>"";IF(AND([.B64]<>"";[.C64]<>"");"";"ERR");"") -> 
B65: of:=IF( ISBLANK([$'03.Muestra'.$C$21]);"";[$'03.Muestra'.$C$21]) ->  | C65: of:=IF( ISBLANK([$'03.Muestra'.$E$21]);"";[$'03.Muestra'.$E$21]) ->  | D65: of:=IF(AND([.B65]<>"";[.C65]<>"");"N/T";"") ->  | E65: of:=IF([.D65]<>"";IF(AND([.B65]<>"";[.C65]<>"");"";"ERR");"") -> 
B66: of:=IF( ISBLANK([$'03.Muestra'.$C$22]);"";[$'03.Muestra'.$C$22]) ->  | C66: of:=IF( ISBLANK([$'03.Muestra'.$E$22]);"";[$'03.Muestra'.$E$22]) ->  | D66: of:=IF(AND([.B66]<>"";[.C66]<>"");"N/T";"") ->  | E66: of:=IF([.D66]<>"";IF(AND([.B66]<>"";[.C66]<>"");"";"ERR");"") -> 
B67: of:=IF( ISBLANK([$'03.Muestra'.$C$23]);"";[$'03.Muestra'.$C$23]) ->  | C67: of:=IF( ISBLANK([$'03.Muestra'.$E$23]);"";[$'03.Muestra'.$E$23]) ->  | D67: of:=IF(AND([.B67]<>"";[.C67]<>"");"N/T";"") ->  | E67: of:=IF([.D67]<>"";IF(AND([.B67]<>"";[.C67]<>"");"";"ERR");"") -> 
B68: of:=IF( ISBLANK([$'03.Muestra'.$C$24]);"";[$'03.Muestra'.$C$24]) ->  | C68: of:=IF( ISBLANK([$'03.Muestra'.$E$24]);"";[$'03.Muestra'.$E$24]) ->  | D68: of:=IF(AND([.B68]<>"";[.C68]<>"");"N/T";"") ->  | E68: of:=IF([.D68]<>"";IF(AND([.B68]<>"";[.C68]<>"");"";"ERR");"") -> 
B69: of:=IF( ISBLANK([$'03.Muestra'.$C$25]);"";[$'03.Muestra'.$C$25]) ->  | C69: of:=IF( ISBLANK([$'03.Muestra'.$E$25]);"";[$'03.Muestra'.$E$25]) ->  | D69: of:=IF(AND([.B69]<>"";[.C69]<>"");"N/T";"") ->  | E69: of:=IF([.D69]<>"";IF(AND([.B69]<>"";[.C69]<>"");"";"ERR");"") -> 
B70: of:=IF( ISBLANK([$'03.Muestra'.$C$26]);"";[$'03.Muestra'.$C$26]) ->  | C70: of:=IF( ISBLANK([$'03.Muestra'.$E$26]);"";[$'03.Muestra'.$E$26]) ->  | D70: of:=IF(AND([.B70]<>"";[.C70]<>"");"N/T";"") ->  | E70: of:=IF([.D70]<>"";IF(AND([.B70]<>"";[.C70]<>"");"";"ERR");"") -> 
B71: of:=IF( ISBLANK([$'03.Muestra'.$C$27]);"";[$'03.Muestra'.$C$27]) ->  | C71: of:=IF( ISBLANK([$'03.Muestra'.$E$27]);"";[$'03.Muestra'.$E$27]) ->  | D71: of:=IF(AND([.B71]<>"";[.C71]<>"");"N/T";"") ->  | E71: of:=IF([.D71]<>"";IF(AND([.B71]<>"";[.C71]<>"");"";"ERR");"") -> 
B72: of:=IF( ISBLANK([$'03.Muestra'.$C$28]);"";[$'03.Muestra'.$C$28]) ->  | C72: of:=IF( ISBLANK([$'03.Muestra'.$E$28]);"";[$'03.Muestra'.$E$28]) ->  | D72: of:=IF(AND([.B72]<>"";[.C72]<>"");"N/T";"") ->  | E72: of:=IF([.D72]<>"";IF(AND([.B72]<>"";[.C72]<>"");"";"ERR");"") -> 
B73: of:=IF( ISBLANK([$'03.Muestra'.$C$29]);"";[$'03.Muestra'.$C$29]) ->  | C73: of:=IF( ISBLANK([$'03.Muestra'.$E$29]);"";[$'03.Muestra'.$E$29]) ->  | D73: of:=IF(AND([.B73]<>"";[.C73]<>"");"N/T";"") ->  | E73: of:=IF([.D73]<>"";IF(AND([.B73]<>"";[.C73]<>"");"";"ERR");"") -> 
B74: of:=IF( ISBLANK([$'03.Muestra'.$C$30]);"";[$'03.Muestra'.$C$30]) ->  | C74: of:=IF( ISBLANK([$'03.Muestra'.$E$30]);"";[$'03.Muestra'.$E$30]) ->  | D74: of:=IF(AND([.B74]<>"";[.C74]<>"");"N/T";"") ->  | E74: of:=IF([.D74]<>"";IF(AND([.B74]<>"";[.C74]<>"");"";"ERR");"") -> 
B75: of:=IF( ISBLANK([$'03.Muestra'.$C$31]);"";[$'03.Muestra'.$C$31]) ->  | C75: of:=IF( ISBLANK([$'03.Muestra'.$E$31]);"";[$'03.Muestra'.$E$31]) ->  | D75: of:=IF(AND([.B75]<>"";[.C75]<>"");"N/T";"") ->  | E75: of:=IF([.D75]<>"";IF(AND([.B75]<>"";[.C75]<>"");"";"ERR");"") -> 
B76: of:=IF( ISBLANK([$'03.Muestra'.$C$32]);"";[$'03.Muestra'.$C$32]) ->  | C76: of:=IF( ISBLANK([$'03.Muestra'.$E$32]);"";[$'03.Muestra'.$E$32]) ->  | D76: of:=IF(AND([.B76]<>"";[.C76]<>"");"N/T";"") ->  | E76: of:=IF([.D76]<>"";IF(AND([.B76]<>"";[.C76]<>"");"";"ERR");"") -> 
B77: of:=IF( ISBLANK([$'03.Muestra'.$C$33]);"";[$'03.Muestra'.$C$33]) ->  | C77: of:=IF( ISBLANK([$'03.Muestra'.$E$33]);"";[$'03.Muestra'.$E$33]) ->  | D77: of:=IF(AND([.B77]<>"";[.C77]<>"");"N/T";"") ->  | E77: of:=IF([.D77]<>"";IF(AND([.B77]<>"";[.C77]<>"");"";"ERR");"") -> 
B78: of:=IF( ISBLANK([$'03.Muestra'.$C$34]);"";[$'03.Muestra'.$C$34]) ->  | C78: of:=IF( ISBLANK([$'03.Muestra'.$E$34]);"";[$'03.Muestra'.$E$34]) ->  | D78: of:=IF(AND([.B78]<>"";[.C78]<>"");"N/T";"") ->  | E78: of:=IF([.D78]<>"";IF(AND([.B78]<>"";[.C78]<>"");"";"ERR");"") -> 
B79: of:=IF( ISBLANK([$'03.Muestra'.$C$35]);"";[$'03.Muestra'.$C$35]) ->  | C79: of:=IF( ISBLANK([$'03.Muestra'.$E$35]);"";[$'03.Muestra'.$E$35]) ->  | D79: of:=IF(AND([.B79]<>"";[.C79]<>"");"N/T";"") ->  | E79: of:=IF([.D79]<>"";IF(AND([.B79]<>"";[.C79]<>"");"";"ERR");"") -> 
B80: of:=IF( ISBLANK([$'03.Muestra'.$C$36]);"";[$'03.Muestra'.$C$36]) ->  | C80: of:=IF( ISBLANK([$'03.Muestra'.$E$36]);"";[$'03.Muestra'.$E$36]) ->  | D80: of:=IF(AND([.B80]<>"";[.C80]<>"");"N/T";"") ->  | E80: of:=IF([.D80]<>"";IF(AND([.B80]<>"";[.C80]<>"");"";"ERR");"") -> 
B81: of:=IF( ISBLANK([$'03.Muestra'.$C$37]);"";[$'03.Muestra'.$C$37]) ->  | C81: of:=IF( ISBLANK([$'03.Muestra'.$E$37]);"";[$'03.Muestra'.$E$37]) ->  | D81: of:=IF(AND([.B81]<>"";[.C81]<>"");"N/T";"") ->  | E81: of:=IF([.D81]<>"";IF(AND([.B81]<>"";[.C81]<>"");"";"ERR");"") -> 
B84: A | C84: 3.2.1 Al recibir el foco | D84: Resultado
B85: of:=IF( ISBLANK([$'03.Muestra'.$C$8]);"";[$'03.Muestra'.$C$8]) ->  | C85: of:=IF( ISBLANK([$'03.Muestra'.$E$8]);"";[$'03.Muestra'.$E$8]) ->  | D85: of:=IF(AND([.B85]<>"";[.C85]<>"");"N/T";"") ->  | E85: of:=IF([.D85]<>"";IF(AND([.B85]<>"";[.C85]<>"");"";"ERR");"") ->  | F85: of:=TRANSPOSE([$'DATA - Oculta'.$U$9:$'DATA - Oculta'.$U$13]) -> N/T | G85: N/D | H85: N/A | I85: Falla | J85: Pasa | K85: En blanco
B86: of:=IF( ISBLANK([$'03.Muestra'.$C$9]);"";[$'03.Muestra'.$C$9]) ->  | C86: of:=IF( ISBLANK([$'03.Muestra'.$E$9]);"";[$'03.Muestra'.$E$9]) ->  | D86: of:=IF(AND([.B86]<>"";[.C86]<>"");"N/T";"") ->  | E86: of:=IF([.D86]<>"";IF(AND([.B86]<>"";[.C86]<>"");"";"ERR");"") ->  | F86: of:=COUNTIF([.$D85]:INDIRECT("$D" &  SUM(ROW()-1;[$'03.Muestra'.$D$40])-1);[.F85]) -> 0 | G86: of:=COUNTIF([.$D85]:INDIRECT("$D" &  SUM(ROW()-1;[$'03.Muestra'.$D$40])-1);[.G85]) -> 0 | H86: of:=COUNTIF([.$D85]:INDIRECT("$D" &  SUM(ROW()-1;[$'03.Muestra'.$D$40])-1);[.H85]) -> 0 | I86: of:=COUNTIF([.$D85]:INDIRECT("$D" &  SUM(ROW()-1;[$'03.Muestra'.$D$40])-1);[.I85]) -> 0 | J86: of:=COUNTIF([.$D85]:INDIRECT("$D" &  SUM(ROW()-1;[$'03.Muestra'.$D$40])-1);[.J85]) -> 0 | K86: of:=IF([$'03.Muestra'.$D$40]=0;0;COUNTBLANK([.$D85]:INDIRECT("$D" &  SUM(ROW()-1;[$'03.Muestra'.$D$40])-1))) -> 0
B87: of:=IF( ISBLANK([$'03.Muestra'.$C$10]);"";[$'03.Muestra'.$C$10]) ->  | C87: of:=IF( ISBLANK([$'03.Muestra'.$E$10]);"";[$'03.Muestra'.$E$10]) ->  | D87: of:=IF(AND([.B87]<>"";[.C87]<>"");"N/T";"") ->  | E87: of:=IF([.D87]<>"";IF(AND([.B87]<>"";[.C87]<>"");"";"ERR");"") -> 
B88: of:=IF( ISBLANK([$'03.Muestra'.$C$11]);"";[$'03.Muestra'.$C$11]) ->  | C88: of:=IF( ISBLANK([$'03.Muestra'.$E$11]);"";[$'03.Muestra'.$E$11]) ->  | D88: of:=IF(AND([.B88]<>"";[.C88]<>"");"N/T";"") ->  | E88: of:=IF([.D88]<>"";IF(AND([.B88]<>"";[.C88]<>"");"";"ERR");"") -> 
B89: of:=IF( ISBLANK([$'03.Muestra'.$C$12]);"";[$'03.Muestra'.$C$12]) ->  | C89: of:=IF( ISBLANK([$'03.Muestra'.$E$12]);"";[$'03.Muestra'.$E$12]) ->  | D89: of:=IF(AND([.B89]<>"";[.C89]<>"");"N/T";"") ->  | E89: of:=IF([.D89]<>"";IF(AND([.B89]<>"";[.C89]<>"");"";"ERR");"") -> 
B90: of:=IF( ISBLANK([$'03.Muestra'.$C$13]);"";[$'03.Muestra'.$C$13]) ->  | C90: of:=IF( ISBLANK([$'03.Muestra'.$E$13]);"";[$'03.Muestra'.$E$13]) ->  | D90: of:=IF(AND([.B90]<>"";[.C90]<>"");"N/T";"") ->  | E90: of:=IF([.D90]<>"";IF(AND([.B90]<>"";[.C90]<>"");"";"ERR");"") -> 
B91: of:=IF( ISBLANK([$'03.Muestra'.$C$14]);"";[$'03.Muestra'.$C$14]) ->  | C91: of:=IF( ISBLANK([$'03.Muestra'.$E$14]);"";[$'03.Muestra'.$E$14]) ->  | D91: of:=IF(AND([.B91]<>"";[.C91]<>"");"N/T";"") ->  | E91: of:=IF([.D91]<>"";IF(AND([.B91]<>"";[.C91]<>"");"";"ERR");"") -> 
B92: of:=IF( ISBLANK([$'03.Muestra'.$C$15]);"";[$'03.Muestra'.$C$15]) ->  | C92: of:=IF( ISBLANK([$'03.Muestra'.$E$15]);"";[$'03.Muestra'.$E$15]) ->  | D92: of:=IF(AND([.B92]<>"";[.C92]<>"");"N/T";"") ->  | E92: of:=IF([.D92]<>"";IF(AND([.B92]<>"";[.C92]<>"");"";"ERR");"") -> 
B93: of:=IF( ISBLANK([$'03.Muestra'.$C$16]);"";[$'03.Muestra'.$C$16]) ->  | C93: of:=IF( ISBLANK([$'03.Muestra'.$E$16]);"";[$'03.Muestra'.$E$16]) ->  | D93: of:=IF(AND([.B93]<>"";[.C93]<>"");"N/T";"") ->  | E93: of:=IF([.D93]<>"";IF(AND([.B93]<>"";[.C93]<>"");"";"ERR");"") -> 
B94: of:=IF( ISBLANK([$'03.Muestra'.$C$17]);"";[$'03.Muestra'.$C$17]) ->  | C94: of:=IF( ISBLANK([$'03.Muestra'.$E$17]);"";[$'03.Muestra'.$E$17]) ->  | D94: of:=IF(AND([.B94]<>"";[.C94]<>"");"N/T";"") ->  | E94: of:=IF([.D94]<>"";IF(AND([.B94]<>"";[.C94]<>"");"";"ERR");"") -> 
B95: of:=IF( ISBLANK([$'03.Muestra'.$C$18]);"";[$'03.Muestra'.$C$18]) ->  | C95: of:=IF( ISBLANK([$'03.Muestra'.$E$18]);"";[$'03.Muestra'.$E$18]) ->  | D95: of:=IF(AND([.B95]<>"";[.C95]<>"");"N/T";"") ->  | E95: of:=IF([.D95]<>"";IF(AND([.B95]<>"";[.C95]<>"");"";"ERR");"") -> 
B96: of:=IF( ISBLANK([$'03.Muestra'.$C$19]);"";[$'03.Muestra'.$C$19]) ->  | C96: of:=IF( ISBLANK([$'03.Muestra'.$E$19]);"";[$'03.Muestra'.$E$19]) ->  | D96: of:=IF(AND([.B96]<>"";[.C96]<>"");"N/T";"") ->  | E96: of:=IF([.D96]<>"";IF(AND([.B96]<>"";[.C96]<>"");"";"ERR");"") -> 
B97: of:=IF( ISBLANK([$'03.Muestra'.$C$20]);"";[$'03.Muestra'.$C$20]) ->  | C97: of:=IF( ISBLANK([$'03.Muestra'.$E$20]);"";[$'03.Muestra'.$E$20]) ->  | D97: of:=IF(AND([.B97]<>"";[.C97]<>"");"N/T";"") ->  | E97: of:=IF([.D97]<>"";IF(AND([.B97]<>"";[.C97]<>"");"";"ERR");"") -> 
B98: of:=IF( ISBLANK([$'03.Muestra'.$C$21]);"";[$'03.Muestra'.$C$21]) ->  | C98: of:=IF( ISBLANK([$'03.Muestra'.$E$21]);"";[$'03.Muestra'.$E$21]) ->  | D98: of:=IF(AND([.B98]<>"";[.C98]<>"");"N/T";"") ->  | E98: of:=IF([.D98]<>"";IF(AND([.B98]<>"";[.C98]<>"");"";"ERR");"") -> 
B99: of:=IF( ISBLANK([$'03.Muestra'.$C$22]);"";[$'03.Muestra'.$C$22]) ->  | C99: of:=IF( ISBLANK([$'03.Muestra'.$E$22]);"";[$'03.Muestra'.$E$22]) ->  | D99: of:=IF(AND([.B99]<>"";[.C99]<>"");"N/T";"") ->  | E99: of:=IF([.D99]<>"";IF(AND([.B99]<>"";[.C99]<>"");"";"ERR");"") -> 
B100: of:=IF( ISBLANK([$'03.Muestra'.$C$23]);"";[$'03.Muestra'.$C$23]) ->  | C100: of:=IF( ISBLANK([$'03.Muestra'.$E$23]);"";[$'03.Muestra'.$E$23]) ->  | D100: of:=IF(AND([.B100]<>"";[.C100]<>"");"N/T";"") ->  | E100: of:=IF([.D100]<>"";IF(AND([.B100]<>"";[.C100]<>"");"";"ERR");"") -> 
B101: of:=IF( ISBLANK([$'03.Muestra'.$C$24]);"";[$'03.Muestra'.$C$24]) ->  | C101: of:=IF( ISBLANK([$'03.Muestra'.$E$24]);"";[$'03.Muestra'.$E$24]) ->  | D101: of:=IF(AND([.B101]<>"";[.C101]<>"");"N/T";"") ->  | E101: of:=IF([.D101]<>"";IF(AND([.B101]<>"";[.C101]<>"");"";"ERR");"") -> 
B102: of:=IF( ISBLANK([$'03.Muestra'.$C$25]);"";[$'03.Muestra'.$C$25]) ->  | C102: of:=IF( ISBLANK([$'03.Muestra'.$E$25]);"";[$'03.Muestra'.$E$25]) ->  | D102: of:=IF(AND([.B102]<>"";[.C102]<>"");"N/T";"") ->  | E102: of:=IF([.D102]<>"";IF(AND([.B102]<>"";[.C102]<>"");"";"ERR");"") -> 
B103: of:=IF( ISBLANK([$'03.Muestra'.$C$26]);"";[$'03.Muestra'.$C$26]) ->  | C103: of:=IF( ISBLANK([$'03.Muestra'.$E$26]);"";[$'03.Muestra'.$E$26]) ->  | D103: of:=IF(AND([.B103]<>"";[.C103]<>"");"N/T";"") ->  | E103: of:=IF([.D103]<>"";IF(AND([.B103]<>"";[.C103]<>"");"";"ERR");"") -> 
B104: of:=IF( ISBLANK([$'03.Muestra'.$C$27]);"";[$'03.Muestra'.$C$27]) ->  | C104: of:=IF( ISBLANK([$'03.Muestra'.$E$27]);"";[$'03.Muestra'.$E$27]) ->  | D104: of:=IF(AND([.B104]<>"";[.C104]<>"");"N/T";"") ->  | E104: of:=IF([.D104]<>"";IF(AND([.B104]<>"";[.C104]<>"");"";"ERR");"") -> 
B105: of:=IF( ISBLANK([$'03.Muestra'.$C$28]);"";[$'03.Muestra'.$C$28]) ->  | C105: of:=IF( ISBLANK([$'03.Muestra'.$E$28]);"";[$'03.Muestra'.$E$28]) ->  | D105: of:=IF(AND([.B105]<>"";[.C105]<>"");"N/T";"") ->  | E105: of:=IF([.D105]<>"";IF(AND([.B105]<>"";[.C105]<>"");"";"ERR");"") -> 
B106: of:=IF( ISBLANK([$'03.Muestra'.$C$29]);"";[$'03.Muestra'.$C$29]) ->  | C106: of:=IF( ISBLANK([$'03.Muestra'.$E$29]);"";[$'03.Muestra'.$E$29]) ->  | D106: of:=IF(AND([.B106]<>"";[.C106]<>"");"N/T";"") ->  | E106: of:=IF([.D106]<>"";IF(AND([.B106]<>"";[.C106]<>"");"";"ERR");"") -> 
B107: of:=IF( ISBLANK([$'03.Muestra'.$C$30]);"";[$'03.Muestra'.$C$30]) ->  | C107: of:=IF( ISBLANK([$'03.Muestra'.$E$30]);"";[$'03.Muestra'.$E$30]) ->  | D107: of:=IF(AND([.B107]<>"";[.C107]<>"");"N/T";"") ->  | E107: of:=IF([.D107]<>"";IF(AND([.B107]<>"";[.C107]<>"");"";"ERR");"") -> 
B108: of:=IF( ISBLANK([$'03.Muestra'.$C$31]);"";[$'03.Muestra'.$C$31]) ->  | C108: of:=IF( ISBLANK([$'03.Muestra'.$E$31]);"";[$'03.Muestra'.$E$31]) ->  | D108: of:=IF(AND([.B108]<>"";[.C108]<>"");"N/T";"") ->  | E108: of:=IF([.D108]<>"";IF(AND([.B108]<>"";[.C108]<>"");"";"ERR");"") -> 
B109: of:=IF( ISBLANK([$'03.Muestra'.$C$32]);"";[$'03.Muestra'.$C$32]) ->  | C109: of:=IF( ISBLANK([$'03.Muestra'.$E$32]);"";[$'03.Muestra'.$E$32]) ->  | D109: of:=IF(AND([.B109]<>"";[.C109]<>"");"N/T";"") ->  | E109: of:=IF([.D109]<>"";IF(AND([.B109]<>"";[.C109]<>"");"";"ERR");"") -> 
B110: of:=IF( ISBLANK([$'03.Muestra'.$C$33]);"";[$'03.Muestra'.$C$33]) ->  | C110: of:=IF( ISBLANK([$'03.Muestra'.$E$33]);"";[$'03.Muestra'.$E$33]) ->  | D110: of:=IF(AND([.B110]<>"";[.C110]<>"");"N/T";"") ->  | E110: of:=IF([.D110]<>"";IF(AND([.B110]<>"";[.C110]<>"");"";"ERR");"") -> 
B111: of:=IF( ISBLANK([$'03.Muestra'.$C$34]);"";[$'03.Muestra'.$C$34]) ->  | C111: of:=IF( ISBLANK([$'03.Muestra'.$E$34]);"";[$'03.Muestra'.$E$34]) ->  | D111: of:=IF(AND([.B111]<>"";[.C111]<>"");"N/T";"") ->  | E111: of:=IF([.D111]<>"";IF(AND([.B111]<>"";[.C111]<>"");"";"ERR");"") -> 
B112: of:=IF( ISBLANK([$'03.Muestra'.$C$35]);"";[$'03.Muestra'.$C$35]) ->  | C112: of:=IF( ISBLANK([$'03.Muestra'.$E$35]);"";[$'03.Muestra'.$E$35]) ->  | D112: of:=IF(AND([.B112]<>"";[.C112]<>"");"N/T";"") ->  | E112: of:=IF([.D112]<>"";IF(AND([.B112]<>"";[.C112]<>"");"";"ERR");"") -> 
B113: of:=IF( ISBLANK([$'03.Muestra'.$C$36]);"";[$'03.Muestra'.$C$36]) ->  | C113: of:=IF( ISBLANK([$'03.Muestra'.$E$36]);"";[$'03.Muestra'.$E$36]) ->  | D113: of:=IF(AND([.B113]<>"";[.C113]<>"");"N/T";"") ->  | E113: of:=IF([.D113]<>"";IF(AND([.B113]<>"";[.C113]<>"");"";"ERR");"") -> 
B114: of:=IF( ISBLANK([$'03.Muestra'.$C$37]);"";[$'03.Muestra'.$C$37]) ->  | C114: of:=IF( ISBLANK([$'03.Muestra'.$E$37]);"";[$'03.Muestra'.$E$37]) ->  | D114: of:=IF(AND([.B114]<>"";[.C114]<>"");"N/T";"") ->  | E114: of:=IF([.D114]<>"";IF(AND([.B114]<>"";[.C114]<>"");"";"ERR");"") -> 
B117: A | C117: 3.2.2 Al recibir entradas | D117: Resultado
B118: of:=IF( ISBLANK([$'03.Muestra'.$C$8]);"";[$'03.Muestra'.$C$8]) ->  | C118: of:=IF( ISBLANK([$'03.Muestra'.$E$8]);"";[$'03.Muestra'.$E$8]) ->  | D118: of:=IF(AND([.B118]<>"";[.C118]<>"");"N/T";"") ->  | E118: of:=IF([.D118]<>"";IF(AND([.B118]<>"";[.C118]<>"");"";"ERR");"") ->  | F118: of:=TRANSPOSE([$'DATA - Oculta'.$U$9:$'DATA - Oculta'.$U$13]) -> N/T | G118: N/D | H118: N/A | I118: Falla | J118: Pasa | K118: En blanco
B119: of:=IF( ISBLANK([$'03.Muestra'.$C$9]);"";[$'03.Muestra'.$C$9]) ->  | C119: of:=IF( ISBLANK([$'03.Muestra'.$E$9]);"";[$'03.Muestra'.$E$9]) ->  | D119: of:=IF(AND([.B119]<>"";[.C119]<>"");"N/T";"") ->  | E119: of:=IF([.D119]<>"";IF(AND([.B119]<>"";[.C119]<>"");"";"ERR");"") ->  | F119: of:=COUNTIF([.$D118]:INDIRECT("$D" &  SUM(ROW()-1;[$'03.Muestra'.$D$40])-1);[.F118]) -> 0 | G119: of:=COUNTIF([.$D118]:INDIRECT("$D" &  SUM(ROW()-1;[$'03.Muestra'.$D$40])-1);[.G118]) -> 0 | H119: of:=COUNTIF([.$D118]:INDIRECT("$D" &  SUM(ROW()-1;[$'03.Muestra'.$D$40])-1);[.H118]) -> 0 | I119: of:=COUNTIF([.$D118]:INDIRECT("$D" &  SUM(ROW()-1;[$'03.Muestra'.$D$40])-1);[.I118]) -> 0 | J119: of:=COUNTIF([.$D118]:INDIRECT("$D" &  SUM(ROW()-1;[$'03.Muestra'.$D$40])-1);[.J118]) -> 0 | K119: of:=IF([$'03.Muestra'.$D$40]=0;0;COUNTBLANK([.$D118]:INDIRECT("$D" &  SUM(ROW()-1;[$'03.Muestra'.$D$40])-1))) -> 0
B120: of:=IF( ISBLANK([$'03.Muestra'.$C$10]);"";[$'03.Muestra'.$C$10]) ->  | C120: of:=IF( ISBLANK([$'03.Muestra'.$E$10]);"";[$'03.Muestra'.$E$10]) ->  | D120: of:=IF(AND([.B120]<>"";[.C120]<>"");"N/T";"") ->  | E120: of:=IF([.D120]<>"";IF(AND([.B120]<>"";[.C120]<>"");"";"ERR");"") -> 
B121: of:=IF( ISBLANK([$'03.Muestra'.$C$11]);"";[$'03.Muestra'.$C$11]) ->  | C121: of:=IF( ISBLANK([$'03.Muestra'.$E$11]);"";[$'03.Muestra'.$E$11]) ->  | D121: of:=IF(AND([.B121]<>"";[.C121]<>"");"N/T";"") ->  | E121: of:=IF([.D121]<>"";IF(AND([.B121]<>"";[.C121]<>"");"";"ERR");"") -> 
B122: of:=IF( ISBLANK([$'03.Muestra'.$C$12]);"";[$'03.Muestra'.$C$12]) ->  | C122: of:=IF( ISBLANK([$'03.Muestra'.$E$12]);"";[$'03.Muestra'.$E$12]) ->  | D122: of:=IF(AND([.B122]<>"";[.C122]<>"");"N/T";"") ->  | E122: of:=IF([.D122]<>"";IF(AND([.B122]<>"";[.C122]<>"");"";"ERR");"") -> 
B123: of:=IF( ISBLANK([$'03.Muestra'.$C$13]);"";[$'03.Muestra'.$C$13]) ->  | C123: of:=IF( ISBLANK([$'03.Muestra'.$E$13]);"";[$'03.Muestra'.$E$13]) ->  | D123: of:=IF(AND([.B123]<>"";[.C123]<>"");"N/T";"") ->  | E123: of:=IF([.D123]<>"";IF(AND([.B123]<>"";[.C123]<>"");"";"ERR");"") -> 
B124: of:=IF( ISBLANK([$'03.Muestra'.$C$14]);"";[$'03.Muestra'.$C$14]) ->  | C124: of:=IF( ISBLANK([$'03.Muestra'.$E$14]);"";[$'03.Muestra'.$E$14]) ->  | D124: of:=IF(AND([.B124]<>"";[.C124]<>"");"N/T";"") ->  | E124: of:=IF([.D124]<>"";IF(AND([.B124]<>"";[.C124]<>"");"";"ERR");"") -> 
B125: of:=IF( ISBLANK([$'03.Muestra'.$C$15]);"";[$'03.Muestra'.$C$15]) ->  | C125: of:=IF( ISBLANK([$'03.Muestra'.$E$15]);"";[$'03.Muestra'.$E$15]) ->  | D125: of:=IF(AND([.B125]<>"";[.C125]<>"");"N/T";"") ->  | E125: of:=IF([.D125]<>"";IF(AND([.B125]<>"";[.C125]<>"");"";"ERR");"") -> 
B126: of:=IF( ISBLANK([$'03.Muestra'.$C$16]);"";[$'03.Muestra'.$C$16]) ->  | C126: of:=IF( ISBLANK([$'03.Muestra'.$E$16]);"";[$'03.Muestra'.$E$16]) ->  | D126: of:=IF(AND([.B126]<>"";[.C126]<>"");"N/T";"") ->  | E126: of:=IF([.D126]<>"";IF(AND([.B126]<>"";[.C126]<>"");"";"ERR");"") -> 
B127: of:=IF( ISBLANK([$'03.Muestra'.$C$17]);"";[$'03.Muestra'.$C$17]) ->  | C127: of:=IF( ISBLANK([$'03.Muestra'.$E$17]);"";[$'03.Muestra'.$E$17]) ->  | D127: of:=IF(AND([.B127]<>"";[.C127]<>"");"N/T";"") ->  | E127: of:=IF([.D127]<>"";IF(AND([.B127]<>"";[.C127]<>"");"";"ERR");"") -> 
B128: of:=IF( ISBLANK([$'03.Muestra'.$C$18]);"";[$'03.Muestra'.$C$18]) ->  | C128: of:=IF( ISBLANK([$'03.Muestra'.$E$18]);"";[$'03.Muestra'.$E$18]) ->  | D128: of:=IF(AND([.B128]<>"";[.C128]<>"");"N/T";"") ->  | E128: of:=IF([.D128]<>"";IF(AND([.B128]<>"";[.C128]<>"");"";"ERR");"") -> 
B129: of:=IF( ISBLANK([$'03.Muestra'.$C$19]);"";[$'03.Muestra'.$C$19]) ->  | C129: of:=IF( ISBLANK([$'03.Muestra'.$E$19]);"";[$'03.Muestra'.$E$19]) ->  | D129: of:=IF(AND([.B129]<>"";[.C129]<>"");"N/T";"") ->  | E129: of:=IF([.D129]<>"";IF(AND([.B129]<>"";[.C129]<>"");"";"ERR");"") -> 
B130: of:=IF( ISBLANK([$'03.Muestra'.$C$20]);"";[$'03.Muestra'.$C$20]) ->  | C130: of:=IF( ISBLANK([$'03.Muestra'.$E$20]);"";[$'03.Muestra'.$E$20]) ->  | D130: of:=IF(AND([.B130]<>"";[.C130]<>"");"N/T";"") ->  | E130: of:=IF([.D130]<>"";IF(AND([.B130]<>"";[.C130]<>"");"";"ERR");"") -> 
B131: of:=IF( ISBLANK([$'03.Muestra'.$C$21]);"";[$'03.Muestra'.$C$21]) ->  | C131: of:=IF( ISBLANK([$'03.Muestra'.$E$21]);"";[$'03.Muestra'.$E$21]) ->  | D131: of:=IF(AND([.B131]<>"";[.C131]<>"");"N/T";"") ->  | E131: of:=IF([.D131]<>"";IF(AND([.B131]<>"";[.C131]<>"");"";"ERR");"") -> 
B132: of:=IF( ISBLANK([$'03.Muestra'.$C$22]);"";[$'03.Muestra'.$C$22]) ->  | C132: of:=IF( ISBLANK([$'03.Muestra'.$E$22]);"";[$'03.Muestra'.$E$22]) ->  | D132: of:=IF(AND([.B132]<>"";[.C132]<>"");"N/T";"") ->  | E132: of:=IF([.D132]<>"";IF(AND([.B132]<>"";[.C132]<>"");"";"ERR");"") -> 
B133: of:=IF( ISBLANK([$'03.Muestra'.$C$23]);"";[$'03.Muestra'.$C$23]) ->  | C133: of:=IF( ISBLANK([$'03.Muestra'.$E$23]);"";[$'03.Muestra'.$E$23]) ->  | D133: of:=IF(AND([.B133]<>"";[.C133]<>"");"N/T";"") ->  | E133: of:=IF([.D133]<>"";IF(AND([.B133]<>"";[.C133]<>"");"";"ERR");"") -> 
B134: of:=IF( ISBLANK([$'03.Muestra'.$C$24]);"";[$'03.Muestra'.$C$24]) ->  | C134: of:=IF( ISBLANK([$'03.Muestra'.$E$24]);"";[$'03.Muestra'.$E$24]) ->  | D134: of:=IF(AND([.B134]<>"";[.C134]<>"");"N/T";"") ->  | E134: of:=IF([.D134]<>"";IF(AND([.B134]<>"";[.C134]<>"");"";"ERR");"") -> 
B135: of:=IF( ISBLANK([$'03.Muestra'.$C$25]);"";[$'03.Muestra'.$C$25]) ->  | C135: of:=IF( ISBLANK([$'03.Muestra'.$E$25]);"";[$'03.Muestra'.$E$25]) ->  | D135: of:=IF(AND([.B135]<>"";[.C135]<>"");"N/T";"") ->  | E135: of:=IF([.D135]<>"";IF(AND([.B135]<>"";[.C135]<>"");"";"ERR");"") -> 
B136: of:=IF( ISBLANK([$'03.Muestra'.$C$26]);"";[$'03.Muestra'.$C$26]) ->  | C136: of:=IF( ISBLANK([$'03.Muestra'.$E$26]);"";[$'03.Muestra'.$E$26]) ->  | D136: of:=IF(AND([.B136]<>"";[.C136]<>"");"N/T";"") ->  | E136: of:=IF([.D136]<>"";IF(AND([.B136]<>"";[.C136]<>"");"";"ERR");"") -> 
B137: of:=IF( ISBLANK([$'03.Muestra'.$C$27]);"";[$'03.Muestra'.$C$27]) ->  | C137: of:=IF( ISBLANK([$'03.Muestra'.$E$27]);"";[$'03.Muestra'.$E$27]) ->  | D137: of:=IF(AND([.B137]<>"";[.C137]<>"");"N/T";"") ->  | E137: of:=IF([.D137]<>"";IF(AND([.B137]<>"";[.C137]<>"");"";"ERR");"") -> 
B138: of:=IF( ISBLANK([$'03.Muestra'.$C$28]);"";[$'03.Muestra'.$C$28]) ->  | C138: of:=IF( ISBLANK([$'03.Muestra'.$E$28]);"";[$'03.Muestra'.$E$28]) ->  | D138: of:=IF(AND([.B138]<>"";[.C138]<>"");"N/T";"") ->  | E138: of:=IF([.D138]<>"";IF(AND([.B138]<>"";[.C138]<>"");"";"ERR");"") -> 
B139: of:=IF( ISBLANK([$'03.Muestra'.$C$29]);"";[$'03.Muestra'.$C$29]) ->  | C139: of:=IF( ISBLANK([$'03.Muestra'.$E$29]);"";[$'03.Muestra'.$E$29]) ->  | D139: of:=IF(AND([.B139]<>"";[.C139]<>"");"N/T";"") ->  | E139: of:=IF([.D139]<>"";IF(AND([.B139]<>"";[.C139]<>"");"";"ERR");"") -> 
B140: of:=IF( ISBLANK([$'03.Muestra'.$C$30]);"";[$'03.Muestra'.$C$30]) ->  | C140: of:=IF( ISBLANK([$'03.Muestra'.$E$30]);"";[$'03.Muestra'.$E$30]) ->  | D140: of:=IF(AND([.B140]<>"";[.C140]<>"");"N/T";"") ->  | E140: of:=IF([.D140]<>"";IF(AND([.B140]<>"";[.C140]<>"");"";"ERR");"") -> 
B141: of:=IF( ISBLANK([$'03.Muestra'.$C$31]);"";[$'03.Muestra'.$C$31]) ->  | C141: of:=IF( ISBLANK([$'03.Muestra'.$E$31]);"";[$'03.Muestra'.$E$31]) ->  | D141: of:=IF(AND([.B141]<>"";[.C141]<>"");"N/T";"") ->  | E141: of:=IF([.D141]<>"";IF(AND([.B141]<>"";[.C141]<>"");"";"ERR");"") -> 
B142: of:=IF( ISBLANK([$'03.Muestra'.$C$32]);"";[$'03.Muestra'.$C$32]) ->  | C142: of:=IF( ISBLANK([$'03.Muestra'.$E$32]);"";[$'03.Muestra'.$E$32]) ->  | D142: of:=IF(AND([.B142]<>"";[.C142]<>"");"N/T";"") ->  | E142: of:=IF([.D142]<>"";IF(AND([.B142]<>"";[.C142]<>"");"";"ERR");"") -> 
B143: of:=IF( ISBLANK([$'03.Muestra'.$C$33]);"";[$'03.Muestra'.$C$33]) ->  | C143: of:=IF( ISBLANK([$'03.Muestra'.$E$33]);"";[$'03.Muestra'.$E$33]) ->  | D143: of:=IF(AND([.B143]<>"";[.C143]<>"");"N/T";"") ->  | E143: of:=IF([.D143]<>"";IF(AND([.B143]<>"";[.C143]<>"");"";"ERR");"") -> 
B144: of:=IF( ISBLANK([$'03.Muestra'.$C$34]);"";[$'03.Muestra'.$C$34]) ->  | C144: of:=IF( ISBLANK([$'03.Muestra'.$E$34]);"";[$'03.Muestra'.$E$34]) ->  | D144: of:=IF(AND([.B144]<>"";[.C144]<>"");"N/T";"") ->  | E144: of:=IF([.D144]<>"";IF(AND([.B144]<>"";[.C144]<>"");"";"ERR");"") -> 
B145: of:=IF( ISBLANK([$'03.Muestra'.$C$35]);"";[$'03.Muestra'.$C$35]) ->  | C145: of:=IF( ISBLANK([$'03.Muestra'.$E$35]);"";[$'03.Muestra'.$E$35]) ->  | D145: of:=IF(AND([.B145]<>"";[.C145]<>"");"N/T";"") ->  | E145: of:=IF([.D145]<>"";IF(AND([.B145]<>"";[.C145]<>"");"";"ERR");"") -> 
B146: of:=IF( ISBLANK([$'03.Muestra'.$C$36]);"";[$'03.Muestra'.$C$36]) ->  | C146: of:=IF( ISBLANK([$'03.Muestra'.$E$36]);"";[$'03.Muestra'.$E$36]) ->  | D146: of:=IF(AND([.B146]<>"";[.C146]<>"");"N/T";"") ->  | E146: of:=IF([.D146]<>"";IF(AND([.B146]<>"";[.C146]<>"");"";"ERR");"") -> 
B147: of:=IF( ISBLANK([$'03.Muestra'.$C$37]);"";[$'03.Muestra'.$C$37]) ->  | C147: of:=IF( ISBLANK([$'03.Muestra'.$E$37]);"";[$'03.Muestra'.$E$37]) ->  | D147: of:=IF(AND([.B147]<>"";[.C147]<>"");"N/T";"") ->  | E147: of:=IF([.D147]<>"";IF(AND([.B147]<>"";[.C147]<>"");"";"ERR");"") -> 
B150: AA | C150: 3.2.3 NavegaciÃ³n coherente | D150: Resultado
B151: of:=IF( ISBLANK([$'03.Muestra'.$C$8]);"";[$'03.Muestra'.$C$8]) ->  | C151: of:=IF( ISBLANK([$'03.Muestra'.$E$8]);"";[$'03.Muestra'.$E$8]) ->  | D151: of:=IF(AND([.B151]<>"";[.C151]<>"");"N/T";"") ->  | E151: of:=IF([.D151]<>"";IF(AND([.B151]<>"";[.C151]<>"");"";"ERR");"") ->  | F151: of:=TRANSPOSE([$'DATA - Oculta'.$U$9:$'DATA - Oculta'.$U$13]) -> N/T | G151: N/D | H151: N/A | I151: Falla | J151: Pasa | K151: En blanco
B152: of:=IF( ISBLANK([$'03.Muestra'.$C$9]);"";[$'03.Muestra'.$C$9]) ->  | C152: of:=IF( ISBLANK([$'03.Muestra'.$E$9]);"";[$'03.Muestra'.$E$9]) ->  | D152: of:=IF(AND([.B152]<>"";[.C152]<>"");"N/T";"") ->  | E152: of:=IF([.D152]<>"";IF(AND([.B152]<>"";[.C152]<>"");"";"ERR");"") ->  | F152: of:=COUNTIF([.$D151]:INDIRECT("$D" &  SUM(ROW()-1;[$'03.Muestra'.$D$40])-1);[.F151]) -> 0 | G152: of:=COUNTIF([.$D151]:INDIRECT("$D" &  SUM(ROW()-1;[$'03.Muestra'.$D$40])-1);[.G151]) -> 0 | H152: of:=COUNTIF([.$D151]:INDIRECT("$D" &  SUM(ROW()-1;[$'03.Muestra'.$D$40])-1);[.H151]) -> 0 | I152: of:=COUNTIF([.$D151]:INDIRECT("$D" &  SUM(ROW()-1;[$'03.Muestra'.$D$40])-1);[.I151]) -> 0 | J152: of:=COUNTIF([.$D151]:INDIRECT("$D" &  SUM(ROW()-1;[$'03.Muestra'.$D$40])-1);[.J151]) -> 0 | K152: of:=IF([$'03.Muestra'.$D$40]=0;0;COUNTBLANK([.$D151]:INDIRECT("$D" &  SUM(ROW()-1;[$'03.Muestra'.$D$40])-1))) -> 0
B153: of:=IF( ISBLANK([$'03.Muestra'.$C$10]);"";[$'03.Muestra'.$C$10]) ->  | C153: of:=IF( ISBLANK([$'03.Muestra'.$E$10]);"";[$'03.Muestra'.$E$10]) ->  | D153: of:=IF(AND([.B153]<>"";[.C153]<>"");"N/T";"") ->  | E153: of:=IF([.D153]<>"";IF(AND([.B153]<>"";[.C153]<>"");"";"ERR");"") -> 
B154: of:=IF( ISBLANK([$'03.Muestra'.$C$11]);"";[$'03.Muestra'.$C$11]) ->  | C154: of:=IF( ISBLANK([$'03.Muestra'.$E$11]);"";[$'03.Muestra'.$E$11]) ->  | D154: of:=IF(AND([.B154]<>"";[.C154]<>"");"N/T";"") ->  | E154: of:=IF([.D154]<>"";IF(AND([.B154]<>"";[.C154]<>"");"";"ERR");"") -> 
B155: of:=IF( ISBLANK([$'03.Muestra'.$C$12]);"";[$'03.Muestra'.$C$12]) ->  | C155: of:=IF( ISBLANK([$'03.Muestra'.$E$12]);"";[$'03.Muestra'.$E$12]) ->  | D155: of:=IF(AND([.B155]<>"";[.C155]<>"");"N/T";"") ->  | E155: of:=IF([.D155]<>"";IF(AND([.B155]<>"";[.C155]<>"");"";"ERR");"") -> 
B156: of:=IF( ISBLANK([$'03.Muestra'.$C$13]);"";[$'03.Muestra'.$C$13]) ->  | C156: of:=IF( ISBLANK([$'03.Muestra'.$E$13]);"";[$'03.Muestra'.$E$13]) ->  | D156: of:=IF(AND([.B156]<>"";[.C156]<>"");"N/T";"") ->  | E156: of:=IF([.D156]<>"";IF(AND([.B156]<>"";[.C156]<>"");"";"ERR");"") -> 
B157: of:=IF( ISBLANK([$'03.Muestra'.$C$14]);"";[$'03.Muestra'.$C$14]) ->  | C157: of:=IF( ISBLANK([$'03.Muestra'.$E$14]);"";[$'03.Muestra'.$E$14]) ->  | D157: of:=IF(AND([.B157]<>"";[.C157]<>"");"N/T";"") ->  | E157: of:=IF([.D157]<>"";IF(AND([.B157]<>"";[.C157]<>"");"";"ERR");"") -> 
B158: of:=IF( ISBLANK([$'03.Muestra'.$C$15]);"";[$'03.Muestra'.$C$15]) ->  | C158: of:=IF( ISBLANK([$'03.Muestra'.$E$15]);"";[$'03.Muestra'.$E$15]) ->  | D158: of:=IF(AND([.B158]<>"";[.C158]<>"");"N/T";"") ->  | E158: of:=IF([.D158]<>"";IF(AND([.B158]<>"";[.C158]<>"");"";"ERR");"") -> 
B159: of:=IF( ISBLANK([$'03.Muestra'.$C$16]);"";[$'03.Muestra'.$C$16]) ->  | C159: of:=IF( ISBLANK([$'03.Muestra'.$E$16]);"";[$'03.Muestra'.$E$16]) ->  | D159: of:=IF(AND([.B159]<>"";[.C159]<>"");"N/T";"") ->  | E159: of:=IF([.D159]<>"";IF(AND([.B159]<>"";[.C159]<>"");"";"ERR");"") -> 
B160: of:=IF( ISBLANK([$'03.Muestra'.$C$17]);"";[$'03.Muestra'.$C$17]) ->  | C160: of:=IF( ISBLANK([$'03.Muestra'.$E$17]);"";[$'03.Muestra'.$E$17]) ->  | D160: of:=IF(AND([.B160]<>"";[.C160]<>"");"N/T";"") ->  | E160: of:=IF([.D160]<>"";IF(AND([.B160]<>"";[.C160]<>"");"";"ERR");"") -> 
B161: of:=IF( ISBLANK([$'03.Muestra'.$C$18]);"";[$'03.Muestra'.$C$18]) ->  | C161: of:=IF( ISBLANK([$'03.Muestra'.$E$18]);"";[$'03.Muestra'.$E$18]) ->  | D161: of:=IF(AND([.B161]<>"";[.C161]<>"");"N/T";"") ->  | E161: of:=IF([.D161]<>"";IF(AND([.B161]<>"";[.C161]<>"");"";"ERR");"") -> 
B162: of:=IF( ISBLANK([$'03.Muestra'.$C$19]);"";[$'03.Muestra'.$C$19]) ->  | C162: of:=IF( ISBLANK([$'03.Muestra'.$E$19]);"";[$'03.Muestra'.$E$19]) ->  | D162: of:=IF(AND([.B162]<>"";[.C162]<>"");"N/T";"") ->  | E162: of:=IF([.D162]<>"";IF(AND([.B162]<>"";[.C162]<>"");"";"ERR");"") -> 
B163: of:=IF( ISBLANK([$'03.Muestra'.$C$20]);"";[$'03.Muestra'.$C$20]) ->  | C163: of:=IF( ISBLANK([$'03.Muestra'.$E$20]);"";[$'03.Muestra'.$E$20]) ->  | D163: of:=IF(AND([.B163]<>"";[.C163]<>"");"N/T";"") ->  | E163: of:=IF([.D163]<>"";IF(AND([.B163]<>"";[.C163]<>"");"";"ERR");"") -> 
B164: of:=IF( ISBLANK([$'03.Muestra'.$C$21]);"";[$'03.Muestra'.$C$21]) ->  | C164: of:=IF( ISBLANK([$'03.Muestra'.$E$21]);"";[$'03.Muestra'.$E$21]) ->  | D164: of:=IF(AND([.B164]<>"";[.C164]<>"");"N/T";"") ->  | E164: of:=IF([.D164]<>"";IF(AND([.B164]<>"";[.C164]<>"");"";"ERR");"") -> 
B165: of:=IF( ISBLANK([$'03.Muestra'.$C$22]);"";[$'03.Muestra'.$C$22]) ->  | C165: of:=IF( ISBLANK([$'03.Muestra'.$E$22]);"";[$'03.Muestra'.$E$22]) ->  | D165: of:=IF(AND([.B165]<>"";[.C165]<>"");"N/T";"") ->  | E165: of:=IF([.D165]<>"";IF(AND([.B165]<>"";[.C165]<>"");"";"ERR");"") -> 
B166: of:=IF( ISBLANK([$'03.Muestra'.$C$23]);"";[$'03.Muestra'.$C$23]) ->  | C166: of:=IF( ISBLANK([$'03.Muestra'.$E$23]);"";[$'03.Muestra'.$E$23]) ->  | D166: of:=IF(AND([.B166]<>"";[.C166]<>"");"N/T";"") ->  | E166: of:=IF([.D166]<>"";IF(AND([.B166]<>"";[.C166]<>"");"";"ERR");"") -> 
B167: of:=IF( ISBLANK([$'03.Muestra'.$C$24]);"";[$'03.Muestra'.$C$24]) ->  | C167: of:=IF( ISBLANK([$'03.Muestra'.$E$24]);"";[$'03.Muestra'.$E$24]) ->  | D167: of:=IF(AND([.B167]<>"";[.C167]<>"");"N/T";"") ->  | E167: of:=IF([.D167]<>"";IF(AND([.B167]<>"";[.C167]<>"");"";"ERR");"") -> 
B168: of:=IF( ISBLANK([$'03.Muestra'.$C$25]);"";[$'03.Muestra'.$C$25]) ->  | C168: of:=IF( ISBLANK([$'03.Muestra'.$E$25]);"";[$'03.Muestra'.$E$25]) ->  | D168: of:=IF(AND([.B168]<>"";[.C168]<>"");"N/T";"") ->  | E168: of:=IF([.D168]<>"";IF(AND([.B168]<>"";[.C168]<>"");"";"ERR");"") -> 
B169: of:=IF( ISBLANK([$'03.Muestra'.$C$26]);"";[$'03.Muestra'.$C$26]) ->  | C169: of:=IF( ISBLANK([$'03.Muestra'.$E$26]);"";[$'03.Muestra'.$E$26]) ->  | D169: of:=IF(AND([.B169]<>"";[.C169]<>"");"N/T";"") ->  | E169: of:=IF([.D169]<>"";IF(AND([.B169]<>"";[.C169]<>"");"";"ERR");"") -> 
B170: of:=IF( ISBLANK([$'03.Muestra'.$C$27]);"";[$'03.Muestra'.$C$27]) ->  | C170: of:=IF( ISBLANK([$'03.Muestra'.$E$27]);"";[$'03.Muestra'.$E$27]) ->  | D170: of:=IF(AND([.B170]<>"";[.C170]<>"");"N/T";"") ->  | E170: of:=IF([.D170]<>"";IF(AND([.B170]<>"";[.C170]<>"");"";"ERR");"") -> 
B171: of:=IF( ISBLANK([$'03.Muestra'.$C$28]);"";[$'03.Muestra'.$C$28]) ->  | C171: of:=IF( ISBLANK([$'03.Muestra'.$E$28]);"";[$'03.Muestra'.$E$28]) ->  | D171: of:=IF(AND([.B171]<>"";[.C171]<>"");"N/T";"") ->  | E171: of:=IF([.D171]<>"";IF(AND([.B171]<>"";[.C171]<>"");"";"ERR");"") -> 
B172: of:=IF( ISBLANK([$'03.Muestra'.$C$29]);"";[$'03.Muestra'.$C$29]) ->  | C172: of:=IF( ISBLANK([$'03.Muestra'.$E$29]);"";[$'03.Muestra'.$E$29]) ->  | D172: of:=IF(AND([.B172]<>"";[.C172]<>"");"N/T";"") ->  | E172: of:=IF([.D172]<>"";IF(AND([.B172]<>"";[.C172]<>"");"";"ERR");"") -> 
B173: of:=IF( ISBLANK([$'03.Muestra'.$C$30]);"";[$'03.Muestra'.$C$30]) ->  | C173: of:=IF( ISBLANK([$'03.Muestra'.$E$30]);"";[$'03.Muestra'.$E$30]) ->  | D173: of:=IF(AND([.B173]<>"";[.C173]<>"");"N/T";"") ->  | E173: of:=IF([.D173]<>"";IF(AND([.B173]<>"";[.C173]<>"");"";"ERR");"") -> 
B174: of:=IF( ISBLANK([$'03.Muestra'.$C$31]);"";[$'03.Muestra'.$C$31]) ->  | C174: of:=IF( ISBLANK([$'03.Muestra'.$E$31]);"";[$'03.Muestra'.$E$31]) ->  | D174: of:=IF(AND([.B174]<>"";[.C174]<>"");"N/T";"") ->  | E174: of:=IF([.D174]<>"";IF(AND([.B174]<>"";[.C174]<>"");"";"ERR");"") -> 
B175: of:=IF( ISBLANK([$'03.Muestra'.$C$32]);"";[$'03.Muestra'.$C$32]) ->  | C175: of:=IF( ISBLANK([$'03.Muestra'.$E$32]);"";[$'03.Muestra'.$E$32]) ->  | D175: of:=IF(AND([.B175]<>"";[.C175]<>"");"N/T";"") ->  | E175: of:=IF([.D175]<>"";IF(AND([.B175]<>"";[.C175]<>"");"";"ERR");"") -> 
B176: of:=IF( ISBLANK([$'03.Muestra'.$C$33]);"";[$'03.Muestra'.$C$33]) ->  | C176: of:=IF( ISBLANK([$'03.Muestra'.$E$33]);"";[$'03.Muestra'.$E$33]) ->  | D176: of:=IF(AND([.B176]<>"";[.C176]<>"");"N/T";"") ->  | E176: of:=IF([.D176]<>"";IF(AND([.B176]<>"";[.C176]<>"");"";"ERR");"") -> 
B177: of:=IF( ISBLANK([$'03.Muestra'.$C$34]);"";[$'03.Muestra'.$C$34]) ->  | C177: of:=IF( ISBLANK([$'03.Muestra'.$E$34]);"";[$'03.Muestra'.$E$34]) ->  | D177: of:=IF(AND([.B177]<>"";[.C177]<>"");"N/T";"") ->  | E177: of:=IF([.D177]<>"";IF(AND([.B177]<>"";[.C177]<>"");"";"ERR");"") -> 
B178: of:=IF( ISBLANK([$'03.Muestra'.$C$35]);"";[$'03.Muestra'.$C$35]) ->  | C178: of:=IF( ISBLANK([$'03.Muestra'.$E$35]);"";[$'03.Muestra'.$E$35]) ->  | D178: of:=IF(AND([.B178]<>"";[.C178]<>"");"N/T";"") ->  | E178: of:=IF([.D178]<>"";IF(AND([.B178]<>"";[.C178]<>"");"";"ERR");"") -> 
B179: of:=IF( ISBLANK([$'03.Muestra'.$C$36]);"";[$'03.Muestra'.$C$36]) ->  | C179: of:=IF( ISBLANK([$'03.Muestra'.$E$36]);"";[$'03.Muestra'.$E$36]) ->  | D179: of:=IF(AND([.B179]<>"";[.C179]<>"");"N/T";"") ->  | E179: of:=IF([.D179]<>"";IF(AND([.B179]<>"";[.C179]<>"");"";"ERR");"") -> 
B180: of:=IF( ISBLANK([$'03.Muestra'.$C$37]);"";[$'03.Muestra'.$C$37]) ->  | C180: of:=IF( ISBLANK([$'03.Muestra'.$E$37]);"";[$'03.Muestra'.$E$37]) ->  | D180: of:=IF(AND([.B180]<>"";[.C180]<>"");"N/T";"") ->  | E180: of:=IF([.D180]<>"";IF(AND([.B180]<>"";[.C180]<>"");"";"ERR");"") -> 
B183: AA | C183: 3.2.4 IdentificaciÃ³n coherente | D183: Resultado
B184: of:=IF( ISBLANK([$'03.Muestra'.$C$8]);"";[$'03.Muestra'.$C$8]) ->  | C184: of:=IF( ISBLANK([$'03.Muestra'.$E$8]);"";[$'03.Muestra'.$E$8]) ->  | D184: of:=IF(AND([.B184]<>"";[.C184]<>"");"N/T";"") ->  | E184: of:=IF([.D184]<>"";IF(AND([.B184]<>"";[.C184]<>"");"";"ERR");"") ->  | F184: of:=TRANSPOSE([$'DATA - Oculta'.$U$9:$'DATA - Oculta'.$U$13]) -> N/T | G184: N/D | H184: N/A | I184: Falla | J184: Pasa | K184: En blanco
B185: of:=IF( ISBLANK([$'03.Muestra'.$C$9]);"";[$'03.Muestra'.$C$9]) ->  | C185: of:=IF( ISBLANK([$'03.Muestra'.$E$9]);"";[$'03.Muestra'.$E$9]) ->  | D185: of:=IF(AND([.B185]<>"";[.C185]<>"");"N/T";"") ->  | E185: of:=IF([.D185]<>"";IF(AND([.B185]<>"";[.C185]<>"");"";"ERR");"") ->  | F185: of:=COUNTIF([.$D184]:INDIRECT("$D" &  SUM(ROW()-1;[$'03.Muestra'.$D$40])-1);[.F184]) -> 0 | G185: of:=COUNTIF([.$D184]:INDIRECT("$D" &  SUM(ROW()-1;[$'03.Muestra'.$D$40])-1);[.G184]) -> 0 | H185: of:=COUNTIF([.$D184]:INDIRECT("$D" &  SUM(ROW()-1;[$'03.Muestra'.$D$40])-1);[.H184]) -> 0 | I185: of:=COUNTIF([.$D184]:INDIRECT("$D" &  SUM(ROW()-1;[$'03.Muestra'.$D$40])-1);[.I184]) -> 0 | J185: of:=COUNTIF([.$D184]:INDIRECT("$D" &  SUM(ROW()-1;[$'03.Muestra'.$D$40])-1);[.J184]) -> 0 | K185: of:=IF([$'03.Muestra'.$D$40]=0;0;COUNTBLANK([.$D184]:INDIRECT("$D" &  SUM(ROW()-1;[$'03.Muestra'.$D$40])-1))) -> 0
B186: of:=IF( ISBLANK([$'03.Muestra'.$C$10]);"";[$'03.Muestra'.$C$10]) ->  | C186: of:=IF( ISBLANK([$'03.Muestra'.$E$10]);"";[$'03.Muestra'.$E$10]) ->  | D186: of:=IF(AND([.B186]<>"";[.C186]<>"");"N/T";"") ->  | E186: of:=IF([.D186]<>"";IF(AND([.B186]<>"";[.C186]<>"");"";"ERR");"") -> 
B187: of:=IF( ISBLANK([$'03.Muestra'.$C$11]);"";[$'03.Muestra'.$C$11]) ->  | C187: of:=IF( ISBLANK([$'03.Muestra'.$E$11]);"";[$'03.Muestra'.$E$11]) ->  | D187: of:=IF(AND([.B187]<>"";[.C187]<>"");"N/T";"") ->  | E187: of:=IF([.D187]<>"";IF(AND([.B187]<>"";[.C187]<>"");"";"ERR");"") -> 
B188: of:=IF( ISBLANK([$'03.Muestra'.$C$12]);"";[$'03.Muestra'.$C$12]) ->  | C188: of:=IF( ISBLANK([$'03.Muestra'.$E$12]);"";[$'03.Muestra'.$E$12]) ->  | D188: of:=IF(AND([.B188]<>"";[.C188]<>"");"N/T";"") ->  | E188: of:=IF([.D188]<>"";IF(AND([.B188]<>"";[.C188]<>"");"";"ERR");"") -> 
B189: of:=IF( ISBLANK([$'03.Muestra'.$C$13]);"";[$'03.Muestra'.$C$13]) ->  | C189: of:=IF( ISBLANK([$'03.Muestra'.$E$13]);"";[$'03.Muestra'.$E$13]) ->  | D189: of:=IF(AND([.B189]<>"";[.C189]<>"");"N/T";"") ->  | E189: of:=IF([.D189]<>"";IF(AND([.B189]<>"";[.C189]<>"");"";"ERR");"") -> 
B190: of:=IF( ISBLANK([$'03.Muestra'.$C$14]);"";[$'03.Muestra'.$C$14]) ->  | C190: of:=IF( ISBLANK([$'03.Muestra'.$E$14]);"";[$'03.Muestra'.$E$14]) ->  | D190: of:=IF(AND([.B190]<>"";[.C190]<>"");"N/T";"") ->  | E190: of:=IF([.D190]<>"";IF(AND([.B190]<>"";[.C190]<>"");"";"ERR");"") -> 
B191: of:=IF( ISBLANK([$'03.Muestra'.$C$15]);"";[$'03.Muestra'.$C$15]) ->  | C191: of:=IF( ISBLANK([$'03.Muestra'.$E$15]);"";[$'03.Muestra'.$E$15]) ->  | D191: of:=IF(AND([.B191]<>"";[.C191]<>"");"N/T";"") ->  | E191: of:=IF([.D191]<>"";IF(AND([.B191]<>"";[.C191]<>"");"";"ERR");"") -> 
B192: of:=IF( ISBLANK([$'03.Muestra'.$C$16]);"";[$'03.Muestra'.$C$16]) ->  | C192: of:=IF( ISBLANK([$'03.Muestra'.$E$16]);"";[$'03.Muestra'.$E$16]) ->  | D192: of:=IF(AND([.B192]<>"";[.C192]<>"");"N/T";"") ->  | E192: of:=IF([.D192]<>"";IF(AND([.B192]<>"";[.C192]<>"");"";"ERR");"") -> 
B193: of:=IF( ISBLANK([$'03.Muestra'.$C$17]);"";[$'03.Muestra'.$C$17]) ->  | C193: of:=IF( ISBLANK([$'03.Muestra'.$E$17]);"";[$'03.Muestra'.$E$17]) ->  | D193: of:=IF(AND([.B193]<>"";[.C193]<>"");"N/T";"") ->  | E193: of:=IF([.D193]<>"";IF(AND([.B193]<>"";[.C193]<>"");"";"ERR");"") -> 
B194: of:=IF( ISBLANK([$'03.Muestra'.$C$18]);"";[$'03.Muestra'.$C$18]) ->  | C194: of:=IF( ISBLANK([$'03.Muestra'.$E$18]);"";[$'03.Muestra'.$E$18]) ->  | D194: of:=IF(AND([.B194]<>"";[.C194]<>"");"N/T";"") ->  | E194: of:=IF([.D194]<>"";IF(AND([.B194]<>"";[.C194]<>"");"";"ERR");"") -> 
B195: of:=IF( ISBLANK([$'03.Muestra'.$C$19]);"";[$'03.Muestra'.$C$19]) ->  | C195: of:=IF( ISBLANK([$'03.Muestra'.$E$19]);"";[$'03.Muestra'.$E$19]) ->  | D195: of:=IF(AND([.B195]<>"";[.C195]<>"");"N/T";"") ->  | E195: of:=IF([.D195]<>"";IF(AND([.B195]<>"";[.C195]<>"");"";"ERR");"") -> 
B196: of:=IF( ISBLANK([$'03.Muestra'.$C$20]);"";[$'03.Muestra'.$C$20]) ->  | C196: of:=IF( ISBLANK([$'03.Muestra'.$E$20]);"";[$'03.Muestra'.$E$20]) ->  | D196: of:=IF(AND([.B196]<>"";[.C196]<>"");"N/T";"") ->  | E196: of:=IF([.D196]<>"";IF(AND([.B196]<>"";[.C196]<>"");"";"ERR");"") -> 
B197: of:=IF( ISBLANK([$'03.Muestra'.$C$21]);"";[$'03.Muestra'.$C$21]) ->  | C197: of:=IF( ISBLANK([$'03.Muestra'.$E$21]);"";[$'03.Muestra'.$E$21]) ->  | D197: of:=IF(AND([.B197]<>"";[.C197]<>"");"N/T";"") ->  | E197: of:=IF([.D197]<>"";IF(AND([.B197]<>"";[.C197]<>"");"";"ERR");"") -> 
B198: of:=IF( ISBLANK([$'03.Muestra'.$C$22]);"";[$'03.Muestra'.$C$22]) ->  | C198: of:=IF( ISBLANK([$'03.Muestra'.$E$22]);"";[$'03.Muestra'.$E$22]) ->  | D198: of:=IF(AND([.B198]<>"";[.C198]<>"");"N/T";"") ->  | E198: of:=IF([.D198]<>"";IF(AND([.B198]<>"";[.C198]<>"");"";"ERR");"") -> 
B199: of:=IF( ISBLANK([$'03.Muestra'.$C$23]);"";[$'03.Muestra'.$C$23]) ->  | C199: of:=IF( ISBLANK([$'03.Muestra'.$E$23]);"";[$'03.Muestra'.$E$23]) ->  | D199: of:=IF(AND([.B199]<>"";[.C199]<>"");"N/T";"") ->  | E199: of:=IF([.D199]<>"";IF(AND([.B199]<>"";[.C199]<>"");"";"ERR");"") -> 
B200: of:=IF( ISBLANK([$'03.Muestra'.$C$24]);"";[$'03.Muestra'.$C$24]) ->  | C200: of:=IF( ISBLANK([$'03.Muestra'.$E$24]);"";[$'03.Muestra'.$E$24]) ->  | D200: of:=IF(AND([.B200]<>"";[.C200]<>"");"N/T";"") ->  | E200: of:=IF([.D200]<>"";IF(AND([.B200]<>"";[.C200]<>"");"";"ERR");"") -> 
B201: of:=IF( ISBLANK([$'03.Muestra'.$C$25]);"";[$'03.Muestra'.$C$25]) ->  | C201: of:=IF( ISBLANK([$'03.Muestra'.$E$25]);"";[$'03.Muestra'.$E$25]) ->  | D201: of:=IF(AND([.B201]<>"";[.C201]<>"");"N/T";"") ->  | E201: of:=IF([.D201]<>"";IF(AND([.B201]<>"";[.C201]<>"");"";"ERR");"") -> 
B202: of:=IF( ISBLANK([$'03.Muestra'.$C$26]);"";[$'03.Muestra'.$C$26]) ->  | C202: of:=IF( ISBLANK([$'03.Muestra'.$E$26]);"";[$'03.Muestra'.$E$26]) ->  | D202: of:=IF(AND([.B202]<>"";[.C202]<>"");"N/T";"") ->  | E202: of:=IF([.D202]<>"";IF(AND([.B202]<>"";[.C202]<>"");"";"ERR");"") -> 
B203: of:=IF( ISBLANK([$'03.Muestra'.$C$27]);"";[$'03.Muestra'.$C$27]) ->  | C203: of:=IF( ISBLANK([$'03.Muestra'.$E$27]);"";[$'03.Muestra'.$E$27]) ->  | D203: of:=IF(AND([.B203]<>"";[.C203]<>"");"N/T";"") ->  | E203: of:=IF([.D203]<>"";IF(AND([.B203]<>"";[.C203]<>"");"";"ERR");"") -> 
B204: of:=IF( ISBLANK([$'03.Muestra'.$C$28]);"";[$'03.Muestra'.$C$28]) ->  | C204: of:=IF( ISBLANK([$'03.Muestra'.$E$28]);"";[$'03.Muestra'.$E$28]) ->  | D204: of:=IF(AND([.B204]<>"";[.C204]<>"");"N/T";"") ->  | E204: of:=IF([.D204]<>"";IF(AND([.B204]<>"";[.C204]<>"");"";"ERR");"") -> 
B205: of:=IF( ISBLANK([$'03.Muestra'.$C$29]);"";[$'03.Muestra'.$C$29]) ->  | C205: of:=IF( ISBLANK([$'03.Muestra'.$E$29]);"";[$'03.Muestra'.$E$29]) ->  | D205: of:=IF(AND([.B205]<>"";[.C205]<>"");"N/T";"") ->  | E205: of:=IF([.D205]<>"";IF(AND([.B205]<>"";[.C205]<>"");"";"ERR");"") -> 
B206: of:=IF( ISBLANK([$'03.Muestra'.$C$30]);"";[$'03.Muestra'.$C$30]) ->  | C206: of:=IF( ISBLANK([$'03.Muestra'.$E$30]);"";[$'03.Muestra'.$E$30]) ->  | D206: of:=IF(AND([.B206]<>"";[.C206]<>"");"N/T";"") ->  | E206: of:=IF([.D206]<>"";IF(AND([.B206]<>"";[.C206]<>"");"";"ERR");"") -> 
B207: of:=IF( ISBLANK([$'03.Muestra'.$C$31]);"";[$'03.Muestra'.$C$31]) ->  | C207: of:=IF( ISBLANK([$'03.Muestra'.$E$31]);"";[$'03.Muestra'.$E$31]) ->  | D207: of:=IF(AND([.B207]<>"";[.C207]<>"");"N/T";"") ->  | E207: of:=IF([.D207]<>"";IF(AND([.B207]<>"";[.C207]<>"");"";"ERR");"") -> 
B208: of:=IF( ISBLANK([$'03.Muestra'.$C$32]);"";[$'03.Muestra'.$C$32]) ->  | C208: of:=IF( ISBLANK([$'03.Muestra'.$E$32]);"";[$'03.Muestra'.$E$32]) ->  | D208: of:=IF(AND([.B208]<>"";[.C208]<>"");"N/T";"") ->  | E208: of:=IF([.D208]<>"";IF(AND([.B208]<>"";[.C208]<>"");"";"ERR");"") -> 
B209: of:=IF( ISBLANK([$'03.Muestra'.$C$33]);"";[$'03.Muestra'.$C$33]) ->  | C209: of:=IF( ISBLANK([$'03.Muestra'.$E$33]);"";[$'03.Muestra'.$E$33]) ->  | D209: of:=IF(AND([.B209]<>"";[.C209]<>"");"N/T";"") ->  | E209: of:=IF([.D209]<>"";IF(AND([.B209]<>"";[.C209]<>"");"";"ERR");"") -> 
B210: of:=IF( ISBLANK([$'03.Muestra'.$C$34]);"";[$'03.Muestra'.$C$34]) ->  | C210: of:=IF( ISBLANK([$'03.Muestra'.$E$34]);"";[$'03.Muestra'.$E$34]) ->  | D210: of:=IF(AND([.B210]<>"";[.C210]<>"");"N/T";"") ->  | E210: of:=IF([.D210]<>"";IF(AND([.B210]<>"";[.C210]<>"");"";"ERR");"") -> 
B211: of:=IF( ISBLANK([$'03.Muestra'.$C$35]);"";[$'03.Muestra'.$C$35]) ->  | C211: of:=IF( ISBLANK([$'03.Muestra'.$E$35]);"";[$'03.Muestra'.$E$35]) ->  | D211: of:=IF(AND([.B211]<>"";[.C211]<>"");"N/T";"") ->  | E211: of:=IF([.D211]<>"";IF(AND([.B211]<>"";[.C211]<>"");"";"ERR");"") -> 
B212: of:=IF( ISBLANK([$'03.Muestra'.$C$36]);"";[$'03.Muestra'.$C$36]) ->  | C212: of:=IF( ISBLANK([$'03.Muestra'.$E$36]);"";[$'03.Muestra'.$E$36]) ->  | D212: of:=IF(AND([.B212]<>"";[.C212]<>"");"N/T";"") ->  | E212: of:=IF([.D212]<>"";IF(AND([.B212]<>"";[.C212]<>"");"";"ERR");"") -> 
B213: of:=IF( ISBLANK([$'03.Muestra'.$C$37]);"";[$'03.Muestra'.$C$37]) ->  | C213: of:=IF( ISBLANK([$'03.Muestra'.$E$37]);"";[$'03.Muestra'.$E$37]) ->  | D213: of:=IF(AND([.B213]<>"";[.C213]<>"");"N/T";"") ->  | E213: of:=IF([.D213]<>"";IF(AND([.B213]<>"";[.C213]<>"");"";"ERR");"") -> 
B216: A | C216: 3.3.1 IdentificaciÃ³n de errores | D216: Resultado
B217: of:=IF( ISBLANK([$'03.Muestra'.$C$8]);"";[$'03.Muestra'.$C$8]) ->  | C217: of:=IF( ISBLANK([$'03.Muestra'.$E$8]);"";[$'03.Muestra'.$E$8]) ->  | D217: of:=IF(AND([.B217]<>"";[.C217]<>"");"N/T";"") ->  | E217: of:=IF([.D217]<>"";IF(AND([.B217]<>"";[.C217]<>"");"";"ERR");"") ->  | F217: of:=TRANSPOSE([$'DATA - Oculta'.$U$9:$'DATA - Oculta'.$U$13]) -> N/T | G217: N/D | H217: N/A | I217: Falla | J217: Pasa | K217: En blanco
B218: of:=IF( ISBLANK([$'03.Muestra'.$C$9]);"";[$'03.Muestra'.$C$9]) ->  | C218: of:=IF( ISBLANK([$'03.Muestra'.$E$9]);"";[$'03.Muestra'.$E$9]) ->  | D218: of:=IF(AND([.B218]<>"";[.C218]<>"");"N/T";"") ->  | E218: of:=IF([.D218]<>"";IF(AND([.B218]<>"";[.C218]<>"");"";"ERR");"") ->  | F218: of:=COUNTIF([.$D217]:INDIRECT("$D" &  SUM(ROW()-1;[$'03.Muestra'.$D$40])-1);[.F217]) -> 0 | G218: of:=COUNTIF([.$D217]:INDIRECT("$D" &  SUM(ROW()-1;[$'03.Muestra'.$D$40])-1);[.G217]) -> 0 | H218: of:=COUNTIF([.$D217]:INDIRECT("$D" &  SUM(ROW()-1;[$'03.Muestra'.$D$40])-1);[.H217]) -> 0 | I218: of:=COUNTIF([.$D217]:INDIRECT("$D" &  SUM(ROW()-1;[$'03.Muestra'.$D$40])-1);[.I217]) -> 0 | J218: of:=COUNTIF([.$D217]:INDIRECT("$D" &  SUM(ROW()-1;[$'03.Muestra'.$D$40])-1);[.J217]) -> 0 | K218: of:=IF([$'03.Muestra'.$D$40]=0;0;COUNTBLANK([.$D217]:INDIRECT("$D" &  SUM(ROW()-1;[$'03.Muestra'.$D$40])-1))) -> 0
B219: of:=IF( ISBLANK([$'03.Muestra'.$C$10]);"";[$'03.Muestra'.$C$10]) ->  | C219: of:=IF( ISBLANK([$'03.Muestra'.$E$10]);"";[$'03.Muestra'.$E$10]) ->  | D219: of:=IF(AND([.B219]<>"";[.C219]<>"");"N/T";"") ->  | E219: of:=IF([.D219]<>"";IF(AND([.B219]<>"";[.C219]<>"");"";"ERR");"") -> 
B220: of:=IF( ISBLANK([$'03.Muestra'.$C$11]);"";[$'03.Muestra'.$C$11]) ->  | C220: of:=IF( ISBLANK([$'03.Muestra'.$E$11]);"";[$'03.Muestra'.$E$11]) ->  | D220: of:=IF(AND([.B220]<>"";[.C220]<>"");"N/T";"") ->  | E220: of:=IF([.D220]<>"";IF(AND([.B220]<>"";[.C220]<>"");"";"ERR");"") -> 
B221: of:=IF( ISBLANK([$'03.Muestra'.$C$12]);"";[$'03.Muestra'.$C$12]) ->  | C221: of:=IF( ISBLANK([$'03.Muestra'.$E$12]);"";[$'03.Muestra'.$E$12]) ->  | D221: of:=IF(AND([.B221]<>"";[.C221]<>"");"N/T";"") ->  | E221: of:=IF([.D221]<>"";IF(AND([.B221]<>"";[.C221]<>"");"";"ERR");"") -> 
B222: of:=IF( ISBLANK([$'03.Muestra'.$C$13]);"";[$'03.Muestra'.$C$13]) ->  | C222: of:=IF( ISBLANK([$'03.Muestra'.$E$13]);"";[$'03.Muestra'.$E$13]) ->  | D222: of:=IF(AND([.B222]<>"";[.C222]<>"");"N/T";"") ->  | E222: of:=IF([.D222]<>"";IF(AND([.B222]<>"";[.C222]<>"");"";"ERR");"") -> 
B223: of:=IF( ISBLANK([$'03.Muestra'.$C$14]);"";[$'03.Muestra'.$C$14]) ->  | C223: of:=IF( ISBLANK([$'03.Muestra'.$E$14]);"";[$'03.Muestra'.$E$14]) ->  | D223: of:=IF(AND([.B223]<>"";[.C223]<>"");"N/T";"") ->  | E223: of:=IF([.D223]<>"";IF(AND([.B223]<>"";[.C223]<>"");"";"ERR");"") -> 
B224: of:=IF( ISBLANK([$'03.Muestra'.$C$15]);"";[$'03.Muestra'.$C$15]) ->  | C224: of:=IF( ISBLANK([$'03.Muestra'.$E$15]);"";[$'03.Muestra'.$E$15]) ->  | D224: of:=IF(AND([.B224]<>"";[.C224]<>"");"N/T";"") ->  | E224: of:=IF([.D224]<>"";IF(AND([.B224]<>"";[.C224]<>"");"";"ERR");"") -> 
B225: of:=IF( ISBLANK([$'03.Muestra'.$C$16]);"";[$'03.Muestra'.$C$16]) ->  | C225: of:=IF( ISBLANK([$'03.Muestra'.$E$16]);"";[$'03.Muestra'.$E$16]) ->  | D225: of:=IF(AND([.B225]<>"";[.C225]<>"");"N/T";"") ->  | E225: of:=IF([.D225]<>"";IF(AND([.B225]<>"";[.C225]<>"");"";"ERR");"") -> 
B226: of:=IF( ISBLANK([$'03.Muestra'.$C$17]);"";[$'03.Muestra'.$C$17]) ->  | C226: of:=IF( ISBLANK([$'03.Muestra'.$E$17]);"";[$'03.Muestra'.$E$17]) ->  | D226: of:=IF(AND([.B226]<>"";[.C226]<>"");"N/T";"") ->  | E226: of:=IF([.D226]<>"";IF(AND([.B226]<>"";[.C226]<>"");"";"ERR");"") -> 
B227: of:=IF( ISBLANK([$'03.Muestra'.$C$18]);"";[$'03.Muestra'.$C$18]) ->  | C227: of:=IF( ISBLANK([$'03.Muestra'.$E$18]);"";[$'03.Muestra'.$E$18]) ->  | D227: of:=IF(AND([.B227]<>"";[.C227]<>"");"N/T";"") ->  | E227: of:=IF([.D227]<>"";IF(AND([.B227]<>"";[.C227]<>"");"";"ERR");"") -> 
B228: of:=IF( ISBLANK([$'03.Muestra'.$C$19]);"";[$'03.Muestra'.$C$19]) ->  | C228: of:=IF( ISBLANK([$'03.Muestra'.$E$19]);"";[$'03.Muestra'.$E$19]) ->  | D228: of:=IF(AND([.B228]<>"";[.C228]<>"");"N/T";"") ->  | E228: of:=IF([.D228]<>"";IF(AND([.B228]<>"";[.C228]<>"");"";"ERR");"") -> 
B229: of:=IF( ISBLANK([$'03.Muestra'.$C$20]);"";[$'03.Muestra'.$C$20]) ->  | C229: of:=IF( ISBLANK([$'03.Muestra'.$E$20]);"";[$'03.Muestra'.$E$20]) ->  | D229: of:=IF(AND([.B229]<>"";[.C229]<>"");"N/T";"") ->  | E229: of:=IF([.D229]<>"";IF(AND([.B229]<>"";[.C229]<>"");"";"ERR");"") -> 
B230: of:=IF( ISBLANK([$'03.Muestra'.$C$21]);"";[$'03.Muestra'.$C$21]) ->  | C230: of:=IF( ISBLANK([$'03.Muestra'.$E$21]);"";[$'03.Muestra'.$E$21]) ->  | D230: of:=IF(AND([.B230]<>"";[.C230]<>"");"N/T";"") ->  | E230: of:=IF([.D230]<>"";IF(AND([.B230]<>"";[.C230]<>"");"";"ERR");"") -> 
B231: of:=IF( ISBLANK([$'03.Muestra'.$C$22]);"";[$'03.Muestra'.$C$22]) ->  | C231: of:=IF( ISBLANK([$'03.Muestra'.$E$22]);"";[$'03.Muestra'.$E$22]) ->  | D231: of:=IF(AND([.B231]<>"";[.C231]<>"");"N/T";"") ->  | E231: of:=IF([.D231]<>"";IF(AND([.B231]<>"";[.C231]<>"");"";"ERR");"") -> 
B232: of:=IF( ISBLANK([$'03.Muestra'.$C$23]);"";[$'03.Muestra'.$C$23]) ->  | C232: of:=IF( ISBLANK([$'03.Muestra'.$E$23]);"";[$'03.Muestra'.$E$23]) ->  | D232: of:=IF(AND([.B232]<>"";[.C232]<>"");"N/T";"") ->  | E232: of:=IF([.D232]<>"";IF(AND([.B232]<>"";[.C232]<>"");"";"ERR");"") -> 
B233: of:=IF( ISBLANK([$'03.Muestra'.$C$24]);"";[$'03.Muestra'.$C$24]) ->  | C233: of:=IF( ISBLANK([$'03.Muestra'.$E$24]);"";[$'03.Muestra'.$E$24]) ->  | D233: of:=IF(AND([.B233]<>"";[.C233]<>"");"N/T";"") ->  | E233: of:=IF([.D233]<>"";IF(AND([.B233]<>"";[.C233]<>"");"";"ERR");"") -> 
B234: of:=IF( ISBLANK([$'03.Muestra'.$C$25]);"";[$'03.Muestra'.$C$25]) ->  | C234: of:=IF( ISBLANK([$'03.Muestra'.$E$25]);"";[$'03.Muestra'.$E$25]) ->  | D234: of:=IF(AND([.B234]<>"";[.C234]<>"");"N/T";"") ->  | E234: of:=IF([.D234]<>"";IF(AND([.B234]<>"";[.C234]<>"");"";"ERR");"") -> 
B235: of:=IF( ISBLANK([$'03.Muestra'.$C$26]);"";[$'03.Muestra'.$C$26]) ->  | C235: of:=IF( ISBLANK([$'03.Muestra'.$E$26]);"";[$'03.Muestra'.$E$26]) ->  | D235: of:=IF(AND([.B235]<>"";[.C235]<>"");"N/T";"") ->  | E235: of:=IF([.D235]<>"";IF(AND([.B235]<>"";[.C235]<>"");"";"ERR");"") -> 
B236: of:=IF( ISBLANK([$'03.Muestra'.$C$27]);"";[$'03.Muestra'.$C$27]) ->  | C236: of:=IF( ISBLANK([$'03.Muestra'.$E$27]);"";[$'03.Muestra'.$E$27]) ->  | D236: of:=IF(AND([.B236]<>"";[.C236]<>"");"N/T";"") ->  | E236: of:=IF([.D236]<>"";IF(AND([.B236]<>"";[.C236]<>"");"";"ERR");"") -> 
B237: of:=IF( ISBLANK([$'03.Muestra'.$C$28]);"";[$'03.Muestra'.$C$28]) ->  | C237: of:=IF( ISBLANK([$'03.Muestra'.$E$28]);"";[$'03.Muestra'.$E$28]) ->  | D237: of:=IF(AND([.B237]<>"";[.C237]<>"");"N/T";"") ->  | E237: of:=IF([.D237]<>"";IF(AND([.B237]<>"";[.C237]<>"");"";"ERR");"") -> 
B238: of:=IF( ISBLANK([$'03.Muestra'.$C$29]);"";[$'03.Muestra'.$C$29]) ->  | C238: of:=IF( ISBLANK([$'03.Muestra'.$E$29]);"";[$'03.Muestra'.$E$29]) ->  | D238: of:=IF(AND([.B238]<>"";[.C238]<>"");"N/T";"") ->  | E238: of:=IF([.D238]<>"";IF(AND([.B238]<>"";[.C238]<>"");"";"ERR");"") -> 
B239: of:=IF( ISBLANK([$'03.Muestra'.$C$30]);"";[$'03.Muestra'.$C$30]) ->  | C239: of:=IF( ISBLANK([$'03.Muestra'.$E$30]);"";[$'03.Muestra'.$E$30]) ->  | D239: of:=IF(AND([.B239]<>"";[.C239]<>"");"N/T";"") ->  | E239: of:=IF([.D239]<>"";IF(AND([.B239]<>"";[.C239]<>"");"";"ERR");"") -> 
B240: of:=IF( ISBLANK([$'03.Muestra'.$C$31]);"";[$'03.Muestra'.$C$31]) ->  | C240: of:=IF( ISBLANK([$'03.Muestra'.$E$31]);"";[$'03.Muestra'.$E$31]) ->  | D240: of:=IF(AND([.B240]<>"";[.C240]<>"");"N/T";"") ->  | E240: of:=IF([.D240]<>"";IF(AND([.B240]<>"";[.C240]<>"");"";"ERR");"") -> 
B241: of:=IF( ISBLANK([$'03.Muestra'.$C$32]);"";[$'03.Muestra'.$C$32]) ->  | C241: of:=IF( ISBLANK([$'03.Muestra'.$E$32]);"";[$'03.Muestra'.$E$32]) ->  | D241: of:=IF(AND([.B241]<>"";[.C241]<>"");"N/T";"") ->  | E241: of:=IF([.D241]<>"";IF(AND([.B241]<>"";[.C241]<>"");"";"ERR");"") -> 
B242: of:=IF( ISBLANK([$'03.Muestra'.$C$33]);"";[$'03.Muestra'.$C$33]) ->  | C242: of:=IF( ISBLANK([$'03.Muestra'.$E$33]);"";[$'03.Muestra'.$E$33]) ->  | D242: of:=IF(AND([.B242]<>"";[.C242]<>"");"N/T";"") ->  | E242: of:=IF([.D242]<>"";IF(AND([.B242]<>"";[.C242]<>"");"";"ERR");"") -> 
B243: of:=IF( ISBLANK([$'03.Muestra'.$C$34]);"";[$'03.Muestra'.$C$34]) ->  | C243: of:=IF( ISBLANK([$'03.Muestra'.$E$34]);"";[$'03.Muestra'.$E$34]) ->  | D243: of:=IF(AND([.B243]<>"";[.C243]<>"");"N/T";"") ->  | E243: of:=IF([.D243]<>"";IF(AND([.B243]<>"";[.C243]<>"");"";"ERR");"") -> 
B244: of:=IF( ISBLANK([$'03.Muestra'.$C$35]);"";[$'03.Muestra'.$C$35]) ->  | C244: of:=IF( ISBLANK([$'03.Muestra'.$E$35]);"";[$'03.Muestra'.$E$35]) ->  | D244: of:=IF(AND([.B244]<>"";[.C244]<>"");"N/T";"") ->  | E244: of:=IF([.D244]<>"";IF(AND([.B244]<>"";[.C244]<>"");"";"ERR");"") -> 
B245: of:=IF( ISBLANK([$'03.Muestra'.$C$36]);"";[$'03.Muestra'.$C$36]) ->  | C245: of:=IF( ISBLANK([$'03.Muestra'.$E$36]);"";[$'03.Muestra'.$E$36]) ->  | D245: of:=IF(AND([.B245]<>"";[.C245]<>"");"N/T";"") ->  | E245: of:=IF([.D245]<>"";IF(AND([.B245]<>"";[.C245]<>"");"";"ERR");"") -> 
B246: of:=IF( ISBLANK([$'03.Muestra'.$C$37]);"";[$'03.Muestra'.$C$37]) ->  | C246: of:=IF( ISBLANK([$'03.Muestra'.$E$37]);"";[$'03.Muestra'.$E$37]) ->  | D246: of:=IF(AND([.B246]<>"";[.C246]<>"");"N/T";"") ->  | E246: of:=IF([.D246]<>"";IF(AND([.B246]<>"";[.C246]<>"");"";"ERR");"") -> 
B249: A | C249: 3.3.2 Etiquetas o instrucciones | D249: Resultado
B250: of:=IF( ISBLANK([$'03.Muestra'.$C$8]);"";[$'03.Muestra'.$C$8]) ->  | C250: of:=IF( ISBLANK([$'03.Muestra'.$E$8]);"";[$'03.Muestra'.$E$8]) ->  | D250: of:=IF(AND([.B250]<>"";[.C250]<>"");"N/T";"") ->  | E250: of:=IF([.D250]<>"";IF(AND([.B250]<>"";[.C250]<>"");"";"ERR");"") ->  | F250: of:=TRANSPOSE([$'DATA - Oculta'.$U$9:$'DATA - Oculta'.$U$13]) -> N/T | G250: N/D | H250: N/A | I250: Falla | J250: Pasa | K250: En blanco
B251: of:=IF( ISBLANK([$'03.Muestra'.$C$9]);"";[$'03.Muestra'.$C$9]) ->  | C251: of:=IF( ISBLANK([$'03.Muestra'.$E$9]);"";[$'03.Muestra'.$E$9]) ->  | D251: of:=IF(AND([.B251]<>"";[.C251]<>"");"N/T";"") ->  | E251: of:=IF([.D251]<>"";IF(AND([.B251]<>"";[.C251]<>"");"";"ERR");"") ->  | F251: of:=COUNTIF([.$D250]:INDIRECT("$D" &  SUM(ROW()-1;[$'03.Muestra'.$D$40])-1);[.F250]) -> 0 | G251: of:=COUNTIF([.$D250]:INDIRECT("$D" &  SUM(ROW()-1;[$'03.Muestra'.$D$40])-1);[.G250]) -> 0 | H251: of:=COUNTIF([.$D250]:INDIRECT("$D" &  SUM(ROW()-1;[$'03.Muestra'.$D$40])-1);[.H250]) -> 0 | I251: of:=COUNTIF([.$D250]:INDIRECT("$D" &  SUM(ROW()-1;[$'03.Muestra'.$D$40])-1);[.I250]) -> 0 | J251: of:=COUNTIF([.$D250]:INDIRECT("$D" &  SUM(ROW()-1;[$'03.Muestra'.$D$40])-1);[.J250]) -> 0 | K251: of:=IF([$'03.Muestra'.$D$40]=0;0;COUNTBLANK([.$D250]:INDIRECT("$D" &  SUM(ROW()-1;[$'03.Muestra'.$D$40])-1))) -> 0
B252: of:=IF( ISBLANK([$'03.Muestra'.$C$10]);"";[$'03.Muestra'.$C$10]) ->  | C252: of:=IF( ISBLANK([$'03.Muestra'.$E$10]);"";[$'03.Muestra'.$E$10]) ->  | D252: of:=IF(AND([.B252]<>"";[.C252]<>"");"N/T";"") ->  | E252: of:=IF([.D252]<>"";IF(AND([.B252]<>"";[.C252]<>"");"";"ERR");"") -> 
B253: of:=IF( ISBLANK([$'03.Muestra'.$C$11]);"";[$'03.Muestra'.$C$11]) ->  | C253: of:=IF( ISBLANK([$'03.Muestra'.$E$11]);"";[$'03.Muestra'.$E$11]) ->  | D253: of:=IF(AND([.B253]<>"";[.C253]<>"");"N/T";"") ->  | E253: of:=IF([.D253]<>"";IF(AND([.B253]<>"";[.C253]<>"");"";"ERR");"") -> 
B254: of:=IF( ISBLANK([$'03.Muestra'.$C$12]);"";[$'03.Muestra'.$C$12]) ->  | C254: of:=IF( ISBLANK([$'03.Muestra'.$E$12]);"";[$'03.Muestra'.$E$12]) ->  | D254: of:=IF(AND([.B254]<>"";[.C254]<>"");"N/T";"") ->  | E254: of:=IF([.D254]<>"";IF(AND([.B254]<>"";[.C254]<>"");"";"ERR");"") -> 
B255: of:=IF( ISBLANK([$'03.Muestra'.$C$13]);"";[$'03.Muestra'.$C$13]) ->  | C255: of:=IF( ISBLANK([$'03.Muestra'.$E$13]);"";[$'03.Muestra'.$E$13]) ->  | D255: of:=IF(AND([.B255]<>"";[.C255]<>"");"N/T";"") ->  | E255: of:=IF([.D255]<>"";IF(AND([.B255]<>"";[.C255]<>"");"";"ERR");"") -> 
B256: of:=IF( ISBLANK([$'03.Muestra'.$C$14]);"";[$'03.Muestra'.$C$14]) ->  | C256: of:=IF( ISBLANK([$'03.Muestra'.$E$14]);"";[$'03.Muestra'.$E$14]) ->  | D256: of:=IF(AND([.B256]<>"";[.C256]<>"");"N/T";"") ->  | E256: of:=IF([.D256]<>"";IF(AND([.B256]<>"";[.C256]<>"");"";"ERR");"") -> 
B257: of:=IF( ISBLANK([$'03.Muestra'.$C$15]);"";[$'03.Muestra'.$C$15]) ->  | C257: of:=IF( ISBLANK([$'03.Muestra'.$E$15]);"";[$'03.Muestra'.$E$15]) ->  | D257: of:=IF(AND([.B257]<>"";[.C257]<>"");"N/T";"") ->  | E257: of:=IF([.D257]<>"";IF(AND([.B257]<>"";[.C257]<>"");"";"ERR");"") -> 
B258: of:=IF( ISBLANK([$'03.Muestra'.$C$16]);"";[$'03.Muestra'.$C$16]) ->  | C258: of:=IF( ISBLANK([$'03.Muestra'.$E$16]);"";[$'03.Muestra'.$E$16]) ->  | D258: of:=IF(AND([.B258]<>"";[.C258]<>"");"N/T";"") ->  | E258: of:=IF([.D258]<>"";IF(AND([.B258]<>"";[.C258]<>"");"";"ERR");"") -> 
B259: of:=IF( ISBLANK([$'03.Muestra'.$C$17]);"";[$'03.Muestra'.$C$17]) ->  | C259: of:=IF( ISBLANK([$'03.Muestra'.$E$17]);"";[$'03.Muestra'.$E$17]) ->  | D259: of:=IF(AND([.B259]<>"";[.C259]<>"");"N/T";"") ->  | E259: of:=IF([.D259]<>"";IF(AND([.B259]<>"";[.C259]<>"");"";"ERR");"") -> 
B260: of:=IF( ISBLANK([$'03.Muestra'.$C$18]);"";[$'03.Muestra'.$C$18]) ->  | C260: of:=IF( ISBLANK([$'03.Muestra'.$E$18]);"";[$'03.Muestra'.$E$18]) ->  | D260: of:=IF(AND([.B260]<>"";[.C260]<>"");"N/T";"") ->  | E260: of:=IF([.D260]<>"";IF(AND([.B260]<>"";[.C260]<>"");"";"ERR");"") -> 
B261: of:=IF( ISBLANK([$'03.Muestra'.$C$19]);"";[$'03.Muestra'.$C$19]) ->  | C261: of:=IF( ISBLANK([$'03.Muestra'.$E$19]);"";[$'03.Muestra'.$E$19]) ->  | D261: of:=IF(AND([.B261]<>"";[.C261]<>"");"N/T";"") ->  | E261: of:=IF([.D261]<>"";IF(AND([.B261]<>"";[.C261]<>"");"";"ERR");"") -> 
B262: of:=IF( ISBLANK([$'03.Muestra'.$C$20]);"";[$'03.Muestra'.$C$20]) ->  | C262: of:=IF( ISBLANK([$'03.Muestra'.$E$20]);"";[$'03.Muestra'.$E$20]) ->  | D262: of:=IF(AND([.B262]<>"";[.C262]<>"");"N/T";"") ->  | E262: of:=IF([.D262]<>"";IF(AND([.B262]<>"";[.C262]<>"");"";"ERR");"") -> 
B263: of:=IF( ISBLANK([$'03.Muestra'.$C$21]);"";[$'03.Muestra'.$C$21]) ->  | C263: of:=IF( ISBLANK([$'03.Muestra'.$E$21]);"";[$'03.Muestra'.$E$21]) ->  | D263: of:=IF(AND([.B263]<>"";[.C263]<>"");"N/T";"") ->  | E263: of:=IF([.D263]<>"";IF(AND([.B263]<>"";[.C263]<>"");"";"ERR");"") -> 
B264: of:=IF( ISBLANK([$'03.Muestra'.$C$22]);"";[$'03.Muestra'.$C$22]) ->  | C264: of:=IF( ISBLANK([$'03.Muestra'.$E$22]);"";[$'03.Muestra'.$E$22]) ->  | D264: of:=IF(AND([.B264]<>"";[.C264]<>"");"N/T";"") ->  | E264: of:=IF([.D264]<>"";IF(AND([.B264]<>"";[.C264]<>"");"";"ERR");"") -> 
B265: of:=IF( ISBLANK([$'03.Muestra'.$C$23]);"";[$'03.Muestra'.$C$23]) ->  | C265: of:=IF( ISBLANK([$'03.Muestra'.$E$23]);"";[$'03.Muestra'.$E$23]) ->  | D265: of:=IF(AND([.B265]<>"";[.C265]<>"");"N/T";"") ->  | E265: of:=IF([.D265]<>"";IF(AND([.B265]<>"";[.C265]<>"");"";"ERR");"") -> 
B266: of:=IF( ISBLANK([$'03.Muestra'.$C$24]);"";[$'03.Muestra'.$C$24]) ->  | C266: of:=IF( ISBLANK([$'03.Muestra'.$E$24]);"";[$'03.Muestra'.$E$24]) ->  | D266: of:=IF(AND([.B266]<>"";[.C266]<>"");"N/T";"") ->  | E266: of:=IF([.D266]<>"";IF(AND([.B266]<>"";[.C266]<>"");"";"ERR");"") -> 
B267: of:=IF( ISBLANK([$'03.Muestra'.$C$25]);"";[$'03.Muestra'.$C$25]) ->  | C267: of:=IF( ISBLANK([$'03.Muestra'.$E$25]);"";[$'03.Muestra'.$E$25]) ->  | D267: of:=IF(AND([.B267]<>"";[.C267]<>"");"N/T";"") ->  | E267: of:=IF([.D267]<>"";IF(AND([.B267]<>"";[.C267]<>"");"";"ERR");"") -> 
B268: of:=IF( ISBLANK([$'03.Muestra'.$C$26]);"";[$'03.Muestra'.$C$26]) ->  | C268: of:=IF( ISBLANK([$'03.Muestra'.$E$26]);"";[$'03.Muestra'.$E$26]) ->  | D268: of:=IF(AND([.B268]<>"";[.C268]<>"");"N/T";"") ->  | E268: of:=IF([.D268]<>"";IF(AND([.B268]<>"";[.C268]<>"");"";"ERR");"") -> 
B269: of:=IF( ISBLANK([$'03.Muestra'.$C$27]);"";[$'03.Muestra'.$C$27]) ->  | C269: of:=IF( ISBLANK([$'03.Muestra'.$E$27]);"";[$'03.Muestra'.$E$27]) ->  | D269: of:=IF(AND([.B269]<>"";[.C269]<>"");"N/T";"") ->  | E269: of:=IF([.D269]<>"";IF(AND([.B269]<>"";[.C269]<>"");"";"ERR");"") -> 
B270: of:=IF( ISBLANK([$'03.Muestra'.$C$28]);"";[$'03.Muestra'.$C$28]) ->  | C270: of:=IF( ISBLANK([$'03.Muestra'.$E$28]);"";[$'03.Muestra'.$E$28]) ->  | D270: of:=IF(AND([.B270]<>"";[.C270]<>"");"N/T";"") ->  | E270: of:=IF([.D270]<>"";IF(AND([.B270]<>"";[.C270]<>"");"";"ERR");"") -> 
B271: of:=IF( ISBLANK([$'03.Muestra'.$C$29]);"";[$'03.Muestra'.$C$29]) ->  | C271: of:=IF( ISBLANK([$'03.Muestra'.$E$29]);"";[$'03.Muestra'.$E$29]) ->  | D271: of:=IF(AND([.B271]<>"";[.C271]<>"");"N/T";"") ->  | E271: of:=IF([.D271]<>"";IF(AND([.B271]<>"";[.C271]<>"");"";"ERR");"") -> 
B272: of:=IF( ISBLANK([$'03.Muestra'.$C$30]);"";[$'03.Muestra'.$C$30]) ->  | C272: of:=IF( ISBLANK([$'03.Muestra'.$E$30]);"";[$'03.Muestra'.$E$30]) ->  | D272: of:=IF(AND([.B272]<>"";[.C272]<>"");"N/T";"") ->  | E272: of:=IF([.D272]<>"";IF(AND([.B272]<>"";[.C272]<>"");"";"ERR");"") -> 
B273: of:=IF( ISBLANK([$'03.Muestra'.$C$31]);"";[$'03.Muestra'.$C$31]) ->  | C273: of:=IF( ISBLANK([$'03.Muestra'.$E$31]);"";[$'03.Muestra'.$E$31]) ->  | D273: of:=IF(AND([.B273]<>"";[.C273]<>"");"N/T";"") ->  | E273: of:=IF([.D273]<>"";IF(AND([.B273]<>"";[.C273]<>"");"";"ERR");"") -> 
B274: of:=IF( ISBLANK([$'03.Muestra'.$C$32]);"";[$'03.Muestra'.$C$32]) ->  | C274: of:=IF( ISBLANK([$'03.Muestra'.$E$32]);"";[$'03.Muestra'.$E$32]) ->  | D274: of:=IF(AND([.B274]<>"";[.C274]<>"");"N/T";"") ->  | E274: of:=IF([.D274]<>"";IF(AND([.B274]<>"";[.C274]<>"");"";"ERR");"") -> 
B275: of:=IF( ISBLANK([$'03.Muestra'.$C$33]);"";[$'03.Muestra'.$C$33]) ->  | C275: of:=IF( ISBLANK([$'03.Muestra'.$E$33]);"";[$'03.Muestra'.$E$33]) ->  | D275: of:=IF(AND([.B275]<>"";[.C275]<>"");"N/T";"") ->  | E275: of:=IF([.D275]<>"";IF(AND([.B275]<>"";[.C275]<>"");"";"ERR");"") -> 
B276: of:=IF( ISBLANK([$'03.Muestra'.$C$34]);"";[$'03.Muestra'.$C$34]) ->  | C276: of:=IF( ISBLANK([$'03.Muestra'.$E$34]);"";[$'03.Muestra'.$E$34]) ->  | D276: of:=IF(AND([.B276]<>"";[.C276]<>"");"N/T";"") ->  | E276: of:=IF([.D276]<>"";IF(AND([.B276]<>"";[.C276]<>"");"";"ERR");"") -> 
B277: of:=IF( ISBLANK([$'03.Muestra'.$C$35]);"";[$'03.Muestra'.$C$35]) ->  | C277: of:=IF( ISBLANK([$'03.Muestra'.$E$35]);"";[$'03.Muestra'.$E$35]) ->  | D277: of:=IF(AND([.B277]<>"";[.C277]<>"");"N/T";"") ->  | E277: of:=IF([.D277]<>"";IF(AND([.B277]<>"";[.C277]<>"");"";"ERR");"") -> 
B278: of:=IF( ISBLANK([$'03.Muestra'.$C$36]);"";[$'03.Muestra'.$C$36]) ->  | C278: of:=IF( ISBLANK([$'03.Muestra'.$E$36]);"";[$'03.Muestra'.$E$36]) ->  | D278: of:=IF(AND([.B278]<>"";[.C278]<>"");"N/T";"") ->  | E278: of:=IF([.D278]<>"";IF(AND([.B278]<>"";[.C278]<>"");"";"ERR");"") -> 
B279: of:=IF( ISBLANK([$'03.Muestra'.$C$37]);"";[$'03.Muestra'.$C$37]) ->  | C279: of:=IF( ISBLANK([$'03.Muestra'.$E$37]);"";[$'03.Muestra'.$E$37]) ->  | D279: of:=IF(AND([.B279]<>"";[.C279]<>"");"N/T";"") ->  | E279: of:=IF([.D279]<>"";IF(AND([.B279]<>"";[.C279]<>"");"";"ERR");"") -> 
B282: AA | C282: 3.3.3 Sugerencias ante errores | D282: Resultado
B283: of:=IF( ISBLANK([$'03.Muestra'.$C$8]);"";[$'03.Muestra'.$C$8]) ->  | C283: of:=IF( ISBLANK([$'03.Muestra'.$E$8]);"";[$'03.Muestra'.$E$8]) ->  | D283: of:=IF(AND([.B283]<>"";[.C283]<>"");"N/T";"") ->  | E283: of:=IF([.D283]<>"";IF(AND([.B283]<>"";[.C283]<>"");"";"ERR");"") ->  | F283: of:=TRANSPOSE([$'DATA - Oculta'.$U$9:$'DATA - Oculta'.$U$13]) -> N/T | G283: N/D | H283: N/A | I283: Falla | J283: Pasa | K283: En blanco
B284: of:=IF( ISBLANK([$'03.Muestra'.$C$9]);"";[$'03.Muestra'.$C$9]) ->  | C284: of:=IF( ISBLANK([$'03.Muestra'.$E$9]);"";[$'03.Muestra'.$E$9]) ->  | D284: of:=IF(AND([.B284]<>"";[.C284]<>"");"N/T";"") ->  | E284: of:=IF([.D284]<>"";IF(AND([.B284]<>"";[.C284]<>"");"";"ERR");"") ->  | F284: of:=COUNTIF([.$D283]:INDIRECT("$D" &  SUM(ROW()-1;[$'03.Muestra'.$D$40])-1);[.F283]) -> 0 | G284: of:=COUNTIF([.$D283]:INDIRECT("$D" &  SUM(ROW()-1;[$'03.Muestra'.$D$40])-1);[.G283]) -> 0 | H284: of:=COUNTIF([.$D283]:INDIRECT("$D" &  SUM(ROW()-1;[$'03.Muestra'.$D$40])-1);[.H283]) -> 0 | I284: of:=COUNTIF([.$D283]:INDIRECT("$D" &  SUM(ROW()-1;[$'03.Muestra'.$D$40])-1);[.I283]) -> 0 | J284: of:=COUNTIF([.$D283]:INDIRECT("$D" &  SUM(ROW()-1;[$'03.Muestra'.$D$40])-1);[.J283]) -> 0 | K284: of:=IF([$'03.Muestra'.$D$40]=0;0;COUNTBLANK([.$D283]:INDIRECT("$D" &  SUM(ROW()-1;[$'03.Muestra'.$D$40])-1))) -> 0
B285: of:=IF( ISBLANK([$'03.Muestra'.$C$10]);"";[$'03.Muestra'.$C$10]) ->  | C285: of:=IF( ISBLANK([$'03.Muestra'.$E$10]);"";[$'03.Muestra'.$E$10]) ->  | D285: of:=IF(AND([.B285]<>"";[.C285]<>"");"N/T";"") ->  | E285: of:=IF([.D285]<>"";IF(AND([.B285]<>"";[.C285]<>"");"";"ERR");"") -> 
B286: of:=IF( ISBLANK([$'03.Muestra'.$C$11]);"";[$'03.Muestra'.$C$11]) ->  | C286: of:=IF( ISBLANK([$'03.Muestra'.$E$11]);"";[$'03.Muestra'.$E$11]) ->  | D286: of:=IF(AND([.B286]<>"";[.C286]<>"");"N/T";"") ->  | E286: of:=IF([.D286]<>"";IF(AND([.B286]<>"";[.C286]<>"");"";"ERR");"") -> 
B287: of:=IF( ISBLANK([$'03.Muestra'.$C$12]);"";[$'03.Muestra'.$C$12]) ->  | C287: of:=IF( ISBLANK([$'03.Muestra'.$E$12]);"";[$'03.Muestra'.$E$12]) ->  | D287: of:=IF(AND([.B287]<>"";[.C287]<>"");"N/T";"") ->  | E287: of:=IF([.D287]<>"";IF(AND([.B287]<>"";[.C287]<>"");"";"ERR");"") -> 
B288: of:=IF( ISBLANK([$'03.Muestra'.$C$13]);"";[$'03.Muestra'.$C$13]) ->  | C288: of:=IF( ISBLANK([$'03.Muestra'.$E$13]);"";[$'03.Muestra'.$E$13]) ->  | D288: of:=IF(AND([.B288]<>"";[.C288]<>"");"N/T";"") ->  | E288: of:=IF([.D288]<>"";IF(AND([.B288]<>"";[.C288]<>"");"";"ERR");"") -> 
B289: of:=IF( ISBLANK([$'03.Muestra'.$C$14]);"";[$'03.Muestra'.$C$14]) ->  | C289: of:=IF( ISBLANK([$'03.Muestra'.$E$14]);"";[$'03.Muestra'.$E$14]) ->  | D289: of:=IF(AND([.B289]<>"";[.C289]<>"");"N/T";"") ->  | E289: of:=IF([.D289]<>"";IF(AND([.B289]<>"";[.C289]<>"");"";"ERR");"") -> 
B290: of:=IF( ISBLANK([$'03.Muestra'.$C$15]);"";[$'03.Muestra'.$C$15]) ->  | C290: of:=IF( ISBLANK([$'03.Muestra'.$E$15]);"";[$'03.Muestra'.$E$15]) ->  | D290: of:=IF(AND([.B290]<>"";[.C290]<>"");"N/T";"") ->  | E290: of:=IF([.D290]<>"";IF(AND([.B290]<>"";[.C290]<>"");"";"ERR");"") -> 
B291: of:=IF( ISBLANK([$'03.Muestra'.$C$16]);"";[$'03.Muestra'.$C$16]) ->  | C291: of:=IF( ISBLANK([$'03.Muestra'.$E$16]);"";[$'03.Muestra'.$E$16]) ->  | D291: of:=IF(AND([.B291]<>"";[.C291]<>"");"N/T";"") ->  | E291: of:=IF([.D291]<>"";IF(AND([.B291]<>"";[.C291]<>"");"";"ERR");"") -> 
B292: of:=IF( ISBLANK([$'03.Muestra'.$C$17]);"";[$'03.Muestra'.$C$17]) ->  | C292: of:=IF( ISBLANK([$'03.Muestra'.$E$17]);"";[$'03.Muestra'.$E$17]) ->  | D292: of:=IF(AND([.B292]<>"";[.C292]<>"");"N/T";"") ->  | E292: of:=IF([.D292]<>"";IF(AND([.B292]<>"";[.C292]<>"");"";"ERR");"") -> 
B293: of:=IF( ISBLANK([$'03.Muestra'.$C$18]);"";[$'03.Muestra'.$C$18]) ->  | C293: of:=IF( ISBLANK([$'03.Muestra'.$E$18]);"";[$'03.Muestra'.$E$18]) ->  | D293: of:=IF(AND([.B293]<>"";[.C293]<>"");"N/T";"") ->  | E293: of:=IF([.D293]<>"";IF(AND([.B293]<>"";[.C293]<>"");"";"ERR");"") -> 
B294: of:=IF( ISBLANK([$'03.Muestra'.$C$19]);"";[$'03.Muestra'.$C$19]) ->  | C294: of:=IF( ISBLANK([$'03.Muestra'.$E$19]);"";[$'03.Muestra'.$E$19]) ->  | D294: of:=IF(AND([.B294]<>"";[.C294]<>"");"N/T";"") ->  | E294: of:=IF([.D294]<>"";IF(AND([.B294]<>"";[.C294]<>"");"";"ERR");"") -> 
B295: of:=IF( ISBLANK([$'03.Muestra'.$C$20]);"";[$'03.Muestra'.$C$20]) ->  | C295: of:=IF( ISBLANK([$'03.Muestra'.$E$20]);"";[$'03.Muestra'.$E$20]) ->  | D295: of:=IF(AND([.B295]<>"";[.C295]<>"");"N/T";"") ->  | E295: of:=IF([.D295]<>"";IF(AND([.B295]<>"";[.C295]<>"");"";"ERR");"") -> 
B296: of:=IF( ISBLANK([$'03.Muestra'.$C$21]);"";[$'03.Muestra'.$C$21]) ->  | C296: of:=IF( ISBLANK([$'03.Muestra'.$E$21]);"";[$'03.Muestra'.$E$21]) ->  | D296: of:=IF(AND([.B296]<>"";[.C296]<>"");"N/T";"") ->  | E296: of:=IF([.D296]<>"";IF(AND([.B296]<>"";[.C296]<>"");"";"ERR");"") -> 
B297: of:=IF( ISBLANK([$'03.Muestra'.$C$22]);"";[$'03.Muestra'.$C$22]) ->  | C297: of:=IF( ISBLANK([$'03.Muestra'.$E$22]);"";[$'03.Muestra'.$E$22]) ->  | D297: of:=IF(AND([.B297]<>"";[.C297]<>"");"N/T";"") ->  | E297: of:=IF([.D297]<>"";IF(AND([.B297]<>"";[.C297]<>"");"";"ERR");"") -> 
B298: of:=IF( ISBLANK([$'03.Muestra'.$C$23]);"";[$'03.Muestra'.$C$23]) ->  | C298: of:=IF( ISBLANK([$'03.Muestra'.$E$23]);"";[$'03.Muestra'.$E$23]) ->  | D298: of:=IF(AND([.B298]<>"";[.C298]<>"");"N/T";"") ->  | E298: of:=IF([.D298]<>"";IF(AND([.B298]<>"";[.C298]<>"");"";"ERR");"") -> 
B299: of:=IF( ISBLANK([$'03.Muestra'.$C$24]);"";[$'03.Muestra'.$C$24]) ->  | C299: of:=IF( ISBLANK([$'03.Muestra'.$E$24]);"";[$'03.Muestra'.$E$24]) ->  | D299: of:=IF(AND([.B299]<>"";[.C299]<>"");"N/T";"") ->  | E299: of:=IF([.D299]<>"";IF(AND([.B299]<>"";[.C299]<>"");"";"ERR");"") -> 
B300: of:=IF( ISBLANK([$'03.Muestra'.$C$25]);"";[$'03.Muestra'.$C$25]) ->  | C300: of:=IF( ISBLANK([$'03.Muestra'.$E$25]);"";[$'03.Muestra'.$E$25]) ->  | D300: of:=IF(AND([.B300]<>"";[.C300]<>"");"N/T";"") ->  | E300: of:=IF([.D300]<>"";IF(AND([.B300]<>"";[.C300]<>"");"";"ERR");"") -> 
B301: of:=IF( ISBLANK([$'03.Muestra'.$C$26]);"";[$'03.Muestra'.$C$26]) ->  | C301: of:=IF( ISBLANK([$'03.Muestra'.$E$26]);"";[$'03.Muestra'.$E$26]) ->  | D301: of:=IF(AND([.B301]<>"";[.C301]<>"");"N/T";"") ->  | E301: of:=IF([.D301]<>"";IF(AND([.B301]<>"";[.C301]<>"");"";"ERR");"") -> 
B302: of:=IF( ISBLANK([$'03.Muestra'.$C$27]);"";[$'03.Muestra'.$C$27]) ->  | C302: of:=IF( ISBLANK([$'03.Muestra'.$E$27]);"";[$'03.Muestra'.$E$27]) ->  | D302: of:=IF(AND([.B302]<>"";[.C302]<>"");"N/T";"") ->  | E302: of:=IF([.D302]<>"";IF(AND([.B302]<>"";[.C302]<>"");"";"ERR");"") -> 
B303: of:=IF( ISBLANK([$'03.Muestra'.$C$28]);"";[$'03.Muestra'.$C$28]) ->  | C303: of:=IF( ISBLANK([$'03.Muestra'.$E$28]);"";[$'03.Muestra'.$E$28]) ->  | D303: of:=IF(AND([.B303]<>"";[.C303]<>"");"N/T";"") ->  | E303: of:=IF([.D303]<>"";IF(AND([.B303]<>"";[.C303]<>"");"";"ERR");"") -> 
B304: of:=IF( ISBLANK([$'03.Muestra'.$C$29]);"";[$'03.Muestra'.$C$29]) ->  | C304: of:=IF( ISBLANK([$'03.Muestra'.$E$29]);"";[$'03.Muestra'.$E$29]) ->  | D304: of:=IF(AND([.B304]<>"";[.C304]<>"");"N/T";"") ->  | E304: of:=IF([.D304]<>"";IF(AND([.B304]<>"";[.C304]<>"");"";"ERR");"") -> 
B305: of:=IF( ISBLANK([$'03.Muestra'.$C$30]);"";[$'03.Muestra'.$C$30]) ->  | C305: of:=IF( ISBLANK([$'03.Muestra'.$E$30]);"";[$'03.Muestra'.$E$30]) ->  | D305: of:=IF(AND([.B305]<>"";[.C305]<>"");"N/T";"") ->  | E305: of:=IF([.D305]<>"";IF(AND([.B305]<>"";[.C305]<>"");"";"ERR");"") -> 
B306: of:=IF( ISBLANK([$'03.Muestra'.$C$31]);"";[$'03.Muestra'.$C$31]) ->  | C306: of:=IF( ISBLANK([$'03.Muestra'.$E$31]);"";[$'03.Muestra'.$E$31]) ->  | D306: of:=IF(AND([.B306]<>"";[.C306]<>"");"N/T";"") ->  | E306: of:=IF([.D306]<>"";IF(AND([.B306]<>"";[.C306]<>"");"";"ERR");"") -> 
B307: of:=IF( ISBLANK([$'03.Muestra'.$C$32]);"";[$'03.Muestra'.$C$32]) ->  | C307: of:=IF( ISBLANK([$'03.Muestra'.$E$32]);"";[$'03.Muestra'.$E$32]) ->  | D307: of:=IF(AND([.B307]<>"";[.C307]<>"");"N/T";"") ->  | E307: of:=IF([.D307]<>"";IF(AND([.B307]<>"";[.C307]<>"");"";"ERR");"") -> 
B308: of:=IF( ISBLANK([$'03.Muestra'.$C$33]);"";[$'03.Muestra'.$C$33]) ->  | C308: of:=IF( ISBLANK([$'03.Muestra'.$E$33]);"";[$'03.Muestra'.$E$33]) ->  | D308: of:=IF(AND([.B308]<>"";[.C308]<>"");"N/T";"") ->  | E308: of:=IF([.D308]<>"";IF(AND([.B308]<>"";[.C308]<>"");"";"ERR");"") -> 
B309: of:=IF( ISBLANK([$'03.Muestra'.$C$34]);"";[$'03.Muestra'.$C$34]) ->  | C309: of:=IF( ISBLANK([$'03.Muestra'.$E$34]);"";[$'03.Muestra'.$E$34]) ->  | D309: of:=IF(AND([.B309]<>"";[.C309]<>"");"N/T";"") ->  | E309: of:=IF([.D309]<>"";IF(AND([.B309]<>"";[.C309]<>"");"";"ERR");"") -> 
B310: of:=IF( ISBLANK([$'03.Muestra'.$C$35]);"";[$'03.Muestra'.$C$35]) ->  | C310: of:=IF( ISBLANK([$'03.Muestra'.$E$35]);"";[$'03.Muestra'.$E$35]) ->  | D310: of:=IF(AND([.B310]<>"";[.C310]<>"");"N/T";"") ->  | E310: of:=IF([.D310]<>"";IF(AND([.B310]<>"";[.C310]<>"");"";"ERR");"") -> 
B311: of:=IF( ISBLANK([$'03.Muestra'.$C$36]);"";[$'03.Muestra'.$C$36]) ->  | C311: of:=IF( ISBLANK([$'03.Muestra'.$E$36]);"";[$'03.Muestra'.$E$36]) ->  | D311: of:=IF(AND([.B311]<>"";[.C311]<>"");"N/T";"") ->  | E311: of:=IF([.D311]<>"";IF(AND([.B311]<>"";[.C311]<>"");"";"ERR");"") -> 
B312: of:=IF( ISBLANK([$'03.Muestra'.$C$37]);"";[$'03.Muestra'.$C$37]) ->  | C312: of:=IF( ISBLANK([$'03.Muestra'.$E$37]);"";[$'03.Muestra'.$E$37]) ->  | D312: of:=IF(AND([.B312]<>"";[.C312]<>"");"N/T";"") ->  | E312: of:=IF([.D312]<>"";IF(AND([.B312]<>"";[.C312]<>"");"";"ERR");"") -> 
B315: AA | C315: 3.3.4 PrevenciÃ³n de errores (legales, financieros, datos) | D315: Resultado
B316: of:=IF( ISBLANK([$'03.Muestra'.$C$8]);"";[$'03.Muestra'.$C$8]) ->  | C316: of:=IF( ISBLANK([$'03.Muestra'.$E$8]);"";[$'03.Muestra'.$E$8]) ->  | D316: of:=IF(AND([.B316]<>"";[.C316]<>"");"N/T";"") ->  | E316: of:=IF([.D316]<>"";IF(AND([.B316]<>"";[.C316]<>"");"";"ERR");"") ->  | F316: of:=TRANSPOSE([$'DATA - Oculta'.$U$9:$'DATA - Oculta'.$U$13]) -> N/T | G316: N/D | H316: N/A | I316: Falla | J316: Pasa | K316: En blanco
B317: of:=IF( ISBLANK([$'03.Muestra'.$C$9]);"";[$'03.Muestra'.$C$9]) ->  | C317: of:=IF( ISBLANK([$'03.Muestra'.$E$9]);"";[$'03.Muestra'.$E$9]) ->  | D317: of:=IF(AND([.B317]<>"";[.C317]<>"");"N/T";"") ->  | E317: of:=IF([.D317]<>"";IF(AND([.B317]<>"";[.C317]<>"");"";"ERR");"") ->  | F317: of:=COUNTIF([.$D316]:INDIRECT("$D" &  SUM(ROW()-1;[$'03.Muestra'.$D$40])-1);[.F316]) -> 0 | G317: of:=COUNTIF([.$D316]:INDIRECT("$D" &  SUM(ROW()-1;[$'03.Muestra'.$D$40])-1);[.G316]) -> 0 | H317: of:=COUNTIF([.$D316]:INDIRECT("$D" &  SUM(ROW()-1;[$'03.Muestra'.$D$40])-1);[.H316]) -> 0 | I317: of:=COUNTIF([.$D316]:INDIRECT("$D" &  SUM(ROW()-1;[$'03.Muestra'.$D$40])-1);[.I316]) -> 0 | J317: of:=COUNTIF([.$D316]:INDIRECT("$D" &  SUM(ROW()-1;[$'03.Muestra'.$D$40])-1);[.J316]) -> 0 | K317: of:=IF([$'03.Muestra'.$D$40]=0;0;COUNTBLANK([.$D316]:INDIRECT("$D" &  SUM(ROW()-1;[$'03.Muestra'.$D$40])-1))) -> 0
B318: of:=IF( ISBLANK([$'03.Muestra'.$C$10]);"";[$'03.Muestra'.$C$10]) ->  | C318: of:=IF( ISBLANK([$'03.Muestra'.$E$10]);"";[$'03.Muestra'.$E$10]) ->  | D318: of:=IF(AND([.B318]<>"";[.C318]<>"");"N/T";"") ->  | E318: of:=IF([.D318]<>"";IF(AND([.B318]<>"";[.C318]<>"");"";"ERR");"") -> 
B319: of:=IF( ISBLANK([$'03.Muestra'.$C$11]);"";[$'03.Muestra'.$C$11]) ->  | C319: of:=IF( ISBLANK([$'03.Muestra'.$E$11]);"";[$'03.Muestra'.$E$11]) ->  | D319: of:=IF(AND([.B319]<>"";[.C319]<>"");"N/T";"") ->  | E319: of:=IF([.D319]<>"";IF(AND([.B319]<>"";[.C319]<>"");"";"ERR");"") -> 
B320: of:=IF( ISBLANK([$'03.Muestra'.$C$12]);"";[$'03.Muestra'.$C$12]) ->  | C320: of:=IF( ISBLANK([$'03.Muestra'.$E$12]);"";[$'03.Muestra'.$E$12]) ->  | D320: of:=IF(AND([.B320]<>"";[.C320]<>"");"N/T";"") ->  | E320: of:=IF([.D320]<>"";IF(AND([.B320]<>"";[.C320]<>"");"";"ERR");"") -> 
B321: of:=IF( ISBLANK([$'03.Muestra'.$C$13]);"";[$'03.Muestra'.$C$13]) ->  | C321: of:=IF( ISBLANK([$'03.Muestra'.$E$13]);"";[$'03.Muestra'.$E$13]) ->  | D321: of:=IF(AND([.B321]<>"";[.C321]<>"");"N/T";"") ->  | E321: of:=IF([.D321]<>"";IF(AND([.B321]<>"";[.C321]<>"");"";"ERR");"") -> 
B322: of:=IF( ISBLANK([$'03.Muestra'.$C$14]);"";[$'03.Muestra'.$C$14]) ->  | C322: of:=IF( ISBLANK([$'03.Muestra'.$E$14]);"";[$'03.Muestra'.$E$14]) ->  | D322: of:=IF(AND([.B322]<>"";[.C322]<>"");"N/T";"") ->  | E322: of:=IF([.D322]<>"";IF(AND([.B322]<>"";[.C322]<>"");"";"ERR");"") -> 
B323: of:=IF( ISBLANK([$'03.Muestra'.$C$15]);"";[$'03.Muestra'.$C$15]) ->  | C323: of:=IF( ISBLANK([$'03.Muestra'.$E$15]);"";[$'03.Muestra'.$E$15]) ->  | D323: of:=IF(AND([.B323]<>"";[.C323]<>"");"N/T";"") ->  | E323: of:=IF([.D323]<>"";IF(AND([.B323]<>"";[.C323]<>"");"";"ERR");"") -> 
B324: of:=IF( ISBLANK([$'03.Muestra'.$C$16]);"";[$'03.Muestra'.$C$16]) ->  | C324: of:=IF( ISBLANK([$'03.Muestra'.$E$16]);"";[$'03.Muestra'.$E$16]) ->  | D324: of:=IF(AND([.B324]<>"";[.C324]<>"");"N/T";"") ->  | E324: of:=IF([.D324]<>"";IF(AND([.B324]<>"";[.C324]<>"");"";"ERR");"") -> 
B325: of:=IF( ISBLANK([$'03.Muestra'.$C$17]);"";[$'03.Muestra'.$C$17]) ->  | C325: of:=IF( ISBLANK([$'03.Muestra'.$E$17]);"";[$'03.Muestra'.$E$17]) ->  | D325: of:=IF(AND([.B325]<>"";[.C325]<>"");"N/T";"") ->  | E325: of:=IF([.D325]<>"";IF(AND([.B325]<>"";[.C325]<>"");"";"ERR");"") -> 
B326: of:=IF( ISBLANK([$'03.Muestra'.$C$18]);"";[$'03.Muestra'.$C$18]) ->  | C326: of:=IF( ISBLANK([$'03.Muestra'.$E$18]);"";[$'03.Muestra'.$E$18]) ->  | D326: of:=IF(AND([.B326]<>"";[.C326]<>"");"N/T";"") ->  | E326: of:=IF([.D326]<>"";IF(AND([.B326]<>"";[.C326]<>"");"";"ERR");"") -> 
B327: of:=IF( ISBLANK([$'03.Muestra'.$C$19]);"";[$'03.Muestra'.$C$19]) ->  | C327: of:=IF( ISBLANK([$'03.Muestra'.$E$19]);"";[$'03.Muestra'.$E$19]) ->  | D327: of:=IF(AND([.B327]<>"";[.C327]<>"");"N/T";"") ->  | E327: of:=IF([.D327]<>"";IF(AND([.B327]<>"";[.C327]<>"");"";"ERR");"") -> 
B328: of:=IF( ISBLANK([$'03.Muestra'.$C$20]);"";[$'03.Muestra'.$C$20]) ->  | C328: of:=IF( ISBLANK([$'03.Muestra'.$E$20]);"";[$'03.Muestra'.$E$20]) ->  | D328: of:=IF(AND([.B328]<>"";[.C328]<>"");"N/T";"") ->  | E328: of:=IF([.D328]<>"";IF(AND([.B328]<>"";[.C328]<>"");"";"ERR");"") -> 
B329: of:=IF( ISBLANK([$'03.Muestra'.$C$21]);"";[$'03.Muestra'.$C$21]) ->  | C329: of:=IF( ISBLANK([$'03.Muestra'.$E$21]);"";[$'03.Muestra'.$E$21]) ->  | D329: of:=IF(AND([.B329]<>"";[.C329]<>"");"N/T";"") ->  | E329: of:=IF([.D329]<>"";IF(AND([.B329]<>"";[.C329]<>"");"";"ERR");"") -> 
B330: of:=IF( ISBLANK([$'03.Muestra'.$C$22]);"";[$'03.Muestra'.$C$22]) ->  | C330: of:=IF( ISBLANK([$'03.Muestra'.$E$22]);"";[$'03.Muestra'.$E$22]) ->  | D330: of:=IF(AND([.B330]<>"";[.C330]<>"");"N/T";"") ->  | E330: of:=IF([.D330]<>"";IF(AND([.B330]<>"";[.C330]<>"");"";"ERR");"") -> 
B331: of:=IF( ISBLANK([$'03.Muestra'.$C$23]);"";[$'03.Muestra'.$C$23]) ->  | C331: of:=IF( ISBLANK([$'03.Muestra'.$E$23]);"";[$'03.Muestra'.$E$23]) ->  | D331: of:=IF(AND([.B331]<>"";[.C331]<>"");"N/T";"") ->  | E331: of:=IF([.D331]<>"";IF(AND([.B331]<>"";[.C331]<>"");"";"ERR");"") -> 
B332: of:=IF( ISBLANK([$'03.Muestra'.$C$24]);"";[$'03.Muestra'.$C$24]) ->  | C332: of:=IF( ISBLANK([$'03.Muestra'.$E$24]);"";[$'03.Muestra'.$E$24]) ->  | D332: of:=IF(AND([.B332]<>"";[.C332]<>"");"N/T";"") ->  | E332: of:=IF([.D332]<>"";IF(AND([.B332]<>"";[.C332]<>"");"";"ERR");"") -> 
B333: of:=IF( ISBLANK([$'03.Muestra'.$C$25]);"";[$'03.Muestra'.$C$25]) ->  | C333: of:=IF( ISBLANK([$'03.Muestra'.$E$25]);"";[$'03.Muestra'.$E$25]) ->  | D333: of:=IF(AND([.B333]<>"";[.C333]<>"");"N/T";"") ->  | E333: of:=IF([.D333]<>"";IF(AND([.B333]<>"";[.C333]<>"");"";"ERR");"") -> 
B334: of:=IF( ISBLANK([$'03.Muestra'.$C$26]);"";[$'03.Muestra'.$C$26]) ->  | C334: of:=IF( ISBLANK([$'03.Muestra'.$E$26]);"";[$'03.Muestra'.$E$26]) ->  | D334: of:=IF(AND([.B334]<>"";[.C334]<>"");"N/T";"") ->  | E334: of:=IF([.D334]<>"";IF(AND([.B334]<>"";[.C334]<>"");"";"ERR");"") -> 
B335: of:=IF( ISBLANK([$'03.Muestra'.$C$27]);"";[$'03.Muestra'.$C$27]) ->  | C335: of:=IF( ISBLANK([$'03.Muestra'.$E$27]);"";[$'03.Muestra'.$E$27]) ->  | D335: of:=IF(AND([.B335]<>"";[.C335]<>"");"N/T";"") ->  | E335: of:=IF([.D335]<>"";IF(AND([.B335]<>"";[.C335]<>"");"";"ERR");"") -> 
B336: of:=IF( ISBLANK([$'03.Muestra'.$C$28]);"";[$'03.Muestra'.$C$28]) ->  | C336: of:=IF( ISBLANK([$'03.Muestra'.$E$28]);"";[$'03.Muestra'.$E$28]) ->  | D336: of:=IF(AND([.B336]<>"";[.C336]<>"");"N/T";"") ->  | E336: of:=IF([.D336]<>"";IF(AND([.B336]<>"";[.C336]<>"");"";"ERR");"") -> 
B337: of:=IF( ISBLANK([$'03.Muestra'.$C$29]);"";[$'03.Muestra'.$C$29]) ->  | C337: of:=IF( ISBLANK([$'03.Muestra'.$E$29]);"";[$'03.Muestra'.$E$29]) ->  | D337: of:=IF(AND([.B337]<>"";[.C337]<>"");"N/T";"") ->  | E337: of:=IF([.D337]<>"";IF(AND([.B337]<>"";[.C337]<>"");"";"ERR");"") -> 
B338: of:=IF( ISBLANK([$'03.Muestra'.$C$30]);"";[$'03.Muestra'.$C$30]) ->  | C338: of:=IF( ISBLANK([$'03.Muestra'.$E$30]);"";[$'03.Muestra'.$E$30]) ->  | D338: of:=IF(AND([.B338]<>"";[.C338]<>"");"N/T";"") ->  | E338: of:=IF([.D338]<>"";IF(AND([.B338]<>"";[.C338]<>"");"";"ERR");"") -> 
B339: of:=IF( ISBLANK([$'03.Muestra'.$C$31]);"";[$'03.Muestra'.$C$31]) ->  | C339: of:=IF( ISBLANK([$'03.Muestra'.$E$31]);"";[$'03.Muestra'.$E$31]) ->  | D339: of:=IF(AND([.B339]<>"";[.C339]<>"");"N/T";"") ->  | E339: of:=IF([.D339]<>"";IF(AND([.B339]<>"";[.C339]<>"");"";"ERR");"") -> 
B340: of:=IF( ISBLANK([$'03.Muestra'.$C$32]);"";[$'03.Muestra'.$C$32]) ->  | C340: of:=IF( ISBLANK([$'03.Muestra'.$E$32]);"";[$'03.Muestra'.$E$32]) ->  | D340: of:=IF(AND([.B340]<>"";[.C340]<>"");"N/T";"") ->  | E340: of:=IF([.D340]<>"";IF(AND([.B340]<>"";[.C340]<>"");"";"ERR");"") -> 
B341: of:=IF( ISBLANK([$'03.Muestra'.$C$33]);"";[$'03.Muestra'.$C$33]) ->  | C341: of:=IF( ISBLANK([$'03.Muestra'.$E$33]);"";[$'03.Muestra'.$E$33]) ->  | D341: of:=IF(AND([.B341]<>"";[.C341]<>"");"N/T";"") ->  | E341: of:=IF([.D341]<>"";IF(AND([.B341]<>"";[.C341]<>"");"";"ERR");"") -> 
B342: of:=IF( ISBLANK([$'03.Muestra'.$C$34]);"";[$'03.Muestra'.$C$34]) ->  | C342: of:=IF( ISBLANK([$'03.Muestra'.$E$34]);"";[$'03.Muestra'.$E$34]) ->  | D342: of:=IF(AND([.B342]<>"";[.C342]<>"");"N/T";"") ->  | E342: of:=IF([.D342]<>"";IF(AND([.B342]<>"";[.C342]<>"");"";"ERR");"") -> 
B343: of:=IF( ISBLANK([$'03.Muestra'.$C$35]);"";[$'03.Muestra'.$C$35]) ->  | C343: of:=IF( ISBLANK([$'03.Muestra'.$E$35]);"";[$'03.Muestra'.$E$35]) ->  | D343: of:=IF(AND([.B343]<>"";[.C343]<>"");"N/T";"") ->  | E343: of:=IF([.D343]<>"";IF(AND([.B343]<>"";[.C343]<>"");"";"ERR");"") -> 
B344: of:=IF( ISBLANK([$'03.Muestra'.$C$36]);"";[$'03.Muestra'.$C$36]) ->  | C344: of:=IF( ISBLANK([$'03.Muestra'.$E$36]);"";[$'03.Muestra'.$E$36]) ->  | D344: of:=IF(AND([.B344]<>"";[.C344]<>"");"N/T";"") ->  | E344: of:=IF([.D344]<>"";IF(AND([.B344]<>"";[.C344]<>"");"";"ERR");"") -> 
B345: of:=IF( ISBLANK([$'03.Muestra'.$C$37]);"";[$'03.Muestra'.$C$37]) ->  | C345: of:=IF( ISBLANK([$'03.Muestra'.$E$37]);"";[$'03.Muestra'.$E$37]) ->  | D345: of:=IF(AND([.B345]<>"";[.C345]<>"");"N/T";"") ->  | E345: of:=IF([.D345]<>"";IF(AND([.B345]<>"";[.C345]<>"");"";"ERR");"") -> 

Sheet: P4.Robusto
B2: Informe de revisiÃ³n de la accesibilidad
B3: AnÃ¡lisis de accesibilidad en profundidad
B5: RevisiÃ³n de la muestra
B8: Principio 4: Robusto
B9: El contenido debe ser lo suficientemente robusto para que pueda ser interpretado de manera confiable
B11: Criterios de VerificaciÃ³n | F11: Criterios | G11: Evaluados | H11: % | J11: Criterios | K11: Pendientes | L11: %
B12: A | C12: 2 | F12: Pasa | G12: of:=[.J20]+[.J53]+[.J86] -> 0 | H12: of:=IF(([.$G$15]+[.$K$15])=0;0;[.G12]/([.$G$15]+[.$K$15])) -> 0 | J12: No decide | K12: of:=[.G20]+[.G53]+[.G86] -> 0 | L12: of:=IF(([.$G$15]+[.$K$15])=0;0;[.K12]/([.$G$15]+[.$K$15])) -> 0
B13: AA | C13: 1 | F13: Falla | G13: of:=[.I20]+[.I53]+[.I86] -> 0 | H13: of:=IF(([.$G$15]+[.$K$15])=0;0;[.G13]/([.$G$15]+[.$K$15])) -> 0 | J13: No testeado | K13: of:=[.F20]+[.F53]+[.F86] -> 0 | L13: of:=IF(([.$G$15]+[.$K$15])=0;0;[.K13]/([.$G$15]+[.$K$15])) -> 0
B14: Total | C14: of:=SUM([.C12:.C13]) -> 3 | F14: No aplica | G14: of:=[.H20]+[.H53]+[.H86] -> 0 | H14: of:=IF(([.$G$15]+[.$K$15])=0;0;[.G14]/([.$G$15]+[.$K$15])) -> 0 | J14: En blanco | K14: of:=[.K20]+[.K53]+[.K86] -> 0 | L14: of:=IF(([.$G$15]+[.$K$15])=0;0;[.K14]/([.$G$15]+[.$K$15])) -> 0
F15: Total | G15: of:=SUM([.G12:.G14]) -> 0 | H15: of:=SUM([.H12:.H14]) -> 0 | J15: Total | K15: of:=SUM([.K12:.K14]) -> 0 | L15: of:=SUM([.L12:.L14]) -> 0
B18: A | C18: 4.1.1 Procesamiento | D18: Resultado
B19: of:=IF( ISBLANK([$'03.Muestra'.$C$8]);"";[$'03.Muestra'.$C$8]) ->  | C19: of:=IF( ISBLANK([$'03.Muestra'.$E$8]);"";[$'03.Muestra'.$E$8]) ->  | D19: of:=IF(AND([.B19]<>"";[.C19]<>"");"N/T";"") ->  | E19: of:=IF([.D19]<>"";IF(AND([.B19]<>"";[.C19]<>"");"";"ERR");"") ->  | F19: of:=TRANSPOSE([$'DATA - Oculta'.$U$9:$'DATA - Oculta'.$U$13]) -> N/T | G19: N/D | H19: N/A | I19: Falla | J19: Pasa | K19: En blanco
B20: of:=IF( ISBLANK([$'03.Muestra'.$C$9]);"";[$'03.Muestra'.$C$9]) ->  | C20: of:=IF( ISBLANK([$'03.Muestra'.$E$9]);"";[$'03.Muestra'.$E$9]) ->  | D20: of:=IF(AND([.B20]<>"";[.C20]<>"");"N/T";"") ->  | E20: of:=IF([.D20]<>"";IF(AND([.B20]<>"";[.C20]<>"");"";"ERR");"") ->  | F20: of:=COUNTIF([.$D19]:INDIRECT("$D" &  SUM(ROW()-1;[$'03.Muestra'.$D$40])-1);[.F19]) -> 0 | G20: of:=COUNTIF([.$D19]:INDIRECT("$D" &  SUM(ROW()-1;[$'03.Muestra'.$D$40])-1);[.G19]) -> 0 | H20: of:=COUNTIF([.$D19]:INDIRECT("$D" &  SUM(ROW()-1;[$'03.Muestra'.$D$40])-1);[.H19]) -> 0 | I20: of:=COUNTIF([.$D19]:INDIRECT("$D" &  SUM(ROW()-1;[$'03.Muestra'.$D$40])-1);[.I19]) -> 0 | J20: of:=COUNTIF([.$D19]:INDIRECT("$D" &  SUM(ROW()-1;[$'03.Muestra'.$D$40])-1);[.J19]) -> 0 | K20: of:=IF([$'03.Muestra'.$D$40]=0;0;COUNTBLANK([.$D19]:INDIRECT("$D" &  SUM(ROW()-1;[$'03.Muestra'.$D$40])-1))) -> 0
B21: of:=IF( ISBLANK([$'03.Muestra'.$C$10]);"";[$'03.Muestra'.$C$10]) ->  | C21: of:=IF( ISBLANK([$'03.Muestra'.$E$10]);"";[$'03.Muestra'.$E$10]) ->  | D21: of:=IF(AND([.B21]<>"";[.C21]<>"");"N/T";"") ->  | E21: of:=IF([.D21]<>"";IF(AND([.B21]<>"";[.C21]<>"");"";"ERR");"") -> 
B22: of:=IF( ISBLANK([$'03.Muestra'.$C$11]);"";[$'03.Muestra'.$C$11]) ->  | C22: of:=IF( ISBLANK([$'03.Muestra'.$E$11]);"";[$'03.Muestra'.$E$11]) ->  | D22: of:=IF(AND([.B22]<>"";[.C22]<>"");"N/T";"") ->  | E22: of:=IF([.D22]<>"";IF(AND([.B22]<>"";[.C22]<>"");"";"ERR");"") ->  | K22: N/T | L22: No Testeado
B23: of:=IF( ISBLANK([$'03.Muestra'.$C$12]);"";[$'03.Muestra'.$C$12]) ->  | C23: of:=IF( ISBLANK([$'03.Muestra'.$E$12]);"";[$'03.Muestra'.$E$12]) ->  | D23: of:=IF(AND([.B23]<>"";[.C23]<>"");"N/T";"") ->  | E23: of:=IF([.D23]<>"";IF(AND([.B23]<>"";[.C23]<>"");"";"ERR");"") ->  | K23: N/A | L23: No Aplica
B24: of:=IF( ISBLANK([$'03.Muestra'.$C$13]);"";[$'03.Muestra'.$C$13]) ->  | C24: of:=IF( ISBLANK([$'03.Muestra'.$E$13]);"";[$'03.Muestra'.$E$13]) ->  | D24: of:=IF(AND([.B24]<>"";[.C24]<>"");"N/T";"") ->  | E24: of:=IF([.D24]<>"";IF(AND([.B24]<>"";[.C24]<>"");"";"ERR");"") ->  | K24: N/D | L24: No Decide
B25: of:=IF( ISBLANK([$'03.Muestra'.$C$14]);"";[$'03.Muestra'.$C$14]) ->  | C25: of:=IF( ISBLANK([$'03.Muestra'.$E$14]);"";[$'03.Muestra'.$E$14]) ->  | D25: of:=IF(AND([.B25]<>"";[.C25]<>"");"N/T";"") ->  | E25: of:=IF([.D25]<>"";IF(AND([.B25]<>"";[.C25]<>"");"";"ERR");"") -> 
B26: of:=IF( ISBLANK([$'03.Muestra'.$C$15]);"";[$'03.Muestra'.$C$15]) ->  | C26: of:=IF( ISBLANK([$'03.Muestra'.$E$15]);"";[$'03.Muestra'.$E$15]) ->  | D26: of:=IF(AND([.B26]<>"";[.C26]<>"");"N/T";"") ->  | E26: of:=IF([.D26]<>"";IF(AND([.B26]<>"";[.C26]<>"");"";"ERR");"") -> 
B27: of:=IF( ISBLANK([$'03.Muestra'.$C$16]);"";[$'03.Muestra'.$C$16]) ->  | C27: of:=IF( ISBLANK([$'03.Muestra'.$E$16]);"";[$'03.Muestra'.$E$16]) ->  | D27: of:=IF(AND([.B27]<>"";[.C27]<>"");"N/T";"") ->  | E27: of:=IF([.D27]<>"";IF(AND([.B27]<>"";[.C27]<>"");"";"ERR");"") -> 
B28: of:=IF( ISBLANK([$'03.Muestra'.$C$17]);"";[$'03.Muestra'.$C$17]) ->  | C28: of:=IF( ISBLANK([$'03.Muestra'.$E$17]);"";[$'03.Muestra'.$E$17]) ->  | D28: of:=IF(AND([.B28]<>"";[.C28]<>"");"N/T";"") ->  | E28: of:=IF([.D28]<>"";IF(AND([.B28]<>"";[.C28]<>"");"";"ERR");"") -> 
B29: of:=IF( ISBLANK([$'03.Muestra'.$C$18]);"";[$'03.Muestra'.$C$18]) ->  | C29: of:=IF( ISBLANK([$'03.Muestra'.$E$18]);"";[$'03.Muestra'.$E$18]) ->  | D29: of:=IF(AND([.B29]<>"";[.C29]<>"");"N/T";"") ->  | E29: of:=IF([.D29]<>"";IF(AND([.B29]<>"";[.C29]<>"");"";"ERR");"") -> 
B30: of:=IF( ISBLANK([$'03.Muestra'.$C$19]);"";[$'03.Muestra'.$C$19]) ->  | C30: of:=IF( ISBLANK([$'03.Muestra'.$E$19]);"";[$'03.Muestra'.$E$19]) ->  | D30: of:=IF(AND([.B30]<>"";[.C30]<>"");"N/T";"") ->  | E30: of:=IF([.D30]<>"";IF(AND([.B30]<>"";[.C30]<>"");"";"ERR");"") -> 
B31: of:=IF( ISBLANK([$'03.Muestra'.$C$20]);"";[$'03.Muestra'.$C$20]) ->  | C31: of:=IF( ISBLANK([$'03.Muestra'.$E$20]);"";[$'03.Muestra'.$E$20]) ->  | D31: of:=IF(AND([.B31]<>"";[.C31]<>"");"N/T";"") ->  | E31: of:=IF([.D31]<>"";IF(AND([.B31]<>"";[.C31]<>"");"";"ERR");"") -> 
B32: of:=IF( ISBLANK([$'03.Muestra'.$C$21]);"";[$'03.Muestra'.$C$21]) ->  | C32: of:=IF( ISBLANK([$'03.Muestra'.$E$21]);"";[$'03.Muestra'.$E$21]) ->  | D32: of:=IF(AND([.B32]<>"";[.C32]<>"");"N/T";"") ->  | E32: of:=IF([.D32]<>"";IF(AND([.B32]<>"";[.C32]<>"");"";"ERR");"") -> 
B33: of:=IF( ISBLANK([$'03.Muestra'.$C$22]);"";[$'03.Muestra'.$C$22]) ->  | C33: of:=IF( ISBLANK([$'03.Muestra'.$E$22]);"";[$'03.Muestra'.$E$22]) ->  | D33: of:=IF(AND([.B33]<>"";[.C33]<>"");"N/T";"") ->  | E33: of:=IF([.D33]<>"";IF(AND([.B33]<>"";[.C33]<>"");"";"ERR");"") -> 
B34: of:=IF( ISBLANK([$'03.Muestra'.$C$23]);"";[$'03.Muestra'.$C$23]) ->  | C34: of:=IF( ISBLANK([$'03.Muestra'.$E$23]);"";[$'03.Muestra'.$E$23]) ->  | D34: of:=IF(AND([.B34]<>"";[.C34]<>"");"N/T";"") ->  | E34: of:=IF([.D34]<>"";IF(AND([.B34]<>"";[.C34]<>"");"";"ERR");"") -> 
B35: of:=IF( ISBLANK([$'03.Muestra'.$C$24]);"";[$'03.Muestra'.$C$24]) ->  | C35: of:=IF( ISBLANK([$'03.Muestra'.$E$24]);"";[$'03.Muestra'.$E$24]) ->  | D35: of:=IF(AND([.B35]<>"";[.C35]<>"");"N/T";"") ->  | E35: of:=IF([.D35]<>"";IF(AND([.B35]<>"";[.C35]<>"");"";"ERR");"") -> 
B36: of:=IF( ISBLANK([$'03.Muestra'.$C$25]);"";[$'03.Muestra'.$C$25]) ->  | C36: of:=IF( ISBLANK([$'03.Muestra'.$E$25]);"";[$'03.Muestra'.$E$25]) ->  | D36: of:=IF(AND([.B36]<>"";[.C36]<>"");"N/T";"") ->  | E36: of:=IF([.D36]<>"";IF(AND([.B36]<>"";[.C36]<>"");"";"ERR");"") -> 
B37: of:=IF( ISBLANK([$'03.Muestra'.$C$26]);"";[$'03.Muestra'.$C$26]) ->  | C37: of:=IF( ISBLANK([$'03.Muestra'.$E$26]);"";[$'03.Muestra'.$E$26]) ->  | D37: of:=IF(AND([.B37]<>"";[.C37]<>"");"N/T";"") ->  | E37: of:=IF([.D37]<>"";IF(AND([.B37]<>"";[.C37]<>"");"";"ERR");"") -> 
B38: of:=IF( ISBLANK([$'03.Muestra'.$C$27]);"";[$'03.Muestra'.$C$27]) ->  | C38: of:=IF( ISBLANK([$'03.Muestra'.$E$27]);"";[$'03.Muestra'.$E$27]) ->  | D38: of:=IF(AND([.B38]<>"";[.C38]<>"");"N/T";"") ->  | E38: of:=IF([.D38]<>"";IF(AND([.B38]<>"";[.C38]<>"");"";"ERR");"") -> 
B39: of:=IF( ISBLANK([$'03.Muestra'.$C$28]);"";[$'03.Muestra'.$C$28]) ->  | C39: of:=IF( ISBLANK([$'03.Muestra'.$E$28]);"";[$'03.Muestra'.$E$28]) ->  | D39: of:=IF(AND([.B39]<>"";[.C39]<>"");"N/T";"") ->  | E39: of:=IF([.D39]<>"";IF(AND([.B39]<>"";[.C39]<>"");"";"ERR");"") -> 
B40: of:=IF( ISBLANK([$'03.Muestra'.$C$29]);"";[$'03.Muestra'.$C$29]) ->  | C40: of:=IF( ISBLANK([$'03.Muestra'.$E$29]);"";[$'03.Muestra'.$E$29]) ->  | D40: of:=IF(AND([.B40]<>"";[.C40]<>"");"N/T";"") ->  | E40: of:=IF([.D40]<>"";IF(AND([.B40]<>"";[.C40]<>"");"";"ERR");"") -> 
B41: of:=IF( ISBLANK([$'03.Muestra'.$C$30]);"";[$'03.Muestra'.$C$30]) ->  | C41: of:=IF( ISBLANK([$'03.Muestra'.$E$30]);"";[$'03.Muestra'.$E$30]) ->  | D41: of:=IF(AND([.B41]<>"";[.C41]<>"");"N/T";"") ->  | E41: of:=IF([.D41]<>"";IF(AND([.B41]<>"";[.C41]<>"");"";"ERR");"") -> 
B42: of:=IF( ISBLANK([$'03.Muestra'.$C$31]);"";[$'03.Muestra'.$C$31]) ->  | C42: of:=IF( ISBLANK([$'03.Muestra'.$E$31]);"";[$'03.Muestra'.$E$31]) ->  | D42: of:=IF(AND([.B42]<>"";[.C42]<>"");"N/T";"") ->  | E42: of:=IF([.D42]<>"";IF(AND([.B42]<>"";[.C42]<>"");"";"ERR");"") -> 
B43: of:=IF( ISBLANK([$'03.Muestra'.$C$32]);"";[$'03.Muestra'.$C$32]) ->  | C43: of:=IF( ISBLANK([$'03.Muestra'.$E$32]);"";[$'03.Muestra'.$E$32]) ->  | D43: of:=IF(AND([.B43]<>"";[.C43]<>"");"N/T";"") ->  | E43: of:=IF([.D43]<>"";IF(AND([.B43]<>"";[.C43]<>"");"";"ERR");"") -> 
B44: of:=IF( ISBLANK([$'03.Muestra'.$C$33]);"";[$'03.Muestra'.$C$33]) ->  | C44: of:=IF( ISBLANK([$'03.Muestra'.$E$33]);"";[$'03.Muestra'.$E$33]) ->  | D44: of:=IF(AND([.B44]<>"";[.C44]<>"");"N/T";"") ->  | E44: of:=IF([.D44]<>"";IF(AND([.B44]<>"";[.C44]<>"");"";"ERR");"") -> 
B45: of:=IF( ISBLANK([$'03.Muestra'.$C$34]);"";[$'03.Muestra'.$C$34]) ->  | C45: of:=IF( ISBLANK([$'03.Muestra'.$E$34]);"";[$'03.Muestra'.$E$34]) ->  | D45: of:=IF(AND([.B45]<>"";[.C45]<>"");"N/T";"") ->  | E45: of:=IF([.D45]<>"";IF(AND([.B45]<>"";[.C45]<>"");"";"ERR");"") -> 
B46: of:=IF( ISBLANK([$'03.Muestra'.$C$35]);"";[$'03.Muestra'.$C$35]) ->  | C46: of:=IF( ISBLANK([$'03.Muestra'.$E$35]);"";[$'03.Muestra'.$E$35]) ->  | D46: of:=IF(AND([.B46]<>"";[.C46]<>"");"N/T";"") ->  | E46: of:=IF([.D46]<>"";IF(AND([.B46]<>"";[.C46]<>"");"";"ERR");"") -> 
B47: of:=IF( ISBLANK([$'03.Muestra'.$C$36]);"";[$'03.Muestra'.$C$36]) ->  | C47: of:=IF( ISBLANK([$'03.Muestra'.$E$36]);"";[$'03.Muestra'.$E$36]) ->  | D47: of:=IF(AND([.B47]<>"";[.C47]<>"");"N/T";"") ->  | E47: of:=IF([.D47]<>"";IF(AND([.B47]<>"";[.C47]<>"");"";"ERR");"") -> 
B48: of:=IF( ISBLANK([$'03.Muestra'.$C$37]);"";[$'03.Muestra'.$C$37]) ->  | C48: of:=IF( ISBLANK([$'03.Muestra'.$E$37]);"";[$'03.Muestra'.$E$37]) ->  | D48: of:=IF(AND([.B48]<>"";[.C48]<>"");"N/T";"") ->  | E48: of:=IF([.D48]<>"";IF(AND([.B48]<>"";[.C48]<>"");"";"ERR");"") -> 
B51: A | C51: 4.1.2 Nombre, funciÃ³n, valor | D51: Resultado
B52: of:=IF( ISBLANK([$'03.Muestra'.$C$8]);"";[$'03.Muestra'.$C$8]) ->  | C52: of:=IF( ISBLANK([$'03.Muestra'.$E$8]);"";[$'03.Muestra'.$E$8]) ->  | D52: of:=IF(AND([.B52]<>"";[.C52]<>"");"N/T";"") ->  | E52: of:=IF([.D52]<>"";IF(AND([.B52]<>"";[.C52]<>"");"";"ERR");"") ->  | F52: of:=TRANSPOSE([$'DATA - Oculta'.$U$9:$'DATA - Oculta'.$U$13]) -> N/T | G52: N/D | H52: N/A | I52: Falla | J52: Pasa | K52: En blanco
B53: of:=IF( ISBLANK([$'03.Muestra'.$C$9]);"";[$'03.Muestra'.$C$9]) ->  | C53: of:=IF( ISBLANK([$'03.Muestra'.$E$9]);"";[$'03.Muestra'.$E$9]) ->  | D53: of:=IF(AND([.B53]<>"";[.C53]<>"");"N/T";"") ->  | E53: of:=IF([.D53]<>"";IF(AND([.B53]<>"";[.C53]<>"");"";"ERR");"") ->  | F53: of:=COUNTIF([.$D52]:INDIRECT("$D" &  SUM(ROW()-1;[$'03.Muestra'.$D$40])-1);[.F52]) -> 0 | G53: of:=COUNTIF([.$D52]:INDIRECT("$D" &  SUM(ROW()-1;[$'03.Muestra'.$D$40])-1);[.G52]) -> 0 | H53: of:=COUNTIF([.$D52]:INDIRECT("$D" &  SUM(ROW()-1;[$'03.Muestra'.$D$40])-1);[.H52]) -> 0 | I53: of:=COUNTIF([.$D52]:INDIRECT("$D" &  SUM(ROW()-1;[$'03.Muestra'.$D$40])-1);[.I52]) -> 0 | J53: of:=COUNTIF([.$D52]:INDIRECT("$D" &  SUM(ROW()-1;[$'03.Muestra'.$D$40])-1);[.J52]) -> 0 | K53: of:=IF([$'03.Muestra'.$D$40]=0;0;COUNTBLANK([.$D52]:INDIRECT("$D" &  SUM(ROW()-1;[$'03.Muestra'.$D$40])-1))) -> 0
B54: of:=IF( ISBLANK([$'03.Muestra'.$C$10]);"";[$'03.Muestra'.$C$10]) ->  | C54: of:=IF( ISBLANK([$'03.Muestra'.$E$10]);"";[$'03.Muestra'.$E$10]) ->  | D54: of:=IF(AND([.B54]<>"";[.C54]<>"");"N/T";"") ->  | E54: of:=IF([.D54]<>"";IF(AND([.B54]<>"";[.C54]<>"");"";"ERR");"") -> 
B55: of:=IF( ISBLANK([$'03.Muestra'.$C$11]);"";[$'03.Muestra'.$C$11]) ->  | C55: of:=IF( ISBLANK([$'03.Muestra'.$E$11]);"";[$'03.Muestra'.$E$11]) ->  | D55: of:=IF(AND([.B55]<>"";[.C55]<>"");"N/T";"") ->  | E55: of:=IF([.D55]<>"";IF(AND([.B55]<>"";[.C55]<>"");"";"ERR");"") -> 
B56: of:=IF( ISBLANK([$'03.Muestra'.$C$12]);"";[$'03.Muestra'.$C$12]) ->  | C56: of:=IF( ISBLANK([$'03.Muestra'.$E$12]);"";[$'03.Muestra'.$E$12]) ->  | D56: of:=IF(AND([.B56]<>"";[.C56]<>"");"N/T";"") ->  | E56: of:=IF([.D56]<>"";IF(AND([.B56]<>"";[.C56]<>"");"";"ERR");"") -> 
B57: of:=IF( ISBLANK([$'03.Muestra'.$C$13]);"";[$'03.Muestra'.$C$13]) ->  | C57: of:=IF( ISBLANK([$'03.Muestra'.$E$13]);"";[$'03.Muestra'.$E$13]) ->  | D57: of:=IF(AND([.B57]<>"";[.C57]<>"");"N/T";"") ->  | E57: of:=IF([.D57]<>"";IF(AND([.B57]<>"";[.C57]<>"");"";"ERR");"") -> 
B58: of:=IF( ISBLANK([$'03.Muestra'.$C$14]);"";[$'03.Muestra'.$C$14]) ->  | C58: of:=IF( ISBLANK([$'03.Muestra'.$E$14]);"";[$'03.Muestra'.$E$14]) ->  | D58: of:=IF(AND([.B58]<>"";[.C58]<>"");"N/T";"") ->  | E58: of:=IF([.D58]<>"";IF(AND([.B58]<>"";[.C58]<>"");"";"ERR");"") -> 
B59: of:=IF( ISBLANK([$'03.Muestra'.$C$15]);"";[$'03.Muestra'.$C$15]) ->  | C59: of:=IF( ISBLANK([$'03.Muestra'.$E$15]);"";[$'03.Muestra'.$E$15]) ->  | D59: of:=IF(AND([.B59]<>"";[.C59]<>"");"N/T";"") ->  | E59: of:=IF([.D59]<>"";IF(AND([.B59]<>"";[.C59]<>"");"";"ERR");"") -> 
B60: of:=IF( ISBLANK([$'03.Muestra'.$C$16]);"";[$'03.Muestra'.$C$16]) ->  | C60: of:=IF( ISBLANK([$'03.Muestra'.$E$16]);"";[$'03.Muestra'.$E$16]) ->  | D60: of:=IF(AND([.B60]<>"";[.C60]<>"");"N/T";"") ->  | E60: of:=IF([.D60]<>"";IF(AND([.B60]<>"";[.C60]<>"");"";"ERR");"") -> 
B61: of:=IF( ISBLANK([$'03.Muestra'.$C$17]);"";[$'03.Muestra'.$C$17]) ->  | C61: of:=IF( ISBLANK([$'03.Muestra'.$E$17]);"";[$'03.Muestra'.$E$17]) ->  | D61: of:=IF(AND([.B61]<>"";[.C61]<>"");"N/T";"") ->  | E61: of:=IF([.D61]<>"";IF(AND([.B61]<>"";[.C61]<>"");"";"ERR");"") -> 
B62: of:=IF( ISBLANK([$'03.Muestra'.$C$18]);"";[$'03.Muestra'.$C$18]) ->  | C62: of:=IF( ISBLANK([$'03.Muestra'.$E$18]);"";[$'03.Muestra'.$E$18]) ->  | D62: of:=IF(AND([.B62]<>"";[.C62]<>"");"N/T";"") ->  | E62: of:=IF([.D62]<>"";IF(AND([.B62]<>"";[.C62]<>"");"";"ERR");"") -> 
B63: of:=IF( ISBLANK([$'03.Muestra'.$C$19]);"";[$'03.Muestra'.$C$19]) ->  | C63: of:=IF( ISBLANK([$'03.Muestra'.$E$19]);"";[$'03.Muestra'.$E$19]) ->  | D63: of:=IF(AND([.B63]<>"";[.C63]<>"");"N/T";"") ->  | E63: of:=IF([.D63]<>"";IF(AND([.B63]<>"";[.C63]<>"");"";"ERR");"") -> 
B64: of:=IF( ISBLANK([$'03.Muestra'.$C$20]);"";[$'03.Muestra'.$C$20]) ->  | C64: of:=IF( ISBLANK([$'03.Muestra'.$E$20]);"";[$'03.Muestra'.$E$20]) ->  | D64: of:=IF(AND([.B64]<>"";[.C64]<>"");"N/T";"") ->  | E64: of:=IF([.D64]<>"";IF(AND([.B64]<>"";[.C64]<>"");"";"ERR");"") -> 
B65: of:=IF( ISBLANK([$'03.Muestra'.$C$21]);"";[$'03.Muestra'.$C$21]) ->  | C65: of:=IF( ISBLANK([$'03.Muestra'.$E$21]);"";[$'03.Muestra'.$E$21]) ->  | D65: of:=IF(AND([.B65]<>"";[.C65]<>"");"N/T";"") ->  | E65: of:=IF([.D65]<>"";IF(AND([.B65]<>"";[.C65]<>"");"";"ERR");"") -> 
B66: of:=IF( ISBLANK([$'03.Muestra'.$C$22]);"";[$'03.Muestra'.$C$22]) ->  | C66: of:=IF( ISBLANK([$'03.Muestra'.$E$22]);"";[$'03.Muestra'.$E$22]) ->  | D66: of:=IF(AND([.B66]<>"";[.C66]<>"");"N/T";"") ->  | E66: of:=IF([.D66]<>"";IF(AND([.B66]<>"";[.C66]<>"");"";"ERR");"") -> 
B67: of:=IF( ISBLANK([$'03.Muestra'.$C$23]);"";[$'03.Muestra'.$C$23]) ->  | C67: of:=IF( ISBLANK([$'03.Muestra'.$E$23]);"";[$'03.Muestra'.$E$23]) ->  | D67: of:=IF(AND([.B67]<>"";[.C67]<>"");"N/T";"") ->  | E67: of:=IF([.D67]<>"";IF(AND([.B67]<>"";[.C67]<>"");"";"ERR");"") -> 
B68: of:=IF( ISBLANK([$'03.Muestra'.$C$24]);"";[$'03.Muestra'.$C$24]) ->  | C68: of:=IF( ISBLANK([$'03.Muestra'.$E$24]);"";[$'03.Muestra'.$E$24]) ->  | D68: of:=IF(AND([.B68]<>"";[.C68]<>"");"N/T";"") ->  | E68: of:=IF([.D68]<>"";IF(AND([.B68]<>"";[.C68]<>"");"";"ERR");"") -> 
B69: of:=IF( ISBLANK([$'03.Muestra'.$C$25]);"";[$'03.Muestra'.$C$25]) ->  | C69: of:=IF( ISBLANK([$'03.Muestra'.$E$25]);"";[$'03.Muestra'.$E$25]) ->  | D69: of:=IF(AND([.B69]<>"";[.C69]<>"");"N/T";"") ->  | E69: of:=IF([.D69]<>"";IF(AND([.B69]<>"";[.C69]<>"");"";"ERR");"") -> 
B70: of:=IF( ISBLANK([$'03.Muestra'.$C$26]);"";[$'03.Muestra'.$C$26]) ->  | C70: of:=IF( ISBLANK([$'03.Muestra'.$E$26]);"";[$'03.Muestra'.$E$26]) ->  | D70: of:=IF(AND([.B70]<>"";[.C70]<>"");"N/T";"") ->  | E70: of:=IF([.D70]<>"";IF(AND([.B70]<>"";[.C70]<>"");"";"ERR");"") -> 
B71: of:=IF( ISBLANK([$'03.Muestra'.$C$27]);"";[$'03.Muestra'.$C$27]) ->  | C71: of:=IF( ISBLANK([$'03.Muestra'.$E$27]);"";[$'03.Muestra'.$E$27]) ->  | D71: of:=IF(AND([.B71]<>"";[.C71]<>"");"N/T";"") ->  | E71: of:=IF([.D71]<>"";IF(AND([.B71]<>"";[.C71]<>"");"";"ERR");"") -> 
B72: of:=IF( ISBLANK([$'03.Muestra'.$C$28]);"";[$'03.Muestra'.$C$28]) ->  | C72: of:=IF( ISBLANK([$'03.Muestra'.$E$28]);"";[$'03.Muestra'.$E$28]) ->  | D72: of:=IF(AND([.B72]<>"";[.C72]<>"");"N/T";"") ->  | E72: of:=IF([.D72]<>"";IF(AND([.B72]<>"";[.C72]<>"");"";"ERR");"") -> 
B73: of:=IF( ISBLANK([$'03.Muestra'.$C$29]);"";[$'03.Muestra'.$C$29]) ->  | C73: of:=IF( ISBLANK([$'03.Muestra'.$E$29]);"";[$'03.Muestra'.$E$29]) ->  | D73: of:=IF(AND([.B73]<>"";[.C73]<>"");"N/T";"") ->  | E73: of:=IF([.D73]<>"";IF(AND([.B73]<>"";[.C73]<>"");"";"ERR");"") -> 
B74: of:=IF( ISBLANK([$'03.Muestra'.$C$30]);"";[$'03.Muestra'.$C$30]) ->  | C74: of:=IF( ISBLANK([$'03.Muestra'.$E$30]);"";[$'03.Muestra'.$E$30]) ->  | D74: of:=IF(AND([.B74]<>"";[.C74]<>"");"N/T";"") ->  | E74: of:=IF([.D74]<>"";IF(AND([.B74]<>"";[.C74]<>"");"";"ERR");"") -> 
B75: of:=IF( ISBLANK([$'03.Muestra'.$C$31]);"";[$'03.Muestra'.$C$31]) ->  | C75: of:=IF( ISBLANK([$'03.Muestra'.$E$31]);"";[$'03.Muestra'.$E$31]) ->  | D75: of:=IF(AND([.B75]<>"";[.C75]<>"");"N/T";"") ->  | E75: of:=IF([.D75]<>"";IF(AND([.B75]<>"";[.C75]<>"");"";"ERR");"") -> 
B76: of:=IF( ISBLANK([$'03.Muestra'.$C$32]);"";[$'03.Muestra'.$C$32]) ->  | C76: of:=IF( ISBLANK([$'03.Muestra'.$E$32]);"";[$'03.Muestra'.$E$32]) ->  | D76: of:=IF(AND([.B76]<>"";[.C76]<>"");"N/T";"") ->  | E76: of:=IF([.D76]<>"";IF(AND([.B76]<>"";[.C76]<>"");"";"ERR");"") -> 
B77: of:=IF( ISBLANK([$'03.Muestra'.$C$33]);"";[$'03.Muestra'.$C$33]) ->  | C77: of:=IF( ISBLANK([$'03.Muestra'.$E$33]);"";[$'03.Muestra'.$E$33]) ->  | D77: of:=IF(AND([.B77]<>"";[.C77]<>"");"N/T";"") ->  | E77: of:=IF([.D77]<>"";IF(AND([.B77]<>"";[.C77]<>"");"";"ERR");"") -> 
B78: of:=IF( ISBLANK([$'03.Muestra'.$C$34]);"";[$'03.Muestra'.$C$34]) ->  | C78: of:=IF( ISBLANK([$'03.Muestra'.$E$34]);"";[$'03.Muestra'.$E$34]) ->  | D78: of:=IF(AND([.B78]<>"";[.C78]<>"");"N/T";"") ->  | E78: of:=IF([.D78]<>"";IF(AND([.B78]<>"";[.C78]<>"");"";"ERR");"") -> 
B79: of:=IF( ISBLANK([$'03.Muestra'.$C$35]);"";[$'03.Muestra'.$C$35]) ->  | C79: of:=IF( ISBLANK([$'03.Muestra'.$E$35]);"";[$'03.Muestra'.$E$35]) ->  | D79: of:=IF(AND([.B79]<>"";[.C79]<>"");"N/T";"") ->  | E79: of:=IF([.D79]<>"";IF(AND([.B79]<>"";[.C79]<>"");"";"ERR");"") -> 
B80: of:=IF( ISBLANK([$'03.Muestra'.$C$36]);"";[$'03.Muestra'.$C$36]) ->  | C80: of:=IF( ISBLANK([$'03.Muestra'.$E$36]);"";[$'03.Muestra'.$E$36]) ->  | D80: of:=IF(AND([.B80]<>"";[.C80]<>"");"N/T";"") ->  | E80: of:=IF([.D80]<>"";IF(AND([.B80]<>"";[.C80]<>"");"";"ERR");"") -> 
B81: of:=IF( ISBLANK([$'03.Muestra'.$C$37]);"";[$'03.Muestra'.$C$37]) ->  | C81: of:=IF( ISBLANK([$'03.Muestra'.$E$37]);"";[$'03.Muestra'.$E$37]) ->  | D81: of:=IF(AND([.B81]<>"";[.C81]<>"");"N/T";"") ->  | E81: of:=IF([.D81]<>"";IF(AND([.B81]<>"";[.C81]<>"");"";"ERR");"") -> 
B84: AA | C84: 4.1.3 Mensajes de estado | D84: Resultado
B85: of:=IF( ISBLANK([$'03.Muestra'.$C$8]);"";[$'03.Muestra'.$C$8]) ->  | C85: of:=IF( ISBLANK([$'03.Muestra'.$E$8]);"";[$'03.Muestra'.$E$8]) ->  | D85: of:=IF(AND([.B85]<>"";[.C85]<>"");"N/T";"") ->  | E85: of:=IF([.D85]<>"";IF(AND([.B85]<>"";[.C85]<>"");"";"ERR");"") ->  | F85: of:=TRANSPOSE([$'DATA - Oculta'.$U$9:$'DATA - Oculta'.$U$13]) -> N/T | G85: N/D | H85: N/A | I85: Falla | J85: Pasa | K85: En blanco
B86: of:=IF( ISBLANK([$'03.Muestra'.$C$9]);"";[$'03.Muestra'.$C$9]) ->  | C86: of:=IF( ISBLANK([$'03.Muestra'.$E$9]);"";[$'03.Muestra'.$E$9]) ->  | D86: of:=IF(AND([.B86]<>"";[.C86]<>"");"N/T";"") ->  | E86: of:=IF([.D86]<>"";IF(AND([.B86]<>"";[.C86]<>"");"";"ERR");"") ->  | F86: of:=COUNTIF([.$D85]:INDIRECT("$D" &  SUM(ROW()-1;[$'03.Muestra'.$D$40])-1);[.F85]) -> 0 | G86: of:=COUNTIF([.$D85]:INDIRECT("$D" &  SUM(ROW()-1;[$'03.Muestra'.$D$40])-1);[.G85]) -> 0 | H86: of:=COUNTIF([.$D85]:INDIRECT("$D" &  SUM(ROW()-1;[$'03.Muestra'.$D$40])-1);[.H85]) -> 0 | I86: of:=COUNTIF([.$D85]:INDIRECT("$D" &  SUM(ROW()-1;[$'03.Muestra'.$D$40])-1);[.I85]) -> 0 | J86: of:=COUNTIF([.$D85]:INDIRECT("$D" &  SUM(ROW()-1;[$'03.Muestra'.$D$40])-1);[.J85]) -> 0 | K86: of:=IF([$'03.Muestra'.$D$40]=0;0;COUNTBLANK([.$D85]:INDIRECT("$D" &  SUM(ROW()-1;[$'03.Muestra'.$D$40])-1))) -> 0
B87: of:=IF( ISBLANK([$'03.Muestra'.$C$10]);"";[$'03.Muestra'.$C$10]) ->  | C87: of:=IF( ISBLANK([$'03.Muestra'.$E$10]);"";[$'03.Muestra'.$E$10]) ->  | D87: of:=IF(AND([.B87]<>"";[.C87]<>"");"N/T";"") ->  | E87: of:=IF([.D87]<>"";IF(AND([.B87]<>"";[.C87]<>"");"";"ERR");"") -> 
B88: of:=IF( ISBLANK([$'03.Muestra'.$C$11]);"";[$'03.Muestra'.$C$11]) ->  | C88: of:=IF( ISBLANK([$'03.Muestra'.$E$11]);"";[$'03.Muestra'.$E$11]) ->  | D88: of:=IF(AND([.B88]<>"";[.C88]<>"");"N/T";"") ->  | E88: of:=IF([.D88]<>"";IF(AND([.B88]<>"";[.C88]<>"");"";"ERR");"") -> 
B89: of:=IF( ISBLANK([$'03.Muestra'.$C$12]);"";[$'03.Muestra'.$C$12]) ->  | C89: of:=IF( ISBLANK([$'03.Muestra'.$E$12]);"";[$'03.Muestra'.$E$12]) ->  | D89: of:=IF(AND([.B89]<>"";[.C89]<>"");"N/T";"") ->  | E89: of:=IF([.D89]<>"";IF(AND([.B89]<>"";[.C89]<>"");"";"ERR");"") -> 
B90: of:=IF( ISBLANK([$'03.Muestra'.$C$13]);"";[$'03.Muestra'.$C$13]) ->  | C90: of:=IF( ISBLANK([$'03.Muestra'.$E$13]);"";[$'03.Muestra'.$E$13]) ->  | D90: of:=IF(AND([.B90]<>"";[.C90]<>"");"N/T";"") ->  | E90: of:=IF([.D90]<>"";IF(AND([.B90]<>"";[.C90]<>"");"";"ERR");"") -> 
B91: of:=IF( ISBLANK([$'03.Muestra'.$C$14]);"";[$'03.Muestra'.$C$14]) ->  | C91: of:=IF( ISBLANK([$'03.Muestra'.$E$14]);"";[$'03.Muestra'.$E$14]) ->  | D91: of:=IF(AND([.B91]<>"";[.C91]<>"");"N/T";"") ->  | E91: of:=IF([.D91]<>"";IF(AND([.B91]<>"";[.C91]<>"");"";"ERR");"") -> 
B92: of:=IF( ISBLANK([$'03.Muestra'.$C$15]);"";[$'03.Muestra'.$C$15]) ->  | C92: of:=IF( ISBLANK([$'03.Muestra'.$E$15]);"";[$'03.Muestra'.$E$15]) ->  | D92: of:=IF(AND([.B92]<>"";[.C92]<>"");"N/T";"") ->  | E92: of:=IF([.D92]<>"";IF(AND([.B92]<>"";[.C92]<>"");"";"ERR");"") -> 
B93: of:=IF( ISBLANK([$'03.Muestra'.$C$16]);"";[$'03.Muestra'.$C$16]) ->  | C93: of:=IF( ISBLANK([$'03.Muestra'.$E$16]);"";[$'03.Muestra'.$E$16]) ->  | D93: of:=IF(AND([.B93]<>"";[.C93]<>"");"N/T";"") ->  | E93: of:=IF([.D93]<>"";IF(AND([.B93]<>"";[.C93]<>"");"";"ERR");"") -> 
B94: of:=IF( ISBLANK([$'03.Muestra'.$C$17]);"";[$'03.Muestra'.$C$17]) ->  | C94: of:=IF( ISBLANK([$'03.Muestra'.$E$17]);"";[$'03.Muestra'.$E$17]) ->  | D94: of:=IF(AND([.B94]<>"";[.C94]<>"");"N/T";"") ->  | E94: of:=IF([.D94]<>"";IF(AND([.B94]<>"";[.C94]<>"");"";"ERR");"") -> 
B95: of:=IF( ISBLANK([$'03.Muestra'.$C$18]);"";[$'03.Muestra'.$C$18]) ->  | C95: of:=IF( ISBLANK([$'03.Muestra'.$E$18]);"";[$'03.Muestra'.$E$18]) ->  | D95: of:=IF(AND([.B95]<>"";[.C95]<>"");"N/T";"") ->  | E95: of:=IF([.D95]<>"";IF(AND([.B95]<>"";[.C95]<>"");"";"ERR");"") -> 
B96: of:=IF( ISBLANK([$'03.Muestra'.$C$19]);"";[$'03.Muestra'.$C$19]) ->  | C96: of:=IF( ISBLANK([$'03.Muestra'.$E$19]);"";[$'03.Muestra'.$E$19]) ->  | D96: of:=IF(AND([.B96]<>"";[.C96]<>"");"N/T";"") ->  | E96: of:=IF([.D96]<>"";IF(AND([.B96]<>"";[.C96]<>"");"";"ERR");"") -> 
B97: of:=IF( ISBLANK([$'03.Muestra'.$C$20]);"";[$'03.Muestra'.$C$20]) ->  | C97: of:=IF( ISBLANK([$'03.Muestra'.$E$20]);"";[$'03.Muestra'.$E$20]) ->  | D97: of:=IF(AND([.B97]<>"";[.C97]<>"");"N/T";"") ->  | E97: of:=IF([.D97]<>"";IF(AND([.B97]<>"";[.C97]<>"");"";"ERR");"") -> 
B98: of:=IF( ISBLANK([$'03.Muestra'.$C$21]);"";[$'03.Muestra'.$C$21]) ->  | C98: of:=IF( ISBLANK([$'03.Muestra'.$E$21]);"";[$'03.Muestra'.$E$21]) ->  | D98: of:=IF(AND([.B98]<>"";[.C98]<>"");"N/T";"") ->  | E98: of:=IF([.D98]<>"";IF(AND([.B98]<>"";[.C98]<>"");"";"ERR");"") -> 
B99: of:=IF( ISBLANK([$'03.Muestra'.$C$22]);"";[$'03.Muestra'.$C$22]) ->  | C99: of:=IF( ISBLANK([$'03.Muestra'.$E$22]);"";[$'03.Muestra'.$E$22]) ->  | D99: of:=IF(AND([.B99]<>"";[.C99]<>"");"N/T";"") ->  | E99: of:=IF([.D99]<>"";IF(AND([.B99]<>"";[.C99]<>"");"";"ERR");"") -> 
B100: of:=IF( ISBLANK([$'03.Muestra'.$C$23]);"";[$'03.Muestra'.$C$23]) ->  | C100: of:=IF( ISBLANK([$'03.Muestra'.$E$23]);"";[$'03.Muestra'.$E$23]) ->  | D100: of:=IF(AND([.B100]<>"";[.C100]<>"");"N/T";"") ->  | E100: of:=IF([.D100]<>"";IF(AND([.B100]<>"";[.C100]<>"");"";"ERR");"") -> 
B101: of:=IF( ISBLANK([$'03.Muestra'.$C$24]);"";[$'03.Muestra'.$C$24]) ->  | C101: of:=IF( ISBLANK([$'03.Muestra'.$E$24]);"";[$'03.Muestra'.$E$24]) ->  | D101: of:=IF(AND([.B101]<>"";[.C101]<>"");"N/T";"") ->  | E101: of:=IF([.D101]<>"";IF(AND([.B101]<>"";[.C101]<>"");"";"ERR");"") -> 
B102: of:=IF( ISBLANK([$'03.Muestra'.$C$25]);"";[$'03.Muestra'.$C$25]) ->  | C102: of:=IF( ISBLANK([$'03.Muestra'.$E$25]);"";[$'03.Muestra'.$E$25]) ->  | D102: of:=IF(AND([.B102]<>"";[.C102]<>"");"N/T";"") ->  | E102: of:=IF([.D102]<>"";IF(AND([.B102]<>"";[.C102]<>"");"";"ERR");"") -> 
B103: of:=IF( ISBLANK([$'03.Muestra'.$C$26]);"";[$'03.Muestra'.$C$26]) ->  | C103: of:=IF( ISBLANK([$'03.Muestra'.$E$26]);"";[$'03.Muestra'.$E$26]) ->  | D103: of:=IF(AND([.B103]<>"";[.C103]<>"");"N/T";"") ->  | E103: of:=IF([.D103]<>"";IF(AND([.B103]<>"";[.C103]<>"");"";"ERR");"") -> 
B104: of:=IF( ISBLANK([$'03.Muestra'.$C$27]);"";[$'03.Muestra'.$C$27]) ->  | C104: of:=IF( ISBLANK([$'03.Muestra'.$E$27]);"";[$'03.Muestra'.$E$27]) ->  | D104: of:=IF(AND([.B104]<>"";[.C104]<>"");"N/T";"") ->  | E104: of:=IF([.D104]<>"";IF(AND([.B104]<>"";[.C104]<>"");"";"ERR");"") -> 
B105: of:=IF( ISBLANK([$'03.Muestra'.$C$28]);"";[$'03.Muestra'.$C$28]) ->  | C105: of:=IF( ISBLANK([$'03.Muestra'.$E$28]);"";[$'03.Muestra'.$E$28]) ->  | D105: of:=IF(AND([.B105]<>"";[.C105]<>"");"N/T";"") ->  | E105: of:=IF([.D105]<>"";IF(AND([.B105]<>"";[.C105]<>"");"";"ERR");"") -> 
B106: of:=IF( ISBLANK([$'03.Muestra'.$C$29]);"";[$'03.Muestra'.$C$29]) ->  | C106: of:=IF( ISBLANK([$'03.Muestra'.$E$29]);"";[$'03.Muestra'.$E$29]) ->  | D106: of:=IF(AND([.B106]<>"";[.C106]<>"");"N/T";"") ->  | E106: of:=IF([.D106]<>"";IF(AND([.B106]<>"";[.C106]<>"");"";"ERR");"") -> 
B107: of:=IF( ISBLANK([$'03.Muestra'.$C$30]);"";[$'03.Muestra'.$C$30]) ->  | C107: of:=IF( ISBLANK([$'03.Muestra'.$E$30]);"";[$'03.Muestra'.$E$30]) ->  | D107: of:=IF(AND([.B107]<>"";[.C107]<>"");"N/T";"") ->  | E107: of:=IF([.D107]<>"";IF(AND([.B107]<>"";[.C107]<>"");"";"ERR");"") -> 
B108: of:=IF( ISBLANK([$'03.Muestra'.$C$31]);"";[$'03.Muestra'.$C$31]) ->  | C108: of:=IF( ISBLANK([$'03.Muestra'.$E$31]);"";[$'03.Muestra'.$E$31]) ->  | D108: of:=IF(AND([.B108]<>"";[.C108]<>"");"N/T";"") ->  | E108: of:=IF([.D108]<>"";IF(AND([.B108]<>"";[.C108]<>"");"";"ERR");"") -> 
B109: of:=IF( ISBLANK([$'03.Muestra'.$C$32]);"";[$'03.Muestra'.$C$32]) ->  | C109: of:=IF( ISBLANK([$'03.Muestra'.$E$32]);"";[$'03.Muestra'.$E$32]) ->  | D109: of:=IF(AND([.B109]<>"";[.C109]<>"");"N/T";"") ->  | E109: of:=IF([.D109]<>"";IF(AND([.B109]<>"";[.C109]<>"");"";"ERR");"") -> 
B110: of:=IF( ISBLANK([$'03.Muestra'.$C$33]);"";[$'03.Muestra'.$C$33]) ->  | C110: of:=IF( ISBLANK([$'03.Muestra'.$E$33]);"";[$'03.Muestra'.$E$33]) ->  | D110: of:=IF(AND([.B110]<>"";[.C110]<>"");"N/T";"") ->  | E110: of:=IF([.D110]<>"";IF(AND([.B110]<>"";[.C110]<>"");"";"ERR");"") -> 
B111: of:=IF( ISBLANK([$'03.Muestra'.$C$34]);"";[$'03.Muestra'.$C$34]) ->  | C111: of:=IF( ISBLANK([$'03.Muestra'.$E$34]);"";[$'03.Muestra'.$E$34]) ->  | D111: of:=IF(AND([.B111]<>"";[.C111]<>"");"N/T";"") ->  | E111: of:=IF([.D111]<>"";IF(AND([.B111]<>"";[.C111]<>"");"";"ERR");"") -> 
B112: of:=IF( ISBLANK([$'03.Muestra'.$C$35]);"";[$'03.Muestra'.$C$35]) ->  | C112: of:=IF( ISBLANK([$'03.Muestra'.$E$35]);"";[$'03.Muestra'.$E$35]) ->  | D112: of:=IF(AND([.B112]<>"";[.C112]<>"");"N/T";"") ->  | E112: of:=IF([.D112]<>"";IF(AND([.B112]<>"";[.C112]<>"");"";"ERR");"") -> 
B113: of:=IF( ISBLANK([$'03.Muestra'.$C$36]);"";[$'03.Muestra'.$C$36]) ->  | C113: of:=IF( ISBLANK([$'03.Muestra'.$E$36]);"";[$'03.Muestra'.$E$36]) ->  | D113: of:=IF(AND([.B113]<>"";[.C113]<>"");"N/T";"") ->  | E113: of:=IF([.D113]<>"";IF(AND([.B113]<>"";[.C113]<>"");"";"ERR");"") -> 
B114: of:=IF( ISBLANK([$'03.Muestra'.$C$37]);"";[$'03.Muestra'.$C$37]) ->  | C114: of:=IF( ISBLANK([$'03.Muestra'.$E$37]);"";[$'03.Muestra'.$E$37]) ->  | D114: of:=IF(AND([.B114]<>"";[.C114]<>"");"N/T";"") ->  | E114: of:=IF([.D114]<>"";IF(AND([.B114]<>"";[.C114]<>"");"";"ERR");"") -> 

Sheet: RESULTADOS
B2: Informe de revisiÃ³n de la accesibilidad
B3: AnÃ¡lisis de accesibilidad en profundidad
B5: Resultados agregados
J6: EVALUADO | N6: PENDIENTE DE EVALUAR
B7: Criterios de VerificaciÃ³n | D7: Conforme | E7: No conforme | F7: No aplica | G7: Error | H7: En Curso | J7: EvaluaciÃ³n | K7: N.Âº Criterios x N.Âº PÃ¡ginas | L7: % | N7: EvaluaciÃ³n | O7: N.Âº Criterios x N.Âº PÃ¡ginas | P7: %
B8: A | D8: of:=COUNTIF([.D50:.AG50];"CONFORME") -> 0 | E8: of:=COUNTIF([.D50:.AG50];"NO CONFORME") -> 0 | F8: of:=COUNTIF([.D50:.AG50];"N/A") -> 30 | G8: of:=COUNTIF([.D50:.AG50];"ERROR") -> 0 | H8: of:=COUNTIF([.D50:.AG50];"EN CURSO") -> 0 | J8: Pasa | K8: of:=COUNTIF( [.$D$20]:INDIRECT("$AG$" &  SUM(20;[$'03.Muestra'.$D$40]));"Pasa")+ COUNTIF([.$D$56]:INDIRECT("$W$" &  SUM(56;[$'03.Muestra'.$D$40]));"Pasa") -> 0 | L8: of:=IF(([.$K$11]+[.$O$11])=0;0;[.K8]/([.$K$11]+[.$O$11])) -> 0 | N8: No decide | O8: of:=COUNTIF( [.$D$20]:INDIRECT("$AG$" &  SUM(20;[$'03.Muestra'.$D$40]));"N/D")+ COUNTIF([.$D$56]:INDIRECT("$W$" &  SUM(56;[$'03.Muestra'.$D$40]));"N/D") -> 0 | P8: of:=IF(([.$K$11]+[.$O$11])=0;0;[.O8]/([.$K$11]+[.$O$11])) -> 0
B9: AA | D9: of:=COUNTIF([.D86:.W86];"CONFORME") -> 0 | E9: of:=COUNTIF([.D86:.W86];"NO CONFORME") -> 0 | F9: of:=COUNTIF([.D86:.W86];"N/A") -> 20 | G9: of:=COUNTIF([.D86:.W86];"ERROR") -> 0 | H9: of:=COUNTIF([.D86:.W86];"EN CURSO") -> 0 | J9: Falla | K9: of:=COUNTIF( [.$D$20]:INDIRECT("$AG$" &  SUM(20;[$'03.Muestra'.$D$40]));"Falla")+ COUNTIF([.$D$56]:INDIRECT("$W$" &  SUM(56;[$'03.Muestra'.$D$40]));"Falla") -> 0 | L9: of:=IF(([.$K$11]+[.$O$11])=0;0;[.K9]/([.$K$11]+[.$O$11])) -> 0 | N9: No testeado | O9: of:=COUNTIF( [.$D$20]:INDIRECT("$AG$" &  SUM(20;[$'03.Muestra'.$D$40]));"N/T")+ COUNTIF([.$D$56]:INDIRECT("$W$" &  SUM(56;[$'03.Muestra'.$D$40]));"N/T") -> 0 | P9: of:=IF(([.$K$11]+[.$O$11])=0;0;[.O9]/([.$K$11]+[.$O$11])) -> 0
B10: TOTAL | D10: of:=SUM([.D8:.D9]) -> 0 | E10: of:=SUM([.E8:.E9]) -> 0 | F10: of:=SUM([.F8:.F9]) -> 50 | G10: of:=SUM([.G8:.G9]) -> 0 | H10: of:=SUM([.H8:.H9]) -> 0 | J10: No aplica | K10: of:=COUNTIF( [.$D$20]:INDIRECT("$AG$" &  SUM(20;[$'03.Muestra'.$D$40]));"N/A")+ COUNTIF([.$D$56]:INDIRECT("$W$" &  SUM(56;[$'03.Muestra'.$D$40]));"N/A") -> 0 | L10: of:=IF(([.$K$11]+[.$O$11])=0;0;[.K10]/([.$K$11]+[.$O$11])) -> 0 | N10: En blanco | O10: of:=IF([$'03.Muestra'.$D$40]=0;0;SUM(COUNTBLANK([.$D$20]:INDIRECT("$AG$" &  SUM(20;[$'03.Muestra'.$D$40])-1));COUNTBLANK([.$D$56]:INDIRECT("$W$" &  SUM(56;[$'03.Muestra'.$D$40])-1)))) -> 0 | P10: of:=IF(([.$K$11]+[.$O$11])=0;0;[.O10]/([.$K$11]+[.$O$11])) -> 0
J11: TOTAL | K11: of:=SUM([.K8:.K10]) -> 0 | L11: of:=SUM([.L8:.L10]) -> 0 | N11: TOTAL | O11: of:=SUM([.O8:.O10]) -> 0 | P11: of:=SUM([.P8:.P10]) -> 0
C14: SituaciÃ³n de Cumplimiento
C15: of:=IF( [$'03.Muestra'.$D$40]=0;""; IF ([.G10]>0; "EvaluaciÃ³n con errores"; IF ([.H10] > 0; "EvaluaciÃ³n en curso"; IF ([.D10]>=(([.D10]+[.E10])*[$'DATA - Oculta'.$C$27]); "Plenamente Conforme"; IF ([.E10] >= (([.E10]+[.D10])*[$'DATA - Oculta'.$C$26]); "No Conforme"; "Parcialmente Conforme"))))) -> 
C18: A
C19: Muestra | D19: 1.1.1 | E19: 1.2.1 | F19: 1.2.2 | G19: 1.2.3 | H19: 1.3.1 | I19: 1.3.2 | J19: 1.3.3 | K19: 1.4.1 | L19: 1.4.2 | M19: 2.1.1 | N19: 2.1.2 | O19: 2.1.4 | P19: 2.2.1 | Q19: 2.2.2 | R19: 2.3.1 | S19: 2.4.1 | T19: 2.4.2 | U19: 2.4.3 | V19: 2.4.4 | W19: 2.5.1 | X19: 2.5.2 | Y19: 2.5.3 | Z19: 2.5.4 | AA19: 3.1.1 | AB19: 3.2.1 | AC19: 3.2.2 | AD19: 3.3.1 | AE19: 3.3.2 | AF19: 4.1.1 | AG19: 4.1.2
B20: of:=IF( ISBLANK([$'03.Muestra'.$C$8]);"";[$'03.Muestra'.$C$8]) ->  | C20: of:=IF( ISBLANK([$'03.Muestra'.$E$8]);"";[$'03.Muestra'.$E$8]) ->  | D20: of:=IF(ISBLANK([$'P1.Perceptible'.D19]);"";[$'P1.Perceptible'.D19]) ->  | E20: of:=IF(ISBLANK([$'P1.Perceptible'.D52]);"";[$'P1.Perceptible'.D52]) ->  | F20: of:=IF(ISBLANK([$'P1.Perceptible'.D85]);"";[$'P1.Perceptible'.D85]) ->  | G20: of:=IF(ISBLANK([$'P1.Perceptible'.D118]);"";[$'P1.Perceptible'.D118]) ->  | H20: of:=IF(ISBLANK([$'P1.Perceptible'.D217]);"";[$'P1.Perceptible'.D217]) ->  | I20: of:=IF(ISBLANK([$'P1.Perceptible'.D250]);"";[$'P1.Perceptible'.D250]) ->  | J20: of:=IF(ISBLANK([$'P1.Perceptible'.D283]);"";[$'P1.Perceptible'.D283]) ->  | K20: of:=IF(ISBLANK([$'P1.Perceptible'.D382]);"";[$'P1.Perceptible'.D382]) ->  | L20: of:=IF(ISBLANK([$'P1.Perceptible'.D415]);"";[$'P1.Perceptible'.D415]) ->  | M20: of:=IF(ISBLANK([$'P2.Operable'.D19]);"";[$'P2.Operable'.D19]) ->  | N20: of:=IF(ISBLANK([$'P2.Operable'.D52]);"";[$'P2.Operable'.D52]) ->  | O20: of:=IF(ISBLANK([$'P2.Operable'.D85]);"";[$'P2.Operable'.D85]) ->  | P20: of:=IF(ISBLANK([$'P2.Operable'.D118]);"";[$'P2.Operable'.D118]) ->  | Q20: of:=IF(ISBLANK([$'P2.Operable'.D151]);"";[$'P2.Operable'.D151]) ->  | R20: of:=IF(ISBLANK([$'P2.Operable'.D184]);"";[$'P2.Operable'.D184]) ->  | S20: of:=IF(ISBLANK([$'P2.Operable'.D217]);"";[$'P2.Operable'.D217]) ->  | T20: of:=IF(ISBLANK([$'P2.Operable'.D250]);"";[$'P2.Operable'.D250]) ->  | U20: of:=IF(ISBLANK([$'P2.Operable'.D283]);"";[$'P2.Operable'.D283]) ->  | V20: of:=IF(ISBLANK([$'P2.Operable'.D316]);"";[$'P2.Operable'.D316]) ->  | W20: of:=IF(ISBLANK([$'P2.Operable'.D448]);"";[$'P2.Operable'.D448]) ->  | X20: of:=IF(ISBLANK([$'P2.Operable'.D481]);"";[$'P2.Operable'.D481]) ->  | Y20: of:=IF(ISBLANK([$'P2.Operable'.D514]);"";[$'P2.Operable'.D514]) ->  | Z20: of:=IF(ISBLANK([$'P2.Operable'.D547]);"";[$'P2.Operable'.D547]) ->  | AA20: of:=IF(ISBLANK([$'P3.Comprensible'.D19]);"";[$'P3.Comprensible'.D19]) ->  | AB20: of:=IF(ISBLANK([$'P3.Comprensible'.D85]);"";[$'P3.Comprensible'.D85]) ->  | AC20: of:=IF(ISBLANK([$'P3.Comprensible'.D118]);"";[$'P3.Comprensible'.D118]) ->  | AD20: of:=IF(ISBLANK([$'P3.Comprensible'.D217]);"";[$'P3.Comprensible'.D217]) ->  | AE20: of:=IF(ISBLANK([$'P3.Comprensible'.D250]);"";[$'P3.Comprensible'.D250]) ->  | AF20: of:=IF(ISBLANK([$'P4.Robusto'.D19]);"";[$'P4.Robusto'.D19]) ->  | AG20: of:=IF(ISBLANK([$'P4.Robusto'.D52]);"";[$'P4.Robusto'.D52]) -> 
B21: of:=IF( ISBLANK([$'03.Muestra'.$C$9]);"";[$'03.Muestra'.$C$9]) ->  | C21: of:=IF( ISBLANK([$'03.Muestra'.$E$9]);"";[$'03.Muestra'.$E$9]) ->  | D21: of:=IF(ISBLANK([$'P1.Perceptible'.D20]);"";[$'P1.Perceptible'.D20]) ->  | E21: of:=IF(ISBLANK([$'P1.Perceptible'.D53]);"";[$'P1.Perceptible'.D53]) ->  | F21: of:=IF(ISBLANK([$'P1.Perceptible'.D86]);"";[$'P1.Perceptible'.D86]) ->  | G21: of:=IF(ISBLANK([$'P1.Perceptible'.D119]);"";[$'P1.Perceptible'.D119]) ->  | H21: of:=IF(ISBLANK([$'P1.Perceptible'.D218]);"";[$'P1.Perceptible'.D218]) ->  | I21: of:=IF(ISBLANK([$'P1.Perceptible'.D251]);"";[$'P1.Perceptible'.D251]) ->  | J21: of:=IF(ISBLANK([$'P1.Perceptible'.D284]);"";[$'P1.Perceptible'.D284]) ->  | K21: of:=IF(ISBLANK([$'P1.Perceptible'.D383]);"";[$'P1.Perceptible'.D383]) ->  | L21: of:=IF(ISBLANK([$'P1.Perceptible'.D416]);"";[$'P1.Perceptible'.D416]) ->  | M21: of:=IF(ISBLANK([$'P2.Operable'.D20]);"";[$'P2.Operable'.D20]) ->  | N21: of:=IF(ISBLANK([$'P2.Operable'.D53]);"";[$'P2.Operable'.D53]) ->  | O21: of:=IF(ISBLANK([$'P2.Operable'.D86]);"";[$'P2.Operable'.D86]) ->  | P21: of:=IF(ISBLANK([$'P2.Operable'.D119]);"";[$'P2.Operable'.D119]) ->  | Q21: of:=IF(ISBLANK([$'P2.Operable'.D152]);"";[$'P2.Operable'.D152]) ->  | R21: of:=IF(ISBLANK([$'P2.Operable'.D185]);"";[$'P2.Operable'.D185]) ->  | S21: of:=IF(ISBLANK([$'P2.Operable'.D218]);"";[$'P2.Operable'.D218]) ->  | T21: of:=IF(ISBLANK([$'P2.Operable'.D251]);"";[$'P2.Operable'.D251]) ->  | U21: of:=IF(ISBLANK([$'P2.Operable'.D284]);"";[$'P2.Operable'.D284]) ->  | V21: of:=IF(ISBLANK([$'P2.Operable'.D317]);"";[$'P2.Operable'.D317]) ->  | W21: of:=IF(ISBLANK([$'P2.Operable'.D449]);"";[$'P2.Operable'.D449]) ->  | X21: of:=IF(ISBLANK([$'P2.Operable'.D482]);"";[$'P2.Operable'.D482]) ->  | Y21: of:=IF(ISBLANK([$'P2.Operable'.D515]);"";[$'P2.Operable'.D515]) ->  | Z21: of:=IF(ISBLANK([$'P2.Operable'.D548]);"";[$'P2.Operable'.D548]) ->  | AA21: of:=IF(ISBLANK([$'P3.Comprensible'.D20]);"";[$'P3.Comprensible'.D20]) ->  | AB21: of:=IF(ISBLANK([$'P3.Comprensible'.D86]);"";[$'P3.Comprensible'.D86]) ->  | AC21: of:=IF(ISBLANK([$'P3.Comprensible'.D119]);"";[$'P3.Comprensible'.D119]) ->  | AD21: of:=IF(ISBLANK([$'P3.Comprensible'.D218]);"";[$'P3.Comprensible'.D218]) ->  | AE21: of:=IF(ISBLANK([$'P3.Comprensible'.D251]);"";[$'P3.Comprensible'.D251]) ->  | AF21: of:=IF(ISBLANK([$'P4.Robusto'.D20]);"";[$'P4.Robusto'.D20]) ->  | AG21: of:=IF(ISBLANK([$'P4.Robusto'.D53]);"";[$'P4.Robusto'.D53]) -> 
B22: of:=IF( ISBLANK([$'03.Muestra'.$C$10]);"";[$'03.Muestra'.$C$10]) ->  | C22: of:=IF( ISBLANK([$'03.Muestra'.$E$10]);"";[$'03.Muestra'.$E$10]) ->  | D22: of:=IF(ISBLANK([$'P1.Perceptible'.D21]);"";[$'P1.Perceptible'.D21]) ->  | E22: of:=IF(ISBLANK([$'P1.Perceptible'.D54]);"";[$'P1.Perceptible'.D54]) ->  | F22: of:=IF(ISBLANK([$'P1.Perceptible'.D87]);"";[$'P1.Perceptible'.D87]) ->  | G22: of:=IF(ISBLANK([$'P1.Perceptible'.D120]);"";[$'P1.Perceptible'.D120]) ->  | H22: of:=IF(ISBLANK([$'P1.Perceptible'.D219]);"";[$'P1.Perceptible'.D219]) ->  | I22: of:=IF(ISBLANK([$'P1.Perceptible'.D252]);"";[$'P1.Perceptible'.D252]) ->  | J22: of:=IF(ISBLANK([$'P1.Perceptible'.D285]);"";[$'P1.Perceptible'.D285]) ->  | K22: of:=IF(ISBLANK([$'P1.Perceptible'.D384]);"";[$'P1.Perceptible'.D384]) ->  | L22: of:=IF(ISBLANK([$'P1.Perceptible'.D417]);"";[$'P1.Perceptible'.D417]) ->  | M22: of:=IF(ISBLANK([$'P2.Operable'.D21]);"";[$'P2.Operable'.D21]) ->  | N22: of:=IF(ISBLANK([$'P2.Operable'.D54]);"";[$'P2.Operable'.D54]) ->  | O22: of:=IF(ISBLANK([$'P2.Operable'.D87]);"";[$'P2.Operable'.D87]) ->  | P22: of:=IF(ISBLANK([$'P2.Operable'.D120]);"";[$'P2.Operable'.D120]) ->  | Q22: of:=IF(ISBLANK([$'P2.Operable'.D153]);"";[$'P2.Operable'.D153]) ->  | R22: of:=IF(ISBLANK([$'P2.Operable'.D186]);"";[$'P2.Operable'.D186]) ->  | S22: of:=IF(ISBLANK([$'P2.Operable'.D219]);"";[$'P2.Operable'.D219]) ->  | T22: of:=IF(ISBLANK([$'P2.Operable'.D252]);"";[$'P2.Operable'.D252]) ->  | U22: of:=IF(ISBLANK([$'P2.Operable'.D285]);"";[$'P2.Operable'.D285]) ->  | V22: of:=IF(ISBLANK([$'P2.Operable'.D318]);"";[$'P2.Operable'.D318]) ->  | W22: of:=IF(ISBLANK([$'P2.Operable'.D450]);"";[$'P2.Operable'.D450]) ->  | X22: of:=IF(ISBLANK([$'P2.Operable'.D483]);"";[$'P2.Operable'.D483]) ->  | Y22: of:=IF(ISBLANK([$'P2.Operable'.D516]);"";[$'P2.Operable'.D516]) ->  | Z22: of:=IF(ISBLANK([$'P2.Operable'.D549]);"";[$'P2.Operable'.D549]) ->  | AA22: of:=IF(ISBLANK([$'P3.Comprensible'.D21]);"";[$'P3.Comprensible'.D21]) ->  | AB22: of:=IF(ISBLANK([$'P3.Comprensible'.D87]);"";[$'P3.Comprensible'.D87]) ->  | AC22: of:=IF(ISBLANK([$'P3.Comprensible'.D120]);"";[$'P3.Comprensible'.D120]) ->  | AD22: of:=IF(ISBLANK([$'P3.Comprensible'.D219]);"";[$'P3.Comprensible'.D219]) ->  | AE22: of:=IF(ISBLANK([$'P3.Comprensible'.D252]);"";[$'P3.Comprensible'.D252]) ->  | AF22: of:=IF(ISBLANK([$'P4.Robusto'.D21]);"";[$'P4.Robusto'.D21]) ->  | AG22: of:=IF(ISBLANK([$'P4.Robusto'.D54]);"";[$'P4.Robusto'.D54]) -> 
B23: of:=IF( ISBLANK([$'03.Muestra'.$C$11]);"";[$'03.Muestra'.$C$11]) ->  | C23: of:=IF( ISBLANK([$'03.Muestra'.$E$11]);"";[$'03.Muestra'.$E$11]) ->  | D23: of:=IF(ISBLANK([$'P1.Perceptible'.D22]);"";[$'P1.Perceptible'.D22]) ->  | E23: of:=IF(ISBLANK([$'P1.Perceptible'.D55]);"";[$'P1.Perceptible'.D55]) ->  | F23: of:=IF(ISBLANK([$'P1.Perceptible'.D88]);"";[$'P1.Perceptible'.D88]) ->  | G23: of:=IF(ISBLANK([$'P1.Perceptible'.D121]);"";[$'P1.Perceptible'.D121]) ->  | H23: of:=IF(ISBLANK([$'P1.Perceptible'.D220]);"";[$'P1.Perceptible'.D220]) ->  | I23: of:=IF(ISBLANK([$'P1.Perceptible'.D253]);"";[$'P1.Perceptible'.D253]) ->  | J23: of:=IF(ISBLANK([$'P1.Perceptible'.D286]);"";[$'P1.Perceptible'.D286]) ->  | K23: of:=IF(ISBLANK([$'P1.Perceptible'.D385]);"";[$'P1.Perceptible'.D385]) ->  | L23: of:=IF(ISBLANK([$'P1.Perceptible'.D418]);"";[$'P1.Perceptible'.D418]) ->  | M23: of:=IF(ISBLANK([$'P2.Operable'.D22]);"";[$'P2.Operable'.D22]) ->  | N23: of:=IF(ISBLANK([$'P2.Operable'.D55]);"";[$'P2.Operable'.D55]) ->  | O23: of:=IF(ISBLANK([$'P2.Operable'.D88]);"";[$'P2.Operable'.D88]) ->  | P23: of:=IF(ISBLANK([$'P2.Operable'.D121]);"";[$'P2.Operable'.D121]) ->  | Q23: of:=IF(ISBLANK([$'P2.Operable'.D154]);"";[$'P2.Operable'.D154]) ->  | R23: of:=IF(ISBLANK([$'P2.Operable'.D187]);"";[$'P2.Operable'.D187]) ->  | S23: of:=IF(ISBLANK([$'P2.Operable'.D220]);"";[$'P2.Operable'.D220]) ->  | T23: of:=IF(ISBLANK([$'P2.Operable'.D253]);"";[$'P2.Operable'.D253]) ->  | U23: of:=IF(ISBLANK([$'P2.Operable'.D286]);"";[$'P2.Operable'.D286]) ->  | V23: of:=IF(ISBLANK([$'P2.Operable'.D319]);"";[$'P2.Operable'.D319]) ->  | W23: of:=IF(ISBLANK([$'P2.Operable'.D451]);"";[$'P2.Operable'.D451]) ->  | X23: of:=IF(ISBLANK([$'P2.Operable'.D484]);"";[$'P2.Operable'.D484]) ->  | Y23: of:=IF(ISBLANK([$'P2.Operable'.D517]);"";[$'P2.Operable'.D517]) ->  | Z23: of:=IF(ISBLANK([$'P2.Operable'.D550]);"";[$'P2.Operable'.D550]) ->  | AA23: of:=IF(ISBLANK([$'P3.Comprensible'.D22]);"";[$'P3.Comprensible'.D22]) ->  | AB23: of:=IF(ISBLANK([$'P3.Comprensible'.D88]);"";[$'P3.Comprensible'.D88]) ->  | AC23: of:=IF(ISBLANK([$'P3.Comprensible'.D121]);"";[$'P3.Comprensible'.D121]) ->  | AD23: of:=IF(ISBLANK([$'P3.Comprensible'.D220]);"";[$'P3.Comprensible'.D220]) ->  | AE23: of:=IF(ISBLANK([$'P3.Comprensible'.D253]);"";[$'P3.Comprensible'.D253]) ->  | AF23: of:=IF(ISBLANK([$'P4.Robusto'.D22]);"";[$'P4.Robusto'.D22]) ->  | AG23: of:=IF(ISBLANK([$'P4.Robusto'.D55]);"";[$'P4.Robusto'.D55]) -> 
B24: of:=IF( ISBLANK([$'03.Muestra'.$C$12]);"";[$'03.Muestra'.$C$12]) ->  | C24: of:=IF( ISBLANK([$'03.Muestra'.$E$12]);"";[$'03.Muestra'.$E$12]) ->  | D24: of:=IF(ISBLANK([$'P1.Perceptible'.D23]);"";[$'P1.Perceptible'.D23]) ->  | E24: of:=IF(ISBLANK([$'P1.Perceptible'.D56]);"";[$'P1.Perceptible'.D56]) ->  | F24: of:=IF(ISBLANK([$'P1.Perceptible'.D89]);"";[$'P1.Perceptible'.D89]) ->  | G24: of:=IF(ISBLANK([$'P1.Perceptible'.D122]);"";[$'P1.Perceptible'.D122]) ->  | H24: of:=IF(ISBLANK([$'P1.Perceptible'.D221]);"";[$'P1.Perceptible'.D221]) ->  | I24: of:=IF(ISBLANK([$'P1.Perceptible'.D254]);"";[$'P1.Perceptible'.D254]) ->  | J24: of:=IF(ISBLANK([$'P1.Perceptible'.D287]);"";[$'P1.Perceptible'.D287]) ->  | K24: of:=IF(ISBLANK([$'P1.Perceptible'.D386]);"";[$'P1.Perceptible'.D386]) ->  | L24: of:=IF(ISBLANK([$'P1.Perceptible'.D419]);"";[$'P1.Perceptible'.D419]) ->  | M24: of:=IF(ISBLANK([$'P2.Operable'.D23]);"";[$'P2.Operable'.D23]) ->  | N24: of:=IF(ISBLANK([$'P2.Operable'.D56]);"";[$'P2.Operable'.D56]) ->  | O24: of:=IF(ISBLANK([$'P2.Operable'.D89]);"";[$'P2.Operable'.D89]) ->  | P24: of:=IF(ISBLANK([$'P2.Operable'.D122]);"";[$'P2.Operable'.D122]) ->  | Q24: of:=IF(ISBLANK([$'P2.Operable'.D155]);"";[$'P2.Operable'.D155]) ->  | R24: of:=IF(ISBLANK([$'P2.Operable'.D188]);"";[$'P2.Operable'.D188]) ->  | S24: of:=IF(ISBLANK([$'P2.Operable'.D221]);"";[$'P2.Operable'.D221]) ->  | T24: of:=IF(ISBLANK([$'P2.Operable'.D254]);"";[$'P2.Operable'.D254]) ->  | U24: of:=IF(ISBLANK([$'P2.Operable'.D287]);"";[$'P2.Operable'.D287]) ->  | V24: of:=IF(ISBLANK([$'P2.Operable'.D320]);"";[$'P2.Operable'.D320]) ->  | W24: of:=IF(ISBLANK([$'P2.Operable'.D452]);"";[$'P2.Operable'.D452]) ->  | X24: of:=IF(ISBLANK([$'P2.Operable'.D485]);"";[$'P2.Operable'.D485]) ->  | Y24: of:=IF(ISBLANK([$'P2.Operable'.D518]);"";[$'P2.Operable'.D518]) ->  | Z24: of:=IF(ISBLANK([$'P2.Operable'.D551]);"";[$'P2.Operable'.D551]) ->  | AA24: of:=IF(ISBLANK([$'P3.Comprensible'.D23]);"";[$'P3.Comprensible'.D23]) ->  | AB24: of:=IF(ISBLANK([$'P3.Comprensible'.D89]);"";[$'P3.Comprensible'.D89]) ->  | AC24: of:=IF(ISBLANK([$'P3.Comprensible'.D122]);"";[$'P3.Comprensible'.D122]) ->  | AD24: of:=IF(ISBLANK([$'P3.Comprensible'.D221]);"";[$'P3.Comprensible'.D221]) ->  | AE24: of:=IF(ISBLANK([$'P3.Comprensible'.D254]);"";[$'P3.Comprensible'.D254]) ->  | AF24: of:=IF(ISBLANK([$'P4.Robusto'.D23]);"";[$'P4.Robusto'.D23]) ->  | AG24: of:=IF(ISBLANK([$'P4.Robusto'.D56]);"";[$'P4.Robusto'.D56]) -> 
B25: of:=IF( ISBLANK([$'03.Muestra'.$C$13]);"";[$'03.Muestra'.$C$13]) ->  | C25: of:=IF( ISBLANK([$'03.Muestra'.$E$13]);"";[$'03.Muestra'.$E$13]) ->  | D25: of:=IF(ISBLANK([$'P1.Perceptible'.D24]);"";[$'P1.Perceptible'.D24]) ->  | E25: of:=IF(ISBLANK([$'P1.Perceptible'.D57]);"";[$'P1.Perceptible'.D57]) ->  | F25: of:=IF(ISBLANK([$'P1.Perceptible'.D90]);"";[$'P1.Perceptible'.D90]) ->  | G25: of:=IF(ISBLANK([$'P1.Perceptible'.D123]);"";[$'P1.Perceptible'.D123]) ->  | H25: of:=IF(ISBLANK([$'P1.Perceptible'.D222]);"";[$'P1.Perceptible'.D222]) ->  | I25: of:=IF(ISBLANK([$'P1.Perceptible'.D255]);"";[$'P1.Perceptible'.D255]) ->  | J25: of:=IF(ISBLANK([$'P1.Perceptible'.D288]);"";[$'P1.Perceptible'.D288]) ->  | K25: of:=IF(ISBLANK([$'P1.Perceptible'.D387]);"";[$'P1.Perceptible'.D387]) ->  | L25: of:=IF(ISBLANK([$'P1.Perceptible'.D420]);"";[$'P1.Perceptible'.D420]) ->  | M25: of:=IF(ISBLANK([$'P2.Operable'.D24]);"";[$'P2.Operable'.D24]) ->  | N25: of:=IF(ISBLANK([$'P2.Operable'.D57]);"";[$'P2.Operable'.D57]) ->  | O25: of:=IF(ISBLANK([$'P2.Operable'.D90]);"";[$'P2.Operable'.D90]) ->  | P25: of:=IF(ISBLANK([$'P2.Operable'.D123]);"";[$'P2.Operable'.D123]) ->  | Q25: of:=IF(ISBLANK([$'P2.Operable'.D156]);"";[$'P2.Operable'.D156]) ->  | R25: of:=IF(ISBLANK([$'P2.Operable'.D189]);"";[$'P2.Operable'.D189]) ->  | S25: of:=IF(ISBLANK([$'P2.Operable'.D222]);"";[$'P2.Operable'.D222]) ->  | T25: of:=IF(ISBLANK([$'P2.Operable'.D255]);"";[$'P2.Operable'.D255]) ->  | U25: of:=IF(ISBLANK([$'P2.Operable'.D288]);"";[$'P2.Operable'.D288]) ->  | V25: of:=IF(ISBLANK([$'P2.Operable'.D321]);"";[$'P2.Operable'.D321]) ->  | W25: of:=IF(ISBLANK([$'P2.Operable'.D453]);"";[$'P2.Operable'.D453]) ->  | X25: of:=IF(ISBLANK([$'P2.Operable'.D486]);"";[$'P2.Operable'.D486]) ->  | Y25: of:=IF(ISBLANK([$'P2.Operable'.D519]);"";[$'P2.Operable'.D519]) ->  | Z25: of:=IF(ISBLANK([$'P2.Operable'.D552]);"";[$'P2.Operable'.D552]) ->  | AA25: of:=IF(ISBLANK([$'P3.Comprensible'.D24]);"";[$'P3.Comprensible'.D24]) ->  | AB25: of:=IF(ISBLANK([$'P3.Comprensible'.D90]);"";[$'P3.Comprensible'.D90]) ->  | AC25: of:=IF(ISBLANK([$'P3.Comprensible'.D123]);"";[$'P3.Comprensible'.D123]) ->  | AD25: of:=IF(ISBLANK([$'P3.Comprensible'.D222]);"";[$'P3.Comprensible'.D222]) ->  | AE25: of:=IF(ISBLANK([$'P3.Comprensible'.D255]);"";[$'P3.Comprensible'.D255]) ->  | AF25: of:=IF(ISBLANK([$'P4.Robusto'.D24]);"";[$'P4.Robusto'.D24]) ->  | AG25: of:=IF(ISBLANK([$'P4.Robusto'.D57]);"";[$'P4.Robusto'.D57]) -> 
B26: of:=IF( ISBLANK([$'03.Muestra'.$C$14]);"";[$'03.Muestra'.$C$14]) ->  | C26: of:=IF( ISBLANK([$'03.Muestra'.$E$14]);"";[$'03.Muestra'.$E$14]) ->  | D26: of:=IF(ISBLANK([$'P1.Perceptible'.D25]);"";[$'P1.Perceptible'.D25]) ->  | E26: of:=IF(ISBLANK([$'P1.Perceptible'.D58]);"";[$'P1.Perceptible'.D58]) ->  | F26: of:=IF(ISBLANK([$'P1.Perceptible'.D91]);"";[$'P1.Perceptible'.D91]) ->  | G26: of:=IF(ISBLANK([$'P1.Perceptible'.D124]);"";[$'P1.Perceptible'.D124]) ->  | H26: of:=IF(ISBLANK([$'P1.Perceptible'.D223]);"";[$'P1.Perceptible'.D223]) ->  | I26: of:=IF(ISBLANK([$'P1.Perceptible'.D256]);"";[$'P1.Perceptible'.D256]) ->  | J26: of:=IF(ISBLANK([$'P1.Perceptible'.D289]);"";[$'P1.Perceptible'.D289]) ->  | K26: of:=IF(ISBLANK([$'P1.Perceptible'.D388]);"";[$'P1.Perceptible'.D388]) ->  | L26: of:=IF(ISBLANK([$'P1.Perceptible'.D421]);"";[$'P1.Perceptible'.D421]) ->  | M26: of:=IF(ISBLANK([$'P2.Operable'.D25]);"";[$'P2.Operable'.D25]) ->  | N26: of:=IF(ISBLANK([$'P2.Operable'.D58]);"";[$'P2.Operable'.D58]) ->  | O26: of:=IF(ISBLANK([$'P2.Operable'.D91]);"";[$'P2.Operable'.D91]) ->  | P26: of:=IF(ISBLANK([$'P2.Operable'.D124]);"";[$'P2.Operable'.D124]) ->  | Q26: of:=IF(ISBLANK([$'P2.Operable'.D157]);"";[$'P2.Operable'.D157]) ->  | R26: of:=IF(ISBLANK([$'P2.Operable'.D190]);"";[$'P2.Operable'.D190]) ->  | S26: of:=IF(ISBLANK([$'P2.Operable'.D223]);"";[$'P2.Operable'.D223]) ->  | T26: of:=IF(ISBLANK([$'P2.Operable'.D256]);"";[$'P2.Operable'.D256]) ->  | U26: of:=IF(ISBLANK([$'P2.Operable'.D289]);"";[$'P2.Operable'.D289]) ->  | V26: of:=IF(ISBLANK([$'P2.Operable'.D322]);"";[$'P2.Operable'.D322]) ->  | W26: of:=IF(ISBLANK([$'P2.Operable'.D454]);"";[$'P2.Operable'.D454]) ->  | X26: of:=IF(ISBLANK([$'P2.Operable'.D487]);"";[$'P2.Operable'.D487]) ->  | Y26: of:=IF(ISBLANK([$'P2.Operable'.D520]);"";[$'P2.Operable'.D520]) ->  | Z26: of:=IF(ISBLANK([$'P2.Operable'.D553]);"";[$'P2.Operable'.D553]) ->  | AA26: of:=IF(ISBLANK([$'P3.Comprensible'.D25]);"";[$'P3.Comprensible'.D25]) ->  | AB26: of:=IF(ISBLANK([$'P3.Comprensible'.D91]);"";[$'P3.Comprensible'.D91]) ->  | AC26: of:=IF(ISBLANK([$'P3.Comprensible'.D124]);"";[$'P3.Comprensible'.D124]) ->  | AD26: of:=IF(ISBLANK([$'P3.Comprensible'.D223]);"";[$'P3.Comprensible'.D223]) ->  | AE26: of:=IF(ISBLANK([$'P3.Comprensible'.D256]);"";[$'P3.Comprensible'.D256]) ->  | AF26: of:=IF(ISBLANK([$'P4.Robusto'.D25]);"";[$'P4.Robusto'.D25]) ->  | AG26: of:=IF(ISBLANK([$'P4.Robusto'.D58]);"";[$'P4.Robusto'.D58]) -> 
B27: of:=IF( ISBLANK([$'03.Muestra'.$C$15]);"";[$'03.Muestra'.$C$15]) ->  | C27: of:=IF( ISBLANK([$'03.Muestra'.$E$15]);"";[$'03.Muestra'.$E$15]) ->  | D27: of:=IF(ISBLANK([$'P1.Perceptible'.D26]);"";[$'P1.Perceptible'.D26]) ->  | E27: of:=IF(ISBLANK([$'P1.Perceptible'.D59]);"";[$'P1.Perceptible'.D59]) ->  | F27: of:=IF(ISBLANK([$'P1.Perceptible'.D92]);"";[$'P1.Perceptible'.D92]) ->  | G27: of:=IF(ISBLANK([$'P1.Perceptible'.D125]);"";[$'P1.Perceptible'.D125]) ->  | H27: of:=IF(ISBLANK([$'P1.Perceptible'.D224]);"";[$'P1.Perceptible'.D224]) ->  | I27: of:=IF(ISBLANK([$'P1.Perceptible'.D257]);"";[$'P1.Perceptible'.D257]) ->  | J27: of:=IF(ISBLANK([$'P1.Perceptible'.D290]);"";[$'P1.Perceptible'.D290]) ->  | K27: of:=IF(ISBLANK([$'P1.Perceptible'.D389]);"";[$'P1.Perceptible'.D389]) ->  | L27: of:=IF(ISBLANK([$'P1.Perceptible'.D422]);"";[$'P1.Perceptible'.D422]) ->  | M27: of:=IF(ISBLANK([$'P2.Operable'.D26]);"";[$'P2.Operable'.D26]) ->  | N27: of:=IF(ISBLANK([$'P2.Operable'.D59]);"";[$'P2.Operable'.D59]) ->  | O27: of:=IF(ISBLANK([$'P2.Operable'.D92]);"";[$'P2.Operable'.D92]) ->  | P27: of:=IF(ISBLANK([$'P2.Operable'.D125]);"";[$'P2.Operable'.D125]) ->  | Q27: of:=IF(ISBLANK([$'P2.Operable'.D158]);"";[$'P2.Operable'.D158]) ->  | R27: of:=IF(ISBLANK([$'P2.Operable'.D191]);"";[$'P2.Operable'.D191]) ->  | S27: of:=IF(ISBLANK([$'P2.Operable'.D224]);"";[$'P2.Operable'.D224]) ->  | T27: of:=IF(ISBLANK([$'P2.Operable'.D257]);"";[$'P2.Operable'.D257]) ->  | U27: of:=IF(ISBLANK([$'P2.Operable'.D290]);"";[$'P2.Operable'.D290]) ->  | V27: of:=IF(ISBLANK([$'P2.Operable'.D323]);"";[$'P2.Operable'.D323]) ->  | W27: of:=IF(ISBLANK([$'P2.Operable'.D455]);"";[$'P2.Operable'.D455]) ->  | X27: of:=IF(ISBLANK([$'P2.Operable'.D488]);"";[$'P2.Operable'.D488]) ->  | Y27: of:=IF(ISBLANK([$'P2.Operable'.D521]);"";[$'P2.Operable'.D521]) ->  | Z27: of:=IF(ISBLANK([$'P2.Operable'.D554]);"";[$'P2.Operable'.D554]) ->  | AA27: of:=IF(ISBLANK([$'P3.Comprensible'.D26]);"";[$'P3.Comprensible'.D26]) ->  | AB27: of:=IF(ISBLANK([$'P3.Comprensible'.D92]);"";[$'P3.Comprensible'.D92]) ->  | AC27: of:=IF(ISBLANK([$'P3.Comprensible'.D125]);"";[$'P3.Comprensible'.D125]) ->  | AD27: of:=IF(ISBLANK([$'P3.Comprensible'.D224]);"";[$'P3.Comprensible'.D224]) ->  | AE27: of:=IF(ISBLANK([$'P3.Comprensible'.D257]);"";[$'P3.Comprensible'.D257]) ->  | AF27: of:=IF(ISBLANK([$'P4.Robusto'.D26]);"";[$'P4.Robusto'.D26]) ->  | AG27: of:=IF(ISBLANK([$'P4.Robusto'.D59]);"";[$'P4.Robusto'.D59]) -> 
B28: of:=IF( ISBLANK([$'03.Muestra'.$C$16]);"";[$'03.Muestra'.$C$16]) ->  | C28: of:=IF( ISBLANK([$'03.Muestra'.$E$16]);"";[$'03.Muestra'.$E$16]) ->  | D28: of:=IF(ISBLANK([$'P1.Perceptible'.D27]);"";[$'P1.Perceptible'.D27]) ->  | E28: of:=IF(ISBLANK([$'P1.Perceptible'.D60]);"";[$'P1.Perceptible'.D60]) ->  | F28: of:=IF(ISBLANK([$'P1.Perceptible'.D93]);"";[$'P1.Perceptible'.D93]) ->  | G28: of:=IF(ISBLANK([$'P1.Perceptible'.D126]);"";[$'P1.Perceptible'.D126]) ->  | H28: of:=IF(ISBLANK([$'P1.Perceptible'.D225]);"";[$'P1.Perceptible'.D225]) ->  | I28: of:=IF(ISBLANK([$'P1.Perceptible'.D258]);"";[$'P1.Perceptible'.D258]) ->  | J28: of:=IF(ISBLANK([$'P1.Perceptible'.D291]);"";[$'P1.Perceptible'.D291]) ->  | K28: of:=IF(ISBLANK([$'P1.Perceptible'.D390]);"";[$'P1.Perceptible'.D390]) ->  | L28: of:=IF(ISBLANK([$'P1.Perceptible'.D423]);"";[$'P1.Perceptible'.D423]) ->  | M28: of:=IF(ISBLANK([$'P2.Operable'.D27]);"";[$'P2.Operable'.D27]) ->  | N28: of:=IF(ISBLANK([$'P2.Operable'.D60]);"";[$'P2.Operable'.D60]) ->  | O28: of:=IF(ISBLANK([$'P2.Operable'.D93]);"";[$'P2.Operable'.D93]) ->  | P28: of:=IF(ISBLANK([$'P2.Operable'.D126]);"";[$'P2.Operable'.D126]) ->  | Q28: of:=IF(ISBLANK([$'P2.Operable'.D159]);"";[$'P2.Operable'.D159]) ->  | R28: of:=IF(ISBLANK([$'P2.Operable'.D192]);"";[$'P2.Operable'.D192]) ->  | S28: of:=IF(ISBLANK([$'P2.Operable'.D225]);"";[$'P2.Operable'.D225]) ->  | T28: of:=IF(ISBLANK([$'P2.Operable'.D258]);"";[$'P2.Operable'.D258]) ->  | U28: of:=IF(ISBLANK([$'P2.Operable'.D291]);"";[$'P2.Operable'.D291]) ->  | V28: of:=IF(ISBLANK([$'P2.Operable'.D324]);"";[$'P2.Operable'.D324]) ->  | W28: of:=IF(ISBLANK([$'P2.Operable'.D456]);"";[$'P2.Operable'.D456]) ->  | X28: of:=IF(ISBLANK([$'P2.Operable'.D489]);"";[$'P2.Operable'.D489]) ->  | Y28: of:=IF(ISBLANK([$'P2.Operable'.D522]);"";[$'P2.Operable'.D522]) ->  | Z28: of:=IF(ISBLANK([$'P2.Operable'.D555]);"";[$'P2.Operable'.D555]) ->  | AA28: of:=IF(ISBLANK([$'P3.Comprensible'.D27]);"";[$'P3.Comprensible'.D27]) ->  | AB28: of:=IF(ISBLANK([$'P3.Comprensible'.D93]);"";[$'P3.Comprensible'.D93]) ->  | AC28: of:=IF(ISBLANK([$'P3.Comprensible'.D126]);"";[$'P3.Comprensible'.D126]) ->  | AD28: of:=IF(ISBLANK([$'P3.Comprensible'.D225]);"";[$'P3.Comprensible'.D225]) ->  | AE28: of:=IF(ISBLANK([$'P3.Comprensible'.D258]);"";[$'P3.Comprensible'.D258]) ->  | AF28: of:=IF(ISBLANK([$'P4.Robusto'.D27]);"";[$'P4.Robusto'.D27]) ->  | AG28: of:=IF(ISBLANK([$'P4.Robusto'.D60]);"";[$'P4.Robusto'.D60]) -> 
B29: of:=IF( ISBLANK([$'03.Muestra'.$C$17]);"";[$'03.Muestra'.$C$17]) ->  | C29: of:=IF( ISBLANK([$'03.Muestra'.$E$17]);"";[$'03.Muestra'.$E$17]) ->  | D29: of:=IF(ISBLANK([$'P1.Perceptible'.D28]);"";[$'P1.Perceptible'.D28]) ->  | E29: of:=IF(ISBLANK([$'P1.Perceptible'.D61]);"";[$'P1.Perceptible'.D61]) ->  | F29: of:=IF(ISBLANK([$'P1.Perceptible'.D94]);"";[$'P1.Perceptible'.D94]) ->  | G29: of:=IF(ISBLANK([$'P1.Perceptible'.D127]);"";[$'P1.Perceptible'.D127]) ->  | H29: of:=IF(ISBLANK([$'P1.Perceptible'.D226]);"";[$'P1.Perceptible'.D226]) ->  | I29: of:=IF(ISBLANK([$'P1.Perceptible'.D259]);"";[$'P1.Perceptible'.D259]) ->  | J29: of:=IF(ISBLANK([$'P1.Perceptible'.D292]);"";[$'P1.Perceptible'.D292]) ->  | K29: of:=IF(ISBLANK([$'P1.Perceptible'.D391]);"";[$'P1.Perceptible'.D391]) ->  | L29: of:=IF(ISBLANK([$'P1.Perceptible'.D424]);"";[$'P1.Perceptible'.D424]) ->  | M29: of:=IF(ISBLANK([$'P2.Operable'.D28]);"";[$'P2.Operable'.D28]) ->  | N29: of:=IF(ISBLANK([$'P2.Operable'.D61]);"";[$'P2.Operable'.D61]) ->  | O29: of:=IF(ISBLANK([$'P2.Operable'.D94]);"";[$'P2.Operable'.D94]) ->  | P29: of:=IF(ISBLANK([$'P2.Operable'.D127]);"";[$'P2.Operable'.D127]) ->  | Q29: of:=IF(ISBLANK([$'P2.Operable'.D160]);"";[$'P2.Operable'.D160]) ->  | R29: of:=IF(ISBLANK([$'P2.Operable'.D193]);"";[$'P2.Operable'.D193]) ->  | S29: of:=IF(ISBLANK([$'P2.Operable'.D226]);"";[$'P2.Operable'.D226]) ->  | T29: of:=IF(ISBLANK([$'P2.Operable'.D259]);"";[$'P2.Operable'.D259]) ->  | U29: of:=IF(ISBLANK([$'P2.Operable'.D292]);"";[$'P2.Operable'.D292]) ->  | V29: of:=IF(ISBLANK([$'P2.Operable'.D325]);"";[$'P2.Operable'.D325]) ->  | W29: of:=IF(ISBLANK([$'P2.Operable'.D457]);"";[$'P2.Operable'.D457]) ->  | X29: of:=IF(ISBLANK([$'P2.Operable'.D490]);"";[$'P2.Operable'.D490]) ->  | Y29: of:=IF(ISBLANK([$'P2.Operable'.D523]);"";[$'P2.Operable'.D523]) ->  | Z29: of:=IF(ISBLANK([$'P2.Operable'.D556]);"";[$'P2.Operable'.D556]) ->  | AA29: of:=IF(ISBLANK([$'P3.Comprensible'.D28]);"";[$'P3.Comprensible'.D28]) ->  | AB29: of:=IF(ISBLANK([$'P3.Comprensible'.D94]);"";[$'P3.Comprensible'.D94]) ->  | AC29: of:=IF(ISBLANK([$'P3.Comprensible'.D127]);"";[$'P3.Comprensible'.D127]) ->  | AD29: of:=IF(ISBLANK([$'P3.Comprensible'.D226]);"";[$'P3.Comprensible'.D226]) ->  | AE29: of:=IF(ISBLANK([$'P3.Comprensible'.D259]);"";[$'P3.Comprensible'.D259]) ->  | AF29: of:=IF(ISBLANK([$'P4.Robusto'.D28]);"";[$'P4.Robusto'.D28]) ->  | AG29: of:=IF(ISBLANK([$'P4.Robusto'.D61]);"";[$'P4.Robusto'.D61]) -> 
B30: of:=IF( ISBLANK([$'03.Muestra'.$C$18]);"";[$'03.Muestra'.$C$18]) ->  | C30: of:=IF( ISBLANK([$'03.Muestra'.$E$18]);"";[$'03.Muestra'.$E$18]) ->  | D30: of:=IF(ISBLANK([$'P1.Perceptible'.D29]);"";[$'P1.Perceptible'.D29]) ->  | E30: of:=IF(ISBLANK([$'P1.Perceptible'.D62]);"";[$'P1.Perceptible'.D62]) ->  | F30: of:=IF(ISBLANK([$'P1.Perceptible'.D95]);"";[$'P1.Perceptible'.D95]) ->  | G30: of:=IF(ISBLANK([$'P1.Perceptible'.D128]);"";[$'P1.Perceptible'.D128]) ->  | H30: of:=IF(ISBLANK([$'P1.Perceptible'.D227]);"";[$'P1.Perceptible'.D227]) ->  | I30: of:=IF(ISBLANK([$'P1.Perceptible'.D260]);"";[$'P1.Perceptible'.D260]) ->  | J30: of:=IF(ISBLANK([$'P1.Perceptible'.D293]);"";[$'P1.Perceptible'.D293]) ->  | K30: of:=IF(ISBLANK([$'P1.Perceptible'.D392]);"";[$'P1.Perceptible'.D392]) ->  | L30: of:=IF(ISBLANK([$'P1.Perceptible'.D425]);"";[$'P1.Perceptible'.D425]) ->  | M30: of:=IF(ISBLANK([$'P2.Operable'.D29]);"";[$'P2.Operable'.D29]) ->  | N30: of:=IF(ISBLANK([$'P2.Operable'.D62]);"";[$'P2.Operable'.D62]) ->  | O30: of:=IF(ISBLANK([$'P2.Operable'.D95]);"";[$'P2.Operable'.D95]) ->  | P30: of:=IF(ISBLANK([$'P2.Operable'.D128]);"";[$'P2.Operable'.D128]) ->  | Q30: of:=IF(ISBLANK([$'P2.Operable'.D161]);"";[$'P2.Operable'.D161]) ->  | R30: of:=IF(ISBLANK([$'P2.Operable'.D194]);"";[$'P2.Operable'.D194]) ->  | S30: of:=IF(ISBLANK([$'P2.Operable'.D227]);"";[$'P2.Operable'.D227]) ->  | T30: of:=IF(ISBLANK([$'P2.Operable'.D260]);"";[$'P2.Operable'.D260]) ->  | U30: of:=IF(ISBLANK([$'P2.Operable'.D293]);"";[$'P2.Operable'.D293]) ->  | V30: of:=IF(ISBLANK([$'P2.Operable'.D326]);"";[$'P2.Operable'.D326]) ->  | W30: of:=IF(ISBLANK([$'P2.Operable'.D458]);"";[$'P2.Operable'.D458]) ->  | X30: of:=IF(ISBLANK([$'P2.Operable'.D491]);"";[$'P2.Operable'.D491]) ->  | Y30: of:=IF(ISBLANK([$'P2.Operable'.D524]);"";[$'P2.Operable'.D524]) ->  | Z30: of:=IF(ISBLANK([$'P2.Operable'.D557]);"";[$'P2.Operable'.D557]) ->  | AA30: of:=IF(ISBLANK([$'P3.Comprensible'.D29]);"";[$'P3.Comprensible'.D29]) ->  | AB30: of:=IF(ISBLANK([$'P3.Comprensible'.D95]);"";[$'P3.Comprensible'.D95]) ->  | AC30: of:=IF(ISBLANK([$'P3.Comprensible'.D128]);"";[$'P3.Comprensible'.D128]) ->  | AD30: of:=IF(ISBLANK([$'P3.Comprensible'.D227]);"";[$'P3.Comprensible'.D227]) ->  | AE30: of:=IF(ISBLANK([$'P3.Comprensible'.D260]);"";[$'P3.Comprensible'.D260]) ->  | AF30: of:=IF(ISBLANK([$'P4.Robusto'.D29]);"";[$'P4.Robusto'.D29]) ->  | AG30: of:=IF(ISBLANK([$'P4.Robusto'.D62]);"";[$'P4.Robusto'.D62]) -> 
B31: of:=IF( ISBLANK([$'03.Muestra'.$C$19]);"";[$'03.Muestra'.$C$19]) ->  | C31: of:=IF( ISBLANK([$'03.Muestra'.$E$19]);"";[$'03.Muestra'.$E$19]) ->  | D31: of:=IF(ISBLANK([$'P1.Perceptible'.D30]);"";[$'P1.Perceptible'.D30]) ->  | E31: of:=IF(ISBLANK([$'P1.Perceptible'.D63]);"";[$'P1.Perceptible'.D63]) ->  | F31: of:=IF(ISBLANK([$'P1.Perceptible'.D96]);"";[$'P1.Perceptible'.D96]) ->  | G31: of:=IF(ISBLANK([$'P1.Perceptible'.D129]);"";[$'P1.Perceptible'.D129]) ->  | H31: of:=IF(ISBLANK([$'P1.Perceptible'.D228]);"";[$'P1.Perceptible'.D228]) ->  | I31: of:=IF(ISBLANK([$'P1.Perceptible'.D261]);"";[$'P1.Perceptible'.D261]) ->  | J31: of:=IF(ISBLANK([$'P1.Perceptible'.D294]);"";[$'P1.Perceptible'.D294]) ->  | K31: of:=IF(ISBLANK([$'P1.Perceptible'.D393]);"";[$'P1.Perceptible'.D393]) ->  | L31: of:=IF(ISBLANK([$'P1.Perceptible'.D426]);"";[$'P1.Perceptible'.D426]) ->  | M31: of:=IF(ISBLANK([$'P2.Operable'.D30]);"";[$'P2.Operable'.D30]) ->  | N31: of:=IF(ISBLANK([$'P2.Operable'.D63]);"";[$'P2.Operable'.D63]) ->  | O31: of:=IF(ISBLANK([$'P2.Operable'.D96]);"";[$'P2.Operable'.D96]) ->  | P31: of:=IF(ISBLANK([$'P2.Operable'.D129]);"";[$'P2.Operable'.D129]) ->  | Q31: of:=IF(ISBLANK([$'P2.Operable'.D162]);"";[$'P2.Operable'.D162]) ->  | R31: of:=IF(ISBLANK([$'P2.Operable'.D195]);"";[$'P2.Operable'.D195]) ->  | S31: of:=IF(ISBLANK([$'P2.Operable'.D228]);"";[$'P2.Operable'.D228]) ->  | T31: of:=IF(ISBLANK([$'P2.Operable'.D261]);"";[$'P2.Operable'.D261]) ->  | U31: of:=IF(ISBLANK([$'P2.Operable'.D294]);"";[$'P2.Operable'.D294]) ->  | V31: of:=IF(ISBLANK([$'P2.Operable'.D327]);"";[$'P2.Operable'.D327]) ->  | W31: of:=IF(ISBLANK([$'P2.Operable'.D459]);"";[$'P2.Operable'.D459]) ->  | X31: of:=IF(ISBLANK([$'P2.Operable'.D492]);"";[$'P2.Operable'.D492]) ->  | Y31: of:=IF(ISBLANK([$'P2.Operable'.D525]);"";[$'P2.Operable'.D525]) ->  | Z31: of:=IF(ISBLANK([$'P2.Operable'.D558]);"";[$'P2.Operable'.D558]) ->  | AA31: of:=IF(ISBLANK([$'P3.Comprensible'.D30]);"";[$'P3.Comprensible'.D30]) ->  | AB31: of:=IF(ISBLANK([$'P3.Comprensible'.D96]);"";[$'P3.Comprensible'.D96]) ->  | AC31: of:=IF(ISBLANK([$'P3.Comprensible'.D129]);"";[$'P3.Comprensible'.D129]) ->  | AD31: of:=IF(ISBLANK([$'P3.Comprensible'.D228]);"";[$'P3.Comprensible'.D228]) ->  | AE31: of:=IF(ISBLANK([$'P3.Comprensible'.D261]);"";[$'P3.Comprensible'.D261]) ->  | AF31: of:=IF(ISBLANK([$'P4.Robusto'.D30]);"";[$'P4.Robusto'.D30]) ->  | AG31: of:=IF(ISBLANK([$'P4.Robusto'.D63]);"";[$'P4.Robusto'.D63]) -> 
B32: of:=IF( ISBLANK([$'03.Muestra'.$C$20]);"";[$'03.Muestra'.$C$20]) ->  | C32: of:=IF( ISBLANK([$'03.Muestra'.$E$20]);"";[$'03.Muestra'.$E$20]) ->  | D32: of:=IF(ISBLANK([$'P1.Perceptible'.D31]);"";[$'P1.Perceptible'.D31]) ->  | E32: of:=IF(ISBLANK([$'P1.Perceptible'.D64]);"";[$'P1.Perceptible'.D64]) ->  | F32: of:=IF(ISBLANK([$'P1.Perceptible'.D97]);"";[$'P1.Perceptible'.D97]) ->  | G32: of:=IF(ISBLANK([$'P1.Perceptible'.D130]);"";[$'P1.Perceptible'.D130]) ->  | H32: of:=IF(ISBLANK([$'P1.Perceptible'.D229]);"";[$'P1.Perceptible'.D229]) ->  | I32: of:=IF(ISBLANK([$'P1.Perceptible'.D262]);"";[$'P1.Perceptible'.D262]) ->  | J32: of:=IF(ISBLANK([$'P1.Perceptible'.D295]);"";[$'P1.Perceptible'.D295]) ->  | K32: of:=IF(ISBLANK([$'P1.Perceptible'.D394]);"";[$'P1.Perceptible'.D394]) ->  | L32: of:=IF(ISBLANK([$'P1.Perceptible'.D427]);"";[$'P1.Perceptible'.D427]) ->  | M32: of:=IF(ISBLANK([$'P2.Operable'.D31]);"";[$'P2.Operable'.D31]) ->  | N32: of:=IF(ISBLANK([$'P2.Operable'.D64]);"";[$'P2.Operable'.D64]) ->  | O32: of:=IF(ISBLANK([$'P2.Operable'.D97]);"";[$'P2.Operable'.D97]) ->  | P32: of:=IF(ISBLANK([$'P2.Operable'.D130]);"";[$'P2.Operable'.D130]) ->  | Q32: of:=IF(ISBLANK([$'P2.Operable'.D163]);"";[$'P2.Operable'.D163]) ->  | R32: of:=IF(ISBLANK([$'P2.Operable'.D196]);"";[$'P2.Operable'.D196]) ->  | S32: of:=IF(ISBLANK([$'P2.Operable'.D229]);"";[$'P2.Operable'.D229]) ->  | T32: of:=IF(ISBLANK([$'P2.Operable'.D262]);"";[$'P2.Operable'.D262]) ->  | U32: of:=IF(ISBLANK([$'P2.Operable'.D295]);"";[$'P2.Operable'.D295]) ->  | V32: of:=IF(ISBLANK([$'P2.Operable'.D328]);"";[$'P2.Operable'.D328]) ->  | W32: of:=IF(ISBLANK([$'P2.Operable'.D460]);"";[$'P2.Operable'.D460]) ->  | X32: of:=IF(ISBLANK([$'P2.Operable'.D493]);"";[$'P2.Operable'.D493]) ->  | Y32: of:=IF(ISBLANK([$'P2.Operable'.D526]);"";[$'P2.Operable'.D526]) ->  | Z32: of:=IF(ISBLANK([$'P2.Operable'.D559]);"";[$'P2.Operable'.D559]) ->  | AA32: of:=IF(ISBLANK([$'P3.Comprensible'.D31]);"";[$'P3.Comprensible'.D31]) ->  | AB32: of:=IF(ISBLANK([$'P3.Comprensible'.D97]);"";[$'P3.Comprensible'.D97]) ->  | AC32: of:=IF(ISBLANK([$'P3.Comprensible'.D130]);"";[$'P3.Comprensible'.D130]) ->  | AD32: of:=IF(ISBLANK([$'P3.Comprensible'.D229]);"";[$'P3.Comprensible'.D229]) ->  | AE32: of:=IF(ISBLANK([$'P3.Comprensible'.D262]);"";[$'P3.Comprensible'.D262]) ->  | AF32: of:=IF(ISBLANK([$'P4.Robusto'.D31]);"";[$'P4.Robusto'.D31]) ->  | AG32: of:=IF(ISBLANK([$'P4.Robusto'.D64]);"";[$'P4.Robusto'.D64]) -> 
B33: of:=IF( ISBLANK([$'03.Muestra'.$C$21]);"";[$'03.Muestra'.$C$21]) ->  | C33: of:=IF( ISBLANK([$'03.Muestra'.$E$21]);"";[$'03.Muestra'.$E$21]) ->  | D33: of:=IF(ISBLANK([$'P1.Perceptible'.D32]);"";[$'P1.Perceptible'.D32]) ->  | E33: of:=IF(ISBLANK([$'P1.Perceptible'.D65]);"";[$'P1.Perceptible'.D65]) ->  | F33: of:=IF(ISBLANK([$'P1.Perceptible'.D98]);"";[$'P1.Perceptible'.D98]) ->  | G33: of:=IF(ISBLANK([$'P1.Perceptible'.D131]);"";[$'P1.Perceptible'.D131]) ->  | H33: of:=IF(ISBLANK([$'P1.Perceptible'.D230]);"";[$'P1.Perceptible'.D230]) ->  | I33: of:=IF(ISBLANK([$'P1.Perceptible'.D263]);"";[$'P1.Perceptible'.D263]) ->  | J33: of:=IF(ISBLANK([$'P1.Perceptible'.D296]);"";[$'P1.Perceptible'.D296]) ->  | K33: of:=IF(ISBLANK([$'P1.Perceptible'.D395]);"";[$'P1.Perceptible'.D395]) ->  | L33: of:=IF(ISBLANK([$'P1.Perceptible'.D428]);"";[$'P1.Perceptible'.D428]) ->  | M33: of:=IF(ISBLANK([$'P2.Operable'.D32]);"";[$'P2.Operable'.D32]) ->  | N33: of:=IF(ISBLANK([$'P2.Operable'.D65]);"";[$'P2.Operable'.D65]) ->  | O33: of:=IF(ISBLANK([$'P2.Operable'.D98]);"";[$'P2.Operable'.D98]) ->  | P33: of:=IF(ISBLANK([$'P2.Operable'.D131]);"";[$'P2.Operable'.D131]) ->  | Q33: of:=IF(ISBLANK([$'P2.Operable'.D164]);"";[$'P2.Operable'.D164]) ->  | R33: of:=IF(ISBLANK([$'P2.Operable'.D197]);"";[$'P2.Operable'.D197]) ->  | S33: of:=IF(ISBLANK([$'P2.Operable'.D230]);"";[$'P2.Operable'.D230]) ->  | T33: of:=IF(ISBLANK([$'P2.Operable'.D263]);"";[$'P2.Operable'.D263]) ->  | U33: of:=IF(ISBLANK([$'P2.Operable'.D296]);"";[$'P2.Operable'.D296]) ->  | V33: of:=IF(ISBLANK([$'P2.Operable'.D329]);"";[$'P2.Operable'.D329]) ->  | W33: of:=IF(ISBLANK([$'P2.Operable'.D461]);"";[$'P2.Operable'.D461]) ->  | X33: of:=IF(ISBLANK([$'P2.Operable'.D494]);"";[$'P2.Operable'.D494]) ->  | Y33: of:=IF(ISBLANK([$'P2.Operable'.D527]);"";[$'P2.Operable'.D527]) ->  | Z33: of:=IF(ISBLANK([$'P2.Operable'.D560]);"";[$'P2.Operable'.D560]) ->  | AA33: of:=IF(ISBLANK([$'P3.Comprensible'.D32]);"";[$'P3.Comprensible'.D32]) ->  | AB33: of:=IF(ISBLANK([$'P3.Comprensible'.D98]);"";[$'P3.Comprensible'.D98]) ->  | AC33: of:=IF(ISBLANK([$'P3.Comprensible'.D131]);"";[$'P3.Comprensible'.D131]) ->  | AD33: of:=IF(ISBLANK([$'P3.Comprensible'.D230]);"";[$'P3.Comprensible'.D230]) ->  | AE33: of:=IF(ISBLANK([$'P3.Comprensible'.D263]);"";[$'P3.Comprensible'.D263]) ->  | AF33: of:=IF(ISBLANK([$'P4.Robusto'.D32]);"";[$'P4.Robusto'.D32]) ->  | AG33: of:=IF(ISBLANK([$'P4.Robusto'.D65]);"";[$'P4.Robusto'.D65]) -> 
B34: of:=IF( ISBLANK([$'03.Muestra'.$C$22]);"";[$'03.Muestra'.$C$22]) ->  | C34: of:=IF( ISBLANK([$'03.Muestra'.$E$22]);"";[$'03.Muestra'.$E$22]) ->  | D34: of:=IF(ISBLANK([$'P1.Perceptible'.D33]);"";[$'P1.Perceptible'.D33]) ->  | E34: of:=IF(ISBLANK([$'P1.Perceptible'.D66]);"";[$'P1.Perceptible'.D66]) ->  | F34: of:=IF(ISBLANK([$'P1.Perceptible'.D99]);"";[$'P1.Perceptible'.D99]) ->  | G34: of:=IF(ISBLANK([$'P1.Perceptible'.D132]);"";[$'P1.Perceptible'.D132]) ->  | H34: of:=IF(ISBLANK([$'P1.Perceptible'.D231]);"";[$'P1.Perceptible'.D231]) ->  | I34: of:=IF(ISBLANK([$'P1.Perceptible'.D264]);"";[$'P1.Perceptible'.D264]) ->  | J34: of:=IF(ISBLANK([$'P1.Perceptible'.D297]);"";[$'P1.Perceptible'.D297]) ->  | K34: of:=IF(ISBLANK([$'P1.Perceptible'.D396]);"";[$'P1.Perceptible'.D396]) ->  | L34: of:=IF(ISBLANK([$'P1.Perceptible'.D429]);"";[$'P1.Perceptible'.D429]) ->  | M34: of:=IF(ISBLANK([$'P2.Operable'.D33]);"";[$'P2.Operable'.D33]) ->  | N34: of:=IF(ISBLANK([$'P2.Operable'.D66]);"";[$'P2.Operable'.D66]) ->  | O34: of:=IF(ISBLANK([$'P2.Operable'.D99]);"";[$'P2.Operable'.D99]) ->  | P34: of:=IF(ISBLANK([$'P2.Operable'.D132]);"";[$'P2.Operable'.D132]) ->  | Q34: of:=IF(ISBLANK([$'P2.Operable'.D165]);"";[$'P2.Operable'.D165]) ->  | R34: of:=IF(ISBLANK([$'P2.Operable'.D198]);"";[$'P2.Operable'.D198]) ->  | S34: of:=IF(ISBLANK([$'P2.Operable'.D231]);"";[$'P2.Operable'.D231]) ->  | T34: of:=IF(ISBLANK([$'P2.Operable'.D264]);"";[$'P2.Operable'.D264]) ->  | U34: of:=IF(ISBLANK([$'P2.Operable'.D297]);"";[$'P2.Operable'.D297]) ->  | V34: of:=IF(ISBLANK([$'P2.Operable'.D330]);"";[$'P2.Operable'.D330]) ->  | W34: of:=IF(ISBLANK([$'P2.Operable'.D462]);"";[$'P2.Operable'.D462]) ->  | X34: of:=IF(ISBLANK([$'P2.Operable'.D495]);"";[$'P2.Operable'.D495]) ->  | Y34: of:=IF(ISBLANK([$'P2.Operable'.D528]);"";[$'P2.Operable'.D528]) ->  | Z34: of:=IF(ISBLANK([$'P2.Operable'.D561]);"";[$'P2.Operable'.D561]) ->  | AA34: of:=IF(ISBLANK([$'P3.Comprensible'.D33]);"";[$'P3.Comprensible'.D33]) ->  | AB34: of:=IF(ISBLANK([$'P3.Comprensible'.D99]);"";[$'P3.Comprensible'.D99]) ->  | AC34: of:=IF(ISBLANK([$'P3.Comprensible'.D132]);"";[$'P3.Comprensible'.D132]) ->  | AD34: of:=IF(ISBLANK([$'P3.Comprensible'.D231]);"";[$'P3.Comprensible'.D231]) ->  | AE34: of:=IF(ISBLANK([$'P3.Comprensible'.D264]);"";[$'P3.Comprensible'.D264]) ->  | AF34: of:=IF(ISBLANK([$'P4.Robusto'.D33]);"";[$'P4.Robusto'.D33]) ->  | AG34: of:=IF(ISBLANK([$'P4.Robusto'.D66]);"";[$'P4.Robusto'.D66]) -> 
B35: of:=IF( ISBLANK([$'03.Muestra'.$C$23]);"";[$'03.Muestra'.$C$23]) ->  | C35: of:=IF( ISBLANK([$'03.Muestra'.$E$23]);"";[$'03.Muestra'.$E$23]) ->  | D35: of:=IF(ISBLANK([$'P1.Perceptible'.D34]);"";[$'P1.Perceptible'.D34]) ->  | E35: of:=IF(ISBLANK([$'P1.Perceptible'.D67]);"";[$'P1.Perceptible'.D67]) ->  | F35: of:=IF(ISBLANK([$'P1.Perceptible'.D100]);"";[$'P1.Perceptible'.D100]) ->  | G35: of:=IF(ISBLANK([$'P1.Perceptible'.D133]);"";[$'P1.Perceptible'.D133]) ->  | H35: of:=IF(ISBLANK([$'P1.Perceptible'.D232]);"";[$'P1.Perceptible'.D232]) ->  | I35: of:=IF(ISBLANK([$'P1.Perceptible'.D265]);"";[$'P1.Perceptible'.D265]) ->  | J35: of:=IF(ISBLANK([$'P1.Perceptible'.D298]);"";[$'P1.Perceptible'.D298]) ->  | K35: of:=IF(ISBLANK([$'P1.Perceptible'.D397]);"";[$'P1.Perceptible'.D397]) ->  | L35: of:=IF(ISBLANK([$'P1.Perceptible'.D430]);"";[$'P1.Perceptible'.D430]) ->  | M35: of:=IF(ISBLANK([$'P2.Operable'.D34]);"";[$'P2.Operable'.D34]) ->  | N35: of:=IF(ISBLANK([$'P2.Operable'.D67]);"";[$'P2.Operable'.D67]) ->  | O35: of:=IF(ISBLANK([$'P2.Operable'.D100]);"";[$'P2.Operable'.D100]) ->  | P35: of:=IF(ISBLANK([$'P2.Operable'.D133]);"";[$'P2.Operable'.D133]) ->  | Q35: of:=IF(ISBLANK([$'P2.Operable'.D166]);"";[$'P2.Operable'.D166]) ->  | R35: of:=IF(ISBLANK([$'P2.Operable'.D199]);"";[$'P2.Operable'.D199]) ->  | S35: of:=IF(ISBLANK([$'P2.Operable'.D232]);"";[$'P2.Operable'.D232]) ->  | T35: of:=IF(ISBLANK([$'P2.Operable'.D265]);"";[$'P2.Operable'.D265]) ->  | U35: of:=IF(ISBLANK([$'P2.Operable'.D298]);"";[$'P2.Operable'.D298]) ->  | V35: of:=IF(ISBLANK([$'P2.Operable'.D331]);"";[$'P2.Operable'.D331]) ->  | W35: of:=IF(ISBLANK([$'P2.Operable'.D463]);"";[$'P2.Operable'.D463]) ->  | X35: of:=IF(ISBLANK([$'P2.Operable'.D496]);"";[$'P2.Operable'.D496]) ->  | Y35: of:=IF(ISBLANK([$'P2.Operable'.D529]);"";[$'P2.Operable'.D529]) ->  | Z35: of:=IF(ISBLANK([$'P2.Operable'.D562]);"";[$'P2.Operable'.D562]) ->  | AA35: of:=IF(ISBLANK([$'P3.Comprensible'.D34]);"";[$'P3.Comprensible'.D34]) ->  | AB35: of:=IF(ISBLANK([$'P3.Comprensible'.D100]);"";[$'P3.Comprensible'.D100]) ->  | AC35: of:=IF(ISBLANK([$'P3.Comprensible'.D133]);"";[$'P3.Comprensible'.D133]) ->  | AD35: of:=IF(ISBLANK([$'P3.Comprensible'.D232]);"";[$'P3.Comprensible'.D232]) ->  | AE35: of:=IF(ISBLANK([$'P3.Comprensible'.D265]);"";[$'P3.Comprensible'.D265]) ->  | AF35: of:=IF(ISBLANK([$'P4.Robusto'.D34]);"";[$'P4.Robusto'.D34]) ->  | AG35: of:=IF(ISBLANK([$'P4.Robusto'.D67]);"";[$'P4.Robusto'.D67]) -> 
B36: of:=IF( ISBLANK([$'03.Muestra'.$C$24]);"";[$'03.Muestra'.$C$24]) ->  | C36: of:=IF( ISBLANK([$'03.Muestra'.$E$24]);"";[$'03.Muestra'.$E$24]) ->  | D36: of:=IF(ISBLANK([$'P1.Perceptible'.D35]);"";[$'P1.Perceptible'.D35]) ->  | E36: of:=IF(ISBLANK([$'P1.Perceptible'.D68]);"";[$'P1.Perceptible'.D68]) ->  | F36: of:=IF(ISBLANK([$'P1.Perceptible'.D101]);"";[$'P1.Perceptible'.D101]) ->  | G36: of:=IF(ISBLANK([$'P1.Perceptible'.D134]);"";[$'P1.Perceptible'.D134]) ->  | H36: of:=IF(ISBLANK([$'P1.Perceptible'.D233]);"";[$'P1.Perceptible'.D233]) ->  | I36: of:=IF(ISBLANK([$'P1.Perceptible'.D266]);"";[$'P1.Perceptible'.D266]) ->  | J36: of:=IF(ISBLANK([$'P1.Perceptible'.D299]);"";[$'P1.Perceptible'.D299]) ->  | K36: of:=IF(ISBLANK([$'P1.Perceptible'.D398]);"";[$'P1.Perceptible'.D398]) ->  | L36: of:=IF(ISBLANK([$'P1.Perceptible'.D431]);"";[$'P1.Perceptible'.D431]) ->  | M36: of:=IF(ISBLANK([$'P2.Operable'.D35]);"";[$'P2.Operable'.D35]) ->  | N36: of:=IF(ISBLANK([$'P2.Operable'.D68]);"";[$'P2.Operable'.D68]) ->  | O36: of:=IF(ISBLANK([$'P2.Operable'.D101]);"";[$'P2.Operable'.D101]) ->  | P36: of:=IF(ISBLANK([$'P2.Operable'.D134]);"";[$'P2.Operable'.D134]) ->  | Q36: of:=IF(ISBLANK([$'P2.Operable'.D167]);"";[$'P2.Operable'.D167]) ->  | R36: of:=IF(ISBLANK([$'P2.Operable'.D200]);"";[$'P2.Operable'.D200]) ->  | S36: of:=IF(ISBLANK([$'P2.Operable'.D233]);"";[$'P2.Operable'.D233]) ->  | T36: of:=IF(ISBLANK([$'P2.Operable'.D266]);"";[$'P2.Operable'.D266]) ->  | U36: of:=IF(ISBLANK([$'P2.Operable'.D299]);"";[$'P2.Operable'.D299]) ->  | V36: of:=IF(ISBLANK([$'P2.Operable'.D332]);"";[$'P2.Operable'.D332]) ->  | W36: of:=IF(ISBLANK([$'P2.Operable'.D464]);"";[$'P2.Operable'.D464]) ->  | X36: of:=IF(ISBLANK([$'P2.Operable'.D497]);"";[$'P2.Operable'.D497]) ->  | Y36: of:=IF(ISBLANK([$'P2.Operable'.D530]);"";[$'P2.Operable'.D530]) ->  | Z36: of:=IF(ISBLANK([$'P2.Operable'.D563]);"";[$'P2.Operable'.D563]) ->  | AA36: of:=IF(ISBLANK([$'P3.Comprensible'.D35]);"";[$'P3.Comprensible'.D35]) ->  | AB36: of:=IF(ISBLANK([$'P3.Comprensible'.D101]);"";[$'P3.Comprensible'.D101]) ->  | AC36: of:=IF(ISBLANK([$'P3.Comprensible'.D134]);"";[$'P3.Comprensible'.D134]) ->  | AD36: of:=IF(ISBLANK([$'P3.Comprensible'.D233]);"";[$'P3.Comprensible'.D233]) ->  | AE36: of:=IF(ISBLANK([$'P3.Comprensible'.D266]);"";[$'P3.Comprensible'.D266]) ->  | AF36: of:=IF(ISBLANK([$'P4.Robusto'.D35]);"";[$'P4.Robusto'.D35]) ->  | AG36: of:=IF(ISBLANK([$'P4.Robusto'.D68]);"";[$'P4.Robusto'.D68]) -> 
B37: of:=IF( ISBLANK([$'03.Muestra'.$C$25]);"";[$'03.Muestra'.$C$25]) ->  | C37: of:=IF( ISBLANK([$'03.Muestra'.$E$25]);"";[$'03.Muestra'.$E$25]) ->  | D37: of:=IF(ISBLANK([$'P1.Perceptible'.D36]);"";[$'P1.Perceptible'.D36]) ->  | E37: of:=IF(ISBLANK([$'P1.Perceptible'.D69]);"";[$'P1.Perceptible'.D69]) ->  | F37: of:=IF(ISBLANK([$'P1.Perceptible'.D102]);"";[$'P1.Perceptible'.D102]) ->  | G37: of:=IF(ISBLANK([$'P1.Perceptible'.D135]);"";[$'P1.Perceptible'.D135]) ->  | H37: of:=IF(ISBLANK([$'P1.Perceptible'.D234]);"";[$'P1.Perceptible'.D234]) ->  | I37: of:=IF(ISBLANK([$'P1.Perceptible'.D267]);"";[$'P1.Perceptible'.D267]) ->  | J37: of:=IF(ISBLANK([$'P1.Perceptible'.D300]);"";[$'P1.Perceptible'.D300]) ->  | K37: of:=IF(ISBLANK([$'P1.Perceptible'.D399]);"";[$'P1.Perceptible'.D399]) ->  | L37: of:=IF(ISBLANK([$'P1.Perceptible'.D432]);"";[$'P1.Perceptible'.D432]) ->  | M37: of:=IF(ISBLANK([$'P2.Operable'.D36]);"";[$'P2.Operable'.D36]) ->  | N37: of:=IF(ISBLANK([$'P2.Operable'.D69]);"";[$'P2.Operable'.D69]) ->  | O37: of:=IF(ISBLANK([$'P2.Operable'.D102]);"";[$'P2.Operable'.D102]) ->  | P37: of:=IF(ISBLANK([$'P2.Operable'.D135]);"";[$'P2.Operable'.D135]) ->  | Q37: of:=IF(ISBLANK([$'P2.Operable'.D168]);"";[$'P2.Operable'.D168]) ->  | R37: of:=IF(ISBLANK([$'P2.Operable'.D201]);"";[$'P2.Operable'.D201]) ->  | S37: of:=IF(ISBLANK([$'P2.Operable'.D234]);"";[$'P2.Operable'.D234]) ->  | T37: of:=IF(ISBLANK([$'P2.Operable'.D267]);"";[$'P2.Operable'.D267]) ->  | U37: of:=IF(ISBLANK([$'P2.Operable'.D300]);"";[$'P2.Operable'.D300]) ->  | V37: of:=IF(ISBLANK([$'P2.Operable'.D333]);"";[$'P2.Operable'.D333]) ->  | W37: of:=IF(ISBLANK([$'P2.Operable'.D465]);"";[$'P2.Operable'.D465]) ->  | X37: of:=IF(ISBLANK([$'P2.Operable'.D498]);"";[$'P2.Operable'.D498]) ->  | Y37: of:=IF(ISBLANK([$'P2.Operable'.D531]);"";[$'P2.Operable'.D531]) ->  | Z37: of:=IF(ISBLANK([$'P2.Operable'.D564]);"";[$'P2.Operable'.D564]) ->  | AA37: of:=IF(ISBLANK([$'P3.Comprensible'.D36]);"";[$'P3.Comprensible'.D36]) ->  | AB37: of:=IF(ISBLANK([$'P3.Comprensible'.D102]);"";[$'P3.Comprensible'.D102]) ->  | AC37: of:=IF(ISBLANK([$'P3.Comprensible'.D135]);"";[$'P3.Comprensible'.D135]) ->  | AD37: of:=IF(ISBLANK([$'P3.Comprensible'.D234]);"";[$'P3.Comprensible'.D234]) ->  | AE37: of:=IF(ISBLANK([$'P3.Comprensible'.D267]);"";[$'P3.Comprensible'.D267]) ->  | AF37: of:=IF(ISBLANK([$'P4.Robusto'.D36]);"";[$'P4.Robusto'.D36]) ->  | AG37: of:=IF(ISBLANK([$'P4.Robusto'.D69]);"";[$'P4.Robusto'.D69]) -> 
B38: of:=IF( ISBLANK([$'03.Muestra'.$C$26]);"";[$'03.Muestra'.$C$26]) ->  | C38: of:=IF( ISBLANK([$'03.Muestra'.$E$26]);"";[$'03.Muestra'.$E$26]) ->  | D38: of:=IF(ISBLANK([$'P1.Perceptible'.D37]);"";[$'P1.Perceptible'.D37]) ->  | E38: of:=IF(ISBLANK([$'P1.Perceptible'.D70]);"";[$'P1.Perceptible'.D70]) ->  | F38: of:=IF(ISBLANK([$'P1.Perceptible'.D103]);"";[$'P1.Perceptible'.D103]) ->  | G38: of:=IF(ISBLANK([$'P1.Perceptible'.D136]);"";[$'P1.Perceptible'.D136]) ->  | H38: of:=IF(ISBLANK([$'P1.Perceptible'.D235]);"";[$'P1.Perceptible'.D235]) ->  | I38: of:=IF(ISBLANK([$'P1.Perceptible'.D268]);"";[$'P1.Perceptible'.D268]) ->  | J38: of:=IF(ISBLANK([$'P1.Perceptible'.D301]);"";[$'P1.Perceptible'.D301]) ->  | K38: of:=IF(ISBLANK([$'P1.Perceptible'.D400]);"";[$'P1.Perceptible'.D400]) ->  | L38: of:=IF(ISBLANK([$'P1.Perceptible'.D433]);"";[$'P1.Perceptible'.D433]) ->  | M38: of:=IF(ISBLANK([$'P2.Operable'.D37]);"";[$'P2.Operable'.D37]) ->  | N38: of:=IF(ISBLANK([$'P2.Operable'.D70]);"";[$'P2.Operable'.D70]) ->  | O38: of:=IF(ISBLANK([$'P2.Operable'.D103]);"";[$'P2.Operable'.D103]) ->  | P38: of:=IF(ISBLANK([$'P2.Operable'.D136]);"";[$'P2.Operable'.D136]) ->  | Q38: of:=IF(ISBLANK([$'P2.Operable'.D169]);"";[$'P2.Operable'.D169]) ->  | R38: of:=IF(ISBLANK([$'P2.Operable'.D202]);"";[$'P2.Operable'.D202]) ->  | S38: of:=IF(ISBLANK([$'P2.Operable'.D235]);"";[$'P2.Operable'.D235]) ->  | T38: of:=IF(ISBLANK([$'P2.Operable'.D268]);"";[$'P2.Operable'.D268]) ->  | U38: of:=IF(ISBLANK([$'P2.Operable'.D301]);"";[$'P2.Operable'.D301]) ->  | V38: of:=IF(ISBLANK([$'P2.Operable'.D334]);"";[$'P2.Operable'.D334]) ->  | W38: of:=IF(ISBLANK([$'P2.Operable'.D466]);"";[$'P2.Operable'.D466]) ->  | X38: of:=IF(ISBLANK([$'P2.Operable'.D499]);"";[$'P2.Operable'.D499]) ->  | Y38: of:=IF(ISBLANK([$'P2.Operable'.D532]);"";[$'P2.Operable'.D532]) ->  | Z38: of:=IF(ISBLANK([$'P2.Operable'.D565]);"";[$'P2.Operable'.D565]) ->  | AA38: of:=IF(ISBLANK([$'P3.Comprensible'.D37]);"";[$'P3.Comprensible'.D37]) ->  | AB38: of:=IF(ISBLANK([$'P3.Comprensible'.D103]);"";[$'P3.Comprensible'.D103]) ->  | AC38: of:=IF(ISBLANK([$'P3.Comprensible'.D136]);"";[$'P3.Comprensible'.D136]) ->  | AD38: of:=IF(ISBLANK([$'P3.Comprensible'.D235]);"";[$'P3.Comprensible'.D235]) ->  | AE38: of:=IF(ISBLANK([$'P3.Comprensible'.D268]);"";[$'P3.Comprensible'.D268]) ->  | AF38: of:=IF(ISBLANK([$'P4.Robusto'.D37]);"";[$'P4.Robusto'.D37]) ->  | AG38: of:=IF(ISBLANK([$'P4.Robusto'.D70]);"";[$'P4.Robusto'.D70]) -> 
B39: of:=IF( ISBLANK([$'03.Muestra'.$C$27]);"";[$'03.Muestra'.$C$27]) ->  | C39: of:=IF( ISBLANK([$'03.Muestra'.$E$27]);"";[$'03.Muestra'.$E$27]) ->  | D39: of:=IF(ISBLANK([$'P1.Perceptible'.D38]);"";[$'P1.Perceptible'.D38]) ->  | E39: of:=IF(ISBLANK([$'P1.Perceptible'.D71]);"";[$'P1.Perceptible'.D71]) ->  | F39: of:=IF(ISBLANK([$'P1.Perceptible'.D104]);"";[$'P1.Perceptible'.D104]) ->  | G39: of:=IF(ISBLANK([$'P1.Perceptible'.D137]);"";[$'P1.Perceptible'.D137]) ->  | H39: of:=IF(ISBLANK([$'P1.Perceptible'.D236]);"";[$'P1.Perceptible'.D236]) ->  | I39: of:=IF(ISBLANK([$'P1.Perceptible'.D269]);"";[$'P1.Perceptible'.D269]) ->  | J39: of:=IF(ISBLANK([$'P1.Perceptible'.D302]);"";[$'P1.Perceptible'.D302]) ->  | K39: of:=IF(ISBLANK([$'P1.Perceptible'.D401]);"";[$'P1.Perceptible'.D401]) ->  | L39: of:=IF(ISBLANK([$'P1.Perceptible'.D434]);"";[$'P1.Perceptible'.D434]) ->  | M39: of:=IF(ISBLANK([$'P2.Operable'.D38]);"";[$'P2.Operable'.D38]) ->  | N39: of:=IF(ISBLANK([$'P2.Operable'.D71]);"";[$'P2.Operable'.D71]) ->  | O39: of:=IF(ISBLANK([$'P2.Operable'.D104]);"";[$'P2.Operable'.D104]) ->  | P39: of:=IF(ISBLANK([$'P2.Operable'.D137]);"";[$'P2.Operable'.D137]) ->  | Q39: of:=IF(ISBLANK([$'P2.Operable'.D170]);"";[$'P2.Operable'.D170]) ->  | R39: of:=IF(ISBLANK([$'P2.Operable'.D203]);"";[$'P2.Operable'.D203]) ->  | S39: of:=IF(ISBLANK([$'P2.Operable'.D236]);"";[$'P2.Operable'.D236]) ->  | T39: of:=IF(ISBLANK([$'P2.Operable'.D269]);"";[$'P2.Operable'.D269]) ->  | U39: of:=IF(ISBLANK([$'P2.Operable'.D302]);"";[$'P2.Operable'.D302]) ->  | V39: of:=IF(ISBLANK([$'P2.Operable'.D335]);"";[$'P2.Operable'.D335]) ->  | W39: of:=IF(ISBLANK([$'P2.Operable'.D467]);"";[$'P2.Operable'.D467]) ->  | X39: of:=IF(ISBLANK([$'P2.Operable'.D500]);"";[$'P2.Operable'.D500]) ->  | Y39: of:=IF(ISBLANK([$'P2.Operable'.D533]);"";[$'P2.Operable'.D533]) ->  | Z39: of:=IF(ISBLANK([$'P2.Operable'.D566]);"";[$'P2.Operable'.D566]) ->  | AA39: of:=IF(ISBLANK([$'P3.Comprensible'.D38]);"";[$'P3.Comprensible'.D38]) ->  | AB39: of:=IF(ISBLANK([$'P3.Comprensible'.D104]);"";[$'P3.Comprensible'.D104]) ->  | AC39: of:=IF(ISBLANK([$'P3.Comprensible'.D137]);"";[$'P3.Comprensible'.D137]) ->  | AD39: of:=IF(ISBLANK([$'P3.Comprensible'.D236]);"";[$'P3.Comprensible'.D236]) ->  | AE39: of:=IF(ISBLANK([$'P3.Comprensible'.D269]);"";[$'P3.Comprensible'.D269]) ->  | AF39: of:=IF(ISBLANK([$'P4.Robusto'.D38]);"";[$'P4.Robusto'.D38]) ->  | AG39: of:=IF(ISBLANK([$'P4.Robusto'.D71]);"";[$'P4.Robusto'.D71]) -> 
B40: of:=IF( ISBLANK([$'03.Muestra'.$C$28]);"";[$'03.Muestra'.$C$28]) ->  | C40: of:=IF( ISBLANK([$'03.Muestra'.$E$28]);"";[$'03.Muestra'.$E$28]) ->  | D40: of:=IF(ISBLANK([$'P1.Perceptible'.D39]);"";[$'P1.Perceptible'.D39]) ->  | E40: of:=IF(ISBLANK([$'P1.Perceptible'.D72]);"";[$'P1.Perceptible'.D72]) ->  | F40: of:=IF(ISBLANK([$'P1.Perceptible'.D105]);"";[$'P1.Perceptible'.D105]) ->  | G40: of:=IF(ISBLANK([$'P1.Perceptible'.D138]);"";[$'P1.Perceptible'.D138]) ->  | H40: of:=IF(ISBLANK([$'P1.Perceptible'.D237]);"";[$'P1.Perceptible'.D237]) ->  | I40: of:=IF(ISBLANK([$'P1.Perceptible'.D270]);"";[$'P1.Perceptible'.D270]) ->  | J40: of:=IF(ISBLANK([$'P1.Perceptible'.D303]);"";[$'P1.Perceptible'.D303]) ->  | K40: of:=IF(ISBLANK([$'P1.Perceptible'.D402]);"";[$'P1.Perceptible'.D402]) ->  | L40: of:=IF(ISBLANK([$'P1.Perceptible'.D435]);"";[$'P1.Perceptible'.D435]) ->  | M40: of:=IF(ISBLANK([$'P2.Operable'.D39]);"";[$'P2.Operable'.D39]) ->  | N40: of:=IF(ISBLANK([$'P2.Operable'.D72]);"";[$'P2.Operable'.D72]) ->  | O40: of:=IF(ISBLANK([$'P2.Operable'.D105]);"";[$'P2.Operable'.D105]) ->  | P40: of:=IF(ISBLANK([$'P2.Operable'.D138]);"";[$'P2.Operable'.D138]) ->  | Q40: of:=IF(ISBLANK([$'P2.Operable'.D171]);"";[$'P2.Operable'.D171]) ->  | R40: of:=IF(ISBLANK([$'P2.Operable'.D204]);"";[$'P2.Operable'.D204]) ->  | S40: of:=IF(ISBLANK([$'P2.Operable'.D237]);"";[$'P2.Operable'.D237]) ->  | T40: of:=IF(ISBLANK([$'P2.Operable'.D270]);"";[$'P2.Operable'.D270]) ->  | U40: of:=IF(ISBLANK([$'P2.Operable'.D303]);"";[$'P2.Operable'.D303]) ->  | V40: of:=IF(ISBLANK([$'P2.Operable'.D336]);"";[$'P2.Operable'.D336]) ->  | W40: of:=IF(ISBLANK([$'P2.Operable'.D468]);"";[$'P2.Operable'.D468]) ->  | X40: of:=IF(ISBLANK([$'P2.Operable'.D501]);"";[$'P2.Operable'.D501]) ->  | Y40: of:=IF(ISBLANK([$'P2.Operable'.D534]);"";[$'P2.Operable'.D534]) ->  | Z40: of:=IF(ISBLANK([$'P2.Operable'.D567]);"";[$'P2.Operable'.D567]) ->  | AA40: of:=IF(ISBLANK([$'P3.Comprensible'.D39]);"";[$'P3.Comprensible'.D39]) ->  | AB40: of:=IF(ISBLANK([$'P3.Comprensible'.D105]);"";[$'P3.Comprensible'.D105]) ->  | AC40: of:=IF(ISBLANK([$'P3.Comprensible'.D138]);"";[$'P3.Comprensible'.D138]) ->  | AD40: of:=IF(ISBLANK([$'P3.Comprensible'.D237]);"";[$'P3.Comprensible'.D237]) ->  | AE40: of:=IF(ISBLANK([$'P3.Comprensible'.D270]);"";[$'P3.Comprensible'.D270]) ->  | AF40: of:=IF(ISBLANK([$'P4.Robusto'.D39]);"";[$'P4.Robusto'.D39]) ->  | AG40: of:=IF(ISBLANK([$'P4.Robusto'.D72]);"";[$'P4.Robusto'.D72]) -> 
B41: of:=IF( ISBLANK([$'03.Muestra'.$C$29]);"";[$'03.Muestra'.$C$29]) ->  | C41: of:=IF( ISBLANK([$'03.Muestra'.$E$29]);"";[$'03.Muestra'.$E$29]) ->  | D41: of:=IF(ISBLANK([$'P1.Perceptible'.D40]);"";[$'P1.Perceptible'.D40]) ->  | E41: of:=IF(ISBLANK([$'P1.Perceptible'.D73]);"";[$'P1.Perceptible'.D73]) ->  | F41: of:=IF(ISBLANK([$'P1.Perceptible'.D106]);"";[$'P1.Perceptible'.D106]) ->  | G41: of:=IF(ISBLANK([$'P1.Perceptible'.D139]);"";[$'P1.Perceptible'.D139]) ->  | H41: of:=IF(ISBLANK([$'P1.Perceptible'.D238]);"";[$'P1.Perceptible'.D238]) ->  | I41: of:=IF(ISBLANK([$'P1.Perceptible'.D271]);"";[$'P1.Perceptible'.D271]) ->  | J41: of:=IF(ISBLANK([$'P1.Perceptible'.D304]);"";[$'P1.Perceptible'.D304]) ->  | K41: of:=IF(ISBLANK([$'P1.Perceptible'.D403]);"";[$'P1.Perceptible'.D403]) ->  | L41: of:=IF(ISBLANK([$'P1.Perceptible'.D436]);"";[$'P1.Perceptible'.D436]) ->  | M41: of:=IF(ISBLANK([$'P2.Operable'.D40]);"";[$'P2.Operable'.D40]) ->  | N41: of:=IF(ISBLANK([$'P2.Operable'.D73]);"";[$'P2.Operable'.D73]) ->  | O41: of:=IF(ISBLANK([$'P2.Operable'.D106]);"";[$'P2.Operable'.D106]) ->  | P41: of:=IF(ISBLANK([$'P2.Operable'.D139]);"";[$'P2.Operable'.D139]) ->  | Q41: of:=IF(ISBLANK([$'P2.Operable'.D172]);"";[$'P2.Operable'.D172]) ->  | R41: of:=IF(ISBLANK([$'P2.Operable'.D205]);"";[$'P2.Operable'.D205]) ->  | S41: of:=IF(ISBLANK([$'P2.Operable'.D238]);"";[$'P2.Operable'.D238]) ->  | T41: of:=IF(ISBLANK([$'P2.Operable'.D271]);"";[$'P2.Operable'.D271]) ->  | U41: of:=IF(ISBLANK([$'P2.Operable'.D304]);"";[$'P2.Operable'.D304]) ->  | V41: of:=IF(ISBLANK([$'P2.Operable'.D337]);"";[$'P2.Operable'.D337]) ->  | W41: of:=IF(ISBLANK([$'P2.Operable'.D469]);"";[$'P2.Operable'.D469]) ->  | X41: of:=IF(ISBLANK([$'P2.Operable'.D502]);"";[$'P2.Operable'.D502]) ->  | Y41: of:=IF(ISBLANK([$'P2.Operable'.D535]);"";[$'P2.Operable'.D535]) ->  | Z41: of:=IF(ISBLANK([$'P2.Operable'.D568]);"";[$'P2.Operable'.D568]) ->  | AA41: of:=IF(ISBLANK([$'P3.Comprensible'.D40]);"";[$'P3.Comprensible'.D40]) ->  | AB41: of:=IF(ISBLANK([$'P3.Comprensible'.D106]);"";[$'P3.Comprensible'.D106]) ->  | AC41: of:=IF(ISBLANK([$'P3.Comprensible'.D139]);"";[$'P3.Comprensible'.D139]) ->  | AD41: of:=IF(ISBLANK([$'P3.Comprensible'.D238]);"";[$'P3.Comprensible'.D238]) ->  | AE41: of:=IF(ISBLANK([$'P3.Comprensible'.D271]);"";[$'P3.Comprensible'.D271]) ->  | AF41: of:=IF(ISBLANK([$'P4.Robusto'.D40]);"";[$'P4.Robusto'.D40]) ->  | AG41: of:=IF(ISBLANK([$'P4.Robusto'.D73]);"";[$'P4.Robusto'.D73]) -> 
B42: of:=IF( ISBLANK([$'03.Muestra'.$C$30]);"";[$'03.Muestra'.$C$30]) ->  | C42: of:=IF( ISBLANK([$'03.Muestra'.$E$30]);"";[$'03.Muestra'.$E$30]) ->  | D42: of:=IF(ISBLANK([$'P1.Perceptible'.D41]);"";[$'P1.Perceptible'.D41]) ->  | E42: of:=IF(ISBLANK([$'P1.Perceptible'.D74]);"";[$'P1.Perceptible'.D74]) ->  | F42: of:=IF(ISBLANK([$'P1.Perceptible'.D107]);"";[$'P1.Perceptible'.D107]) ->  | G42: of:=IF(ISBLANK([$'P1.Perceptible'.D140]);"";[$'P1.Perceptible'.D140]) ->  | H42: of:=IF(ISBLANK([$'P1.Perceptible'.D239]);"";[$'P1.Perceptible'.D239]) ->  | I42: of:=IF(ISBLANK([$'P1.Perceptible'.D272]);"";[$'P1.Perceptible'.D272]) ->  | J42: of:=IF(ISBLANK([$'P1.Perceptible'.D305]);"";[$'P1.Perceptible'.D305]) ->  | K42: of:=IF(ISBLANK([$'P1.Perceptible'.D404]);"";[$'P1.Perceptible'.D404]) ->  | L42: of:=IF(ISBLANK([$'P1.Perceptible'.D437]);"";[$'P1.Perceptible'.D437]) ->  | M42: of:=IF(ISBLANK([$'P2.Operable'.D41]);"";[$'P2.Operable'.D41]) ->  | N42: of:=IF(ISBLANK([$'P2.Operable'.D74]);"";[$'P2.Operable'.D74]) ->  | O42: of:=IF(ISBLANK([$'P2.Operable'.D107]);"";[$'P2.Operable'.D107]) ->  | P42: of:=IF(ISBLANK([$'P2.Operable'.D140]);"";[$'P2.Operable'.D140]) ->  | Q42: of:=IF(ISBLANK([$'P2.Operable'.D173]);"";[$'P2.Operable'.D173]) ->  | R42: of:=IF(ISBLANK([$'P2.Operable'.D206]);"";[$'P2.Operable'.D206]) ->  | S42: of:=IF(ISBLANK([$'P2.Operable'.D239]);"";[$'P2.Operable'.D239]) ->  | T42: of:=IF(ISBLANK([$'P2.Operable'.D272]);"";[$'P2.Operable'.D272]) ->  | U42: of:=IF(ISBLANK([$'P2.Operable'.D305]);"";[$'P2.Operable'.D305]) ->  | V42: of:=IF(ISBLANK([$'P2.Operable'.D338]);"";[$'P2.Operable'.D338]) ->  | W42: of:=IF(ISBLANK([$'P2.Operable'.D470]);"";[$'P2.Operable'.D470]) ->  | X42: of:=IF(ISBLANK([$'P2.Operable'.D503]);"";[$'P2.Operable'.D503]) ->  | Y42: of:=IF(ISBLANK([$'P2.Operable'.D536]);"";[$'P2.Operable'.D536]) ->  | Z42: of:=IF(ISBLANK([$'P2.Operable'.D569]);"";[$'P2.Operable'.D569]) ->  | AA42: of:=IF(ISBLANK([$'P3.Comprensible'.D41]);"";[$'P3.Comprensible'.D41]) ->  | AB42: of:=IF(ISBLANK([$'P3.Comprensible'.D107]);"";[$'P3.Comprensible'.D107]) ->  | AC42: of:=IF(ISBLANK([$'P3.Comprensible'.D140]);"";[$'P3.Comprensible'.D140]) ->  | AD42: of:=IF(ISBLANK([$'P3.Comprensible'.D239]);"";[$'P3.Comprensible'.D239]) ->  | AE42: of:=IF(ISBLANK([$'P3.Comprensible'.D272]);"";[$'P3.Comprensible'.D272]) ->  | AF42: of:=IF(ISBLANK([$'P4.Robusto'.D41]);"";[$'P4.Robusto'.D41]) ->  | AG42: of:=IF(ISBLANK([$'P4.Robusto'.D74]);"";[$'P4.Robusto'.D74]) -> 
B43: of:=IF( ISBLANK([$'03.Muestra'.$C$31]);"";[$'03.Muestra'.$C$31]) ->  | C43: of:=IF( ISBLANK([$'03.Muestra'.$E$31]);"";[$'03.Muestra'.$E$31]) ->  | D43: of:=IF(ISBLANK([$'P1.Perceptible'.D42]);"";[$'P1.Perceptible'.D42]) ->  | E43: of:=IF(ISBLANK([$'P1.Perceptible'.D75]);"";[$'P1.Perceptible'.D75]) ->  | F43: of:=IF(ISBLANK([$'P1.Perceptible'.D108]);"";[$'P1.Perceptible'.D108]) ->  | G43: of:=IF(ISBLANK([$'P1.Perceptible'.D141]);"";[$'P1.Perceptible'.D141]) ->  | H43: of:=IF(ISBLANK([$'P1.Perceptible'.D240]);"";[$'P1.Perceptible'.D240]) ->  | I43: of:=IF(ISBLANK([$'P1.Perceptible'.D273]);"";[$'P1.Perceptible'.D273]) ->  | J43: of:=IF(ISBLANK([$'P1.Perceptible'.D306]);"";[$'P1.Perceptible'.D306]) ->  | K43: of:=IF(ISBLANK([$'P1.Perceptible'.D405]);"";[$'P1.Perceptible'.D405]) ->  | L43: of:=IF(ISBLANK([$'P1.Perceptible'.D438]);"";[$'P1.Perceptible'.D438]) ->  | M43: of:=IF(ISBLANK([$'P2.Operable'.D42]);"";[$'P2.Operable'.D42]) ->  | N43: of:=IF(ISBLANK([$'P2.Operable'.D75]);"";[$'P2.Operable'.D75]) ->  | O43: of:=IF(ISBLANK([$'P2.Operable'.D108]);"";[$'P2.Operable'.D108]) ->  | P43: of:=IF(ISBLANK([$'P2.Operable'.D141]);"";[$'P2.Operable'.D141]) ->  | Q43: of:=IF(ISBLANK([$'P2.Operable'.D174]);"";[$'P2.Operable'.D174]) ->  | R43: of:=IF(ISBLANK([$'P2.Operable'.D207]);"";[$'P2.Operable'.D207]) ->  | S43: of:=IF(ISBLANK([$'P2.Operable'.D240]);"";[$'P2.Operable'.D240]) ->  | T43: of:=IF(ISBLANK([$'P2.Operable'.D273]);"";[$'P2.Operable'.D273]) ->  | U43: of:=IF(ISBLANK([$'P2.Operable'.D306]);"";[$'P2.Operable'.D306]) ->  | V43: of:=IF(ISBLANK([$'P2.Operable'.D339]);"";[$'P2.Operable'.D339]) ->  | W43: of:=IF(ISBLANK([$'P2.Operable'.D471]);"";[$'P2.Operable'.D471]) ->  | X43: of:=IF(ISBLANK([$'P2.Operable'.D504]);"";[$'P2.Operable'.D504]) ->  | Y43: of:=IF(ISBLANK([$'P2.Operable'.D537]);"";[$'P2.Operable'.D537]) ->  | Z43: of:=IF(ISBLANK([$'P2.Operable'.D570]);"";[$'P2.Operable'.D570]) ->  | AA43: of:=IF(ISBLANK([$'P3.Comprensible'.D42]);"";[$'P3.Comprensible'.D42]) ->  | AB43: of:=IF(ISBLANK([$'P3.Comprensible'.D108]);"";[$'P3.Comprensible'.D108]) ->  | AC43: of:=IF(ISBLANK([$'P3.Comprensible'.D141]);"";[$'P3.Comprensible'.D141]) ->  | AD43: of:=IF(ISBLANK([$'P3.Comprensible'.D240]);"";[$'P3.Comprensible'.D240]) ->  | AE43: of:=IF(ISBLANK([$'P3.Comprensible'.D273]);"";[$'P3.Comprensible'.D273]) ->  | AF43: of:=IF(ISBLANK([$'P4.Robusto'.D42]);"";[$'P4.Robusto'.D42]) ->  | AG43: of:=IF(ISBLANK([$'P4.Robusto'.D75]);"";[$'P4.Robusto'.D75]) -> 
B44: of:=IF( ISBLANK([$'03.Muestra'.$C$32]);"";[$'03.Muestra'.$C$32]) ->  | C44: of:=IF( ISBLANK([$'03.Muestra'.$E$32]);"";[$'03.Muestra'.$E$32]) ->  | D44: of:=IF(ISBLANK([$'P1.Perceptible'.D43]);"";[$'P1.Perceptible'.D43]) ->  | E44: of:=IF(ISBLANK([$'P1.Perceptible'.D76]);"";[$'P1.Perceptible'.D76]) ->  | F44: of:=IF(ISBLANK([$'P1.Perceptible'.D109]);"";[$'P1.Perceptible'.D109]) ->  | G44: of:=IF(ISBLANK([$'P1.Perceptible'.D142]);"";[$'P1.Perceptible'.D142]) ->  | H44: of:=IF(ISBLANK([$'P1.Perceptible'.D241]);"";[$'P1.Perceptible'.D241]) ->  | I44: of:=IF(ISBLANK([$'P1.Perceptible'.D274]);"";[$'P1.Perceptible'.D274]) ->  | J44: of:=IF(ISBLANK([$'P1.Perceptible'.D307]);"";[$'P1.Perceptible'.D307]) ->  | K44: of:=IF(ISBLANK([$'P1.Perceptible'.D406]);"";[$'P1.Perceptible'.D406]) ->  | L44: of:=IF(ISBLANK([$'P1.Perceptible'.D439]);"";[$'P1.Perceptible'.D439]) ->  | M44: of:=IF(ISBLANK([$'P2.Operable'.D43]);"";[$'P2.Operable'.D43]) ->  | N44: of:=IF(ISBLANK([$'P2.Operable'.D76]);"";[$'P2.Operable'.D76]) ->  | O44: of:=IF(ISBLANK([$'P2.Operable'.D109]);"";[$'P2.Operable'.D109]) ->  | P44: of:=IF(ISBLANK([$'P2.Operable'.D142]);"";[$'P2.Operable'.D142]) ->  | Q44: of:=IF(ISBLANK([$'P2.Operable'.D175]);"";[$'P2.Operable'.D175]) ->  | R44: of:=IF(ISBLANK([$'P2.Operable'.D208]);"";[$'P2.Operable'.D208]) ->  | S44: of:=IF(ISBLANK([$'P2.Operable'.D241]);"";[$'P2.Operable'.D241]) ->  | T44: of:=IF(ISBLANK([$'P2.Operable'.D274]);"";[$'P2.Operable'.D274]) ->  | U44: of:=IF(ISBLANK([$'P2.Operable'.D307]);"";[$'P2.Operable'.D307]) ->  | V44: of:=IF(ISBLANK([$'P2.Operable'.D340]);"";[$'P2.Operable'.D340]) ->  | W44: of:=IF(ISBLANK([$'P2.Operable'.D472]);"";[$'P2.Operable'.D472]) ->  | X44: of:=IF(ISBLANK([$'P2.Operable'.D505]);"";[$'P2.Operable'.D505]) ->  | Y44: of:=IF(ISBLANK([$'P2.Operable'.D538]);"";[$'P2.Operable'.D538]) ->  | Z44: of:=IF(ISBLANK([$'P2.Operable'.D571]);"";[$'P2.Operable'.D571]) ->  | AA44: of:=IF(ISBLANK([$'P3.Comprensible'.D43]);"";[$'P3.Comprensible'.D43]) ->  | AB44: of:=IF(ISBLANK([$'P3.Comprensible'.D109]);"";[$'P3.Comprensible'.D109]) ->  | AC44: of:=IF(ISBLANK([$'P3.Comprensible'.D142]);"";[$'P3.Comprensible'.D142]) ->  | AD44: of:=IF(ISBLANK([$'P3.Comprensible'.D241]);"";[$'P3.Comprensible'.D241]) ->  | AE44: of:=IF(ISBLANK([$'P3.Comprensible'.D274]);"";[$'P3.Comprensible'.D274]) ->  | AF44: of:=IF(ISBLANK([$'P4.Robusto'.D43]);"";[$'P4.Robusto'.D43]) ->  | AG44: of:=IF(ISBLANK([$'P4.Robusto'.D76]);"";[$'P4.Robusto'.D76]) -> 
B45: of:=IF( ISBLANK([$'03.Muestra'.$C$33]);"";[$'03.Muestra'.$C$33]) ->  | C45: of:=IF( ISBLANK([$'03.Muestra'.$E$33]);"";[$'03.Muestra'.$E$33]) ->  | D45: of:=IF(ISBLANK([$'P1.Perceptible'.D44]);"";[$'P1.Perceptible'.D44]) ->  | E45: of:=IF(ISBLANK([$'P1.Perceptible'.D77]);"";[$'P1.Perceptible'.D77]) ->  | F45: of:=IF(ISBLANK([$'P1.Perceptible'.D110]);"";[$'P1.Perceptible'.D110]) ->  | G45: of:=IF(ISBLANK([$'P1.Perceptible'.D143]);"";[$'P1.Perceptible'.D143]) ->  | H45: of:=IF(ISBLANK([$'P1.Perceptible'.D242]);"";[$'P1.Perceptible'.D242]) ->  | I45: of:=IF(ISBLANK([$'P1.Perceptible'.D275]);"";[$'P1.Perceptible'.D275]) ->  | J45: of:=IF(ISBLANK([$'P1.Perceptible'.D308]);"";[$'P1.Perceptible'.D308]) ->  | K45: of:=IF(ISBLANK([$'P1.Perceptible'.D407]);"";[$'P1.Perceptible'.D407]) ->  | L45: of:=IF(ISBLANK([$'P1.Perceptible'.D440]);"";[$'P1.Perceptible'.D440]) ->  | M45: of:=IF(ISBLANK([$'P2.Operable'.D44]);"";[$'P2.Operable'.D44]) ->  | N45: of:=IF(ISBLANK([$'P2.Operable'.D77]);"";[$'P2.Operable'.D77]) ->  | O45: of:=IF(ISBLANK([$'P2.Operable'.D110]);"";[$'P2.Operable'.D110]) ->  | P45: of:=IF(ISBLANK([$'P2.Operable'.D143]);"";[$'P2.Operable'.D143]) ->  | Q45: of:=IF(ISBLANK([$'P2.Operable'.D176]);"";[$'P2.Operable'.D176]) ->  | R45: of:=IF(ISBLANK([$'P2.Operable'.D209]);"";[$'P2.Operable'.D209]) ->  | S45: of:=IF(ISBLANK([$'P2.Operable'.D242]);"";[$'P2.Operable'.D242]) ->  | T45: of:=IF(ISBLANK([$'P2.Operable'.D275]);"";[$'P2.Operable'.D275]) ->  | U45: of:=IF(ISBLANK([$'P2.Operable'.D308]);"";[$'P2.Operable'.D308]) ->  | V45: of:=IF(ISBLANK([$'P2.Operable'.D341]);"";[$'P2.Operable'.D341]) ->  | W45: of:=IF(ISBLANK([$'P2.Operable'.D473]);"";[$'P2.Operable'.D473]) ->  | X45: of:=IF(ISBLANK([$'P2.Operable'.D506]);"";[$'P2.Operable'.D506]) ->  | Y45: of:=IF(ISBLANK([$'P2.Operable'.D539]);"";[$'P2.Operable'.D539]) ->  | Z45: of:=IF(ISBLANK([$'P2.Operable'.D572]);"";[$'P2.Operable'.D572]) ->  | AA45: of:=IF(ISBLANK([$'P3.Comprensible'.D44]);"";[$'P3.Comprensible'.D44]) ->  | AB45: of:=IF(ISBLANK([$'P3.Comprensible'.D110]);"";[$'P3.Comprensible'.D110]) ->  | AC45: of:=IF(ISBLANK([$'P3.Comprensible'.D143]);"";[$'P3.Comprensible'.D143]) ->  | AD45: of:=IF(ISBLANK([$'P3.Comprensible'.D242]);"";[$'P3.Comprensible'.D242]) ->  | AE45: of:=IF(ISBLANK([$'P3.Comprensible'.D275]);"";[$'P3.Comprensible'.D275]) ->  | AF45: of:=IF(ISBLANK([$'P4.Robusto'.D44]);"";[$'P4.Robusto'.D44]) ->  | AG45: of:=IF(ISBLANK([$'P4.Robusto'.D77]);"";[$'P4.Robusto'.D77]) -> 
B46: of:=IF( ISBLANK([$'03.Muestra'.$C$34]);"";[$'03.Muestra'.$C$34]) ->  | C46: of:=IF( ISBLANK([$'03.Muestra'.$E$34]);"";[$'03.Muestra'.$E$34]) ->  | D46: of:=IF(ISBLANK([$'P1.Perceptible'.D45]);"";[$'P1.Perceptible'.D45]) ->  | E46: of:=IF(ISBLANK([$'P1.Perceptible'.D78]);"";[$'P1.Perceptible'.D78]) ->  | F46: of:=IF(ISBLANK([$'P1.Perceptible'.D111]);"";[$'P1.Perceptible'.D111]) ->  | G46: of:=IF(ISBLANK([$'P1.Perceptible'.D144]);"";[$'P1.Perceptible'.D144]) ->  | H46: of:=IF(ISBLANK([$'P1.Perceptible'.D243]);"";[$'P1.Perceptible'.D243]) ->  | I46: of:=IF(ISBLANK([$'P1.Perceptible'.D276]);"";[$'P1.Perceptible'.D276]) ->  | J46: of:=IF(ISBLANK([$'P1.Perceptible'.D309]);"";[$'P1.Perceptible'.D309]) ->  | K46: of:=IF(ISBLANK([$'P1.Perceptible'.D408]);"";[$'P1.Perceptible'.D408]) ->  | L46: of:=IF(ISBLANK([$'P1.Perceptible'.D441]);"";[$'P1.Perceptible'.D441]) ->  | M46: of:=IF(ISBLANK([$'P2.Operable'.D45]);"";[$'P2.Operable'.D45]) ->  | N46: of:=IF(ISBLANK([$'P2.Operable'.D78]);"";[$'P2.Operable'.D78]) ->  | O46: of:=IF(ISBLANK([$'P2.Operable'.D111]);"";[$'P2.Operable'.D111]) ->  | P46: of:=IF(ISBLANK([$'P2.Operable'.D144]);"";[$'P2.Operable'.D144]) ->  | Q46: of:=IF(ISBLANK([$'P2.Operable'.D177]);"";[$'P2.Operable'.D177]) ->  | R46: of:=IF(ISBLANK([$'P2.Operable'.D210]);"";[$'P2.Operable'.D210]) ->  | S46: of:=IF(ISBLANK([$'P2.Operable'.D243]);"";[$'P2.Operable'.D243]) ->  | T46: of:=IF(ISBLANK([$'P2.Operable'.D276]);"";[$'P2.Operable'.D276]) ->  | U46: of:=IF(ISBLANK([$'P2.Operable'.D309]);"";[$'P2.Operable'.D309]) ->  | V46: of:=IF(ISBLANK([$'P2.Operable'.D342]);"";[$'P2.Operable'.D342]) ->  | W46: of:=IF(ISBLANK([$'P2.Operable'.D474]);"";[$'P2.Operable'.D474]) ->  | X46: of:=IF(ISBLANK([$'P2.Operable'.D507]);"";[$'P2.Operable'.D507]) ->  | Y46: of:=IF(ISBLANK([$'P2.Operable'.D540]);"";[$'P2.Operable'.D540]) ->  | Z46: of:=IF(ISBLANK([$'P2.Operable'.D573]);"";[$'P2.Operable'.D573]) ->  | AA46: of:=IF(ISBLANK([$'P3.Comprensible'.D45]);"";[$'P3.Comprensible'.D45]) ->  | AB46: of:=IF(ISBLANK([$'P3.Comprensible'.D111]);"";[$'P3.Comprensible'.D111]) ->  | AC46: of:=IF(ISBLANK([$'P3.Comprensible'.D144]);"";[$'P3.Comprensible'.D144]) ->  | AD46: of:=IF(ISBLANK([$'P3.Comprensible'.D243]);"";[$'P3.Comprensible'.D243]) ->  | AE46: of:=IF(ISBLANK([$'P3.Comprensible'.D276]);"";[$'P3.Comprensible'.D276]) ->  | AF46: of:=IF(ISBLANK([$'P4.Robusto'.D45]);"";[$'P4.Robusto'.D45]) ->  | AG46: of:=IF(ISBLANK([$'P4.Robusto'.D78]);"";[$'P4.Robusto'.D78]) -> 
B47: of:=IF( ISBLANK([$'03.Muestra'.$C$35]);"";[$'03.Muestra'.$C$35]) ->  | C47: of:=IF( ISBLANK([$'03.Muestra'.$E$35]);"";[$'03.Muestra'.$E$35]) ->  | D47: of:=IF(ISBLANK([$'P1.Perceptible'.D46]);"";[$'P1.Perceptible'.D46]) ->  | E47: of:=IF(ISBLANK([$'P1.Perceptible'.D79]);"";[$'P1.Perceptible'.D79]) ->  | F47: of:=IF(ISBLANK([$'P1.Perceptible'.D112]);"";[$'P1.Perceptible'.D112]) ->  | G47: of:=IF(ISBLANK([$'P1.Perceptible'.D145]);"";[$'P1.Perceptible'.D145]) ->  | H47: of:=IF(ISBLANK([$'P1.Perceptible'.D244]);"";[$'P1.Perceptible'.D244]) ->  | I47: of:=IF(ISBLANK([$'P1.Perceptible'.D277]);"";[$'P1.Perceptible'.D277]) ->  | J47: of:=IF(ISBLANK([$'P1.Perceptible'.D310]);"";[$'P1.Perceptible'.D310]) ->  | K47: of:=IF(ISBLANK([$'P1.Perceptible'.D409]);"";[$'P1.Perceptible'.D409]) ->  | L47: of:=IF(ISBLANK([$'P1.Perceptible'.D442]);"";[$'P1.Perceptible'.D442]) ->  | M47: of:=IF(ISBLANK([$'P2.Operable'.D46]);"";[$'P2.Operable'.D46]) ->  | N47: of:=IF(ISBLANK([$'P2.Operable'.D79]);"";[$'P2.Operable'.D79]) ->  | O47: of:=IF(ISBLANK([$'P2.Operable'.D112]);"";[$'P2.Operable'.D112]) ->  | P47: of:=IF(ISBLANK([$'P2.Operable'.D145]);"";[$'P2.Operable'.D145]) ->  | Q47: of:=IF(ISBLANK([$'P2.Operable'.D178]);"";[$'P2.Operable'.D178]) ->  | R47: of:=IF(ISBLANK([$'P2.Operable'.D211]);"";[$'P2.Operable'.D211]) ->  | S47: of:=IF(ISBLANK([$'P2.Operable'.D244]);"";[$'P2.Operable'.D244]) ->  | T47: of:=IF(ISBLANK([$'P2.Operable'.D277]);"";[$'P2.Operable'.D277]) ->  | U47: of:=IF(ISBLANK([$'P2.Operable'.D310]);"";[$'P2.Operable'.D310]) ->  | V47: of:=IF(ISBLANK([$'P2.Operable'.D343]);"";[$'P2.Operable'.D343]) ->  | W47: of:=IF(ISBLANK([$'P2.Operable'.D475]);"";[$'P2.Operable'.D475]) ->  | X47: of:=IF(ISBLANK([$'P2.Operable'.D508]);"";[$'P2.Operable'.D508]) ->  | Y47: of:=IF(ISBLANK([$'P2.Operable'.D541]);"";[$'P2.Operable'.D541]) ->  | Z47: of:=IF(ISBLANK([$'P2.Operable'.D574]);"";[$'P2.Operable'.D574]) ->  | AA47: of:=IF(ISBLANK([$'P3.Comprensible'.D46]);"";[$'P3.Comprensible'.D46]) ->  | AB47: of:=IF(ISBLANK([$'P3.Comprensible'.D112]);"";[$'P3.Comprensible'.D112]) ->  | AC47: of:=IF(ISBLANK([$'P3.Comprensible'.D145]);"";[$'P3.Comprensible'.D145]) ->  | AD47: of:=IF(ISBLANK([$'P3.Comprensible'.D244]);"";[$'P3.Comprensible'.D244]) ->  | AE47: of:=IF(ISBLANK([$'P3.Comprensible'.D277]);"";[$'P3.Comprensible'.D277]) ->  | AF47: of:=IF(ISBLANK([$'P4.Robusto'.D46]);"";[$'P4.Robusto'.D46]) ->  | AG47: of:=IF(ISBLANK([$'P4.Robusto'.D79]);"";[$'P4.Robusto'.D79]) -> 
B48: of:=IF( ISBLANK([$'03.Muestra'.$C$36]);"";[$'03.Muestra'.$C$36]) ->  | C48: of:=IF( ISBLANK([$'03.Muestra'.$E$36]);"";[$'03.Muestra'.$E$36]) ->  | D48: of:=IF(ISBLANK([$'P1.Perceptible'.D47]);"";[$'P1.Perceptible'.D47]) ->  | E48: of:=IF(ISBLANK([$'P1.Perceptible'.D80]);"";[$'P1.Perceptible'.D80]) ->  | F48: of:=IF(ISBLANK([$'P1.Perceptible'.D113]);"";[$'P1.Perceptible'.D113]) ->  | G48: of:=IF(ISBLANK([$'P1.Perceptible'.D146]);"";[$'P1.Perceptible'.D146]) ->  | H48: of:=IF(ISBLANK([$'P1.Perceptible'.D245]);"";[$'P1.Perceptible'.D245]) ->  | I48: of:=IF(ISBLANK([$'P1.Perceptible'.D278]);"";[$'P1.Perceptible'.D278]) ->  | J48: of:=IF(ISBLANK([$'P1.Perceptible'.D311]);"";[$'P1.Perceptible'.D311]) ->  | K48: of:=IF(ISBLANK([$'P1.Perceptible'.D410]);"";[$'P1.Perceptible'.D410]) ->  | L48: of:=IF(ISBLANK([$'P1.Perceptible'.D443]);"";[$'P1.Perceptible'.D443]) ->  | M48: of:=IF(ISBLANK([$'P2.Operable'.D47]);"";[$'P2.Operable'.D47]) ->  | N48: of:=IF(ISBLANK([$'P2.Operable'.D80]);"";[$'P2.Operable'.D80]) ->  | O48: of:=IF(ISBLANK([$'P2.Operable'.D113]);"";[$'P2.Operable'.D113]) ->  | P48: of:=IF(ISBLANK([$'P2.Operable'.D146]);"";[$'P2.Operable'.D146]) ->  | Q48: of:=IF(ISBLANK([$'P2.Operable'.D179]);"";[$'P2.Operable'.D179]) ->  | R48: of:=IF(ISBLANK([$'P2.Operable'.D212]);"";[$'P2.Operable'.D212]) ->  | S48: of:=IF(ISBLANK([$'P2.Operable'.D245]);"";[$'P2.Operable'.D245]) ->  | T48: of:=IF(ISBLANK([$'P2.Operable'.D278]);"";[$'P2.Operable'.D278]) ->  | U48: of:=IF(ISBLANK([$'P2.Operable'.D311]);"";[$'P2.Operable'.D311]) ->  | V48: of:=IF(ISBLANK([$'P2.Operable'.D344]);"";[$'P2.Operable'.D344]) ->  | W48: of:=IF(ISBLANK([$'P2.Operable'.D476]);"";[$'P2.Operable'.D476]) ->  | X48: of:=IF(ISBLANK([$'P2.Operable'.D509]);"";[$'P2.Operable'.D509]) ->  | Y48: of:=IF(ISBLANK([$'P2.Operable'.D542]);"";[$'P2.Operable'.D542]) ->  | Z48: of:=IF(ISBLANK([$'P2.Operable'.D575]);"";[$'P2.Operable'.D575]) ->  | AA48: of:=IF(ISBLANK([$'P3.Comprensible'.D47]);"";[$'P3.Comprensible'.D47]) ->  | AB48: of:=IF(ISBLANK([$'P3.Comprensible'.D113]);"";[$'P3.Comprensible'.D113]) ->  | AC48: of:=IF(ISBLANK([$'P3.Comprensible'.D146]);"";[$'P3.Comprensible'.D146]) ->  | AD48: of:=IF(ISBLANK([$'P3.Comprensible'.D245]);"";[$'P3.Comprensible'.D245]) ->  | AE48: of:=IF(ISBLANK([$'P3.Comprensible'.D278]);"";[$'P3.Comprensible'.D278]) ->  | AF48: of:=IF(ISBLANK([$'P4.Robusto'.D47]);"";[$'P4.Robusto'.D47]) ->  | AG48: of:=IF(ISBLANK([$'P4.Robusto'.D80]);"";[$'P4.Robusto'.D80]) -> 
B49: of:=IF( ISBLANK([$'03.Muestra'.$C$37]);"";[$'03.Muestra'.$C$37]) ->  | C49: of:=IF( ISBLANK([$'03.Muestra'.$E$37]);"";[$'03.Muestra'.$E$37]) ->  | D49: of:=IF(ISBLANK([$'P1.Perceptible'.D48]);"";[$'P1.Perceptible'.D48]) ->  | E49: of:=IF(ISBLANK([$'P1.Perceptible'.D81]);"";[$'P1.Perceptible'.D81]) ->  | F49: of:=IF(ISBLANK([$'P1.Perceptible'.D114]);"";[$'P1.Perceptible'.D114]) ->  | G49: of:=IF(ISBLANK([$'P1.Perceptible'.D147]);"";[$'P1.Perceptible'.D147]) ->  | H49: of:=IF(ISBLANK([$'P1.Perceptible'.D246]);"";[$'P1.Perceptible'.D246]) ->  | I49: of:=IF(ISBLANK([$'P1.Perceptible'.D279]);"";[$'P1.Perceptible'.D279]) ->  | J49: of:=IF(ISBLANK([$'P1.Perceptible'.D312]);"";[$'P1.Perceptible'.D312]) ->  | K49: of:=IF(ISBLANK([$'P1.Perceptible'.D411]);"";[$'P1.Perceptible'.D411]) ->  | L49: of:=IF(ISBLANK([$'P1.Perceptible'.D444]);"";[$'P1.Perceptible'.D444]) ->  | M49: of:=IF(ISBLANK([$'P2.Operable'.D48]);"";[$'P2.Operable'.D48]) ->  | N49: of:=IF(ISBLANK([$'P2.Operable'.D81]);"";[$'P2.Operable'.D81]) ->  | O49: of:=IF(ISBLANK([$'P2.Operable'.D114]);"";[$'P2.Operable'.D114]) ->  | P49: of:=IF(ISBLANK([$'P2.Operable'.D147]);"";[$'P2.Operable'.D147]) ->  | Q49: of:=IF(ISBLANK([$'P2.Operable'.D180]);"";[$'P2.Operable'.D180]) ->  | R49: of:=IF(ISBLANK([$'P2.Operable'.D213]);"";[$'P2.Operable'.D213]) ->  | S49: of:=IF(ISBLANK([$'P2.Operable'.D246]);"";[$'P2.Operable'.D246]) ->  | T49: of:=IF(ISBLANK([$'P2.Operable'.D279]);"";[$'P2.Operable'.D279]) ->  | U49: of:=IF(ISBLANK([$'P2.Operable'.D312]);"";[$'P2.Operable'.D312]) ->  | V49: of:=IF(ISBLANK([$'P2.Operable'.D345]);"";[$'P2.Operable'.D345]) ->  | W49: of:=IF(ISBLANK([$'P2.Operable'.D477]);"";[$'P2.Operable'.D477]) ->  | X49: of:=IF(ISBLANK([$'P2.Operable'.D510]);"";[$'P2.Operable'.D510]) ->  | Y49: of:=IF(ISBLANK([$'P2.Operable'.D543]);"";[$'P2.Operable'.D543]) ->  | Z49: of:=IF(ISBLANK([$'P2.Operable'.D576]);"";[$'P2.Operable'.D576]) ->  | AA49: of:=IF(ISBLANK([$'P3.Comprensible'.D48]);"";[$'P3.Comprensible'.D48]) ->  | AB49: of:=IF(ISBLANK([$'P3.Comprensible'.D114]);"";[$'P3.Comprensible'.D114]) ->  | AC49: of:=IF(ISBLANK([$'P3.Comprensible'.D147]);"";[$'P3.Comprensible'.D147]) ->  | AD49: of:=IF(ISBLANK([$'P3.Comprensible'.D246]);"";[$'P3.Comprensible'.D246]) ->  | AE49: of:=IF(ISBLANK([$'P3.Comprensible'.D279]);"";[$'P3.Comprensible'.D279]) ->  | AF49: of:=IF(ISBLANK([$'P4.Robusto'.D48]);"";[$'P4.Robusto'.D48]) ->  | AG49: of:=IF(ISBLANK([$'P4.Robusto'.D81]);"";[$'P4.Robusto'.D81]) -> 
C50: SITIO WEB | D50: of:=IF (COUNTIF([$'P1.Perceptible'.E19:$'P1.Perceptible'.E48];"ERR")>0;"ERROR";      IF(COUNTIF([.D20:.D49];"N/T")>0 ; "EN CURSO";         IF (COUNTIF([.D20:.D49];"N/D") > 0;"EN CURSO";              IF (COUNTIF([.$C$20:.$C$49]; "<>") <> COUNTIF([.D20:.D49];"<>");"EN CURSO" ;  IF(COUNTIF([.$C$20:.$C$49]; "<>") = COUNTIF([.D20:.D49];"N/A"); "N/A";                   IF(COUNTIF([.D20:.D49];"Falla")>([$'DATA - Oculta'.$C$25]*((COUNTIF([.D20:.D49];"Pasa")+COUNTIF([.D20:.D49];"Falla"))));                 "NO CONFORME";"CONFORME")))))) -> N/A | E50: of:=IF (COUNTIF([$'P1.Perceptible'.$E52:$'P1.Perceptible'.$E81];"ERR")>0;"ERROR";      IF(COUNTIF([.E20:.E49];"N/T")>0 ; "EN CURSO";         IF (COUNTIF([.E20:.E49];"N/D") > 0;"EN CURSO";              IF (COUNTIF([.$C$20:.$C$49]; "<>") <> COUNTIF([.E20:.E49];"<>");"EN CURSO" ;  IF(COUNTIF([.$C$20:.$C$49]; "<>") = COUNTIF([.E20:.E49];"N/A"); "N/A";                   IF(COUNTIF([.E20:.E49];"Falla")>([$'DATA - Oculta'.$C$25]*((COUNTIF([.E20:.E49];"Pasa")+COUNTIF([.E20:.E49];"Falla"))));                 "NO CONFORME";"CONFORME")))))) -> N/A | F50: of:=IF (COUNTIF([$'P1.Perceptible'.$E85:$'P1.Perceptible'.$E114];"ERR")>0;"ERROR";      IF(COUNTIF([.F20:.F49];"N/T")>0 ; "EN CURSO";         IF (COUNTIF([.F20:.F49];"N/D") > 0;"EN CURSO";              IF (COUNTIF([.$C$20:.$C$49]; "<>") <> COUNTIF([.F20:.F49];"<>");"EN CURSO" ;  IF(COUNTIF([.$C$20:.$C$49]; "<>") = COUNTIF([.F20:.F49];"N/A"); "N/A";                   IF(COUNTIF([.F20:.F49];"Falla")>([$'DATA - Oculta'.$C$25]*((COUNTIF([.F20:.F49];"Pasa")+COUNTIF([.F20:.F49];"Falla"))));                 "NO CONFORME";"CONFORME")))))) -> N/A | G50: of:=IF (COUNTIF([$'P1.Perceptible'.$E118:$'P1.Perceptible'.$E147];"ERR")>0;"ERROR";      IF(COUNTIF([.G20:.G49];"N/T")>0 ; "EN CURSO";         IF (COUNTIF([.G20:.G49];"N/D") > 0;"EN CURSO";              IF (COUNTIF([.$C$20:.$C$49]; "<>") <> COUNTIF([.G20:.G49];"<>");"EN CURSO" ;  IF(COUNTIF([.$C$20:.$C$49]; "<>") = COUNTIF([.G20:.G49];"N/A"); "N/A";                   IF(COUNTIF([.G20:.G49];"Falla")>([$'DATA - Oculta'.$C$25]*((COUNTIF([.G20:.G49];"Pasa")+COUNTIF([.G20:.G49];"Falla"))));                 "NO CONFORME";"CONFORME")))))) -> N/A | H50: of:=IF (COUNTIF([$'P1.Perceptible'.$E217:$'P1.Perceptible'.$E246];"ERR")>0;"ERROR";      IF(COUNTIF([.H20:.H49];"N/T")>0 ; "EN CURSO";         IF (COUNTIF([.H20:.H49];"N/D") > 0;"EN CURSO";              IF (COUNTIF([.$C$20:.$C$49]; "<>") <> COUNTIF([.H20:.H49];"<>");"EN CURSO" ;  IF(COUNTIF([.$C$20:.$C$49]; "<>") = COUNTIF([.H20:.H49];"N/A"); "N/A";                   IF(COUNTIF([.H20:.H49];"Falla")>([$'DATA - Oculta'.$C$25]*((COUNTIF([.H20:.H49];"Pasa")+COUNTIF([.H20:.H49];"Falla"))));                 "NO CONFORME";"CONFORME")))))) -> N/A | I50: of:=IF (COUNTIF([$'P1.Perceptible'.$E250:$'P1.Perceptible'.$E279];"ERR")>0;"ERROR";      IF(COUNTIF([.I20:.I49];"N/T")>0 ; "EN CURSO";         IF (COUNTIF([.I20:.I49];"N/D") > 0;"EN CURSO";              IF (COUNTIF([.$C$20:.$C$49]; "<>") <> COUNTIF([.I20:.I49];"<>");"EN CURSO" ;  IF(COUNTIF([.$C$20:.$C$49]; "<>") = COUNTIF([.I20:.I49];"N/A"); "N/A";                   IF(COUNTIF([.I20:.I49];"Falla")>([$'DATA - Oculta'.$C$25]*((COUNTIF([.I20:.I49];"Pasa")+COUNTIF([.I20:.I49];"Falla"))));                 "NO CONFORME";"CONFORME")))))) -> N/A | J50: of:=IF (COUNTIF([$'P1.Perceptible'.$E283:$'P1.Perceptible'.$E312];"ERR")>0;"ERROR";      IF(COUNTIF([.J20:.J49];"N/T")>0 ; "EN CURSO";         IF (COUNTIF([.J20:.J49];"N/D") > 0;"EN CURSO";              IF (COUNTIF([.$C$20:.$C$49]; "<>") <> COUNTIF([.J20:.J49];"<>");"EN CURSO" ;  IF(COUNTIF([.$C$20:.$C$49]; "<>") = COUNTIF([.J20:.J49];"N/A"); "N/A";                   IF(COUNTIF([.J20:.J49];"Falla")>([$'DATA - Oculta'.$C$25]*((COUNTIF([.J20:.J49];"Pasa")+COUNTIF([.J20:.J49];"Falla"))));                 "NO CONFORME";"CONFORME")))))) -> N/A | K50: of:=IF (COUNTIF([$'P1.Perceptible'.$E382:$'P1.Perceptible'.$E411];"ERR")>0;"ERROR";      IF(COUNTIF([.K20:.K49];"N/T")>0 ; "EN CURSO";         IF (COUNTIF([.K20:.K49];"N/D") > 0;"EN CURSO";              IF (COUNTIF([.$C$20:.$C$49]; "<>") <> COUNTIF([.K20:.K49];"<>");"EN CURSO" ;  IF(COUNTIF([.$C$20:.$C$49]; "<>") = COUNTIF([.K20:.K49];"N/A"); "N/A";                   IF(COUNTIF([.K20:.K49];"Falla")>([$'DATA - Oculta'.$C$25]*((COUNTIF([.K20:.K49];"Pasa")+COUNTIF([.K20:.K49];"Falla"))));                 "NO CONFORME";"CONFORME")))))) -> N/A | L50: of:=IF (COUNTIF([$'P1.Perceptible'.$E415:$'P1.Perceptible'.$E444];"ERR")>0;"ERROR";      IF(COUNTIF([.L20:.L49];"N/T")>0 ; "EN CURSO";         IF (COUNTIF([.L20:.L49];"N/D") > 0;"EN CURSO";              IF (COUNTIF([.$C$20:.$C$49]; "<>") <> COUNTIF([.L20:.L49];"<>");"EN CURSO" ;  IF(COUNTIF([.$C$20:.$C$49]; "<>") = COUNTIF([.L20:.L49];"N/A"); "N/A";                   IF(COUNTIF([.L20:.L49];"Falla")>([$'DATA - Oculta'.$C$25]*((COUNTIF([.L20:.L49];"Pasa")+COUNTIF([.L20:.L49];"Falla"))));                 "NO CONFORME";"CONFORME")))))) -> N/A | M50: of:=IF (COUNTIF([$'P2.Operable'.$E19:$'P2.Operable'.$E48];"ERR")>0;"ERROR";      IF(COUNTIF([.M20:.M49];"N/T")>0 ; "EN CURSO";         IF (COUNTIF([.M20:.M49];"N/D") > 0;"EN CURSO";              IF (COUNTIF([.$C$20:.$C$49]; "<>") <> COUNTIF([.M20:.M49];"<>");"EN CURSO" ;  IF(COUNTIF([.$C$20:.$C$49]; "<>") = COUNTIF([.M20:.M49];"N/A"); "N/A";                   IF(COUNTIF([.M20:.M49];"Falla")>([$'DATA - Oculta'.$C$25]*((COUNTIF([.M20:.M49];"Pasa")+COUNTIF([.M20:.M49];"Falla"))));                 "NO CONFORME";"CONFORME")))))) -> N/A | N50: of:=IF (COUNTIF([$'P2.Operable'.$E52:$'P2.Operable'.$E81];"ERR")>0;"ERROR";      IF(COUNTIF([.N20:.N49];"N/T")>0 ; "EN CURSO";         IF (COUNTIF([.N20:.N49];"N/D") > 0;"EN CURSO";              IF (COUNTIF([.$C$20:.$C$49]; "<>") <> COUNTIF([.N20:.N49];"<>");"EN CURSO" ;  IF(COUNTIF([.$C$20:.$C$49]; "<>") = COUNTIF([.N20:.N49];"N/A"); "N/A";                   IF(COUNTIF([.N20:.N49];"Falla")>([$'DATA - Oculta'.$C$25]*((COUNTIF([.N20:.N49];"Pasa")+COUNTIF([.N20:.N49];"Falla"))));                 "NO CONFORME";"CONFORME")))))) -> N/A | O50: of:=IF (COUNTIF([$'P2.Operable'.$E85:$'P2.Operable'.$E114];"ERR")>0;"ERROR";      IF(COUNTIF([.O20:.O49];"N/T")>0 ; "EN CURSO";         IF (COUNTIF([.O20:.O49];"N/D") > 0;"EN CURSO";              IF (COUNTIF([.$C$20:.$C$49]; "<>") <> COUNTIF([.O20:.O49];"<>");"EN CURSO" ;  IF(COUNTIF([.$C$20:.$C$49]; "<>") = COUNTIF([.O20:.O49];"N/A"); "N/A";                   IF(COUNTIF([.O20:.O49];"Falla")>([$'DATA - Oculta'.$C$25]*((COUNTIF([.O20:.O49];"Pasa")+COUNTIF([.O20:.O49];"Falla"))));                 "NO CONFORME";"CONFORME")))))) -> N/A | P50: of:=IF (COUNTIF([$'P2.Operable'.$E118:$'P2.Operable'.$E147];"ERR")>0;"ERROR";      IF(COUNTIF([.P20:.P49];"N/T")>0 ; "EN CURSO";         IF (COUNTIF([.P20:.P49];"N/D") > 0;"EN CURSO";              IF (COUNTIF([.$C$20:.$C$49]; "<>") <> COUNTIF([.P20:.P49];"<>");"EN CURSO" ;  IF(COUNTIF([.$C$20:.$C$49]; "<>") = COUNTIF([.P20:.P49];"N/A"); "N/A";                   IF(COUNTIF([.P20:.P49];"Falla")>([$'DATA - Oculta'.$C$25]*((COUNTIF([.P20:.P49];"Pasa")+COUNTIF([.P20:.P49];"Falla"))));                 "NO CONFORME";"CONFORME")))))) -> N/A | Q50: of:=IF (COUNTIF([$'P2.Operable'.$E151:$'P2.Operable'.$E180];"ERR")>0;"ERROR";      IF(COUNTIF([.Q20:.Q49];"N/T")>0 ; "EN CURSO";         IF (COUNTIF([.Q20:.Q49];"N/D") > 0;"EN CURSO";              IF (COUNTIF([.$C$20:.$C$49]; "<>") <> COUNTIF([.Q20:.Q49];"<>");"EN CURSO" ;  IF(COUNTIF([.$C$20:.$C$49]; "<>") = COUNTIF([.Q20:.Q49];"N/A"); "N/A";                   IF(COUNTIF([.Q20:.Q49];"Falla")>([$'DATA - Oculta'.$C$25]*((COUNTIF([.Q20:.Q49];"Pasa")+COUNTIF([.Q20:.Q49];"Falla"))));                 "NO CONFORME";"CONFORME")))))) -> N/A | R50: of:=IF (COUNTIF([$'P2.Operable'.$E184:$'P2.Operable'.$E213];"ERR")>0;"ERROR";      IF(COUNTIF([.R20:.R49];"N/T")>0 ; "EN CURSO";         IF (COUNTIF([.R20:.R49];"N/D") > 0;"EN CURSO";              IF (COUNTIF([.$C$20:.$C$49]; "<>") <> COUNTIF([.R20:.R49];"<>");"EN CURSO" ;  IF(COUNTIF([.$C$20:.$C$49]; "<>") = COUNTIF([.R20:.R49];"N/A"); "N/A";                   IF(COUNTIF([.R20:.R49];"Falla")>([$'DATA - Oculta'.$C$25]*((COUNTIF([.R20:.R49];"Pasa")+COUNTIF([.R20:.R49];"Falla"))));                 "NO CONFORME";"CONFORME")))))) -> N/A | S50: of:=IF (COUNTIF([$'P2.Operable'.$E217:$'P2.Operable'.$E246];"ERR")>0;"ERROR";      IF(COUNTIF([.S20:.S49];"N/T")>0 ; "EN CURSO";         IF (COUNTIF([.S20:.S49];"N/D") > 0;"EN CURSO";              IF (COUNTIF([.$C$20:.$C$49]; "<>") <> COUNTIF([.S20:.S49];"<>");"EN CURSO" ;  IF(COUNTIF([.$C$20:.$C$49]; "<>") = COUNTIF([.S20:.S49];"N/A"); "N/A";                   IF(COUNTIF([.S20:.S49];"Falla")>([$'DATA - Oculta'.$C$25]*((COUNTIF([.S20:.S49];"Pasa")+COUNTIF([.S20:.S49];"Falla"))));                 "NO CONFORME";"CONFORME")))))) -> N/A | T50: of:=IF (COUNTIF([$'P2.Operable'.$E250:$'P2.Operable'.$E279];"ERR")>0;"ERROR";      IF(COUNTIF([.T20:.T49];"N/T")>0 ; "EN CURSO";         IF (COUNTIF([.T20:.T49];"N/D") > 0;"EN CURSO";              IF (COUNTIF([.$C$20:.$C$49]; "<>") <> COUNTIF([.T20:.T49];"<>");"EN CURSO" ;  IF(COUNTIF([.$C$20:.$C$49]; "<>") = COUNTIF([.T20:.T49];"N/A"); "N/A";                   IF(COUNTIF([.T20:.T49];"Falla")>([$'DATA - Oculta'.$C$25]*((COUNTIF([.T20:.T49];"Pasa")+COUNTIF([.T20:.T49];"Falla"))));                 "NO CONFORME";"CONFORME")))))) -> N/A | U50: of:=IF (COUNTIF([$'P2.Operable'.$E283:$'P2.Operable'.$E312];"ERR")>0;"ERROR";      IF(COUNTIF([.U20:.U49];"N/T")>0 ; "EN CURSO";         IF (COUNTIF([.U20:.U49];"N/D") > 0;"EN CURSO";              IF (COUNTIF([.$C$20:.$C$49]; "<>") <> COUNTIF([.U20:.U49];"<>");"EN CURSO" ;  IF(COUNTIF([.$C$20:.$C$49]; "<>") = COUNTIF([.U20:.U49];"N/A"); "N/A";                   IF(COUNTIF([.U20:.U49];"Falla")>([$'DATA - Oculta'.$C$25]*((COUNTIF([.U20:.U49];"Pasa")+COUNTIF([.U20:.U49];"Falla"))));                 "NO CONFORME";"CONFORME")))))) -> N/A | V50: of:=IF (COUNTIF([$'P2.Operable'.$E316:$'P2.Operable'.$E345];"ERR")>0;"ERROR";      IF(COUNTIF([.V20:.V49];"N/T")>0 ; "EN CURSO";         IF (COUNTIF([.V20:.V49];"N/D") > 0;"EN CURSO";              IF (COUNTIF([.$C$20:.$C$49]; "<>") <> COUNTIF([.V20:.V49];"<>");"EN CURSO" ;  IF(COUNTIF([.$C$20:.$C$49]; "<>") = COUNTIF([.V20:.V49];"N/A"); "N/A";                   IF(COUNTIF([.V20:.V49];"Falla")>([$'DATA - Oculta'.$C$25]*((COUNTIF([.V20:.V49];"Pasa")+COUNTIF([.V20:.V49];"Falla"))));                 "NO CONFORME";"CONFORME")))))) -> N/A | W50: of:=IF (COUNTIF([$'P2.Operable'.$E448:$'P2.Operable'.$E477];"ERR")>0;"ERROR";      IF(COUNTIF([.W20:.W49];"N/T")>0 ; "EN CURSO";         IF (COUNTIF([.W20:.W49];"N/D") > 0;"EN CURSO";              IF (COUNTIF([.$C$20:.$C$49]; "<>") <> COUNTIF([.W20:.W49];"<>");"EN CURSO" ;  IF(COUNTIF([.$C$20:.$C$49]; "<>") = COUNTIF([.W20:.W49];"N/A"); "N/A";                   IF(COUNTIF([.W20:.W49];"Falla")>([$'DATA - Oculta'.$C$25]*((COUNTIF([.W20:.W49];"Pasa")+COUNTIF([.W20:.W49];"Falla"))));                 "NO CONFORME";"CONFORME")))))) -> N/A | X50: of:=IF (COUNTIF([$'P2.Operable'.$E481:$'P2.Operable'.$E510];"ERR")>0;"ERROR";      IF(COUNTIF([.X20:.X49];"N/T")>0 ; "EN CURSO";         IF (COUNTIF([.X20:.X49];"N/D") > 0;"EN CURSO";              IF (COUNTIF([.$C$20:.$C$49]; "<>") <> COUNTIF([.X20:.X49];"<>");"EN CURSO" ;  IF(COUNTIF([.$C$20:.$C$49]; "<>") = COUNTIF([.X20:.X49];"N/A"); "N/A";                   IF(COUNTIF([.X20:.X49];"Falla")>([$'DATA - Oculta'.$C$25]*((COUNTIF([.X20:.X49];"Pasa")+COUNTIF([.X20:.X49];"Falla"))));                 "NO CONFORME";"CONFORME")))))) -> N/A | Y50: of:=IF (COUNTIF([$'P2.Operable'.$E514:$'P2.Operable'.$E543];"ERR")>0;"ERROR";      IF(COUNTIF([.Y20:.Y49];"N/T")>0 ; "EN CURSO";         IF (COUNTIF([.Y20:.Y49];"N/D") > 0;"EN CURSO";              IF (COUNTIF([.$C$20:.$C$49]; "<>") <> COUNTIF([.Y20:.Y49];"<>");"EN CURSO" ;  IF(COUNTIF([.$C$20:.$C$49]; "<>") = COUNTIF([.Y20:.Y49];"N/A"); "N/A";                   IF(COUNTIF([.Y20:.Y49];"Falla")>([$'DATA - Oculta'.$C$25]*((COUNTIF([.Y20:.Y49];"Pasa")+COUNTIF([.Y20:.Y49];"Falla"))));                 "NO CONFORME";"CONFORME")))))) -> N/A | Z50: of:=IF (COUNTIF([$'P2.Operable'.$E547:$'P2.Operable'.$E576];"ERR")>0;"ERROR";      IF(COUNTIF([.Z20:.Z49];"N/T")>0 ; "EN CURSO";         IF (COUNTIF([.Z20:.Z49];"N/D") > 0;"EN CURSO";              IF (COUNTIF([.$C$20:.$C$49]; "<>") <> COUNTIF([.Z20:.Z49];"<>");"EN CURSO" ;  IF(COUNTIF([.$C$20:.$C$49]; "<>") = COUNTIF([.Z20:.Z49];"N/A"); "N/A";                   IF(COUNTIF([.Z20:.Z49];"Falla")>([$'DATA - Oculta'.$C$25]*((COUNTIF([.Z20:.Z49];"Pasa")+COUNTIF([.Z20:.Z49];"Falla"))));                 "NO CONFORME";"CONFORME")))))) -> N/A | AA50: of:=IF (COUNTIF([$'P3.Comprensible'.$E19:$'P3.Comprensible'.$E48];"ERR")>0;"ERROR";      IF(COUNTIF([.AA20:.AA49];"N/T")>0 ; "EN CURSO";         IF (COUNTIF([.AA20:.AA49];"N/D") > 0;"EN CURSO";              IF (COUNTIF([.$C$20:.$C$49]; "<>") <> COUNTIF([.AA20:.AA49];"<>");"EN CURSO" ;  IF(COUNTIF([.$C$20:.$C$49]; "<>") = COUNTIF([.AA20:.AA49];"N/A"); "N/A";                   IF(COUNTIF([.AA20:.AA49];"Falla")>([$'DATA - Oculta'.$C$25]*((COUNTIF([.AA20:.AA49];"Pasa")+COUNTIF([.AA20:.AA49];"Falla"))));                 "NO CONFORME";"CONFORME")))))) -> N/A | AB50: of:=IF (COUNTIF([$'P3.Comprensible'.$E85:$'P3.Comprensible'.$E114];"ERR")>0;"ERROR";      IF(COUNTIF([.AB20:.AB49];"N/T")>0 ; "EN CURSO";         IF (COUNTIF([.AB20:.AB49];"N/D") > 0;"EN CURSO";              IF (COUNTIF([.$C$20:.$C$49]; "<>") <> COUNTIF([.AB20:.AB49];"<>");"EN CURSO" ;  IF(COUNTIF([.$C$20:.$C$49]; "<>") = COUNTIF([.AB20:.AB49];"N/A"); "N/A";                   IF(COUNTIF([.AB20:.AB49];"Falla")>([$'DATA - Oculta'.$C$25]*((COUNTIF([.AB20:.AB49];"Pasa")+COUNTIF([.AB20:.AB49];"Falla"))));                 "NO CONFORME";"CONFORME")))))) -> N/A | AC50: of:=IF (COUNTIF([$'P3.Comprensible'.$E118:$'P3.Comprensible'.$E147];"ERR")>0;"ERROR";      IF(COUNTIF([.AC20:.AC49];"N/T")>0 ; "EN CURSO";         IF (COUNTIF([.AC20:.AC49];"N/D") > 0;"EN CURSO";              IF (COUNTIF([.$C$20:.$C$49]; "<>") <> COUNTIF([.AC20:.AC49];"<>");"EN CURSO" ;  IF(COUNTIF([.$C$20:.$C$49]; "<>") = COUNTIF([.AC20:.AC49];"N/A"); "N/A";                   IF(COUNTIF([.AC20:.AC49];"Falla")>([$'DATA - Oculta'.$C$25]*((COUNTIF([.AC20:.AC49];"Pasa")+COUNTIF([.AC20:.AC49];"Falla"))));                 "NO CONFORME";"CONFORME")))))) -> N/A | AD50: of:=IF (COUNTIF([$'P3.Comprensible'.$E217:$'P3.Comprensible'.$E246];"ERR")>0;"ERROR";      IF(COUNTIF([.AD20:.AD49];"N/T")>0 ; "EN CURSO";         IF (COUNTIF([.AD20:.AD49];"N/D") > 0;"EN CURSO";              IF (COUNTIF([.$C$20:.$C$49]; "<>") <> COUNTIF([.AD20:.AD49];"<>");"EN CURSO" ;  IF(COUNTIF([.$C$20:.$C$49]; "<>") = COUNTIF([.AD20:.AD49];"N/A"); "N/A";                   IF(COUNTIF([.AD20:.AD49];"Falla")>([$'DATA - Oculta'.$C$25]*((COUNTIF([.AD20:.AD49];"Pasa")+COUNTIF([.AD20:.AD49];"Falla"))));                 "NO CONFORME";"CONFORME")))))) -> N/A | AE50: of:=IF (COUNTIF([$'P3.Comprensible'.$E250:$'P3.Comprensible'.$E279];"ERR")>0;"ERROR";      IF(COUNTIF([.AE20:.AE49];"N/T")>0 ; "EN CURSO";         IF (COUNTIF([.AE20:.AE49];"N/D") > 0;"EN CURSO";              IF (COUNTIF([.$C$20:.$C$49]; "<>") <> COUNTIF([.AE20:.AE49];"<>");"EN CURSO" ;  IF(COUNTIF([.$C$20:.$C$49]; "<>") = COUNTIF([.AE20:.AE49];"N/A"); "N/A";                   IF(COUNTIF([.AE20:.AE49];"Falla")>([$'DATA - Oculta'.$C$25]*((COUNTIF([.AE20:.AE49];"Pasa")+COUNTIF([.AE20:.AE49];"Falla"))));                 "NO CONFORME";"CONFORME")))))) -> N/A | AF50: of:=IF (COUNTIF([$'P4.Robusto'.$E19:$'P4.Robusto'.$E48];"ERR")>0;"ERROR";      IF(COUNTIF([.AF20:.AF49];"N/T")>0 ; "EN CURSO";         IF (COUNTIF([.AF20:.AF49];"N/D") > 0;"EN CURSO";              IF (COUNTIF([.$C$20:.$C$49]; "<>") <> COUNTIF([.AF20:.AF49];"<>");"EN CURSO" ;  IF(COUNTIF([.$C$20:.$C$49]; "<>") = COUNTIF([.AF20:.AF49];"N/A"); "N/A";                   IF(COUNTIF([.AF20:.AF49];"Falla")>([$'DATA - Oculta'.$C$25]*((COUNTIF([.AF20:.AF49];"Pasa")+COUNTIF([.AF20:.AF49];"Falla"))));                 "NO CONFORME";"CONFORME")))))) -> N/A | AG50: of:=IF (COUNTIF([$'P4.Robusto'.$E52:$'P4.Robusto'.$E81];"ERR")>0;"ERROR";      IF(COUNTIF([.AG20:.AG49];"N/T")>0 ; "EN CURSO";         IF (COUNTIF([.AG20:.AG49];"N/D") > 0;"EN CURSO";              IF (COUNTIF([.$C$20:.$C$49]; "<>") <> COUNTIF([.AG20:.AG49];"<>");"EN CURSO" ;  IF(COUNTIF([.$C$20:.$C$49]; "<>") = COUNTIF([.AG20:.AG49];"N/A"); "N/A";                   IF(COUNTIF([.AG20:.AG49];"Falla")>([$'DATA - Oculta'.$C$25]*((COUNTIF([.AG20:.AG49];"Pasa")+COUNTIF([.AG20:.AG49];"Falla"))));                 "NO CONFORME";"CONFORME")))))) -> N/A
C54: AA
C55: Muestra | D55: 1.2.4 | E55: 1.2.5 | F55: 1.3.4 | G55: 1.3.5 | H55: 1.4.3 | I55: 1.4.4 | J55: 1.4.5 | K55: 1.4.10 | L55: 1.4.11 | M55: 1.4.12 | N55: 1.4.13 | O55: 2.4.5 | P55: 2.4.6 | Q55: 2.4.7 | R55: 3.1.2 | S55: 3.2.3 | T55: 3.2.4 | U55: 3.3.3 | V55: 3.3.4 | W55: 4.1.3
B56: of:=IF( ISBLANK([$'03.Muestra'.$C$8]);"";[$'03.Muestra'.$C$8]) ->  | C56: of:=IF( ISBLANK([$'03.Muestra'.$E$8]);"";[$'03.Muestra'.$E$8]) ->  | D56: of:=IF( ISBLANK([$'P1.Perceptible'.D151]);"";[$'P1.Perceptible'.D151]) ->  | E56: of:=IF( ISBLANK([$'P1.Perceptible'.D184]);"";[$'P1.Perceptible'.D184]) ->  | F56: of:=IF( ISBLANK([$'P1.Perceptible'.D316]);"";[$'P1.Perceptible'.D316]) ->  | G56: of:=IF( ISBLANK([$'P1.Perceptible'.D349]);"";[$'P1.Perceptible'.D349]) ->  | H56: of:=IF( ISBLANK([$'P1.Perceptible'.D448]);"";[$'P1.Perceptible'.D448]) ->  | I56: of:=IF( ISBLANK([$'P1.Perceptible'.D481]);"";[$'P1.Perceptible'.D481]) ->  | J56: of:=IF( ISBLANK([$'P1.Perceptible'.D514]);"";[$'P1.Perceptible'.D514]) ->  | K56: of:=IF( ISBLANK([$'P1.Perceptible'.D547]);"";[$'P1.Perceptible'.D547]) ->  | L56: of:=IF( ISBLANK([$'P1.Perceptible'.D580]);"";[$'P1.Perceptible'.D580]) ->  | M56: of:=IF( ISBLANK([$'P1.Perceptible'.D613]);"";[$'P1.Perceptible'.D613]) ->  | N56: of:=IF( ISBLANK([$'P1.Perceptible'.D647]);"";[$'P1.Perceptible'.D647]) ->  | O56: of:=IF( ISBLANK([$'P2.Operable'.D349]);"";[$'P2.Operable'.D349]) ->  | P56: of:=IF( ISBLANK([$'P2.Operable'.D382]);"";[$'P2.Operable'.D382]) ->  | Q56: of:=IF( ISBLANK([$'P2.Operable'.D415]);"";[$'P2.Operable'.D415]) ->  | R56: of:=IF( ISBLANK([$'P3.Comprensible'.D52]);"";[$'P3.Comprensible'.D52]) ->  | S56: of:=IF( ISBLANK([$'P3.Comprensible'.D151]);"";[$'P3.Comprensible'.D151]) ->  | T56: of:=IF( ISBLANK([$'P3.Comprensible'.D184]);"";[$'P3.Comprensible'.D184]) ->  | U56: of:=IF( ISBLANK([$'P3.Comprensible'.D283]);"";[$'P3.Comprensible'.D283]) ->  | V56: of:=IF( ISBLANK([$'P3.Comprensible'.D316]);"";[$'P3.Comprensible'.D316]) ->  | W56: of:=IF(ISBLANK([$'P4.Robusto'.D85]);"";[$'P4.Robusto'.D85]) -> 
B57: of:=IF( ISBLANK([$'03.Muestra'.$C$9]);"";[$'03.Muestra'.$C$9]) ->  | C57: of:=IF( ISBLANK([$'03.Muestra'.$E$9]);"";[$'03.Muestra'.$E$9]) ->  | D57: of:=IF( ISBLANK([$'P1.Perceptible'.D152]);"";[$'P1.Perceptible'.D152]) ->  | E57: of:=IF( ISBLANK([$'P1.Perceptible'.D185]);"";[$'P1.Perceptible'.D185]) ->  | F57: of:=IF( ISBLANK([$'P1.Perceptible'.D317]);"";[$'P1.Perceptible'.D317]) ->  | G57: of:=IF( ISBLANK([$'P1.Perceptible'.D350]);"";[$'P1.Perceptible'.D350]) ->  | H57: of:=IF( ISBLANK([$'P1.Perceptible'.D449]);"";[$'P1.Perceptible'.D449]) ->  | I57: of:=IF( ISBLANK([$'P1.Perceptible'.D482]);"";[$'P1.Perceptible'.D482]) ->  | J57: of:=IF( ISBLANK([$'P1.Perceptible'.D515]);"";[$'P1.Perceptible'.D515]) ->  | K57: of:=IF( ISBLANK([$'P1.Perceptible'.D548]);"";[$'P1.Perceptible'.D548]) ->  | L57: of:=IF( ISBLANK([$'P1.Perceptible'.D581]);"";[$'P1.Perceptible'.D581]) ->  | M57: of:=IF( ISBLANK([$'P1.Perceptible'.D614]);"";[$'P1.Perceptible'.D614]) ->  | N57: of:=IF( ISBLANK([$'P1.Perceptible'.D648]);"";[$'P1.Perceptible'.D648]) ->  | O57: of:=IF( ISBLANK([$'P2.Operable'.D350]);"";[$'P2.Operable'.D350]) ->  | P57: of:=IF( ISBLANK([$'P2.Operable'.D383]);"";[$'P2.Operable'.D383]) ->  | Q57: of:=IF( ISBLANK([$'P2.Operable'.D416]);"";[$'P2.Operable'.D416]) ->  | R57: of:=IF( ISBLANK([$'P3.Comprensible'.D53]);"";[$'P3.Comprensible'.D53]) ->  | S57: of:=IF( ISBLANK([$'P3.Comprensible'.D152]);"";[$'P3.Comprensible'.D152]) ->  | T57: of:=IF( ISBLANK([$'P3.Comprensible'.D185]);"";[$'P3.Comprensible'.D185]) ->  | U57: of:=IF( ISBLANK([$'P3.Comprensible'.D284]);"";[$'P3.Comprensible'.D284]) ->  | V57: of:=IF( ISBLANK([$'P3.Comprensible'.D317]);"";[$'P3.Comprensible'.D317]) ->  | W57: of:=IF(ISBLANK([$'P4.Robusto'.D86]);"";[$'P4.Robusto'.D86]) -> 
B58: of:=IF( ISBLANK([$'03.Muestra'.$C$10]);"";[$'03.Muestra'.$C$10]) ->  | C58: of:=IF( ISBLANK([$'03.Muestra'.$E$10]);"";[$'03.Muestra'.$E$10]) ->  | D58: of:=IF( ISBLANK([$'P1.Perceptible'.D153]);"";[$'P1.Perceptible'.D153]) ->  | E58: of:=IF( ISBLANK([$'P1.Perceptible'.D186]);"";[$'P1.Perceptible'.D186]) ->  | F58: of:=IF( ISBLANK([$'P1.Perceptible'.D318]);"";[$'P1.Perceptible'.D318]) ->  | G58: of:=IF( ISBLANK([$'P1.Perceptible'.D351]);"";[$'P1.Perceptible'.D351]) ->  | H58: of:=IF( ISBLANK([$'P1.Perceptible'.D450]);"";[$'P1.Perceptible'.D450]) ->  | I58: of:=IF( ISBLANK([$'P1.Perceptible'.D483]);"";[$'P1.Perceptible'.D483]) ->  | J58: of:=IF( ISBLANK([$'P1.Perceptible'.D516]);"";[$'P1.Perceptible'.D516]) ->  | K58: of:=IF( ISBLANK([$'P1.Perceptible'.D549]);"";[$'P1.Perceptible'.D549]) ->  | L58: of:=IF( ISBLANK([$'P1.Perceptible'.D582]);"";[$'P1.Perceptible'.D582]) ->  | M58: of:=IF( ISBLANK([$'P1.Perceptible'.D615]);"";[$'P1.Perceptible'.D615]) ->  | N58: of:=IF( ISBLANK([$'P1.Perceptible'.D649]);"";[$'P1.Perceptible'.D649]) ->  | O58: of:=IF( ISBLANK([$'P2.Operable'.D351]);"";[$'P2.Operable'.D351]) ->  | P58: of:=IF( ISBLANK([$'P2.Operable'.D384]);"";[$'P2.Operable'.D384]) ->  | Q58: of:=IF( ISBLANK([$'P2.Operable'.D417]);"";[$'P2.Operable'.D417]) ->  | R58: of:=IF( ISBLANK([$'P3.Comprensible'.D54]);"";[$'P3.Comprensible'.D54]) ->  | S58: of:=IF( ISBLANK([$'P3.Comprensible'.D153]);"";[$'P3.Comprensible'.D153]) ->  | T58: of:=IF( ISBLANK([$'P3.Comprensible'.D186]);"";[$'P3.Comprensible'.D186]) ->  | U58: of:=IF( ISBLANK([$'P3.Comprensible'.D285]);"";[$'P3.Comprensible'.D285]) ->  | V58: of:=IF( ISBLANK([$'P3.Comprensible'.D318]);"";[$'P3.Comprensible'.D318]) ->  | W58: of:=IF(ISBLANK([$'P4.Robusto'.D87]);"";[$'P4.Robusto'.D87]) -> 
B59: of:=IF( ISBLANK([$'03.Muestra'.$C$11]);"";[$'03.Muestra'.$C$11]) ->  | C59: of:=IF( ISBLANK([$'03.Muestra'.$E$11]);"";[$'03.Muestra'.$E$11]) ->  | D59: of:=IF( ISBLANK([$'P1.Perceptible'.D154]);"";[$'P1.Perceptible'.D154]) ->  | E59: of:=IF( ISBLANK([$'P1.Perceptible'.D187]);"";[$'P1.Perceptible'.D187]) ->  | F59: of:=IF( ISBLANK([$'P1.Perceptible'.D319]);"";[$'P1.Perceptible'.D319]) ->  | G59: of:=IF( ISBLANK([$'P1.Perceptible'.D352]);"";[$'P1.Perceptible'.D352]) ->  | H59: of:=IF( ISBLANK([$'P1.Perceptible'.D451]);"";[$'P1.Perceptible'.D451]) ->  | I59: of:=IF( ISBLANK([$'P1.Perceptible'.D484]);"";[$'P1.Perceptible'.D484]) ->  | J59: of:=IF( ISBLANK([$'P1.Perceptible'.D517]);"";[$'P1.Perceptible'.D517]) ->  | K59: of:=IF( ISBLANK([$'P1.Perceptible'.D550]);"";[$'P1.Perceptible'.D550]) ->  | L59: of:=IF( ISBLANK([$'P1.Perceptible'.D583]);"";[$'P1.Perceptible'.D583]) ->  | M59: of:=IF( ISBLANK([$'P1.Perceptible'.D616]);"";[$'P1.Perceptible'.D616]) ->  | N59: of:=IF( ISBLANK([$'P1.Perceptible'.D650]);"";[$'P1.Perceptible'.D650]) ->  | O59: of:=IF( ISBLANK([$'P2.Operable'.D352]);"";[$'P2.Operable'.D352]) ->  | P59: of:=IF( ISBLANK([$'P2.Operable'.D385]);"";[$'P2.Operable'.D385]) ->  | Q59: of:=IF( ISBLANK([$'P2.Operable'.D418]);"";[$'P2.Operable'.D418]) ->  | R59: of:=IF( ISBLANK([$'P3.Comprensible'.D55]);"";[$'P3.Comprensible'.D55]) ->  | S59: of:=IF( ISBLANK([$'P3.Comprensible'.D154]);"";[$'P3.Comprensible'.D154]) ->  | T59: of:=IF( ISBLANK([$'P3.Comprensible'.D187]);"";[$'P3.Comprensible'.D187]) ->  | U59: of:=IF( ISBLANK([$'P3.Comprensible'.D286]);"";[$'P3.Comprensible'.D286]) ->  | V59: of:=IF( ISBLANK([$'P3.Comprensible'.D319]);"";[$'P3.Comprensible'.D319]) ->  | W59: of:=IF(ISBLANK([$'P4.Robusto'.D88]);"";[$'P4.Robusto'.D88]) -> 
B60: of:=IF( ISBLANK([$'03.Muestra'.$C$12]);"";[$'03.Muestra'.$C$12]) ->  | C60: of:=IF( ISBLANK([$'03.Muestra'.$E$12]);"";[$'03.Muestra'.$E$12]) ->  | D60: of:=IF( ISBLANK([$'P1.Perceptible'.D155]);"";[$'P1.Perceptible'.D155]) ->  | E60: of:=IF( ISBLANK([$'P1.Perceptible'.D188]);"";[$'P1.Perceptible'.D188]) ->  | F60: of:=IF( ISBLANK([$'P1.Perceptible'.D320]);"";[$'P1.Perceptible'.D320]) ->  | G60: of:=IF( ISBLANK([$'P1.Perceptible'.D353]);"";[$'P1.Perceptible'.D353]) ->  | H60: of:=IF( ISBLANK([$'P1.Perceptible'.D452]);"";[$'P1.Perceptible'.D452]) ->  | I60: of:=IF( ISBLANK([$'P1.Perceptible'.D485]);"";[$'P1.Perceptible'.D485]) ->  | J60: of:=IF( ISBLANK([$'P1.Perceptible'.D518]);"";[$'P1.Perceptible'.D518]) ->  | K60: of:=IF( ISBLANK([$'P1.Perceptible'.D551]);"";[$'P1.Perceptible'.D551]) ->  | L60: of:=IF( ISBLANK([$'P1.Perceptible'.D584]);"";[$'P1.Perceptible'.D584]) ->  | M60: of:=IF( ISBLANK([$'P1.Perceptible'.D617]);"";[$'P1.Perceptible'.D617]) ->  | N60: of:=IF( ISBLANK([$'P1.Perceptible'.D651]);"";[$'P1.Perceptible'.D651]) ->  | O60: of:=IF( ISBLANK([$'P2.Operable'.D353]);"";[$'P2.Operable'.D353]) ->  | P60: of:=IF( ISBLANK([$'P2.Operable'.D386]);"";[$'P2.Operable'.D386]) ->  | Q60: of:=IF( ISBLANK([$'P2.Operable'.D419]);"";[$'P2.Operable'.D419]) ->  | R60: of:=IF( ISBLANK([$'P3.Comprensible'.D56]);"";[$'P3.Comprensible'.D56]) ->  | S60: of:=IF( ISBLANK([$'P3.Comprensible'.D155]);"";[$'P3.Comprensible'.D155]) ->  | T60: of:=IF( ISBLANK([$'P3.Comprensible'.D188]);"";[$'P3.Comprensible'.D188]) ->  | U60: of:=IF( ISBLANK([$'P3.Comprensible'.D287]);"";[$'P3.Comprensible'.D287]) ->  | V60: of:=IF( ISBLANK([$'P3.Comprensible'.D320]);"";[$'P3.Comprensible'.D320]) ->  | W60: of:=IF(ISBLANK([$'P4.Robusto'.D89]);"";[$'P4.Robusto'.D89]) -> 
B61: of:=IF( ISBLANK([$'03.Muestra'.$C$13]);"";[$'03.Muestra'.$C$13]) ->  | C61: of:=IF( ISBLANK([$'03.Muestra'.$E$13]);"";[$'03.Muestra'.$E$13]) ->  | D61: of:=IF( ISBLANK([$'P1.Perceptible'.D156]);"";[$'P1.Perceptible'.D156]) ->  | E61: of:=IF( ISBLANK([$'P1.Perceptible'.D189]);"";[$'P1.Perceptible'.D189]) ->  | F61: of:=IF( ISBLANK([$'P1.Perceptible'.D321]);"";[$'P1.Perceptible'.D321]) ->  | G61: of:=IF( ISBLANK([$'P1.Perceptible'.D354]);"";[$'P1.Perceptible'.D354]) ->  | H61: of:=IF( ISBLANK([$'P1.Perceptible'.D453]);"";[$'P1.Perceptible'.D453]) ->  | I61: of:=IF( ISBLANK([$'P1.Perceptible'.D486]);"";[$'P1.Perceptible'.D486]) ->  | J61: of:=IF( ISBLANK([$'P1.Perceptible'.D519]);"";[$'P1.Perceptible'.D519]) ->  | K61: of:=IF( ISBLANK([$'P1.Perceptible'.D552]);"";[$'P1.Perceptible'.D552]) ->  | L61: of:=IF( ISBLANK([$'P1.Perceptible'.D585]);"";[$'P1.Perceptible'.D585]) ->  | M61: of:=IF( ISBLANK([$'P1.Perceptible'.D618]);"";[$'P1.Perceptible'.D618]) ->  | N61: of:=IF( ISBLANK([$'P1.Perceptible'.D652]);"";[$'P1.Perceptible'.D652]) ->  | O61: of:=IF( ISBLANK([$'P2.Operable'.D354]);"";[$'P2.Operable'.D354]) ->  | P61: of:=IF( ISBLANK([$'P2.Operable'.D387]);"";[$'P2.Operable'.D387]) ->  | Q61: of:=IF( ISBLANK([$'P2.Operable'.D420]);"";[$'P2.Operable'.D420]) ->  | R61: of:=IF( ISBLANK([$'P3.Comprensible'.D57]);"";[$'P3.Comprensible'.D57]) ->  | S61: of:=IF( ISBLANK([$'P3.Comprensible'.D156]);"";[$'P3.Comprensible'.D156]) ->  | T61: of:=IF( ISBLANK([$'P3.Comprensible'.D189]);"";[$'P3.Comprensible'.D189]) ->  | U61: of:=IF( ISBLANK([$'P3.Comprensible'.D288]);"";[$'P3.Comprensible'.D288]) ->  | V61: of:=IF( ISBLANK([$'P3.Comprensible'.D321]);"";[$'P3.Comprensible'.D321]) ->  | W61: of:=IF(ISBLANK([$'P4.Robusto'.D90]);"";[$'P4.Robusto'.D90]) -> 
B62: of:=IF( ISBLANK([$'03.Muestra'.$C$14]);"";[$'03.Muestra'.$C$14]) ->  | C62: of:=IF( ISBLANK([$'03.Muestra'.$E$14]);"";[$'03.Muestra'.$E$14]) ->  | D62: of:=IF( ISBLANK([$'P1.Perceptible'.D157]);"";[$'P1.Perceptible'.D157]) ->  | E62: of:=IF( ISBLANK([$'P1.Perceptible'.D190]);"";[$'P1.Perceptible'.D190]) ->  | F62: of:=IF( ISBLANK([$'P1.Perceptible'.D322]);"";[$'P1.Perceptible'.D322]) ->  | G62: of:=IF( ISBLANK([$'P1.Perceptible'.D355]);"";[$'P1.Perceptible'.D355]) ->  | H62: of:=IF( ISBLANK([$'P1.Perceptible'.D454]);"";[$'P1.Perceptible'.D454]) ->  | I62: of:=IF( ISBLANK([$'P1.Perceptible'.D487]);"";[$'P1.Perceptible'.D487]) ->  | J62: of:=IF( ISBLANK([$'P1.Perceptible'.D520]);"";[$'P1.Perceptible'.D520]) ->  | K62: of:=IF( ISBLANK([$'P1.Perceptible'.D553]);"";[$'P1.Perceptible'.D553]) ->  | L62: of:=IF( ISBLANK([$'P1.Perceptible'.D586]);"";[$'P1.Perceptible'.D586]) ->  | M62: of:=IF( ISBLANK([$'P1.Perceptible'.D619]);"";[$'P1.Perceptible'.D619]) ->  | N62: of:=IF( ISBLANK([$'P1.Perceptible'.D653]);"";[$'P1.Perceptible'.D653]) ->  | O62: of:=IF( ISBLANK([$'P2.Operable'.D355]);"";[$'P2.Operable'.D355]) ->  | P62: of:=IF( ISBLANK([$'P2.Operable'.D388]);"";[$'P2.Operable'.D388]) ->  | Q62: of:=IF( ISBLANK([$'P2.Operable'.D421]);"";[$'P2.Operable'.D421]) ->  | R62: of:=IF( ISBLANK([$'P3.Comprensible'.D58]);"";[$'P3.Comprensible'.D58]) ->  | S62: of:=IF( ISBLANK([$'P3.Comprensible'.D157]);"";[$'P3.Comprensible'.D157]) ->  | T62: of:=IF( ISBLANK([$'P3.Comprensible'.D190]);"";[$'P3.Comprensible'.D190]) ->  | U62: of:=IF( ISBLANK([$'P3.Comprensible'.D289]);"";[$'P3.Comprensible'.D289]) ->  | V62: of:=IF( ISBLANK([$'P3.Comprensible'.D322]);"";[$'P3.Comprensible'.D322]) ->  | W62: of:=IF(ISBLANK([$'P4.Robusto'.D91]);"";[$'P4.Robusto'.D91]) -> 
B63: of:=IF( ISBLANK([$'03.Muestra'.$C$15]);"";[$'03.Muestra'.$C$15]) ->  | C63: of:=IF( ISBLANK([$'03.Muestra'.$E$15]);"";[$'03.Muestra'.$E$15]) ->  | D63: of:=IF( ISBLANK([$'P1.Perceptible'.D158]);"";[$'P1.Perceptible'.D158]) ->  | E63: of:=IF( ISBLANK([$'P1.Perceptible'.D191]);"";[$'P1.Perceptible'.D191]) ->  | F63: of:=IF( ISBLANK([$'P1.Perceptible'.D323]);"";[$'P1.Perceptible'.D323]) ->  | G63: of:=IF( ISBLANK([$'P1.Perceptible'.D356]);"";[$'P1.Perceptible'.D356]) ->  | H63: of:=IF( ISBLANK([$'P1.Perceptible'.D455]);"";[$'P1.Perceptible'.D455]) ->  | I63: of:=IF( ISBLANK([$'P1.Perceptible'.D488]);"";[$'P1.Perceptible'.D488]) ->  | J63: of:=IF( ISBLANK([$'P1.Perceptible'.D521]);"";[$'P1.Perceptible'.D521]) ->  | K63: of:=IF( ISBLANK([$'P1.Perceptible'.D554]);"";[$'P1.Perceptible'.D554]) ->  | L63: of:=IF( ISBLANK([$'P1.Perceptible'.D587]);"";[$'P1.Perceptible'.D587]) ->  | M63: of:=IF( ISBLANK([$'P1.Perceptible'.D620]);"";[$'P1.Perceptible'.D620]) ->  | N63: of:=IF( ISBLANK([$'P1.Perceptible'.D654]);"";[$'P1.Perceptible'.D654]) ->  | O63: of:=IF( ISBLANK([$'P2.Operable'.D356]);"";[$'P2.Operable'.D356]) ->  | P63: of:=IF( ISBLANK([$'P2.Operable'.D389]);"";[$'P2.Operable'.D389]) ->  | Q63: of:=IF( ISBLANK([$'P2.Operable'.D422]);"";[$'P2.Operable'.D422]) ->  | R63: of:=IF( ISBLANK([$'P3.Comprensible'.D59]);"";[$'P3.Comprensible'.D59]) ->  | S63: of:=IF( ISBLANK([$'P3.Comprensible'.D158]);"";[$'P3.Comprensible'.D158]) ->  | T63: of:=IF( ISBLANK([$'P3.Comprensible'.D191]);"";[$'P3.Comprensible'.D191]) ->  | U63: of:=IF( ISBLANK([$'P3.Comprensible'.D290]);"";[$'P3.Comprensible'.D290]) ->  | V63: of:=IF( ISBLANK([$'P3.Comprensible'.D323]);"";[$'P3.Comprensible'.D323]) ->  | W63: of:=IF(ISBLANK([$'P4.Robusto'.D92]);"";[$'P4.Robusto'.D92]) -> 
B64: of:=IF( ISBLANK([$'03.Muestra'.$C$16]);"";[$'03.Muestra'.$C$16]) ->  | C64: of:=IF( ISBLANK([$'03.Muestra'.$E$16]);"";[$'03.Muestra'.$E$16]) ->  | D64: of:=IF( ISBLANK([$'P1.Perceptible'.D159]);"";[$'P1.Perceptible'.D159]) ->  | E64: of:=IF( ISBLANK([$'P1.Perceptible'.D192]);"";[$'P1.Perceptible'.D192]) ->  | F64: of:=IF( ISBLANK([$'P1.Perceptible'.D324]);"";[$'P1.Perceptible'.D324]) ->  | G64: of:=IF( ISBLANK([$'P1.Perceptible'.D357]);"";[$'P1.Perceptible'.D357]) ->  | H64: of:=IF( ISBLANK([$'P1.Perceptible'.D456]);"";[$'P1.Perceptible'.D456]) ->  | I64: of:=IF( ISBLANK([$'P1.Perceptible'.D489]);"";[$'P1.Perceptible'.D489]) ->  | J64: of:=IF( ISBLANK([$'P1.Perceptible'.D522]);"";[$'P1.Perceptible'.D522]) ->  | K64: of:=IF( ISBLANK([$'P1.Perceptible'.D555]);"";[$'P1.Perceptible'.D555]) ->  | L64: of:=IF( ISBLANK([$'P1.Perceptible'.D588]);"";[$'P1.Perceptible'.D588]) ->  | M64: of:=IF( ISBLANK([$'P1.Perceptible'.D621]);"";[$'P1.Perceptible'.D621]) ->  | N64: of:=IF( ISBLANK([$'P1.Perceptible'.D655]);"";[$'P1.Perceptible'.D655]) ->  | O64: of:=IF( ISBLANK([$'P2.Operable'.D357]);"";[$'P2.Operable'.D357]) ->  | P64: of:=IF( ISBLANK([$'P2.Operable'.D390]);"";[$'P2.Operable'.D390]) ->  | Q64: of:=IF( ISBLANK([$'P2.Operable'.D423]);"";[$'P2.Operable'.D423]) ->  | R64: of:=IF( ISBLANK([$'P3.Comprensible'.D60]);"";[$'P3.Comprensible'.D60]) ->  | S64: of:=IF( ISBLANK([$'P3.Comprensible'.D159]);"";[$'P3.Comprensible'.D159]) ->  | T64: of:=IF( ISBLANK([$'P3.Comprensible'.D192]);"";[$'P3.Comprensible'.D192]) ->  | U64: of:=IF( ISBLANK([$'P3.Comprensible'.D291]);"";[$'P3.Comprensible'.D291]) ->  | V64: of:=IF( ISBLANK([$'P3.Comprensible'.D324]);"";[$'P3.Comprensible'.D324]) ->  | W64: of:=IF(ISBLANK([$'P4.Robusto'.D93]);"";[$'P4.Robusto'.D93]) -> 
B65: of:=IF( ISBLANK([$'03.Muestra'.$C$17]);"";[$'03.Muestra'.$C$17]) ->  | C65: of:=IF( ISBLANK([$'03.Muestra'.$E$17]);"";[$'03.Muestra'.$E$17]) ->  | D65: of:=IF( ISBLANK([$'P1.Perceptible'.D160]);"";[$'P1.Perceptible'.D160]) ->  | E65: of:=IF( ISBLANK([$'P1.Perceptible'.D193]);"";[$'P1.Perceptible'.D193]) ->  | F65: of:=IF( ISBLANK([$'P1.Perceptible'.D325]);"";[$'P1.Perceptible'.D325]) ->  | G65: of:=IF( ISBLANK([$'P1.Perceptible'.D358]);"";[$'P1.Perceptible'.D358]) ->  | H65: of:=IF( ISBLANK([$'P1.Perceptible'.D457]);"";[$'P1.Perceptible'.D457]) ->  | I65: of:=IF( ISBLANK([$'P1.Perceptible'.D490]);"";[$'P1.Perceptible'.D490]) ->  | J65: of:=IF( ISBLANK([$'P1.Perceptible'.D523]);"";[$'P1.Perceptible'.D523]) ->  | K65: of:=IF( ISBLANK([$'P1.Perceptible'.D556]);"";[$'P1.Perceptible'.D556]) ->  | L65: of:=IF( ISBLANK([$'P1.Perceptible'.D589]);"";[$'P1.Perceptible'.D589]) ->  | M65: of:=IF( ISBLANK([$'P1.Perceptible'.D622]);"";[$'P1.Perceptible'.D622]) ->  | N65: of:=IF( ISBLANK([$'P1.Perceptible'.D656]);"";[$'P1.Perceptible'.D656]) ->  | O65: of:=IF( ISBLANK([$'P2.Operable'.D358]);"";[$'P2.Operable'.D358]) ->  | P65: of:=IF( ISBLANK([$'P2.Operable'.D391]);"";[$'P2.Operable'.D391]) ->  | Q65: of:=IF( ISBLANK([$'P2.Operable'.D424]);"";[$'P2.Operable'.D424]) ->  | R65: of:=IF( ISBLANK([$'P3.Comprensible'.D61]);"";[$'P3.Comprensible'.D61]) ->  | S65: of:=IF( ISBLANK([$'P3.Comprensible'.D160]);"";[$'P3.Comprensible'.D160]) ->  | T65: of:=IF( ISBLANK([$'P3.Comprensible'.D193]);"";[$'P3.Comprensible'.D193]) ->  | U65: of:=IF( ISBLANK([$'P3.Comprensible'.D292]);"";[$'P3.Comprensible'.D292]) ->  | V65: of:=IF( ISBLANK([$'P3.Comprensible'.D325]);"";[$'P3.Comprensible'.D325]) ->  | W65: of:=IF(ISBLANK([$'P4.Robusto'.D94]);"";[$'P4.Robusto'.D94]) -> 
B66: of:=IF( ISBLANK([$'03.Muestra'.$C$18]);"";[$'03.Muestra'.$C$18]) ->  | C66: of:=IF( ISBLANK([$'03.Muestra'.$E$18]);"";[$'03.Muestra'.$E$18]) ->  | D66: of:=IF( ISBLANK([$'P1.Perceptible'.D161]);"";[$'P1.Perceptible'.D161]) ->  | E66: of:=IF( ISBLANK([$'P1.Perceptible'.D194]);"";[$'P1.Perceptible'.D194]) ->  | F66: of:=IF( ISBLANK([$'P1.Perceptible'.D326]);"";[$'P1.Perceptible'.D326]) ->  | G66: of:=IF( ISBLANK([$'P1.Perceptible'.D359]);"";[$'P1.Perceptible'.D359]) ->  | H66: of:=IF( ISBLANK([$'P1.Perceptible'.D458]);"";[$'P1.Perceptible'.D458]) ->  | I66: of:=IF( ISBLANK([$'P1.Perceptible'.D491]);"";[$'P1.Perceptible'.D491]) ->  | J66: of:=IF( ISBLANK([$'P1.Perceptible'.D524]);"";[$'P1.Perceptible'.D524]) ->  | K66: of:=IF( ISBLANK([$'P1.Perceptible'.D557]);"";[$'P1.Perceptible'.D557]) ->  | L66: of:=IF( ISBLANK([$'P1.Perceptible'.D590]);"";[$'P1.Perceptible'.D590]) ->  | M66: of:=IF( ISBLANK([$'P1.Perceptible'.D623]);"";[$'P1.Perceptible'.D623]) ->  | N66: of:=IF( ISBLANK([$'P1.Perceptible'.D657]);"";[$'P1.Perceptible'.D657]) ->  | O66: of:=IF( ISBLANK([$'P2.Operable'.D359]);"";[$'P2.Operable'.D359]) ->  | P66: of:=IF( ISBLANK([$'P2.Operable'.D392]);"";[$'P2.Operable'.D392]) ->  | Q66: of:=IF( ISBLANK([$'P2.Operable'.D425]);"";[$'P2.Operable'.D425]) ->  | R66: of:=IF( ISBLANK([$'P3.Comprensible'.D62]);"";[$'P3.Comprensible'.D62]) ->  | S66: of:=IF( ISBLANK([$'P3.Comprensible'.D161]);"";[$'P3.Comprensible'.D161]) ->  | T66: of:=IF( ISBLANK([$'P3.Comprensible'.D194]);"";[$'P3.Comprensible'.D194]) ->  | U66: of:=IF( ISBLANK([$'P3.Comprensible'.D293]);"";[$'P3.Comprensible'.D293]) ->  | V66: of:=IF( ISBLANK([$'P3.Comprensible'.D326]);"";[$'P3.Comprensible'.D326]) ->  | W66: of:=IF(ISBLANK([$'P4.Robusto'.D95]);"";[$'P4.Robusto'.D95]) -> 
B67: of:=IF( ISBLANK([$'03.Muestra'.$C$19]);"";[$'03.Muestra'.$C$19]) ->  | C67: of:=IF( ISBLANK([$'03.Muestra'.$E$19]);"";[$'03.Muestra'.$E$19]) ->  | D67: of:=IF( ISBLANK([$'P1.Perceptible'.D162]);"";[$'P1.Perceptible'.D162]) ->  | E67: of:=IF( ISBLANK([$'P1.Perceptible'.D195]);"";[$'P1.Perceptible'.D195]) ->  | F67: of:=IF( ISBLANK([$'P1.Perceptible'.D327]);"";[$'P1.Perceptible'.D327]) ->  | G67: of:=IF( ISBLANK([$'P1.Perceptible'.D360]);"";[$'P1.Perceptible'.D360]) ->  | H67: of:=IF( ISBLANK([$'P1.Perceptible'.D459]);"";[$'P1.Perceptible'.D459]) ->  | I67: of:=IF( ISBLANK([$'P1.Perceptible'.D492]);"";[$'P1.Perceptible'.D492]) ->  | J67: of:=IF( ISBLANK([$'P1.Perceptible'.D525]);"";[$'P1.Perceptible'.D525]) ->  | K67: of:=IF( ISBLANK([$'P1.Perceptible'.D558]);"";[$'P1.Perceptible'.D558]) ->  | L67: of:=IF( ISBLANK([$'P1.Perceptible'.D591]);"";[$'P1.Perceptible'.D591]) ->  | M67: of:=IF( ISBLANK([$'P1.Perceptible'.D624]);"";[$'P1.Perceptible'.D624]) ->  | N67: of:=IF( ISBLANK([$'P1.Perceptible'.D658]);"";[$'P1.Perceptible'.D658]) ->  | O67: of:=IF( ISBLANK([$'P2.Operable'.D360]);"";[$'P2.Operable'.D360]) ->  | P67: of:=IF( ISBLANK([$'P2.Operable'.D393]);"";[$'P2.Operable'.D393]) ->  | Q67: of:=IF( ISBLANK([$'P2.Operable'.D426]);"";[$'P2.Operable'.D426]) ->  | R67: of:=IF( ISBLANK([$'P3.Comprensible'.D63]);"";[$'P3.Comprensible'.D63]) ->  | S67: of:=IF( ISBLANK([$'P3.Comprensible'.D162]);"";[$'P3.Comprensible'.D162]) ->  | T67: of:=IF( ISBLANK([$'P3.Comprensible'.D195]);"";[$'P3.Comprensible'.D195]) ->  | U67: of:=IF( ISBLANK([$'P3.Comprensible'.D294]);"";[$'P3.Comprensible'.D294]) ->  | V67: of:=IF( ISBLANK([$'P3.Comprensible'.D327]);"";[$'P3.Comprensible'.D327]) ->  | W67: of:=IF(ISBLANK([$'P4.Robusto'.D96]);"";[$'P4.Robusto'.D96]) -> 
B68: of:=IF( ISBLANK([$'03.Muestra'.$C$20]);"";[$'03.Muestra'.$C$20]) ->  | C68: of:=IF( ISBLANK([$'03.Muestra'.$E$20]);"";[$'03.Muestra'.$E$20]) ->  | D68: of:=IF( ISBLANK([$'P1.Perceptible'.D163]);"";[$'P1.Perceptible'.D163]) ->  | E68: of:=IF( ISBLANK([$'P1.Perceptible'.D196]);"";[$'P1.Perceptible'.D196]) ->  | F68: of:=IF( ISBLANK([$'P1.Perceptible'.D328]);"";[$'P1.Perceptible'.D328]) ->  | G68: of:=IF( ISBLANK([$'P1.Perceptible'.D361]);"";[$'P1.Perceptible'.D361]) ->  | H68: of:=IF( ISBLANK([$'P1.Perceptible'.D460]);"";[$'P1.Perceptible'.D460]) ->  | I68: of:=IF( ISBLANK([$'P1.Perceptible'.D493]);"";[$'P1.Perceptible'.D493]) ->  | J68: of:=IF( ISBLANK([$'P1.Perceptible'.D526]);"";[$'P1.Perceptible'.D526]) ->  | K68: of:=IF( ISBLANK([$'P1.Perceptible'.D559]);"";[$'P1.Perceptible'.D559]) ->  | L68: of:=IF( ISBLANK([$'P1.Perceptible'.D592]);"";[$'P1.Perceptible'.D592]) ->  | M68: of:=IF( ISBLANK([$'P1.Perceptible'.D625]);"";[$'P1.Perceptible'.D625]) ->  | N68: of:=IF( ISBLANK([$'P1.Perceptible'.D659]);"";[$'P1.Perceptible'.D659]) ->  | O68: of:=IF( ISBLANK([$'P2.Operable'.D361]);"";[$'P2.Operable'.D361]) ->  | P68: of:=IF( ISBLANK([$'P2.Operable'.D394]);"";[$'P2.Operable'.D394]) ->  | Q68: of:=IF( ISBLANK([$'P2.Operable'.D427]);"";[$'P2.Operable'.D427]) ->  | R68: of:=IF( ISBLANK([$'P3.Comprensible'.D64]);"";[$'P3.Comprensible'.D64]) ->  | S68: of:=IF( ISBLANK([$'P3.Comprensible'.D163]);"";[$'P3.Comprensible'.D163]) ->  | T68: of:=IF( ISBLANK([$'P3.Comprensible'.D196]);"";[$'P3.Comprensible'.D196]) ->  | U68: of:=IF( ISBLANK([$'P3.Comprensible'.D295]);"";[$'P3.Comprensible'.D295]) ->  | V68: of:=IF( ISBLANK([$'P3.Comprensible'.D328]);"";[$'P3.Comprensible'.D328]) ->  | W68: of:=IF(ISBLANK([$'P4.Robusto'.D97]);"";[$'P4.Robusto'.D97]) -> 
B69: of:=IF( ISBLANK([$'03.Muestra'.$C$21]);"";[$'03.Muestra'.$C$21]) ->  | C69: of:=IF( ISBLANK([$'03.Muestra'.$E$21]);"";[$'03.Muestra'.$E$21]) ->  | D69: of:=IF( ISBLANK([$'P1.Perceptible'.D164]);"";[$'P1.Perceptible'.D164]) ->  | E69: of:=IF( ISBLANK([$'P1.Perceptible'.D197]);"";[$'P1.Perceptible'.D197]) ->  | F69: of:=IF( ISBLANK([$'P1.Perceptible'.D329]);"";[$'P1.Perceptible'.D329]) ->  | G69: of:=IF( ISBLANK([$'P1.Perceptible'.D362]);"";[$'P1.Perceptible'.D362]) ->  | H69: of:=IF( ISBLANK([$'P1.Perceptible'.D461]);"";[$'P1.Perceptible'.D461]) ->  | I69: of:=IF( ISBLANK([$'P1.Perceptible'.D494]);"";[$'P1.Perceptible'.D494]) ->  | J69: of:=IF( ISBLANK([$'P1.Perceptible'.D527]);"";[$'P1.Perceptible'.D527]) ->  | K69: of:=IF( ISBLANK([$'P1.Perceptible'.D560]);"";[$'P1.Perceptible'.D560]) ->  | L69: of:=IF( ISBLANK([$'P1.Perceptible'.D593]);"";[$'P1.Perceptible'.D593]) ->  | M69: of:=IF( ISBLANK([$'P1.Perceptible'.D626]);"";[$'P1.Perceptible'.D626]) ->  | N69: of:=IF( ISBLANK([$'P1.Perceptible'.D660]);"";[$'P1.Perceptible'.D660]) ->  | O69: of:=IF( ISBLANK([$'P2.Operable'.D362]);"";[$'P2.Operable'.D362]) ->  | P69: of:=IF( ISBLANK([$'P2.Operable'.D395]);"";[$'P2.Operable'.D395]) ->  | Q69: of:=IF( ISBLANK([$'P2.Operable'.D428]);"";[$'P2.Operable'.D428]) ->  | R69: of:=IF( ISBLANK([$'P3.Comprensible'.D65]);"";[$'P3.Comprensible'.D65]) ->  | S69: of:=IF( ISBLANK([$'P3.Comprensible'.D164]);"";[$'P3.Comprensible'.D164]) ->  | T69: of:=IF( ISBLANK([$'P3.Comprensible'.D197]);"";[$'P3.Comprensible'.D197]) ->  | U69: of:=IF( ISBLANK([$'P3.Comprensible'.D296]);"";[$'P3.Comprensible'.D296]) ->  | V69: of:=IF( ISBLANK([$'P3.Comprensible'.D329]);"";[$'P3.Comprensible'.D329]) ->  | W69: of:=IF(ISBLANK([$'P4.Robusto'.D98]);"";[$'P4.Robusto'.D98]) -> 
B70: of:=IF( ISBLANK([$'03.Muestra'.$C$22]);"";[$'03.Muestra'.$C$22]) ->  | C70: of:=IF( ISBLANK([$'03.Muestra'.$E$22]);"";[$'03.Muestra'.$E$22]) ->  | D70: of:=IF( ISBLANK([$'P1.Perceptible'.D165]);"";[$'P1.Perceptible'.D165]) ->  | E70: of:=IF( ISBLANK([$'P1.Perceptible'.D198]);"";[$'P1.Perceptible'.D198]) ->  | F70: of:=IF( ISBLANK([$'P1.Perceptible'.D330]);"";[$'P1.Perceptible'.D330]) ->  | G70: of:=IF( ISBLANK([$'P1.Perceptible'.D363]);"";[$'P1.Perceptible'.D363]) ->  | H70: of:=IF( ISBLANK([$'P1.Perceptible'.D462]);"";[$'P1.Perceptible'.D462]) ->  | I70: of:=IF( ISBLANK([$'P1.Perceptible'.D495]);"";[$'P1.Perceptible'.D495]) ->  | J70: of:=IF( ISBLANK([$'P1.Perceptible'.D528]);"";[$'P1.Perceptible'.D528]) ->  | K70: of:=IF( ISBLANK([$'P1.Perceptible'.D561]);"";[$'P1.Perceptible'.D561]) ->  | L70: of:=IF( ISBLANK([$'P1.Perceptible'.D594]);"";[$'P1.Perceptible'.D594]) ->  | M70: of:=IF( ISBLANK([$'P1.Perceptible'.D627]);"";[$'P1.Perceptible'.D627]) ->  | N70: of:=IF( ISBLANK([$'P1.Perceptible'.D661]);"";[$'P1.Perceptible'.D661]) ->  | O70: of:=IF( ISBLANK([$'P2.Operable'.D363]);"";[$'P2.Operable'.D363]) ->  | P70: of:=IF( ISBLANK([$'P2.Operable'.D396]);"";[$'P2.Operable'.D396]) ->  | Q70: of:=IF( ISBLANK([$'P2.Operable'.D429]);"";[$'P2.Operable'.D429]) ->  | R70: of:=IF( ISBLANK([$'P3.Comprensible'.D66]);"";[$'P3.Comprensible'.D66]) ->  | S70: of:=IF( ISBLANK([$'P3.Comprensible'.D165]);"";[$'P3.Comprensible'.D165]) ->  | T70: of:=IF( ISBLANK([$'P3.Comprensible'.D198]);"";[$'P3.Comprensible'.D198]) ->  | U70: of:=IF( ISBLANK([$'P3.Comprensible'.D297]);"";[$'P3.Comprensible'.D297]) ->  | V70: of:=IF( ISBLANK([$'P3.Comprensible'.D330]);"";[$'P3.Comprensible'.D330]) ->  | W70: of:=IF(ISBLANK([$'P4.Robusto'.D99]);"";[$'P4.Robusto'.D99]) -> 
B71: of:=IF( ISBLANK([$'03.Muestra'.$C$23]);"";[$'03.Muestra'.$C$23]) ->  | C71: of:=IF( ISBLANK([$'03.Muestra'.$E$23]);"";[$'03.Muestra'.$E$23]) ->  | D71: of:=IF( ISBLANK([$'P1.Perceptible'.D166]);"";[$'P1.Perceptible'.D166]) ->  | E71: of:=IF( ISBLANK([$'P1.Perceptible'.D199]);"";[$'P1.Perceptible'.D199]) ->  | F71: of:=IF( ISBLANK([$'P1.Perceptible'.D331]);"";[$'P1.Perceptible'.D331]) ->  | G71: of:=IF( ISBLANK([$'P1.Perceptible'.D364]);"";[$'P1.Perceptible'.D364]) ->  | H71: of:=IF( ISBLANK([$'P1.Perceptible'.D463]);"";[$'P1.Perceptible'.D463]) ->  | I71: of:=IF( ISBLANK([$'P1.Perceptible'.D496]);"";[$'P1.Perceptible'.D496]) ->  | J71: of:=IF( ISBLANK([$'P1.Perceptible'.D529]);"";[$'P1.Perceptible'.D529]) ->  | K71: of:=IF( ISBLANK([$'P1.Perceptible'.D562]);"";[$'P1.Perceptible'.D562]) ->  | L71: of:=IF( ISBLANK([$'P1.Perceptible'.D595]);"";[$'P1.Perceptible'.D595]) ->  | M71: of:=IF( ISBLANK([$'P1.Perceptible'.D628]);"";[$'P1.Perceptible'.D628]) ->  | N71: of:=IF( ISBLANK([$'P1.Perceptible'.D662]);"";[$'P1.Perceptible'.D662]) ->  | O71: of:=IF( ISBLANK([$'P2.Operable'.D364]);"";[$'P2.Operable'.D364]) ->  | P71: of:=IF( ISBLANK([$'P2.Operable'.D397]);"";[$'P2.Operable'.D397]) ->  | Q71: of:=IF( ISBLANK([$'P2.Operable'.D430]);"";[$'P2.Operable'.D430]) ->  | R71: of:=IF( ISBLANK([$'P3.Comprensible'.D67]);"";[$'P3.Comprensible'.D67]) ->  | S71: of:=IF( ISBLANK([$'P3.Comprensible'.D166]);"";[$'P3.Comprensible'.D166]) ->  | T71: of:=IF( ISBLANK([$'P3.Comprensible'.D199]);"";[$'P3.Comprensible'.D199]) ->  | U71: of:=IF( ISBLANK([$'P3.Comprensible'.D298]);"";[$'P3.Comprensible'.D298]) ->  | V71: of:=IF( ISBLANK([$'P3.Comprensible'.D331]);"";[$'P3.Comprensible'.D331]) ->  | W71: of:=IF(ISBLANK([$'P4.Robusto'.D100]);"";[$'P4.Robusto'.D100]) -> 
B72: of:=IF( ISBLANK([$'03.Muestra'.$C$24]);"";[$'03.Muestra'.$C$24]) ->  | C72: of:=IF( ISBLANK([$'03.Muestra'.$E$24]);"";[$'03.Muestra'.$E$24]) ->  | D72: of:=IF( ISBLANK([$'P1.Perceptible'.D167]);"";[$'P1.Perceptible'.D167]) ->  | E72: of:=IF( ISBLANK([$'P1.Perceptible'.D200]);"";[$'P1.Perceptible'.D200]) ->  | F72: of:=IF( ISBLANK([$'P1.Perceptible'.D332]);"";[$'P1.Perceptible'.D332]) ->  | G72: of:=IF( ISBLANK([$'P1.Perceptible'.D365]);"";[$'P1.Perceptible'.D365]) ->  | H72: of:=IF( ISBLANK([$'P1.Perceptible'.D464]);"";[$'P1.Perceptible'.D464]) ->  | I72: of:=IF( ISBLANK([$'P1.Perceptible'.D497]);"";[$'P1.Perceptible'.D497]) ->  | J72: of:=IF( ISBLANK([$'P1.Perceptible'.D530]);"";[$'P1.Perceptible'.D530]) ->  | K72: of:=IF( ISBLANK([$'P1.Perceptible'.D563]);"";[$'P1.Perceptible'.D563]) ->  | L72: of:=IF( ISBLANK([$'P1.Perceptible'.D596]);"";[$'P1.Perceptible'.D596]) ->  | M72: of:=IF( ISBLANK([$'P1.Perceptible'.D629]);"";[$'P1.Perceptible'.D629]) ->  | N72: of:=IF( ISBLANK([$'P1.Perceptible'.D663]);"";[$'P1.Perceptible'.D663]) ->  | O72: of:=IF( ISBLANK([$'P2.Operable'.D365]);"";[$'P2.Operable'.D365]) ->  | P72: of:=IF( ISBLANK([$'P2.Operable'.D398]);"";[$'P2.Operable'.D398]) ->  | Q72: of:=IF( ISBLANK([$'P2.Operable'.D431]);"";[$'P2.Operable'.D431]) ->  | R72: of:=IF( ISBLANK([$'P3.Comprensible'.D68]);"";[$'P3.Comprensible'.D68]) ->  | S72: of:=IF( ISBLANK([$'P3.Comprensible'.D167]);"";[$'P3.Comprensible'.D167]) ->  | T72: of:=IF( ISBLANK([$'P3.Comprensible'.D200]);"";[$'P3.Comprensible'.D200]) ->  | U72: of:=IF( ISBLANK([$'P3.Comprensible'.D299]);"";[$'P3.Comprensible'.D299]) ->  | V72: of:=IF( ISBLANK([$'P3.Comprensible'.D332]);"";[$'P3.Comprensible'.D332]) ->  | W72: of:=IF(ISBLANK([$'P4.Robusto'.D101]);"";[$'P4.Robusto'.D101]) -> 
B73: of:=IF( ISBLANK([$'03.Muestra'.$C$25]);"";[$'03.Muestra'.$C$25]) ->  | C73: of:=IF( ISBLANK([$'03.Muestra'.$E$25]);"";[$'03.Muestra'.$E$25]) ->  | D73: of:=IF( ISBLANK([$'P1.Perceptible'.D168]);"";[$'P1.Perceptible'.D168]) ->  | E73: of:=IF( ISBLANK([$'P1.Perceptible'.D201]);"";[$'P1.Perceptible'.D201]) ->  | F73: of:=IF( ISBLANK([$'P1.Perceptible'.D333]);"";[$'P1.Perceptible'.D333]) ->  | G73: of:=IF( ISBLANK([$'P1.Perceptible'.D366]);"";[$'P1.Perceptible'.D366]) ->  | H73: of:=IF( ISBLANK([$'P1.Perceptible'.D465]);"";[$'P1.Perceptible'.D465]) ->  | I73: of:=IF( ISBLANK([$'P1.Perceptible'.D498]);"";[$'P1.Perceptible'.D498]) ->  | J73: of:=IF( ISBLANK([$'P1.Perceptible'.D531]);"";[$'P1.Perceptible'.D531]) ->  | K73: of:=IF( ISBLANK([$'P1.Perceptible'.D564]);"";[$'P1.Perceptible'.D564]) ->  | L73: of:=IF( ISBLANK([$'P1.Perceptible'.D597]);"";[$'P1.Perceptible'.D597]) ->  | M73: of:=IF( ISBLANK([$'P1.Perceptible'.D630]);"";[$'P1.Perceptible'.D630]) ->  | N73: of:=IF( ISBLANK([$'P1.Perceptible'.D664]);"";[$'P1.Perceptible'.D664]) ->  | O73: of:=IF( ISBLANK([$'P2.Operable'.D366]);"";[$'P2.Operable'.D366]) ->  | P73: of:=IF( ISBLANK([$'P2.Operable'.D399]);"";[$'P2.Operable'.D399]) ->  | Q73: of:=IF( ISBLANK([$'P2.Operable'.D432]);"";[$'P2.Operable'.D432]) ->  | R73: of:=IF( ISBLANK([$'P3.Comprensible'.D69]);"";[$'P3.Comprensible'.D69]) ->  | S73: of:=IF( ISBLANK([$'P3.Comprensible'.D168]);"";[$'P3.Comprensible'.D168]) ->  | T73: of:=IF( ISBLANK([$'P3.Comprensible'.D201]);"";[$'P3.Comprensible'.D201]) ->  | U73: of:=IF( ISBLANK([$'P3.Comprensible'.D300]);"";[$'P3.Comprensible'.D300]) ->  | V73: of:=IF( ISBLANK([$'P3.Comprensible'.D333]);"";[$'P3.Comprensible'.D333]) ->  | W73: of:=IF(ISBLANK([$'P4.Robusto'.D102]);"";[$'P4.Robusto'.D102]) -> 
B74: of:=IF( ISBLANK([$'03.Muestra'.$C$26]);"";[$'03.Muestra'.$C$26]) ->  | C74: of:=IF( ISBLANK([$'03.Muestra'.$E$26]);"";[$'03.Muestra'.$E$26]) ->  | D74: of:=IF( ISBLANK([$'P1.Perceptible'.D169]);"";[$'P1.Perceptible'.D169]) ->  | E74: of:=IF( ISBLANK([$'P1.Perceptible'.D202]);"";[$'P1.Perceptible'.D202]) ->  | F74: of:=IF( ISBLANK([$'P1.Perceptible'.D334]);"";[$'P1.Perceptible'.D334]) ->  | G74: of:=IF( ISBLANK([$'P1.Perceptible'.D367]);"";[$'P1.Perceptible'.D367]) ->  | H74: of:=IF( ISBLANK([$'P1.Perceptible'.D466]);"";[$'P1.Perceptible'.D466]) ->  | I74: of:=IF( ISBLANK([$'P1.Perceptible'.D499]);"";[$'P1.Perceptible'.D499]) ->  | J74: of:=IF( ISBLANK([$'P1.Perceptible'.D532]);"";[$'P1.Perceptible'.D532]) ->  | K74: of:=IF( ISBLANK([$'P1.Perceptible'.D565]);"";[$'P1.Perceptible'.D565]) ->  | L74: of:=IF( ISBLANK([$'P1.Perceptible'.D598]);"";[$'P1.Perceptible'.D598]) ->  | M74: of:=IF( ISBLANK([$'P1.Perceptible'.D631]);"";[$'P1.Perceptible'.D631]) ->  | N74: of:=IF( ISBLANK([$'P1.Perceptible'.D665]);"";[$'P1.Perceptible'.D665]) ->  | O74: of:=IF( ISBLANK([$'P2.Operable'.D367]);"";[$'P2.Operable'.D367]) ->  | P74: of:=IF( ISBLANK([$'P2.Operable'.D400]);"";[$'P2.Operable'.D400]) ->  | Q74: of:=IF( ISBLANK([$'P2.Operable'.D433]);"";[$'P2.Operable'.D433]) ->  | R74: of:=IF( ISBLANK([$'P3.Comprensible'.D70]);"";[$'P3.Comprensible'.D70]) ->  | S74: of:=IF( ISBLANK([$'P3.Comprensible'.D169]);"";[$'P3.Comprensible'.D169]) ->  | T74: of:=IF( ISBLANK([$'P3.Comprensible'.D202]);"";[$'P3.Comprensible'.D202]) ->  | U74: of:=IF( ISBLANK([$'P3.Comprensible'.D301]);"";[$'P3.Comprensible'.D301]) ->  | V74: of:=IF( ISBLANK([$'P3.Comprensible'.D334]);"";[$'P3.Comprensible'.D334]) ->  | W74: of:=IF(ISBLANK([$'P4.Robusto'.D103]);"";[$'P4.Robusto'.D103]) -> 
B75: of:=IF( ISBLANK([$'03.Muestra'.$C$27]);"";[$'03.Muestra'.$C$27]) ->  | C75: of:=IF( ISBLANK([$'03.Muestra'.$E$27]);"";[$'03.Muestra'.$E$27]) ->  | D75: of:=IF( ISBLANK([$'P1.Perceptible'.D170]);"";[$'P1.Perceptible'.D170]) ->  | E75: of:=IF( ISBLANK([$'P1.Perceptible'.D203]);"";[$'P1.Perceptible'.D203]) ->  | F75: of:=IF( ISBLANK([$'P1.Perceptible'.D335]);"";[$'P1.Perceptible'.D335]) ->  | G75: of:=IF( ISBLANK([$'P1.Perceptible'.D368]);"";[$'P1.Perceptible'.D368]) ->  | H75: of:=IF( ISBLANK([$'P1.Perceptible'.D467]);"";[$'P1.Perceptible'.D467]) ->  | I75: of:=IF( ISBLANK([$'P1.Perceptible'.D500]);"";[$'P1.Perceptible'.D500]) ->  | J75: of:=IF( ISBLANK([$'P1.Perceptible'.D533]);"";[$'P1.Perceptible'.D533]) ->  | K75: of:=IF( ISBLANK([$'P1.Perceptible'.D566]);"";[$'P1.Perceptible'.D566]) ->  | L75: of:=IF( ISBLANK([$'P1.Perceptible'.D599]);"";[$'P1.Perceptible'.D599]) ->  | M75: of:=IF( ISBLANK([$'P1.Perceptible'.D632]);"";[$'P1.Perceptible'.D632]) ->  | N75: of:=IF( ISBLANK([$'P1.Perceptible'.D666]);"";[$'P1.Perceptible'.D666]) ->  | O75: of:=IF( ISBLANK([$'P2.Operable'.D368]);"";[$'P2.Operable'.D368]) ->  | P75: of:=IF( ISBLANK([$'P2.Operable'.D401]);"";[$'P2.Operable'.D401]) ->  | Q75: of:=IF( ISBLANK([$'P2.Operable'.D434]);"";[$'P2.Operable'.D434]) ->  | R75: of:=IF( ISBLANK([$'P3.Comprensible'.D71]);"";[$'P3.Comprensible'.D71]) ->  | S75: of:=IF( ISBLANK([$'P3.Comprensible'.D170]);"";[$'P3.Comprensible'.D170]) ->  | T75: of:=IF( ISBLANK([$'P3.Comprensible'.D203]);"";[$'P3.Comprensible'.D203]) ->  | U75: of:=IF( ISBLANK([$'P3.Comprensible'.D302]);"";[$'P3.Comprensible'.D302]) ->  | V75: of:=IF( ISBLANK([$'P3.Comprensible'.D335]);"";[$'P3.Comprensible'.D335]) ->  | W75: of:=IF(ISBLANK([$'P4.Robusto'.D104]);"";[$'P4.Robusto'.D104]) -> 
B76: of:=IF( ISBLANK([$'03.Muestra'.$C$28]);"";[$'03.Muestra'.$C$28]) ->  | C76: of:=IF( ISBLANK([$'03.Muestra'.$E$28]);"";[$'03.Muestra'.$E$28]) ->  | D76: of:=IF( ISBLANK([$'P1.Perceptible'.D171]);"";[$'P1.Perceptible'.D171]) ->  | E76: of:=IF( ISBLANK([$'P1.Perceptible'.D204]);"";[$'P1.Perceptible'.D204]) ->  | F76: of:=IF( ISBLANK([$'P1.Perceptible'.D336]);"";[$'P1.Perceptible'.D336]) ->  | G76: of:=IF( ISBLANK([$'P1.Perceptible'.D369]);"";[$'P1.Perceptible'.D369]) ->  | H76: of:=IF( ISBLANK([$'P1.Perceptible'.D468]);"";[$'P1.Perceptible'.D468]) ->  | I76: of:=IF( ISBLANK([$'P1.Perceptible'.D501]);"";[$'P1.Perceptible'.D501]) ->  | J76: of:=IF( ISBLANK([$'P1.Perceptible'.D534]);"";[$'P1.Perceptible'.D534]) ->  | K76: of:=IF( ISBLANK([$'P1.Perceptible'.D567]);"";[$'P1.Perceptible'.D567]) ->  | L76: of:=IF( ISBLANK([$'P1.Perceptible'.D600]);"";[$'P1.Perceptible'.D600]) ->  | M76: of:=IF( ISBLANK([$'P1.Perceptible'.D633]);"";[$'P1.Perceptible'.D633]) ->  | N76: of:=IF( ISBLANK([$'P1.Perceptible'.D667]);"";[$'P1.Perceptible'.D667]) ->  | O76: of:=IF( ISBLANK([$'P2.Operable'.D369]);"";[$'P2.Operable'.D369]) ->  | P76: of:=IF( ISBLANK([$'P2.Operable'.D402]);"";[$'P2.Operable'.D402]) ->  | Q76: of:=IF( ISBLANK([$'P2.Operable'.D435]);"";[$'P2.Operable'.D435]) ->  | R76: of:=IF( ISBLANK([$'P3.Comprensible'.D72]);"";[$'P3.Comprensible'.D72]) ->  | S76: of:=IF( ISBLANK([$'P3.Comprensible'.D171]);"";[$'P3.Comprensible'.D171]) ->  | T76: of:=IF( ISBLANK([$'P3.Comprensible'.D204]);"";[$'P3.Comprensible'.D204]) ->  | U76: of:=IF( ISBLANK([$'P3.Comprensible'.D303]);"";[$'P3.Comprensible'.D303]) ->  | V76: of:=IF( ISBLANK([$'P3.Comprensible'.D336]);"";[$'P3.Comprensible'.D336]) ->  | W76: of:=IF(ISBLANK([$'P4.Robusto'.D105]);"";[$'P4.Robusto'.D105]) -> 
B77: of:=IF( ISBLANK([$'03.Muestra'.$C$29]);"";[$'03.Muestra'.$C$29]) ->  | C77: of:=IF( ISBLANK([$'03.Muestra'.$E$29]);"";[$'03.Muestra'.$E$29]) ->  | D77: of:=IF( ISBLANK([$'P1.Perceptible'.D172]);"";[$'P1.Perceptible'.D172]) ->  | E77: of:=IF( ISBLANK([$'P1.Perceptible'.D205]);"";[$'P1.Perceptible'.D205]) ->  | F77: of:=IF( ISBLANK([$'P1.Perceptible'.D337]);"";[$'P1.Perceptible'.D337]) ->  | G77: of:=IF( ISBLANK([$'P1.Perceptible'.D370]);"";[$'P1.Perceptible'.D370]) ->  | H77: of:=IF( ISBLANK([$'P1.Perceptible'.D469]);"";[$'P1.Perceptible'.D469]) ->  | I77: of:=IF( ISBLANK([$'P1.Perceptible'.D502]);"";[$'P1.Perceptible'.D502]) ->  | J77: of:=IF( ISBLANK([$'P1.Perceptible'.D535]);"";[$'P1.Perceptible'.D535]) ->  | K77: of:=IF( ISBLANK([$'P1.Perceptible'.D568]);"";[$'P1.Perceptible'.D568]) ->  | L77: of:=IF( ISBLANK([$'P1.Perceptible'.D601]);"";[$'P1.Perceptible'.D601]) ->  | M77: of:=IF( ISBLANK([$'P1.Perceptible'.D634]);"";[$'P1.Perceptible'.D634]) ->  | N77: of:=IF( ISBLANK([$'P1.Perceptible'.D668]);"";[$'P1.Perceptible'.D668]) ->  | O77: of:=IF( ISBLANK([$'P2.Operable'.D370]);"";[$'P2.Operable'.D370]) ->  | P77: of:=IF( ISBLANK([$'P2.Operable'.D403]);"";[$'P2.Operable'.D403]) ->  | Q77: of:=IF( ISBLANK([$'P2.Operable'.D436]);"";[$'P2.Operable'.D436]) ->  | R77: of:=IF( ISBLANK([$'P3.Comprensible'.D73]);"";[$'P3.Comprensible'.D73]) ->  | S77: of:=IF( ISBLANK([$'P3.Comprensible'.D172]);"";[$'P3.Comprensible'.D172]) ->  | T77: of:=IF( ISBLANK([$'P3.Comprensible'.D205]);"";[$'P3.Comprensible'.D205]) ->  | U77: of:=IF( ISBLANK([$'P3.Comprensible'.D304]);"";[$'P3.Comprensible'.D304]) ->  | V77: of:=IF( ISBLANK([$'P3.Comprensible'.D337]);"";[$'P3.Comprensible'.D337]) ->  | W77: of:=IF(ISBLANK([$'P4.Robusto'.D106]);"";[$'P4.Robusto'.D106]) -> 
B78: of:=IF( ISBLANK([$'03.Muestra'.$C$30]);"";[$'03.Muestra'.$C$30]) ->  | C78: of:=IF( ISBLANK([$'03.Muestra'.$E$30]);"";[$'03.Muestra'.$E$30]) ->  | D78: of:=IF( ISBLANK([$'P1.Perceptible'.D173]);"";[$'P1.Perceptible'.D173]) ->  | E78: of:=IF( ISBLANK([$'P1.Perceptible'.D206]);"";[$'P1.Perceptible'.D206]) ->  | F78: of:=IF( ISBLANK([$'P1.Perceptible'.D338]);"";[$'P1.Perceptible'.D338]) ->  | G78: of:=IF( ISBLANK([$'P1.Perceptible'.D371]);"";[$'P1.Perceptible'.D371]) ->  | H78: of:=IF( ISBLANK([$'P1.Perceptible'.D470]);"";[$'P1.Perceptible'.D470]) ->  | I78: of:=IF( ISBLANK([$'P1.Perceptible'.D503]);"";[$'P1.Perceptible'.D503]) ->  | J78: of:=IF( ISBLANK([$'P1.Perceptible'.D536]);"";[$'P1.Perceptible'.D536]) ->  | K78: of:=IF( ISBLANK([$'P1.Perceptible'.D569]);"";[$'P1.Perceptible'.D569]) ->  | L78: of:=IF( ISBLANK([$'P1.Perceptible'.D602]);"";[$'P1.Perceptible'.D602]) ->  | M78: of:=IF( ISBLANK([$'P1.Perceptible'.D635]);"";[$'P1.Perceptible'.D635]) ->  | N78: of:=IF( ISBLANK([$'P1.Perceptible'.D669]);"";[$'P1.Perceptible'.D669]) ->  | O78: of:=IF( ISBLANK([$'P2.Operable'.D371]);"";[$'P2.Operable'.D371]) ->  | P78: of:=IF( ISBLANK([$'P2.Operable'.D404]);"";[$'P2.Operable'.D404]) ->  | Q78: of:=IF( ISBLANK([$'P2.Operable'.D437]);"";[$'P2.Operable'.D437]) ->  | R78: of:=IF( ISBLANK([$'P3.Comprensible'.D74]);"";[$'P3.Comprensible'.D74]) ->  | S78: of:=IF( ISBLANK([$'P3.Comprensible'.D173]);"";[$'P3.Comprensible'.D173]) ->  | T78: of:=IF( ISBLANK([$'P3.Comprensible'.D206]);"";[$'P3.Comprensible'.D206]) ->  | U78: of:=IF( ISBLANK([$'P3.Comprensible'.D305]);"";[$'P3.Comprensible'.D305]) ->  | V78: of:=IF( ISBLANK([$'P3.Comprensible'.D338]);"";[$'P3.Comprensible'.D338]) ->  | W78: of:=IF(ISBLANK([$'P4.Robusto'.D107]);"";[$'P4.Robusto'.D107]) -> 
B79: of:=IF( ISBLANK([$'03.Muestra'.$C$31]);"";[$'03.Muestra'.$C$31]) ->  | C79: of:=IF( ISBLANK([$'03.Muestra'.$E$31]);"";[$'03.Muestra'.$E$31]) ->  | D79: of:=IF( ISBLANK([$'P1.Perceptible'.D174]);"";[$'P1.Perceptible'.D174]) ->  | E79: of:=IF( ISBLANK([$'P1.Perceptible'.D207]);"";[$'P1.Perceptible'.D207]) ->  | F79: of:=IF( ISBLANK([$'P1.Perceptible'.D339]);"";[$'P1.Perceptible'.D339]) ->  | G79: of:=IF( ISBLANK([$'P1.Perceptible'.D372]);"";[$'P1.Perceptible'.D372]) ->  | H79: of:=IF( ISBLANK([$'P1.Perceptible'.D471]);"";[$'P1.Perceptible'.D471]) ->  | I79: of:=IF( ISBLANK([$'P1.Perceptible'.D504]);"";[$'P1.Perceptible'.D504]) ->  | J79: of:=IF( ISBLANK([$'P1.Perceptible'.D537]);"";[$'P1.Perceptible'.D537]) ->  | K79: of:=IF( ISBLANK([$'P1.Perceptible'.D570]);"";[$'P1.Perceptible'.D570]) ->  | L79: of:=IF( ISBLANK([$'P1.Perceptible'.D603]);"";[$'P1.Perceptible'.D603]) ->  | M79: of:=IF( ISBLANK([$'P1.Perceptible'.D636]);"";[$'P1.Perceptible'.D636]) ->  | N79: of:=IF( ISBLANK([$'P1.Perceptible'.D670]);"";[$'P1.Perceptible'.D670]) ->  | O79: of:=IF( ISBLANK([$'P2.Operable'.D372]);"";[$'P2.Operable'.D372]) ->  | P79: of:=IF( ISBLANK([$'P2.Operable'.D405]);"";[$'P2.Operable'.D405]) ->  | Q79: of:=IF( ISBLANK([$'P2.Operable'.D438]);"";[$'P2.Operable'.D438]) ->  | R79: of:=IF( ISBLANK([$'P3.Comprensible'.D75]);"";[$'P3.Comprensible'.D75]) ->  | S79: of:=IF( ISBLANK([$'P3.Comprensible'.D174]);"";[$'P3.Comprensible'.D174]) ->  | T79: of:=IF( ISBLANK([$'P3.Comprensible'.D207]);"";[$'P3.Comprensible'.D207]) ->  | U79: of:=IF( ISBLANK([$'P3.Comprensible'.D306]);"";[$'P3.Comprensible'.D306]) ->  | V79: of:=IF( ISBLANK([$'P3.Comprensible'.D339]);"";[$'P3.Comprensible'.D339]) ->  | W79: of:=IF(ISBLANK([$'P4.Robusto'.D108]);"";[$'P4.Robusto'.D108]) -> 
B80: of:=IF( ISBLANK([$'03.Muestra'.$C$32]);"";[$'03.Muestra'.$C$32]) ->  | C80: of:=IF( ISBLANK([$'03.Muestra'.$E$32]);"";[$'03.Muestra'.$E$32]) ->  | D80: of:=IF( ISBLANK([$'P1.Perceptible'.D175]);"";[$'P1.Perceptible'.D175]) ->  | E80: of:=IF( ISBLANK([$'P1.Perceptible'.D208]);"";[$'P1.Perceptible'.D208]) ->  | F80: of:=IF( ISBLANK([$'P1.Perceptible'.D340]);"";[$'P1.Perceptible'.D340]) ->  | G80: of:=IF( ISBLANK([$'P1.Perceptible'.D373]);"";[$'P1.Perceptible'.D373]) ->  | H80: of:=IF( ISBLANK([$'P1.Perceptible'.D472]);"";[$'P1.Perceptible'.D472]) ->  | I80: of:=IF( ISBLANK([$'P1.Perceptible'.D505]);"";[$'P1.Perceptible'.D505]) ->  | J80: of:=IF( ISBLANK([$'P1.Perceptible'.D538]);"";[$'P1.Perceptible'.D538]) ->  | K80: of:=IF( ISBLANK([$'P1.Perceptible'.D571]);"";[$'P1.Perceptible'.D571]) ->  | L80: of:=IF( ISBLANK([$'P1.Perceptible'.D604]);"";[$'P1.Perceptible'.D604]) ->  | M80: of:=IF( ISBLANK([$'P1.Perceptible'.D637]);"";[$'P1.Perceptible'.D637]) ->  | N80: of:=IF( ISBLANK([$'P1.Perceptible'.D671]);"";[$'P1.Perceptible'.D671]) ->  | O80: of:=IF( ISBLANK([$'P2.Operable'.D373]);"";[$'P2.Operable'.D373]) ->  | P80: of:=IF( ISBLANK([$'P2.Operable'.D406]);"";[$'P2.Operable'.D406]) ->  | Q80: of:=IF( ISBLANK([$'P2.Operable'.D439]);"";[$'P2.Operable'.D439]) ->  | R80: of:=IF( ISBLANK([$'P3.Comprensible'.D76]);"";[$'P3.Comprensible'.D76]) ->  | S80: of:=IF( ISBLANK([$'P3.Comprensible'.D175]);"";[$'P3.Comprensible'.D175]) ->  | T80: of:=IF( ISBLANK([$'P3.Comprensible'.D208]);"";[$'P3.Comprensible'.D208]) ->  | U80: of:=IF( ISBLANK([$'P3.Comprensible'.D307]);"";[$'P3.Comprensible'.D307]) ->  | V80: of:=IF( ISBLANK([$'P3.Comprensible'.D340]);"";[$'P3.Comprensible'.D340]) ->  | W80: of:=IF(ISBLANK([$'P4.Robusto'.D109]);"";[$'P4.Robusto'.D109]) -> 
B81: of:=IF( ISBLANK([$'03.Muestra'.$C$33]);"";[$'03.Muestra'.$C$33]) ->  | C81: of:=IF( ISBLANK([$'03.Muestra'.$E$33]);"";[$'03.Muestra'.$E$33]) ->  | D81: of:=IF( ISBLANK([$'P1.Perceptible'.D176]);"";[$'P1.Perceptible'.D176]) ->  | E81: of:=IF( ISBLANK([$'P1.Perceptible'.D209]);"";[$'P1.Perceptible'.D209]) ->  | F81: of:=IF( ISBLANK([$'P1.Perceptible'.D341]);"";[$'P1.Perceptible'.D341]) ->  | G81: of:=IF( ISBLANK([$'P1.Perceptible'.D374]);"";[$'P1.Perceptible'.D374]) ->  | H81: of:=IF( ISBLANK([$'P1.Perceptible'.D473]);"";[$'P1.Perceptible'.D473]) ->  | I81: of:=IF( ISBLANK([$'P1.Perceptible'.D506]);"";[$'P1.Perceptible'.D506]) ->  | J81: of:=IF( ISBLANK([$'P1.Perceptible'.D539]);"";[$'P1.Perceptible'.D539]) ->  | K81: of:=IF( ISBLANK([$'P1.Perceptible'.D572]);"";[$'P1.Perceptible'.D572]) ->  | L81: of:=IF( ISBLANK([$'P1.Perceptible'.D605]);"";[$'P1.Perceptible'.D605]) ->  | M81: of:=IF( ISBLANK([$'P1.Perceptible'.D638]);"";[$'P1.Perceptible'.D638]) ->  | N81: of:=IF( ISBLANK([$'P1.Perceptible'.D672]);"";[$'P1.Perceptible'.D672]) ->  | O81: of:=IF( ISBLANK([$'P2.Operable'.D374]);"";[$'P2.Operable'.D374]) ->  | P81: of:=IF( ISBLANK([$'P2.Operable'.D407]);"";[$'P2.Operable'.D407]) ->  | Q81: of:=IF( ISBLANK([$'P2.Operable'.D440]);"";[$'P2.Operable'.D440]) ->  | R81: of:=IF( ISBLANK([$'P3.Comprensible'.D77]);"";[$'P3.Comprensible'.D77]) ->  | S81: of:=IF( ISBLANK([$'P3.Comprensible'.D176]);"";[$'P3.Comprensible'.D176]) ->  | T81: of:=IF( ISBLANK([$'P3.Comprensible'.D209]);"";[$'P3.Comprensible'.D209]) ->  | U81: of:=IF( ISBLANK([$'P3.Comprensible'.D308]);"";[$'P3.Comprensible'.D308]) ->  | V81: of:=IF( ISBLANK([$'P3.Comprensible'.D341]);"";[$'P3.Comprensible'.D341]) ->  | W81: of:=IF(ISBLANK([$'P4.Robusto'.D110]);"";[$'P4.Robusto'.D110]) -> 
B82: of:=IF( ISBLANK([$'03.Muestra'.$C$34]);"";[$'03.Muestra'.$C$34]) ->  | C82: of:=IF( ISBLANK([$'03.Muestra'.$E$34]);"";[$'03.Muestra'.$E$34]) ->  | D82: of:=IF( ISBLANK([$'P1.Perceptible'.D177]);"";[$'P1.Perceptible'.D177]) ->  | E82: of:=IF( ISBLANK([$'P1.Perceptible'.D210]);"";[$'P1.Perceptible'.D210]) ->  | F82: of:=IF( ISBLANK([$'P1.Perceptible'.D342]);"";[$'P1.Perceptible'.D342]) ->  | G82: of:=IF( ISBLANK([$'P1.Perceptible'.D375]);"";[$'P1.Perceptible'.D375]) ->  | H82: of:=IF( ISBLANK([$'P1.Perceptible'.D474]);"";[$'P1.Perceptible'.D474]) ->  | I82: of:=IF( ISBLANK([$'P1.Perceptible'.D507]);"";[$'P1.Perceptible'.D507]) ->  | J82: of:=IF( ISBLANK([$'P1.Perceptible'.D540]);"";[$'P1.Perceptible'.D540]) ->  | K82: of:=IF( ISBLANK([$'P1.Perceptible'.D573]);"";[$'P1.Perceptible'.D573]) ->  | L82: of:=IF( ISBLANK([$'P1.Perceptible'.D606]);"";[$'P1.Perceptible'.D606]) ->  | M82: of:=IF( ISBLANK([$'P1.Perceptible'.D639]);"";[$'P1.Perceptible'.D639]) ->  | N82: of:=IF( ISBLANK([$'P1.Perceptible'.D673]);"";[$'P1.Perceptible'.D673]) ->  | O82: of:=IF( ISBLANK([$'P2.Operable'.D375]);"";[$'P2.Operable'.D375]) ->  | P82: of:=IF( ISBLANK([$'P2.Operable'.D408]);"";[$'P2.Operable'.D408]) ->  | Q82: of:=IF( ISBLANK([$'P2.Operable'.D441]);"";[$'P2.Operable'.D441]) ->  | R82: of:=IF( ISBLANK([$'P3.Comprensible'.D78]);"";[$'P3.Comprensible'.D78]) ->  | S82: of:=IF( ISBLANK([$'P3.Comprensible'.D177]);"";[$'P3.Comprensible'.D177]) ->  | T82: of:=IF( ISBLANK([$'P3.Comprensible'.D210]);"";[$'P3.Comprensible'.D210]) ->  | U82: of:=IF( ISBLANK([$'P3.Comprensible'.D309]);"";[$'P3.Comprensible'.D309]) ->  | V82: of:=IF( ISBLANK([$'P3.Comprensible'.D342]);"";[$'P3.Comprensible'.D342]) ->  | W82: of:=IF(ISBLANK([$'P4.Robusto'.D111]);"";[$'P4.Robusto'.D111]) -> 
B83: of:=IF( ISBLANK([$'03.Muestra'.$C$35]);"";[$'03.Muestra'.$C$35]) ->  | C83: of:=IF( ISBLANK([$'03.Muestra'.$E$35]);"";[$'03.Muestra'.$E$35]) ->  | D83: of:=IF( ISBLANK([$'P1.Perceptible'.D178]);"";[$'P1.Perceptible'.D178]) ->  | E83: of:=IF( ISBLANK([$'P1.Perceptible'.D211]);"";[$'P1.Perceptible'.D211]) ->  | F83: of:=IF( ISBLANK([$'P1.Perceptible'.D343]);"";[$'P1.Perceptible'.D343]) ->  | G83: of:=IF( ISBLANK([$'P1.Perceptible'.D376]);"";[$'P1.Perceptible'.D376]) ->  | H83: of:=IF( ISBLANK([$'P1.Perceptible'.D475]);"";[$'P1.Perceptible'.D475]) ->  | I83: of:=IF( ISBLANK([$'P1.Perceptible'.D508]);"";[$'P1.Perceptible'.D508]) ->  | J83: of:=IF( ISBLANK([$'P1.Perceptible'.D541]);"";[$'P1.Perceptible'.D541]) ->  | K83: of:=IF( ISBLANK([$'P1.Perceptible'.D574]);"";[$'P1.Perceptible'.D574]) ->  | L83: of:=IF( ISBLANK([$'P1.Perceptible'.D607]);"";[$'P1.Perceptible'.D607]) ->  | M83: of:=IF( ISBLANK([$'P1.Perceptible'.D640]);"";[$'P1.Perceptible'.D640]) ->  | N83: of:=IF( ISBLANK([$'P1.Perceptible'.D674]);"";[$'P1.Perceptible'.D674]) ->  | O83: of:=IF( ISBLANK([$'P2.Operable'.D376]);"";[$'P2.Operable'.D376]) ->  | P83: of:=IF( ISBLANK([$'P2.Operable'.D409]);"";[$'P2.Operable'.D409]) ->  | Q83: of:=IF( ISBLANK([$'P2.Operable'.D442]);"";[$'P2.Operable'.D442]) ->  | R83: of:=IF( ISBLANK([$'P3.Comprensible'.D79]);"";[$'P3.Comprensible'.D79]) ->  | S83: of:=IF( ISBLANK([$'P3.Comprensible'.D178]);"";[$'P3.Comprensible'.D178]) ->  | T83: of:=IF( ISBLANK([$'P3.Comprensible'.D211]);"";[$'P3.Comprensible'.D211]) ->  | U83: of:=IF( ISBLANK([$'P3.Comprensible'.D310]);"";[$'P3.Comprensible'.D310]) ->  | V83: of:=IF( ISBLANK([$'P3.Comprensible'.D343]);"";[$'P3.Comprensible'.D343]) ->  | W83: of:=IF(ISBLANK([$'P4.Robusto'.D112]);"";[$'P4.Robusto'.D112]) -> 
B84: of:=IF( ISBLANK([$'03.Muestra'.$C$36]);"";[$'03.Muestra'.$C$36]) ->  | C84: of:=IF( ISBLANK([$'03.Muestra'.$E$36]);"";[$'03.Muestra'.$E$36]) ->  | D84: of:=IF( ISBLANK([$'P1.Perceptible'.D179]);"";[$'P1.Perceptible'.D179]) ->  | E84: of:=IF( ISBLANK([$'P1.Perceptible'.D212]);"";[$'P1.Perceptible'.D212]) ->  | F84: of:=IF( ISBLANK([$'P1.Perceptible'.D344]);"";[$'P1.Perceptible'.D344]) ->  | G84: of:=IF( ISBLANK([$'P1.Perceptible'.D377]);"";[$'P1.Perceptible'.D377]) ->  | H84: of:=IF( ISBLANK([$'P1.Perceptible'.D476]);"";[$'P1.Perceptible'.D476]) ->  | I84: of:=IF( ISBLANK([$'P1.Perceptible'.D509]);"";[$'P1.Perceptible'.D509]) ->  | J84: of:=IF( ISBLANK([$'P1.Perceptible'.D542]);"";[$'P1.Perceptible'.D542]) ->  | K84: of:=IF( ISBLANK([$'P1.Perceptible'.D575]);"";[$'P1.Perceptible'.D575]) ->  | L84: of:=IF( ISBLANK([$'P1.Perceptible'.D608]);"";[$'P1.Perceptible'.D608]) ->  | M84: of:=IF( ISBLANK([$'P1.Perceptible'.D641]);"";[$'P1.Perceptible'.D641]) ->  | N84: of:=IF( ISBLANK([$'P1.Perceptible'.D675]);"";[$'P1.Perceptible'.D675]) ->  | O84: of:=IF( ISBLANK([$'P2.Operable'.D377]);"";[$'P2.Operable'.D377]) ->  | P84: of:=IF( ISBLANK([$'P2.Operable'.D410]);"";[$'P2.Operable'.D410]) ->  | Q84: of:=IF( ISBLANK([$'P2.Operable'.D443]);"";[$'P2.Operable'.D443]) ->  | R84: of:=IF( ISBLANK([$'P3.Comprensible'.D80]);"";[$'P3.Comprensible'.D80]) ->  | S84: of:=IF( ISBLANK([$'P3.Comprensible'.D179]);"";[$'P3.Comprensible'.D179]) ->  | T84: of:=IF( ISBLANK([$'P3.Comprensible'.D212]);"";[$'P3.Comprensible'.D212]) ->  | U84: of:=IF( ISBLANK([$'P3.Comprensible'.D311]);"";[$'P3.Comprensible'.D311]) ->  | V84: of:=IF( ISBLANK([$'P3.Comprensible'.D344]);"";[$'P3.Comprensible'.D344]) ->  | W84: of:=IF(ISBLANK([$'P4.Robusto'.D113]);"";[$'P4.Robusto'.D113]) -> 
B85: of:=IF( ISBLANK([$'03.Muestra'.$C$37]);"";[$'03.Muestra'.$C$37]) ->  | C85: of:=IF( ISBLANK([$'03.Muestra'.$E$37]);"";[$'03.Muestra'.$E$37]) ->  | D85: of:=IF( ISBLANK([$'P1.Perceptible'.D180]);"";[$'P1.Perceptible'.D180]) ->  | E85: of:=IF( ISBLANK([$'P1.Perceptible'.D213]);"";[$'P1.Perceptible'.D213]) ->  | F85: of:=IF( ISBLANK([$'P1.Perceptible'.D345]);"";[$'P1.Perceptible'.D345]) ->  | G85: of:=IF( ISBLANK([$'P1.Perceptible'.D378]);"";[$'P1.Perceptible'.D378]) ->  | H85: of:=IF( ISBLANK([$'P1.Perceptible'.D477]);"";[$'P1.Perceptible'.D477]) ->  | I85: of:=IF( ISBLANK([$'P1.Perceptible'.D510]);"";[$'P1.Perceptible'.D510]) ->  | J85: of:=IF( ISBLANK([$'P1.Perceptible'.D543]);"";[$'P1.Perceptible'.D543]) ->  | K85: of:=IF( ISBLANK([$'P1.Perceptible'.D576]);"";[$'P1.Perceptible'.D576]) ->  | L85: of:=IF( ISBLANK([$'P1.Perceptible'.D609]);"";[$'P1.Perceptible'.D609]) ->  | M85: of:=IF( ISBLANK([$'P1.Perceptible'.D642]);"";[$'P1.Perceptible'.D642]) ->  | N85: of:=IF( ISBLANK([$'P1.Perceptible'.D676]);"";[$'P1.Perceptible'.D676]) ->  | O85: of:=IF( ISBLANK([$'P2.Operable'.D378]);"";[$'P2.Operable'.D378]) ->  | P85: of:=IF( ISBLANK([$'P2.Operable'.D411]);"";[$'P2.Operable'.D411]) ->  | Q85: of:=IF( ISBLANK([$'P2.Operable'.D444]);"";[$'P2.Operable'.D444]) ->  | R85: of:=IF( ISBLANK([$'P3.Comprensible'.D81]);"";[$'P3.Comprensible'.D81]) ->  | S85: of:=IF( ISBLANK([$'P3.Comprensible'.D180]);"";[$'P3.Comprensible'.D180]) ->  | T85: of:=IF( ISBLANK([$'P3.Comprensible'.D213]);"";[$'P3.Comprensible'.D213]) ->  | U85: of:=IF( ISBLANK([$'P3.Comprensible'.D312]);"";[$'P3.Comprensible'.D312]) ->  | V85: of:=IF( ISBLANK([$'P3.Comprensible'.D345]);"";[$'P3.Comprensible'.D345]) ->  | W85: of:=IF(ISBLANK([$'P4.Robusto'.D114]);"";[$'P4.Robusto'.D114]) -> 
C86: SITIO WEB | D86: of:=IF (COUNTIF([$'P1.Perceptible'.$E151:$'P1.Perceptible'.$E180];"ERR")>0;"ERROR";      IF(COUNTIF([.D56:.D85];"N/T")>0 ; "EN CURSO";         IF (COUNTIF([.D56:.D85];"N/D") > 0;"EN CURSO";              IF (COUNTIF([.$C$20:.$C$49]; "<>") <> COUNTIF([.D56:.D85];"<>");"EN CURSO" ;  IF(COUNTIF([.$C$56:.$C$85]; "<>") = COUNTIF([.D56:.D85];"N/A"); "N/A";                   IF(COUNTIF([.D56:.D85];"Falla")>([$'DATA - Oculta'.$C$25]*((COUNTIF([.D56:.D85];"Pasa")+COUNTIF([.D56:.D85];"Falla"))));                 "NO CONFORME";"CONFORME")))))) -> N/A | E86: of:=IF (COUNTIF([$'P1.Perceptible'.$E184:$'P1.Perceptible'.$E213];"ERR")>0;"ERROR";      IF(COUNTIF([.E56:.E85];"N/T")>0 ; "EN CURSO";         IF (COUNTIF([.E56:.E85];"N/D") > 0;"EN CURSO";              IF (COUNTIF([.$C$20:.$C$49]; "<>") <> COUNTIF([.E56:.E85];"<>");"EN CURSO" ;  IF(COUNTIF([.$C$56:.$C$85]; "<>") = COUNTIF([.E56:.E85];"N/A"); "N/A";                   IF(COUNTIF([.E56:.E85];"Falla")>([$'DATA - Oculta'.$C$25]*((COUNTIF([.E56:.E85];"Pasa")+COUNTIF([.E56:.E85];"Falla"))));                 "NO CONFORME";"CONFORME")))))) -> N/A | F86: of:=IF (COUNTIF([$'P1.Perceptible'.$E316:$'P1.Perceptible'.$E345];"ERR")>0;"ERROR";      IF(COUNTIF([.F56:.F85];"N/T")>0 ; "EN CURSO";         IF (COUNTIF([.F56:.F85];"N/D") > 0;"EN CURSO";              IF (COUNTIF([.$C$20:.$C$49]; "<>") <> COUNTIF([.F56:.F85];"<>");"EN CURSO" ;  IF(COUNTIF([.$C$56:.$C$85]; "<>") = COUNTIF([.F56:.F85];"N/A"); "N/A";                   IF(COUNTIF([.F56:.F85];"Falla")>([$'DATA - Oculta'.$C$25]*((COUNTIF([.F56:.F85];"Pasa")+COUNTIF([.F56:.F85];"Falla"))));                 "NO CONFORME";"CONFORME")))))) -> N/A | G86: of:=IF (COUNTIF([$'P1.Perceptible'.$E349:$'P1.Perceptible'.$E378];"ERR")>0;"ERROR";      IF(COUNTIF([.G56:.G85];"N/T")>0 ; "EN CURSO";         IF (COUNTIF([.G56:.G85];"N/D") > 0;"EN CURSO";              IF (COUNTIF([.$C$20:.$C$49]; "<>") <> COUNTIF([.G56:.G85];"<>");"EN CURSO" ;  IF(COUNTIF([.$C$56:.$C$85]; "<>") = COUNTIF([.G56:.G85];"N/A"); "N/A";                   IF(COUNTIF([.G56:.G85];"Falla")>([$'DATA - Oculta'.$C$25]*((COUNTIF([.G56:.G85];"Pasa")+COUNTIF([.G56:.G85];"Falla"))));                 "NO CONFORME";"CONFORME")))))) -> N/A | H86: of:=IF (COUNTIF([$'P1.Perceptible'.$E448:$'P1.Perceptible'.$E477];"ERR")>0;"ERROR";      IF(COUNTIF([.H56:.H85];"N/T")>0 ; "EN CURSO";         IF (COUNTIF([.H56:.H85];"N/D") > 0;"EN CURSO";              IF (COUNTIF([.$C$20:.$C$49]; "<>") <> COUNTIF([.H56:.H85];"<>");"EN CURSO" ;  IF(COUNTIF([.$C$56:.$C$85]; "<>") = COUNTIF([.H56:.H85];"N/A"); "N/A";                   IF(COUNTIF([.H56:.H85];"Falla")>([$'DATA - Oculta'.$C$25]*((COUNTIF([.H56:.H85];"Pasa")+COUNTIF([.H56:.H85];"Falla"))));                 "NO CONFORME";"CONFORME")))))) -> N/A | I86: of:=IF (COUNTIF([$'P1.Perceptible'.$E481:$'P1.Perceptible'.$E510];"ERR")>0;"ERROR";      IF(COUNTIF([.I56:.I85];"N/T")>0 ; "EN CURSO";         IF (COUNTIF([.I56:.I85];"N/D") > 0;"EN CURSO";              IF (COUNTIF([.$C$20:.$C$49]; "<>") <> COUNTIF([.I56:.I85];"<>");"EN CURSO" ;  IF(COUNTIF([.$C$56:.$C$85]; "<>") = COUNTIF([.I56:.I85];"N/A"); "N/A";                   IF(COUNTIF([.I56:.I85];"Falla")>([$'DATA - Oculta'.$C$25]*((COUNTIF([.I56:.I85];"Pasa")+COUNTIF([.I56:.I85];"Falla"))));                 "NO CONFORME";"CONFORME")))))) -> N/A | J86: of:=IF (COUNTIF([$'P1.Perceptible'.$E514:$'P1.Perceptible'.$E543];"ERR")>0;"ERROR";      IF(COUNTIF([.J56:.J85];"N/T")>0 ; "EN CURSO";         IF (COUNTIF([.J56:.J85];"N/D") > 0;"EN CURSO";              IF (COUNTIF([.$C$20:.$C$49]; "<>") <> COUNTIF([.J56:.J85];"<>");"EN CURSO" ;  IF(COUNTIF([.$C$56:.$C$85]; "<>") = COUNTIF([.J56:.J85];"N/A"); "N/A";                   IF(COUNTIF([.J56:.J85];"Falla")>([$'DATA - Oculta'.$C$25]*((COUNTIF([.J56:.J85];"Pasa")+COUNTIF([.J56:.J85];"Falla"))));                 "NO CONFORME";"CONFORME")))))) -> N/A | K86: of:=IF (COUNTIF([$'P1.Perceptible'.$E547:$'P1.Perceptible'.$E576];"ERR")>0;"ERROR";      IF(COUNTIF([.K56:.K85];"N/T")>0 ; "EN CURSO";         IF (COUNTIF([.K56:.K85];"N/D") > 0;"EN CURSO";              IF (COUNTIF([.$C$20:.$C$49]; "<>") <> COUNTIF([.K56:.K85];"<>");"EN CURSO" ;  IF(COUNTIF([.$C$56:.$C$85]; "<>") = COUNTIF([.K56:.K85];"N/A"); "N/A";                   IF(COUNTIF([.K56:.K85];"Falla")>([$'DATA - Oculta'.$C$25]*((COUNTIF([.K56:.K85];"Pasa")+COUNTIF([.K56:.K85];"Falla"))));                 "NO CONFORME";"CONFORME")))))) -> N/A | L86: of:=IF (COUNTIF([$'P1.Perceptible'.$E580:$'P1.Perceptible'.$E609];"ERR")>0;"ERROR";      IF(COUNTIF([.L56:.L85];"N/T")>0 ; "EN CURSO";         IF (COUNTIF([.L56:.L85];"N/D") > 0;"EN CURSO";              IF (COUNTIF([.$C$20:.$C$49]; "<>") <> COUNTIF([.L56:.L85];"<>");"EN CURSO" ;  IF(COUNTIF([.$C$56:.$C$85]; "<>") = COUNTIF([.L56:.L85];"N/A"); "N/A";                   IF(COUNTIF([.L56:.L85];"Falla")>([$'DATA - Oculta'.$C$25]*((COUNTIF([.L56:.L85];"Pasa")+COUNTIF([.L56:.L85];"Falla"))));                 "NO CONFORME";"CONFORME")))))) -> N/A | M86: of:=IF (COUNTIF([$'P1.Perceptible'.$E613:$'P1.Perceptible'.$E642];"ERR")>0;"ERROR";      IF(COUNTIF([.M56:.M85];"N/T")>0 ; "EN CURSO";         IF (COUNTIF([.M56:.M85];"N/D") > 0;"EN CURSO";              IF (COUNTIF([.$C$20:.$C$49]; "<>") <> COUNTIF([.M56:.M85];"<>");"EN CURSO" ;  IF(COUNTIF([.$C$56:.$C$85]; "<>") = COUNTIF([.M56:.M85];"N/A"); "N/A";                   IF(COUNTIF([.M56:.M85];"Falla")>([$'DATA - Oculta'.$C$25]*((COUNTIF([.M56:.M85];"Pasa")+COUNTIF([.M56:.M85];"Falla"))));                 "NO CONFORME";"CONFORME")))))) -> N/A | N86: of:=IF (COUNTIF([$'P1.Perceptible'.$E647:$'P1.Perceptible'.$E676];"ERR")>0;"ERROR";      IF(COUNTIF([.N56:.N85];"N/T")>0 ; "EN CURSO";         IF (COUNTIF([.N56:.N85];"N/D") > 0;"EN CURSO";              IF (COUNTIF([.$C$20:.$C$49]; "<>") <> COUNTIF([.N56:.N85];"<>");"EN CURSO" ;  IF(COUNTIF([.$C$56:.$C$85]; "<>") = COUNTIF([.N56:.N85];"N/A"); "N/A";                   IF(COUNTIF([.N56:.N85];"Falla")>([$'DATA - Oculta'.$C$25]*((COUNTIF([.N56:.N85];"Pasa")+COUNTIF([.N56:.N85];"Falla"))));                 "NO CONFORME";"CONFORME")))))) -> N/A | O86: of:=IF (COUNTIF([$'P2.Operable'.$E349:$'P2.Operable'.$E378];"ERR")>0;"ERROR";      IF(COUNTIF([.O56:.O85];"N/T")>0 ; "EN CURSO";         IF (COUNTIF([.O56:.O85];"N/D") > 0;"EN CURSO";              IF (COUNTIF([.$C$20:.$C$49]; "<>") <> COUNTIF([.O56:.O85];"<>");"EN CURSO" ;  IF(COUNTIF([.$C$56:.$C$85]; "<>") = COUNTIF([.O56:.O85];"N/A"); "N/A";                   IF(COUNTIF([.O56:.O85];"Falla")>([$'DATA - Oculta'.$C$25]*((COUNTIF([.O56:.O85];"Pasa")+COUNTIF([.O56:.O85];"Falla"))));                 "NO CONFORME";"CONFORME")))))) -> N/A | P86: of:=IF (COUNTIF([$'P2.Operable'.$E382:$'P2.Operable'.$E411];"ERR")>0;"ERROR";      IF(COUNTIF([.P56:.P85];"N/T")>0 ; "EN CURSO";         IF (COUNTIF([.P56:.P85];"N/D") > 0;"EN CURSO";              IF (COUNTIF([.$C$20:.$C$49]; "<>") <> COUNTIF([.P56:.P85];"<>");"EN CURSO" ;  IF(COUNTIF([.$C$56:.$C$85]; "<>") = COUNTIF([.P56:.P85];"N/A"); "N/A";                   IF(COUNTIF([.P56:.P85];"Falla")>([$'DATA - Oculta'.$C$25]*((COUNTIF([.P56:.P85];"Pasa")+COUNTIF([.P56:.P85];"Falla"))));                 "NO CONFORME";"CONFORME")))))) -> N/A | Q86: of:=IF (COUNTIF([$'P2.Operable'.$E415:$'P2.Operable'.$E444];"ERR")>0;"ERROR";      IF(COUNTIF([.Q56:.Q85];"N/T")>0 ; "EN CURSO";         IF (COUNTIF([.Q56:.Q85];"N/D") > 0;"EN CURSO";              IF (COUNTIF([.$C$20:.$C$49]; "<>") <> COUNTIF([.Q56:.Q85];"<>");"EN CURSO" ;  IF(COUNTIF([.$C$56:.$C$85]; "<>") = COUNTIF([.Q56:.Q85];"N/A"); "N/A";                   IF(COUNTIF([.Q56:.Q85];"Falla")>([$'DATA - Oculta'.$C$25]*((COUNTIF([.Q56:.Q85];"Pasa")+COUNTIF([.Q56:.Q85];"Falla"))));                 "NO CONFORME";"CONFORME")))))) -> N/A | R86: of:=IF (COUNTIF([$'P3.Comprensible'.$E52:$'P3.Comprensible'.$E81];"ERR")>0;"ERROR";      IF(COUNTIF([.R56:.R85];"N/T")>0 ; "EN CURSO";         IF (COUNTIF([.R56:.R85];"N/D") > 0;"EN CURSO";              IF (COUNTIF([.$C$20:.$C$49]; "<>") <> COUNTIF([.R56:.R85];"<>");"EN CURSO" ;  IF(COUNTIF([.$C$56:.$C$85]; "<>") = COUNTIF([.R56:.R85];"N/A"); "N/A";                   IF(COUNTIF([.R56:.R85];"Falla")>([$'DATA - Oculta'.$C$25]*((COUNTIF([.R56:.R85];"Pasa")+COUNTIF([.R56:.R85];"Falla"))));                 "NO CONFORME";"CONFORME")))))) -> N/A | S86: of:=IF (COUNTIF([$'P3.Comprensible'.$E151:$'P3.Comprensible'.$E180];"ERR")>0;"ERROR";      IF(COUNTIF([.S56:.S85];"N/T")>0 ; "EN CURSO";         IF (COUNTIF([.S56:.S85];"N/D") > 0;"EN CURSO";              IF (COUNTIF([.$C$20:.$C$49]; "<>") <> COUNTIF([.S56:.S85];"<>");"EN CURSO" ;  IF(COUNTIF([.$C$56:.$C$85]; "<>") = COUNTIF([.S56:.S85];"N/A"); "N/A";                   IF(COUNTIF([.S56:.S85];"Falla")>([$'DATA - Oculta'.$C$25]*((COUNTIF([.S56:.S85];"Pasa")+COUNTIF([.S56:.S85];"Falla"))));                 "NO CONFORME";"CONFORME")))))) -> N/A | T86: of:=IF (COUNTIF([$'P3.Comprensible'.$E184:$'P3.Comprensible'.$E213];"ERR")>0;"ERROR";      IF(COUNTIF([.T56:.T85];"N/T")>0 ; "EN CURSO";         IF (COUNTIF([.T56:.T85];"N/D") > 0;"EN CURSO";              IF (COUNTIF([.$C$20:.$C$49]; "<>") <> COUNTIF([.T56:.T85];"<>");"EN CURSO" ;  IF(COUNTIF([.$C$56:.$C$85]; "<>") = COUNTIF([.T56:.T85];"N/A"); "N/A";                   IF(COUNTIF([.T56:.T85];"Falla")>([$'DATA - Oculta'.$C$25]*((COUNTIF([.T56:.T85];"Pasa")+COUNTIF([.T56:.T85];"Falla"))));                 "NO CONFORME";"CONFORME")))))) -> N/A | U86: of:=IF (COUNTIF([$'P3.Comprensible'.$E283:$'P3.Comprensible'.$E312];"ERR")>0;"ERROR";      IF(COUNTIF([.U56:.U85];"N/T")>0 ; "EN CURSO";         IF (COUNTIF([.U56:.U85];"N/D") > 0;"EN CURSO";              IF (COUNTIF([.$C$20:.$C$49]; "<>") <> COUNTIF([.U56:.U85];"<>");"EN CURSO" ;  IF(COUNTIF([.$C$56:.$C$85]; "<>") = COUNTIF([.U56:.U85];"N/A"); "N/A";                   IF(COUNTIF([.U56:.U85];"Falla")>([$'DATA - Oculta'.$C$25]*((COUNTIF([.U56:.U85];"Pasa")+COUNTIF([.U56:.U85];"Falla"))));                 "NO CONFORME";"CONFORME")))))) -> N/A | V86: of:=IF (COUNTIF([$'P3.Comprensible'.$E316:$'P3.Comprensible'.$E345];"ERR")>0;"ERROR";      IF(COUNTIF([.V56:.V85];"N/T")>0 ; "EN CURSO";         IF (COUNTIF([.V56:.V85];"N/D") > 0;"EN CURSO";              IF (COUNTIF([.$C$20:.$C$49]; "<>") <> COUNTIF([.V56:.V85];"<>");"EN CURSO" ;  IF(COUNTIF([.$C$56:.$C$85]; "<>") = COUNTIF([.V56:.V85];"N/A"); "N/A";                   IF(COUNTIF([.V56:.V85];"Falla")>([$'DATA - Oculta'.$C$25]*((COUNTIF([.V56:.V85];"Pasa")+COUNTIF([.V56:.V85];"Falla"))));                 "NO CONFORME";"CONFORME")))))) -> N/A | W86: of:=IF (COUNTIF([$'P4.Robusto'.$E19:$'P4.Robusto'.$E48];"ERR")>0;"ERROR";      IF(COUNTIF([.W56:.W85];"N/T")>0 ; "EN CURSO";         IF (COUNTIF([.W56:.W85];"N/D") > 0;"EN CURSO";              IF (COUNTIF([.$C$20:.$C$49]; "<>") <> COUNTIF([.W56:.W85];"<>");"EN CURSO" ;  IF(COUNTIF([.$C$56:.$C$85]; "<>") = COUNTIF([.W56:.W85];"N/A"); "N/A";                   IF(COUNTIF([.W56:.W85];"Falla")>([$'DATA - Oculta'.$C$25]*((COUNTIF([.W56:.W85];"Pasa")+COUNTIF([.W56:.W85];"Falla"))));                 "NO CONFORME";"CONFORME")))))) -> N/A

Sheet: DATA - Oculta
C7: Ambito geogrÃ¡fico | E7: Ambito temÃ¡tico | G7: Tipo de evaluaciÃ³n | I7: Nivel compliance | K7: V/F | M7: V/F | O7: Tipos de pÃ¡gina | Q7: Tipo de sitio | S7: Tipo de sitio web | U7: Resultado
C9: AGE | E9: EducaciÃ³n | G9: Autoevaluacion con recursos propios | I9: A WCAG2.1 | K9: SÃ­ | M9: Fija | O9: PÃ¡gina inicio | Q9: Sitio web | S9: Mayoritariamente estÃ¡tico | U9: N/T | V9: NT
C10: CCAA | E10: Empleo | G10: AutoevaluaciÃ³n con recursos externos | I10: AA WCAG 2.1 | K10: No | M10: Aleatoria | O10: Inicio de sesiÃ³n | Q10: AplicaciÃ³n mÃ³vil | S10: Servicio electrÃ³nico | U10: N/D | V10: N/D
C11: EELL | E11: Hacienda | G11: InspecciÃ³n acreditada por ENAC | O11: Mapa web | U11: N/A | V11: N/A
C12: Otros | E12: Medio ambiente | O12: Contacto | U12: Falla | V12: Falla
E13: Ocio y cultura | O13: Ayuda | U13: Pasa | V13: Pasa
E14: ProtecciÃ³n social | O14: Legal
E15: Sanidad | O15: Servicio / Proceso
E16: Seguridad orden pÃºblico | O16: BÃºsqueda
E17: Servicios comunitarios | O17: DeclaraciÃ³n accesibilidad
E18: Transporte | O18: Mecanismo de comunicaciÃ³n
E19: Vivienda | O19: Pagina tipo
O20: Otras pÃ¡ginas
O21: Documento descargable
O22: Aleatoria
B23: PARÃMETROS DE CONTEO
B25: Porcentaje fallos por criterio para OK | C25: 0.1
B26: LÃ­mite para SituaciÃ³n Cumplimiento = No Conforme | C26: 0.5
B27: LÃ­mite para SituaciÃ³n Cumplimiento = Plenamente Conforme | C27: 1
B30: CÃLCULOS INTERMEDIOS
B32: Columnas A | C32: 30
B33: Columnas AA | C33: 20

Sheet: Para BD+DWH - Oculta
A1: of:=[$RESULTADOS.B18] -> 0 | B1: of:=[$RESULTADOS.C18] -> A | C1: of:=[$RESULTADOS.D18] -> 0 | D1: of:=[$RESULTADOS.E18] -> 0 | E1: of:=[$RESULTADOS.F18] -> 0 | F1: of:=[$RESULTADOS.G18] -> 0 | G1: of:=[$RESULTADOS.H18] -> 0 | H1: of:=[$RESULTADOS.I18] -> 0 | I1: of:=[$RESULTADOS.J18] -> 0 | J1: of:=[$RESULTADOS.K18] -> 0 | K1: of:=[$RESULTADOS.L18] -> 0 | L1: of:=[$RESULTADOS.M18] -> 0 | M1: of:=[$RESULTADOS.N18] -> 0 | N1: of:=[$RESULTADOS.O18] -> 0 | O1: of:=[$RESULTADOS.P18] -> 0 | P1: of:=[$RESULTADOS.Q18] -> 0 | Q1: of:=[$RESULTADOS.R18] -> 0 | R1: of:=[$RESULTADOS.S18] -> 0 | S1: of:=[$RESULTADOS.T18] -> 0 | T1: of:=[$RESULTADOS.U18] -> 0 | U1: of:=[$RESULTADOS.V18] -> 0 | V1: of:=[$RESULTADOS.W18] -> 0 | W1: of:=[$RESULTADOS.X18] -> 0 | X1: of:=[$RESULTADOS.Y18] -> 0 | Y1: of:=[$RESULTADOS.Z18] -> 0 | Z1: of:=[$RESULTADOS.AA18] -> 0 | AA1: of:=[$RESULTADOS.AB18] -> 0 | AB1: of:=[$RESULTADOS.AC18] -> 0 | AC1: of:=[$RESULTADOS.AD18] -> 0 | AD1: of:=[$RESULTADOS.AE18] -> 0 | AE1: of:=[$RESULTADOS.AF18] -> 0 | AF1: of:=[$RESULTADOS.AG18] -> 0 | AG1: of:=[$RESULTADOS.AH18] -> 0 | AI1: of:=[$RESULTADOS.B54] -> 0 | AJ1: of:=[$RESULTADOS.C54] -> AA | AK1: of:=[$RESULTADOS.D54] -> 0 | AL1: of:=[$RESULTADOS.E54] -> 0 | AM1: of:=[$RESULTADOS.F54] -> 0 | AN1: of:=[$RESULTADOS.G54] -> 0 | AO1: of:=[$RESULTADOS.H54] -> 0 | AP1: of:=[$RESULTADOS.I54] -> 0 | AQ1: of:=[$RESULTADOS.J54] -> 0 | AR1: of:=[$RESULTADOS.K54] -> 0 | AS1: of:=[$RESULTADOS.L54] -> 0 | AT1: of:=[$RESULTADOS.M54] -> 0 | AU1: of:=[$RESULTADOS.N54] -> 0 | AV1: of:=[$RESULTADOS.O54] -> 0 | AW1: of:=[$RESULTADOS.P54] -> 0 | AX1: of:=[$RESULTADOS.Q54] -> 0 | AY1: of:=[$RESULTADOS.R54] -> 0 | AZ1: of:=[$RESULTADOS.S54] -> 0 | BA1: of:=[$RESULTADOS.T54] -> 0 | BB1: of:=[$RESULTADOS.U54] -> 0 | BC1: of:=[$RESULTADOS.V54] -> 0 | BD1: of:=[$RESULTADOS.W54] -> 0 | BE1: of:=[$RESULTADOS.X54] -> 0
A2: of:=[$RESULTADOS.B19] -> 0 | B2: of:=[$RESULTADOS.C19] -> Muestra | C2: of:=[$RESULTADOS.D19] -> 1.1.1 | D2: of:=[$RESULTADOS.E19] -> 1.2.1 | E2: of:=[$RESULTADOS.F19] -> 1.2.2 | F2: of:=[$RESULTADOS.G19] -> 1.2.3 | G2: of:=[$RESULTADOS.H19] -> 1.3.1 | H2: of:=[$RESULTADOS.I19] -> 1.3.2 | I2: of:=[$RESULTADOS.J19] -> 1.3.3 | J2: of:=[$RESULTADOS.K19] -> 1.4.1 | K2: of:=[$RESULTADOS.L19] -> 1.4.2 | L2: of:=[$RESULTADOS.M19] -> 2.1.1 | M2: of:=[$RESULTADOS.N19] -> 2.1.2 | N2: of:=[$RESULTADOS.O19] -> 2.1.4 | O2: of:=[$RESULTADOS.P19] -> 2.2.1 | P2: of:=[$RESULTADOS.Q19] -> 2.2.2 | Q2: of:=[$RESULTADOS.R19] -> 2.3.1 | R2: of:=[$RESULTADOS.S19] -> 2.4.1 | S2: of:=[$RESULTADOS.T19] -> 2.4.2 | T2: of:=[$RESULTADOS.U19] -> 2.4.3 | U2: of:=[$RESULTADOS.V19] -> 2.4.4 | V2: of:=[$RESULTADOS.W19] -> 2.5.1 | W2: of:=[$RESULTADOS.X19] -> 2.5.2 | X2: of:=[$RESULTADOS.Y19] -> 2.5.3 | Y2: of:=[$RESULTADOS.Z19] -> 2.5.4 | Z2: of:=[$RESULTADOS.AA19] -> 3.1.1 | AA2: of:=[$RESULTADOS.AB19] -> 3.2.1 | AB2: of:=[$RESULTADOS.AC19] -> 3.2.2 | AC2: of:=[$RESULTADOS.AD19] -> 3.3.1 | AD2: of:=[$RESULTADOS.AE19] -> 3.3.2 | AE2: of:=[$RESULTADOS.AF19] -> 4.1.1 | AF2: of:=[$RESULTADOS.AG19] -> 4.1.2 | AG2: of:=[$RESULTADOS.AH19] -> 0 | AI2: of:=[$RESULTADOS.B55] -> 0 | AJ2: of:=[$RESULTADOS.C55] -> Muestra | AK2: of:=[$RESULTADOS.D55] -> 1.2.4 | AL2: of:=[$RESULTADOS.E55] -> 1.2.5 | AM2: of:=[$RESULTADOS.F55] -> 1.3.4 | AN2: of:=[$RESULTADOS.G55] -> 1.3.5 | AO2: of:=[$RESULTADOS.H55] -> 1.4.3 | AP2: of:=[$RESULTADOS.I55] -> 1.4.4 | AQ2: of:=[$RESULTADOS.J55] -> 1.4.5 | AR2: of:=[$RESULTADOS.K55] -> 1.4.10 | AS2: of:=[$RESULTADOS.L55] -> 1.4.11 | AT2: of:=[$RESULTADOS.M55] -> 1.4.12 | AU2: of:=[$RESULTADOS.N55] -> 1.4.13 | AV2: of:=[$RESULTADOS.O55] -> 2.4.5 | AW2: of:=[$RESULTADOS.P55] -> 2.4.6 | AX2: of:=[$RESULTADOS.Q55] -> 2.4.7 | AY2: of:=[$RESULTADOS.R55] -> 3.1.2 | AZ2: of:=[$RESULTADOS.S55] -> 3.2.3 | BA2: of:=[$RESULTADOS.T55] -> 3.2.4 | BB2: of:=[$RESULTADOS.U55] -> 3.3.3 | BC2: of:=[$RESULTADOS.V55] -> 3.3.4 | BD2: of:=[$RESULTADOS.W55] -> 4.1.3 | BE2: of:=[$RESULTADOS.X55] -> 0
A3: of:=[$RESULTADOS.B20] ->  | B3: of:=[$RESULTADOS.C20] ->  | C3: of:=[$RESULTADOS.D20] ->  | D3: of:=[$RESULTADOS.E20] ->  | E3: of:=[$RESULTADOS.F20] ->  | F3: of:=[$RESULTADOS.G20] ->  | G3: of:=[$RESULTADOS.H20] ->  | H3: of:=[$RESULTADOS.I20] ->  | I3: of:=[$RESULTADOS.J20] ->  | J3: of:=[$RESULTADOS.K20] ->  | K3: of:=[$RESULTADOS.L20] ->  | L3: of:=[$RESULTADOS.M20] ->  | M3: of:=[$RESULTADOS.N20] ->  | N3: of:=[$RESULTADOS.O20] ->  | O3: of:=[$RESULTADOS.P20] ->  | P3: of:=[$RESULTADOS.Q20] ->  | Q3: of:=[$RESULTADOS.R20] ->  | R3: of:=[$RESULTADOS.S20] ->  | S3: of:=[$RESULTADOS.T20] ->  | T3: of:=[$RESULTADOS.U20] ->  | U3: of:=[$RESULTADOS.V20] ->  | V3: of:=[$RESULTADOS.W20] ->  | W3: of:=[$RESULTADOS.X20] ->  | X3: of:=[$RESULTADOS.Y20] ->  | Y3: of:=[$RESULTADOS.Z20] ->  | Z3: of:=[$RESULTADOS.AA20] ->  | AA3: of:=[$RESULTADOS.AB20] ->  | AB3: of:=[$RESULTADOS.AC20] ->  | AC3: of:=[$RESULTADOS.AD20] ->  | AD3: of:=[$RESULTADOS.AE20] ->  | AE3: of:=[$RESULTADOS.AF20] ->  | AF3: of:=[$RESULTADOS.AG20] ->  | AG3: of:=[$RESULTADOS.AH20] -> 0 | AI3: of:=[$RESULTADOS.B56] ->  | AJ3: of:=[$RESULTADOS.C56] ->  | AK3: of:=[$RESULTADOS.D56] ->  | AL3: of:=[$RESULTADOS.E56] ->  | AM3: of:=[$RESULTADOS.F56] ->  | AN3: of:=[$RESULTADOS.G56] ->  | AO3: of:=[$RESULTADOS.H56] ->  | AP3: of:=[$RESULTADOS.I56] ->  | AQ3: of:=[$RESULTADOS.J56] ->  | AR3: of:=[$RESULTADOS.K56] ->  | AS3: of:=[$RESULTADOS.L56] ->  | AT3: of:=[$RESULTADOS.M56] ->  | AU3: of:=[$RESULTADOS.N56] ->  | AV3: of:=[$RESULTADOS.O56] ->  | AW3: of:=[$RESULTADOS.P56] ->  | AX3: of:=[$RESULTADOS.Q56] ->  | AY3: of:=[$RESULTADOS.R56] ->  | AZ3: of:=[$RESULTADOS.S56] ->  | BA3: of:=[$RESULTADOS.T56] ->  | BB3: of:=[$RESULTADOS.U56] ->  | BC3: of:=[$RESULTADOS.V56] ->  | BD3: of:=[$RESULTADOS.W56] ->  | BE3: of:=[$RESULTADOS.X56] -> 0
A4: of:=[$RESULTADOS.B21] ->  | B4: of:=[$RESULTADOS.C21] ->  | C4: of:=[$RESULTADOS.D21] ->  | D4: of:=[$RESULTADOS.E21] ->  | E4: of:=[$RESULTADOS.F21] ->  | F4: of:=[$RESULTADOS.G21] ->  | G4: of:=[$RESULTADOS.H21] ->  | H4: of:=[$RESULTADOS.I21] ->  | I4: of:=[$RESULTADOS.J21] ->  | J4: of:=[$RESULTADOS.K21] ->  | K4: of:=[$RESULTADOS.L21] ->  | L4: of:=[$RESULTADOS.M21] ->  | M4: of:=[$RESULTADOS.N21] ->  | N4: of:=[$RESULTADOS.O21] ->  | O4: of:=[$RESULTADOS.P21] ->  | P4: of:=[$RESULTADOS.Q21] ->  | Q4: of:=[$RESULTADOS.R21] ->  | R4: of:=[$RESULTADOS.S21] ->  | S4: of:=[$RESULTADOS.T21] ->  | T4: of:=[$RESULTADOS.U21] ->  | U4: of:=[$RESULTADOS.V21] ->  | V4: of:=[$RESULTADOS.W21] ->  | W4: of:=[$RESULTADOS.X21] ->  | X4: of:=[$RESULTADOS.Y21] ->  | Y4: of:=[$RESULTADOS.Z21] ->  | Z4: of:=[$RESULTADOS.AA21] ->  | AA4: of:=[$RESULTADOS.AB21] ->  | AB4: of:=[$RESULTADOS.AC21] ->  | AC4: of:=[$RESULTADOS.AD21] ->  | AD4: of:=[$RESULTADOS.AE21] ->  | AE4: of:=[$RESULTADOS.AF21] ->  | AF4: of:=[$RESULTADOS.AG21] ->  | AG4: of:=[$RESULTADOS.AH21] -> 0 | AI4: of:=[$RESULTADOS.B57] ->  | AJ4: of:=[$RESULTADOS.C57] ->  | AK4: of:=[$RESULTADOS.D57] ->  | AL4: of:=[$RESULTADOS.E57] ->  | AM4: of:=[$RESULTADOS.F57] ->  | AN4: of:=[$RESULTADOS.G57] ->  | AO4: of:=[$RESULTADOS.H57] ->  | AP4: of:=[$RESULTADOS.I57] ->  | AQ4: of:=[$RESULTADOS.J57] ->  | AR4: of:=[$RESULTADOS.K57] ->  | AS4: of:=[$RESULTADOS.L57] ->  | AT4: of:=[$RESULTADOS.M57] ->  | AU4: of:=[$RESULTADOS.N57] ->  | AV4: of:=[$RESULTADOS.O57] ->  | AW4: of:=[$RESULTADOS.P57] ->  | AX4: of:=[$RESULTADOS.Q57] ->  | AY4: of:=[$RESULTADOS.R57] ->  | AZ4: of:=[$RESULTADOS.S57] ->  | BA4: of:=[$RESULTADOS.T57] ->  | BB4: of:=[$RESULTADOS.U57] ->  | BC4: of:=[$RESULTADOS.V57] ->  | BD4: of:=[$RESULTADOS.W57] ->  | BE4: of:=[$RESULTADOS.X57] -> 0
A5: of:=[$RESULTADOS.B22] ->  | B5: of:=[$RESULTADOS.C22] ->  | C5: of:=[$RESULTADOS.D22] ->  | D5: of:=[$RESULTADOS.E22] ->  | E5: of:=[$RESULTADOS.F22] ->  | F5: of:=[$RESULTADOS.G22] ->  | G5: of:=[$RESULTADOS.H22] ->  | H5: of:=[$RESULTADOS.I22] ->  | I5: of:=[$RESULTADOS.J22] ->  | J5: of:=[$RESULTADOS.K22] ->  | K5: of:=[$RESULTADOS.L22] ->  | L5: of:=[$RESULTADOS.M22] ->  | M5: of:=[$RESULTADOS.N22] ->  | N5: of:=[$RESULTADOS.O22] ->  | O5: of:=[$RESULTADOS.P22] ->  | P5: of:=[$RESULTADOS.Q22] ->  | Q5: of:=[$RESULTADOS.R22] ->  | R5: of:=[$RESULTADOS.S22] ->  | S5: of:=[$RESULTADOS.T22] ->  | T5: of:=[$RESULTADOS.U22] ->  | U5: of:=[$RESULTADOS.V22] ->  | V5: of:=[$RESULTADOS.W22] ->  | W5: of:=[$RESULTADOS.X22] ->  | X5: of:=[$RESULTADOS.Y22] ->  | Y5: of:=[$RESULTADOS.Z22] ->  | Z5: of:=[$RESULTADOS.AA22] ->  | AA5: of:=[$RESULTADOS.AB22] ->  | AB5: of:=[$RESULTADOS.AC22] ->  | AC5: of:=[$RESULTADOS.AD22] ->  | AD5: of:=[$RESULTADOS.AE22] ->  | AE5: of:=[$RESULTADOS.AF22] ->  | AF5: of:=[$RESULTADOS.AG22] ->  | AG5: of:=[$RESULTADOS.AH22] -> 0 | AI5: of:=[$RESULTADOS.B58] ->  | AJ5: of:=[$RESULTADOS.C58] ->  | AK5: of:=[$RESULTADOS.D58] ->  | AL5: of:=[$RESULTADOS.E58] ->  | AM5: of:=[$RESULTADOS.F58] ->  | AN5: of:=[$RESULTADOS.G58] ->  | AO5: of:=[$RESULTADOS.H58] ->  | AP5: of:=[$RESULTADOS.I58] ->  | AQ5: of:=[$RESULTADOS.J58] ->  | AR5: of:=[$RESULTADOS.K58] ->  | AS5: of:=[$RESULTADOS.L58] ->  | AT5: of:=[$RESULTADOS.M58] ->  | AU5: of:=[$RESULTADOS.N58] ->  | AV5: of:=[$RESULTADOS.O58] ->  | AW5: of:=[$RESULTADOS.P58] ->  | AX5: of:=[$RESULTADOS.Q58] ->  | AY5: of:=[$RESULTADOS.R58] ->  | AZ5: of:=[$RESULTADOS.S58] ->  | BA5: of:=[$RESULTADOS.T58] ->  | BB5: of:=[$RESULTADOS.U58] ->  | BC5: of:=[$RESULTADOS.V58] ->  | BD5: of:=[$RESULTADOS.W58] ->  | BE5: of:=[$RESULTADOS.X58] -> 0
A6: of:=[$RESULTADOS.B23] ->  | B6: of:=[$RESULTADOS.C23] ->  | C6: of:=[$RESULTADOS.D23] ->  | D6: of:=[$RESULTADOS.E23] ->  | E6: of:=[$RESULTADOS.F23] ->  | F6: of:=[$RESULTADOS.G23] ->  | G6: of:=[$RESULTADOS.H23] ->  | H6: of:=[$RESULTADOS.I23] ->  | I6: of:=[$RESULTADOS.J23] ->  | J6: of:=[$RESULTADOS.K23] ->  | K6: of:=[$RESULTADOS.L23] ->  | L6: of:=[$RESULTADOS.M23] ->  | M6: of:=[$RESULTADOS.N23] ->  | N6: of:=[$RESULTADOS.O23] ->  | O6: of:=[$RESULTADOS.P23] ->  | P6: of:=[$RESULTADOS.Q23] ->  | Q6: of:=[$RESULTADOS.R23] ->  | R6: of:=[$RESULTADOS.S23] ->  | S6: of:=[$RESULTADOS.T23] ->  | T6: of:=[$RESULTADOS.U23] ->  | U6: of:=[$RESULTADOS.V23] ->  | V6: of:=[$RESULTADOS.W23] ->  | W6: of:=[$RESULTADOS.X23] ->  | X6: of:=[$RESULTADOS.Y23] ->  | Y6: of:=[$RESULTADOS.Z23] ->  | Z6: of:=[$RESULTADOS.AA23] ->  | AA6: of:=[$RESULTADOS.AB23] ->  | AB6: of:=[$RESULTADOS.AC23] ->  | AC6: of:=[$RESULTADOS.AD23] ->  | AD6: of:=[$RESULTADOS.AE23] ->  | AE6: of:=[$RESULTADOS.AF23] ->  | AF6: of:=[$RESULTADOS.AG23] ->  | AG6: of:=[$RESULTADOS.AH23] -> 0 | AI6: of:=[$RESULTADOS.B59] ->  | AJ6: of:=[$RESULTADOS.C59] ->  | AK6: of:=[$RESULTADOS.D59] ->  | AL6: of:=[$RESULTADOS.E59] ->  | AM6: of:=[$RESULTADOS.F59] ->  | AN6: of:=[$RESULTADOS.G59] ->  | AO6: of:=[$RESULTADOS.H59] ->  | AP6: of:=[$RESULTADOS.I59] ->  | AQ6: of:=[$RESULTADOS.J59] ->  | AR6: of:=[$RESULTADOS.K59] ->  | AS6: of:=[$RESULTADOS.L59] ->  | AT6: of:=[$RESULTADOS.M59] ->  | AU6: of:=[$RESULTADOS.N59] ->  | AV6: of:=[$RESULTADOS.O59] ->  | AW6: of:=[$RESULTADOS.P59] ->  | AX6: of:=[$RESULTADOS.Q59] ->  | AY6: of:=[$RESULTADOS.R59] ->  | AZ6: of:=[$RESULTADOS.S59] ->  | BA6: of:=[$RESULTADOS.T59] ->  | BB6: of:=[$RESULTADOS.U59] ->  | BC6: of:=[$RESULTADOS.V59] ->  | BD6: of:=[$RESULTADOS.W59] ->  | BE6: of:=[$RESULTADOS.X59] -> 0
A7: of:=[$RESULTADOS.B24] ->  | B7: of:=[$RESULTADOS.C24] ->  | C7: of:=[$RESULTADOS.D24] ->  | D7: of:=[$RESULTADOS.E24] ->  | E7: of:=[$RESULTADOS.F24] ->  | F7: of:=[$RESULTADOS.G24] ->  | G7: of:=[$RESULTADOS.H24] ->  | H7: of:=[$RESULTADOS.I24] ->  | I7: of:=[$RESULTADOS.J24] ->  | J7: of:=[$RESULTADOS.K24] ->  | K7: of:=[$RESULTADOS.L24] ->  | L7: of:=[$RESULTADOS.M24] ->  | M7: of:=[$RESULTADOS.N24] ->  | N7: of:=[$RESULTADOS.O24] ->  | O7: of:=[$RESULTADOS.P24] ->  | P7: of:=[$RESULTADOS.Q24] ->  | Q7: of:=[$RESULTADOS.R24] ->  | R7: of:=[$RESULTADOS.S24] ->  | S7: of:=[$RESULTADOS.T24] ->  | T7: of:=[$RESULTADOS.U24] ->  | U7: of:=[$RESULTADOS.V24] ->  | V7: of:=[$RESULTADOS.W24] ->  | W7: of:=[$RESULTADOS.X24] ->  | X7: of:=[$RESULTADOS.Y24] ->  | Y7: of:=[$RESULTADOS.Z24] ->  | Z7: of:=[$RESULTADOS.AA24] ->  | AA7: of:=[$RESULTADOS.AB24] ->  | AB7: of:=[$RESULTADOS.AC24] ->  | AC7: of:=[$RESULTADOS.AD24] ->  | AD7: of:=[$RESULTADOS.AE24] ->  | AE7: of:=[$RESULTADOS.AF24] ->  | AF7: of:=[$RESULTADOS.AG24] ->  | AG7: of:=[$RESULTADOS.AH24] -> 0 | AI7: of:=[$RESULTADOS.B60] ->  | AJ7: of:=[$RESULTADOS.C60] ->  | AK7: of:=[$RESULTADOS.D60] ->  | AL7: of:=[$RESULTADOS.E60] ->  | AM7: of:=[$RESULTADOS.F60] ->  | AN7: of:=[$RESULTADOS.G60] ->  | AO7: of:=[$RESULTADOS.H60] ->  | AP7: of:=[$RESULTADOS.I60] ->  | AQ7: of:=[$RESULTADOS.J60] ->  | AR7: of:=[$RESULTADOS.K60] ->  | AS7: of:=[$RESULTADOS.L60] ->  | AT7: of:=[$RESULTADOS.M60] ->  | AU7: of:=[$RESULTADOS.N60] ->  | AV7: of:=[$RESULTADOS.O60] ->  | AW7: of:=[$RESULTADOS.P60] ->  | AX7: of:=[$RESULTADOS.Q60] ->  | AY7: of:=[$RESULTADOS.R60] ->  | AZ7: of:=[$RESULTADOS.S60] ->  | BA7: of:=[$RESULTADOS.T60] ->  | BB7: of:=[$RESULTADOS.U60] ->  | BC7: of:=[$RESULTADOS.V60] ->  | BD7: of:=[$RESULTADOS.W60] ->  | BE7: of:=[$RESULTADOS.X60] -> 0
A8: of:=[$RESULTADOS.B25] ->  | B8: of:=[$RESULTADOS.C25] ->  | C8: of:=[$RESULTADOS.D25] ->  | D8: of:=[$RESULTADOS.E25] ->  | E8: of:=[$RESULTADOS.F25] ->  | F8: of:=[$RESULTADOS.G25] ->  | G8: of:=[$RESULTADOS.H25] ->  | H8: of:=[$RESULTADOS.I25] ->  | I8: of:=[$RESULTADOS.J25] ->  | J8: of:=[$RESULTADOS.K25] ->  | K8: of:=[$RESULTADOS.L25] ->  | L8: of:=[$RESULTADOS.M25] ->  | M8: of:=[$RESULTADOS.N25] ->  | N8: of:=[$RESULTADOS.O25] ->  | O8: of:=[$RESULTADOS.P25] ->  | P8: of:=[$RESULTADOS.Q25] ->  | Q8: of:=[$RESULTADOS.R25] ->  | R8: of:=[$RESULTADOS.S25] ->  | S8: of:=[$RESULTADOS.T25] ->  | T8: of:=[$RESULTADOS.U25] ->  | U8: of:=[$RESULTADOS.V25] ->  | V8: of:=[$RESULTADOS.W25] ->  | W8: of:=[$RESULTADOS.X25] ->  | X8: of:=[$RESULTADOS.Y25] ->  | Y8: of:=[$RESULTADOS.Z25] ->  | Z8: of:=[$RESULTADOS.AA25] ->  | AA8: of:=[$RESULTADOS.AB25] ->  | AB8: of:=[$RESULTADOS.AC25] ->  | AC8: of:=[$RESULTADOS.AD25] ->  | AD8: of:=[$RESULTADOS.AE25] ->  | AE8: of:=[$RESULTADOS.AF25] ->  | AF8: of:=[$RESULTADOS.AG25] ->  | AG8: of:=[$RESULTADOS.AH25] -> 0 | AI8: of:=[$RESULTADOS.B61] ->  | AJ8: of:=[$RESULTADOS.C61] ->  | AK8: of:=[$RESULTADOS.D61] ->  | AL8: of:=[$RESULTADOS.E61] ->  | AM8: of:=[$RESULTADOS.F61] ->  | AN8: of:=[$RESULTADOS.G61] ->  | AO8: of:=[$RESULTADOS.H61] ->  | AP8: of:=[$RESULTADOS.I61] ->  | AQ8: of:=[$RESULTADOS.J61] ->  | AR8: of:=[$RESULTADOS.K61] ->  | AS8: of:=[$RESULTADOS.L61] ->  | AT8: of:=[$RESULTADOS.M61] ->  | AU8: of:=[$RESULTADOS.N61] ->  | AV8: of:=[$RESULTADOS.O61] ->  | AW8: of:=[$RESULTADOS.P61] ->  | AX8: of:=[$RESULTADOS.Q61] ->  | AY8: of:=[$RESULTADOS.R61] ->  | AZ8: of:=[$RESULTADOS.S61] ->  | BA8: of:=[$RESULTADOS.T61] ->  | BB8: of:=[$RESULTADOS.U61] ->  | BC8: of:=[$RESULTADOS.V61] ->  | BD8: of:=[$RESULTADOS.W61] ->  | BE8: of:=[$RESULTADOS.X61] -> 0
A9: of:=[$RESULTADOS.B26] ->  | B9: of:=[$RESULTADOS.C26] ->  | C9: of:=[$RESULTADOS.D26] ->  | D9: of:=[$RESULTADOS.E26] ->  | E9: of:=[$RESULTADOS.F26] ->  | F9: of:=[$RESULTADOS.G26] ->  | G9: of:=[$RESULTADOS.H26] ->  | H9: of:=[$RESULTADOS.I26] ->  | I9: of:=[$RESULTADOS.J26] ->  | J9: of:=[$RESULTADOS.K26] ->  | K9: of:=[$RESULTADOS.L26] ->  | L9: of:=[$RESULTADOS.M26] ->  | M9: of:=[$RESULTADOS.N26] ->  | N9: of:=[$RESULTADOS.O26] ->  | O9: of:=[$RESULTADOS.P26] ->  | P9: of:=[$RESULTADOS.Q26] ->  | Q9: of:=[$RESULTADOS.R26] ->  | R9: of:=[$RESULTADOS.S26] ->  | S9: of:=[$RESULTADOS.T26] ->  | T9: of:=[$RESULTADOS.U26] ->  | U9: of:=[$RESULTADOS.V26] ->  | V9: of:=[$RESULTADOS.W26] ->  | W9: of:=[$RESULTADOS.X26] ->  | X9: of:=[$RESULTADOS.Y26] ->  | Y9: of:=[$RESULTADOS.Z26] ->  | Z9: of:=[$RESULTADOS.AA26] ->  | AA9: of:=[$RESULTADOS.AB26] ->  | AB9: of:=[$RESULTADOS.AC26] ->  | AC9: of:=[$RESULTADOS.AD26] ->  | AD9: of:=[$RESULTADOS.AE26] ->  | AE9: of:=[$RESULTADOS.AF26] ->  | AF9: of:=[$RESULTADOS.AG26] ->  | AG9: of:=[$RESULTADOS.AH26] -> 0 | AI9: of:=[$RESULTADOS.B62] ->  | AJ9: of:=[$RESULTADOS.C62] ->  | AK9: of:=[$RESULTADOS.D62] ->  | AL9: of:=[$RESULTADOS.E62] ->  | AM9: of:=[$RESULTADOS.F62] ->  | AN9: of:=[$RESULTADOS.G62] ->  | AO9: of:=[$RESULTADOS.H62] ->  | AP9: of:=[$RESULTADOS.I62] ->  | AQ9: of:=[$RESULTADOS.J62] ->  | AR9: of:=[$RESULTADOS.K62] ->  | AS9: of:=[$RESULTADOS.L62] ->  | AT9: of:=[$RESULTADOS.M62] ->  | AU9: of:=[$RESULTADOS.N62] ->  | AV9: of:=[$RESULTADOS.O62] ->  | AW9: of:=[$RESULTADOS.P62] ->  | AX9: of:=[$RESULTADOS.Q62] ->  | AY9: of:=[$RESULTADOS.R62] ->  | AZ9: of:=[$RESULTADOS.S62] ->  | BA9: of:=[$RESULTADOS.T62] ->  | BB9: of:=[$RESULTADOS.U62] ->  | BC9: of:=[$RESULTADOS.V62] ->  | BD9: of:=[$RESULTADOS.W62] ->  | BE9: of:=[$RESULTADOS.X62] -> 0
A10: of:=[$RESULTADOS.B27] ->  | B10: of:=[$RESULTADOS.C27] ->  | C10: of:=[$RESULTADOS.D27] ->  | D10: of:=[$RESULTADOS.E27] ->  | E10: of:=[$RESULTADOS.F27] ->  | F10: of:=[$RESULTADOS.G27] ->  | G10: of:=[$RESULTADOS.H27] ->  | H10: of:=[$RESULTADOS.I27] ->  | I10: of:=[$RESULTADOS.J27] ->  | J10: of:=[$RESULTADOS.K27] ->  | K10: of:=[$RESULTADOS.L27] ->  | L10: of:=[$RESULTADOS.M27] ->  | M10: of:=[$RESULTADOS.N27] ->  | N10: of:=[$RESULTADOS.O27] ->  | O10: of:=[$RESULTADOS.P27] ->  | P10: of:=[$RESULTADOS.Q27] ->  | Q10: of:=[$RESULTADOS.R27] ->  | R10: of:=[$RESULTADOS.S27] ->  | S10: of:=[$RESULTADOS.T27] ->  | T10: of:=[$RESULTADOS.U27] ->  | U10: of:=[$RESULTADOS.V27] ->  | V10: of:=[$RESULTADOS.W27] ->  | W10: of:=[$RESULTADOS.X27] ->  | X10: of:=[$RESULTADOS.Y27] ->  | Y10: of:=[$RESULTADOS.Z27] ->  | Z10: of:=[$RESULTADOS.AA27] ->  | AA10: of:=[$RESULTADOS.AB27] ->  | AB10: of:=[$RESULTADOS.AC27] ->  | AC10: of:=[$RESULTADOS.AD27] ->  | AD10: of:=[$RESULTADOS.AE27] ->  | AE10: of:=[$RESULTADOS.AF27] ->  | AF10: of:=[$RESULTADOS.AG27] ->  | AG10: of:=[$RESULTADOS.AH27] -> 0 | AI10: of:=[$RESULTADOS.B63] ->  | AJ10: of:=[$RESULTADOS.C63] ->  | AK10: of:=[$RESULTADOS.D63] ->  | AL10: of:=[$RESULTADOS.E63] ->  | AM10: of:=[$RESULTADOS.F63] ->  | AN10: of:=[$RESULTADOS.G63] ->  | AO10: of:=[$RESULTADOS.H63] ->  | AP10: of:=[$RESULTADOS.I63] ->  | AQ10: of:=[$RESULTADOS.J63] ->  | AR10: of:=[$RESULTADOS.K63] ->  | AS10: of:=[$RESULTADOS.L63] ->  | AT10: of:=[$RESULTADOS.M63] ->  | AU10: of:=[$RESULTADOS.N63] ->  | AV10: of:=[$RESULTADOS.O63] ->  | AW10: of:=[$RESULTADOS.P63] ->  | AX10: of:=[$RESULTADOS.Q63] ->  | AY10: of:=[$RESULTADOS.R63] ->  | AZ10: of:=[$RESULTADOS.S63] ->  | BA10: of:=[$RESULTADOS.T63] ->  | BB10: of:=[$RESULTADOS.U63] ->  | BC10: of:=[$RESULTADOS.V63] ->  | BD10: of:=[$RESULTADOS.W63] ->  | BE10: of:=[$RESULTADOS.X63] -> 0
A11: of:=[$RESULTADOS.B28] ->  | B11: of:=[$RESULTADOS.C28] ->  | C11: of:=[$RESULTADOS.D28] ->  | D11: of:=[$RESULTADOS.E28] ->  | E11: of:=[$RESULTADOS.F28] ->  | F11: of:=[$RESULTADOS.G28] ->  | G11: of:=[$RESULTADOS.H28] ->  | H11: of:=[$RESULTADOS.I28] ->  | I11: of:=[$RESULTADOS.J28] ->  | J11: of:=[$RESULTADOS.K28] ->  | K11: of:=[$RESULTADOS.L28] ->  | L11: of:=[$RESULTADOS.M28] ->  | M11: of:=[$RESULTADOS.N28] ->  | N11: of:=[$RESULTADOS.O28] ->  | O11: of:=[$RESULTADOS.P28] ->  | P11: of:=[$RESULTADOS.Q28] ->  | Q11: of:=[$RESULTADOS.R28] ->  | R11: of:=[$RESULTADOS.S28] ->  | S11: of:=[$RESULTADOS.T28] ->  | T11: of:=[$RESULTADOS.U28] ->  | U11: of:=[$RESULTADOS.V28] ->  | V11: of:=[$RESULTADOS.W28] ->  | W11: of:=[$RESULTADOS.X28] ->  | X11: of:=[$RESULTADOS.Y28] ->  | Y11: of:=[$RESULTADOS.Z28] ->  | Z11: of:=[$RESULTADOS.AA28] ->  | AA11: of:=[$RESULTADOS.AB28] ->  | AB11: of:=[$RESULTADOS.AC28] ->  | AC11: of:=[$RESULTADOS.AD28] ->  | AD11: of:=[$RESULTADOS.AE28] ->  | AE11: of:=[$RESULTADOS.AF28] ->  | AF11: of:=[$RESULTADOS.AG28] ->  | AG11: of:=[$RESULTADOS.AH28] -> 0 | AI11: of:=[$RESULTADOS.B64] ->  | AJ11: of:=[$RESULTADOS.C64] ->  | AK11: of:=[$RESULTADOS.D64] ->  | AL11: of:=[$RESULTADOS.E64] ->  | AM11: of:=[$RESULTADOS.F64] ->  | AN11: of:=[$RESULTADOS.G64] ->  | AO11: of:=[$RESULTADOS.H64] ->  | AP11: of:=[$RESULTADOS.I64] ->  | AQ11: of:=[$RESULTADOS.J64] ->  | AR11: of:=[$RESULTADOS.K64] ->  | AS11: of:=[$RESULTADOS.L64] ->  | AT11: of:=[$RESULTADOS.M64] ->  | AU11: of:=[$RESULTADOS.N64] ->  | AV11: of:=[$RESULTADOS.O64] ->  | AW11: of:=[$RESULTADOS.P64] ->  | AX11: of:=[$RESULTADOS.Q64] ->  | AY11: of:=[$RESULTADOS.R64] ->  | AZ11: of:=[$RESULTADOS.S64] ->  | BA11: of:=[$RESULTADOS.T64] ->  | BB11: of:=[$RESULTADOS.U64] ->  | BC11: of:=[$RESULTADOS.V64] ->  | BD11: of:=[$RESULTADOS.W64] ->  | BE11: of:=[$RESULTADOS.X64] -> 0
A12: of:=[$RESULTADOS.B29] ->  | B12: of:=[$RESULTADOS.C29] ->  | C12: of:=[$RESULTADOS.D29] ->  | D12: of:=[$RESULTADOS.E29] ->  | E12: of:=[$RESULTADOS.F29] ->  | F12: of:=[$RESULTADOS.G29] ->  | G12: of:=[$RESULTADOS.H29] ->  | H12: of:=[$RESULTADOS.I29] ->  | I12: of:=[$RESULTADOS.J29] ->  | J12: of:=[$RESULTADOS.K29] ->  | K12: of:=[$RESULTADOS.L29] ->  | L12: of:=[$RESULTADOS.M29] ->  | M12: of:=[$RESULTADOS.N29] ->  | N12: of:=[$RESULTADOS.O29] ->  | O12: of:=[$RESULTADOS.P29] ->  | P12: of:=[$RESULTADOS.Q29] ->  | Q12: of:=[$RESULTADOS.R29] ->  | R12: of:=[$RESULTADOS.S29] ->  | S12: of:=[$RESULTADOS.T29] ->  | T12: of:=[$RESULTADOS.U29] ->  | U12: of:=[$RESULTADOS.V29] ->  | V12: of:=[$RESULTADOS.W29] ->  | W12: of:=[$RESULTADOS.X29] ->  | X12: of:=[$RESULTADOS.Y29] ->  | Y12: of:=[$RESULTADOS.Z29] ->  | Z12: of:=[$RESULTADOS.AA29] ->  | AA12: of:=[$RESULTADOS.AB29] ->  | AB12: of:=[$RESULTADOS.AC29] ->  | AC12: of:=[$RESULTADOS.AD29] ->  | AD12: of:=[$RESULTADOS.AE29] ->  | AE12: of:=[$RESULTADOS.AF29] ->  | AF12: of:=[$RESULTADOS.AG29] ->  | AG12: of:=[$RESULTADOS.AH29] -> 0 | AI12: of:=[$RESULTADOS.B65] ->  | AJ12: of:=[$RESULTADOS.C65] ->  | AK12: of:=[$RESULTADOS.D65] ->  | AL12: of:=[$RESULTADOS.E65] ->  | AM12: of:=[$RESULTADOS.F65] ->  | AN12: of:=[$RESULTADOS.G65] ->  | AO12: of:=[$RESULTADOS.H65] ->  | AP12: of:=[$RESULTADOS.I65] ->  | AQ12: of:=[$RESULTADOS.J65] ->  | AR12: of:=[$RESULTADOS.K65] ->  | AS12: of:=[$RESULTADOS.L65] ->  | AT12: of:=[$RESULTADOS.M65] ->  | AU12: of:=[$RESULTADOS.N65] ->  | AV12: of:=[$RESULTADOS.O65] ->  | AW12: of:=[$RESULTADOS.P65] ->  | AX12: of:=[$RESULTADOS.Q65] ->  | AY12: of:=[$RESULTADOS.R65] ->  | AZ12: of:=[$RESULTADOS.S65] ->  | BA12: of:=[$RESULTADOS.T65] ->  | BB12: of:=[$RESULTADOS.U65] ->  | BC12: of:=[$RESULTADOS.V65] ->  | BD12: of:=[$RESULTADOS.W65] ->  | BE12: of:=[$RESULTADOS.X65] -> 0
A13: of:=[$RESULTADOS.B30] ->  | B13: of:=[$RESULTADOS.C30] ->  | C13: of:=[$RESULTADOS.D30] ->  | D13: of:=[$RESULTADOS.E30] ->  | E13: of:=[$RESULTADOS.F30] ->  | F13: of:=[$RESULTADOS.G30] ->  | G13: of:=[$RESULTADOS.H30] ->  | H13: of:=[$RESULTADOS.I30] ->  | I13: of:=[$RESULTADOS.J30] ->  | J13: of:=[$RESULTADOS.K30] ->  | K13: of:=[$RESULTADOS.L30] ->  | L13: of:=[$RESULTADOS.M30] ->  | M13: of:=[$RESULTADOS.N30] ->  | N13: of:=[$RESULTADOS.O30] ->  | O13: of:=[$RESULTADOS.P30] ->  | P13: of:=[$RESULTADOS.Q30] ->  | Q13: of:=[$RESULTADOS.R30] ->  | R13: of:=[$RESULTADOS.S30] ->  | S13: of:=[$RESULTADOS.T30] ->  | T13: of:=[$RESULTADOS.U30] ->  | U13: of:=[$RESULTADOS.V30] ->  | V13: of:=[$RESULTADOS.W30] ->  | W13: of:=[$RESULTADOS.X30] ->  | X13: of:=[$RESULTADOS.Y30] ->  | Y13: of:=[$RESULTADOS.Z30] ->  | Z13: of:=[$RESULTADOS.AA30] ->  | AA13: of:=[$RESULTADOS.AB30] ->  | AB13: of:=[$RESULTADOS.AC30] ->  | AC13: of:=[$RESULTADOS.AD30] ->  | AD13: of:=[$RESULTADOS.AE30] ->  | AE13: of:=[$RESULTADOS.AF30] ->  | AF13: of:=[$RESULTADOS.AG30] ->  | AG13: of:=[$RESULTADOS.AH30] -> 0 | AI13: of:=[$RESULTADOS.B66] ->  | AJ13: of:=[$RESULTADOS.C66] ->  | AK13: of:=[$RESULTADOS.D66] ->  | AL13: of:=[$RESULTADOS.E66] ->  | AM13: of:=[$RESULTADOS.F66] ->  | AN13: of:=[$RESULTADOS.G66] ->  | AO13: of:=[$RESULTADOS.H66] ->  | AP13: of:=[$RESULTADOS.I66] ->  | AQ13: of:=[$RESULTADOS.J66] ->  | AR13: of:=[$RESULTADOS.K66] ->  | AS13: of:=[$RESULTADOS.L66] ->  | AT13: of:=[$RESULTADOS.M66] ->  | AU13: of:=[$RESULTADOS.N66] ->  | AV13: of:=[$RESULTADOS.O66] ->  | AW13: of:=[$RESULTADOS.P66] ->  | AX13: of:=[$RESULTADOS.Q66] ->  | AY13: of:=[$RESULTADOS.R66] ->  | AZ13: of:=[$RESULTADOS.S66] ->  | BA13: of:=[$RESULTADOS.T66] ->  | BB13: of:=[$RESULTADOS.U66] ->  | BC13: of:=[$RESULTADOS.V66] ->  | BD13: of:=[$RESULTADOS.W66] ->  | BE13: of:=[$RESULTADOS.X66] -> 0
A14: of:=[$RESULTADOS.B31] ->  | B14: of:=[$RESULTADOS.C31] ->  | C14: of:=[$RESULTADOS.D31] ->  | D14: of:=[$RESULTADOS.E31] ->  | E14: of:=[$RESULTADOS.F31] ->  | F14: of:=[$RESULTADOS.G31] ->  | G14: of:=[$RESULTADOS.H31] ->  | H14: of:=[$RESULTADOS.I31] ->  | I14: of:=[$RESULTADOS.J31] ->  | J14: of:=[$RESULTADOS.K31] ->  | K14: of:=[$RESULTADOS.L31] ->  | L14: of:=[$RESULTADOS.M31] ->  | M14: of:=[$RESULTADOS.N31] ->  | N14: of:=[$RESULTADOS.O31] ->  | O14: of:=[$RESULTADOS.P31] ->  | P14: of:=[$RESULTADOS.Q31] ->  | Q14: of:=[$RESULTADOS.R31] ->  | R14: of:=[$RESULTADOS.S31] ->  | S14: of:=[$RESULTADOS.T31] ->  | T14: of:=[$RESULTADOS.U31] ->  | U14: of:=[$RESULTADOS.V31] ->  | V14: of:=[$RESULTADOS.W31] ->  | W14: of:=[$RESULTADOS.X31] ->  | X14: of:=[$RESULTADOS.Y31] ->  | Y14: of:=[$RESULTADOS.Z31] ->  | Z14: of:=[$RESULTADOS.AA31] ->  | AA14: of:=[$RESULTADOS.AB31] ->  | AB14: of:=[$RESULTADOS.AC31] ->  | AC14: of:=[$RESULTADOS.AD31] ->  | AD14: of:=[$RESULTADOS.AE31] ->  | AE14: of:=[$RESULTADOS.AF31] ->  | AF14: of:=[$RESULTADOS.AG31] ->  | AG14: of:=[$RESULTADOS.AH31] -> 0 | AI14: of:=[$RESULTADOS.B67] ->  | AJ14: of:=[$RESULTADOS.C67] ->  | AK14: of:=[$RESULTADOS.D67] ->  | AL14: of:=[$RESULTADOS.E67] ->  | AM14: of:=[$RESULTADOS.F67] ->  | AN14: of:=[$RESULTADOS.G67] ->  | AO14: of:=[$RESULTADOS.H67] ->  | AP14: of:=[$RESULTADOS.I67] ->  | AQ14: of:=[$RESULTADOS.J67] ->  | AR14: of:=[$RESULTADOS.K67] ->  | AS14: of:=[$RESULTADOS.L67] ->  | AT14: of:=[$RESULTADOS.M67] ->  | AU14: of:=[$RESULTADOS.N67] ->  | AV14: of:=[$RESULTADOS.O67] ->  | AW14: of:=[$RESULTADOS.P67] ->  | AX14: of:=[$RESULTADOS.Q67] ->  | AY14: of:=[$RESULTADOS.R67] ->  | AZ14: of:=[$RESULTADOS.S67] ->  | BA14: of:=[$RESULTADOS.T67] ->  | BB14: of:=[$RESULTADOS.U67] ->  | BC14: of:=[$RESULTADOS.V67] ->  | BD14: of:=[$RESULTADOS.W67] ->  | BE14: of:=[$RESULTADOS.X67] -> 0
A15: of:=[$RESULTADOS.B43] ->  | B15: of:=[$RESULTADOS.C43] ->  | C15: of:=[$RESULTADOS.D43] ->  | D15: of:=[$RESULTADOS.E43] ->  | E15: of:=[$RESULTADOS.F43] ->  | F15: of:=[$RESULTADOS.G43] ->  | G15: of:=[$RESULTADOS.H43] ->  | H15: of:=[$RESULTADOS.I43] ->  | I15: of:=[$RESULTADOS.J43] ->  | J15: of:=[$RESULTADOS.K43] ->  | K15: of:=[$RESULTADOS.L43] ->  | L15: of:=[$RESULTADOS.M43] ->  | M15: of:=[$RESULTADOS.N43] ->  | N15: of:=[$RESULTADOS.O43] ->  | O15: of:=[$RESULTADOS.P43] ->  | P15: of:=[$RESULTADOS.Q43] ->  | Q15: of:=[$RESULTADOS.R43] ->  | R15: of:=[$RESULTADOS.S43] ->  | S15: of:=[$RESULTADOS.T43] ->  | T15: of:=[$RESULTADOS.U43] ->  | U15: of:=[$RESULTADOS.V43] ->  | V15: of:=[$RESULTADOS.W43] ->  | W15: of:=[$RESULTADOS.X43] ->  | X15: of:=[$RESULTADOS.Y43] ->  | Y15: of:=[$RESULTADOS.Z43] ->  | Z15: of:=[$RESULTADOS.AA43] ->  | AA15: of:=[$RESULTADOS.AB43] ->  | AB15: of:=[$RESULTADOS.AC43] ->  | AC15: of:=[$RESULTADOS.AD43] ->  | AD15: of:=[$RESULTADOS.AE43] ->  | AE15: of:=[$RESULTADOS.AF43] ->  | AF15: of:=[$RESULTADOS.AG43] ->  | AG15: of:=[$RESULTADOS.AH43] -> 0 | AI15: of:=[$RESULTADOS.B79] ->  | AJ15: of:=[$RESULTADOS.C79] ->  | AK15: of:=[$RESULTADOS.D79] ->  | AL15: of:=[$RESULTADOS.E79] ->  | AM15: of:=[$RESULTADOS.F79] ->  | AN15: of:=[$RESULTADOS.G79] ->  | AO15: of:=[$RESULTADOS.H79] ->  | AP15: of:=[$RESULTADOS.I79] ->  | AQ15: of:=[$RESULTADOS.J79] ->  | AR15: of:=[$RESULTADOS.K79] ->  | AS15: of:=[$RESULTADOS.L79] ->  | AT15: of:=[$RESULTADOS.M79] ->  | AU15: of:=[$RESULTADOS.N79] ->  | AV15: of:=[$RESULTADOS.O79] ->  | AW15: of:=[$RESULTADOS.P79] ->  | AX15: of:=[$RESULTADOS.Q79] ->  | AY15: of:=[$RESULTADOS.R79] ->  | AZ15: of:=[$RESULTADOS.S79] ->  | BA15: of:=[$RESULTADOS.T79] ->  | BB15: of:=[$RESULTADOS.U79] ->  | BC15: of:=[$RESULTADOS.V79] ->  | BD15: of:=[$RESULTADOS.W79] ->  | BE15: of:=[$RESULTADOS.X79] -> 0
A16: of:=[$RESULTADOS.B44] ->  | B16: of:=[$RESULTADOS.C44] ->  | C16: of:=[$RESULTADOS.D44] ->  | D16: of:=[$RESULTADOS.E44] ->  | E16: of:=[$RESULTADOS.F44] ->  | F16: of:=[$RESULTADOS.G44] ->  | G16: of:=[$RESULTADOS.H44] ->  | H16: of:=[$RESULTADOS.I44] ->  | I16: of:=[$RESULTADOS.J44] ->  | J16: of:=[$RESULTADOS.K44] ->  | K16: of:=[$RESULTADOS.L44] ->  | L16: of:=[$RESULTADOS.M44] ->  | M16: of:=[$RESULTADOS.N44] ->  | N16: of:=[$RESULTADOS.O44] ->  | O16: of:=[$RESULTADOS.P44] ->  | P16: of:=[$RESULTADOS.Q44] ->  | Q16: of:=[$RESULTADOS.R44] ->  | R16: of:=[$RESULTADOS.S44] ->  | S16: of:=[$RESULTADOS.T44] ->  | T16: of:=[$RESULTADOS.U44] ->  | U16: of:=[$RESULTADOS.V44] ->  | V16: of:=[$RESULTADOS.W44] ->  | W16: of:=[$RESULTADOS.X44] ->  | X16: of:=[$RESULTADOS.Y44] ->  | Y16: of:=[$RESULTADOS.Z44] ->  | Z16: of:=[$RESULTADOS.AA44] ->  | AA16: of:=[$RESULTADOS.AB44] ->  | AB16: of:=[$RESULTADOS.AC44] ->  | AC16: of:=[$RESULTADOS.AD44] ->  | AD16: of:=[$RESULTADOS.AE44] ->  | AE16: of:=[$RESULTADOS.AF44] ->  | AF16: of:=[$RESULTADOS.AG44] ->  | AG16: of:=[$RESULTADOS.AH44] -> 0 | AI16: of:=[$RESULTADOS.B80] ->  | AJ16: of:=[$RESULTADOS.C80] ->  | AK16: of:=[$RESULTADOS.D80] ->  | AL16: of:=[$RESULTADOS.E80] ->  | AM16: of:=[$RESULTADOS.F80] ->  | AN16: of:=[$RESULTADOS.G80] ->  | AO16: of:=[$RESULTADOS.H80] ->  | AP16: of:=[$RESULTADOS.I80] ->  | AQ16: of:=[$RESULTADOS.J80] ->  | AR16: of:=[$RESULTADOS.K80] ->  | AS16: of:=[$RESULTADOS.L80] ->  | AT16: of:=[$RESULTADOS.M80] ->  | AU16: of:=[$RESULTADOS.N80] ->  | AV16: of:=[$RESULTADOS.O80] ->  | AW16: of:=[$RESULTADOS.P80] ->  | AX16: of:=[$RESULTADOS.Q80] ->  | AY16: of:=[$RESULTADOS.R80] ->  | AZ16: of:=[$RESULTADOS.S80] ->  | BA16: of:=[$RESULTADOS.T80] ->  | BB16: of:=[$RESULTADOS.U80] ->  | BC16: of:=[$RESULTADOS.V80] ->  | BD16: of:=[$RESULTADOS.W80] ->  | BE16: of:=[$RESULTADOS.X80] -> 0
A17: of:=[$RESULTADOS.B45] ->  | B17: of:=[$RESULTADOS.C45] ->  | C17: of:=[$RESULTADOS.D45] ->  | D17: of:=[$RESULTADOS.E45] ->  | E17: of:=[$RESULTADOS.F45] ->  | F17: of:=[$RESULTADOS.G45] ->  | G17: of:=[$RESULTADOS.H45] ->  | H17: of:=[$RESULTADOS.I45] ->  | I17: of:=[$RESULTADOS.J45] ->  | J17: of:=[$RESULTADOS.K45] ->  | K17: of:=[$RESULTADOS.L45] ->  | L17: of:=[$RESULTADOS.M45] ->  | M17: of:=[$RESULTADOS.N45] ->  | N17: of:=[$RESULTADOS.O45] ->  | O17: of:=[$RESULTADOS.P45] ->  | P17: of:=[$RESULTADOS.Q45] ->  | Q17: of:=[$RESULTADOS.R45] ->  | R17: of:=[$RESULTADOS.S45] ->  | S17: of:=[$RESULTADOS.T45] ->  | T17: of:=[$RESULTADOS.U45] ->  | U17: of:=[$RESULTADOS.V45] ->  | V17: of:=[$RESULTADOS.W45] ->  | W17: of:=[$RESULTADOS.X45] ->  | X17: of:=[$RESULTADOS.Y45] ->  | Y17: of:=[$RESULTADOS.Z45] ->  | Z17: of:=[$RESULTADOS.AA45] ->  | AA17: of:=[$RESULTADOS.AB45] ->  | AB17: of:=[$RESULTADOS.AC45] ->  | AC17: of:=[$RESULTADOS.AD45] ->  | AD17: of:=[$RESULTADOS.AE45] ->  | AE17: of:=[$RESULTADOS.AF45] ->  | AF17: of:=[$RESULTADOS.AG45] ->  | AG17: of:=[$RESULTADOS.AH45] -> 0 | AI17: of:=[$RESULTADOS.B81] ->  | AJ17: of:=[$RESULTADOS.C81] ->  | AK17: of:=[$RESULTADOS.D81] ->  | AL17: of:=[$RESULTADOS.E81] ->  | AM17: of:=[$RESULTADOS.F81] ->  | AN17: of:=[$RESULTADOS.G81] ->  | AO17: of:=[$RESULTADOS.H81] ->  | AP17: of:=[$RESULTADOS.I81] ->  | AQ17: of:=[$RESULTADOS.J81] ->  | AR17: of:=[$RESULTADOS.K81] ->  | AS17: of:=[$RESULTADOS.L81] ->  | AT17: of:=[$RESULTADOS.M81] ->  | AU17: of:=[$RESULTADOS.N81] ->  | AV17: of:=[$RESULTADOS.O81] ->  | AW17: of:=[$RESULTADOS.P81] ->  | AX17: of:=[$RESULTADOS.Q81] ->  | AY17: of:=[$RESULTADOS.R81] ->  | AZ17: of:=[$RESULTADOS.S81] ->  | BA17: of:=[$RESULTADOS.T81] ->  | BB17: of:=[$RESULTADOS.U81] ->  | BC17: of:=[$RESULTADOS.V81] ->  | BD17: of:=[$RESULTADOS.W81] ->  | BE17: of:=[$RESULTADOS.X81] -> 0
A18: of:=[$RESULTADOS.B46] ->  | B18: of:=[$RESULTADOS.C46] ->  | C18: of:=[$RESULTADOS.D46] ->  | D18: of:=[$RESULTADOS.E46] ->  | E18: of:=[$RESULTADOS.F46] ->  | F18: of:=[$RESULTADOS.G46] ->  | G18: of:=[$RESULTADOS.H46] ->  | H18: of:=[$RESULTADOS.I46] ->  | I18: of:=[$RESULTADOS.J46] ->  | J18: of:=[$RESULTADOS.K46] ->  | K18: of:=[$RESULTADOS.L46] ->  | L18: of:=[$RESULTADOS.M46] ->  | M18: of:=[$RESULTADOS.N46] ->  | N18: of:=[$RESULTADOS.O46] ->  | O18: of:=[$RESULTADOS.P46] ->  | P18: of:=[$RESULTADOS.Q46] ->  | Q18: of:=[$RESULTADOS.R46] ->  | R18: of:=[$RESULTADOS.S46] ->  | S18: of:=[$RESULTADOS.T46] ->  | T18: of:=[$RESULTADOS.U46] ->  | U18: of:=[$RESULTADOS.V46] ->  | V18: of:=[$RESULTADOS.W46] ->  | W18: of:=[$RESULTADOS.X46] ->  | X18: of:=[$RESULTADOS.Y46] ->  | Y18: of:=[$RESULTADOS.Z46] ->  | Z18: of:=[$RESULTADOS.AA46] ->  | AA18: of:=[$RESULTADOS.AB46] ->  | AB18: of:=[$RESULTADOS.AC46] ->  | AC18: of:=[$RESULTADOS.AD46] ->  | AD18: of:=[$RESULTADOS.AE46] ->  | AE18: of:=[$RESULTADOS.AF46] ->  | AF18: of:=[$RESULTADOS.AG46] ->  | AG18: of:=[$RESULTADOS.AH46] -> 0 | AI18: of:=[$RESULTADOS.B82] ->  | AJ18: of:=[$RESULTADOS.C82] ->  | AK18: of:=[$RESULTADOS.D82] ->  | AL18: of:=[$RESULTADOS.E82] ->  | AM18: of:=[$RESULTADOS.F82] ->  | AN18: of:=[$RESULTADOS.G82] ->  | AO18: of:=[$RESULTADOS.H82] ->  | AP18: of:=[$RESULTADOS.I82] ->  | AQ18: of:=[$RESULTADOS.J82] ->  | AR18: of:=[$RESULTADOS.K82] ->  | AS18: of:=[$RESULTADOS.L82] ->  | AT18: of:=[$RESULTADOS.M82] ->  | AU18: of:=[$RESULTADOS.N82] ->  | AV18: of:=[$RESULTADOS.O82] ->  | AW18: of:=[$RESULTADOS.P82] ->  | AX18: of:=[$RESULTADOS.Q82] ->  | AY18: of:=[$RESULTADOS.R82] ->  | AZ18: of:=[$RESULTADOS.S82] ->  | BA18: of:=[$RESULTADOS.T82] ->  | BB18: of:=[$RESULTADOS.U82] ->  | BC18: of:=[$RESULTADOS.V82] ->  | BD18: of:=[$RESULTADOS.W82] ->  | BE18: of:=[$RESULTADOS.X82] -> 0
A19: of:=[$RESULTADOS.B47] ->  | B19: of:=[$RESULTADOS.C47] ->  | C19: of:=[$RESULTADOS.D47] ->  | D19: of:=[$RESULTADOS.E47] ->  | E19: of:=[$RESULTADOS.F47] ->  | F19: of:=[$RESULTADOS.G47] ->  | G19: of:=[$RESULTADOS.H47] ->  | H19: of:=[$RESULTADOS.I47] ->  | I19: of:=[$RESULTADOS.J47] ->  | J19: of:=[$RESULTADOS.K47] ->  | K19: of:=[$RESULTADOS.L47] ->  | L19: of:=[$RESULTADOS.M47] ->  | M19: of:=[$RESULTADOS.N47] ->  | N19: of:=[$RESULTADOS.O47] ->  | O19: of:=[$RESULTADOS.P47] ->  | P19: of:=[$RESULTADOS.Q47] ->  | Q19: of:=[$RESULTADOS.R47] ->  | R19: of:=[$RESULTADOS.S47] ->  | S19: of:=[$RESULTADOS.T47] ->  | T19: of:=[$RESULTADOS.U47] ->  | U19: of:=[$RESULTADOS.V47] ->  | V19: of:=[$RESULTADOS.W47] ->  | W19: of:=[$RESULTADOS.X47] ->  | X19: of:=[$RESULTADOS.Y47] ->  | Y19: of:=[$RESULTADOS.Z47] ->  | Z19: of:=[$RESULTADOS.AA47] ->  | AA19: of:=[$RESULTADOS.AB47] ->  | AB19: of:=[$RESULTADOS.AC47] ->  | AC19: of:=[$RESULTADOS.AD47] ->  | AD19: of:=[$RESULTADOS.AE47] ->  | AE19: of:=[$RESULTADOS.AF47] ->  | AF19: of:=[$RESULTADOS.AG47] ->  | AG19: of:=[$RESULTADOS.AH47] -> 0 | AI19: of:=[$RESULTADOS.B83] ->  | AJ19: of:=[$RESULTADOS.C83] ->  | AK19: of:=[$RESULTADOS.D83] ->  | AL19: of:=[$RESULTADOS.E83] ->  | AM19: of:=[$RESULTADOS.F83] ->  | AN19: of:=[$RESULTADOS.G83] ->  | AO19: of:=[$RESULTADOS.H83] ->  | AP19: of:=[$RESULTADOS.I83] ->  | AQ19: of:=[$RESULTADOS.J83] ->  | AR19: of:=[$RESULTADOS.K83] ->  | AS19: of:=[$RESULTADOS.L83] ->  | AT19: of:=[$RESULTADOS.M83] ->  | AU19: of:=[$RESULTADOS.N83] ->  | AV19: of:=[$RESULTADOS.O83] ->  | AW19: of:=[$RESULTADOS.P83] ->  | AX19: of:=[$RESULTADOS.Q83] ->  | AY19: of:=[$RESULTADOS.R83] ->  | AZ19: of:=[$RESULTADOS.S83] ->  | BA19: of:=[$RESULTADOS.T83] ->  | BB19: of:=[$RESULTADOS.U83] ->  | BC19: of:=[$RESULTADOS.V83] ->  | BD19: of:=[$RESULTADOS.W83] ->  | BE19: of:=[$RESULTADOS.X83] -> 0
A20: of:=[$RESULTADOS.B48] ->  | B20: of:=[$RESULTADOS.C48] ->  | C20: of:=[$RESULTADOS.D48] ->  | D20: of:=[$RESULTADOS.E48] ->  | E20: of:=[$RESULTADOS.F48] ->  | F20: of:=[$RESULTADOS.G48] ->  | G20: of:=[$RESULTADOS.H48] ->  | H20: of:=[$RESULTADOS.I48] ->  | I20: of:=[$RESULTADOS.J48] ->  | J20: of:=[$RESULTADOS.K48] ->  | K20: of:=[$RESULTADOS.L48] ->  | L20: of:=[$RESULTADOS.M48] ->  | M20: of:=[$RESULTADOS.N48] ->  | N20: of:=[$RESULTADOS.O48] ->  | O20: of:=[$RESULTADOS.P48] ->  | P20: of:=[$RESULTADOS.Q48] ->  | Q20: of:=[$RESULTADOS.R48] ->  | R20: of:=[$RESULTADOS.S48] ->  | S20: of:=[$RESULTADOS.T48] ->  | T20: of:=[$RESULTADOS.U48] ->  | U20: of:=[$RESULTADOS.V48] ->  | V20: of:=[$RESULTADOS.W48] ->  | W20: of:=[$RESULTADOS.X48] ->  | X20: of:=[$RESULTADOS.Y48] ->  | Y20: of:=[$RESULTADOS.Z48] ->  | Z20: of:=[$RESULTADOS.AA48] ->  | AA20: of:=[$RESULTADOS.AB48] ->  | AB20: of:=[$RESULTADOS.AC48] ->  | AC20: of:=[$RESULTADOS.AD48] ->  | AD20: of:=[$RESULTADOS.AE48] ->  | AE20: of:=[$RESULTADOS.AF48] ->  | AF20: of:=[$RESULTADOS.AG48] ->  | AG20: of:=[$RESULTADOS.AH48] -> 0 | AI20: of:=[$RESULTADOS.B84] ->  | AJ20: of:=[$RESULTADOS.C84] ->  | AK20: of:=[$RESULTADOS.D84] ->  | AL20: of:=[$RESULTADOS.E84] ->  | AM20: of:=[$RESULTADOS.F84] ->  | AN20: of:=[$RESULTADOS.G84] ->  | AO20: of:=[$RESULTADOS.H84] ->  | AP20: of:=[$RESULTADOS.I84] ->  | AQ20: of:=[$RESULTADOS.J84] ->  | AR20: of:=[$RESULTADOS.K84] ->  | AS20: of:=[$RESULTADOS.L84] ->  | AT20: of:=[$RESULTADOS.M84] ->  | AU20: of:=[$RESULTADOS.N84] ->  | AV20: of:=[$RESULTADOS.O84] ->  | AW20: of:=[$RESULTADOS.P84] ->  | AX20: of:=[$RESULTADOS.Q84] ->  | AY20: of:=[$RESULTADOS.R84] ->  | AZ20: of:=[$RESULTADOS.S84] ->  | BA20: of:=[$RESULTADOS.T84] ->  | BB20: of:=[$RESULTADOS.U84] ->  | BC20: of:=[$RESULTADOS.V84] ->  | BD20: of:=[$RESULTADOS.W84] ->  | BE20: of:=[$RESULTADOS.X84] -> 0
A21: of:=[$RESULTADOS.B48] ->  | B21: of:=[$RESULTADOS.C48] ->  | C21: of:=[$RESULTADOS.D48] ->  | D21: of:=[$RESULTADOS.E48] ->  | E21: of:=[$RESULTADOS.F48] ->  | F21: of:=[$RESULTADOS.G48] ->  | G21: of:=[$RESULTADOS.H48] ->  | H21: of:=[$RESULTADOS.I48] ->  | I21: of:=[$RESULTADOS.J48] ->  | J21: of:=[$RESULTADOS.K48] ->  | K21: of:=[$RESULTADOS.L48] ->  | L21: of:=[$RESULTADOS.M48] ->  | M21: of:=[$RESULTADOS.N48] ->  | N21: of:=[$RESULTADOS.O48] ->  | O21: of:=[$RESULTADOS.P48] ->  | P21: of:=[$RESULTADOS.Q48] ->  | Q21: of:=[$RESULTADOS.R48] ->  | R21: of:=[$RESULTADOS.S48] ->  | S21: of:=[$RESULTADOS.T48] ->  | T21: of:=[$RESULTADOS.U48] ->  | U21: of:=[$RESULTADOS.V48] ->  | V21: of:=[$RESULTADOS.W48] ->  | W21: of:=[$RESULTADOS.X48] ->  | X21: of:=[$RESULTADOS.Y48] ->  | Y21: of:=[$RESULTADOS.Z48] ->  | Z21: of:=[$RESULTADOS.AA48] ->  | AA21: of:=[$RESULTADOS.AB48] ->  | AB21: of:=[$RESULTADOS.AC48] ->  | AC21: of:=[$RESULTADOS.AD48] ->  | AD21: of:=[$RESULTADOS.AE48] ->  | AE21: of:=[$RESULTADOS.AF48] ->  | AF21: of:=[$RESULTADOS.AG48] ->  | AG21: of:=[$RESULTADOS.AH48] -> 0 | AI21: of:=#REF! ->  | AJ21: of:=#REF! ->  | AK21: of:=#REF! ->  | AL21: of:=#REF! ->  | AM21: of:=#REF! ->  | AN21: of:=#REF! ->  | AO21: of:=#REF! ->  | AP21: of:=#REF! ->  | AQ21: of:=#REF! ->  | AR21: of:=#REF! ->  | AS21: of:=#REF! ->  | AT21: of:=#REF! ->  | AU21: of:=#REF! ->  | AV21: of:=#REF! ->  | AW21: of:=#REF! ->  | AX21: of:=#REF! ->  | AY21: of:=#REF! ->  | AZ21: of:=#REF! ->  | BA21: of:=#REF! ->  | BB21: of:=#REF! ->  | BC21: of:=#REF! ->  | BD21: of:=#REF! ->  | BE21: of:=#REF! -> 
A22: of:=[$RESULTADOS.B49] ->  | B22: of:=[$RESULTADOS.C49] ->  | C22: of:=[$RESULTADOS.D49] ->  | D22: of:=[$RESULTADOS.E49] ->  | E22: of:=[$RESULTADOS.F49] ->  | F22: of:=[$RESULTADOS.G49] ->  | G22: of:=[$RESULTADOS.H49] ->  | H22: of:=[$RESULTADOS.I49] ->  | I22: of:=[$RESULTADOS.J49] ->  | J22: of:=[$RESULTADOS.K49] ->  | K22: of:=[$RESULTADOS.L49] ->  | L22: of:=[$RESULTADOS.M49] ->  | M22: of:=[$RESULTADOS.N49] ->  | N22: of:=[$RESULTADOS.O49] ->  | O22: of:=[$RESULTADOS.P49] ->  | P22: of:=[$RESULTADOS.Q49] ->  | Q22: of:=[$RESULTADOS.R49] ->  | R22: of:=[$RESULTADOS.S49] ->  | S22: of:=[$RESULTADOS.T49] ->  | T22: of:=[$RESULTADOS.U49] ->  | U22: of:=[$RESULTADOS.V49] ->  | V22: of:=[$RESULTADOS.W49] ->  | W22: of:=[$RESULTADOS.X49] ->  | X22: of:=[$RESULTADOS.Y49] ->  | Y22: of:=[$RESULTADOS.Z49] ->  | Z22: of:=[$RESULTADOS.AA49] ->  | AA22: of:=[$RESULTADOS.AB49] ->  | AB22: of:=[$RESULTADOS.AC49] ->  | AC22: of:=[$RESULTADOS.AD49] ->  | AD22: of:=[$RESULTADOS.AE49] ->  | AE22: of:=[$RESULTADOS.AF49] ->  | AF22: of:=[$RESULTADOS.AG49] ->  | AG22: of:=[$RESULTADOS.AH49] -> 0 | AI22: of:=[$RESULTADOS.B85] ->  | AJ22: of:=[$RESULTADOS.C85] ->  | AK22: of:=[$RESULTADOS.D85] ->  | AL22: of:=[$RESULTADOS.E85] ->  | AM22: of:=[$RESULTADOS.F85] ->  | AN22: of:=[$RESULTADOS.G85] ->  | AO22: of:=[$RESULTADOS.H85] ->  | AP22: of:=[$RESULTADOS.I85] ->  | AQ22: of:=[$RESULTADOS.J85] ->  | AR22: of:=[$RESULTADOS.K85] ->  | AS22: of:=[$RESULTADOS.L85] ->  | AT22: of:=[$RESULTADOS.M85] ->  | AU22: of:=[$RESULTADOS.N85] ->  | AV22: of:=[$RESULTADOS.O85] ->  | AW22: of:=[$RESULTADOS.P85] ->  | AX22: of:=[$RESULTADOS.Q85] ->  | AY22: of:=[$RESULTADOS.R85] ->  | AZ22: of:=[$RESULTADOS.S85] ->  | BA22: of:=[$RESULTADOS.T85] ->  | BB22: of:=[$RESULTADOS.U85] ->  | BC22: of:=[$RESULTADOS.V85] ->  | BD22: of:=[$RESULTADOS.W85] ->  | BE22: of:=[$RESULTADOS.X85] -> 0
A23: of:=[$RESULTADOS.B50] -> 0 | B23: of:=[$RESULTADOS.C50] -> SITIO WEB | C23: of:=[$RESULTADOS.D50] -> N/A | D23: of:=[$RESULTADOS.E50] -> N/A | E23: of:=[$RESULTADOS.F50] -> N/A | F23: of:=[$RESULTADOS.G50] -> N/A | G23: of:=[$RESULTADOS.H50] -> N/A | H23: of:=[$RESULTADOS.I50] -> N/A | I23: of:=[$RESULTADOS.J50] -> N/A | J23: of:=[$RESULTADOS.K50] -> N/A | K23: of:=[$RESULTADOS.L50] -> N/A | L23: of:=[$RESULTADOS.M50] -> N/A | M23: of:=[$RESULTADOS.N50] -> N/A | N23: of:=[$RESULTADOS.O50] -> N/A | O23: of:=[$RESULTADOS.P50] -> N/A | P23: of:=[$RESULTADOS.Q50] -> N/A | Q23: of:=[$RESULTADOS.R50] -> N/A | R23: of:=[$RESULTADOS.S50] -> N/A | S23: of:=[$RESULTADOS.T50] -> N/A | T23: of:=[$RESULTADOS.U50] -> N/A | U23: of:=[$RESULTADOS.V50] -> N/A | V23: of:=[$RESULTADOS.W50] -> N/A | W23: of:=[$RESULTADOS.X50] -> N/A | X23: of:=[$RESULTADOS.Y50] -> N/A | Y23: of:=[$RESULTADOS.Z50] -> N/A | Z23: of:=[$RESULTADOS.AA50] -> N/A | AA23: of:=[$RESULTADOS.AB50] -> N/A | AB23: of:=[$RESULTADOS.AC50] -> N/A | AC23: of:=[$RESULTADOS.AD50] -> N/A | AD23: of:=[$RESULTADOS.AE50] -> N/A | AE23: of:=[$RESULTADOS.AF50] -> N/A | AF23: of:=[$RESULTADOS.AG50] -> N/A | AG23: of:=[$RESULTADOS.D11] -> 0 | AI23: of:=[$RESULTADOS.B86] -> 0 | AJ23: of:=[$RESULTADOS.C86] -> SITIO WEB | AK23: of:=[$RESULTADOS.D86] -> N/A | AL23: of:=[$RESULTADOS.E86] -> N/A | AM23: of:=[$RESULTADOS.F86] -> N/A | AN23: of:=[$RESULTADOS.G86] -> N/A | AO23: of:=[$RESULTADOS.H86] -> N/A | AP23: of:=[$RESULTADOS.I86] -> N/A | AQ23: of:=[$RESULTADOS.J86] -> N/A | AR23: of:=[$RESULTADOS.K86] -> N/A | AS23: of:=[$RESULTADOS.L86] -> N/A | AT23: of:=[$RESULTADOS.M86] -> N/A | AU23: of:=[$RESULTADOS.N86] -> N/A | AV23: of:=[$RESULTADOS.O86] -> N/A | AW23: of:=[$RESULTADOS.P86] -> N/A | AX23: of:=[$RESULTADOS.Q86] -> N/A | AY23: of:=[$RESULTADOS.R86] -> N/A | AZ23: of:=[$RESULTADOS.S86] -> N/A | BA23: of:=[$RESULTADOS.T86] -> N/A | BB23: of:=[$RESULTADOS.U86] -> N/A | BC23: of:=[$RESULTADOS.V86] -> N/A | BD23: of:=[$RESULTADOS.W86] -> N/A | BE23: of:=[$RESULTADOS.K13] -> 0
A24: of:=[$RESULTADOS.B51] -> 0 | B24: of:=[$RESULTADOS.C51] -> 0 | C24: of:=[$RESULTADOS.D51] -> 0 | D24: of:=[$RESULTADOS.E51] -> 0 | E24: of:=[$RESULTADOS.F51] -> 0 | F24: of:=[$RESULTADOS.G51] -> 0 | G24: of:=[$RESULTADOS.H51] -> 0 | H24: of:=[$RESULTADOS.I51] -> 0 | I24: of:=[$RESULTADOS.J51] -> 0 | J24: of:=[$RESULTADOS.K51] -> 0 | K24: of:=[$RESULTADOS.L51] -> 0 | L24: of:=[$RESULTADOS.M51] -> 0 | M24: of:=[$RESULTADOS.N51] -> 0 | N24: of:=[$RESULTADOS.O51] -> 0 | O24: of:=[$RESULTADOS.P51] -> 0 | P24: of:=[$RESULTADOS.Q51] -> 0 | Q24: of:=[$RESULTADOS.R51] -> 0 | R24: of:=[$RESULTADOS.S51] -> 0 | S24: of:=[$RESULTADOS.T51] -> 0 | T24: of:=[$RESULTADOS.U51] -> 0 | U24: of:=[$RESULTADOS.V51] -> 0 | V24: of:=[$RESULTADOS.W51] -> 0 | W24: of:=[$RESULTADOS.X51] -> 0 | X24: of:=[$RESULTADOS.Y51] -> 0 | Y24: of:=[$RESULTADOS.Z51] -> 0 | Z24: of:=[$RESULTADOS.AA51] -> 0 | AA24: of:=[$RESULTADOS.AB51] -> 0 | AB24: of:=[$RESULTADOS.AC51] -> 0 | AC24: of:=[$RESULTADOS.AD51] -> 0 | AD24: of:=[$RESULTADOS.AE51] -> 0 | AE24: of:=[$RESULTADOS.AF51] -> 0 | AF24: of:=[$RESULTADOS.AG51] -> 0 | AG24: of:=[$RESULTADOS.AH51] -> 0 | AI24: of:=[$RESULTADOS.B87] -> 0 | AJ24: of:=[$RESULTADOS.C87] -> 0 | AK24: of:=[$RESULTADOS.D87] -> 0 | AL24: of:=[$RESULTADOS.E87] -> 0 | AM24: of:=[$RESULTADOS.F87] -> 0 | AN24: of:=[$RESULTADOS.G87] -> 0 | AO24: of:=[$RESULTADOS.H87] -> 0 | AP24: of:=[$RESULTADOS.I87] -> 0 | AQ24: of:=[$RESULTADOS.J87] -> 0 | AR24: of:=[$RESULTADOS.K87] -> 0 | AS24: of:=[$RESULTADOS.L87] -> 0 | AT24: of:=[$RESULTADOS.M87] -> 0 | AU24: of:=[$RESULTADOS.N87] -> 0 | AV24: of:=[$RESULTADOS.O87] -> 0 | AW24: of:=[$RESULTADOS.P87] -> 0 | AX24: of:=[$RESULTADOS.Q87] -> 0 | AY24: of:=[$RESULTADOS.R87] -> 0 | AZ24: of:=[$RESULTADOS.S87] -> 0 | BA24: of:=[$RESULTADOS.T87] -> 0 | BB24: of:=[$RESULTADOS.U87] -> 0 | BC24: of:=[$RESULTADOS.V87] -> 0 | BD24: of:=[$RESULTADOS.W87] -> 0 | BE24: of:=[$RESULTADOS.X87] -> 0
A25: of:=#REF! ->  | B25: of:=#REF! ->  | C25: of:=#REF! ->  | D25: of:=#REF! ->  | E25: of:=#REF! ->  | F25: of:=#REF! ->  | G25: of:=#REF! ->  | H25: of:=#REF! ->  | I25: of:=#REF! ->  | J25: of:=#REF! ->  | K25: of:=#REF! ->  | L25: of:=#REF! ->  | M25: of:=#REF! ->  | N25: of:=#REF! ->  | O25: of:=#REF! ->  | P25: of:=#REF! ->  | Q25: of:=#REF! ->  | R25: of:=#REF! ->  | S25: of:=#REF! ->  | T25: of:=#REF! ->  | U25: of:=#REF! ->  | V25: of:=#REF! ->  | W25: of:=#REF! ->  | X25: of:=#REF! ->  | Y25: of:=#REF! ->  | Z25: of:=#REF! ->  | AA25: of:=#REF! ->  | AB25: of:=#REF! ->  | AC25: of:=#REF! ->  | AD25: of:=#REF! ->  | AE25: of:=#REF! ->  | AF25: of:=#REF! ->  | AG25: of:=#REF! ->  | AI25: of:=[$RESULTADOS.B88] -> 0 | AJ25: of:=[$RESULTADOS.C88] -> 0 | AK25: of:=[$RESULTADOS.D88] -> 0 | AL25: of:=[$RESULTADOS.E88] -> 0 | AM25: of:=[$RESULTADOS.F88] -> 0 | AN25: of:=[$RESULTADOS.G88] -> 0 | AO25: of:=[$RESULTADOS.H88] -> 0 | AP25: of:=[$RESULTADOS.I88] -> 0 | AQ25: of:=[$RESULTADOS.J88] -> 0 | AR25: of:=[$RESULTADOS.K88] -> 0 | AS25: of:=[$RESULTADOS.L88] -> 0 | AT25: of:=[$RESULTADOS.M88] -> 0 | AU25: of:=[$RESULTADOS.N88] -> 0 | AV25: of:=[$RESULTADOS.O88] -> 0 | AW25: of:=[$RESULTADOS.P88] -> 0 | AX25: of:=[$RESULTADOS.Q88] -> 0 | AY25: of:=[$RESULTADOS.R88] -> 0 | AZ25: of:=[$RESULTADOS.S88] -> 0 | BA25: of:=[$RESULTADOS.T88] -> 0 | BB25: of:=[$RESULTADOS.U88] -> 0 | BC25: of:=[$RESULTADOS.V88] -> 0 | BD25: of:=[$RESULTADOS.W88] -> 0 | BE25: of:=[$RESULTADOS.X88] -> 0
A26: of:=[$RESULTADOS.B52] -> 0 | B26: of:=[$RESULTADOS.C52] -> 0 | C26: of:=[$RESULTADOS.D52] -> 0 | D26: of:=[$RESULTADOS.E52] -> 0 | E26: of:=[$RESULTADOS.F52] -> 0 | F26: of:=[$RESULTADOS.G52] -> 0 | G26: of:=[$RESULTADOS.H52] -> 0 | H26: of:=[$RESULTADOS.I52] -> 0 | I26: of:=[$RESULTADOS.J52] -> 0 | J26: of:=[$RESULTADOS.K52] -> 0 | K26: of:=[$RESULTADOS.L52] -> 0 | L26: of:=[$RESULTADOS.M52] -> 0 | M26: of:=[$RESULTADOS.N52] -> false | N26: of:=[$RESULTADOS.O52] -> 0 | O26: of:=[$RESULTADOS.P52] -> 0 | P26: of:=[$RESULTADOS.Q52] -> 0 | Q26: of:=[$RESULTADOS.R52] -> 0 | R26: of:=[$RESULTADOS.S52] -> 0 | S26: of:=[$RESULTADOS.T52] -> 0 | T26: of:=[$RESULTADOS.U52] -> 0 | U26: of:=[$RESULTADOS.V52] -> 0 | V26: of:=[$RESULTADOS.W52] -> 0 | W26: of:=[$RESULTADOS.X52] -> 0 | X26: of:=[$RESULTADOS.Y52] -> 0 | Y26: of:=[$RESULTADOS.Z52] -> 0 | Z26: of:=[$RESULTADOS.AA52] -> 0 | AA26: of:=[$RESULTADOS.AB52] -> 0 | AB26: of:=[$RESULTADOS.AC52] -> 0 | AC26: of:=[$RESULTADOS.AD52] -> 0 | AD26: of:=[$RESULTADOS.AE52] -> 0 | AE26: of:=[$RESULTADOS.AF52] -> 0 | AF26: of:=[$RESULTADOS.AG52] -> 0 | AG26: of:=[$RESULTADOS.AH52] -> 0 | AI26: of:=[$RESULTADOS.B89] -> 0 | AJ26: of:=[$RESULTADOS.C89] -> 0 | AK26: of:=[$RESULTADOS.D89] -> 0 | AL26: of:=[$RESULTADOS.E89] -> 0 | AM26: of:=[$RESULTADOS.F89] -> 0 | AN26: of:=[$RESULTADOS.G89] -> 0 | AO26: of:=[$RESULTADOS.H89] -> 0 | AP26: of:=[$RESULTADOS.I89] -> 0 | AQ26: of:=[$RESULTADOS.J89] -> 0 | AR26: of:=[$RESULTADOS.K89] -> 0 | AS26: of:=[$RESULTADOS.L89] -> 0 | AT26: of:=[$RESULTADOS.M89] -> 0 | AU26: of:=[$RESULTADOS.N89] -> 0 | AV26: of:=[$RESULTADOS.O89] -> 0 | AW26: of:=[$RESULTADOS.P89] -> 0 | AX26: of:=[$RESULTADOS.Q89] -> 0 | AY26: of:=[$RESULTADOS.R89] -> 0 | AZ26: of:=[$RESULTADOS.S89] -> 0 | BA26: of:=[$RESULTADOS.T89] -> 0 | BB26: of:=[$RESULTADOS.U89] -> 0 | BC26: of:=[$RESULTADOS.V89] -> 0 | BD26: of:=[$RESULTADOS.W89] -> 0 | BE26: of:=[$RESULTADOS.X89] -> 0
A27: of:=[$RESULTADOS.B53] -> 0 | B27: of:=[$RESULTADOS.C53] -> 0 | C27: of:=[$RESULTADOS.D53] -> 0 | D27: of:=[$RESULTADOS.E53] -> 0 | E27: of:=[$RESULTADOS.F53] -> 0 | F27: of:=[$RESULTADOS.G53] -> 0 | G27: of:=[$RESULTADOS.H53] -> 0 | H27: of:=[$RESULTADOS.I53] -> 0 | I27: of:=[$RESULTADOS.J53] -> 0 | J27: of:=[$RESULTADOS.K53] -> 0 | K27: of:=[$RESULTADOS.L53] -> 0 | L27: of:=[$RESULTADOS.M53] -> 0 | M27: of:=[$RESULTADOS.N53] -> 0 | N27: of:=[$RESULTADOS.O53] -> 0 | O27: of:=[$RESULTADOS.P53] -> 0 | P27: of:=[$RESULTADOS.Q53] -> 0 | Q27: of:=[$RESULTADOS.R53] -> 0 | R27: of:=[$RESULTADOS.S53] -> 0 | S27: of:=[$RESULTADOS.T53] -> 0 | T27: of:=[$RESULTADOS.U53] -> 0 | U27: of:=[$RESULTADOS.V53] -> 0 | V27: of:=[$RESULTADOS.W53] -> 0 | W27: of:=[$RESULTADOS.X53] -> 0 | X27: of:=[$RESULTADOS.Y53] -> 0 | Y27: of:=[$RESULTADOS.Z53] -> 0 | Z27: of:=[$RESULTADOS.AA53] -> 0 | AA27: of:=[$RESULTADOS.AB53] -> 0 | AB27: of:=[$RESULTADOS.AC53] -> 0 | AC27: of:=[$RESULTADOS.AD53] -> 0 | AD27: of:=[$RESULTADOS.AE53] -> 0 | AE27: of:=[$RESULTADOS.AF53] -> 0 | AF27: of:=[$RESULTADOS.AG53] -> 0 | AG27: of:=[$RESULTADOS.AH53] -> 0 | AH27: of:=[$RESULTADOS.A90] -> 0 | AI27: of:=[$RESULTADOS.B90] -> 0 | AJ27: of:=[$RESULTADOS.C90] -> 0 | AK27: of:=[$RESULTADOS.D90] -> 0 | AL27: of:=[$RESULTADOS.E90] -> 0 | AM27: of:=[$RESULTADOS.F90] -> 0 | AN27: of:=[$RESULTADOS.G90] -> 0 | AO27: of:=[$RESULTADOS.H90] -> 0 | AP27: of:=[$RESULTADOS.I90] -> 0 | AQ27: of:=[$RESULTADOS.J90] -> 0 | AR27: of:=[$RESULTADOS.K90] -> 0 | AS27: of:=[$RESULTADOS.L90] -> 0 | AT27: of:=[$RESULTADOS.M90] -> 0 | AU27: of:=[$RESULTADOS.N90] -> 0 | AV27: of:=[$RESULTADOS.O90] -> 0 | AW27: of:=[$RESULTADOS.P90] -> 0 | AX27: of:=[$RESULTADOS.Q90] -> 0 | AY27: of:=[$RESULTADOS.R90] -> 0 | AZ27: of:=[$RESULTADOS.S90] -> 0 | BA27: of:=[$RESULTADOS.T90] -> 0 | BB27: of:=[$RESULTADOS.U90] -> 0 | BC27: of:=[$RESULTADOS.V90] -> 0 | BD27: of:=[$RESULTADOS.W90] -> 0 | BE27: of:=[$RESULTADOS.X90] -> 0
A29: of:=[$'01.DefiniciÃ³n de Ã¡mbito'.C7] -> 0 | B29: of:=[$'01.DefiniciÃ³n de Ã¡mbito'.C11] -> 0 | C29: of:=[$'01.DefiniciÃ³n de Ã¡mbito'.C9] -> 0 | D29: of:=[$'01.DefiniciÃ³n de Ã¡mbito'.C25] -> 0 | E29: of:=[$'01.DefiniciÃ³n de Ã¡mbito'.C29] -> 0 | F29: of:=#REF! ->  | G29: of:=[$'01.DefiniciÃ³n de Ã¡mbito'.C31] -> 0 | H29: of:=[$'01.DefiniciÃ³n de Ã¡mbito'.C39] -> UNE-EN 301549 : 2019 - AA WCAG 2.1  | I29: of:=[$'01.DefiniciÃ³n de Ã¡mbito'.C41] -> 0 | J29: of:=[$'01.DefiniciÃ³n de Ã¡mbito'.C42] -> 0 | K29: of:=[$'01.DefiniciÃ³n de Ã¡mbito'.C38] -> 0 | L29: of:=[$'01.DefiniciÃ³n de Ã¡mbito'.C55] -> Vivienda | M29: of:=[$'01.DefiniciÃ³n de Ã¡mbito'.C61] -> 0
A31: of:=[$'03.Muestra'.C8] -> 0 | B31: of:=[$'03.Muestra'.D8] -> 0 | C31: of:=[$'03.Muestra'.E8] -> 0
A32: of:=[$'03.Muestra'.C9] -> 0 | B32: of:=[$'03.Muestra'.D9] -> 0 | C32: of:=[$'03.Muestra'.E9] -> 0
A33: of:=[$'03.Muestra'.C10] -> 0 | B33: of:=[$'03.Muestra'.D10] -> 0 | C33: of:=[$'03.Muestra'.E10] -> 0
A34: of:=[$'03.Muestra'.C11] -> 0 | B34: of:=[$'03.Muestra'.D11] -> 0 | C34: of:=[$'03.Muestra'.E11] -> 0
A35: of:=[$'03.Muestra'.C12] -> 0 | B35: of:=[$'03.Muestra'.D12] -> 0 | C35: of:=[$'03.Muestra'.E12] -> 0
A36: of:=[$'03.Muestra'.C13] -> 0 | B36: of:=[$'03.Muestra'.D13] -> 0 | C36: of:=[$'03.Muestra'.E13] -> 0
A37: of:=[$'03.Muestra'.C14] -> 0 | B37: of:=[$'03.Muestra'.D14] -> 0 | C37: of:=[$'03.Muestra'.E14] -> 0
A38: of:=[$'03.Muestra'.C15] -> 0 | B38: of:=[$'03.Muestra'.D15] -> 0 | C38: of:=[$'03.Muestra'.E15] -> 0
A39: of:=[$'03.Muestra'.C16] -> 0 | B39: of:=[$'03.Muestra'.D16] -> 0 | C39: of:=[$'03.Muestra'.E16] -> 0
A40: of:=[$'03.Muestra'.C17] -> 0 | B40: of:=[$'03.Muestra'.D17] -> 0 | C40: of:=[$'03.Muestra'.E17] -> 0
A41: of:=[$'03.Muestra'.C18] -> 0 | B41: of:=[$'03.Muestra'.D18] -> 0 | C41: of:=[$'03.Muestra'.E18] -> 0
A42: of:=[$'03.Muestra'.C19] -> 0 | B42: of:=[$'03.Muestra'.D19] -> 0 | C42: of:=[$'03.Muestra'.E19] -> 0
A43: of:=[$'03.Muestra'.C31] -> 0 | B43: of:=[$'03.Muestra'.D31] -> 0 | C43: of:=[$'03.Muestra'.E31] -> 0
A44: of:=[$'03.Muestra'.C32] -> 0 | B44: of:=[$'03.Muestra'.D32] -> 0 | C44: of:=[$'03.Muestra'.E32] -> 0
A45: of:=[$'03.Muestra'.C33] -> 0 | B45: of:=[$'03.Muestra'.D33] -> 0 | C45: of:=[$'03.Muestra'.E33] -> 0
A46: of:=[$'03.Muestra'.C34] -> 0 | B46: of:=[$'03.Muestra'.D34] -> 0 | C46: of:=[$'03.Muestra'.E34] -> 0
A47: of:=[$'03.Muestra'.C35] -> 0 | B47: of:=[$'03.Muestra'.D35] -> 0 | C47: of:=[$'03.Muestra'.E35] -> 0
A48: of:=[$'03.Muestra'.C36] -> 0 | B48: of:=[$'03.Muestra'.D36] -> 0 | C48: of:=[$'03.Muestra'.E36] -> 0
A49: of:=#REF! ->  | B49: of:=#REF! ->  | C49: of:=#REF! -> 
A50: of:=[$'03.Muestra'.C37] -> 0 | B50: of:=[$'03.Muestra'.D37] -> 0 | C50: of:=[$'03.Muestra'.E37] -> 0